"No.","Time","Source","Destination","Protocol","Length","Info"
"1","0.000000","192.168.0.63","162.159.136.232","UDP","1285","62920  >  443 Len=1243"
"2","0.000067","192.168.0.63","162.159.136.232","UDP","187","62920  >  443 Len=145"
"3","0.014566","162.159.136.232","192.168.0.63","UDP","67","443  >  62920 Len=25"
"4","0.074049","162.159.136.232","192.168.0.63","UDP","643","443  >  62920 Len=601"
"5","0.074290","162.159.136.232","192.168.0.63","UDP","74","443  >  62920 Len=32"
"6","0.077485","192.168.0.63","162.159.136.232","UDP","87","62920  >  443 Len=45"
"7","2.125151","192.168.0.63","162.159.137.232","TLSv1.2","459","Application Data"
"8","2.125249","192.168.0.63","162.159.137.232","TLSv1.2","105","Application Data"
"9","2.142912","162.159.137.232","192.168.0.63","TCP","66","443  >  51396 [ACK] Seq=1 Ack=433 Win=8 Len=0 TSval=2678064904 TSecr=4004370166"
"10","2.142912","162.159.137.232","192.168.0.63","TLSv1.2","105","Application Data"
"11","2.143016","192.168.0.63","162.159.137.232","TCP","66","51396  >  443 [ACK] Seq=433 Ack=40 Win=32474 Len=0 TSval=4004370184 TSecr=2678064904"
"12","2.471200","162.159.137.232","192.168.0.63","TLSv1.2","617","Application Data"
"13","2.471349","192.168.0.63","162.159.137.232","TCP","66","51396  >  443 [ACK] Seq=433 Ack=591 Win=32466 Len=0 TSval=4004370512 TSecr=2678065232"
"14","2.471372","162.159.137.232","192.168.0.63","TCP","1514","443  >  51396 [ACK] Seq=591 Ack=433 Win=8 Len=1448 TSval=2678065232 TSecr=4004370184 [TCP segment of a reassembled PDU]"
"15","2.471373","162.159.137.232","192.168.0.63","TCP","1514","443  >  51396 [ACK] Seq=2039 Ack=433 Win=8 Len=1448 TSval=2678065232 TSecr=4004370184 [TCP segment of a reassembled PDU]"
"16","2.471374","162.159.137.232","192.168.0.63","TLSv1.2","258","Application Data"
"17","2.471456","192.168.0.63","162.159.137.232","TCP","66","51396  >  443 [ACK] Seq=433 Ack=3679 Win=32427 Len=0 TSval=4004370512 TSecr=2678065232"
"18","2.471996","192.168.0.63","162.159.137.232","TCP","66","[TCP Window Update] 51396  >  443 [ACK] Seq=433 Ack=3679 Win=32475 Len=0 TSval=4004370512 TSecr=2678065232"
"19","2.472025","162.159.137.232","192.168.0.63","TCP","1514","443  >  51396 [ACK] Seq=3679 Ack=433 Win=8 Len=1448 TSval=2678065233 TSecr=4004370184 [TCP segment of a reassembled PDU]"
"20","2.472026","162.159.137.232","192.168.0.63","TCP","1514","443  >  51396 [ACK] Seq=5127 Ack=433 Win=8 Len=1448 TSval=2678065233 TSecr=4004370184 [TCP segment of a reassembled PDU]"
"21","2.472027","162.159.137.232","192.168.0.63","TLSv1.2","1219","Application Data"
"22","2.472029","162.159.137.232","192.168.0.63","TLSv1.2","98","Application Data"
"23","2.472029","162.159.137.232","192.168.0.63","TLSv1.2","97","Application Data"
"24","2.472115","192.168.0.63","162.159.137.232","TCP","66","51396  >  443 [ACK] Seq=433 Ack=7791 Win=32411 Len=0 TSval=4004370512 TSecr=2678065233"
"25","2.473291","192.168.0.63","162.159.137.232","TCP","66","[TCP Window Update] 51396  >  443 [ACK] Seq=433 Ack=7791 Win=32475 Len=0 TSval=4004370514 TSecr=2678065233"
"26","2.473436","192.168.0.63","162.159.137.232","TLSv1.2","101","Application Data"
"27","2.530822","162.159.137.232","192.168.0.63","TCP","66","443  >  51396 [ACK] Seq=7791 Ack=468 Win=8 Len=0 TSval=2678065293 TSecr=4004370514"
"28","2.621511","192.168.0.63","162.159.138.232","UDP","509","51109  >  443 Len=467"
"29","2.631148","162.159.138.232","192.168.0.63","UDP","65","443  >  51109 Len=23"
"30","2.647539","162.159.138.232","192.168.0.63","UDP","992","443  >  51109 Len=950"
"31","2.674368","192.168.0.63","162.159.138.232","UDP","86","51109  >  443 Len=44"
"32","2.727545","192.168.0.63","162.159.137.232","TLSv1.2","325","Application Data"
"33","2.727808","192.168.0.63","162.159.137.232","TLSv1.2","540","Application Data"
"34","2.738461","162.159.137.232","192.168.0.63","TCP","66","443  >  51396 [ACK] Seq=7791 Ack=727 Win=8 Len=0 TSval=2678065500 TSecr=4004370768"
"35","2.742769","162.159.137.232","192.168.0.63","TCP","66","443  >  51396 [ACK] Seq=7791 Ack=1201 Win=8 Len=0 TSval=2678065504 TSecr=4004370768"
"36","2.753369","192.168.0.63","162.159.137.232","TLSv1.2","182","Application Data"
"37","2.763888","162.159.137.232","192.168.0.63","TCP","66","443  >  51396 [ACK] Seq=7791 Ack=1317 Win=8 Len=0 TSval=2678065525 TSecr=4004370794"
"38","2.776628","162.159.137.232","192.168.0.63","TLSv1.2","559","Application Data"
"39","2.776696","192.168.0.63","162.159.137.232","TCP","66","51396  >  443 [ACK] Seq=1317 Ack=8284 Win=32467 Len=0 TSval=4004370817 TSecr=2678065537"
"40","2.779034","162.159.137.232","192.168.0.63","TLSv1.2","99","Application Data"
"41","2.779035","162.159.137.232","192.168.0.63","TLSv1.2","98","Application Data"
"42","2.779035","162.159.137.232","192.168.0.63","TLSv1.2","97","Application Data"
"43","2.779035","162.159.137.232","192.168.0.63","TLSv1.2","534","Application Data"
"44","2.779089","192.168.0.63","162.159.137.232","TCP","66","51396  >  443 [ACK] Seq=1317 Ack=8848 Win=32466 Len=0 TSval=4004370820 TSecr=2678065538"
"45","2.780089","192.168.0.63","162.159.137.232","TLSv1.2","101","Application Data"
"46","2.826940","162.159.137.232","192.168.0.63","TCP","66","443  >  51396 [ACK] Seq=8848 Ack=1352 Win=8 Len=0 TSval=2678065589 TSecr=4004370820"
"47","7.069478","192.168.0.63","162.159.137.232","TLSv1.2","588","Application Data"
"48","7.080383","162.159.137.232","192.168.0.63","TCP","66","443  >  51396 [ACK] Seq=8848 Ack=1874 Win=8 Len=0 TSval=2678069842 TSecr=4004375110"
"49","7.124998","162.159.137.232","192.168.0.63","TLSv1.2","674","Application Data"
"50","7.125175","192.168.0.63","162.159.137.232","TCP","66","51396  >  443 [ACK] Seq=1874 Ack=9456 Win=32466 Len=0 TSval=4004375166 TSecr=2678069884"
"51","7.126660","162.159.137.232","192.168.0.63","TCP","1514","443  >  51396 [ACK] Seq=9456 Ack=1874 Win=8 Len=1448 TSval=2678069884 TSecr=4004375110 [TCP segment of a reassembled PDU]"
"52","7.126661","162.159.137.232","192.168.0.63","TCP","1514","443  >  51396 [ACK] Seq=10904 Ack=1874 Win=8 Len=1448 TSval=2678069884 TSecr=4004375110 [TCP segment of a reassembled PDU]"
"53","7.126663","162.159.137.232","192.168.0.63","TLSv1.2","163","Application Data"
"54","7.126664","162.159.137.232","192.168.0.63","TCP","1514","443  >  51396 [ACK] Seq=12449 Ack=1874 Win=8 Len=1448 TSval=2678069884 TSecr=4004375110 [TCP segment of a reassembled PDU]"
"55","7.126665","162.159.137.232","192.168.0.63","TCP","1514","443  >  51396 [ACK] Seq=13897 Ack=1874 Win=8 Len=1448 TSval=2678069884 TSecr=4004375110 [TCP segment of a reassembled PDU]"
"56","7.126666","162.159.137.232","192.168.0.63","TLSv1.2","800","Application Data"
"57","7.126667","162.159.137.232","192.168.0.63","TLSv1.2","98","Application Data"
"58","7.126668","162.159.137.232","192.168.0.63","TLSv1.2","97","Application Data"
"59","7.126776","192.168.0.63","162.159.137.232","TCP","66","51396  >  443 [ACK] Seq=1874 Ack=16142 Win=32371 Len=0 TSval=4004375167 TSecr=2678069884"
"60","7.127228","192.168.0.63","162.159.137.232","TCP","66","[TCP Window Update] 51396  >  443 [ACK] Seq=1874 Ack=16142 Win=32475 Len=0 TSval=4004375167 TSecr=2678069884"
"61","7.235014","192.168.0.63","162.159.138.232","UDP","509","51109  >  443 Len=467"
"62","7.246667","162.159.138.232","192.168.0.63","UDP","65","443  >  51109 Len=23"
"63","7.257073","162.159.138.232","192.168.0.63","UDP","991","443  >  51109 Len=949"
"64","7.262266","192.168.0.63","162.159.137.232","TLSv1.2","731","Application Data"
"65","7.262356","192.168.0.63","162.159.137.232","TLSv1.2","473","Application Data"
"66","7.271542","162.159.137.232","192.168.0.63","TCP","66","443  >  51396 [ACK] Seq=16142 Ack=2539 Win=8 Len=0 TSval=2678070033 TSecr=4004375303"
"67","7.271542","162.159.137.232","192.168.0.63","TCP","66","443  >  51396 [ACK] Seq=16142 Ack=2946 Win=8 Len=0 TSval=2678070033 TSecr=4004375303"
"68","7.282668","192.168.0.63","162.159.138.232","UDP","86","51109  >  443 Len=44"
"69","7.299010","192.168.0.63","162.159.137.232","TLSv1.2","565","Application Data"
"70","7.307559","162.159.137.232","192.168.0.63","TLSv1.2","373","Application Data"
"71","7.307560","162.159.137.232","192.168.0.63","TLSv1.2","100","Application Data"
"72","7.307560","162.159.137.232","192.168.0.63","TLSv1.2","97","Application Data"
"73","7.307641","192.168.0.63","162.159.137.232","TCP","66","51396  >  443 [ACK] Seq=3445 Ack=16514 Win=32469 Len=0 TSval=4004375348 TSecr=2678070068"
"74","7.326683","162.159.137.232","192.168.0.63","TLSv1.2","409","Application Data"
"75","7.326712","192.168.0.63","162.159.137.232","TCP","66","51396  >  443 [ACK] Seq=3445 Ack=16857 Win=32470 Len=0 TSval=4004375367 TSecr=2678070088"
"76","7.327621","192.168.0.63","162.159.137.232","TLSv1.2","101","Application Data"
"77","7.384952","162.159.137.232","192.168.0.63","TCP","66","443  >  51396 [ACK] Seq=16857 Ack=3480 Win=8 Len=0 TSval=2678070145 TSecr=4004375367"
"78","8.480216","192.168.0.63","162.159.136.232","QUIC","1292","Initial, DCID=7ce944557b23d118, PKN: 1, CRYPTO"
"79","8.480278","192.168.0.63","162.159.136.232","QUIC","1292","Initial, DCID=7ce944557b23d118, PKN: 2, PADDING, PING, PING, PING, CRYPTO, PING, PADDING, CRYPTO, PADDING, PING, PING, PADDING, PING, PADDING"
"80","8.495751","162.159.136.232","192.168.0.63","QUIC","1242","Initial, SCID=01b6f218a2b036cdbeb65118b3b013228a76f76d, PKN: 0, ACK"
"81","8.500095","162.159.136.232","192.168.0.63","QUIC","1242","Initial, SCID=01b6f218a2b036cdbeb65118b3b013228a76f76d, PKN: 1, ACK"
"82","8.500345","162.159.136.232","192.168.0.63","QUIC","1242","Initial, SCID=01b6f218a2b036cdbeb65118b3b013228a76f76d, PKN: 2, CRYPTO"
"83","8.500768","162.159.136.232","192.168.0.63","QUIC","1242","Initial, SCID=01b6f218a2b036cdbeb65118b3b013228a76f76d, PKN: 3, CRYPTO"
"84","8.500768","162.159.136.232","192.168.0.63","QUIC","1242","Handshake, SCID=01b6f218a2b036cdbeb65118b3b013228a76f76d"
"85","8.500867","162.159.136.232","192.168.0.63","QUIC","863","Handshake, SCID=01b6f218a2b036cdbeb65118b3b013228a76f76d"
"86","8.501133","192.168.0.63","162.159.136.232","QUIC","1292","Initial, DCID=01b6f218a2b036cdbeb65118b3b013228a76f76d, PKN: 3, ACK, PADDING"
"87","8.501379","192.168.0.63","162.159.136.232","QUIC","93","Handshake, DCID=01b6f218a2b036cdbeb65118b3b013228a76f76d"
"88","8.503929","192.168.0.63","162.159.136.232","QUIC","127","Handshake, DCID=01b6f218a2b036cdbeb65118b3b013228a76f76d"
"89","8.504326","192.168.0.63","162.159.136.232","QUIC","127","Protected Payload (KP0), DCID=01b6f218a2b036cdbeb65118b3b013228a76f76d"
"90","8.517852","162.159.136.232","192.168.0.63","QUIC","575","Protected Payload (KP0)"
"91","8.518171","162.159.136.232","192.168.0.63","QUIC","66","Protected Payload (KP0)"
"92","8.518171","162.159.136.232","192.168.0.63","QUIC","66","Protected Payload (KP0)"
"93","8.518302","192.168.0.63","162.159.136.232","QUIC","85","Protected Payload (KP0), DCID=01b6f218a2b036cdbeb65118b3b013228a76f76d"
"94","8.518375","162.159.136.232","192.168.0.63","QUIC","91","Protected Payload (KP0)"
"95","8.518467","192.168.0.63","162.159.136.232","QUIC","89","Protected Payload (KP0), DCID=01b6f218a2b036cdbeb65118b3b013228a76f76d"
"96","8.530684","162.159.136.232","192.168.0.63","QUIC","70","Protected Payload (KP0)"
"97","8.551820","192.168.0.63","162.159.136.232","QUIC","1137","Protected Payload (KP0), DCID=01b6f218a2b036cdbeb65118b3b013228a76f76d"
"98","8.565014","162.159.136.232","192.168.0.63","QUIC","66","Protected Payload (KP0)"
"99","8.571296","162.159.136.232","192.168.0.63","QUIC","782","Protected Payload (KP0)"
"100","8.581221","192.168.0.63","162.159.136.232","QUIC","96","Protected Payload (KP0), DCID=01b6f218a2b036cdbeb65118b3b013228a76f76d"
"101","8.595426","162.159.136.232","192.168.0.63","QUIC","71","Protected Payload (KP0)"
"102","8.597059","192.168.0.63","162.159.137.232","TLSv1.2","386","Application Data"
"103","8.607977","162.159.137.232","192.168.0.63","TCP","66","443  >  51396 [ACK] Seq=16857 Ack=3800 Win=8 Len=0 TSval=2678071369 TSecr=4004376638"
"104","8.625725","192.168.0.63","162.159.136.232","QUIC","86","Protected Payload (KP0), DCID=01b6f218a2b036cdbeb65118b3b013228a76f76d"
"105","8.822924","162.159.137.232","192.168.0.63","TLSv1.2","585","Application Data"
"106","8.823005","192.168.0.63","162.159.137.232","TCP","66","51396  >  443 [ACK] Seq=3800 Ack=17376 Win=32467 Len=0 TSval=4004376864 TSecr=2678071584"
"107","8.823977","162.159.137.232","192.168.0.63","TCP","1514","443  >  51396 [ACK] Seq=17376 Ack=3800 Win=8 Len=1448 TSval=2678071584 TSecr=4004376638 [TCP segment of a reassembled PDU]"
"108","8.823977","162.159.137.232","192.168.0.63","TCP","1514","443  >  51396 [ACK] Seq=18824 Ack=3800 Win=8 Len=1448 TSval=2678071584 TSecr=4004376638 [TCP segment of a reassembled PDU]"
"109","8.823978","162.159.137.232","192.168.0.63","TLSv1.2","230","Application Data"
"110","8.823978","162.159.137.232","192.168.0.63","TCP","1514","443  >  51396 [ACK] Seq=20436 Ack=3800 Win=8 Len=1448 TSval=2678071585 TSecr=4004376638 [TCP segment of a reassembled PDU]"
"111","8.823979","162.159.137.232","192.168.0.63","TLSv1.2","1514","Application Data"
"112","8.823979","162.159.137.232","192.168.0.63","TLSv1.2","98","Application Data"
"113","8.823979","162.159.137.232","192.168.0.63","TLSv1.2","97","Application Data"
"114","8.824046","192.168.0.63","162.159.137.232","TCP","66","51396  >  443 [ACK] Seq=3800 Ack=23395 Win=32381 Len=0 TSval=4004376865 TSecr=2678071585"
"115","8.824169","192.168.0.63","162.159.137.232","TCP","66","[TCP Window Update] 51396  >  443 [ACK] Seq=3800 Ack=23395 Win=32475 Len=0 TSval=4004376865 TSecr=2678071585"
"116","8.825070","192.168.0.63","162.159.137.232","TLSv1.2","101","Application Data"
"117","8.838471","162.159.137.232","192.168.0.63","TCP","66","443  >  51396 [ACK] Seq=23395 Ack=3835 Win=8 Len=0 TSval=2678071600 TSecr=4004376866"
"118","8.935984","192.168.0.63","162.159.138.232","UDP","509","51109  >  443 Len=467"
"119","8.946528","162.159.138.232","192.168.0.63","UDP","65","443  >  51109 Len=23"
"120","8.957437","162.159.138.232","192.168.0.63","UDP","993","443  >  51109 Len=951"
"121","8.981150","192.168.0.63","162.159.137.232","TLSv1.2","365","Application Data"
"122","8.987719","192.168.0.63","162.159.138.232","UDP","86","51109  >  443 Len=44"
"123","8.995211","162.159.137.232","192.168.0.63","TCP","66","443  >  51396 [ACK] Seq=23395 Ack=4134 Win=8 Len=0 TSval=2678071756 TSecr=4004377021"
"124","9.007308","162.159.137.232","192.168.0.63","TLSv1.2","554","Application Data"
"125","9.007376","192.168.0.63","162.159.137.232","TCP","66","51396  >  443 [ACK] Seq=4134 Ack=23883 Win=32467 Len=0 TSval=4004377048 TSecr=2678071769"
"126","9.008202","192.168.0.63","162.159.137.232","TLSv1.2","101","Application Data"
"127","9.059770","162.159.137.232","192.168.0.63","TCP","66","443  >  51396 [ACK] Seq=23883 Ack=4169 Win=8 Len=0 TSval=2678071821 TSecr=4004377048"
"128","10.265560","192.168.0.63","162.159.137.232","TLSv1.2","348","Application Data"
"129","10.283394","162.159.137.232","192.168.0.63","TCP","66","443  >  51396 [ACK] Seq=23883 Ack=4451 Win=8 Len=0 TSval=2678073045 TSecr=4004378306"
"130","11.725972","162.159.137.232","192.168.0.63","TLSv1.2","669","Application Data"
"131","11.725973","162.159.137.232","192.168.0.63","TCP","1514","443  >  51396 [ACK] Seq=24486 Ack=4451 Win=8 Len=1448 TSval=2678074381 TSecr=4004378306 [TCP segment of a reassembled PDU]"
"132","11.725974","162.159.137.232","192.168.0.63","TCP","1514","443  >  51396 [ACK] Seq=25934 Ack=4451 Win=8 Len=1448 TSval=2678074381 TSecr=4004378306 [TCP segment of a reassembled PDU]"
"133","11.725975","162.159.137.232","192.168.0.63","TLSv1.2","187","Application Data"
"134","11.725975","162.159.137.232","192.168.0.63","TCP","1514","443  >  51396 [ACK] Seq=27503 Ack=4451 Win=8 Len=1448 TSval=2678074382 TSecr=4004378306 [TCP segment of a reassembled PDU]"
"135","11.725976","162.159.137.232","192.168.0.63","TCP","1514","443  >  51396 [ACK] Seq=28951 Ack=4451 Win=8 Len=1448 TSval=2678074382 TSecr=4004378306 [TCP segment of a reassembled PDU]"
"136","11.725977","162.159.137.232","192.168.0.63","TLSv1.2","1270","Application Data"
"137","11.725977","162.159.137.232","192.168.0.63","TCP","1514","443  >  51396 [ACK] Seq=31603 Ack=4451 Win=8 Len=1448 TSval=2678074382 TSecr=4004378306 [TCP segment of a reassembled PDU]"
"138","11.725978","162.159.137.232","192.168.0.63","TLSv1.2","1179","Application Data"
"139","11.725979","162.159.137.232","192.168.0.63","TLSv1.2","98","Application Data"
"140","11.725979","162.159.137.232","192.168.0.63","TLSv1.2","97","Application Data"
"141","11.725980","162.159.137.232","192.168.0.63","TCP","97","[TCP Retransmission] 443  >  51396 [PSH, ACK] Seq=34196 Ack=4451 Win=8 Len=31 TSval=2678074414 TSecr=4004378306"
"142","11.726172","192.168.0.63","162.159.137.232","TCP","66","51396  >  443 [ACK] Seq=4451 Ack=34227 Win=32313 Len=0 TSval=4004379767 TSecr=2678074382"
"143","11.726229","192.168.0.63","162.159.137.232","TCP","78","[TCP Dup ACK 142#1] 51396  >  443 [ACK] Seq=4451 Ack=34227 Win=32313 Len=0 TSval=4004379767 TSecr=2678074414 SLE=34196 SRE=34227"
"144","11.726404","192.168.0.63","162.159.137.232","TCP","66","[TCP Window Update] 51396  >  443 [ACK] Seq=4451 Ack=34227 Win=32475 Len=0 TSval=4004379767 TSecr=2678074414"
"145","11.855651","192.168.0.63","162.159.138.232","UDP","509","51109  >  443 Len=467"
"146","11.866644","162.159.138.232","192.168.0.63","UDP","65","443  >  51109 Len=23"
"147","11.876312","162.159.138.232","192.168.0.63","UDP","992","443  >  51109 Len=950"
"148","11.906299","192.168.0.63","162.159.138.232","UDP","86","51109  >  443 Len=44"
"149","11.938136","192.168.0.63","162.159.137.232","TLSv1.2","333","Application Data"
"150","11.947876","162.159.137.232","192.168.0.63","TCP","66","443  >  51396 [ACK] Seq=34227 Ack=4718 Win=8 Len=0 TSval=2678074709 TSecr=4004379979"
"151","11.968354","162.159.137.232","192.168.0.63","TLSv1.2","362","Application Data"
"152","11.968467","192.168.0.63","162.159.137.232","TCP","66","51396  >  443 [ACK] Seq=4718 Ack=34523 Win=32470 Len=0 TSval=4004380009 TSecr=2678074730"
"153","11.969308","192.168.0.63","162.159.137.232","TLSv1.2","101","Application Data"
"154","12.024381","162.159.137.232","192.168.0.63","TCP","66","443  >  51396 [ACK] Seq=34523 Ack=4753 Win=8 Len=0 TSval=2678074786 TSecr=4004380009"
"155","13.363856","192.168.0.63","162.159.137.232","TLSv1.2","635","Application Data"
"156","13.374981","162.159.137.232","192.168.0.63","TCP","66","443  >  51396 [ACK] Seq=34523 Ack=5322 Win=8 Len=0 TSval=2678076136 TSecr=4004381404"
"157","13.664578","162.159.137.232","192.168.0.63","TLSv1.2","580","Application Data"
"158","13.664772","192.168.0.63","162.159.137.232","TCP","66","51396  >  443 [ACK] Seq=5322 Ack=35037 Win=32467 Len=0 TSval=4004381705 TSecr=2678076425"
"159","13.665001","162.159.137.232","192.168.0.63","TCP","1514","443  >  51396 [ACK] Seq=35037 Ack=5322 Win=8 Len=1448 TSval=2678076425 TSecr=4004381404 [TCP segment of a reassembled PDU]"
"160","13.665003","162.159.137.232","192.168.0.63","TCP","1514","443  >  51396 [ACK] Seq=36485 Ack=5322 Win=8 Len=1448 TSval=2678076425 TSecr=4004381404 [TCP segment of a reassembled PDU]"
"161","13.665005","162.159.137.232","192.168.0.63","TLSv1.2","178","Application Data"
"162","13.665115","192.168.0.63","162.159.137.232","TCP","66","51396  >  443 [ACK] Seq=5322 Ack=38045 Win=32428 Len=0 TSval=4004381705 TSecr=2678076425"
"163","13.665963","192.168.0.63","162.159.137.232","TCP","66","[TCP Window Update] 51396  >  443 [ACK] Seq=5322 Ack=38045 Win=32475 Len=0 TSval=4004381706 TSecr=2678076425"
"164","13.666496","162.159.137.232","192.168.0.63","TCP","1514","443  >  51396 [ACK] Seq=38045 Ack=5322 Win=8 Len=1448 TSval=2678076426 TSecr=4004381404 [TCP segment of a reassembled PDU]"
"165","13.666498","162.159.137.232","192.168.0.63","TCP","1514","443  >  51396 [ACK] Seq=39493 Ack=5322 Win=8 Len=1448 TSval=2678076426 TSecr=4004381404 [TCP segment of a reassembled PDU]"
"166","13.666499","162.159.137.232","192.168.0.63","TLSv1.2","1398","Application Data"
"167","13.666500","162.159.137.232","192.168.0.63","TLSv1.2","500","Application Data"
"168","13.666501","162.159.137.232","192.168.0.63","TLSv1.2","129","Application Data, Application Data"
"169","13.666602","192.168.0.63","162.159.137.232","TCP","66","51396  >  443 [ACK] Seq=5322 Ack=42770 Win=32401 Len=0 TSval=4004381706 TSecr=2678076426"
"170","13.667804","192.168.0.63","162.159.137.232","TCP","66","[TCP Window Update] 51396  >  443 [ACK] Seq=5322 Ack=42770 Win=32475 Len=0 TSval=4004381708 TSecr=2678076426"
"171","13.788625","192.168.0.63","162.159.138.232","UDP","509","51109  >  443 Len=467"
"172","13.799561","162.159.138.232","192.168.0.63","UDP","65","443  >  51109 Len=23"
"173","13.808232","162.159.138.232","192.168.0.63","UDP","992","443  >  51109 Len=950"
"174","13.813142","192.168.0.63","162.159.137.232","TLSv1.2","1212","Application Data"
"175","13.813572","192.168.0.63","162.159.137.232","TLSv1.2","280","Application Data"
"176","13.813654","192.168.0.63","162.159.137.232","TLSv1.2","582","Application Data"
"177","13.829241","162.159.137.232","192.168.0.63","TCP","66","443  >  51396 [ACK] Seq=42770 Ack=6468 Win=8 Len=0 TSval=2678076591 TSecr=4004381854"
"178","13.829242","162.159.137.232","192.168.0.63","TCP","66","443  >  51396 [ACK] Seq=42770 Ack=6682 Win=8 Len=0 TSval=2678076591 TSecr=4004381854"
"179","13.829662","162.159.137.232","192.168.0.63","TCP","66","443  >  51396 [ACK] Seq=42770 Ack=7198 Win=8 Len=0 TSval=2678076591 TSecr=4004381854"
"180","13.836719","192.168.0.63","162.159.138.232","UDP","86","51109  >  443 Len=44"
"181","13.839006","192.168.0.63","162.159.137.232","TLSv1.2","210","Application Data"
"182","13.852115","162.159.137.232","192.168.0.63","TCP","66","443  >  51396 [ACK] Seq=42770 Ack=7342 Win=8 Len=0 TSval=2678076613 TSecr=4004381879"
"183","13.864529","162.159.137.232","192.168.0.63","TLSv1.2","544","Application Data"
"184","13.864529","162.159.137.232","192.168.0.63","TLSv1.2","99","Application Data"
"185","13.864530","162.159.137.232","192.168.0.63","TLSv1.2","129","Application Data, Application Data"
"186","13.864600","192.168.0.63","162.159.137.232","TCP","66","51396  >  443 [ACK] Seq=7342 Ack=43344 Win=32466 Len=0 TSval=4004381905 TSecr=2678076626"
"187","13.866158","192.168.0.63","162.159.137.232","TLSv1.2","101","Application Data"
"188","13.867786","162.159.137.232","192.168.0.63","TLSv1.2","547","Application Data"
"189","13.867852","192.168.0.63","162.159.137.232","TCP","66","51396  >  443 [ACK] Seq=7377 Ack=43825 Win=32468 Len=0 TSval=4004381908 TSecr=2678076629"
"190","13.868995","192.168.0.63","162.159.137.232","TLSv1.2","101","Application Data"
"191","13.883245","162.159.137.232","192.168.0.63","TCP","66","443  >  51396 [ACK] Seq=43825 Ack=7412 Win=8 Len=0 TSval=2678076644 TSecr=4004381879"
"192","13.932197","162.159.137.232","192.168.0.63","TLSv1.2","601","Application Data"
"193","13.932198","162.159.137.232","192.168.0.63","TLSv1.2","98","Application Data"
"194","13.932258","192.168.0.63","162.159.137.232","TCP","66","51396  >  443 [ACK] Seq=7412 Ack=44392 Win=32466 Len=0 TSval=4004381973 TSecr=2678076693"
"195","13.932340","162.159.137.232","192.168.0.63","TLSv1.2","97","Application Data"
"196","13.932368","192.168.0.63","162.159.137.232","TCP","66","51396  >  443 [ACK] Seq=7412 Ack=44423 Win=32466 Len=0 TSval=4004381973 TSecr=2678076694"
"197","16.236240","192.168.0.63","162.159.137.232","TLSv1.2","343","Application Data"
"198","16.272068","162.159.137.232","192.168.0.63","TLSv1.2","586","Application Data"
"199","16.272327","192.168.0.63","162.159.137.232","TCP","66","51396  >  443 [ACK] Seq=7689 Ack=44943 Win=32467 Len=0 TSval=4004384313 TSecr=2678079033"
"200","16.273059","192.168.0.63","162.159.137.232","TLSv1.2","101","Application Data"
"201","16.330706","162.159.137.232","192.168.0.63","TCP","66","443  >  51396 [ACK] Seq=44943 Ack=7724 Win=8 Len=0 TSval=2678079091 TSecr=4004384313"
"202","16.409127","192.168.0.63","162.159.138.232","UDP","509","51109  >  443 Len=467"
"203","16.419919","162.159.138.232","192.168.0.63","UDP","66","443  >  51109 Len=24"
"204","16.430124","192.168.0.63","162.159.137.232","TLSv1.2","264","Application Data"
"205","16.430213","192.168.0.63","162.159.137.232","TLSv1.2","503","Application Data"
"206","16.442444","192.168.0.63","162.159.137.232","TLSv1.2","182","Application Data"
"207","16.443630","162.159.138.232","192.168.0.63","UDP","991","443  >  51109 Len=949"
"208","16.444570","162.159.137.232","192.168.0.63","TCP","66","443  >  51396 [ACK] Seq=44943 Ack=7922 Win=8 Len=0 TSval=2678079206 TSecr=4004384471"
"209","16.444982","162.159.137.232","192.168.0.63","TCP","66","443  >  51396 [ACK] Seq=44943 Ack=8359 Win=8 Len=0 TSval=2678079206 TSecr=4004384471"
"210","16.457531","162.159.137.232","192.168.0.63","TCP","66","443  >  51396 [ACK] Seq=44943 Ack=8475 Win=8 Len=0 TSval=2678079217 TSecr=4004384483"
"211","16.468367","162.159.137.232","192.168.0.63","TLSv1.2","360","Application Data"
"212","16.468421","192.168.0.63","162.159.137.232","TCP","66","51396  >  443 [ACK] Seq=8475 Ack=45237 Win=32470 Len=0 TSval=4004384509 TSecr=2678079229"
"213","16.468847","192.168.0.63","162.159.137.232","TLSv1.2","101","Application Data"
"214","16.468961","192.168.0.63","162.159.138.232","UDP","86","51109  >  443 Len=44"
"215","16.494016","162.159.137.232","192.168.0.63","TLSv1.2","546","Application Data"
"216","16.494016","162.159.137.232","192.168.0.63","TLSv1.2","99","Application Data"
"217","16.494075","192.168.0.63","162.159.137.232","TCP","66","51396  >  443 [ACK] Seq=8510 Ack=45750 Win=32467 Len=0 TSval=4004384535 TSecr=2678079255"
"218","16.494139","162.159.137.232","192.168.0.63","TLSv1.2","129","Application Data, Application Data"
"219","16.494174","192.168.0.63","162.159.137.232","TCP","66","51396  >  443 [ACK] Seq=8510 Ack=45813 Win=32466 Len=0 TSval=4004384535 TSecr=2678079255"
"220","18.692943","192.168.0.63","162.159.137.232","TLSv1.2","589","Application Data"
"221","18.740276","162.159.137.232","192.168.0.63","TLSv1.2","478","Application Data"
"222","18.740439","192.168.0.63","162.159.137.232","TCP","66","51396  >  443 [ACK] Seq=9033 Ack=46225 Win=32469 Len=0 TSval=4004386781 TSecr=2678081501"
"223","18.741846","192.168.0.63","162.159.137.232","TLSv1.2","101","Application Data"
"224","18.792873","162.159.137.232","192.168.0.63","TCP","66","443  >  51396 [ACK] Seq=46225 Ack=9068 Win=8 Len=0 TSval=2678081554 TSecr=4004386782"
"225","18.852497","192.168.0.63","162.159.138.232","UDP","509","51109  >  443 Len=467"
"226","18.863389","162.159.138.232","192.168.0.63","UDP","66","443  >  51109 Len=24"
"227","18.874394","162.159.138.232","192.168.0.63","UDP","993","443  >  51109 Len=951"
"228","18.884230","192.168.0.63","162.159.137.232","TLSv1.2","442","Application Data"
"229","18.884339","192.168.0.63","162.159.137.232","TLSv1.2","436","Application Data"
"230","18.894479","162.159.137.232","192.168.0.63","TCP","66","443  >  51396 [ACK] Seq=46225 Ack=9444 Win=8 Len=0 TSval=2678081656 TSecr=4004386925"
"231","18.895342","162.159.137.232","192.168.0.63","TCP","66","443  >  51396 [ACK] Seq=46225 Ack=9814 Win=8 Len=0 TSval=2678081656 TSecr=4004386925"
"232","18.900029","192.168.0.63","162.159.138.232","UDP","86","51109  >  443 Len=44"
"233","18.936335","162.159.137.232","192.168.0.63","TLSv1.2","385","Application Data"
"234","18.936335","162.159.137.232","192.168.0.63","TLSv1.2","99","Application Data"
"235","18.936336","162.159.137.232","192.168.0.63","TLSv1.2","98","Application Data"
"236","18.936336","162.159.137.232","192.168.0.63","TLSv1.2","97","Application Data"
"237","18.936420","192.168.0.63","162.159.137.232","TCP","66","51396  >  443 [ACK] Seq=9814 Ack=46640 Win=32469 Len=0 TSval=4004386977 TSecr=2678081696"
"238","18.937523","192.168.0.63","162.159.137.232","TLSv1.2","101","Application Data"
"239","18.949924","162.159.137.232","192.168.0.63","TCP","66","443  >  51396 [ACK] Seq=46640 Ack=9849 Win=8 Len=0 TSval=2678081711 TSecr=4004386978"
"240","18.958355","192.168.0.63","162.159.137.232","TLSv1.2","810","Application Data"
"241","18.968566","162.159.137.232","192.168.0.63","TCP","66","443  >  51396 [ACK] Seq=46640 Ack=10593 Win=8 Len=0 TSval=2678081730 TSecr=4004386999"
"242","18.981660","162.159.137.232","192.168.0.63","TLSv1.2","673","Application Data"
"243","18.981716","192.168.0.63","162.159.137.232","TCP","66","51396  >  443 [ACK] Seq=10593 Ack=47247 Win=32466 Len=0 TSval=4004387022 TSecr=2678081742"
"244","18.982343","192.168.0.63","162.159.137.232","TLSv1.2","101","Application Data"
"245","19.033423","162.159.137.232","192.168.0.63","TCP","66","443  >  51396 [ACK] Seq=47247 Ack=10628 Win=8 Len=0 TSval=2678081795 TSecr=4004387022"
"246","20.601925","192.168.0.63","162.159.137.232","TLSv1.2","307","Application Data"
"247","20.614285","162.159.137.232","192.168.0.63","TCP","66","443  >  51396 [ACK] Seq=47247 Ack=10869 Win=8 Len=0 TSval=2678083375 TSecr=4004388642"
"248","20.636559","162.159.137.232","192.168.0.63","TLSv1.2","593","Application Data"
"249","20.636700","192.168.0.63","162.159.137.232","TCP","66","51396  >  443 [ACK] Seq=10869 Ack=47774 Win=32467 Len=0 TSval=4004388676 TSecr=2678083397"
"250","20.637444","192.168.0.63","162.159.137.232","TLSv1.2","101","Application Data"
"251","20.688787","162.159.137.232","192.168.0.63","TCP","66","443  >  51396 [ACK] Seq=47774 Ack=10904 Win=8 Len=0 TSval=2678083450 TSecr=4004388677"
"252","20.734075","192.168.0.63","162.159.138.232","UDP","509","51109  >  443 Len=467"
"253","20.744404","162.159.138.232","192.168.0.63","UDP","66","443  >  51109 Len=24"
"254","20.753157","162.159.138.232","192.168.0.63","UDP","994","443  >  51109 Len=952"
"255","20.764214","192.168.0.63","162.159.137.232","TLSv1.2","366","Application Data"
"256","20.764453","192.168.0.63","162.159.137.232","TLSv1.2","436","Application Data"
"257","20.774206","162.159.137.232","192.168.0.63","TCP","66","443  >  51396 [ACK] Seq=47774 Ack=11204 Win=8 Len=0 TSval=2678083535 TSecr=4004388805"
"258","20.777305","162.159.137.232","192.168.0.63","TCP","66","443  >  51396 [ACK] Seq=47774 Ack=11574 Win=8 Len=0 TSval=2678083538 TSecr=4004388805"
"259","20.781855","192.168.0.63","162.159.138.232","UDP","86","51109  >  443 Len=44"
"260","20.808104","192.168.0.63","162.159.137.232","TLSv1.2","210","Application Data"
"261","20.813460","162.159.137.232","192.168.0.63","TLSv1.2","536","Application Data"
"262","20.813461","162.159.137.232","192.168.0.63","TLSv1.2","100","Application Data"
"263","20.813550","192.168.0.63","162.159.137.232","TCP","66","51396  >  443 [ACK] Seq=11718 Ack=48278 Win=32467 Len=0 TSval=4004388854 TSecr=2678083574"
"264","20.813784","162.159.137.232","192.168.0.63","TLSv1.2","97","Application Data"
"265","20.813825","192.168.0.63","162.159.137.232","TCP","66","51396  >  443 [ACK] Seq=11718 Ack=48309 Win=32475 Len=0 TSval=4004388854 TSecr=2678083574"
"266","20.832729","162.159.137.232","192.168.0.63","TLSv1.2","358","Application Data"
"267","20.832791","192.168.0.63","162.159.137.232","TCP","66","51396  >  443 [ACK] Seq=11718 Ack=48601 Win=32471 Len=0 TSval=4004388873 TSecr=2678083594"
"268","20.833279","192.168.0.63","162.159.137.232","TLSv1.2","101","Application Data"
"269","20.890456","162.159.137.232","192.168.0.63","TCP","66","443  >  51396 [ACK] Seq=48601 Ack=11753 Win=8 Len=0 TSval=2678083652 TSecr=4004388873"
"270","23.024748","192.168.0.63","162.159.137.232","TLSv1.2","422","Application Data"
"271","23.033433","162.159.137.232","192.168.0.63","TCP","66","443  >  51396 [ACK] Seq=48601 Ack=12109 Win=8 Len=0 TSval=2678085794 TSecr=4004391065"
"272","23.056311","162.159.137.232","192.168.0.63","TLSv1.2","526","Application Data"
"273","23.056393","192.168.0.63","162.159.137.232","TCP","66","51396  >  443 [ACK] Seq=12109 Ack=49061 Win=32468 Len=0 TSval=4004391097 TSecr=2678085817"
"274","23.056910","192.168.0.63","162.159.137.232","TLSv1.2","101","Application Data"
"275","23.112017","162.159.137.232","192.168.0.63","TCP","66","443  >  51396 [ACK] Seq=49061 Ack=12144 Win=8 Len=0 TSval=2678085873 TSecr=4004391097"
"276","23.183918","192.168.0.63","162.159.138.232","UDP","511","51109  >  443 Len=469"
"277","23.194711","162.159.138.232","192.168.0.63","UDP","66","443  >  51109 Len=24"
"278","23.203804","162.159.138.232","192.168.0.63","UDP","994","443  >  51109 Len=952"
"279","23.215750","192.168.0.63","162.159.137.232","TLSv1.2","270","Application Data"
"280","23.230515","162.159.137.232","192.168.0.63","TCP","66","443  >  51396 [ACK] Seq=49061 Ack=12348 Win=8 Len=0 TSval=2678085991 TSecr=4004391256"
"281","23.232903","192.168.0.63","162.159.138.232","UDP","86","51109  >  443 Len=44"
"282","23.242469","162.159.137.232","192.168.0.63","TLSv1.2","804","Application Data"
"283","23.242517","192.168.0.63","162.159.137.232","TCP","66","51396  >  443 [ACK] Seq=12348 Ack=49799 Win=32464 Len=0 TSval=4004391283 TSecr=2678086003"
"284","23.242958","192.168.0.63","162.159.137.232","TLSv1.2","101","Application Data"
"285","23.294278","162.159.137.232","192.168.0.63","TCP","66","443  >  51396 [ACK] Seq=49799 Ack=12383 Win=8 Len=0 TSval=2678086055 TSecr=4004391283"
"286","25.563641","192.168.0.63","162.159.137.232","TLSv1.2","696","Application Data"
"287","25.575548","162.159.137.232","192.168.0.63","TCP","66","443  >  51396 [ACK] Seq=49799 Ack=13013 Win=8 Len=0 TSval=2678088336 TSecr=4004393604"
"288","27.087185","162.159.137.232","192.168.0.63","TLSv1.2","612","Application Data"
"289","27.087186","162.159.137.232","192.168.0.63","TCP","1514","443  >  51396 [ACK] Seq=50345 Ack=13013 Win=8 Len=1448 TSval=2678089751 TSecr=4004393604 [TCP segment of a reassembled PDU]"
"290","27.087187","162.159.137.232","192.168.0.63","TCP","1514","443  >  51396 [ACK] Seq=51793 Ack=13013 Win=8 Len=1448 TSval=2678089751 TSecr=4004393604 [TCP segment of a reassembled PDU]"
"291","27.087188","162.159.137.232","192.168.0.63","TLSv1.2","186","Application Data"
"292","27.087189","162.159.137.232","192.168.0.63","TCP","1514","443  >  51396 [ACK] Seq=53361 Ack=13013 Win=8 Len=1448 TSval=2678089751 TSecr=4004393604 [TCP segment of a reassembled PDU]"
"293","27.087190","162.159.137.232","192.168.0.63","TCP","1514","443  >  51396 [ACK] Seq=54809 Ack=13013 Win=8 Len=1448 TSval=2678089751 TSecr=4004393604 [TCP segment of a reassembled PDU]"
"294","27.087191","162.159.137.232","192.168.0.63","TLSv1.2","1197","Application Data"
"295","27.087192","162.159.137.232","192.168.0.63","TCP","1514","443  >  51396 [ACK] Seq=57388 Ack=13013 Win=8 Len=1448 TSval=2678089752 TSecr=4004393604 [TCP segment of a reassembled PDU]"
"296","27.087193","162.159.137.232","192.168.0.63","TLSv1.2","1005","Application Data"
"297","27.087193","162.159.137.232","192.168.0.63","TLSv1.2","98","Application Data"
"298","27.087194","162.159.137.232","192.168.0.63","TLSv1.2","97","Application Data"
"299","27.087196","162.159.137.232","192.168.0.63","TCP","97","[TCP Retransmission] 443  >  51396 [PSH, ACK] Seq=59807 Ack=13013 Win=8 Len=31 TSval=2678089782 TSecr=4004393604"
"300","27.087339","192.168.0.63","162.159.137.232","TCP","66","51396  >  443 [ACK] Seq=13013 Ack=59838 Win=32318 Len=0 TSval=4004395128 TSecr=2678089752"
"301","27.087495","192.168.0.63","162.159.137.232","TCP","78","[TCP Dup ACK 300#1] 51396  >  443 [ACK] Seq=13013 Ack=59838 Win=32318 Len=0 TSval=4004395128 TSecr=2678089782 SLE=59807 SRE=59838"
"302","27.087560","192.168.0.63","162.159.137.232","TCP","66","[TCP Window Update] 51396  >  443 [ACK] Seq=13013 Ack=59838 Win=32475 Len=0 TSval=4004395128 TSecr=2678089782"
"303","27.091504","192.168.0.63","162.159.137.232","TLSv1.2","101","Application Data"
"304","27.098614","162.159.137.232","192.168.0.63","TCP","66","443  >  51396 [ACK] Seq=59838 Ack=13048 Win=8 Len=0 TSval=2678089859 TSecr=4004395132"
"305","27.216167","192.168.0.63","162.159.138.232","UDP","511","51109  >  443 Len=469"
"306","27.234001","162.159.138.232","192.168.0.63","UDP","65","443  >  51109 Len=23"
"307","27.247156","162.159.138.232","192.168.0.63","UDP","993","443  >  51109 Len=951"
"308","27.277069","192.168.0.63","162.159.138.232","UDP","86","51109  >  443 Len=44"
"309","27.327270","192.168.0.63","162.159.137.232","TLSv1.2","1129","Application Data"
"310","27.340262","162.159.137.232","192.168.0.63","TCP","66","443  >  51396 [ACK] Seq=59838 Ack=14111 Win=8 Len=0 TSval=2678090101 TSecr=4004395367"
"311","27.356202","162.159.137.232","192.168.0.63","TLSv1.2","502","Application Data"
"312","27.356267","192.168.0.63","162.159.137.232","TCP","66","51396  >  443 [ACK] Seq=14111 Ack=60274 Win=32468 Len=0 TSval=4004395396 TSecr=2678090116"
"313","27.356845","192.168.0.63","162.159.137.232","TLSv1.2","101","Application Data"
"314","27.410775","162.159.137.232","192.168.0.63","TCP","66","443  >  51396 [ACK] Seq=60274 Ack=14146 Win=8 Len=0 TSval=2678090172 TSecr=4004395396"
"315","28.997802","192.168.0.63","162.159.137.232","TLSv1.2","537","Application Data"
"316","29.015214","162.159.137.232","192.168.0.63","TCP","66","443  >  51396 [ACK] Seq=60274 Ack=14617 Win=8 Len=0 TSval=2678091776 TSecr=4004397038"
"317","29.035808","162.159.137.232","192.168.0.63","TLSv1.2","511","Application Data"
"318","29.035882","192.168.0.63","162.159.137.232","TCP","66","51396  >  443 [ACK] Seq=14617 Ack=60719 Win=32468 Len=0 TSval=4004397076 TSecr=2678091796"
"319","29.036497","192.168.0.63","162.159.137.232","TLSv1.2","101","Application Data"
"320","29.089032","162.159.137.232","192.168.0.63","TCP","66","443  >  51396 [ACK] Seq=60719 Ack=14652 Win=8 Len=0 TSval=2678091850 TSecr=4004397076"
"321","29.177808","192.168.0.63","162.159.138.232","UDP","511","51109  >  443 Len=469"
"322","29.189322","162.159.138.232","192.168.0.63","UDP","65","443  >  51109 Len=23"
"323","29.199048","162.159.138.232","192.168.0.63","UDP","993","443  >  51109 Len=951"
"324","29.210608","192.168.0.63","162.159.137.232","TLSv1.2","330","Application Data"
"325","29.210735","192.168.0.63","162.159.137.232","TLSv1.2","472","Application Data"
"326","29.213513","192.168.0.63","162.159.137.232","TLSv1.2","210","Application Data"
"327","29.220903","162.159.137.232","192.168.0.63","TCP","66","443  >  51396 [ACK] Seq=60719 Ack=14916 Win=8 Len=0 TSval=2678091981 TSecr=4004397251"
"328","29.226439","192.168.0.63","162.159.138.232","UDP","86","51109  >  443 Len=44"
"329","29.226726","162.159.137.232","192.168.0.63","TCP","66","443  >  51396 [ACK] Seq=60719 Ack=15322 Win=8 Len=0 TSval=2678091987 TSecr=4004397251"
"330","29.226726","162.159.137.232","192.168.0.63","TCP","66","443  >  51396 [ACK] Seq=60719 Ack=15466 Win=8 Len=0 TSval=2678091987 TSecr=4004397253"
"331","29.240782","162.159.137.232","192.168.0.63","TLSv1.2","808","Application Data"
"332","29.240864","192.168.0.63","162.159.137.232","TCP","66","51396  >  443 [ACK] Seq=15466 Ack=61461 Win=32463 Len=0 TSval=4004397281 TSecr=2678092001"
"333","29.242085","192.168.0.63","162.159.137.232","TLSv1.2","101","Application Data"
"334","29.260353","162.159.137.232","192.168.0.63","TLSv1.2","525","Application Data"
"335","29.260413","192.168.0.63","162.159.137.232","TCP","66","51396  >  443 [ACK] Seq=15501 Ack=61920 Win=32468 Len=0 TSval=4004397301 TSecr=2678092021"
"336","29.260716","162.159.137.232","192.168.0.63","TLSv1.2","100","Application Data"
"337","29.260717","162.159.137.232","192.168.0.63","TLSv1.2","97","Application Data"
"338","29.260752","192.168.0.63","162.159.137.232","TCP","66","51396  >  443 [ACK] Seq=15501 Ack=61985 Win=32474 Len=0 TSval=4004397301 TSecr=2678092021"
"339","34.347158","192.168.0.63","162.159.135.232","QUIC","1292","Initial, DCID=884ab6d698712f56, PKN: 1, CRYPTO"
"340","34.347222","192.168.0.63","162.159.135.232","QUIC","1292","Initial, DCID=884ab6d698712f56, PKN: 2, CRYPTO, CRYPTO, PADDING, CRYPTO, PADDING, PING, CRYPTO, PING, CRYPTO, PADDING, CRYPTO, CRYPTO, CRYPTO, PADDING, CRYPTO, PADDING, PING, PING, CRYPTO, PING"
"341","34.347630","192.168.0.63","162.159.135.232","QUIC","122","0-RTT, DCID=884ab6d698712f56"
