"No.","Time","Source","Destination","Protocol","Length","Info"
"1","0.000000","2600:8805:3803:6100:c100:e220:6ae:755","2620:1ec:21::14","TLSv1.2","953","Application Data"
"2","0.000098","2600:8805:3803:6100:c100:e220:6ae:755","2620:1ec:21::14","TCP","1474","54869  >  443 [ACK] Seq=880 Ack=1 Win=4096 Len=1400 [TCP segment of a reassembled PDU]"
"3","0.000171","2600:8805:3803:6100:c100:e220:6ae:755","2620:1ec:21::14","TLSv1.2","420","Application Data"
"4","0.025429","2620:1ec:21::14","2600:8805:3803:6100:c100:e220:6ae:755","TCP","74","443  >  54869 [ACK] Seq=1 Ack=880 Win=16382 Len=0"
"5","0.026037","2620:1ec:21::14","2600:8805:3803:6100:c100:e220:6ae:755","TCP","74","443  >  54869 [ACK] Seq=1 Ack=2280 Win=16385 Len=0"
"6","0.026038","2620:1ec:21::14","2600:8805:3803:6100:c100:e220:6ae:755","TCP","74","443  >  54869 [ACK] Seq=1 Ack=2626 Win=16384 Len=0"
"7","0.069717","2600:8805:3803:6100:c100:e220:6ae:755","2620:1ec:21::14","TCP","1474","54869  >  443 [ACK] Seq=2626 Ack=1 Win=4096 Len=1400 [TCP segment of a reassembled PDU]"
"8","0.069828","2600:8805:3803:6100:c100:e220:6ae:755","2620:1ec:21::14","TLSv1.2","1052","Application Data"
"9","0.085288","2620:1ec:21::14","2600:8805:3803:6100:c100:e220:6ae:755","TCP","74","443  >  54869 [ACK] Seq=1 Ack=4026 Win=16385 Len=0"
"10","0.085698","2620:1ec:21::14","2600:8805:3803:6100:c100:e220:6ae:755","TCP","74","443  >  54869 [ACK] Seq=1 Ack=5004 Win=16381 Len=0"
"11","0.089761","2620:1ec:21::14","2600:8805:3803:6100:c100:e220:6ae:755","TLSv1.2","422","Application Data"
"12","0.089825","2600:8805:3803:6100:c100:e220:6ae:755","2620:1ec:21::14","TCP","74","54869  >  443 [ACK] Seq=5004 Ack=349 Win=4090 Len=0"
"13","0.182505","2620:1ec:21::14","2600:8805:3803:6100:c100:e220:6ae:755","TLSv1.2","1023","Application Data"
"14","0.182649","2600:8805:3803:6100:c100:e220:6ae:755","2620:1ec:21::14","TCP","74","54869  >  443 [ACK] Seq=5004 Ack=1298 Win=4081 Len=0"
"15","0.183521","2600:8805:3803:6100:c100:e220:6ae:755","2620:1ec:21::14","TLSv1.2","116","Application Data"
"16","0.184034","2620:1ec:21::14","2600:8805:3803:6100:c100:e220:6ae:755","TLSv1.2","112","Application Data"
"17","0.184098","2600:8805:3803:6100:c100:e220:6ae:755","2620:1ec:21::14","TCP","74","54869  >  443 [ACK] Seq=5046 Ack=1336 Win=4095 Len=0"
"18","0.202472","2620:1ec:21::14","2600:8805:3803:6100:c100:e220:6ae:755","TCP","74","443  >  54869 [ACK] Seq=1336 Ack=5046 Win=16381 Len=0"
"19","0.213899","2600:8805:3803:6100:c100:e220:6ae:755","2620:1ec:21::14","TLSv1.2","1081","Application Data"
"20","0.230554","2620:1ec:21::14","2600:8805:3803:6100:c100:e220:6ae:755","TCP","74","443  >  54869 [ACK] Seq=1336 Ack=6053 Win=16385 Len=0"
"21","0.244153","2600:8805:3803:6100:c100:e220:6ae:755","2620:1ec:21::14","TLSv1.2","1453","Application Data"
"22","0.247213","2600:8805:3803:6100:c100:e220:6ae:755","2620:1ec:21::14","TLSv1.2","481","Application Data"
"23","0.256299","2600:8805:3803:6100:c100:e220:6ae:755","2620:1ec:21::14","TCP","1474","54869  >  443 [ACK] Seq=7839 Ack=1336 Win=4096 Len=1400 [TCP segment of a reassembled PDU]"
"24","0.256306","2600:8805:3803:6100:c100:e220:6ae:755","2620:1ec:21::14","TCP","1474","54869  >  443 [ACK] Seq=9239 Ack=1336 Win=4096 Len=1400 [TCP segment of a reassembled PDU]"
"25","0.256372","2600:8805:3803:6100:c100:e220:6ae:755","2620:1ec:21::14","TLSv1.2","325","Application Data"
"26","0.260178","2620:1ec:21::14","2600:8805:3803:6100:c100:e220:6ae:755","TCP","74","443  >  54869 [ACK] Seq=1336 Ack=7432 Win=16380 Len=0"
"27","0.263429","2620:1ec:21::14","2600:8805:3803:6100:c100:e220:6ae:755","TCP","74","443  >  54869 [ACK] Seq=1336 Ack=7839 Win=16385 Len=0"
"28","0.273015","2620:1ec:21::14","2600:8805:3803:6100:c100:e220:6ae:755","TCP","74","443  >  54869 [ACK] Seq=1336 Ack=9239 Win=16380 Len=0"
"29","0.273355","2620:1ec:21::14","2600:8805:3803:6100:c100:e220:6ae:755","TCP","74","443  >  54869 [ACK] Seq=1336 Ack=10890 Win=16385 Len=0"
"30","0.326654","2620:1ec:21::14","2600:8805:3803:6100:c100:e220:6ae:755","TLSv1.2","301","Application Data"
"31","0.326736","2600:8805:3803:6100:c100:e220:6ae:755","2620:1ec:21::14","TCP","74","54869  >  443 [ACK] Seq=10890 Ack=1563 Win=4092 Len=0"
"32","0.377839","2620:1ec:21::14","2600:8805:3803:6100:c100:e220:6ae:755","TLSv1.2","774","Application Data"
"33","0.377915","2600:8805:3803:6100:c100:e220:6ae:755","2620:1ec:21::14","TCP","74","54869  >  443 [ACK] Seq=10890 Ack=2263 Win=4085 Len=0"
"34","0.378131","2620:1ec:21::14","2600:8805:3803:6100:c100:e220:6ae:755","TLSv1.2","112","Application Data"
"35","0.378172","2600:8805:3803:6100:c100:e220:6ae:755","2620:1ec:21::14","TCP","74","54869  >  443 [ACK] Seq=10890 Ack=2301 Win=4095 Len=0"
"36","0.379355","2600:8805:3803:6100:c100:e220:6ae:755","2620:1ec:21::14","TCP","1474","54869  >  443 [ACK] Seq=10890 Ack=2301 Win=4096 Len=1400 [TCP segment of a reassembled PDU]"
"37","0.379360","2600:8805:3803:6100:c100:e220:6ae:755","2620:1ec:21::14","TCP","1474","54869  >  443 [ACK] Seq=12290 Ack=2301 Win=4096 Len=1400 [TCP segment of a reassembled PDU]"
"38","0.379414","2600:8805:3803:6100:c100:e220:6ae:755","2620:1ec:21::14","TLSv1.2","335","Application Data"
"39","0.389829","2600:8805:3803:6100:c100:e220:6ae:755","2620:1ec:21::14","TCP","1474","54869  >  443 [ACK] Seq=13951 Ack=2301 Win=4096 Len=1400 [TCP segment of a reassembled PDU]"
"40","0.389836","2600:8805:3803:6100:c100:e220:6ae:755","2620:1ec:21::14","TCP","1474","54869  >  443 [ACK] Seq=15351 Ack=2301 Win=4096 Len=1400 [TCP segment of a reassembled PDU]"
"41","0.389927","2600:8805:3803:6100:c100:e220:6ae:755","2620:1ec:21::14","TLSv1.2","315","Application Data"
"42","0.389985","2600:8805:3803:6100:c100:e220:6ae:755","2620:1ec:21::14","TLSv1.2","195","Application Data"
"43","0.399358","2620:1ec:21::14","2600:8805:3803:6100:c100:e220:6ae:755","TCP","74","443  >  54869 [ACK] Seq=2301 Ack=12290 Win=16380 Len=0"
"44","0.399646","2620:1ec:21::14","2600:8805:3803:6100:c100:e220:6ae:755","TCP","74","443  >  54869 [ACK] Seq=2301 Ack=13951 Win=16385 Len=0"
"45","0.405197","2620:1ec:21::14","2600:8805:3803:6100:c100:e220:6ae:755","TCP","74","443  >  54869 [ACK] Seq=2301 Ack=15351 Win=16380 Len=0"
"46","0.405824","2620:1ec:21::14","2600:8805:3803:6100:c100:e220:6ae:755","TCP","74","443  >  54869 [ACK] Seq=2301 Ack=17113 Win=16385 Len=0"
"47","0.474964","2600:8805:3803:6100:c100:e220:6ae:755","2620:1ec:21::14","TCP","1474","54869  >  443 [ACK] Seq=17113 Ack=2301 Win=4096 Len=1400 [TCP segment of a reassembled PDU]"
"48","0.474971","2600:8805:3803:6100:c100:e220:6ae:755","2620:1ec:21::14","TCP","1474","54869  >  443 [ACK] Seq=18513 Ack=2301 Win=4096 Len=1400 [TCP segment of a reassembled PDU]"
"49","0.475040","2600:8805:3803:6100:c100:e220:6ae:755","2620:1ec:21::14","TLSv1.2","315","Application Data"
"50","0.475087","2600:8805:3803:6100:c100:e220:6ae:755","2620:1ec:21::14","TLSv1.2","135","Application Data"
"51","0.484597","2620:1ec:21::14","2600:8805:3803:6100:c100:e220:6ae:755","TLSv1.2","260","Application Data"
"52","0.484654","2600:8805:3803:6100:c100:e220:6ae:755","2620:1ec:21::14","TCP","74","54869  >  443 [ACK] Seq=20215 Ack=2487 Win=4093 Len=0"
"53","0.491045","2620:1ec:21::14","2600:8805:3803:6100:c100:e220:6ae:755","TCP","74","443  >  54869 [ACK] Seq=2487 Ack=18513 Win=16380 Len=0"
"54","0.491454","2620:1ec:21::14","2600:8805:3803:6100:c100:e220:6ae:755","TCP","74","443  >  54869 [ACK] Seq=2487 Ack=19913 Win=16385 Len=0"
"55","0.491746","2620:1ec:21::14","2600:8805:3803:6100:c100:e220:6ae:755","TCP","74","443  >  54869 [ACK] Seq=2487 Ack=20215 Win=16384 Len=0"
"56","0.498257","2620:1ec:21::14","2600:8805:3803:6100:c100:e220:6ae:755","TLSv1.2","829","Application Data"
"57","0.498258","2620:1ec:21::14","2600:8805:3803:6100:c100:e220:6ae:755","TLSv1.2","112","Application Data"
"58","0.498317","2600:8805:3803:6100:c100:e220:6ae:755","2620:1ec:21::14","TCP","74","54869  >  443 [ACK] Seq=20215 Ack=3280 Win=4083 Len=0"
"59","0.513401","2620:1ec:21::14","2600:8805:3803:6100:c100:e220:6ae:755","TLSv1.2","621","Application Data"
"60","0.513402","2620:1ec:21::14","2600:8805:3803:6100:c100:e220:6ae:755","TLSv1.2","112","Application Data"
"61","0.513461","2600:8805:3803:6100:c100:e220:6ae:755","2620:1ec:21::14","TCP","74","54869  >  443 [ACK] Seq=20215 Ack=3865 Win=4086 Len=0"
"62","0.515110","2600:8805:3803:6100:c100:e220:6ae:755","2620:1ec:21::14","TCP","1474","54869  >  443 [ACK] Seq=20215 Ack=3865 Win=4096 Len=1400 [TCP segment of a reassembled PDU]"
"63","0.515115","2600:8805:3803:6100:c100:e220:6ae:755","2620:1ec:21::14","TCP","1474","54869  >  443 [ACK] Seq=21615 Ack=3865 Win=4096 Len=1400 [TCP segment of a reassembled PDU]"
"64","0.515211","2600:8805:3803:6100:c100:e220:6ae:755","2620:1ec:21::14","TLSv1.2","335","Application Data"
"65","0.533879","2620:1ec:21::14","2600:8805:3803:6100:c100:e220:6ae:755","TCP","74","443  >  54869 [ACK] Seq=3865 Ack=21615 Win=16385 Len=0"
"66","0.534182","2620:1ec:21::14","2600:8805:3803:6100:c100:e220:6ae:755","TCP","74","443  >  54869 [ACK] Seq=3865 Ack=23015 Win=16380 Len=0"
"67","0.534182","2620:1ec:21::14","2600:8805:3803:6100:c100:e220:6ae:755","TCP","74","443  >  54869 [ACK] Seq=3865 Ack=23276 Win=16385 Len=0"
"68","0.574778","2620:1ec:21::14","2600:8805:3803:6100:c100:e220:6ae:755","TLSv1.2","324","Application Data"
"69","0.574836","2600:8805:3803:6100:c100:e220:6ae:755","2620:1ec:21::14","TCP","74","54869  >  443 [ACK] Seq=23276 Ack=4115 Win=4092 Len=0"
"70","0.649165","2620:1ec:21::14","2600:8805:3803:6100:c100:e220:6ae:755","TLSv1.2","603","Application Data"
"71","0.649166","2620:1ec:21::14","2600:8805:3803:6100:c100:e220:6ae:755","TLSv1.2","112","Application Data"
"72","0.649237","2600:8805:3803:6100:c100:e220:6ae:755","2620:1ec:21::14","TCP","74","54869  >  443 [ACK] Seq=23276 Ack=4682 Win=4087 Len=0"
"73","0.650755","2600:8805:3803:6100:c100:e220:6ae:755","2620:1ec:21::14","TCP","1474","54869  >  443 [ACK] Seq=23276 Ack=4682 Win=4096 Len=1400 [TCP segment of a reassembled PDU]"
"74","0.650785","2600:8805:3803:6100:c100:e220:6ae:755","2620:1ec:21::14","TCP","1474","54869  >  443 [ACK] Seq=24676 Ack=4682 Win=4096 Len=1400 [TCP segment of a reassembled PDU]"
"75","0.650843","2600:8805:3803:6100:c100:e220:6ae:755","2620:1ec:21::14","TLSv1.2","335","Application Data"
"76","0.669895","2620:1ec:21::14","2600:8805:3803:6100:c100:e220:6ae:755","TCP","74","443  >  54869 [ACK] Seq=4682 Ack=26337 Win=16385 Len=0"
"77","0.775648","2600:8805:3803:6100:c100:e220:6ae:755","2620:1ec:21::14","TLSv1.2","1041","Application Data"
"78","0.775766","2600:8805:3803:6100:c100:e220:6ae:755","2620:1ec:21::14","TCP","1474","54869  >  443 [ACK] Seq=27304 Ack=4682 Win=4096 Len=1400 [TCP segment of a reassembled PDU]"
"79","0.775804","2600:8805:3803:6100:c100:e220:6ae:755","2620:1ec:21::14","TLSv1.2","437","Application Data"
"80","0.791149","2620:1ec:21::14","2600:8805:3803:6100:c100:e220:6ae:755","TLSv1.2","605","Application Data"
"81","0.791150","2620:1ec:21::14","2600:8805:3803:6100:c100:e220:6ae:755","TLSv1.2","112","Application Data"
"82","0.791211","2600:8805:3803:6100:c100:e220:6ae:755","2620:1ec:21::14","TCP","74","54869  >  443 [ACK] Seq=29067 Ack=5251 Win=4087 Len=0"
"83","0.791790","2600:8805:3803:6100:c100:e220:6ae:755","2620:1ec:21::14","TCP","1474","54869  >  443 [ACK] Seq=29067 Ack=5251 Win=4096 Len=1400 [TCP segment of a reassembled PDU]"
"84","0.791825","2600:8805:3803:6100:c100:e220:6ae:755","2620:1ec:21::14","TLSv1.2","1038","Application Data"
"85","0.795477","2620:1ec:21::14","2600:8805:3803:6100:c100:e220:6ae:755","TCP","74","443  >  54869 [ACK] Seq=5251 Ack=27304 Win=16381 Len=0"
"86","0.795802","2620:1ec:21::14","2600:8805:3803:6100:c100:e220:6ae:755","TCP","74","443  >  54869 [ACK] Seq=5251 Ack=29067 Win=16385 Len=0"
"87","0.811336","2620:1ec:21::14","2600:8805:3803:6100:c100:e220:6ae:755","TCP","74","443  >  54869 [ACK] Seq=5251 Ack=30467 Win=16380 Len=0"
"88","0.811658","2620:1ec:21::14","2600:8805:3803:6100:c100:e220:6ae:755","TCP","74","443  >  54869 [ACK] Seq=5251 Ack=31431 Win=16385 Len=0"
"89","0.865863","2620:1ec:21::14","2600:8805:3803:6100:c100:e220:6ae:755","TLSv1.2","423","Application Data"
"90","0.865939","2600:8805:3803:6100:c100:e220:6ae:755","2620:1ec:21::14","TCP","74","54869  >  443 [ACK] Seq=31431 Ack=5600 Win=4090 Len=0"
"91","0.895561","2620:1ec:21::14","2600:8805:3803:6100:c100:e220:6ae:755","TLSv1.2","749","Application Data"
"92","0.895561","2620:1ec:21::14","2600:8805:3803:6100:c100:e220:6ae:755","TLSv1.2","112","Application Data"
"93","0.895618","2600:8805:3803:6100:c100:e220:6ae:755","2620:1ec:21::14","TCP","74","54869  >  443 [ACK] Seq=31431 Ack=6313 Win=4084 Len=0"
"94","0.896587","2600:8805:3803:6100:c100:e220:6ae:755","2620:1ec:21::14","TLSv1.2","931","Application Data"
"95","0.916386","2620:1ec:21::14","2600:8805:3803:6100:c100:e220:6ae:755","TCP","74","443  >  54869 [ACK] Seq=6313 Ack=32288 Win=16382 Len=0"
"96","1.022024","2600:8805:3803:6100:c100:e220:6ae:755","2620:1ec:21::14","TCP","1474","54869  >  443 [ACK] Seq=32288 Ack=6313 Win=4096 Len=1400 [TCP segment of a reassembled PDU]"
"97","1.022108","2600:8805:3803:6100:c100:e220:6ae:755","2620:1ec:21::14","TLSv1.2","1027","Application Data"
"98","1.022163","2600:8805:3803:6100:c100:e220:6ae:755","2620:1ec:21::14","TLSv1.2","135","Application Data"
"99","1.039188","2620:1ec:21::14","2600:8805:3803:6100:c100:e220:6ae:755","TCP","74","443  >  54869 [ACK] Seq=6313 Ack=33688 Win=16385 Len=0"
"100","1.039856","2620:1ec:21::14","2600:8805:3803:6100:c100:e220:6ae:755","TCP","74","443  >  54869 [ACK] Seq=6313 Ack=34641 Win=16381 Len=0"
"101","1.039856","2620:1ec:21::14","2600:8805:3803:6100:c100:e220:6ae:755","TCP","74","443  >  54869 [ACK] Seq=6313 Ack=34702 Win=16381 Len=0"
"102","1.043561","2600:8805:3803:6100:c100:e220:6ae:755","2620:1ec:21::14","TLSv1.2","917","Application Data"
"103","1.043669","2600:8805:3803:6100:c100:e220:6ae:755","2620:1ec:21::14","TLSv1.2","532","Application Data"
"104","1.058869","2620:1ec:21::14","2600:8805:3803:6100:c100:e220:6ae:755","TCP","74","443  >  54869 [ACK] Seq=6313 Ack=35545 Win=16385 Len=0"
"105","1.058870","2620:1ec:21::14","2600:8805:3803:6100:c100:e220:6ae:755","TCP","74","443  >  54869 [ACK] Seq=6313 Ack=36003 Win=16383 Len=0"
"106","1.104044","2600:8805:3803:6100:c100:e220:6ae:755","2620:1ec:21::14","TCP","1474","54869  >  443 [ACK] Seq=36003 Ack=6313 Win=4096 Len=1400 [TCP segment of a reassembled PDU]"
"107","1.104140","2600:8805:3803:6100:c100:e220:6ae:755","2620:1ec:21::14","TLSv1.2","1226","Application Data"
"108","1.118582","2600:8805:3803:6100:c100:e220:6ae:755","2620:1ec:21::14","TLSv1.2","1001","Application Data"
"109","1.121017","2600:8805:3803:6100:c100:e220:6ae:755","2620:1ec:21::14","TCP","1474","54869  >  443 [ACK] Seq=39482 Ack=6313 Win=4096 Len=1400 [TCP segment of a reassembled PDU]"
"110","1.121147","2600:8805:3803:6100:c100:e220:6ae:755","2620:1ec:21::14","TLSv1.2","1039","Application Data"
"111","1.124767","2600:8805:3803:6100:c100:e220:6ae:755","2620:1ec:21::14","TCP","1474","54869  >  443 [ACK] Seq=41847 Ack=6313 Win=4096 Len=1400 [TCP segment of a reassembled PDU]"
"112","1.124910","2600:8805:3803:6100:c100:e220:6ae:755","2620:1ec:21::14","TLSv1.2","1095","Application Data"
"113","1.124990","2600:8805:3803:6100:c100:e220:6ae:755","2620:1ec:21::14","TCP","1474","54869  >  443 [ACK] Seq=44268 Ack=6313 Win=4096 Len=1400 [TCP segment of a reassembled PDU]"
"114","1.125009","2600:8805:3803:6100:c100:e220:6ae:755","2620:1ec:21::14","TLSv1.2","528","Application Data"
"115","1.127756","2620:1ec:21::14","2600:8805:3803:6100:c100:e220:6ae:755","TLSv1.2","260","Application Data"
"116","1.127824","2600:8805:3803:6100:c100:e220:6ae:755","2620:1ec:21::14","TCP","74","54869  >  443 [ACK] Seq=46122 Ack=6499 Win=4093 Len=0"
"117","1.132552","2620:1ec:21::14","2600:8805:3803:6100:c100:e220:6ae:755","TCP","74","443  >  54869 [ACK] Seq=6499 Ack=37403 Win=16385 Len=0"
"118","1.132858","2620:1ec:21::14","2600:8805:3803:6100:c100:e220:6ae:755","TCP","74","443  >  54869 [ACK] Seq=6499 Ack=38555 Win=16381 Len=0"
"119","1.136935","2620:1ec:21::14","2600:8805:3803:6100:c100:e220:6ae:755","TCP","74","443  >  54869 [ACK] Seq=6499 Ack=39482 Win=16385 Len=0"
"120","1.137340","2620:1ec:21::14","2600:8805:3803:6100:c100:e220:6ae:755","TCP","74","443  >  54869 [ACK] Seq=6499 Ack=41847 Win=16385 Len=0"
"121","1.140957","2620:1ec:21::14","2600:8805:3803:6100:c100:e220:6ae:755","TLSv1.2","301","Application Data"
"122","1.141017","2600:8805:3803:6100:c100:e220:6ae:755","2620:1ec:21::14","TCP","74","54869  >  443 [ACK] Seq=46122 Ack=6726 Win=4092 Len=0"
"123","1.142333","2620:1ec:21::14","2600:8805:3803:6100:c100:e220:6ae:755","TCP","74","443  >  54869 [ACK] Seq=6726 Ack=44268 Win=16385 Len=0"
"124","1.142666","2620:1ec:21::14","2600:8805:3803:6100:c100:e220:6ae:755","TCP","74","443  >  54869 [ACK] Seq=6726 Ack=45668 Win=16380 Len=0"
"125","1.146886","2620:1ec:21::14","2600:8805:3803:6100:c100:e220:6ae:755","TCP","74","443  >  54869 [ACK] Seq=6726 Ack=46122 Win=16385 Len=0"
"126","1.162846","2600:8805:3803:6100:c100:e220:6ae:755","2620:1ec:21::14","TCP","1474","54869  >  443 [ACK] Seq=46122 Ack=6726 Win=4096 Len=1400 [TCP segment of a reassembled PDU]"
"127","1.162853","2600:8805:3803:6100:c100:e220:6ae:755","2620:1ec:21::14","TCP","1474","54869  >  443 [ACK] Seq=47522 Ack=6726 Win=4096 Len=1400 [TCP segment of a reassembled PDU]"
"128","1.163204","2600:8805:3803:6100:c100:e220:6ae:755","2620:1ec:21::14","TLSv1.2","599","Application Data"
"129","1.179892","2620:1ec:21::14","2600:8805:3803:6100:c100:e220:6ae:755","TCP","74","443  >  54869 [ACK] Seq=6726 Ack=47522 Win=16380 Len=0"
"130","1.180332","2620:1ec:21::14","2600:8805:3803:6100:c100:e220:6ae:755","TCP","74","443  >  54869 [ACK] Seq=6726 Ack=48922 Win=16385 Len=0"
"131","1.180332","2620:1ec:21::14","2600:8805:3803:6100:c100:e220:6ae:755","TCP","74","443  >  54869 [ACK] Seq=6726 Ack=49447 Win=16383 Len=0"
"132","1.188267","2620:1ec:21::14","2600:8805:3803:6100:c100:e220:6ae:755","TLSv1.2","613","Application Data"
"133","1.188267","2620:1ec:21::14","2600:8805:3803:6100:c100:e220:6ae:755","TLSv1.2","112","Application Data"
"134","1.188365","2600:8805:3803:6100:c100:e220:6ae:755","2620:1ec:21::14","TCP","74","54869  >  443 [ACK] Seq=49447 Ack=7303 Win=4096 Len=0"
"135","1.189495","2600:8805:3803:6100:c100:e220:6ae:755","2620:1ec:21::14","TCP","1474","54869  >  443 [ACK] Seq=49447 Ack=7303 Win=4096 Len=1400 [TCP segment of a reassembled PDU]"
"136","1.189501","2600:8805:3803:6100:c100:e220:6ae:755","2620:1ec:21::14","TCP","1474","54869  >  443 [ACK] Seq=50847 Ack=7303 Win=4096 Len=1400 [TCP segment of a reassembled PDU]"
"137","1.189561","2600:8805:3803:6100:c100:e220:6ae:755","2620:1ec:21::14","TLSv1.2","335","Application Data"
"138","1.207390","2620:1ec:21::14","2600:8805:3803:6100:c100:e220:6ae:755","TCP","74","443  >  54869 [ACK] Seq=7303 Ack=50847 Win=16385 Len=0"
"139","1.207641","2620:1ec:21::14","2600:8805:3803:6100:c100:e220:6ae:755","TCP","74","443  >  54869 [ACK] Seq=7303 Ack=52508 Win=16385 Len=0"
"140","1.220527","2600:8805:3803:6100:c100:e220:6ae:755","2620:1ec:21::14","TCP","1474","54869  >  443 [ACK] Seq=52508 Ack=7303 Win=4096 Len=1400 [TCP segment of a reassembled PDU]"
"141","1.220533","2600:8805:3803:6100:c100:e220:6ae:755","2620:1ec:21::14","TCP","1474","54869  >  443 [ACK] Seq=53908 Ack=7303 Win=4096 Len=1400 [TCP segment of a reassembled PDU]"
"142","1.220603","2600:8805:3803:6100:c100:e220:6ae:755","2620:1ec:21::14","TLSv1.2","372","Application Data"
"143","1.220659","2600:8805:3803:6100:c100:e220:6ae:755","2620:1ec:21::14","TLSv1.2","135","Application Data"
"144","1.221144","2620:1ec:21::14","2600:8805:3803:6100:c100:e220:6ae:755","TLSv1.2","256","Application Data"
"145","1.221212","2600:8805:3803:6100:c100:e220:6ae:755","2620:1ec:21::14","TCP","74","54869  >  443 [ACK] Seq=55667 Ack=7485 Win=4096 Len=0"
"146","1.223108","2620:1ec:21::14","2600:8805:3803:6100:c100:e220:6ae:755","TLSv1.2","737","Application Data"
"147","1.223109","2620:1ec:21::14","2600:8805:3803:6100:c100:e220:6ae:755","TLSv1.2","112","Application Data"
"148","1.223677","2600:8805:3803:6100:c100:e220:6ae:755","2620:1ec:21::14","TCP","74","54869  >  443 [ACK] Seq=55667 Ack=8186 Win=4096 Len=0"
"149","1.243358","2620:1ec:21::14","2600:8805:3803:6100:c100:e220:6ae:755","TCP","74","443  >  54869 [ACK] Seq=8186 Ack=53908 Win=16380 Len=0"
"150","1.243359","2620:1ec:21::14","2600:8805:3803:6100:c100:e220:6ae:755","TCP","74","443  >  54869 [ACK] Seq=8186 Ack=55308 Win=16385 Len=0"
"151","1.243359","2620:1ec:21::14","2600:8805:3803:6100:c100:e220:6ae:755","TCP","74","443  >  54869 [ACK] Seq=8186 Ack=55667 Win=16384 Len=0"
"152","1.282203","2620:1ec:21::14","2600:8805:3803:6100:c100:e220:6ae:755","TLSv1.2","727","Application Data"
"153","1.282203","2620:1ec:21::14","2600:8805:3803:6100:c100:e220:6ae:755","TLSv1.2","112","Application Data"
"154","1.282314","2600:8805:3803:6100:c100:e220:6ae:755","2620:1ec:21::14","TCP","74","54869  >  443 [ACK] Seq=55667 Ack=8877 Win=4096 Len=0"
"155","1.292171","2620:1ec:21::14","2600:8805:3803:6100:c100:e220:6ae:755","TLSv1.2","791","Application Data"
"156","1.292172","2620:1ec:21::14","2600:8805:3803:6100:c100:e220:6ae:755","TLSv1.2","112","Application Data"
"157","1.292446","2600:8805:3803:6100:c100:e220:6ae:755","2620:1ec:21::14","TCP","74","54869  >  443 [ACK] Seq=55667 Ack=9632 Win=4096 Len=0"
"158","1.294396","2600:8805:3803:6100:c100:e220:6ae:755","2620:1ec:21::14","TCP","1474","54869  >  443 [ACK] Seq=55667 Ack=9632 Win=4096 Len=1400 [TCP segment of a reassembled PDU]"
"159","1.294402","2600:8805:3803:6100:c100:e220:6ae:755","2620:1ec:21::14","TCP","1474","54869  >  443 [ACK] Seq=57067 Ack=9632 Win=4096 Len=1400 [TCP segment of a reassembled PDU]"
"160","1.294489","2600:8805:3803:6100:c100:e220:6ae:755","2620:1ec:21::14","TLSv1.2","363","Application Data"
"161","1.294661","2600:8805:3803:6100:c100:e220:6ae:755","2620:1ec:21::14","TCP","1474","54869  >  443 [ACK] Seq=58756 Ack=9632 Win=4096 Len=1400 [TCP segment of a reassembled PDU]"
"162","1.294665","2600:8805:3803:6100:c100:e220:6ae:755","2620:1ec:21::14","TCP","1474","54869  >  443 [ACK] Seq=60156 Ack=9632 Win=4096 Len=1400 [TCP segment of a reassembled PDU]"
"163","1.294708","2600:8805:3803:6100:c100:e220:6ae:755","2620:1ec:21::14","TLSv1.2","299","Application Data"
"164","1.296227","2600:8805:3803:6100:c100:e220:6ae:755","2620:1ec:21::14","TCP","1474","54869  >  443 [ACK] Seq=61781 Ack=9632 Win=4096 Len=1400 [TCP segment of a reassembled PDU]"
"165","1.296235","2600:8805:3803:6100:c100:e220:6ae:755","2620:1ec:21::14","TCP","1474","54869  >  443 [ACK] Seq=63181 Ack=9632 Win=4096 Len=1400 [TCP segment of a reassembled PDU]"
"166","1.296292","2600:8805:3803:6100:c100:e220:6ae:755","2620:1ec:21::14","TLSv1.2","331","Application Data"
"167","1.299752","2600:8805:3803:6100:c100:e220:6ae:755","2620:1ec:21::14","TCP","1474","54869  >  443 [ACK] Seq=64838 Ack=9632 Win=4096 Len=1400 [TCP segment of a reassembled PDU]"
"168","1.299759","2600:8805:3803:6100:c100:e220:6ae:755","2620:1ec:21::14","TCP","1474","54869  >  443 [ACK] Seq=66238 Ack=9632 Win=4096 Len=1400 [TCP segment of a reassembled PDU]"
"169","1.299865","2600:8805:3803:6100:c100:e220:6ae:755","2620:1ec:21::14","TLSv1.2","309","Application Data"
"170","1.301741","2600:8805:3803:6100:c100:e220:6ae:755","2620:1ec:21::14","TCP","1474","54869  >  443 [ACK] Seq=67873 Ack=9632 Win=4096 Len=1400 [TCP segment of a reassembled PDU]"
"171","1.301746","2600:8805:3803:6100:c100:e220:6ae:755","2620:1ec:21::14","TCP","1474","54869  >  443 [ACK] Seq=69273 Ack=9632 Win=4096 Len=1400 [TCP segment of a reassembled PDU]"
"172","1.301830","2600:8805:3803:6100:c100:e220:6ae:755","2620:1ec:21::14","TLSv1.2","375","Application Data"
"173","1.307615","2620:1ec:21::14","2600:8805:3803:6100:c100:e220:6ae:755","TLSv1.2","738","Application Data"
"174","1.307616","2620:1ec:21::14","2600:8805:3803:6100:c100:e220:6ae:755","TLSv1.2","112","Application Data"
"175","1.307745","2600:8805:3803:6100:c100:e220:6ae:755","2620:1ec:21::14","TCP","74","54869  >  443 [ACK] Seq=70974 Ack=10334 Win=4096 Len=0"
"176","1.313970","2620:1ec:21::14","2600:8805:3803:6100:c100:e220:6ae:755","TCP","74","443  >  54869 [ACK] Seq=10334 Ack=57067 Win=16385 Len=0"
"177","1.314306","2620:1ec:21::14","2600:8805:3803:6100:c100:e220:6ae:755","TCP","74","443  >  54869 [ACK] Seq=10334 Ack=58756 Win=16385 Len=0"
"178","1.314306","2620:1ec:21::14","2600:8805:3803:6100:c100:e220:6ae:755","TCP","74","443  >  54869 [ACK] Seq=10334 Ack=60156 Win=16380 Len=0"
"179","1.314307","2620:1ec:21::14","2600:8805:3803:6100:c100:e220:6ae:755","TCP","74","443  >  54869 [ACK] Seq=10334 Ack=61781 Win=16385 Len=0"
"180","1.316818","2620:1ec:21::14","2600:8805:3803:6100:c100:e220:6ae:755","TCP","74","443  >  54869 [ACK] Seq=10334 Ack=64581 Win=16385 Len=0"
"181","1.321130","2620:1ec:21::14","2600:8805:3803:6100:c100:e220:6ae:755","TCP","74","443  >  54869 [ACK] Seq=10334 Ack=64838 Win=16384 Len=0"
"182","1.321373","2620:1ec:21::14","2600:8805:3803:6100:c100:e220:6ae:755","TCP","74","443  >  54869 [ACK] Seq=10334 Ack=66238 Win=16385 Len=0"
"183","1.322277","2620:1ec:21::14","2600:8805:3803:6100:c100:e220:6ae:755","TCP","74","443  >  54869 [ACK] Seq=10334 Ack=67873 Win=16385 Len=0"
"184","1.322677","2620:1ec:21::14","2600:8805:3803:6100:c100:e220:6ae:755","TCP","74","443  >  54869 [ACK] Seq=10334 Ack=70673 Win=16385 Len=0"
"185","1.326316","2620:1ec:21::14","2600:8805:3803:6100:c100:e220:6ae:755","TLSv1.2","608","Application Data"
"186","1.326316","2620:1ec:21::14","2600:8805:3803:6100:c100:e220:6ae:755","TLSv1.2","112","Application Data"
"187","1.326435","2600:8805:3803:6100:c100:e220:6ae:755","2620:1ec:21::14","TCP","74","54869  >  443 [ACK] Seq=70974 Ack=10906 Win=4096 Len=0"
"188","1.326695","2620:1ec:21::14","2600:8805:3803:6100:c100:e220:6ae:755","TCP","74","443  >  54869 [ACK] Seq=10906 Ack=70974 Win=16384 Len=0"
"189","1.328679","2600:8805:3803:6100:c100:e220:6ae:755","2620:1ec:21::14","TCP","1474","54869  >  443 [ACK] Seq=70974 Ack=10906 Win=4096 Len=1400 [TCP segment of a reassembled PDU]"
"190","1.328686","2600:8805:3803:6100:c100:e220:6ae:755","2620:1ec:21::14","TCP","1474","54869  >  443 [ACK] Seq=72374 Ack=10906 Win=4096 Len=1400 [TCP segment of a reassembled PDU]"
"191","1.328775","2600:8805:3803:6100:c100:e220:6ae:755","2620:1ec:21::14","TLSv1.2","335","Application Data"
"192","1.341984","2620:1ec:21::14","2600:8805:3803:6100:c100:e220:6ae:755","TLSv1.2","364","Application Data"
"193","1.342087","2600:8805:3803:6100:c100:e220:6ae:755","2620:1ec:21::14","TCP","74","54869  >  443 [ACK] Seq=74035 Ack=11196 Win=4096 Len=0"
"194","1.349479","2620:1ec:21::14","2600:8805:3803:6100:c100:e220:6ae:755","TCP","74","443  >  54869 [ACK] Seq=11196 Ack=72374 Win=16385 Len=0"
"195","1.349857","2620:1ec:21::14","2600:8805:3803:6100:c100:e220:6ae:755","TCP","74","443  >  54869 [ACK] Seq=11196 Ack=74035 Win=16385 Len=0"
"196","1.351523","2600:8805:3803:6100:c100:e220:6ae:755","2620:1ec:21::14","TLSv1.2","1041","Application Data"
"197","1.351634","2600:8805:3803:6100:c100:e220:6ae:755","2620:1ec:21::14","TCP","1474","54869  >  443 [ACK] Seq=75002 Ack=11196 Win=4096 Len=1400 [TCP segment of a reassembled PDU]"
"198","1.351664","2600:8805:3803:6100:c100:e220:6ae:755","2620:1ec:21::14","TLSv1.2","469","Application Data"
"199","1.369031","2620:1ec:21::14","2600:8805:3803:6100:c100:e220:6ae:755","TCP","74","443  >  54869 [ACK] Seq=11196 Ack=75002 Win=16381 Len=0"
"200","1.369996","2620:1ec:21::14","2600:8805:3803:6100:c100:e220:6ae:755","TCP","74","443  >  54869 [ACK] Seq=11196 Ack=76402 Win=16385 Len=0"
"201","1.370245","2620:1ec:21::14","2600:8805:3803:6100:c100:e220:6ae:755","TCP","74","443  >  54869 [ACK] Seq=11196 Ack=76797 Win=16384 Len=0"
"202","1.373305","2600:8805:3803:6100:c100:e220:6ae:755","2620:1ec:21::14","TCP","1474","54869  >  443 [ACK] Seq=76797 Ack=11196 Win=4096 Len=1400 [TCP segment of a reassembled PDU]"
"203","1.373351","2600:8805:3803:6100:c100:e220:6ae:755","2620:1ec:21::14","TLSv1.2","962","Application Data"
"204","1.373413","2600:8805:3803:6100:c100:e220:6ae:755","2620:1ec:21::14","TLSv1.2","381","Application Data"
"205","1.387221","2600:8805:3803:6100:c100:e220:6ae:755","2620:1ec:21::14","TLSv1.2","1187","Application Data"
"206","1.387322","2600:8805:3803:6100:c100:e220:6ae:755","2620:1ec:21::14","TCP","1474","54869  >  443 [ACK] Seq=80505 Ack=11196 Win=4096 Len=1400 [TCP segment of a reassembled PDU]"
"207","1.387337","2600:8805:3803:6100:c100:e220:6ae:755","2620:1ec:21::14","TLSv1.2","1081","Application Data"
"208","1.389662","2620:1ec:21::14","2600:8805:3803:6100:c100:e220:6ae:755","TCP","74","443  >  54869 [ACK] Seq=11196 Ack=78197 Win=16385 Len=0"
"209","1.390002","2620:1ec:21::14","2600:8805:3803:6100:c100:e220:6ae:755","TCP","74","443  >  54869 [ACK] Seq=11196 Ack=79085 Win=16382 Len=0"
"210","1.390002","2620:1ec:21::14","2600:8805:3803:6100:c100:e220:6ae:755","TCP","74","443  >  54869 [ACK] Seq=11196 Ack=79392 Win=16380 Len=0"
"211","1.403346","2620:1ec:21::14","2600:8805:3803:6100:c100:e220:6ae:755","TCP","74","443  >  54869 [ACK] Seq=11196 Ack=80505 Win=16385 Len=0"
"212","1.404045","2620:1ec:21::14","2600:8805:3803:6100:c100:e220:6ae:755","TCP","74","443  >  54869 [ACK] Seq=11196 Ack=81905 Win=16380 Len=0"
"213","1.404046","2620:1ec:21::14","2600:8805:3803:6100:c100:e220:6ae:755","TCP","74","443  >  54869 [ACK] Seq=11196 Ack=82912 Win=16385 Len=0"
"214","1.427717","2620:1ec:21::14","2600:8805:3803:6100:c100:e220:6ae:755","TLSv1.2","467","Application Data"
"215","1.428993","2600:8805:3803:6100:c100:e220:6ae:755","2620:1ec:21::14","TCP","74","54869  >  443 [ACK] Seq=82912 Ack=11589 Win=4096 Len=0"
"216","1.434107","2600:8805:3803:6100:c100:e220:6ae:755","2620:1ec:21::14","TLSv1.2","1179","Application Data"
"217","1.444477","2620:1ec:21::14","2600:8805:3803:6100:c100:e220:6ae:755","TLSv1.2","661","Application Data"
"218","1.445110","2620:1ec:21::14","2600:8805:3803:6100:c100:e220:6ae:755","TLSv1.2","112","Application Data"
"219","1.445848","2600:8805:3803:6100:c100:e220:6ae:755","2620:1ec:21::14","TCP","74","54869  >  443 [ACK] Seq=84017 Ack=12214 Win=4096 Len=0"
"220","1.448580","2600:8805:3803:6100:c100:e220:6ae:755","2620:1ec:21::14","TCP","1474","54869  >  443 [ACK] Seq=84017 Ack=12214 Win=4096 Len=1400 [TCP segment of a reassembled PDU]"
"221","1.448681","2600:8805:3803:6100:c100:e220:6ae:755","2620:1ec:21::14","TLSv1.2","989","Application Data"
"222","1.452104","2620:1ec:21::14","2600:8805:3803:6100:c100:e220:6ae:755","TCP","74","443  >  54869 [ACK] Seq=12214 Ack=84017 Win=16381 Len=0"
"223","1.465326","2620:1ec:21::14","2600:8805:3803:6100:c100:e220:6ae:755","TCP","74","443  >  54869 [ACK] Seq=12214 Ack=85417 Win=16385 Len=0"
"224","1.465326","2620:1ec:21::14","2600:8805:3803:6100:c100:e220:6ae:755","TCP","74","443  >  54869 [ACK] Seq=12214 Ack=86332 Win=16382 Len=0"
"225","1.473525","2600:8805:3803:6100:c100:e220:6ae:755","2620:1ec:21::14","TLSv1.2","1031","Application Data"
"226","1.476932","2600:8805:3803:6100:c100:e220:6ae:755","2620:1ec:21::14","TLSv1.2","457","Application Data"
"227","1.478652","2620:1ec:21::14","2600:8805:3803:6100:c100:e220:6ae:755","TCP","1514","443  >  54869 [ACK] Seq=12214 Ack=86332 Win=16382 Len=1440 [TCP segment of a reassembled PDU]"
"228","1.478995","2620:1ec:21::14","2600:8805:3803:6100:c100:e220:6ae:755","TCP","1514","443  >  54869 [ACK] Seq=13654 Ack=86332 Win=16382 Len=1440 [TCP segment of a reassembled PDU]"
"229","1.478995","2620:1ec:21::14","2600:8805:3803:6100:c100:e220:6ae:755","TLSv1.2","245","Application Data"
"230","1.478996","2620:1ec:21::14","2600:8805:3803:6100:c100:e220:6ae:755","TLSv1.2","112","Application Data"
"231","1.481064","2620:1ec:21::14","2600:8805:3803:6100:c100:e220:6ae:755","TLSv1.2","645","Application Data"
"232","1.481065","2620:1ec:21::14","2600:8805:3803:6100:c100:e220:6ae:755","TLSv1.2","112","Application Data"
"233","1.481279","2600:8805:3803:6100:c100:e220:6ae:755","2620:1ec:21::14","TCP","74","54869  >  443 [ACK] Seq=87672 Ack=15912 Win=4096 Len=0"
"234","1.484059","2620:1ec:21::14","2600:8805:3803:6100:c100:e220:6ae:755","TLSv1.2","548","Application Data"
"235","1.484060","2620:1ec:21::14","2600:8805:3803:6100:c100:e220:6ae:755","TLSv1.2","112","Application Data"
"236","1.484208","2600:8805:3803:6100:c100:e220:6ae:755","2620:1ec:21::14","TCP","74","54869  >  443 [ACK] Seq=87672 Ack=16424 Win=4096 Len=0"
"237","1.490966","2620:1ec:21::14","2600:8805:3803:6100:c100:e220:6ae:755","TCP","74","443  >  54869 [ACK] Seq=16424 Ack=87289 Win=16385 Len=0"
"238","1.500135","2620:1ec:21::14","2600:8805:3803:6100:c100:e220:6ae:755","TCP","74","443  >  54869 [ACK] Seq=16424 Ack=87672 Win=16384 Len=0"
"239","1.512650","2620:1ec:21::14","2600:8805:3803:6100:c100:e220:6ae:755","TLSv1.2","464","Application Data"
"240","1.512651","2620:1ec:21::14","2600:8805:3803:6100:c100:e220:6ae:755","TLSv1.2","112","Application Data"
"241","1.512721","2600:8805:3803:6100:c100:e220:6ae:755","2620:1ec:21::14","TCP","1474","54869  >  443 [ACK] Seq=87672 Ack=16424 Win=4096 Len=1400 [TCP segment of a reassembled PDU]"
"242","1.512774","2600:8805:3803:6100:c100:e220:6ae:755","2620:1ec:21::14","TLSv1.2","905","Application Data"
"243","1.529987","2620:1ec:21::14","2600:8805:3803:6100:c100:e220:6ae:755","TLSv1.2","462","Application Data"
"244","1.529988","2620:1ec:21::14","2600:8805:3803:6100:c100:e220:6ae:755","TLSv1.2","112","Application Data"
"245","1.530052","2600:8805:3803:6100:c100:e220:6ae:755","2620:1ec:21::14","TCP","74","54869  >  443 [ACK] Seq=89903 Ack=17278 Win=4089 Len=0"
"246","1.530947","2600:8805:3803:6100:c100:e220:6ae:755","2620:1ec:21::14","TCP","1474","54869  >  443 [ACK] Seq=89903 Ack=17278 Win=4096 Len=1400 [TCP segment of a reassembled PDU]"
"247","1.531056","2600:8805:3803:6100:c100:e220:6ae:755","2620:1ec:21::14","TLSv1.2","1111","Application Data"
"248","1.534796","2620:1ec:21::14","2600:8805:3803:6100:c100:e220:6ae:755","TLSv1.2","567","Application Data"
"249","1.534796","2620:1ec:21::14","2600:8805:3803:6100:c100:e220:6ae:755","TLSv1.2","112","Application Data"
"250","1.534949","2600:8805:3803:6100:c100:e220:6ae:755","2620:1ec:21::14","TCP","74","54869  >  443 [ACK] Seq=92340 Ack=17809 Win=4096 Len=0"
"251","1.535056","2620:1ec:21::14","2600:8805:3803:6100:c100:e220:6ae:755","TCP","86","[TCP Dup ACK 238#1] 443  >  54869 [ACK] Seq=17809 Ack=87672 Win=16384 Len=0 SLE=89072 SRE=89903"
"252","1.549334","2620:1ec:21::14","2600:8805:3803:6100:c100:e220:6ae:755","TLSv1.2","481","Application Data"
"253","1.549334","2620:1ec:21::14","2600:8805:3803:6100:c100:e220:6ae:755","TLSv1.2","112","Application Data"
"254","1.549516","2600:8805:3803:6100:c100:e220:6ae:755","2620:1ec:21::14","TCP","74","54869  >  443 [ACK] Seq=92340 Ack=18254 Win=4096 Len=0"
"255","1.550115","2600:8805:3803:6100:c100:e220:6ae:755","2620:1ec:21::14","TCP","1474","54869  >  443 [ACK] Seq=92340 Ack=18254 Win=4096 Len=1400 [TCP segment of a reassembled PDU]"
"256","1.550119","2600:8805:3803:6100:c100:e220:6ae:755","2620:1ec:21::14","TCP","1474","54869  >  443 [ACK] Seq=93740 Ack=18254 Win=4096 Len=1400 [TCP segment of a reassembled PDU]"
"257","1.550144","2600:8805:3803:6100:c100:e220:6ae:755","2620:1ec:21::14","TLSv1.2","331","Application Data"
"258","1.550744","2620:1ec:21::14","2600:8805:3803:6100:c100:e220:6ae:755","TCP","86","[TCP Dup ACK 238#2] 443  >  54869 [ACK] Seq=18254 Ack=87672 Win=16384 Len=0 SLE=89072 SRE=91303"
"259","1.550797","2600:8805:3803:6100:c100:e220:6ae:755","2620:1ec:21::14","TCP","1474","[TCP Fast Retransmission] 54869  >  443 [ACK] Seq=87672 Ack=18254 Win=4096 Len=1400"
"260","1.550827","2600:8805:3803:6100:c100:e220:6ae:755","2620:1ec:21::14","TCP","1474","[TCP Retransmission] 54869  >  443 [PSH, ACK] Seq=93997 Ack=18254 Win=4096 Len=1400 [TCP segment of a reassembled PDU]"
"261","1.555318","2620:1ec:21::14","2600:8805:3803:6100:c100:e220:6ae:755","TCP","86","[TCP Dup ACK 238#3] 443  >  54869 [ACK] Seq=18254 Ack=87672 Win=16384 Len=0 SLE=89072 SRE=92340"
"262","1.569706","2620:1ec:21::14","2600:8805:3803:6100:c100:e220:6ae:755","TLSv1.2","473","Application Data"
"263","1.569707","2620:1ec:21::14","2600:8805:3803:6100:c100:e220:6ae:755","TCP","86","[TCP Dup ACK 238#4] 443  >  54869 [ACK] Seq=18653 Ack=87672 Win=16384 Len=0 SLE=89072 SRE=93740"
"264","1.569865","2600:8805:3803:6100:c100:e220:6ae:755","2620:1ec:21::14","TCP","74","54869  >  443 [ACK] Seq=95397 Ack=18653 Win=4096 Len=0"
"265","1.570272","2620:1ec:21::14","2600:8805:3803:6100:c100:e220:6ae:755","TCP","86","[TCP Dup ACK 238#5] 443  >  54869 [ACK] Seq=18653 Ack=87672 Win=16384 Len=0 SLE=89072 SRE=95140"
"266","1.570273","2620:1ec:21::14","2600:8805:3803:6100:c100:e220:6ae:755","TCP","86","[TCP Dup ACK 238#6] 443  >  54869 [ACK] Seq=18653 Ack=87672 Win=16384 Len=0 SLE=89072 SRE=95397"
"267","1.570273","2620:1ec:21::14","2600:8805:3803:6100:c100:e220:6ae:755","TCP","74","443  >  54869 [ACK] Seq=18653 Ack=95397 Win=16385 Len=0"
"268","1.571044","2620:1ec:21::14","2600:8805:3803:6100:c100:e220:6ae:755","TCP","86","[TCP Dup ACK 267#1] 443  >  54869 [ACK] Seq=18653 Ack=95397 Win=16385 Len=0 SLE=93997 SRE=95397"
"269","1.584087","2620:1ec:21::14","2600:8805:3803:6100:c100:e220:6ae:755","TLSv1.2","503","Application Data"
"270","1.584087","2620:1ec:21::14","2600:8805:3803:6100:c100:e220:6ae:755","TLSv1.2","112","Application Data"
"271","1.584273","2600:8805:3803:6100:c100:e220:6ae:755","2620:1ec:21::14","TCP","74","54869  >  443 [ACK] Seq=95397 Ack=19120 Win=4096 Len=0"
"272","1.584892","2600:8805:3803:6100:c100:e220:6ae:755","2620:1ec:21::14","TCP","1474","54869  >  443 [ACK, CWR] Seq=95397 Ack=19120 Win=4096 Len=1400 [TCP segment of a reassembled PDU]"
"273","1.584897","2600:8805:3803:6100:c100:e220:6ae:755","2620:1ec:21::14","TCP","1474","54869  >  443 [ACK] Seq=96797 Ack=19120 Win=4096 Len=1400 [TCP segment of a reassembled PDU]"
"274","1.585339","2620:1ec:21::14","2600:8805:3803:6100:c100:e220:6ae:755","TLSv1.2","895","Application Data"
"275","1.585340","2620:1ec:21::14","2600:8805:3803:6100:c100:e220:6ae:755","TLSv1.2","112","Application Data"
"276","1.585565","2600:8805:3803:6100:c100:e220:6ae:755","2620:1ec:21::14","TCP","74","54869  >  443 [ACK] Seq=98197 Ack=19979 Win=4096 Len=0"
"277","1.601869","2620:1ec:21::14","2600:8805:3803:6100:c100:e220:6ae:755","TCP","74","443  >  54869 [ACK] Seq=19979 Ack=96797 Win=16380 Len=0"
"278","1.601960","2600:8805:3803:6100:c100:e220:6ae:755","2620:1ec:21::14","TLSv1.2","1474","Application Data"
"279","1.601962","2600:8805:3803:6100:c100:e220:6ae:755","2620:1ec:21::14","TCP","1474","54869  >  443 [ACK] Seq=99597 Ack=19979 Win=4096 Len=1400 [TCP segment of a reassembled PDU]"
"280","1.605382","2620:1ec:21::14","2600:8805:3803:6100:c100:e220:6ae:755","TCP","74","443  >  54869 [ACK] Seq=19979 Ack=98197 Win=16385 Len=0"
"281","1.605459","2600:8805:3803:6100:c100:e220:6ae:755","2620:1ec:21::14","TLSv1.2","611","Application Data"
"282","1.617572","2620:1ec:21::14","2600:8805:3803:6100:c100:e220:6ae:755","TCP","74","443  >  54869 [ACK] Seq=19979 Ack=99597 Win=16380 Len=0"
"283","1.617860","2620:1ec:21::14","2600:8805:3803:6100:c100:e220:6ae:755","TCP","74","443  >  54869 [ACK] Seq=19979 Ack=100997 Win=16385 Len=0"
"284","1.622598","2620:1ec:21::14","2600:8805:3803:6100:c100:e220:6ae:755","TCP","74","443  >  54869 [ACK] Seq=19979 Ack=101534 Win=16383 Len=0"
"285","1.624060","2620:1ec:21::14","2600:8805:3803:6100:c100:e220:6ae:755","TLSv1.2","535","Application Data"
"286","1.624061","2620:1ec:21::14","2600:8805:3803:6100:c100:e220:6ae:755","TLSv1.2","112","Application Data"
"287","1.624261","2600:8805:3803:6100:c100:e220:6ae:755","2620:1ec:21::14","TCP","74","54869  >  443 [ACK] Seq=101534 Ack=20478 Win=4096 Len=0"
"288","1.658301","2620:1ec:21::14","2600:8805:3803:6100:c100:e220:6ae:755","TLSv1.2","454","Application Data"
"289","1.658301","2620:1ec:21::14","2600:8805:3803:6100:c100:e220:6ae:755","TLSv1.2","112","Application Data"
