"No.","Time","Source","Destination","Protocol","Length","Info"
"1","0.000000","2600:8805:3803:6100:c100:e220:6ae:755","2620:1ec:21::14","TLSv1.2","1017","Application Data"
"2","0.000065","2600:8805:3803:6100:c100:e220:6ae:755","2620:1ec:21::14","TCP","1474","54869  >  443 [ACK] Seq=944 Ack=1 Win=4096 Len=1400 [TCP segment of a reassembled PDU]"
"3","0.000097","2600:8805:3803:6100:c100:e220:6ae:755","2620:1ec:21::14","TLSv1.2","476","Application Data"
"4","0.019925","2620:1ec:21::14","2600:8805:3803:6100:c100:e220:6ae:755","TCP","74","443  >  54869 [ACK] Seq=1 Ack=944 Win=16385 Len=0"
"5","0.020170","2620:1ec:21::14","2600:8805:3803:6100:c100:e220:6ae:755","TCP","74","443  >  54869 [ACK] Seq=1 Ack=2746 Win=16385 Len=0"
"6","0.094280","2620:1ec:21::14","2600:8805:3803:6100:c100:e220:6ae:755","TLSv1.2","421","Application Data"
"7","0.094338","2600:8805:3803:6100:c100:e220:6ae:755","2620:1ec:21::14","TCP","74","54869  >  443 [ACK] Seq=2746 Ack=348 Win=4090 Len=0"
"8","0.130641","2600:8805:3803:6100:c100:e220:6ae:755","2620:1ec:21::14","TCP","1474","54869  >  443 [ACK] Seq=2746 Ack=348 Win=4096 Len=1400 [TCP segment of a reassembled PDU]"
"9","0.130649","2600:8805:3803:6100:c100:e220:6ae:755","2620:1ec:21::14","TLSv1.2","955","Application Data"
"10","0.131872","2600:8805:3803:6100:c100:e220:6ae:755","2620:1ec:21::14","TLSv1.2","1058","Application Data"
"11","0.149857","2620:1ec:21::14","2600:8805:3803:6100:c100:e220:6ae:755","TCP","74","443  >  54869 [ACK] Seq=348 Ack=4146 Win=16380 Len=0"
"12","0.150291","2620:1ec:21::14","2600:8805:3803:6100:c100:e220:6ae:755","TCP","74","443  >  54869 [ACK] Seq=348 Ack=5027 Win=16385 Len=0"
"13","0.150291","2620:1ec:21::14","2600:8805:3803:6100:c100:e220:6ae:755","TCP","74","443  >  54869 [ACK] Seq=348 Ack=6011 Win=16381 Len=0"
"14","0.361520","2620:1ec:21::14","2600:8805:3803:6100:c100:e220:6ae:755","TLSv1.2","772","Application Data"
"15","0.361524","2620:1ec:21::14","2600:8805:3803:6100:c100:e220:6ae:755","TLSv1.2","112","Application Data"
"16","0.361690","2600:8805:3803:6100:c100:e220:6ae:755","2620:1ec:21::14","TCP","74","54869  >  443 [ACK] Seq=6011 Ack=1046 Win=4085 Len=0"
"17","0.361846","2600:8805:3803:6100:c100:e220:6ae:755","2620:1ec:21::14","TCP","74","54869  >  443 [ACK] Seq=6011 Ack=1084 Win=4084 Len=0"
"18","0.364425","2600:8805:3803:6100:c100:e220:6ae:755","2620:1ec:21::14","TLSv1.2","116","Application Data"
"19","0.377214","2600:8805:3803:6100:c100:e220:6ae:755","2620:1ec:21::14","TCP","1474","54869  >  443 [ACK] Seq=6053 Ack=1084 Win=4096 Len=1400 [TCP segment of a reassembled PDU]"
"20","0.377350","2600:8805:3803:6100:c100:e220:6ae:755","2620:1ec:21::14","TLSv1.2","961","Application Data"
"21","0.384313","2620:1ec:21::14","2600:8805:3803:6100:c100:e220:6ae:755","TCP","74","443  >  54869 [ACK] Seq=1084 Ack=6053 Win=16381 Len=0"
"22","0.392649","2620:1ec:21::14","2600:8805:3803:6100:c100:e220:6ae:755","TCP","74","443  >  54869 [ACK] Seq=1084 Ack=7453 Win=16385 Len=0"
"23","0.393195","2620:1ec:21::14","2600:8805:3803:6100:c100:e220:6ae:755","TCP","74","443  >  54869 [ACK] Seq=1084 Ack=8340 Win=16382 Len=0"
"24","0.417424","2600:8805:3803:6100:c100:e220:6ae:755","2620:1ec:21::14","TLSv1.2","1007","Application Data"
"25","0.419257","2600:8805:3803:6100:c100:e220:6ae:755","2620:1ec:21::14","TLSv1.2","465","Application Data"
"26","0.432442","2620:1ec:21::14","2600:8805:3803:6100:c100:e220:6ae:755","TCP","74","443  >  54869 [ACK] Seq=1084 Ack=9273 Win=16385 Len=0"
"27","0.437292","2620:1ec:21::14","2600:8805:3803:6100:c100:e220:6ae:755","TCP","74","443  >  54869 [ACK] Seq=1084 Ack=9664 Win=16384 Len=0"
"28","0.441259","2600:8805:3803:6100:c100:e220:6ae:755","2620:1ec:21::14","TCP","1474","54869  >  443 [ACK] Seq=9664 Ack=1084 Win=4096 Len=1400 [TCP segment of a reassembled PDU]"
"29","0.441806","2600:8805:3803:6100:c100:e220:6ae:755","2620:1ec:21::14","TLSv1.2","952","Application Data"
"30","0.456742","2620:1ec:21::14","2600:8805:3803:6100:c100:e220:6ae:755","TCP","74","443  >  54869 [ACK] Seq=1084 Ack=11064 Win=16385 Len=0"
"31","0.461531","2620:1ec:21::14","2600:8805:3803:6100:c100:e220:6ae:755","TCP","74","443  >  54869 [ACK] Seq=1084 Ack=11942 Win=16382 Len=0"
"32","0.496381","2620:1ec:21::14","2600:8805:3803:6100:c100:e220:6ae:755","TLSv1.2","250","Application Data"
"33","0.496445","2600:8805:3803:6100:c100:e220:6ae:755","2620:1ec:21::14","TCP","74","54869  >  443 [ACK] Seq=11942 Ack=1260 Win=4093 Len=0"
"34","0.537861","2620:1ec:21::14","2600:8805:3803:6100:c100:e220:6ae:755","TLSv1.2","791","Application Data"
"35","0.537862","2620:1ec:21::14","2600:8805:3803:6100:c100:e220:6ae:755","TLSv1.2","112","Application Data"
"36","0.537917","2600:8805:3803:6100:c100:e220:6ae:755","2620:1ec:21::14","TCP","74","54869  >  443 [ACK] Seq=11942 Ack=2015 Win=4084 Len=0"
"37","0.539031","2600:8805:3803:6100:c100:e220:6ae:755","2620:1ec:21::14","TLSv1.2","995","Application Data"
"38","0.554104","2620:1ec:21::14","2600:8805:3803:6100:c100:e220:6ae:755","TCP","74","443  >  54869 [ACK] Seq=2015 Ack=12863 Win=16385 Len=0"
"39","0.637740","2620:1ec:21::14","2600:8805:3803:6100:c100:e220:6ae:755","TLSv1.2","604","Application Data"
"40","0.637741","2620:1ec:21::14","2600:8805:3803:6100:c100:e220:6ae:755","TLSv1.2","112","Application Data"
"41","0.637806","2600:8805:3803:6100:c100:e220:6ae:755","2620:1ec:21::14","TCP","74","54869  >  443 [ACK] Seq=12863 Ack=2583 Win=4087 Len=0"
"42","0.638502","2600:8805:3803:6100:c100:e220:6ae:755","2620:1ec:21::14","TCP","1474","54869  >  443 [ACK] Seq=12863 Ack=2583 Win=4096 Len=1400 [TCP segment of a reassembled PDU]"
"43","0.638549","2600:8805:3803:6100:c100:e220:6ae:755","2620:1ec:21::14","TLSv1.2","962","Application Data"
"44","0.658658","2620:1ec:21::14","2600:8805:3803:6100:c100:e220:6ae:755","TCP","74","443  >  54869 [ACK] Seq=2583 Ack=14263 Win=16380 Len=0"
"45","0.659242","2620:1ec:21::14","2600:8805:3803:6100:c100:e220:6ae:755","TCP","74","[TCP Dup ACK 44#1] 443  >  54869 [ACK] Seq=2583 Ack=14263 Win=16380 Len=0"
"46","0.663418","2620:1ec:21::14","2600:8805:3803:6100:c100:e220:6ae:755","TCP","74","443  >  54869 [ACK] Seq=2583 Ack=15151 Win=16385 Len=0"
"47","0.690465","2620:1ec:21::14","2600:8805:3803:6100:c100:e220:6ae:755","TCP","1514","443  >  54869 [ACK] Seq=2583 Ack=15151 Win=16385 Len=1440 [TCP segment of a reassembled PDU]"
"48","0.690465","2620:1ec:21::14","2600:8805:3803:6100:c100:e220:6ae:755","TLSv1.2","255","Application Data"
"49","0.690524","2600:8805:3803:6100:c100:e220:6ae:755","2620:1ec:21::14","TCP","74","54869  >  443 [ACK] Seq=15151 Ack=4204 Win=4070 Len=0"
"50","0.690734","2620:1ec:21::14","2600:8805:3803:6100:c100:e220:6ae:755","TLSv1.2","112","Application Data"
"51","0.690761","2600:8805:3803:6100:c100:e220:6ae:755","2620:1ec:21::14","TCP","74","54869  >  443 [ACK] Seq=15151 Ack=4242 Win=4095 Len=0"
"52","0.713176","2620:1ec:21::14","2600:8805:3803:6100:c100:e220:6ae:755","TLSv1.2","115","Application Data"
"53","0.713232","2600:8805:3803:6100:c100:e220:6ae:755","2620:1ec:21::14","TCP","74","54869  >  443 [ACK] Seq=15151 Ack=4283 Win=4095 Len=0"
"54","0.713519","2620:1ec:21::14","2600:8805:3803:6100:c100:e220:6ae:755","TLSv1.2","117","Application Data"
"55","0.713567","2600:8805:3803:6100:c100:e220:6ae:755","2620:1ec:21::14","TCP","74","54869  >  443 [ACK] Seq=15151 Ack=4326 Win=4095 Len=0"
"56","0.715114","2600:8805:3803:6100:c100:e220:6ae:755","2620:1ec:21::14","TLSv1.2","116","Application Data"
"57","0.731552","2620:1ec:21::14","2600:8805:3803:6100:c100:e220:6ae:755","TCP","74","443  >  54869 [ACK] Seq=4326 Ack=15193 Win=16385 Len=0"
"58","0.740339","2620:1ec:21::14","2600:8805:3803:6100:c100:e220:6ae:755","TLSv1.2","607","Application Data"
"59","0.740339","2620:1ec:21::14","2600:8805:3803:6100:c100:e220:6ae:755","TLSv1.2","112","Application Data"
"60","0.740398","2600:8805:3803:6100:c100:e220:6ae:755","2620:1ec:21::14","TCP","74","54869  >  443 [ACK] Seq=15193 Ack=4897 Win=4087 Len=0"
"61","0.742331","2600:8805:3803:6100:c100:e220:6ae:755","2620:1ec:21::14","TLSv1.2","995","Application Data"
"62","0.761395","2620:1ec:21::14","2600:8805:3803:6100:c100:e220:6ae:755","TCP","74","443  >  54869 [ACK] Seq=4897 Ack=16114 Win=16381 Len=0"
"63","0.873970","2620:1ec:21::14","2600:8805:3803:6100:c100:e220:6ae:755","TLSv1.2","610","Application Data"
"64","0.873971","2620:1ec:21::14","2600:8805:3803:6100:c100:e220:6ae:755","TLSv1.2","112","Application Data"
"65","0.874040","2600:8805:3803:6100:c100:e220:6ae:755","2620:1ec:21::14","TCP","74","54869  >  443 [ACK] Seq=16114 Ack=5471 Win=4087 Len=0"
"66","0.874635","2600:8805:3803:6100:c100:e220:6ae:755","2620:1ec:21::14","TCP","1474","54869  >  443 [ACK] Seq=16114 Ack=5471 Win=4096 Len=1400 [TCP segment of a reassembled PDU]"
"67","0.874674","2600:8805:3803:6100:c100:e220:6ae:755","2620:1ec:21::14","TLSv1.2","962","Application Data"
"68","0.892002","2620:1ec:21::14","2600:8805:3803:6100:c100:e220:6ae:755","TCP","74","443  >  54869 [ACK] Seq=5471 Ack=17514 Win=16385 Len=0"
"69","0.892343","2620:1ec:21::14","2600:8805:3803:6100:c100:e220:6ae:755","TCP","74","443  >  54869 [ACK] Seq=5471 Ack=18402 Win=16382 Len=0"
"70","0.969051","2620:1ec:21::14","2600:8805:3803:6100:c100:e220:6ae:755","TLSv1.2","605","Application Data"
"71","0.969052","2620:1ec:21::14","2600:8805:3803:6100:c100:e220:6ae:755","TLSv1.2","112","Application Data"
"72","0.969112","2600:8805:3803:6100:c100:e220:6ae:755","2620:1ec:21::14","TCP","74","54869  >  443 [ACK] Seq=18402 Ack=6040 Win=4087 Len=0"
"73","0.987645","2620:1ec:21::14","2600:8805:3803:6100:c100:e220:6ae:755","TCP","1514","443  >  54869 [ACK] Seq=6040 Ack=18402 Win=16382 Len=1440 [TCP segment of a reassembled PDU]"
"74","0.987730","2600:8805:3803:6100:c100:e220:6ae:755","2620:1ec:21::14","TCP","74","54869  >  443 [ACK] Seq=18402 Ack=7480 Win=4073 Len=0"
"75","0.989059","2620:1ec:21::14","2600:8805:3803:6100:c100:e220:6ae:755","TCP","1514","443  >  54869 [ACK] Seq=7480 Ack=18402 Win=16382 Len=1440 [TCP segment of a reassembled PDU]"
"76","0.989059","2620:1ec:21::14","2600:8805:3803:6100:c100:e220:6ae:755","TCP","1514","443  >  54869 [ACK] Seq=8920 Ack=18402 Win=16382 Len=1440 [TCP segment of a reassembled PDU]"
"77","0.989060","2620:1ec:21::14","2600:8805:3803:6100:c100:e220:6ae:755","TLSv1.2","79","Application Data"
"78","0.989060","2620:1ec:21::14","2600:8805:3803:6100:c100:e220:6ae:755","TCP","1514","443  >  54869 [ACK] Seq=10365 Ack=18402 Win=16382 Len=1440 [TCP segment of a reassembled PDU]"
"79","0.989061","2620:1ec:21::14","2600:8805:3803:6100:c100:e220:6ae:755","TCP","1514","443  >  54869 [ACK] Seq=11805 Ack=18402 Win=16382 Len=1440 [TCP segment of a reassembled PDU]"
"80","0.989061","2620:1ec:21::14","2600:8805:3803:6100:c100:e220:6ae:755","TLSv1.2","659","Application Data"
"81","0.989061","2620:1ec:21::14","2600:8805:3803:6100:c100:e220:6ae:755","TCP","1514","443  >  54869 [ACK] Seq=13830 Ack=18402 Win=16382 Len=1440 [TCP segment of a reassembled PDU]"
"82","0.989062","2620:1ec:21::14","2600:8805:3803:6100:c100:e220:6ae:755","TCP","1514","443  >  54869 [ACK] Seq=15270 Ack=18402 Win=16382 Len=1440 [TCP segment of a reassembled PDU]"
"83","0.989062","2620:1ec:21::14","2600:8805:3803:6100:c100:e220:6ae:755","TLSv1.2","1328","Application Data"
"84","0.989100","2600:8805:3803:6100:c100:e220:6ae:755","2620:1ec:21::14","TCP","74","54869  >  443 [ACK] Seq=18402 Ack=17964 Win=3932 Len=0"
"85","0.989154","2600:8805:3803:6100:c100:e220:6ae:755","2620:1ec:21::14","TCP","74","[TCP Window Update] 54869  >  443 [ACK] Seq=18402 Ack=17964 Win=4096 Len=0"
"86","1.027732","2620:1ec:21::14","2600:8805:3803:6100:c100:e220:6ae:755","TCP","1514","443  >  54869 [ACK] Seq=17964 Ack=18402 Win=16382 Len=1440 [TCP segment of a reassembled PDU]"
"87","1.027792","2600:8805:3803:6100:c100:e220:6ae:755","2620:1ec:21::14","TCP","74","54869  >  443 [ACK] Seq=18402 Ack=19404 Win=4073 Len=0"
"88","1.028744","2620:1ec:21::14","2600:8805:3803:6100:c100:e220:6ae:755","TCP","1514","443  >  54869 [ACK] Seq=19404 Ack=18402 Win=16382 Len=1440 [TCP segment of a reassembled PDU]"
"89","1.028745","2620:1ec:21::14","2600:8805:3803:6100:c100:e220:6ae:755","TLSv1.2","1328","Application Data"
"90","1.028745","2620:1ec:21::14","2600:8805:3803:6100:c100:e220:6ae:755","TCP","1514","443  >  54869 [ACK] Seq=22098 Ack=18402 Win=16382 Len=1440 [TCP segment of a reassembled PDU]"
"91","1.028746","2620:1ec:21::14","2600:8805:3803:6100:c100:e220:6ae:755","TCP","1514","443  >  54869 [ACK] Seq=23538 Ack=18402 Win=16382 Len=1440 [TCP segment of a reassembled PDU]"
"92","1.028746","2620:1ec:21::14","2600:8805:3803:6100:c100:e220:6ae:755","TLSv1.2","1328","Application Data"
"93","1.028747","2620:1ec:21::14","2600:8805:3803:6100:c100:e220:6ae:755","TCP","1514","443  >  54869 [ACK] Seq=26232 Ack=18402 Win=16382 Len=1440 [TCP segment of a reassembled PDU]"
"94","1.028747","2620:1ec:21::14","2600:8805:3803:6100:c100:e220:6ae:755","TCP","1514","443  >  54869 [ACK] Seq=27672 Ack=18402 Win=16382 Len=1440 [TCP segment of a reassembled PDU]"
"95","1.028748","2620:1ec:21::14","2600:8805:3803:6100:c100:e220:6ae:755","TLSv1.2","1328","Application Data"
"96","1.028748","2620:1ec:21::14","2600:8805:3803:6100:c100:e220:6ae:755","TCP","1514","443  >  54869 [ACK] Seq=30366 Ack=18402 Win=16382 Len=1440 [TCP segment of a reassembled PDU]"
"97","1.028749","2620:1ec:21::14","2600:8805:3803:6100:c100:e220:6ae:755","TCP","1514","443  >  54869 [ACK] Seq=31806 Ack=18402 Win=16382 Len=1440 [TCP segment of a reassembled PDU]"
"98","1.030581","2620:1ec:21::14","2600:8805:3803:6100:c100:e220:6ae:755","TLSv1.2","1328","Application Data"
"99","1.030582","2620:1ec:21::14","2600:8805:3803:6100:c100:e220:6ae:755","TCP","1514","443  >  54869 [ACK] Seq=34500 Ack=18402 Win=16382 Len=1440 [TCP segment of a reassembled PDU]"
"100","1.030583","2620:1ec:21::14","2600:8805:3803:6100:c100:e220:6ae:755","TLSv1.2","999","Application Data"
"101","1.030583","2620:1ec:21::14","2600:8805:3803:6100:c100:e220:6ae:755","TLSv1.2","112","Application Data"
"102","1.038103","2600:8805:3803:6100:c100:e220:6ae:755","2620:1ec:21::14","TCP","74","54869  >  443 [ACK] Seq=18402 Ack=36903 Win=4096 Len=0"
"103","1.214471","2600:8805:3803:6100:c100:e220:6ae:755","2620:1ec:21::14","TLSv1.2","1007","Application Data"
"104","1.214915","2600:8805:3803:6100:c100:e220:6ae:755","2620:1ec:21::14","TCP","1474","54869  >  443 [ACK] Seq=19335 Ack=36903 Win=4096 Len=1400 [TCP segment of a reassembled PDU]"
"105","1.214966","2600:8805:3803:6100:c100:e220:6ae:755","2620:1ec:21::14","TLSv1.2","253","Application Data"
"106","1.226321","2600:8805:3803:6100:c100:e220:6ae:755","2620:1ec:21::14","TCP","1474","54869  >  443 [ACK] Seq=20914 Ack=36903 Win=4096 Len=1400 [TCP segment of a reassembled PDU]"
"107","1.226565","2600:8805:3803:6100:c100:e220:6ae:755","2620:1ec:21::14","TLSv1.2","1046","Application Data"
"108","1.226702","2600:8805:3803:6100:c100:e220:6ae:755","2620:1ec:21::14","TLSv1.2","1058","Application Data"
"109","1.229650","2620:1ec:21::14","2600:8805:3803:6100:c100:e220:6ae:755","TCP","74","443  >  54869 [ACK] Seq=36903 Ack=19335 Win=16385 Len=0"
"110","1.229708","2600:8805:3803:6100:c100:e220:6ae:755","2620:1ec:21::14","TCP","1474","54869  >  443 [ACK] Seq=24270 Ack=36903 Win=4096 Len=1400 [TCP segment of a reassembled PDU]"
"111","1.234001","2620:1ec:21::14","2600:8805:3803:6100:c100:e220:6ae:755","TCP","74","443  >  54869 [ACK] Seq=36903 Ack=20914 Win=16385 Len=0"
"112","1.234062","2600:8805:3803:6100:c100:e220:6ae:755","2620:1ec:21::14","TLSv1.2","876","Application Data"
"113","1.248552","2620:1ec:21::14","2600:8805:3803:6100:c100:e220:6ae:755","TCP","74","443  >  54869 [ACK] Seq=36903 Ack=22314 Win=16380 Len=0"
"114","1.248882","2620:1ec:21::14","2600:8805:3803:6100:c100:e220:6ae:755","TCP","74","443  >  54869 [ACK] Seq=36903 Ack=23286 Win=16385 Len=0"
"115","1.249244","2620:1ec:21::14","2600:8805:3803:6100:c100:e220:6ae:755","TCP","74","443  >  54869 [ACK] Seq=36903 Ack=24270 Win=16381 Len=0"
"116","1.249245","2620:1ec:21::14","2600:8805:3803:6100:c100:e220:6ae:755","TCP","74","443  >  54869 [ACK] Seq=36903 Ack=25670 Win=16385 Len=0"
"117","1.253904","2620:1ec:21::14","2600:8805:3803:6100:c100:e220:6ae:755","TCP","74","443  >  54869 [ACK] Seq=36903 Ack=26472 Win=16382 Len=0"
"118","1.294554","2620:1ec:21::14","2600:8805:3803:6100:c100:e220:6ae:755","TLSv1.2","476","Application Data"
"119","1.294684","2600:8805:3803:6100:c100:e220:6ae:755","2620:1ec:21::14","TCP","74","54869  >  443 [ACK] Seq=26472 Ack=37305 Win=4096 Len=0"
"120","1.333320","2620:1ec:21::14","2600:8805:3803:6100:c100:e220:6ae:755","TLSv1.2","681","Application Data"
"121","1.333321","2620:1ec:21::14","2600:8805:3803:6100:c100:e220:6ae:755","TLSv1.2","112","Application Data"
"122","1.333457","2600:8805:3803:6100:c100:e220:6ae:755","2620:1ec:21::14","TCP","74","54869  >  443 [ACK] Seq=26472 Ack=37950 Win=4096 Len=0"
"123","1.361274","2620:1ec:21::14","2600:8805:3803:6100:c100:e220:6ae:755","TLSv1.2","555","Application Data"
"124","1.361274","2620:1ec:21::14","2600:8805:3803:6100:c100:e220:6ae:755","TLSv1.2","112","Application Data"
"125","1.361443","2600:8805:3803:6100:c100:e220:6ae:755","2620:1ec:21::14","TCP","74","54869  >  443 [ACK] Seq=26472 Ack=38469 Win=4096 Len=0"
"126","1.511223","2620:1ec:21::14","2600:8805:3803:6100:c100:e220:6ae:755","TCP","1514","443  >  54869 [ACK] Seq=38469 Ack=26472 Win=16382 Len=1440 [TCP segment of a reassembled PDU]"
"127","1.511641","2620:1ec:21::14","2600:8805:3803:6100:c100:e220:6ae:755","TCP","1514","443  >  54869 [ACK] Seq=39909 Ack=26472 Win=16382 Len=1440 [TCP segment of a reassembled PDU]"
"128","1.511753","2600:8805:3803:6100:c100:e220:6ae:755","2620:1ec:21::14","TCP","74","54869  >  443 [ACK] Seq=26472 Ack=41349 Win=4096 Len=0"
"129","1.512131","2620:1ec:21::14","2600:8805:3803:6100:c100:e220:6ae:755","TLSv1.2","326","Application Data"
"130","1.512131","2620:1ec:21::14","2600:8805:3803:6100:c100:e220:6ae:755","TLSv1.2","112","Application Data"
"131","1.512302","2600:8805:3803:6100:c100:e220:6ae:755","2620:1ec:21::14","TCP","74","54869  >  443 [ACK] Seq=26472 Ack=41639 Win=4096 Len=0"
"132","1.768393","2600:8805:3803:6100:c100:e220:6ae:755","2620:1ec:21::14","TLSv1.2","1213","Application Data"
"133","1.783911","2620:1ec:21::14","2600:8805:3803:6100:c100:e220:6ae:755","TCP","74","443  >  54869 [ACK] Seq=41639 Ack=27611 Win=16385 Len=0"
"134","1.994468","2620:1ec:21::14","2600:8805:3803:6100:c100:e220:6ae:755","TCP","1514","443  >  54869 [ACK] Seq=41639 Ack=27611 Win=16385 Len=1440 [TCP segment of a reassembled PDU]"
"135","1.994526","2600:8805:3803:6100:c100:e220:6ae:755","2620:1ec:21::14","TCP","74","54869  >  443 [ACK] Seq=27611 Ack=43079 Win=4073 Len=0"
"136","1.995933","2620:1ec:21::14","2600:8805:3803:6100:c100:e220:6ae:755","TCP","1514","443  >  54869 [ACK] Seq=43079 Ack=27611 Win=16385 Len=1440 [TCP segment of a reassembled PDU]"
"137","1.995934","2620:1ec:21::14","2600:8805:3803:6100:c100:e220:6ae:755","TCP","1514","443  >  54869 [ACK] Seq=44519 Ack=27611 Win=16385 Len=1440 [TCP segment of a reassembled PDU]"
"138","1.995934","2620:1ec:21::14","2600:8805:3803:6100:c100:e220:6ae:755","TLSv1.2","904","Application Data"
"139","1.995934","2620:1ec:21::14","2600:8805:3803:6100:c100:e220:6ae:755","TLSv1.2","451","Application Data"
"140","1.995935","2620:1ec:21::14","2600:8805:3803:6100:c100:e220:6ae:755","TLSv1.2","112","Application Data"
"141","1.995967","2600:8805:3803:6100:c100:e220:6ae:755","2620:1ec:21::14","TCP","74","54869  >  443 [ACK] Seq=27611 Ack=47204 Win=4031 Len=0"
"142","1.996172","2600:8805:3803:6100:c100:e220:6ae:755","2620:1ec:21::14","TCP","74","[TCP Window Update] 54869  >  443 [ACK] Seq=27611 Ack=47204 Win=4096 Len=0"
"143","2.461654","2600:8805:3803:6100:c100:e220:6ae:755","2620:1ec:21::14","TCP","1474","54869  >  443 [ACK] Seq=27611 Ack=47204 Win=4096 Len=1400 [TCP segment of a reassembled PDU]"
"144","2.461709","2600:8805:3803:6100:c100:e220:6ae:755","2620:1ec:21::14","TLSv1.2","1046","Application Data"
"145","2.481320","2620:1ec:21::14","2600:8805:3803:6100:c100:e220:6ae:755","TCP","74","443  >  54869 [ACK] Seq=47204 Ack=29011 Win=16380 Len=0"
"146","2.481661","2620:1ec:21::14","2600:8805:3803:6100:c100:e220:6ae:755","TCP","74","443  >  54869 [ACK] Seq=47204 Ack=29983 Win=16385 Len=0"
"147","2.497358","2600:8805:3803:6100:c100:e220:6ae:755","2620:1ec:21::14","TLSv1.2","981","Application Data"
"148","2.497806","2600:8805:3803:6100:c100:e220:6ae:755","2620:1ec:21::14","TLSv1.2","703","Application Data"
"149","2.518573","2620:1ec:21::14","2600:8805:3803:6100:c100:e220:6ae:755","TCP","74","443  >  54869 [ACK] Seq=47204 Ack=31519 Win=16385 Len=0"
"150","2.604829","2620:1ec:21::14","2600:8805:3803:6100:c100:e220:6ae:755","TLSv1.2","268","Application Data"
"151","2.604894","2600:8805:3803:6100:c100:e220:6ae:755","2620:1ec:21::14","TCP","74","54869  >  443 [ACK] Seq=31519 Ack=47398 Win=4092 Len=0"
"152","2.888027","2620:1ec:21::14","2600:8805:3803:6100:c100:e220:6ae:755","TCP","1514","443  >  54869 [ACK] Seq=47398 Ack=31519 Win=16385 Len=1440 [TCP segment of a reassembled PDU]"
"153","2.888163","2600:8805:3803:6100:c100:e220:6ae:755","2620:1ec:21::14","TCP","74","54869  >  443 [ACK] Seq=31519 Ack=48838 Win=4073 Len=0"
"154","2.889118","2620:1ec:21::14","2600:8805:3803:6100:c100:e220:6ae:755","TCP","1514","443  >  54869 [ACK] Seq=48838 Ack=31519 Win=16385 Len=1440 [TCP segment of a reassembled PDU]"
"155","2.889119","2620:1ec:21::14","2600:8805:3803:6100:c100:e220:6ae:755","TLSv1.2","1494","Application Data"
"156","2.889119","2620:1ec:21::14","2600:8805:3803:6100:c100:e220:6ae:755","TCP","1514","443  >  54869 [ACK] Seq=51698 Ack=31519 Win=16385 Len=1440 [TCP segment of a reassembled PDU]"
"157","2.889120","2620:1ec:21::14","2600:8805:3803:6100:c100:e220:6ae:755","TCP","1514","443  >  54869 [ACK] Seq=53138 Ack=31519 Win=16385 Len=1440 [TCP segment of a reassembled PDU]"
"158","2.889120","2620:1ec:21::14","2600:8805:3803:6100:c100:e220:6ae:755","TLSv1.2","695","Application Data"
"159","2.889120","2620:1ec:21::14","2600:8805:3803:6100:c100:e220:6ae:755","TCP","1514","443  >  54869 [ACK] Seq=55199 Ack=31519 Win=16385 Len=1440 [TCP segment of a reassembled PDU]"
"160","2.889121","2620:1ec:21::14","2600:8805:3803:6100:c100:e220:6ae:755","TCP","1514","443  >  54869 [ACK] Seq=56639 Ack=31519 Win=16385 Len=1440 [TCP segment of a reassembled PDU]"
"161","2.889135","2620:1ec:21::14","2600:8805:3803:6100:c100:e220:6ae:755","TLSv1.2","1328","Application Data"
"162","2.889222","2600:8805:3803:6100:c100:e220:6ae:755","2620:1ec:21::14","TCP","74","54869  >  443 [ACK] Seq=31519 Ack=59333 Win=3932 Len=0"
"163","2.889557","2600:8805:3803:6100:c100:e220:6ae:755","2620:1ec:21::14","TCP","74","[TCP Window Update] 54869  >  443 [ACK] Seq=31519 Ack=59333 Win=4096 Len=0"
"164","2.928375","2620:1ec:21::14","2600:8805:3803:6100:c100:e220:6ae:755","TCP","1514","443  >  54869 [ACK] Seq=59333 Ack=31519 Win=16385 Len=1440 [TCP segment of a reassembled PDU]"
"165","2.928436","2600:8805:3803:6100:c100:e220:6ae:755","2620:1ec:21::14","TCP","74","54869  >  443 [ACK] Seq=31519 Ack=60773 Win=4073 Len=0"
"166","2.929132","2620:1ec:21::14","2600:8805:3803:6100:c100:e220:6ae:755","TCP","1514","443  >  54869 [ACK] Seq=60773 Ack=31519 Win=16385 Len=1440 [TCP segment of a reassembled PDU]"
"167","2.929133","2620:1ec:21::14","2600:8805:3803:6100:c100:e220:6ae:755","TLSv1.2","1328","Application Data"
"168","2.929133","2620:1ec:21::14","2600:8805:3803:6100:c100:e220:6ae:755","TCP","1514","443  >  54869 [ACK] Seq=63467 Ack=31519 Win=16385 Len=1440 [TCP segment of a reassembled PDU]"
"169","2.929134","2620:1ec:21::14","2600:8805:3803:6100:c100:e220:6ae:755","TCP","1514","443  >  54869 [ACK] Seq=64907 Ack=31519 Win=16385 Len=1440 [TCP segment of a reassembled PDU]"
"170","2.929134","2620:1ec:21::14","2600:8805:3803:6100:c100:e220:6ae:755","TLSv1.2","1328","Application Data"
"171","2.929135","2620:1ec:21::14","2600:8805:3803:6100:c100:e220:6ae:755","TCP","1514","443  >  54869 [ACK] Seq=67601 Ack=31519 Win=16385 Len=1440 [TCP segment of a reassembled PDU]"
"172","2.929135","2620:1ec:21::14","2600:8805:3803:6100:c100:e220:6ae:755","TCP","1514","443  >  54869 [ACK] Seq=69041 Ack=31519 Win=16385 Len=1440 [TCP segment of a reassembled PDU]"
"173","2.929135","2620:1ec:21::14","2600:8805:3803:6100:c100:e220:6ae:755","TLSv1.2","1328","Application Data"
"174","2.929136","2620:1ec:21::14","2600:8805:3803:6100:c100:e220:6ae:755","TCP","1514","443  >  54869 [ACK] Seq=71735 Ack=31519 Win=16385 Len=1440 [TCP segment of a reassembled PDU]"
"175","2.929136","2620:1ec:21::14","2600:8805:3803:6100:c100:e220:6ae:755","TCP","1514","443  >  54869 [ACK] Seq=73175 Ack=31519 Win=16385 Len=1440 [TCP segment of a reassembled PDU]"
"176","2.929137","2620:1ec:21::14","2600:8805:3803:6100:c100:e220:6ae:755","TLSv1.2","1328","Application Data"
"177","2.929137","2620:1ec:21::14","2600:8805:3803:6100:c100:e220:6ae:755","TCP","1514","443  >  54869 [ACK] Seq=75869 Ack=31519 Win=16385 Len=1440 [TCP segment of a reassembled PDU]"
"178","2.929137","2620:1ec:21::14","2600:8805:3803:6100:c100:e220:6ae:755","TCP","1514","443  >  54869 [ACK] Seq=77309 Ack=31519 Win=16385 Len=1440 [TCP segment of a reassembled PDU]"
"179","2.929138","2620:1ec:21::14","2600:8805:3803:6100:c100:e220:6ae:755","TLSv1.2","1328","Application Data"
"180","2.929138","2620:1ec:21::14","2600:8805:3803:6100:c100:e220:6ae:755","TCP","1514","443  >  54869 [ACK] Seq=80003 Ack=31519 Win=16385 Len=1440 [TCP segment of a reassembled PDU]"
"181","2.929138","2620:1ec:21::14","2600:8805:3803:6100:c100:e220:6ae:755","TLSv1.2","1167","Application Data"
"182","2.929139","2620:1ec:21::14","2600:8805:3803:6100:c100:e220:6ae:755","TLSv1.2","112","Application Data"
"183","2.929208","2600:8805:3803:6100:c100:e220:6ae:755","2620:1ec:21::14","TCP","74","54869  >  443 [ACK] Seq=31519 Ack=75869 Win=3860 Len=0"
"184","2.929249","2600:8805:3803:6100:c100:e220:6ae:755","2620:1ec:21::14","TCP","74","54869  >  443 [ACK] Seq=31519 Ack=82574 Win=3755 Len=0"
"185","2.929373","2600:8805:3803:6100:c100:e220:6ae:755","2620:1ec:21::14","TCP","74","[TCP Window Update] 54869  >  443 [ACK] Seq=31519 Ack=82574 Win=4096 Len=0"
"186","3.399618","2600:8805:3803:6100:c100:e220:6ae:755","2620:1ec:21::14","TCP","1474","54869  >  443 [ACK] Seq=31519 Ack=82574 Win=4096 Len=1400 [TCP segment of a reassembled PDU]"
"187","3.399725","2600:8805:3803:6100:c100:e220:6ae:755","2620:1ec:21::14","TLSv1.2","919","Application Data"
"188","3.399794","2600:8805:3803:6100:c100:e220:6ae:755","2620:1ec:21::14","TLSv1.2","135","Application Data"
"189","3.400728","2600:8805:3803:6100:c100:e220:6ae:755","2620:1ec:21::14","TLSv1.2","976","Application Data"
"190","3.400896","2600:8805:3803:6100:c100:e220:6ae:755","2620:1ec:21::14","TCP","1474","54869  >  443 [ACK] Seq=34727 Ack=82574 Win=4096 Len=1400 [TCP segment of a reassembled PDU]"
"191","3.400925","2600:8805:3803:6100:c100:e220:6ae:755","2620:1ec:21::14","TLSv1.2","989","Application Data"
"192","3.400957","2600:8805:3803:6100:c100:e220:6ae:755","2620:1ec:21::14","TLSv1.2","461","Application Data"
"193","3.418038","2620:1ec:21::14","2600:8805:3803:6100:c100:e220:6ae:755","TCP","74","443  >  54869 [ACK] Seq=82574 Ack=32919 Win=16380 Len=0"
"194","3.418039","2620:1ec:21::14","2600:8805:3803:6100:c100:e220:6ae:755","TCP","74","443  >  54869 [ACK] Seq=82574 Ack=33825 Win=16385 Len=0"
"195","3.419148","2620:1ec:21::14","2600:8805:3803:6100:c100:e220:6ae:755","TCP","74","443  >  54869 [ACK] Seq=82574 Ack=34727 Win=16382 Len=0"
"196","3.420313","2620:1ec:21::14","2600:8805:3803:6100:c100:e220:6ae:755","TCP","74","443  >  54869 [ACK] Seq=82574 Ack=37042 Win=16385 Len=0"
"197","3.420858","2620:1ec:21::14","2600:8805:3803:6100:c100:e220:6ae:755","TCP","74","443  >  54869 [ACK] Seq=82574 Ack=37429 Win=16384 Len=0"
"198","3.477652","2620:1ec:21::14","2600:8805:3803:6100:c100:e220:6ae:755","TLSv1.2","541","Application Data"
"199","3.477720","2600:8805:3803:6100:c100:e220:6ae:755","2620:1ec:21::14","TCP","74","54869  >  443 [ACK] Seq=37429 Ack=83041 Win=4088 Len=0"
"200","3.494097","2620:1ec:21::14","2600:8805:3803:6100:c100:e220:6ae:755","TLSv1.2","1053","Application Data, Application Data"
"201","3.494097","2620:1ec:21::14","2600:8805:3803:6100:c100:e220:6ae:755","TLSv1.2","112","Application Data"
"202","3.494155","2600:8805:3803:6100:c100:e220:6ae:755","2620:1ec:21::14","TCP","74","54869  >  443 [ACK] Seq=37429 Ack=84058 Win=4080 Len=0"
"203","3.495722","2600:8805:3803:6100:c100:e220:6ae:755","2620:1ec:21::14","TLSv1.2","964","Application Data"
"204","3.514547","2620:1ec:21::14","2600:8805:3803:6100:c100:e220:6ae:755","TCP","74","443  >  54869 [ACK] Seq=84058 Ack=38319 Win=16380 Len=0"
"205","3.587835","2620:1ec:21::14","2600:8805:3803:6100:c100:e220:6ae:755","TLSv1.2","604","Application Data"
"206","3.587929","2600:8805:3803:6100:c100:e220:6ae:755","2620:1ec:21::14","TCP","74","54869  >  443 [ACK] Seq=38319 Ack=84588 Win=4087 Len=0"
"207","3.588050","2620:1ec:21::14","2600:8805:3803:6100:c100:e220:6ae:755","TLSv1.2","112","Application Data"
"208","3.588096","2600:8805:3803:6100:c100:e220:6ae:755","2620:1ec:21::14","TCP","74","54869  >  443 [ACK] Seq=38319 Ack=84626 Win=4087 Len=0"
"209","3.589829","2600:8805:3803:6100:c100:e220:6ae:755","2620:1ec:21::14","TCP","1474","54869  >  443 [ACK] Seq=38319 Ack=84626 Win=4096 Len=1400 [TCP segment of a reassembled PDU]"
"210","3.589888","2600:8805:3803:6100:c100:e220:6ae:755","2620:1ec:21::14","TLSv1.2","999","Application Data"
"211","3.610383","2620:1ec:21::14","2600:8805:3803:6100:c100:e220:6ae:755","TCP","74","443  >  54869 [ACK] Seq=84626 Ack=39719 Win=16385 Len=0"
"212","3.611046","2620:1ec:21::14","2600:8805:3803:6100:c100:e220:6ae:755","TCP","74","443  >  54869 [ACK] Seq=84626 Ack=40644 Win=16382 Len=0"
"213","3.671703","2600:8805:3803:6100:c100:e220:6ae:755","2620:1ec:21::14","TLSv1.2","1074","Application Data"
"214","3.671901","2600:8805:3803:6100:c100:e220:6ae:755","2620:1ec:21::14","TLSv1.2","135","Application Data"
"215","3.679516","2620:1ec:21::14","2600:8805:3803:6100:c100:e220:6ae:755","TLSv1.2","602","Application Data"
"216","3.679517","2620:1ec:21::14","2600:8805:3803:6100:c100:e220:6ae:755","TLSv1.2","112","Application Data"
"217","3.679593","2600:8805:3803:6100:c100:e220:6ae:755","2620:1ec:21::14","TCP","74","54869  >  443 [ACK] Seq=41705 Ack=85192 Win=4087 Len=0"
"218","3.680581","2600:8805:3803:6100:c100:e220:6ae:755","2620:1ec:21::14","TCP","1474","54869  >  443 [ACK] Seq=41705 Ack=85192 Win=4096 Len=1400 [TCP segment of a reassembled PDU]"
"219","3.680634","2600:8805:3803:6100:c100:e220:6ae:755","2620:1ec:21::14","TLSv1.2","999","Application Data"
"220","3.687391","2620:1ec:21::14","2600:8805:3803:6100:c100:e220:6ae:755","TCP","74","443  >  54869 [ACK] Seq=85192 Ack=41644 Win=16385 Len=0"
"221","3.693093","2620:1ec:21::14","2600:8805:3803:6100:c100:e220:6ae:755","TCP","74","443  >  54869 [ACK] Seq=85192 Ack=41705 Win=16385 Len=0"
"222","3.697963","2620:1ec:21::14","2600:8805:3803:6100:c100:e220:6ae:755","TCP","74","443  >  54869 [ACK] Seq=85192 Ack=43105 Win=16385 Len=0"
"223","3.698610","2620:1ec:21::14","2600:8805:3803:6100:c100:e220:6ae:755","TCP","74","443  >  54869 [ACK] Seq=85192 Ack=44030 Win=16382 Len=0"
"224","3.755101","2600:8805:3803:6100:c100:e220:6ae:755","2620:1ec:21::14","TCP","1474","54869  >  443 [ACK] Seq=44030 Ack=85192 Win=4096 Len=1400 [TCP segment of a reassembled PDU]"
"225","3.755107","2600:8805:3803:6100:c100:e220:6ae:755","2620:1ec:21::14","TCP","1474","54869  >  443 [ACK] Seq=45430 Ack=85192 Win=4096 Len=1400 [TCP segment of a reassembled PDU]"
"226","3.755109","2600:8805:3803:6100:c100:e220:6ae:755","2620:1ec:21::14","TCP","1474","54869  >  443 [ACK] Seq=46830 Ack=85192 Win=4096 Len=1400 [TCP segment of a reassembled PDU]"
"227","3.755111","2600:8805:3803:6100:c100:e220:6ae:755","2620:1ec:21::14","TCP","1474","54869  >  443 [ACK] Seq=48230 Ack=85192 Win=4096 Len=1400 [TCP segment of a reassembled PDU]"
"228","3.755207","2600:8805:3803:6100:c100:e220:6ae:755","2620:1ec:21::14","TLSv1.2","905","Application Data"
"229","3.755293","2600:8805:3803:6100:c100:e220:6ae:755","2620:1ec:21::14","TLSv1.2","443","Application Data"
"230","3.772663","2620:1ec:21::14","2600:8805:3803:6100:c100:e220:6ae:755","TCP","74","443  >  54869 [ACK] Seq=85192 Ack=45430 Win=16385 Len=0"
"231","3.772961","2620:1ec:21::14","2600:8805:3803:6100:c100:e220:6ae:755","TCP","74","443  >  54869 [ACK] Seq=85192 Ack=46830 Win=16380 Len=0"
"232","3.774859","2620:1ec:21::14","2600:8805:3803:6100:c100:e220:6ae:755","TCP","74","443  >  54869 [ACK] Seq=85192 Ack=48230 Win=16385 Len=0"
"233","3.780676","2620:1ec:21::14","2600:8805:3803:6100:c100:e220:6ae:755","TCP","74","443  >  54869 [ACK] Seq=85192 Ack=49630 Win=16380 Len=0"
"234","3.780677","2620:1ec:21::14","2600:8805:3803:6100:c100:e220:6ae:755","TCP","74","443  >  54869 [ACK] Seq=85192 Ack=50830 Win=16385 Len=0"
"235","3.784804","2620:1ec:21::14","2600:8805:3803:6100:c100:e220:6ae:755","TLSv1.2","604","Application Data"
"236","3.784805","2620:1ec:21::14","2600:8805:3803:6100:c100:e220:6ae:755","TLSv1.2","112","Application Data"
"237","3.784899","2600:8805:3803:6100:c100:e220:6ae:755","2620:1ec:21::14","TCP","74","54869  >  443 [ACK] Seq=50830 Ack=85760 Win=4087 Len=0"
"238","3.793083","2600:8805:3803:6100:c100:e220:6ae:755","2620:1ec:21::14","TCP","1474","54869  >  443 [ACK] Seq=50830 Ack=85760 Win=4096 Len=1400 [TCP segment of a reassembled PDU]"
"239","3.793090","2600:8805:3803:6100:c100:e220:6ae:755","2620:1ec:21::14","TCP","1474","54869  >  443 [ACK] Seq=52230 Ack=85760 Win=4096 Len=1400 [TCP segment of a reassembled PDU]"
"240","3.793174","2600:8805:3803:6100:c100:e220:6ae:755","2620:1ec:21::14","TLSv1.2","319","Application Data"
"241","3.803446","2620:1ec:21::14","2600:8805:3803:6100:c100:e220:6ae:755","TLSv1.2","415","Application Data"
"242","3.803518","2600:8805:3803:6100:c100:e220:6ae:755","2620:1ec:21::14","TCP","74","54869  >  443 [ACK] Seq=53875 Ack=86101 Win=4090 Len=0"
"243","3.810035","2620:1ec:21::14","2600:8805:3803:6100:c100:e220:6ae:755","TCP","74","443  >  54869 [ACK] Seq=86101 Ack=52230 Win=16380 Len=0"
"244","3.810789","2620:1ec:21::14","2600:8805:3803:6100:c100:e220:6ae:755","TCP","74","443  >  54869 [ACK] Seq=86101 Ack=53630 Win=16385 Len=0"
"245","3.815235","2620:1ec:21::14","2600:8805:3803:6100:c100:e220:6ae:755","TCP","74","443  >  54869 [ACK] Seq=86101 Ack=53875 Win=16384 Len=0"
"246","3.891603","2620:1ec:21::14","2600:8805:3803:6100:c100:e220:6ae:755","TLSv1.2","806","Application Data, Application Data"
"247","3.891604","2620:1ec:21::14","2600:8805:3803:6100:c100:e220:6ae:755","TLSv1.2","112","Application Data"
"248","3.891662","2600:8805:3803:6100:c100:e220:6ae:755","2620:1ec:21::14","TCP","74","54869  >  443 [ACK] Seq=53875 Ack=86871 Win=4083 Len=0"
"249","3.921094","2600:8805:3803:6100:c100:e220:6ae:755","2620:1ec:21::14","TCP","1474","54869  >  443 [ACK] Seq=53875 Ack=86871 Win=4096 Len=1400 [TCP segment of a reassembled PDU]"
"250","3.921100","2600:8805:3803:6100:c100:e220:6ae:755","2620:1ec:21::14","TCP","1474","54869  >  443 [ACK] Seq=55275 Ack=86871 Win=4096 Len=1400 [TCP segment of a reassembled PDU]"
"251","3.921180","2600:8805:3803:6100:c100:e220:6ae:755","2620:1ec:21::14","TLSv1.2","331","Application Data"
"252","3.931369","2600:8805:3803:6100:c100:e220:6ae:755","2620:1ec:21::14","TCP","1474","54869  >  443 [ACK] Seq=56932 Ack=86871 Win=4096 Len=1400 [TCP segment of a reassembled PDU]"
"253","3.931375","2600:8805:3803:6100:c100:e220:6ae:755","2620:1ec:21::14","TCP","1474","54869  >  443 [ACK] Seq=58332 Ack=86871 Win=4096 Len=1400 [TCP segment of a reassembled PDU]"
"254","3.931454","2600:8805:3803:6100:c100:e220:6ae:755","2620:1ec:21::14","TLSv1.2","436","Application Data"
"255","3.937888","2620:1ec:21::14","2600:8805:3803:6100:c100:e220:6ae:755","TCP","74","443  >  54869 [ACK] Seq=86871 Ack=55275 Win=16385 Len=0"
"256","3.938450","2620:1ec:21::14","2600:8805:3803:6100:c100:e220:6ae:755","TCP","74","443  >  54869 [ACK] Seq=86871 Ack=56675 Win=16380 Len=0"
"257","3.938451","2620:1ec:21::14","2600:8805:3803:6100:c100:e220:6ae:755","TCP","74","443  >  54869 [ACK] Seq=86871 Ack=56932 Win=16385 Len=0"
"258","3.940514","2600:8805:3803:6100:c100:e220:6ae:755","2620:1ec:21::14","TCP","1474","54869  >  443 [ACK] Seq=60094 Ack=86871 Win=4096 Len=1400 [TCP segment of a reassembled PDU]"
"259","3.940519","2600:8805:3803:6100:c100:e220:6ae:755","2620:1ec:21::14","TCP","1474","54869  >  443 [ACK] Seq=61494 Ack=86871 Win=4096 Len=1400 [TCP segment of a reassembled PDU]"
"260","3.940588","2600:8805:3803:6100:c100:e220:6ae:755","2620:1ec:21::14","TLSv1.2","311","Application Data"
"261","3.940697","2600:8805:3803:6100:c100:e220:6ae:755","2620:1ec:21::14","TCP","1474","54869  >  443 [ACK] Seq=63131 Ack=86871 Win=4096 Len=1400 [TCP segment of a reassembled PDU]"
"262","3.940699","2600:8805:3803:6100:c100:e220:6ae:755","2620:1ec:21::14","TCP","1474","54869  >  443 [ACK] Seq=64531 Ack=86871 Win=4096 Len=1400 [TCP segment of a reassembled PDU]"
"263","3.940714","2600:8805:3803:6100:c100:e220:6ae:755","2620:1ec:21::14","TLSv1.2","274","Application Data"
"264","3.952799","2620:1ec:21::14","2600:8805:3803:6100:c100:e220:6ae:755","TCP","74","443  >  54869 [ACK] Seq=86871 Ack=58332 Win=16380 Len=0"
"265","3.953259","2620:1ec:21::14","2600:8805:3803:6100:c100:e220:6ae:755","TCP","74","443  >  54869 [ACK] Seq=86871 Ack=60094 Win=16385 Len=0"
"266","3.958042","2620:1ec:21::14","2600:8805:3803:6100:c100:e220:6ae:755","TCP","74","443  >  54869 [ACK] Seq=86871 Ack=61494 Win=16380 Len=0"
"267","3.958043","2620:1ec:21::14","2600:8805:3803:6100:c100:e220:6ae:755","TCP","74","443  >  54869 [ACK] Seq=86871 Ack=62894 Win=16385 Len=0"
"268","3.958244","2620:1ec:21::14","2600:8805:3803:6100:c100:e220:6ae:755","TCP","74","443  >  54869 [ACK] Seq=86871 Ack=63131 Win=16384 Len=0"
"269","3.958663","2620:1ec:21::14","2600:8805:3803:6100:c100:e220:6ae:755","TCP","74","443  >  54869 [ACK] Seq=86871 Ack=64531 Win=16385 Len=0"
"270","3.959069","2620:1ec:21::14","2600:8805:3803:6100:c100:e220:6ae:755","TCP","74","443  >  54869 [ACK] Seq=86871 Ack=65931 Win=16380 Len=0"
"271","3.960547","2620:1ec:21::14","2600:8805:3803:6100:c100:e220:6ae:755","TCP","74","443  >  54869 [ACK] Seq=86871 Ack=66131 Win=16385 Len=0"
"272","4.032308","2620:1ec:21::14","2600:8805:3803:6100:c100:e220:6ae:755","TLSv1.2","387","Application Data"
"273","4.032308","2620:1ec:21::14","2600:8805:3803:6100:c100:e220:6ae:755","TLSv1.2","112","Application Data"
"274","4.032400","2600:8805:3803:6100:c100:e220:6ae:755","2620:1ec:21::14","TCP","74","54869  >  443 [ACK] Seq=66131 Ack=87222 Win=4090 Len=0"
"275","4.081430","2620:1ec:21::14","2600:8805:3803:6100:c100:e220:6ae:755","TLSv1.2","541","Application Data"
"276","4.081508","2600:8805:3803:6100:c100:e220:6ae:755","2620:1ec:21::14","TCP","74","54869  >  443 [ACK] Seq=66131 Ack=87689 Win=4088 Len=0"
"277","4.081657","2620:1ec:21::14","2600:8805:3803:6100:c100:e220:6ae:755","TLSv1.2","112","Application Data"
"278","4.081712","2600:8805:3803:6100:c100:e220:6ae:755","2620:1ec:21::14","TCP","74","54869  >  443 [ACK] Seq=66131 Ack=87727 Win=4088 Len=0"
"279","4.083255","2620:1ec:21::14","2600:8805:3803:6100:c100:e220:6ae:755","TLSv1.2","1457","Application Data"
"280","4.083311","2600:8805:3803:6100:c100:e220:6ae:755","2620:1ec:21::14","TCP","74","54869  >  443 [ACK] Seq=66131 Ack=89110 Win=4074 Len=0"
"281","4.083628","2620:1ec:21::14","2600:8805:3803:6100:c100:e220:6ae:755","TLSv1.2","112","Application Data"
"282","4.083692","2600:8805:3803:6100:c100:e220:6ae:755","2620:1ec:21::14","TCP","74","54869  >  443 [ACK] Seq=66131 Ack=89148 Win=4095 Len=0"
"283","4.147644","2600:8805:3803:6100:c100:e220:6ae:755","2620:1ec:21::14","TCP","1474","54869  >  443 [ACK] Seq=66131 Ack=89148 Win=4096 Len=1400 [TCP segment of a reassembled PDU]"
"284","4.147750","2600:8805:3803:6100:c100:e220:6ae:755","2620:1ec:21::14","TLSv1.2","1437","Application Data"
