"No.","Time","Source","Destination","Protocol","Length","Info"
"1","0.000000","13.107.42.14","100.65.82.205","TLSv1.2","100","Application Data"
"2","0.000193","100.65.82.205","13.107.42.14","TCP","54","50364  >  443 [ACK] Seq=1 Ack=47 Win=34650 Len=0"
"3","0.002066","100.65.82.205","13.107.42.14","TLSv1.2","96","Application Data"
"4","0.002290","100.65.82.205","13.107.42.14","TLSv1.2","96","Application Data"
"5","0.012706","13.107.42.14","100.65.82.205","TCP","56","443  >  50364 [ACK] Seq=47 Ack=85 Win=16381 Len=0"
"6","0.506633","100.65.82.205","13.107.42.14","TCP","1494","50364  >  443 [ACK] Seq=85 Ack=47 Win=34651 Len=1440 [TCP segment of a reassembled PDU]"
"7","0.506792","100.65.82.205","13.107.42.14","TLSv1.2","1249","Application Data"
"8","0.506920","100.65.82.205","13.107.42.14","TCP","1494","50364  >  443 [ACK] Seq=2720 Ack=47 Win=34651 Len=1440 [TCP segment of a reassembled PDU]"
"9","0.506925","100.65.82.205","13.107.42.14","TCP","1494","50364  >  443 [ACK] Seq=4160 Ack=47 Win=34651 Len=1440 [TCP segment of a reassembled PDU]"
"10","0.506927","100.65.82.205","13.107.42.14","TCP","1494","50364  >  443 [ACK] Seq=5600 Ack=47 Win=34651 Len=1440 [TCP segment of a reassembled PDU]"
"11","0.506929","100.65.82.205","13.107.42.14","TCP","1494","50364  >  443 [ACK] Seq=7040 Ack=47 Win=34651 Len=1440 [TCP segment of a reassembled PDU]"
"12","0.506960","100.65.82.205","13.107.42.14","TLSv1.2","620","Application Data"
"13","0.519632","13.107.42.14","100.65.82.205","TCP","56","443  >  50364 [ACK] Seq=47 Ack=1525 Win=16385 Len=0"
"14","0.519633","13.107.42.14","100.65.82.205","TCP","56","443  >  50364 [ACK] Seq=47 Ack=9046 Win=16382 Len=0"
"15","0.986304","13.107.42.14","100.65.82.205","TLSv1.2","238","Application Data"
"16","0.986305","13.107.42.14","100.65.82.205","TCP","238","[TCP Retransmission] 443  >  50364 [PSH, ACK] Seq=47 Ack=9046 Win=16382 Len=184"
"17","0.986362","100.65.82.205","13.107.42.14","TCP","54","50364  >  443 [ACK] Seq=9046 Ack=231 Win=34648 Len=0"
"18","0.986412","100.65.82.205","13.107.42.14","TCP","66","[TCP Dup ACK 17#1] 50364  >  443 [ACK] Seq=9046 Ack=231 Win=34648 Len=0 SLE=47 SRE=231"
"19","1.037987","100.65.82.205","13.107.42.14","TCP","1494","50364  >  443 [ACK] Seq=9046 Ack=231 Win=34651 Len=1440 [TCP segment of a reassembled PDU]"
"20","1.038031","100.65.82.205","13.107.42.14","TLSv1.2","1249","Application Data"
"21","1.038179","100.65.82.205","13.107.42.14","TCP","1494","50364  >  443 [ACK] Seq=11681 Ack=231 Win=34651 Len=1440 [TCP segment of a reassembled PDU]"
"22","1.038182","100.65.82.205","13.107.42.14","TCP","1494","50364  >  443 [ACK] Seq=13121 Ack=231 Win=34651 Len=1440 [TCP segment of a reassembled PDU]"
"23","1.038184","100.65.82.205","13.107.42.14","TCP","1494","50364  >  443 [ACK] Seq=14561 Ack=231 Win=34651 Len=1440 [TCP segment of a reassembled PDU]"
"24","1.038185","100.65.82.205","13.107.42.14","TCP","1494","50364  >  443 [ACK] Seq=16001 Ack=231 Win=34651 Len=1440 [TCP segment of a reassembled PDU]"
"25","1.038200","100.65.82.205","13.107.42.14","TLSv1.2","602","Application Data"
"26","1.038249","100.65.82.205","13.107.42.14","TCP","1494","50364  >  443 [ACK] Seq=17989 Ack=231 Win=34651 Len=1440 [TCP segment of a reassembled PDU]"
"27","1.038265","100.65.82.205","13.107.42.14","TLSv1.2","1278","Application Data"
"28","1.038280","100.65.82.205","13.107.42.14","TLSv1.2","273","Application Data"
"29","1.048919","13.107.42.14","100.65.82.205","TCP","56","443  >  50364 [ACK] Seq=231 Ack=10486 Win=16385 Len=0"
"30","1.049240","13.107.42.14","100.65.82.205","TCP","56","443  >  50364 [ACK] Seq=231 Ack=16001 Win=16379 Len=0"
"31","1.049240","13.107.42.14","100.65.82.205","TCP","56","443  >  50364 [ACK] Seq=231 Ack=17989 Win=16385 Len=0"
"32","1.049920","13.107.42.14","100.65.82.205","TCP","56","443  >  50364 [ACK] Seq=231 Ack=20872 Win=16385 Len=0"
"33","1.060515","100.65.82.205","13.107.42.14","TCP","1494","50364  >  443 [ACK] Seq=20872 Ack=231 Win=34651 Len=1440 [TCP segment of a reassembled PDU]"
"34","1.060521","100.65.82.205","13.107.42.14","TCP","1494","50364  >  443 [ACK] Seq=22312 Ack=231 Win=34651 Len=1440 [TCP segment of a reassembled PDU]"
"35","1.060563","100.65.82.205","13.107.42.14","TLSv1.2","82","Application Data"
"36","1.060621","100.65.82.205","13.107.42.14","TLSv1.2","402","Application Data"
"37","1.071488","13.107.42.14","100.65.82.205","TCP","56","443  >  50364 [ACK] Seq=231 Ack=22312 Win=16379 Len=0"
"38","1.071740","13.107.42.14","100.65.82.205","TCP","56","443  >  50364 [ACK] Seq=231 Ack=24128 Win=16385 Len=0"
"39","1.086485","100.65.82.205","13.107.42.14","TLSv1.2","96","Application Data"
"40","1.087938","100.65.82.205","13.107.42.14","TCP","1494","50364  >  443 [ACK] Seq=24170 Ack=231 Win=34651 Len=1440 [TCP segment of a reassembled PDU]"
"41","1.087978","100.65.82.205","13.107.42.14","TLSv1.2","1306","Application Data"
"42","1.097745","13.107.42.14","100.65.82.205","TCP","56","443  >  50364 [ACK] Seq=231 Ack=24170 Win=16384 Len=0"
"43","1.099027","13.107.42.14","100.65.82.205","TCP","56","443  >  50364 [ACK] Seq=231 Ack=26862 Win=16385 Len=0"
"44","1.126458","13.107.42.14","100.65.82.205","TLSv1.2","236","Application Data"
"45","1.126551","100.65.82.205","13.107.42.14","TCP","54","50364  >  443 [ACK] Seq=26862 Ack=413 Win=34648 Len=0"
"46","1.148208","13.107.42.14","100.65.82.205","TLSv1.2","247","Application Data"
"47","1.148270","100.65.82.205","13.107.42.14","TCP","54","50364  >  443 [ACK] Seq=26862 Ack=606 Win=34647 Len=0"
"48","1.148344","13.107.42.14","100.65.82.205","TLSv1.2","266","Application Data"
"49","1.148345","13.107.42.14","100.65.82.205","TLSv1.2","102","Application Data"
"50","1.148376","100.65.82.205","13.107.42.14","TCP","54","50364  >  443 [ACK] Seq=26862 Ack=866 Win=34643 Len=0"
"51","1.192731","13.107.42.14","100.65.82.205","TLSv1.2","92","Application Data"
"52","1.192804","100.65.82.205","13.107.42.14","TCP","54","50364  >  443 [ACK] Seq=26862 Ack=904 Win=34650 Len=0"
"53","1.226113","13.107.42.14","100.65.82.205","TCP","1514","443  >  50364 [ACK] Seq=904 Ack=26862 Win=16385 Len=1460 [TCP segment of a reassembled PDU]"
"54","1.226114","13.107.42.14","100.65.82.205","TLSv1.2","1138","Application Data"
"55","1.226114","13.107.42.14","100.65.82.205","TLSv1.2","786","Application Data"
"56","1.226187","100.65.82.205","13.107.42.14","TCP","54","50364  >  443 [ACK] Seq=26862 Ack=4180 Win=34599 Len=0"
"57","1.227303","100.65.82.205","13.107.42.14","TCP","54","[TCP Window Update] 50364  >  443 [ACK] Seq=26862 Ack=4180 Win=34651 Len=0"
"58","1.230796","13.107.42.14","100.65.82.205","TCP","1514","443  >  50364 [ACK] Seq=4180 Ack=26862 Win=16385 Len=1460 [TCP segment of a reassembled PDU]"
"59","1.230797","13.107.42.14","100.65.82.205","TCP","1514","443  >  50364 [ACK] Seq=5640 Ack=26862 Win=16385 Len=1460 [TCP segment of a reassembled PDU]"
"60","1.230867","13.107.42.14","100.65.82.205","TLSv1.2","1268","Application Data"
"61","1.230868","13.107.42.14","100.65.82.205","TCP","1514","443  >  50364 [ACK] Seq=8314 Ack=26862 Win=16385 Len=1460 [TCP segment of a reassembled PDU]"
"62","1.230873","100.65.82.205","13.107.42.14","TCP","54","50364  >  443 [ACK] Seq=26862 Ack=7100 Win=34605 Len=0"
"63","1.230891","100.65.82.205","13.107.42.14","TCP","54","50364  >  443 [ACK] Seq=26862 Ack=9774 Win=34563 Len=0"
"64","1.231091","13.107.42.14","100.65.82.205","TCP","1514","443  >  50364 [ACK] Seq=9774 Ack=26862 Win=16385 Len=1460 [TCP segment of a reassembled PDU]"
"65","1.231092","13.107.42.14","100.65.82.205","TLSv1.2","1268","Application Data"
"66","1.231092","13.107.42.14","100.65.82.205","TCP","1514","443  >  50364 [ACK] Seq=12448 Ack=26862 Win=16385 Len=1460 [TCP segment of a reassembled PDU]"
"67","1.231093","13.107.42.14","100.65.82.205","TCP","1514","443  >  50364 [ACK] Seq=13908 Ack=26862 Win=16385 Len=1460 [TCP segment of a reassembled PDU]"
"68","1.231112","100.65.82.205","13.107.42.14","TCP","54","50364  >  443 [ACK] Seq=26862 Ack=15368 Win=34476 Len=0"
"69","1.231336","13.107.42.14","100.65.82.205","TLSv1.2","1268","Application Data"
"70","1.231337","13.107.42.14","100.65.82.205","TCP","1514","443  >  50364 [ACK] Seq=16582 Ack=26862 Win=16385 Len=1460 [TCP segment of a reassembled PDU]"
"71","1.231353","100.65.82.205","13.107.42.14","TCP","54","50364  >  443 [ACK] Seq=26862 Ack=18042 Win=34434 Len=0"
"72","1.232175","13.107.42.14","100.65.82.205","TCP","1514","443  >  50364 [ACK] Seq=18042 Ack=26862 Win=16385 Len=1460 [TCP segment of a reassembled PDU]"
"73","1.232176","13.107.42.14","100.65.82.205","TLSv1.2","1268","Application Data"
"74","1.232177","13.107.42.14","100.65.82.205","TCP","1514","443  >  50364 [ACK] Seq=20716 Ack=26862 Win=16385 Len=1460 [TCP segment of a reassembled PDU]"
"75","1.232177","13.107.42.14","100.65.82.205","TCP","1514","443  >  50364 [ACK] Seq=22176 Ack=26862 Win=16385 Len=1460 [TCP segment of a reassembled PDU]"
"76","1.232178","13.107.42.14","100.65.82.205","TLSv1.2","1268","Application Data"
"77","1.232178","13.107.42.14","100.65.82.205","TCP","1514","443  >  50364 [ACK] Seq=24850 Ack=26862 Win=16385 Len=1460 [TCP segment of a reassembled PDU]"
"78","1.232178","13.107.42.14","100.65.82.205","TCP","1514","443  >  50364 [ACK] Seq=26310 Ack=26862 Win=16385 Len=1460 [TCP segment of a reassembled PDU]"
"79","1.232179","13.107.42.14","100.65.82.205","TLSv1.2","1268","Application Data"
"80","1.232180","13.107.42.14","100.65.82.205","TCP","1514","443  >  50364 [ACK] Seq=28984 Ack=26862 Win=16385 Len=1460 [TCP segment of a reassembled PDU]"
"81","1.232180","13.107.42.14","100.65.82.205","TCP","1514","443  >  50364 [ACK] Seq=30444 Ack=26862 Win=16385 Len=1460 [TCP segment of a reassembled PDU]"
"82","1.232181","13.107.42.14","100.65.82.205","TLSv1.2","1268","Application Data"
"83","1.232181","13.107.42.14","100.65.82.205","TCP","1514","443  >  50364 [ACK] Seq=33118 Ack=26862 Win=16385 Len=1460 [TCP segment of a reassembled PDU]"
"84","1.232182","13.107.42.14","100.65.82.205","TCP","1514","443  >  50364 [ACK] Seq=34578 Ack=26862 Win=16385 Len=1460 [TCP segment of a reassembled PDU]"
"85","1.232182","13.107.42.14","100.65.82.205","TLSv1.2","66","Application Data"
"86","1.232182","13.107.42.14","100.65.82.205","TLSv1.2","1294","Application Data"
"87","1.232183","13.107.42.14","100.65.82.205","TCP","1514","443  >  50364 [ACK] Seq=37290 Ack=26862 Win=16385 Len=1460 [TCP segment of a reassembled PDU]"
"88","1.232243","100.65.82.205","13.107.42.14","TCP","54","50364  >  443 [ACK] Seq=26862 Ack=33118 Win=34198 Len=0"
"89","1.232275","100.65.82.205","13.107.42.14","TCP","54","50364  >  443 [ACK] Seq=26862 Ack=38750 Win=34110 Len=0"
"90","1.232849","100.65.82.205","13.107.42.14","TCP","54","[TCP Window Update] 50364  >  443 [ACK] Seq=26862 Ack=38750 Win=34651 Len=0"
"91","1.254701","13.107.42.14","100.65.82.205","TCP","1514","443  >  50364 [ACK] Seq=38750 Ack=26862 Win=16385 Len=1460 [TCP segment of a reassembled PDU]"
"92","1.254701","13.107.42.14","100.65.82.205","TLSv1.2","1268","Application Data"
"93","1.254746","13.107.42.14","100.65.82.205","TCP","1514","443  >  50364 [ACK] Seq=41424 Ack=26862 Win=16385 Len=1460 [TCP segment of a reassembled PDU]"
"94","1.254747","13.107.42.14","100.65.82.205","TCP","1514","443  >  50364 [ACK] Seq=42884 Ack=26862 Win=16385 Len=1460 [TCP segment of a reassembled PDU]"
"95","1.254755","100.65.82.205","13.107.42.14","TCP","54","50364  >  443 [ACK] Seq=26862 Ack=41424 Win=34609 Len=0"
"96","1.254805","100.65.82.205","13.107.42.14","TCP","54","50364  >  443 [ACK] Seq=26862 Ack=44344 Win=34563 Len=0"
"97","1.255602","100.65.82.205","13.107.42.14","TCP","54","[TCP Window Update] 50364  >  443 [ACK] Seq=26862 Ack=44344 Win=34651 Len=0"
"98","1.255687","13.107.42.14","100.65.82.205","TLSv1.2","1268","Application Data"
"99","1.255688","13.107.42.14","100.65.82.205","TCP","1514","443  >  50364 [ACK] Seq=45558 Ack=26862 Win=16385 Len=1460 [TCP segment of a reassembled PDU]"
"100","1.255731","100.65.82.205","13.107.42.14","TCP","54","50364  >  443 [ACK] Seq=26862 Ack=47018 Win=34609 Len=0"
"101","1.256249","13.107.42.14","100.65.82.205","TCP","1514","443  >  50364 [ACK] Seq=47018 Ack=26862 Win=16385 Len=1460 [TCP segment of a reassembled PDU]"
"102","1.256250","13.107.42.14","100.65.82.205","TLSv1.2","1268","Application Data"
"103","1.256251","13.107.42.14","100.65.82.205","TCP","1514","443  >  50364 [ACK] Seq=49692 Ack=26862 Win=16385 Len=1460 [TCP segment of a reassembled PDU]"
"104","1.256251","13.107.42.14","100.65.82.205","TCP","1514","443  >  50364 [ACK] Seq=51152 Ack=26862 Win=16385 Len=1460 [TCP segment of a reassembled PDU]"
"105","1.256355","100.65.82.205","13.107.42.14","TCP","54","50364  >  443 [ACK] Seq=26862 Ack=52612 Win=34651 Len=0"
"106","1.266615","100.65.82.205","13.107.42.14","TCP","1494","50364  >  443 [ACK] Seq=26862 Ack=52612 Win=34651 Len=1440 [TCP segment of a reassembled PDU]"
"107","1.266687","100.65.82.205","13.107.42.14","TLSv1.2","1249","Application Data"
"108","1.267861","100.65.82.205","13.107.42.14","TLSv1.2","650","Application Data"
"109","1.272895","13.107.42.14","100.65.82.205","TLSv1.2","1268","Application Data"
"110","1.272896","13.107.42.14","100.65.82.205","TCP","1514","443  >  50364 [ACK] Seq=53826 Ack=26862 Win=16385 Len=1460 [TCP segment of a reassembled PDU]"
"111","1.272896","13.107.42.14","100.65.82.205","TCP","1514","443  >  50364 [ACK] Seq=55286 Ack=26862 Win=16385 Len=1460 [TCP segment of a reassembled PDU]"
"112","1.272897","13.107.42.14","100.65.82.205","TLSv1.2","147","Application Data"
"113","1.273725","13.107.42.14","100.65.82.205","TLSv1.2","1205","Application Data"
"114","1.273726","13.107.42.14","100.65.82.205","TCP","1514","443  >  50364 [ACK] Seq=57990 Ack=26862 Win=16385 Len=1460 [TCP segment of a reassembled PDU]"
"115","1.273844","13.107.42.14","100.65.82.205","TCP","1514","443  >  50364 [ACK] Seq=59450 Ack=26862 Win=16385 Len=1460 [TCP segment of a reassembled PDU]"
"116","1.273844","13.107.42.14","100.65.82.205","TLSv1.2","1268","Application Data"
"117","1.274041","100.65.82.205","13.107.42.14","TCP","54","50364  >  443 [ACK] Seq=30093 Ack=62124 Win=34651 Len=0"
"118","1.274063","13.107.42.14","100.65.82.205","TCP","1514","443  >  50364 [ACK] Seq=62124 Ack=26862 Win=16385 Len=1460 [TCP segment of a reassembled PDU]"
"119","1.274064","13.107.42.14","100.65.82.205","TCP","1514","443  >  50364 [ACK] Seq=63584 Ack=26862 Win=16385 Len=1460 [TCP segment of a reassembled PDU]"
"120","1.274064","13.107.42.14","100.65.82.205","TLSv1.2","1268","Application Data"
"121","1.274065","13.107.42.14","100.65.82.205","TCP","1514","443  >  50364 [ACK] Seq=66258 Ack=26862 Win=16385 Len=1460 [TCP segment of a reassembled PDU]"
"122","1.274353","100.65.82.205","13.107.42.14","TCP","54","50364  >  443 [ACK] Seq=30093 Ack=67718 Win=34651 Len=0"
"123","1.275228","13.107.42.14","100.65.82.205","TCP","1514","443  >  50364 [ACK] Seq=67718 Ack=26862 Win=16385 Len=1460 [TCP segment of a reassembled PDU]"
"124","1.275229","13.107.42.14","100.65.82.205","TLSv1.2","859","Application Data"
"125","1.275229","13.107.42.14","100.65.82.205","TLSv1.2","493","Application Data"
"126","1.275229","13.107.42.14","100.65.82.205","TCP","1514","443  >  50364 [ACK] Seq=70422 Ack=26862 Win=16385 Len=1460 [TCP segment of a reassembled PDU]"
"127","1.275230","13.107.42.14","100.65.82.205","TCP","1514","443  >  50364 [ACK] Seq=71882 Ack=26862 Win=16385 Len=1460 [TCP segment of a reassembled PDU]"
"128","1.275231","13.107.42.14","100.65.82.205","TLSv1.2","1268","Application Data"
"129","1.275231","13.107.42.14","100.65.82.205","TCP","1514","443  >  50364 [ACK] Seq=74556 Ack=26862 Win=16385 Len=1460 [TCP segment of a reassembled PDU]"
"130","1.275231","13.107.42.14","100.65.82.205","TCP","1514","443  >  50364 [ACK] Seq=76016 Ack=26862 Win=16385 Len=1460 [TCP segment of a reassembled PDU]"
"131","1.275232","13.107.42.14","100.65.82.205","TLSv1.2","687","Application Data"
"132","1.275232","13.107.42.14","100.65.82.205","TLSv1.2","225","Application Data"
"133","1.275232","13.107.42.14","100.65.82.205","TCP","1514","443  >  50364 [ACK] Seq=78280 Ack=26862 Win=16385 Len=1460 [TCP segment of a reassembled PDU]"
"134","1.275233","13.107.42.14","100.65.82.205","TLSv1.2","83","Application Data"
"135","1.276260","100.65.82.205","13.107.42.14","TCP","54","50364  >  443 [ACK] Seq=30093 Ack=79769 Win=34651 Len=0"
"136","1.278010","13.107.42.14","100.65.82.205","TLSv1.2","214","Application Data"
"137","1.278011","13.107.42.14","100.65.82.205","TLSv1.2","159","Application Data"
"138","1.278011","13.107.42.14","100.65.82.205","TCP","56","443  >  50364 [ACK] Seq=80034 Ack=29497 Win=16385 Len=0"
"139","1.278235","13.107.42.14","100.65.82.205","TCP","56","443  >  50364 [ACK] Seq=80034 Ack=30093 Win=16382 Len=0"
"140","1.280718","100.65.82.205","13.107.42.14","TCP","54","50364  >  443 [ACK] Seq=30093 Ack=80034 Win=34651 Len=0"
"141","1.282030","100.65.82.205","13.107.42.14","TCP","1494","50364  >  443 [ACK] Seq=30093 Ack=80034 Win=34651 Len=1440 [TCP segment of a reassembled PDU]"
"142","1.282115","100.65.82.205","13.107.42.14","TLSv1.2","1249","Application Data"
"143","1.282314","100.65.82.205","13.107.42.14","TCP","1494","50364  >  443 [ACK] Seq=32728 Ack=80034 Win=34651 Len=1440 [TCP segment of a reassembled PDU]"
"144","1.282341","100.65.82.205","13.107.42.14","TLSv1.2","1249","Application Data"
"145","1.282379","100.65.82.205","13.107.42.14","TLSv1.2","766","Application Data"
"146","1.282433","100.65.82.205","13.107.42.14","TLSv1.2","839","Application Data"
"147","1.292645","13.107.42.14","100.65.82.205","TCP","56","443  >  50364 [ACK] Seq=80034 Ack=32728 Win=16380 Len=0"
"148","1.293396","13.107.42.14","100.65.82.205","TCP","56","443  >  50364 [ACK] Seq=80034 Ack=35363 Win=16380 Len=0"
"149","1.293396","13.107.42.14","100.65.82.205","TCP","56","443  >  50364 [ACK] Seq=80034 Ack=36860 Win=16385 Len=0"
"150","1.439448","13.107.42.14","100.65.82.205","TLSv1.2","404","Application Data"
"151","1.439448","13.107.42.14","100.65.82.205","TLSv1.2","1168","Application Data, Application Data, Application Data"
"152","1.440883","100.65.82.205","13.107.42.14","TCP","54","50364  >  443 [ACK] Seq=36860 Ack=81498 Win=34651 Len=0"
"153","1.459696","13.107.42.14","100.65.82.205","TCP","1514","443  >  50364 [ACK] Seq=81498 Ack=36860 Win=16385 Len=1460 [TCP segment of a reassembled PDU]"
"154","1.459697","13.107.42.14","100.65.82.205","TLSv1.2","1248","Application Data"
"155","1.460149","100.65.82.205","13.107.42.14","TCP","54","50364  >  443 [ACK] Seq=36860 Ack=84152 Win=34651 Len=0"
"156","1.483923","13.107.42.14","100.65.82.205","TLSv1.2","517","Application Data"
"157","1.483923","13.107.42.14","100.65.82.205","TLSv1.2","284","Application Data"
"158","1.484075","100.65.82.205","13.107.42.14","TCP","54","50364  >  443 [ACK] Seq=36860 Ack=84845 Win=34651 Len=0"
"159","1.558993","13.107.42.14","100.65.82.205","TLSv1.2","1026","Application Data"
"160","1.558994","13.107.42.14","100.65.82.205","TCP","1514","443  >  50364 [ACK] Seq=85817 Ack=36860 Win=16385 Len=1460 [TCP segment of a reassembled PDU]"
"161","1.559087","100.65.82.205","13.107.42.14","TCP","54","50364  >  443 [ACK] Seq=36860 Ack=87277 Win=34651 Len=0"
"162","1.559374","13.107.42.14","100.65.82.205","TLSv1.2","1101","Application Data"
"163","1.559374","13.107.42.14","100.65.82.205","TCP","1514","443  >  50364 [ACK] Seq=88324 Ack=36860 Win=16385 Len=1460 [TCP segment of a reassembled PDU]"
"164","1.559375","13.107.42.14","100.65.82.205","TLSv1.2","253","Application Data"
"165","1.559375","13.107.42.14","100.65.82.205","TCP","1514","443  >  50364 [ACK] Seq=89983 Ack=36860 Win=16385 Len=1460 [TCP segment of a reassembled PDU]"
"166","1.559422","100.65.82.205","13.107.42.14","TCP","54","50364  >  443 [ACK] Seq=36860 Ack=91443 Win=34651 Len=0"
"167","1.559622","13.107.42.14","100.65.82.205","TCP","1514","443  >  50364 [ACK] Seq=91443 Ack=36860 Win=16385 Len=1460 [TCP segment of a reassembled PDU]"
"168","1.559622","13.107.42.14","100.65.82.205","TLSv1.2","1268","Application Data"
"169","1.559662","100.65.82.205","13.107.42.14","TCP","54","50364  >  443 [ACK] Seq=36860 Ack=94117 Win=34651 Len=0"
"170","1.560379","13.107.42.14","100.65.82.205","TCP","1514","443  >  50364 [ACK] Seq=94117 Ack=36860 Win=16385 Len=1460 [TCP segment of a reassembled PDU]"
"171","1.560380","13.107.42.14","100.65.82.205","TCP","1514","443  >  50364 [ACK] Seq=95577 Ack=36860 Win=16385 Len=1460 [TCP segment of a reassembled PDU]"
"172","1.560381","13.107.42.14","100.65.82.205","TLSv1.2","1268","Application Data"
"173","1.560381","13.107.42.14","100.65.82.205","TCP","1514","443  >  50364 [ACK] Seq=98251 Ack=36860 Win=16385 Len=1460 [TCP segment of a reassembled PDU]"
"174","1.560382","13.107.42.14","100.65.82.205","TCP","1514","443  >  50364 [ACK] Seq=99711 Ack=36860 Win=16385 Len=1460 [TCP segment of a reassembled PDU]"
"175","1.560383","13.107.42.14","100.65.82.205","TLSv1.2","1268","Application Data"
"176","1.560472","100.65.82.205","13.107.42.14","TCP","54","50364  >  443 [ACK] Seq=36860 Ack=102385 Win=34651 Len=0"
"177","1.583042","13.107.42.14","100.65.82.205","TCP","1514","443  >  50364 [ACK] Seq=102385 Ack=36860 Win=16385 Len=1460 [TCP segment of a reassembled PDU]"
"178","1.583043","13.107.42.14","100.65.82.205","TLSv1.2","618","Application Data"
"179","1.583178","13.107.42.14","100.65.82.205","TLSv1.2","164","Application Data"
"180","1.583179","13.107.42.14","100.65.82.205","TCP","1514","443  >  50364 [ACK] Seq=104519 Ack=36860 Win=16385 Len=1460 [TCP segment of a reassembled PDU]"
"181","1.583500","13.107.42.14","100.65.82.205","TCP","1514","443  >  50364 [ACK] Seq=105979 Ack=36860 Win=16385 Len=1460 [TCP segment of a reassembled PDU]"
"182","1.583501","13.107.42.14","100.65.82.205","TLSv1.2","1268","Application Data"
"183","1.583501","13.107.42.14","100.65.82.205","TCP","1514","443  >  50364 [ACK] Seq=108653 Ack=36860 Win=16385 Len=1460 [TCP segment of a reassembled PDU]"
"184","1.583501","13.107.42.14","100.65.82.205","TCP","1514","443  >  50364 [ACK] Seq=110113 Ack=36860 Win=16385 Len=1460 [TCP segment of a reassembled PDU]"
"185","1.583655","100.65.82.205","13.107.42.14","TCP","54","50364  >  443 [ACK] Seq=36860 Ack=111573 Win=34651 Len=0"
"186","1.598692","13.107.42.14","100.65.82.205","TLSv1.2","1268","Application Data"
"187","1.598693","13.107.42.14","100.65.82.205","TLSv1.2","239","Application Data"
"188","1.598789","100.65.82.205","13.107.42.14","TCP","54","50364  >  443 [ACK] Seq=36860 Ack=112972 Win=34651 Len=0"
"189","1.610399","13.107.42.14","100.65.82.205","TCP","1514","443  >  50364 [ACK] Seq=112972 Ack=36860 Win=16385 Len=1460 [TCP segment of a reassembled PDU]"
"190","1.610400","13.107.42.14","100.65.82.205","TLSv1.2","263","Application Data"
"191","1.610494","100.65.82.205","13.107.42.14","TCP","54","50364  >  443 [ACK] Seq=36860 Ack=114641 Win=34651 Len=0"
"192","1.653816","13.107.42.14","100.65.82.205","TLSv1.2","466","Application Data"
"193","1.653817","13.107.42.14","100.65.82.205","TLSv1.2","1270","Application Data"
"194","1.653980","100.65.82.205","13.107.42.14","TCP","54","50364  >  443 [ACK] Seq=36860 Ack=116269 Win=34651 Len=0"
"195","1.663039","13.107.42.14","100.65.82.205","TLSv1.2","267","Application Data"
"196","1.663039","13.107.42.14","100.65.82.205","TCP","1514","[TCP Retransmission] 443  >  50364 [PSH, ACK] Seq=115022 Ack=36860 Win=16385 Len=1460"
"197","1.663100","100.65.82.205","13.107.42.14","TCP","66","50364  >  443 [ACK] Seq=36860 Ack=116482 Win=34647 Len=0 SLE=115022 SRE=116482"
"198","1.663199","13.107.42.14","100.65.82.205","TLSv1.2","668","Application Data"
"199","1.663199","13.107.42.14","100.65.82.205","TCP","1514","443  >  50364 [ACK] Seq=117096 Ack=36860 Win=16385 Len=1460 [TCP segment of a reassembled PDU]"
"200","1.663828","100.65.82.205","13.107.42.14","TCP","54","50364  >  443 [ACK] Seq=36860 Ack=118556 Win=34651 Len=0"
"201","1.665526","13.107.42.14","100.65.82.205","TLSv1.2","59","Application Data"
"202","1.665527","13.107.42.14","100.65.82.205","TCP","1514","443  >  50364 [ACK] Seq=118561 Ack=36860 Win=16385 Len=1460 [TCP segment of a reassembled PDU]"
"203","1.665528","13.107.42.14","100.65.82.205","TCP","1514","443  >  50364 [ACK] Seq=120021 Ack=36860 Win=16385 Len=1460 [TCP segment of a reassembled PDU]"
"204","1.665528","13.107.42.14","100.65.82.205","TLSv1.2","1212","Application Data"
"205","1.665627","100.65.82.205","13.107.42.14","TCP","54","50364  >  443 [ACK] Seq=36860 Ack=122639 Win=34651 Len=0"
"206","1.709903","13.107.42.14","100.65.82.205","TLSv1.2","142","Application Data"
"207","1.709903","13.107.42.14","100.65.82.205","TLSv1.2","110","Application Data"
"208","1.710023","100.65.82.205","13.107.42.14","TCP","54","50364  >  443 [ACK] Seq=36860 Ack=122783 Win=34651 Len=0"
"209","1.710340","13.107.42.14","100.65.82.205","TCP","1514","443  >  50364 [ACK] Seq=122783 Ack=36860 Win=16385 Len=1460 [TCP segment of a reassembled PDU]"
"210","1.710341","13.107.42.14","100.65.82.205","TCP","1514","443  >  50364 [ACK] Seq=124243 Ack=36860 Win=16385 Len=1460 [TCP segment of a reassembled PDU]"
"211","1.710341","13.107.42.14","100.65.82.205","TLSv1.2","1212","Application Data"
"212","1.710341","13.107.42.14","100.65.82.205","TLSv1.2","142","Application Data"
"213","1.710421","100.65.82.205","13.107.42.14","TCP","54","50364  >  443 [ACK] Seq=36860 Ack=126949 Win=34651 Len=0"
"214","1.710523","13.107.42.14","100.65.82.205","TCP","1514","443  >  50364 [ACK] Seq=126949 Ack=36860 Win=16385 Len=1460 [TCP segment of a reassembled PDU]"
"215","1.710523","13.107.42.14","100.65.82.205","TCP","1514","443  >  50364 [ACK] Seq=128409 Ack=36860 Win=16385 Len=1460 [TCP segment of a reassembled PDU]"
"216","1.710565","100.65.82.205","13.107.42.14","TCP","54","50364  >  443 [ACK] Seq=36860 Ack=129869 Win=34651 Len=0"
"217","1.711055","13.107.42.14","100.65.82.205","TLSv1.2","1268","Application Data"
"218","1.711056","13.107.42.14","100.65.82.205","TCP","1514","443  >  50364 [ACK] Seq=131083 Ack=36860 Win=16385 Len=1460 [TCP segment of a reassembled PDU]"
"219","1.711056","13.107.42.14","100.65.82.205","TCP","1514","443  >  50364 [ACK] Seq=132543 Ack=36860 Win=16385 Len=1460 [TCP segment of a reassembled PDU]"
"220","1.711057","13.107.42.14","100.65.82.205","TLSv1.2","1268","Application Data"
"221","1.711057","13.107.42.14","100.65.82.205","TCP","1514","443  >  50364 [ACK] Seq=135217 Ack=36860 Win=16385 Len=1460 [TCP segment of a reassembled PDU]"
"222","1.711057","13.107.42.14","100.65.82.205","TLSv1.2","1260","Application Data"
"223","1.711057","13.107.42.14","100.65.82.205","TCP","1514","443  >  50364 [ACK] Seq=137883 Ack=36860 Win=16385 Len=1460 [TCP segment of a reassembled PDU]"
"224","1.711058","13.107.42.14","100.65.82.205","TCP","1514","443  >  50364 [ACK] Seq=139343 Ack=36860 Win=16385 Len=1460 [TCP segment of a reassembled PDU]"
"225","1.711117","100.65.82.205","13.107.42.14","TCP","54","50364  >  443 [ACK] Seq=36860 Ack=140803 Win=34651 Len=0"
"226","1.833833","13.107.42.14","100.65.82.205","TLSv1.2","362","Application Data"
"227","1.833835","13.107.42.14","100.65.82.205","TCP","1514","443  >  50364 [ACK] Seq=141111 Ack=36860 Win=16385 Len=1460 [TCP segment of a reassembled PDU]"
"228","1.833944","100.65.82.205","13.107.42.14","TCP","54","50364  >  443 [ACK] Seq=36860 Ack=142571 Win=34651 Len=0"
"229","1.874958","13.107.42.14","100.65.82.205","TCP","1514","443  >  50364 [ACK] Seq=142571 Ack=36860 Win=16385 Len=1460 [TCP segment of a reassembled PDU]"
"230","1.874958","13.107.42.14","100.65.82.205","TLSv1.2","803","Application Data"
"231","1.875097","100.65.82.205","13.107.42.14","TCP","54","50364  >  443 [ACK] Seq=36860 Ack=144780 Win=34651 Len=0"
"232","2.252990","13.107.42.14","100.65.82.205","TCP","1514","[TCP Spurious Retransmission] 443  >  50364 [PSH, ACK] Seq=143320 Ack=36860 Win=16385 Len=1460 [TCP segment of a reassembled PDU]"
"233","2.252990","13.107.42.14","100.65.82.205","TLSv1.2","494","Application Data"
"234","2.252991","13.107.42.14","100.65.82.205","TCP","1514","443  >  50364 [ACK] Seq=145220 Ack=36860 Win=16385 Len=1460 [TCP segment of a reassembled PDU]"
"235","2.252991","13.107.42.14","100.65.82.205","TCP","1514","443  >  50364 [ACK] Seq=146680 Ack=36860 Win=16385 Len=1460 [TCP segment of a reassembled PDU]"
"236","2.253046","100.65.82.205","13.107.42.14","TCP","66","[TCP Dup ACK 231#1] 50364  >  443 [ACK] Seq=36860 Ack=144780 Win=34651 Len=0 SLE=143320 SRE=144780"
"237","2.253164","100.65.82.205","13.107.42.14","TCP","54","50364  >  443 [ACK] Seq=36860 Ack=148140 Win=34651 Len=0"
"238","2.253732","13.107.42.14","100.65.82.205","TLSv1.2","860","Application Data"
"239","2.253733","13.107.42.14","100.65.82.205","TCP","1514","443  >  50364 [ACK] Seq=148946 Ack=36860 Win=16385 Len=1460 [TCP segment of a reassembled PDU]"
"240","2.253790","100.65.82.205","13.107.42.14","TCP","54","50364  >  443 [ACK] Seq=36860 Ack=150406 Win=34651 Len=0"
"241","2.253825","13.107.42.14","100.65.82.205","TCP","1514","443  >  50364 [ACK] Seq=150406 Ack=36860 Win=16385 Len=1460 [TCP segment of a reassembled PDU]"
"242","2.253826","13.107.42.14","100.65.82.205","TLSv1.2","1268","Application Data"
"243","2.253826","13.107.42.14","100.65.82.205","TLSv1.2","1418","Application Data"
"244","2.253826","13.107.42.14","100.65.82.205","TLSv1.2","145","Application Data"
"245","2.253827","13.107.42.14","100.65.82.205","TLSv1.2","178","Application Data"
"246","2.253827","13.107.42.14","100.65.82.205","TLSv1.2","200","Application Data"
"247","2.253854","100.65.82.205","13.107.42.14","TCP","54","50364  >  443 [ACK] Seq=36860 Ack=154805 Win=34651 Len=0"
"248","2.459563","100.65.82.205","13.107.42.14","TCP","1494","50364  >  443 [ACK] Seq=36860 Ack=154805 Win=34651 Len=1440 [TCP segment of a reassembled PDU]"
"249","2.459569","100.65.82.205","13.107.42.14","TCP","1494","50364  >  443 [ACK] Seq=38300 Ack=154805 Win=34651 Len=1440 [TCP segment of a reassembled PDU]"
"250","2.459571","100.65.82.205","13.107.42.14","TCP","1494","50364  >  443 [ACK] Seq=39740 Ack=154805 Win=34651 Len=1440 [TCP segment of a reassembled PDU]"
"251","2.459573","100.65.82.205","13.107.42.14","TCP","1494","50364  >  443 [ACK] Seq=41180 Ack=154805 Win=34651 Len=1440 [TCP segment of a reassembled PDU]"
"252","2.459644","100.65.82.205","13.107.42.14","TLSv1.2","601","Application Data"
"253","2.459698","100.65.82.205","13.107.42.14","TLSv1.2","273","Application Data"
"254","2.460156","100.65.82.205","13.107.42.14","TCP","1494","50364  >  443 [ACK] Seq=43386 Ack=154805 Win=34651 Len=1440 [TCP segment of a reassembled PDU]"
"255","2.460159","100.65.82.205","13.107.42.14","TCP","1494","50364  >  443 [ACK] Seq=44826 Ack=154805 Win=34651 Len=1440 [TCP segment of a reassembled PDU]"
"256","2.460161","100.65.82.205","13.107.42.14","TCP","1494","50364  >  443 [ACK] Seq=46266 Ack=154805 Win=34651 Len=1440 [TCP segment of a reassembled PDU]"
"257","2.460162","100.65.82.205","13.107.42.14","TCP","1494","50364  >  443 [ACK] Seq=47706 Ack=154805 Win=34651 Len=1440 [TCP segment of a reassembled PDU]"
"258","2.460186","100.65.82.205","13.107.42.14","TLSv1.2","524","Application Data"
"259","2.476815","13.107.42.14","100.65.82.205","TLSv1.2","102","Application Data"
"260","2.476816","13.107.42.14","100.65.82.205","TLSv1.2","92","Application Data"
"261","2.476816","13.107.42.14","100.65.82.205","TCP","56","443  >  50364 [ACK] Seq=154891 Ack=38300 Win=16379 Len=0"
"262","2.476980","100.65.82.205","13.107.42.14","TCP","54","50364  >  443 [ACK] Seq=49616 Ack=154891 Win=34651 Len=0"
"263","2.477113","13.107.42.14","100.65.82.205","TCP","56","443  >  50364 [ACK] Seq=154891 Ack=44826 Win=16379 Len=0"
"264","2.477113","13.107.42.14","100.65.82.205","TCP","56","443  >  50364 [ACK] Seq=154891 Ack=49616 Win=16385 Len=0"
"265","2.544751","13.107.42.14","100.65.82.205","TCP","1514","443  >  50364 [ACK] Seq=154891 Ack=49616 Win=16385 Len=1460 [TCP segment of a reassembled PDU]"
"266","2.645663","100.65.82.205","13.107.42.14","TCP","54","50364  >  443 [ACK] Seq=49616 Ack=156351 Win=34651 Len=0"
"267","2.679044","13.107.42.14","100.65.82.205","TLSv1.2","1465","Application Data"
"268","2.679114","100.65.82.205","13.107.42.14","TCP","54","50364  >  443 [ACK] Seq=49616 Ack=157762 Win=34628 Len=0"
"269","3.072382","100.65.82.205","13.107.42.14","TCP","1494","50364  >  443 [ACK] Seq=49616 Ack=157762 Win=34651 Len=1440 [TCP segment of a reassembled PDU]"
"270","3.072387","100.65.82.205","13.107.42.14","TCP","1494","50364  >  443 [ACK] Seq=51056 Ack=157762 Win=34651 Len=1440 [TCP segment of a reassembled PDU]"
"271","3.072428","100.65.82.205","13.107.42.14","TLSv1.2","192","Application Data"
"272","3.072533","100.65.82.205","13.107.42.14","TCP","1494","50364  >  443 [ACK] Seq=52634 Ack=157762 Win=34651 Len=1440 [TCP segment of a reassembled PDU]"
"273","3.072535","100.65.82.205","13.107.42.14","TCP","1494","50364  >  443 [ACK] Seq=54074 Ack=157762 Win=34651 Len=1440 [TCP segment of a reassembled PDU]"
"274","3.072577","100.65.82.205","13.107.42.14","TLSv1.2","164","Application Data"
"275","3.072659","100.65.82.205","13.107.42.14","TCP","1494","50364  >  443 [ACK] Seq=55624 Ack=157762 Win=34651 Len=1440 [TCP segment of a reassembled PDU]"
"276","3.072694","100.65.82.205","13.107.42.14","TCP","1494","50364  >  443 [ACK] Seq=57064 Ack=157762 Win=34651 Len=1440 [TCP segment of a reassembled PDU]"
"277","3.072705","100.65.82.205","13.107.42.14","TLSv1.2","697","Application Data"
"278","3.073075","100.65.82.205","13.107.42.14","TCP","1494","50364  >  443 [ACK] Seq=59147 Ack=157762 Win=34651 Len=1440 [TCP segment of a reassembled PDU]"
"279","3.073077","100.65.82.205","13.107.42.14","TCP","1494","50364  >  443 [ACK] Seq=60587 Ack=157762 Win=34651 Len=1440 [TCP segment of a reassembled PDU]"
"280","3.073093","100.65.82.205","13.107.42.14","TLSv1.2","234","Application Data"
"281","3.073178","100.65.82.205","13.107.42.14","TCP","1494","50364  >  443 [ACK] Seq=62207 Ack=157762 Win=34651 Len=1440 [TCP segment of a reassembled PDU]"
"282","3.073205","100.65.82.205","13.107.42.14","TCP","1494","50364  >  443 [ACK] Seq=63647 Ack=157762 Win=34651 Len=1440 [TCP segment of a reassembled PDU]"
"283","3.073215","100.65.82.205","13.107.42.14","TLSv1.2","237","Application Data"
"284","3.073279","100.65.82.205","13.107.42.14","TCP","1494","50364  >  443 [ACK] Seq=65270 Ack=157762 Win=34651 Len=1440 [TCP segment of a reassembled PDU]"
"285","3.073282","100.65.82.205","13.107.42.14","TCP","1494","50364  >  443 [ACK] Seq=66710 Ack=157762 Win=34651 Len=1440 [TCP segment of a reassembled PDU]"
"286","3.073294","100.65.82.205","13.107.42.14","TLSv1.2","217","Application Data"
"287","3.073352","100.65.82.205","13.107.42.14","TCP","1494","50364  >  443 [ACK] Seq=68313 Ack=157762 Win=34651 Len=1440 [TCP segment of a reassembled PDU]"
"288","3.073353","100.65.82.205","13.107.42.14","TCP","1494","50364  >  443 [ACK] Seq=69753 Ack=157762 Win=34651 Len=1440 [TCP segment of a reassembled PDU]"
"289","3.073363","100.65.82.205","13.107.42.14","TLSv1.2","511","Application Data"
"290","3.090920","100.65.82.205","13.107.42.14","TCP","1494","50364  >  443 [ACK] Seq=71650 Ack=157762 Win=34651 Len=1440 [TCP segment of a reassembled PDU]"
"291","3.090926","100.65.82.205","13.107.42.14","TCP","1494","50364  >  443 [ACK] Seq=73090 Ack=157762 Win=34651 Len=1440 [TCP segment of a reassembled PDU]"
"292","3.091002","100.65.82.205","13.107.42.14","TLSv1.2","258","Application Data"
"293","3.091547","13.107.42.14","100.65.82.205","TLSv1.2","426","Application Data"
"294","3.091548","13.107.42.14","100.65.82.205","TCP","426","[TCP Retransmission] 443  >  50364 [PSH, ACK] Seq=157762 Ack=49616 Win=16385 Len=372"
"295","3.091548","13.107.42.14","100.65.82.205","TCP","56","443  >  50364 [ACK] Seq=158134 Ack=51056 Win=16379 Len=0"
"296","3.091602","100.65.82.205","13.107.42.14","TCP","54","50364  >  443 [ACK] Seq=74734 Ack=158134 Win=34645 Len=0"
"297","3.091629","100.65.82.205","13.107.42.14","TCP","66","[TCP Dup ACK 296#1] 50364  >  443 [ACK] Seq=74734 Ack=158134 Win=34645 Len=0 SLE=157762 SRE=158134"
"298","3.092375","13.107.42.14","100.65.82.205","TCP","56","443  >  50364 [ACK] Seq=158134 Ack=52496 Win=16385 Len=0"
"299","3.093239","13.107.42.14","100.65.82.205","TCP","56","443  >  50364 [ACK] Seq=158134 Ack=52634 Win=16384 Len=0"
"300","3.094323","13.107.42.14","100.65.82.205","TCP","56","443  >  50364 [ACK] Seq=158134 Ack=62207 Win=16385 Len=0"
"301","3.094324","13.107.42.14","100.65.82.205","TCP","56","443  >  50364 [ACK] Seq=158134 Ack=69753 Win=16385 Len=0"
"302","3.094324","13.107.42.14","100.65.82.205","TCP","56","443  >  50364 [ACK] Seq=158134 Ack=71650 Win=16385 Len=0"
"303","3.102838","13.107.42.14","100.65.82.205","TCP","56","443  >  50364 [ACK] Seq=158134 Ack=73090 Win=16379 Len=0"
"304","3.103672","13.107.42.14","100.65.82.205","TCP","56","443  >  50364 [ACK] Seq=158134 Ack=74734 Win=16384 Len=0"
"305","3.169712","100.65.82.205","13.107.42.14","TCP","1494","50364  >  443 [ACK] Seq=74734 Ack=158134 Win=34651 Len=1440 [TCP segment of a reassembled PDU]"
"306","3.169720","100.65.82.205","13.107.42.14","TCP","1494","50364  >  443 [ACK] Seq=76174 Ack=158134 Win=34651 Len=1440 [TCP segment of a reassembled PDU]"
"307","3.170209","100.65.82.205","13.107.42.14","TLSv1.2","259","Application Data"
"308","3.170490","100.65.82.205","13.107.42.14","TCP","1494","50364  >  443 [ACK] Seq=77819 Ack=158134 Win=34651 Len=1440 [TCP segment of a reassembled PDU]"
"309","3.170494","100.65.82.205","13.107.42.14","TCP","1494","50364  >  443 [ACK] Seq=79259 Ack=158134 Win=34651 Len=1440 [TCP segment of a reassembled PDU]"
"310","3.170535","100.65.82.205","13.107.42.14","TLSv1.2","211","Application Data"
"311","3.170757","100.65.82.205","13.107.42.14","TCP","1494","50364  >  443 [ACK] Seq=80856 Ack=158134 Win=34651 Len=1440 [TCP segment of a reassembled PDU]"
"312","3.170761","100.65.82.205","13.107.42.14","TCP","1494","50364  >  443 [ACK] Seq=82296 Ack=158134 Win=34651 Len=1440 [TCP segment of a reassembled PDU]"
"313","3.170794","100.65.82.205","13.107.42.14","TLSv1.2","211","Application Data"
"314","3.173314","100.65.82.205","13.107.42.14","TCP","1494","50364  >  443 [ACK] Seq=83893 Ack=158134 Win=34651 Len=1440 [TCP segment of a reassembled PDU]"
"315","3.173320","100.65.82.205","13.107.42.14","TCP","1494","50364  >  443 [ACK] Seq=85333 Ack=158134 Win=34651 Len=1440 [TCP segment of a reassembled PDU]"
"316","3.173361","100.65.82.205","13.107.42.14","TLSv1.2","149","Application Data"
"317","3.173443","100.65.82.205","13.107.42.14","TCP","1494","50364  >  443 [ACK] Seq=86868 Ack=158134 Win=34651 Len=1440 [TCP segment of a reassembled PDU]"
"318","3.173445","100.65.82.205","13.107.42.14","TCP","1494","50364  >  443 [ACK] Seq=88308 Ack=158134 Win=34651 Len=1440 [TCP segment of a reassembled PDU]"
"319","3.173456","100.65.82.205","13.107.42.14","TLSv1.2","149","Application Data"
"320","3.173518","100.65.82.205","13.107.42.14","TCP","1494","50364  >  443 [ACK] Seq=89843 Ack=158134 Win=34651 Len=1440 [TCP segment of a reassembled PDU]"
"321","3.173520","100.65.82.205","13.107.42.14","TCP","1494","50364  >  443 [ACK] Seq=91283 Ack=158134 Win=34651 Len=1440 [TCP segment of a reassembled PDU]"
"322","3.173547","100.65.82.205","13.107.42.14","TLSv1.2","189","Application Data"
"323","3.173584","100.65.82.205","13.107.42.14","TCP","1494","50364  >  443 [ACK] Seq=92858 Ack=158134 Win=34651 Len=1440 [TCP segment of a reassembled PDU]"
"324","3.173585","100.65.82.205","13.107.42.14","TCP","1494","50364  >  443 [ACK] Seq=94298 Ack=158134 Win=34651 Len=1440 [TCP segment of a reassembled PDU]"
"325","3.173591","100.65.82.205","13.107.42.14","TLSv1.2","172","Application Data"
"326","3.173630","100.65.82.205","13.107.42.14","TCP","1494","50364  >  443 [ACK] Seq=95856 Ack=158134 Win=34651 Len=1440 [TCP segment of a reassembled PDU]"
"327","3.173631","100.65.82.205","13.107.42.14","TCP","1494","50364  >  443 [ACK] Seq=97296 Ack=158134 Win=34651 Len=1440 [TCP segment of a reassembled PDU]"
