"No.","Time","Source","Destination","Protocol","Length","Info"
"1","0.000000","100.65.82.205","13.107.42.14","TCP","78","51230  >  443 [SYN] Seq=0 Win=65535 Len=0 MSS=1460 WS=64 TSval=1337625425 TSecr=0 SACK_PERM"
"2","0.000416","100.65.82.205","13.107.42.14","TCP","78","51231  >  443 [SYN] Seq=0 Win=65535 Len=0 MSS=1460 WS=64 TSval=604807754 TSecr=0 SACK_PERM"
"3","0.009299","100.65.82.205","13.107.42.14","TLSv1.2","1407","Application Data"
"4","0.010789","13.107.42.14","100.65.82.205","TCP","66","443  >  51230 [SYN, ACK] Seq=0 Ack=1 Win=65535 Len=0 MSS=1440 WS=256 SACK_PERM"
"5","0.010925","100.65.82.205","13.107.42.14","TCP","54","51230  >  443 [ACK] Seq=1 Ack=1 Win=262144 Len=0"
"6","0.011329","13.107.42.14","100.65.82.205","TCP","66","443  >  51231 [SYN, ACK] Seq=0 Ack=1 Win=65535 Len=0 MSS=1440 WS=256 SACK_PERM"
"7","0.011418","100.65.82.205","13.107.42.14","TCP","54","51231  >  443 [ACK] Seq=1 Ack=1 Win=262144 Len=0"
"8","0.014907","100.65.82.205","13.107.42.14","TCP","1494","51230  >  443 [ACK] Seq=1 Ack=1 Win=262144 Len=1440 [TCP segment of a reassembled PDU]"
"9","0.015009","100.65.82.205","13.107.42.14","TLSv1.2","432","Client Hello (SNI=linkedin.com)"
"10","0.015660","100.65.82.205","13.107.42.14","TCP","1494","51231  >  443 [ACK] Seq=1 Ack=1 Win=262144 Len=1440 [TCP segment of a reassembled PDU]"
"11","0.015686","100.65.82.205","13.107.42.14","TLSv1.2","336","Client Hello (SNI=linkedin.com)"
"12","0.019772","13.107.42.14","100.65.82.205","TCP","56","443  >  50364 [ACK] Seq=1 Ack=1354 Win=16379 Len=0"
"13","0.025237","13.107.42.14","100.65.82.205","TCP","56","443  >  51230 [ACK] Seq=1 Ack=1819 Win=4194560 Len=0"
"14","0.026320","13.107.42.14","100.65.82.205","TCP","1514","443  >  51230 [ACK] Seq=1 Ack=1819 Win=4194560 Len=1460 [TCP segment of a reassembled PDU]"
"15","0.026375","100.65.82.205","13.107.42.14","TCP","54","51230  >  443 [ACK] Seq=1819 Ack=1461 Win=260672 Len=0"
"16","0.026684","13.107.42.14","100.65.82.205","TCP","1514","443  >  51230 [ACK] Seq=1461 Ack=1819 Win=4194560 Len=1460 [TCP segment of a reassembled PDU]"
"17","0.026685","13.107.42.14","100.65.82.205","TCP","1514","443  >  51230 [ACK] Seq=2921 Ack=1819 Win=4194560 Len=1460 [TCP segment of a reassembled PDU]"
"18","0.026685","13.107.42.14","100.65.82.205","TLSv1.2","265","Server Hello, Certificate, Certificate Status, Server Key Exchange, Server Hello Done"
"19","0.026725","100.65.82.205","13.107.42.14","TCP","54","51230  >  443 [ACK] Seq=1819 Ack=4592 Win=259008 Len=0"
"20","0.026942","13.107.42.14","100.65.82.205","TCP","56","443  >  51231 [ACK] Seq=1 Ack=1723 Win=4194560 Len=0"
"21","0.026971","100.65.82.205","13.107.42.14","TCP","54","[TCP Window Update] 51230  >  443 [ACK] Seq=1819 Ack=4592 Win=262144 Len=0"
"22","0.028113","13.107.42.14","100.65.82.205","TCP","1514","443  >  51231 [ACK] Seq=1 Ack=1723 Win=4194560 Len=1460 [TCP segment of a reassembled PDU]"
"23","0.028129","13.107.42.14","100.65.82.205","TCP","1514","443  >  51231 [ACK] Seq=1461 Ack=1723 Win=4194560 Len=1460 [TCP segment of a reassembled PDU]"
"24","0.028130","13.107.42.14","100.65.82.205","TCP","1514","443  >  51231 [ACK] Seq=2921 Ack=1723 Win=4194560 Len=1460 [TCP segment of a reassembled PDU]"
"25","0.028220","100.65.82.205","13.107.42.14","TCP","54","51231  >  443 [ACK] Seq=1723 Ack=1461 Win=260672 Len=0"
"26","0.028295","100.65.82.205","13.107.42.14","TCP","54","51231  >  443 [ACK] Seq=1723 Ack=4381 Win=257728 Len=0"
"27","0.028369","100.65.82.205","13.107.42.14","TCP","54","[TCP Window Update] 51231  >  443 [ACK] Seq=1723 Ack=4381 Win=262144 Len=0"
"28","0.028540","13.107.42.14","100.65.82.205","TLSv1.2","265","Server Hello, Certificate, Certificate Status, Server Key Exchange, Server Hello Done"
"29","0.028593","100.65.82.205","13.107.42.14","TCP","54","51231  >  443 [ACK] Seq=1723 Ack=4592 Win=261888 Len=0"
"30","0.031667","100.65.82.205","13.107.42.14","TLSv1.2","212","Client Key Exchange, Change Cipher Spec, Encrypted Handshake Message"
"31","0.034283","100.65.82.205","13.107.42.14","TLSv1.2","212","Client Key Exchange, Change Cipher Spec, Encrypted Handshake Message"
"32","0.042051","13.107.42.14","100.65.82.205","TCP","56","443  >  51230 [ACK] Seq=4592 Ack=1977 Win=4194304 Len=0"
"33","0.043408","13.107.42.14","100.65.82.205","TLSv1.2","396","New Session Ticket, Change Cipher Spec, Encrypted Handshake Message"
"34","0.043507","100.65.82.205","13.107.42.14","TCP","54","51230  >  443 [ACK] Seq=1977 Ack=4934 Win=261760 Len=0"
"35","0.043777","13.107.42.14","100.65.82.205","TLSv1.2","123","Application Data"
"36","0.043836","100.65.82.205","13.107.42.14","TCP","54","51230  >  443 [ACK] Seq=1977 Ack=5003 Win=261696 Len=0"
"37","0.044676","13.107.42.14","100.65.82.205","TCP","56","443  >  51231 [ACK] Seq=4592 Ack=1881 Win=4194304 Len=0"
"38","0.045739","13.107.42.14","100.65.82.205","TLSv1.2","396","New Session Ticket, Change Cipher Spec, Encrypted Handshake Message"
"39","0.045796","100.65.82.205","13.107.42.14","TCP","54","51231  >  443 [ACK] Seq=1881 Ack=4934 Win=261760 Len=0"
"40","0.046097","13.107.42.14","100.65.82.205","TLSv1.2","123","Application Data"
"41","0.046142","100.65.82.205","13.107.42.14","TCP","54","51231  >  443 [ACK] Seq=1881 Ack=5003 Win=262016 Len=0"
"42","0.071858","13.107.42.14","100.65.82.205","TLSv1.2","250","Application Data"
"43","0.071910","100.65.82.205","13.107.42.14","TCP","54","50364  >  443 [ACK] Seq=1354 Ack=197 Win=4092 Len=0"
"44","0.094852","100.65.82.205","13.107.42.14","TLSv1.2","1477","Application Data"
"45","0.105384","13.107.42.14","100.65.82.205","TCP","56","443  >  50364 [ACK] Seq=197 Ack=2777 Win=16385 Len=0"
"46","0.213489","13.107.42.14","100.65.82.205","TCP","1514","443  >  50364 [ACK] Seq=197 Ack=2777 Win=16385 Len=1460 [TCP segment of a reassembled PDU]"
"47","0.213556","100.65.82.205","13.107.42.14","TCP","54","50364  >  443 [ACK] Seq=2777 Ack=1657 Win=4073 Len=0"
"48","0.213648","13.107.42.14","100.65.82.205","TLSv1.2","1262","Application Data"
"49","0.213649","13.107.42.14","100.65.82.205","TLSv1.2","674","Application Data"
"50","0.213701","100.65.82.205","13.107.42.14","TCP","54","50364  >  443 [ACK] Seq=2777 Ack=3485 Win=4044 Len=0"
"51","0.213751","100.65.82.205","13.107.42.14","TCP","54","[TCP Window Update] 50364  >  443 [ACK] Seq=2777 Ack=3485 Win=4096 Len=0"
"52","0.213995","13.107.42.14","100.65.82.205","TCP","1514","443  >  50364 [ACK] Seq=3485 Ack=2777 Win=16385 Len=1460 [TCP segment of a reassembled PDU]"
"53","0.213997","13.107.42.14","100.65.82.205","TCP","1514","443  >  50364 [ACK] Seq=4945 Ack=2777 Win=16385 Len=1460 [TCP segment of a reassembled PDU]"
"54","0.213997","13.107.42.14","100.65.82.205","TLSv1.2","1268","Application Data"
"55","0.213998","13.107.42.14","100.65.82.205","TCP","1514","443  >  50364 [ACK] Seq=7619 Ack=2777 Win=16385 Len=1460 [TCP segment of a reassembled PDU]"
"56","0.214025","100.65.82.205","13.107.42.14","TCP","54","50364  >  443 [ACK] Seq=2777 Ack=9079 Win=4008 Len=0"
"57","0.214081","100.65.82.205","13.107.42.14","TCP","54","[TCP Window Update] 50364  >  443 [ACK] Seq=2777 Ack=9079 Win=4096 Len=0"
"58","0.214599","13.107.42.14","100.65.82.205","TCP","1514","443  >  50364 [ACK] Seq=9079 Ack=2777 Win=16385 Len=1460 [TCP segment of a reassembled PDU]"
"59","0.214600","13.107.42.14","100.65.82.205","TLSv1.2","1268","Application Data"
"60","0.214653","100.65.82.205","13.107.42.14","TCP","54","50364  >  443 [ACK] Seq=2777 Ack=11753 Win=4054 Len=0"
"61","0.215357","100.65.82.205","13.107.42.14","TLSv1.2","96","Application Data"
"62","0.221965","13.107.42.14","100.65.82.205","TCP","1514","443  >  50364 [ACK] Seq=11753 Ack=2777 Win=16385 Len=1460 [TCP segment of a reassembled PDU]"
"63","0.222039","100.65.82.205","13.107.42.14","TCP","54","50364  >  443 [ACK] Seq=2819 Ack=13213 Win=4073 Len=0"
"64","0.222540","13.107.42.14","100.65.82.205","TCP","1514","443  >  50364 [ACK] Seq=13213 Ack=2777 Win=16385 Len=1460 [TCP segment of a reassembled PDU]"
"65","0.222541","13.107.42.14","100.65.82.205","TLSv1.2","1268","Application Data"
"66","0.222597","100.65.82.205","13.107.42.14","TCP","54","50364  >  443 [ACK] Seq=2819 Ack=15887 Win=4054 Len=0"
"67","0.225543","13.107.42.14","100.65.82.205","TCP","56","443  >  50364 [ACK] Seq=15887 Ack=2819 Win=16384 Len=0"
"68","0.247491","13.107.42.14","100.65.82.205","TCP","1514","443  >  50364 [ACK] Seq=15887 Ack=2819 Win=16384 Len=1460 [TCP segment of a reassembled PDU]"
"69","0.247555","100.65.82.205","13.107.42.14","TCP","54","50364  >  443 [ACK] Seq=2819 Ack=17347 Win=4073 Len=0"
"70","0.247691","13.107.42.14","100.65.82.205","TCP","1514","443  >  50364 [ACK] Seq=17347 Ack=2819 Win=16384 Len=1460 [TCP segment of a reassembled PDU]"
"71","0.247691","13.107.42.14","100.65.82.205","TLSv1.2","1268","Application Data"
"72","0.247719","100.65.82.205","13.107.42.14","TCP","54","50364  >  443 [ACK] Seq=2819 Ack=20021 Win=4054 Len=0"
"73","0.248057","13.107.42.14","100.65.82.205","TCP","1514","443  >  50364 [ACK] Seq=20021 Ack=2819 Win=16384 Len=1460 [TCP segment of a reassembled PDU]"
"74","0.248058","13.107.42.14","100.65.82.205","TCP","1514","443  >  50364 [ACK] Seq=21481 Ack=2819 Win=16384 Len=1460 [TCP segment of a reassembled PDU]"
"75","0.248100","100.65.82.205","13.107.42.14","TCP","54","50364  >  443 [ACK] Seq=2819 Ack=22941 Win=4050 Len=0"
"76","0.248139","13.107.42.14","100.65.82.205","TLSv1.2","1268","Application Data"
"77","0.248140","13.107.42.14","100.65.82.205","TCP","1514","443  >  50364 [ACK] Seq=24155 Ack=2819 Win=16384 Len=1460 [TCP segment of a reassembled PDU]"
"78","0.248159","100.65.82.205","13.107.42.14","TCP","54","50364  >  443 [ACK] Seq=2819 Ack=25615 Win=4008 Len=0"
"79","0.248174","100.65.82.205","13.107.42.14","TCP","54","[TCP Window Update] 50364  >  443 [ACK] Seq=2819 Ack=25615 Win=4096 Len=0"
"80","0.249277","13.107.42.14","100.65.82.205","TCP","1514","443  >  50364 [ACK] Seq=25615 Ack=2819 Win=16384 Len=1460 [TCP segment of a reassembled PDU]"
"81","0.249278","13.107.42.14","100.65.82.205","TLSv1.2","1268","Application Data"
"82","0.249278","13.107.42.14","100.65.82.205","TCP","1514","443  >  50364 [ACK] Seq=28289 Ack=2819 Win=16384 Len=1460 [TCP segment of a reassembled PDU]"
"83","0.249279","13.107.42.14","100.65.82.205","TCP","1514","443  >  50364 [ACK] Seq=29749 Ack=2819 Win=16384 Len=1460 [TCP segment of a reassembled PDU]"
"84","0.249280","13.107.42.14","100.65.82.205","TLSv1.2","1268","Application Data"
"85","0.249280","13.107.42.14","100.65.82.205","TCP","1514","443  >  50364 [ACK] Seq=32423 Ack=2819 Win=16384 Len=1460 [TCP segment of a reassembled PDU]"
"86","0.249367","100.65.82.205","13.107.42.14","TCP","54","50364  >  443 [ACK] Seq=2819 Ack=33883 Win=3966 Len=0"
"87","0.249547","100.65.82.205","13.107.42.14","TCP","54","[TCP Window Update] 50364  >  443 [ACK] Seq=2819 Ack=33883 Win=4096 Len=0"
"88","0.249812","13.107.42.14","100.65.82.205","TLSv1.2","1481","Application Data"
"89","0.249813","13.107.42.14","100.65.82.205","TLSv1.2","1339","Application Data"
"90","0.249860","100.65.82.205","13.107.42.14","TCP","54","50364  >  443 [ACK] Seq=2819 Ack=36595 Win=4053 Len=0"
"91","0.250032","13.107.42.14","100.65.82.205","TCP","1514","443  >  50364 [ACK] Seq=36595 Ack=2819 Win=16384 Len=1460 [TCP segment of a reassembled PDU]"
"92","0.250033","13.107.42.14","100.65.82.205","TCP","1514","443  >  50364 [ACK] Seq=38055 Ack=2819 Win=16384 Len=1460 [TCP segment of a reassembled PDU]"
"93","0.250072","100.65.82.205","13.107.42.14","TCP","54","50364  >  443 [ACK] Seq=2819 Ack=39515 Win=4050 Len=0"
"94","0.250098","100.65.82.205","13.107.42.14","TCP","54","[TCP Window Update] 50364  >  443 [ACK] Seq=2819 Ack=39515 Win=4096 Len=0"
"95","0.250821","13.107.42.14","100.65.82.205","TLSv1.2","1268","Application Data"
"96","0.250871","100.65.82.205","13.107.42.14","TCP","54","50364  >  443 [ACK] Seq=2819 Ack=40729 Win=4077 Len=0"
"97","0.256236","13.107.42.14","100.65.82.205","TCP","1514","443  >  50364 [ACK] Seq=40729 Ack=2819 Win=16384 Len=1460 [TCP segment of a reassembled PDU]"
"98","0.256290","100.65.82.205","13.107.42.14","TCP","54","50364  >  443 [ACK] Seq=2819 Ack=42189 Win=4073 Len=0"
"99","0.256464","13.107.42.14","100.65.82.205","TCP","1514","443  >  50364 [ACK] Seq=42189 Ack=2819 Win=16384 Len=1460 [TCP segment of a reassembled PDU]"
"100","0.256465","13.107.42.14","100.65.82.205","TLSv1.2","1268","Application Data"
"101","0.256856","13.107.42.14","100.65.82.205","TCP","1514","443  >  50364 [ACK] Seq=44863 Ack=2819 Win=16384 Len=1460 [TCP segment of a reassembled PDU]"
"102","0.256858","13.107.42.14","100.65.82.205","TCP","1514","443  >  50364 [ACK] Seq=46323 Ack=2819 Win=16384 Len=1460 [TCP segment of a reassembled PDU]"
"103","0.256858","13.107.42.14","100.65.82.205","TLSv1.2","1268","Application Data"
"104","0.256858","13.107.42.14","100.65.82.205","TCP","1514","443  >  50364 [ACK] Seq=48997 Ack=2819 Win=16384 Len=1460 [TCP segment of a reassembled PDU]"
"105","0.257152","100.65.82.205","13.107.42.14","TCP","54","50364  >  443 [ACK] Seq=2819 Ack=50457 Win=4096 Len=0"
"106","0.257298","13.107.42.14","100.65.82.205","TCP","1514","443  >  50364 [ACK] Seq=50457 Ack=2819 Win=16384 Len=1460 [TCP segment of a reassembled PDU]"
"107","0.257299","13.107.42.14","100.65.82.205","TLSv1.2","1268","Application Data"
"108","0.257542","100.65.82.205","13.107.42.14","TCP","54","50364  >  443 [ACK] Seq=2819 Ack=53131 Win=4096 Len=0"
"109","0.281725","13.107.42.14","100.65.82.205","TCP","1514","443  >  50364 [ACK] Seq=53131 Ack=2819 Win=16384 Len=1460 [TCP segment of a reassembled PDU]"
"110","0.281857","13.107.42.14","100.65.82.205","TCP","1514","443  >  50364 [ACK] Seq=54591 Ack=2819 Win=16384 Len=1460 [TCP segment of a reassembled PDU]"
"111","0.281859","13.107.42.14","100.65.82.205","TLSv1.2","95","Application Data"
"112","0.282364","13.107.42.14","100.65.82.205","TLSv1.2","1257","Application Data"
"113","0.282365","13.107.42.14","100.65.82.205","TCP","1514","443  >  50364 [ACK] Seq=57295 Ack=2819 Win=16384 Len=1460 [TCP segment of a reassembled PDU]"
"114","0.282365","13.107.42.14","100.65.82.205","TCP","1514","443  >  50364 [ACK] Seq=58755 Ack=2819 Win=16384 Len=1460 [TCP segment of a reassembled PDU]"
"115","0.282366","13.107.42.14","100.65.82.205","TLSv1.2","1268","Application Data"
"116","0.282367","13.107.42.14","100.65.82.205","TCP","1514","443  >  50364 [ACK] Seq=61429 Ack=2819 Win=16384 Len=1460 [TCP segment of a reassembled PDU]"
"117","0.282367","13.107.42.14","100.65.82.205","TCP","1514","443  >  50364 [ACK] Seq=62889 Ack=2819 Win=16384 Len=1460 [TCP segment of a reassembled PDU]"
"118","0.282449","13.107.42.14","100.65.82.205","TLSv1.2","1268","Application Data"
"119","0.282450","13.107.42.14","100.65.82.205","TCP","1514","443  >  50364 [ACK] Seq=65563 Ack=2819 Win=16384 Len=1460 [TCP segment of a reassembled PDU]"
"120","0.283050","13.107.42.14","100.65.82.205","TCP","1514","443  >  50364 [ACK] Seq=67023 Ack=2819 Win=16384 Len=1460 [TCP segment of a reassembled PDU]"
"121","0.283052","13.107.42.14","100.65.82.205","TLSv1.2","807","Application Data"
"122","0.283052","13.107.42.14","100.65.82.205","TLSv1.2","545","Application Data"
"123","0.283052","13.107.42.14","100.65.82.205","TCP","1514","443  >  50364 [ACK] Seq=69727 Ack=2819 Win=16384 Len=1460 [TCP segment of a reassembled PDU]"
"124","0.283203","13.107.42.14","100.65.82.205","TCP","1514","443  >  50364 [ACK] Seq=71187 Ack=2819 Win=16384 Len=1460 [TCP segment of a reassembled PDU]"
"125","0.283204","13.107.42.14","100.65.82.205","TLSv1.2","1268","Application Data"
"126","0.283890","100.65.82.205","13.107.42.14","TCP","54","50364  >  443 [ACK] Seq=2819 Ack=73861 Win=4096 Len=0"
"127","0.284385","13.107.42.14","100.65.82.205","TCP","1514","443  >  50364 [ACK] Seq=73861 Ack=2819 Win=16384 Len=1460 [TCP segment of a reassembled PDU]"
"128","0.284386","13.107.42.14","100.65.82.205","TCP","1514","443  >  50364 [ACK] Seq=75321 Ack=2819 Win=16384 Len=1460 [TCP segment of a reassembled PDU]"
"129","0.284387","13.107.42.14","100.65.82.205","TLSv1.2","635","Application Data"
"130","0.284387","13.107.42.14","100.65.82.205","TLSv1.2","225","Application Data"
"131","0.284387","13.107.42.14","100.65.82.205","TCP","1514","443  >  50364 [ACK] Seq=77533 Ack=2819 Win=16384 Len=1460 [TCP segment of a reassembled PDU]"
"132","0.284388","13.107.42.14","100.65.82.205","TLSv1.2","82","Application Data"
"133","0.284388","13.107.42.14","100.65.82.205","TLSv1.2","214","Application Data"
"134","0.284388","13.107.42.14","100.65.82.205","TLSv1.2","159","Application Data"
"135","0.284779","100.65.82.205","13.107.42.14","TCP","54","50364  >  443 [ACK] Seq=2819 Ack=79286 Win=4096 Len=0"
"136","0.412971","13.107.42.14","100.65.82.205","TLSv1.2","702","Application Data"
"137","0.413558","13.107.42.14","100.65.82.205","TCP","1514","443  >  50364 [ACK] Seq=79934 Ack=2819 Win=16384 Len=1460 [TCP segment of a reassembled PDU]"
"138","0.413559","13.107.42.14","100.65.82.205","TLSv1.2","1351","Application Data"
"139","0.417167","100.65.82.205","13.107.42.14","TCP","54","50364  >  443 [ACK] Seq=2819 Ack=82691 Win=4096 Len=0"
"140","0.433003","13.107.42.14","100.65.82.205","TLSv1.2","517","Application Data"
"141","0.433144","100.65.82.205","13.107.42.14","TCP","54","50364  >  443 [ACK] Seq=2819 Ack=83154 Win=4096 Len=0"
"142","0.435201","13.107.42.14","100.65.82.205","TLSv1.2","284","Application Data"
"143","0.435324","100.65.82.205","13.107.42.14","TCP","54","50364  >  443 [ACK] Seq=2819 Ack=83384 Win=4096 Len=0"
"144","0.458628","13.107.42.14","100.65.82.205","TLSv1.2","1026","Application Data"
"145","0.459053","100.65.82.205","13.107.42.14","TCP","54","50364  >  443 [ACK] Seq=2819 Ack=84356 Win=4096 Len=0"
"146","0.540388","13.107.42.14","100.65.82.205","TCP","1514","443  >  50364 [ACK] Seq=84356 Ack=2819 Win=16384 Len=1460 [TCP segment of a reassembled PDU]"
"147","0.540388","13.107.42.14","100.65.82.205","TLSv1.2","1101","Application Data"
"148","0.540389","13.107.42.14","100.65.82.205","TCP","1514","443  >  50364 [ACK] Seq=86863 Ack=2819 Win=16384 Len=1460 [TCP segment of a reassembled PDU]"
"149","0.540681","13.107.42.14","100.65.82.205","TLSv1.2","253","Application Data"
"150","0.540682","13.107.42.14","100.65.82.205","TCP","1514","443  >  50364 [ACK] Seq=88522 Ack=2819 Win=16384 Len=1460 [TCP segment of a reassembled PDU]"
"151","0.540682","13.107.42.14","100.65.82.205","TCP","1514","443  >  50364 [ACK] Seq=89982 Ack=2819 Win=16384 Len=1460 [TCP segment of a reassembled PDU]"
"152","0.540682","13.107.42.14","100.65.82.205","TLSv1.2","1268","Application Data"
"153","0.540791","13.107.42.14","100.65.82.205","TCP","1514","443  >  50364 [ACK] Seq=92656 Ack=2819 Win=16384 Len=1460 [TCP segment of a reassembled PDU]"
"154","0.540792","13.107.42.14","100.65.82.205","TCP","1514","443  >  50364 [ACK] Seq=94116 Ack=2819 Win=16384 Len=1460 [TCP segment of a reassembled PDU]"
"155","0.540894","13.107.42.14","100.65.82.205","TLSv1.2","1268","Application Data"
"156","0.540895","13.107.42.14","100.65.82.205","TCP","1514","443  >  50364 [ACK] Seq=96790 Ack=2819 Win=16384 Len=1460 [TCP segment of a reassembled PDU]"
"157","0.541092","13.107.42.14","100.65.82.205","TCP","1514","443  >  50364 [ACK] Seq=98250 Ack=2819 Win=16384 Len=1460 [TCP segment of a reassembled PDU]"
"158","0.541092","13.107.42.14","100.65.82.205","TLSv1.2","1268","Application Data"
"159","0.541125","13.107.42.14","100.65.82.205","TCP","1514","443  >  50364 [ACK] Seq=100924 Ack=2819 Win=16384 Len=1460 [TCP segment of a reassembled PDU]"
"160","0.541125","13.107.42.14","100.65.82.205","TLSv1.2","616","Application Data"
"161","0.541606","100.65.82.205","13.107.42.14","TCP","54","50364  >  443 [ACK] Seq=2819 Ack=102946 Win=4096 Len=0"
"162","0.569158","13.107.42.14","100.65.82.205","TLSv1.2","219","Application Data"
"163","0.569342","13.107.42.14","100.65.82.205","TCP","1514","443  >  50364 [ACK] Seq=103111 Ack=2819 Win=16384 Len=1460 [TCP segment of a reassembled PDU]"
"164","0.569343","13.107.42.14","100.65.82.205","TCP","1514","443  >  50364 [ACK] Seq=104571 Ack=2819 Win=16384 Len=1460 [TCP segment of a reassembled PDU]"
"165","0.569449","13.107.42.14","100.65.82.205","TLSv1.2","1268","Application Data"
"166","0.569450","13.107.42.14","100.65.82.205","TCP","1514","443  >  50364 [ACK] Seq=107245 Ack=2819 Win=16384 Len=1460 [TCP segment of a reassembled PDU]"
"167","0.569676","13.107.42.14","100.65.82.205","TCP","1514","443  >  50364 [ACK] Seq=108705 Ack=2819 Win=16384 Len=1460 [TCP segment of a reassembled PDU]"
"168","0.569677","13.107.42.14","100.65.82.205","TLSv1.2","1268","Application Data"
"169","0.570659","100.65.82.205","13.107.42.14","TCP","54","50364  >  443 [ACK] Seq=2819 Ack=111379 Win=4096 Len=0"
"170","0.571252","13.107.42.14","100.65.82.205","TLSv1.2","183","Application Data"
"171","0.572350","100.65.82.205","13.107.42.14","TCP","54","50364  >  443 [ACK] Seq=2819 Ack=111508 Win=4096 Len=0"
"172","0.582414","13.107.42.14","100.65.82.205","TCP","1514","[TCP Spurious Retransmission] 443  >  50364 [PSH, ACK] Seq=110048 Ack=2819 Win=16384 Len=1460"
"173","0.582492","100.65.82.205","13.107.42.14","TCP","66","[TCP Dup ACK 171#1] 50364  >  443 [ACK] Seq=2819 Ack=111508 Win=4096 Len=0 SLE=110048 SRE=111508"
"174","0.608543","13.107.42.14","100.65.82.205","TCP","1514","443  >  50364 [ACK] Seq=111508 Ack=2819 Win=16384 Len=1460 [TCP segment of a reassembled PDU]"
"175","0.608544","13.107.42.14","100.65.82.205","TLSv1.2","264","Application Data"
"176","0.610593","100.65.82.205","13.107.42.14","TCP","54","50364  >  443 [ACK] Seq=2819 Ack=113178 Win=4096 Len=0"
"177","0.610839","13.107.42.14","100.65.82.205","TLSv1.2","472","Application Data"
"178","0.610840","13.107.42.14","100.65.82.205","TLSv1.2","1268","Application Data"
"179","0.612952","13.107.42.14","100.65.82.205","TLSv1.2","273","Application Data"
"180","0.613169","100.65.82.205","13.107.42.14","TCP","54","50364  >  443 [ACK] Seq=2819 Ack=115029 Win=4096 Len=0"
"181","0.634768","13.107.42.14","100.65.82.205","TLSv1.2","601","Application Data"
"182","0.634768","13.107.42.14","100.65.82.205","TCP","1514","443  >  50364 [ACK] Seq=115576 Ack=2819 Win=16384 Len=1460 [TCP segment of a reassembled PDU]"
"183","0.635394","13.107.42.14","100.65.82.205","TCP","1514","443  >  50364 [ACK] Seq=117036 Ack=2819 Win=16384 Len=1460 [TCP segment of a reassembled PDU]"
"184","0.635395","13.107.42.14","100.65.82.205","TLSv1.2","753","Application Data"
"185","0.635395","13.107.42.14","100.65.82.205","TLSv1.2","356","Application Data"
"186","0.636114","100.65.82.205","13.107.42.14","TCP","54","50364  >  443 [ACK] Seq=2819 Ack=119497 Win=4096 Len=0"
"187","0.637864","13.107.42.14","100.65.82.205","TCP","1514","443  >  50364 [ACK] Seq=119497 Ack=2819 Win=16384 Len=1460 [TCP segment of a reassembled PDU]"
"188","0.638327","13.107.42.14","100.65.82.205","TLSv1.2","621","Application Data"
"189","0.638427","100.65.82.205","13.107.42.14","TCP","54","50364  >  443 [ACK] Seq=2819 Ack=121524 Win=4096 Len=0"
"190","0.744081","13.107.42.14","100.65.82.205","TCP","1514","443  >  50364 [ACK] Seq=121524 Ack=2819 Win=16384 Len=1460 [TCP segment of a reassembled PDU]"
"191","0.744288","13.107.42.14","100.65.82.205","TLSv1.2","676","Application Data"
"192","0.744289","13.107.42.14","100.65.82.205","TCP","1514","443  >  50364 [ACK] Seq=123606 Ack=2819 Win=16384 Len=1460 [TCP segment of a reassembled PDU]"
"193","0.744367","100.65.82.205","13.107.42.14","TCP","54","50364  >  443 [ACK] Seq=2819 Ack=125066 Win=4096 Len=0"
"194","0.744411","13.107.42.14","100.65.82.205","TLSv1.2","678","Application Data"
"195","0.744411","13.107.42.14","100.65.82.205","TCP","1514","443  >  50364 [ACK] Seq=125690 Ack=2819 Win=16384 Len=1460 [TCP segment of a reassembled PDU]"
"196","0.744469","100.65.82.205","13.107.42.14","TCP","54","50364  >  443 [ACK] Seq=2819 Ack=127150 Win=4096 Len=0"
"197","0.744505","13.107.42.14","100.65.82.205","TCP","1514","443  >  50364 [ACK] Seq=127150 Ack=2819 Win=16384 Len=1460 [TCP segment of a reassembled PDU]"
"198","0.744506","13.107.42.14","100.65.82.205","TLSv1.2","1268","Application Data"
"199","0.744567","100.65.82.205","13.107.42.14","TCP","54","50364  >  443 [ACK] Seq=2819 Ack=129824 Win=4096 Len=0"
"200","0.744709","13.107.42.14","100.65.82.205","TCP","1514","443  >  50364 [ACK] Seq=129824 Ack=2819 Win=16384 Len=1460 [TCP segment of a reassembled PDU]"
"201","0.744709","13.107.42.14","100.65.82.205","TCP","1514","443  >  50364 [ACK] Seq=131284 Ack=2819 Win=16384 Len=1460 [TCP segment of a reassembled PDU]"
"202","0.744821","100.65.82.205","13.107.42.14","TCP","54","50364  >  443 [ACK] Seq=2819 Ack=132744 Win=4096 Len=0"
"203","0.744891","13.107.42.14","100.65.82.205","TLSv1.2","1268","Application Data"
"204","0.744891","13.107.42.14","100.65.82.205","TCP","1514","443  >  50364 [ACK] Seq=133958 Ack=2819 Win=16384 Len=1460 [TCP segment of a reassembled PDU]"
"205","0.744996","100.65.82.205","13.107.42.14","TCP","54","50364  >  443 [ACK] Seq=2819 Ack=135418 Win=4096 Len=0"
"206","0.745017","13.107.42.14","100.65.82.205","TLSv1.2","1073","Application Data"
"207","0.745017","13.107.42.14","100.65.82.205","TCP","1514","443  >  50364 [ACK] Seq=136437 Ack=2819 Win=16384 Len=1460 [TCP segment of a reassembled PDU]"
"208","0.745052","100.65.82.205","13.107.42.14","TCP","54","50364  >  443 [ACK] Seq=2819 Ack=137897 Win=4096 Len=0"
"209","0.745726","13.107.42.14","100.65.82.205","TCP","1514","443  >  50364 [ACK] Seq=137897 Ack=2819 Win=16384 Len=1460 [TCP segment of a reassembled PDU]"
"210","0.745726","13.107.42.14","100.65.82.205","TLSv1.2","1268","Application Data"
"211","0.745817","100.65.82.205","13.107.42.14","TCP","54","50364  >  443 [ACK] Seq=2819 Ack=140571 Win=4096 Len=0"
"212","0.746579","13.107.42.14","100.65.82.205","TCP","1514","443  >  50364 [ACK] Seq=140571 Ack=2819 Win=16384 Len=1460 [TCP segment of a reassembled PDU]"
"213","0.746580","13.107.42.14","100.65.82.205","TLSv1.2","334","Application Data"
"214","0.746659","100.65.82.205","13.107.42.14","TCP","54","50364  >  443 [ACK] Seq=2819 Ack=142311 Win=4096 Len=0"
"215","0.921623","13.107.42.14","100.65.82.205","TCP","1514","443  >  50364 [ACK] Seq=142311 Ack=2819 Win=16384 Len=1460 [TCP segment of a reassembled PDU]"
"216","0.922167","13.107.42.14","100.65.82.205","TCP","1514","443  >  50364 [ACK] Seq=143771 Ack=2819 Win=16384 Len=1460 [TCP segment of a reassembled PDU]"
"217","0.922168","13.107.42.14","100.65.82.205","TLSv1.2","729","Application Data"
"218","0.922372","100.65.82.205","13.107.42.14","TCP","54","50364  >  443 [ACK] Seq=2819 Ack=145906 Win=4096 Len=0"
"219","1.230093","13.107.42.14","100.65.82.205","TLSv1.2","568","Application Data"
"220","1.230235","100.65.82.205","13.107.42.14","TCP","54","50364  >  443 [ACK] Seq=2819 Ack=146420 Win=4096 Len=0"
"221","1.230291","13.107.42.14","100.65.82.205","TCP","1514","443  >  50364 [ACK] Seq=146420 Ack=2819 Win=16384 Len=1460 [TCP segment of a reassembled PDU]"
"222","1.230302","13.107.42.14","100.65.82.205","TCP","1514","443  >  50364 [ACK] Seq=147880 Ack=2819 Win=16384 Len=1460 [TCP segment of a reassembled PDU]"
"223","1.230360","100.65.82.205","13.107.42.14","TCP","54","50364  >  443 [ACK] Seq=2819 Ack=149340 Win=4096 Len=0"
"224","1.230608","13.107.42.14","100.65.82.205","TLSv1.2","786","Application Data"
"225","1.230609","13.107.42.14","100.65.82.205","TCP","1514","443  >  50364 [ACK] Seq=150072 Ack=2819 Win=16384 Len=1460 [TCP segment of a reassembled PDU]"
"226","1.230609","13.107.42.14","100.65.82.205","TCP","1514","443  >  50364 [ACK] Seq=151532 Ack=2819 Win=16384 Len=1460 [TCP segment of a reassembled PDU]"
"227","1.230609","13.107.42.14","100.65.82.205","TLSv1.2","1268","Application Data"
"228","1.230660","100.65.82.205","13.107.42.14","TCP","54","50364  >  443 [ACK] Seq=2819 Ack=154206 Win=4096 Len=0"
"229","1.230921","13.107.42.14","100.65.82.205","TCP","1514","443  >  50364 [ACK] Seq=154206 Ack=2819 Win=16384 Len=1460 [TCP segment of a reassembled PDU]"
"230","1.230921","13.107.42.14","100.65.82.205","TCP","1514","443  >  50364 [ACK] Seq=155666 Ack=2819 Win=16384 Len=1460 [TCP segment of a reassembled PDU]"
"231","1.230966","100.65.82.205","13.107.42.14","TCP","54","50364  >  443 [ACK] Seq=2819 Ack=157126 Win=4096 Len=0"
"232","1.231858","13.107.42.14","100.65.82.205","TLSv1.2","462","Application Data"
"233","1.232013","100.65.82.205","13.107.42.14","TCP","54","50364  >  443 [ACK] Seq=2819 Ack=157534 Win=4096 Len=0"
"234","1.279887","13.107.42.14","100.65.82.205","TLSv1.2","145","Application Data"
"235","1.280028","13.107.42.14","100.65.82.205","TLSv1.2","179","Application Data"
"236","1.280029","13.107.42.14","100.65.82.205","TLSv1.2","200","Application Data"
"237","1.280894","13.107.42.14","100.65.82.205","TLSv1.2","102","Application Data"
"238","1.280895","13.107.42.14","100.65.82.205","TLSv1.2","92","Application Data"
"239","1.283106","100.65.82.205","13.107.42.14","TCP","54","50364  >  443 [ACK] Seq=2819 Ack=157982 Win=4096 Len=0"
"240","1.418054","100.65.82.205","13.107.42.14","TCP","1494","50364  >  443 [ACK] Seq=2819 Ack=157982 Win=4096 Len=1440 [TCP segment of a reassembled PDU]"
"241","1.418061","100.65.82.205","13.107.42.14","TCP","1494","50364  >  443 [ACK] Seq=4259 Ack=157982 Win=4096 Len=1440 [TCP segment of a reassembled PDU]"
"242","1.418063","100.65.82.205","13.107.42.14","TCP","1494","50364  >  443 [ACK] Seq=5699 Ack=157982 Win=4096 Len=1440 [TCP segment of a reassembled PDU]"
"243","1.418065","100.65.82.205","13.107.42.14","TCP","1494","50364  >  443 [ACK] Seq=7139 Ack=157982 Win=4096 Len=1440 [TCP segment of a reassembled PDU]"
"244","1.418150","100.65.82.205","13.107.42.14","TLSv1.2","598","Application Data"
"245","1.418237","100.65.82.205","13.107.42.14","TLSv1.2","273","Application Data"
"246","1.419337","100.65.82.205","13.107.42.14","TCP","1494","50364  >  443 [ACK] Seq=9342 Ack=157982 Win=4096 Len=1440 [TCP segment of a reassembled PDU]"
"247","1.419341","100.65.82.205","13.107.42.14","TCP","1494","50364  >  443 [ACK] Seq=10782 Ack=157982 Win=4096 Len=1440 [TCP segment of a reassembled PDU]"
"248","1.419342","100.65.82.205","13.107.42.14","TCP","1494","50364  >  443 [ACK] Seq=12222 Ack=157982 Win=4096 Len=1440 [TCP segment of a reassembled PDU]"
"249","1.419344","100.65.82.205","13.107.42.14","TCP","1494","50364  >  443 [ACK] Seq=13662 Ack=157982 Win=4096 Len=1440 [TCP segment of a reassembled PDU]"
"250","1.419373","100.65.82.205","13.107.42.14","TLSv1.2","534","Application Data"
"251","1.428911","13.107.42.14","100.65.82.205","TCP","56","443  >  50364 [ACK] Seq=157982 Ack=9342 Win=16385 Len=0"
"252","1.429916","13.107.42.14","100.65.82.205","TCP","56","443  >  50364 [ACK] Seq=157982 Ack=15582 Win=16383 Len=0"
"253","1.486756","13.107.42.14","100.65.82.205","TLSv1.2","370","Application Data"
"254","1.486847","100.65.82.205","13.107.42.14","TCP","54","50364  >  443 [ACK] Seq=15582 Ack=158298 Win=4096 Len=0"
"255","1.504948","13.107.42.14","100.65.82.205","TCP","1514","443  >  50364 [ACK] Seq=158298 Ack=15582 Win=16383 Len=1460 [TCP segment of a reassembled PDU]"
"256","1.505273","13.107.42.14","100.65.82.205","TLSv1.2","1464","Application Data"
"257","1.505353","100.65.82.205","13.107.42.14","TCP","54","50364  >  443 [ACK] Seq=15582 Ack=161168 Win=4096 Len=0"
"258","2.446015","100.65.82.205","13.107.42.14","TCP","1494","50364  >  443 [ACK] Seq=15582 Ack=161168 Win=4096 Len=1440 [TCP segment of a reassembled PDU]"
"259","2.446021","100.65.82.205","13.107.42.14","TCP","1494","50364  >  443 [ACK] Seq=17022 Ack=161168 Win=4096 Len=1440 [TCP segment of a reassembled PDU]"
"260","2.446094","100.65.82.205","13.107.42.14","TLSv1.2","202","Application Data"
"261","2.446142","100.65.82.205","13.107.42.14","TLSv1.2","686","Application Data"
"262","2.456558","13.107.42.14","100.65.82.205","TCP","56","443  >  50364 [ACK] Seq=161168 Ack=18610 Win=16385 Len=0"
"263","2.456559","13.107.42.14","100.65.82.205","TCP","56","443  >  50364 [ACK] Seq=161168 Ack=19242 Win=16382 Len=0"
"264","2.547879","13.107.42.14","100.65.82.205","TLSv1.2","483","Application Data"
"265","2.547969","100.65.82.205","13.107.42.14","TCP","54","50364  >  443 [ACK] Seq=19242 Ack=161597 Win=4089 Len=0"
"266","2.607552","100.65.82.205","13.107.42.14","TCP","1494","50364  >  443 [ACK] Seq=19242 Ack=161597 Win=4096 Len=1440 [TCP segment of a reassembled PDU]"
"267","2.607557","100.65.82.205","13.107.42.14","TCP","1494","50364  >  443 [ACK] Seq=20682 Ack=161597 Win=4096 Len=1440 [TCP segment of a reassembled PDU]"
"268","2.607600","100.65.82.205","13.107.42.14","TLSv1.2","205","Application Data"
"269","2.607701","100.65.82.205","13.107.42.14","TCP","1494","50364  >  443 [ACK] Seq=22273 Ack=161597 Win=4096 Len=1440 [TCP segment of a reassembled PDU]"
"270","2.607703","100.65.82.205","13.107.42.14","TCP","1494","50364  >  443 [ACK] Seq=23713 Ack=161597 Win=4096 Len=1440 [TCP segment of a reassembled PDU]"
"271","2.607716","100.65.82.205","13.107.42.14","TLSv1.2","177","Application Data"
"272","2.607776","100.65.82.205","13.107.42.14","TCP","1494","50364  >  443 [ACK] Seq=25276 Ack=161597 Win=4096 Len=1440 [TCP segment of a reassembled PDU]"
"273","2.607778","100.65.82.205","13.107.42.14","TCP","1494","50364  >  443 [ACK] Seq=26716 Ack=161597 Win=4096 Len=1440 [TCP segment of a reassembled PDU]"
"274","2.607788","100.65.82.205","13.107.42.14","TLSv1.2","708","Application Data"
"275","2.617015","100.65.82.205","13.107.42.14","TCP","1494","50364  >  443 [ACK] Seq=28810 Ack=161597 Win=4096 Len=1440 [TCP segment of a reassembled PDU]"
"276","2.617020","100.65.82.205","13.107.42.14","TCP","1494","50364  >  443 [ACK] Seq=30250 Ack=161597 Win=4096 Len=1440 [TCP segment of a reassembled PDU]"
"277","2.617073","100.65.82.205","13.107.42.14","TLSv1.2","245","Application Data"
"278","2.617569","100.65.82.205","13.107.42.14","TCP","1494","50364  >  443 [ACK] Seq=31881 Ack=161597 Win=4096 Len=1440 [TCP segment of a reassembled PDU]"
"279","2.617574","100.65.82.205","13.107.42.14","TCP","1494","50364  >  443 [ACK] Seq=33321 Ack=161597 Win=4096 Len=1440 [TCP segment of a reassembled PDU]"
"280","2.617645","100.65.82.205","13.107.42.14","TLSv1.2","248","Application Data"
"281","2.617792","100.65.82.205","13.107.42.14","TCP","1494","50364  >  443 [ACK] Seq=34955 Ack=161597 Win=4096 Len=1440 [TCP segment of a reassembled PDU]"
"282","2.617795","100.65.82.205","13.107.42.14","TCP","1494","50364  >  443 [ACK] Seq=36395 Ack=161597 Win=4096 Len=1440 [TCP segment of a reassembled PDU]"
"283","2.617838","100.65.82.205","13.107.42.14","TLSv1.2","228","Application Data"
"284","2.618138","100.65.82.205","13.107.42.14","TCP","1494","50364  >  443 [ACK] Seq=38009 Ack=161597 Win=4096 Len=1440 [TCP segment of a reassembled PDU]"
"285","2.618142","100.65.82.205","13.107.42.14","TCP","1494","50364  >  443 [ACK] Seq=39449 Ack=161597 Win=4096 Len=1440 [TCP segment of a reassembled PDU]"
"286","2.618238","100.65.82.205","13.107.42.14","TLSv1.2","525","Application Data"
"287","2.620892","13.107.42.14","100.65.82.205","TCP","56","443  >  50364 [ACK] Seq=161597 Ack=20682 Win=16385 Len=0"
"288","2.620893","13.107.42.14","100.65.82.205","TCP","56","443  >  50364 [ACK] Seq=161597 Ack=22273 Win=16385 Len=0"
"289","2.621264","13.107.42.14","100.65.82.205","TCP","56","443  >  50364 [ACK] Seq=161597 Ack=28810 Win=16385 Len=0"
"290","2.623635","100.65.82.205","13.107.42.14","TCP","1494","50364  >  443 [ACK] Seq=41360 Ack=161597 Win=4096 Len=1440 [TCP segment of a reassembled PDU]"
"291","2.623642","100.65.82.205","13.107.42.14","TCP","1494","50364  >  443 [ACK] Seq=42800 Ack=161597 Win=4096 Len=1440 [TCP segment of a reassembled PDU]"
"292","2.623644","100.65.82.205","13.107.42.14","TCP","1494","50364  >  443 [ACK] Seq=44240 Ack=161597 Win=4096 Len=1440 [TCP segment of a reassembled PDU]"
"293","2.623646","100.65.82.205","13.107.42.14","TCP","1494","50364  >  443 [ACK] Seq=45680 Ack=161597 Win=4096 Len=1440 [TCP segment of a reassembled PDU]"
"294","2.623758","100.65.82.205","13.107.42.14","TLSv1.2","537","Application Data"
"295","2.624062","100.65.82.205","13.107.42.14","TCP","1494","50364  >  443 [ACK] Seq=47603 Ack=161597 Win=4096 Len=1440 [TCP segment of a reassembled PDU]"
"296","2.624066","100.65.82.205","13.107.42.14","TCP","1494","50364  >  443 [ACK] Seq=49043 Ack=161597 Win=4096 Len=1440 [TCP segment of a reassembled PDU]"
"297","2.624094","100.65.82.205","13.107.42.14","TLSv1.2","269","Application Data"
"298","2.624306","100.65.82.205","13.107.42.14","TCP","1494","50364  >  443 [ACK] Seq=50698 Ack=161597 Win=4096 Len=1440 [TCP segment of a reassembled PDU]"
"299","2.624310","100.65.82.205","13.107.42.14","TCP","1494","50364  >  443 [ACK] Seq=52138 Ack=161597 Win=4096 Len=1440 [TCP segment of a reassembled PDU]"
"300","2.624365","100.65.82.205","13.107.42.14","TLSv1.2","270","Application Data"
"301","2.624518","100.65.82.205","13.107.42.14","TCP","1494","50364  >  443 [ACK] Seq=53794 Ack=161597 Win=4096 Len=1440 [TCP segment of a reassembled PDU]"
"302","2.624521","100.65.82.205","13.107.42.14","TCP","1494","50364  >  443 [ACK] Seq=55234 Ack=161597 Win=4096 Len=1440 [TCP segment of a reassembled PDU]"
"303","2.624550","100.65.82.205","13.107.42.14","TLSv1.2","222","Application Data"
"304","2.624665","100.65.82.205","13.107.42.14","TCP","1494","50364  >  443 [ACK] Seq=56842 Ack=161597 Win=4096 Len=1440 [TCP segment of a reassembled PDU]"
"305","2.624667","100.65.82.205","13.107.42.14","TCP","1494","50364  >  443 [ACK] Seq=58282 Ack=161597 Win=4096 Len=1440 [TCP segment of a reassembled PDU]"
"306","2.624691","100.65.82.205","13.107.42.14","TLSv1.2","222","Application Data"
"307","2.624780","100.65.82.205","13.107.42.14","TCP","1494","50364  >  443 [ACK] Seq=59890 Ack=161597 Win=4096 Len=1440 [TCP segment of a reassembled PDU]"
"308","2.624782","100.65.82.205","13.107.42.14","TCP","1494","50364  >  443 [ACK] Seq=61330 Ack=161597 Win=4096 Len=1440 [TCP segment of a reassembled PDU]"
"309","2.624805","100.65.82.205","13.107.42.14","TLSv1.2","160","Application Data"
"310","2.624889","100.65.82.205","13.107.42.14","TCP","1494","50364  >  443 [ACK] Seq=62876 Ack=161597 Win=4096 Len=1440 [TCP segment of a reassembled PDU]"
"311","2.624891","100.65.82.205","13.107.42.14","TCP","1494","50364  >  443 [ACK] Seq=64316 Ack=161597 Win=4096 Len=1440 [TCP segment of a reassembled PDU]"
"312","2.624956","100.65.82.205","13.107.42.14","TLSv1.2","160","Application Data"
"313","2.625101","100.65.82.205","13.107.42.14","TCP","1494","50364  >  443 [ACK] Seq=65862 Ack=161597 Win=4096 Len=1440 [TCP segment of a reassembled PDU]"
"314","2.625104","100.65.82.205","13.107.42.14","TCP","1494","50364  >  443 [ACK] Seq=67302 Ack=161597 Win=4096 Len=1440 [TCP segment of a reassembled PDU]"
"315","2.625127","100.65.82.205","13.107.42.14","TLSv1.2","200","Application Data"
"316","2.625682","100.65.82.205","13.107.42.14","TCP","1494","50364  >  443 [ACK] Seq=68888 Ack=161597 Win=4096 Len=1440 [TCP segment of a reassembled PDU]"
"317","2.625688","100.65.82.205","13.107.42.14","TCP","1494","50364  >  443 [ACK] Seq=70328 Ack=161597 Win=4096 Len=1440 [TCP segment of a reassembled PDU]"
"318","2.625740","100.65.82.205","13.107.42.14","TLSv1.2","183","Application Data"
"319","2.625864","100.65.82.205","13.107.42.14","TCP","1494","50364  >  443 [ACK] Seq=71897 Ack=161597 Win=4096 Len=1440 [TCP segment of a reassembled PDU]"
"320","2.625867","100.65.82.205","13.107.42.14","TCP","1494","50364  >  443 [ACK] Seq=73337 Ack=161597 Win=4096 Len=1440 [TCP segment of a reassembled PDU]"
"321","2.625887","100.65.82.205","13.107.42.14","TLSv1.2","163","Application Data"
"322","2.625989","100.65.82.205","13.107.42.14","TCP","1494","50364  >  443 [ACK] Seq=74886 Ack=161597 Win=4096 Len=1440 [TCP segment of a reassembled PDU]"
"323","2.625991","100.65.82.205","13.107.42.14","TCP","1494","50364  >  443 [ACK] Seq=76326 Ack=161597 Win=4096 Len=1440 [TCP segment of a reassembled PDU]"
"324","2.626021","100.65.82.205","13.107.42.14","TLSv1.2","310","Application Data"
