"No.","Time","Source","Destination","Protocol","Length","Info"
"1","0.000000","2600:8805:3803:6100:357c:4644:40b6:e846","2620:1ec:21::14","TLSv1.2","953","Application Data"
"2","0.000163","2600:8805:3803:6100:357c:4644:40b6:e846","2620:1ec:21::14","TCP","1474","50885  >  443 [ACK] Seq=880 Ack=1 Win=4096 Len=1400 [TCP segment of a reassembled PDU]"
"3","0.000203","2600:8805:3803:6100:357c:4644:40b6:e846","2620:1ec:21::14","TLSv1.2","422","Application Data"
"4","0.021603","2620:1ec:21::14","2600:8805:3803:6100:357c:4644:40b6:e846","TCP","74","443  >  50885 [ACK] Seq=1 Ack=880 Win=16381 Len=0"
"5","0.023010","2620:1ec:21::14","2600:8805:3803:6100:357c:4644:40b6:e846","TCP","74","443  >  50885 [ACK] Seq=1 Ack=2280 Win=16385 Len=0"
"6","0.023298","2620:1ec:21::14","2600:8805:3803:6100:357c:4644:40b6:e846","TCP","74","443  >  50885 [ACK] Seq=1 Ack=2628 Win=16384 Len=0"
"7","0.086245","2600:8805:3803:6100:357c:4644:40b6:e846","2620:1ec:21::14","TCP","1474","50885  >  443 [ACK] Seq=2628 Ack=1 Win=4096 Len=1400 [TCP segment of a reassembled PDU]"
"8","0.086343","2600:8805:3803:6100:357c:4644:40b6:e846","2620:1ec:21::14","TLSv1.2","1049","Application Data"
"9","0.088162","2620:1ec:21::14","2600:8805:3803:6100:357c:4644:40b6:e846","TLSv1.2","475","Application Data"
"10","0.088227","2600:8805:3803:6100:357c:4644:40b6:e846","2620:1ec:21::14","TCP","74","50885  >  443 [ACK] Seq=5003 Ack=402 Win=4089 Len=0"
"11","0.105019","2620:1ec:21::14","2600:8805:3803:6100:357c:4644:40b6:e846","TCP","74","443  >  50885 [ACK] Seq=402 Ack=4028 Win=16385 Len=0"
"12","0.109282","2620:1ec:21::14","2600:8805:3803:6100:357c:4644:40b6:e846","TCP","74","443  >  50885 [ACK] Seq=402 Ack=5003 Win=16381 Len=0"
"13","0.260933","2620:1ec:21::14","2600:8805:3803:6100:357c:4644:40b6:e846","TLSv1.2","613","Application Data"
"14","0.260933","2620:1ec:21::14","2600:8805:3803:6100:357c:4644:40b6:e846","TLSv1.2","112","Application Data"
"15","0.260988","2600:8805:3803:6100:357c:4644:40b6:e846","2620:1ec:21::14","TCP","74","50885  >  443 [ACK] Seq=5003 Ack=979 Win=4086 Len=0"
"16","0.304942","2600:8805:3803:6100:357c:4644:40b6:e846","2620:1ec:21::14","TCP","1474","50885  >  443 [ACK] Seq=5003 Ack=979 Win=4096 Len=1400 [TCP segment of a reassembled PDU]"
"17","0.305127","2600:8805:3803:6100:357c:4644:40b6:e846","2620:1ec:21::14","TLSv1.2","1323","Application Data"
"18","0.305228","2600:8805:3803:6100:357c:4644:40b6:e846","2620:1ec:21::14","TLSv1.2","528","Application Data"
"19","0.324649","2620:1ec:21::14","2600:8805:3803:6100:357c:4644:40b6:e846","TCP","74","443  >  50885 [ACK] Seq=979 Ack=6403 Win=16385 Len=0"
"20","0.327269","2620:1ec:21::14","2600:8805:3803:6100:357c:4644:40b6:e846","TCP","74","443  >  50885 [ACK] Seq=979 Ack=8106 Win=16385 Len=0"
"21","0.341535","2600:8805:3803:6100:357c:4644:40b6:e846","2620:1ec:21::14","TCP","1474","50885  >  443 [ACK] Seq=8106 Ack=979 Win=4096 Len=1400 [TCP segment of a reassembled PDU]"
"22","0.341540","2600:8805:3803:6100:357c:4644:40b6:e846","2620:1ec:21::14","TCP","1474","50885  >  443 [ACK] Seq=9506 Ack=979 Win=4096 Len=1400 [TCP segment of a reassembled PDU]"
"23","0.341613","2600:8805:3803:6100:357c:4644:40b6:e846","2620:1ec:21::14","TLSv1.2","318","Application Data"
"24","0.350320","2600:8805:3803:6100:357c:4644:40b6:e846","2620:1ec:21::14","TLSv1.2","953","Application Data"
"25","0.350719","2600:8805:3803:6100:357c:4644:40b6:e846","2620:1ec:21::14","TLSv1.2","458","Application Data"
"26","0.357390","2620:1ec:21::14","2600:8805:3803:6100:357c:4644:40b6:e846","TCP","74","443  >  50885 [ACK] Seq=979 Ack=9506 Win=16380 Len=0"
"27","0.357785","2620:1ec:21::14","2600:8805:3803:6100:357c:4644:40b6:e846","TCP","74","443  >  50885 [ACK] Seq=979 Ack=11150 Win=16385 Len=0"
"28","0.360088","2600:8805:3803:6100:357c:4644:40b6:e846","2620:1ec:21::14","TCP","1474","50885  >  443 [ACK] Seq=12413 Ack=979 Win=4096 Len=1400 [TCP segment of a reassembled PDU]"
"29","0.360245","2600:8805:3803:6100:357c:4644:40b6:e846","2620:1ec:21::14","TLSv1.2","1020","Application Data"
"30","0.367238","2620:1ec:21::14","2600:8805:3803:6100:357c:4644:40b6:e846","TCP","74","443  >  50885 [ACK] Seq=979 Ack=12029 Win=16382 Len=0"
"31","0.375376","2620:1ec:21::14","2600:8805:3803:6100:357c:4644:40b6:e846","TCP","74","443  >  50885 [ACK] Seq=979 Ack=12413 Win=16380 Len=0"
"32","0.378065","2620:1ec:21::14","2600:8805:3803:6100:357c:4644:40b6:e846","TCP","74","443  >  50885 [ACK] Seq=979 Ack=13813 Win=16385 Len=0"
"33","0.378407","2620:1ec:21::14","2600:8805:3803:6100:357c:4644:40b6:e846","TCP","74","443  >  50885 [ACK] Seq=979 Ack=14759 Win=16381 Len=0"
"34","0.420982","2620:1ec:21::14","2600:8805:3803:6100:357c:4644:40b6:e846","TLSv1.2","449","Application Data"
"35","0.421045","2600:8805:3803:6100:357c:4644:40b6:e846","2620:1ec:21::14","TCP","74","50885  >  443 [ACK] Seq=14759 Ack=1354 Win=4090 Len=0"
"36","0.421446","2620:1ec:21::14","2600:8805:3803:6100:357c:4644:40b6:e846","TLSv1.2","122","Application Data"
"37","0.421446","2620:1ec:21::14","2600:8805:3803:6100:357c:4644:40b6:e846","TLSv1.2","112","Application Data"
"38","0.421497","2600:8805:3803:6100:357c:4644:40b6:e846","2620:1ec:21::14","TCP","74","50885  >  443 [ACK] Seq=14759 Ack=1440 Win=4094 Len=0"
"39","0.441737","2620:1ec:21::14","2600:8805:3803:6100:357c:4644:40b6:e846","TLSv1.2","249","Application Data"
"40","0.441792","2600:8805:3803:6100:357c:4644:40b6:e846","2620:1ec:21::14","TCP","74","50885  >  443 [ACK] Seq=14759 Ack=1615 Win=4093 Len=0"
"41","0.497820","2620:1ec:21::14","2600:8805:3803:6100:357c:4644:40b6:e846","TLSv1.2","617","Application Data"
"42","0.497820","2620:1ec:21::14","2600:8805:3803:6100:357c:4644:40b6:e846","TLSv1.2","112","Application Data"
"43","0.497936","2600:8805:3803:6100:357c:4644:40b6:e846","2620:1ec:21::14","TCP","74","50885  >  443 [ACK] Seq=14759 Ack=2196 Win=4086 Len=0"
"44","0.499366","2600:8805:3803:6100:357c:4644:40b6:e846","2620:1ec:21::14","TLSv1.2","931","Application Data"
"45","0.517252","2620:1ec:21::14","2600:8805:3803:6100:357c:4644:40b6:e846","TCP","74","443  >  50885 [ACK] Seq=2196 Ack=15616 Win=16385 Len=0"
"46","0.634333","2620:1ec:21::14","2600:8805:3803:6100:357c:4644:40b6:e846","TCP","1514","443  >  50885 [ACK] Seq=2196 Ack=15616 Win=16385 Len=1440 [TCP segment of a reassembled PDU]"
"47","0.634399","2600:8805:3803:6100:357c:4644:40b6:e846","2620:1ec:21::14","TCP","74","50885  >  443 [ACK] Seq=15616 Ack=3636 Win=4073 Len=0"
"48","0.634679","2620:1ec:21::14","2600:8805:3803:6100:357c:4644:40b6:e846","TLSv1.2","324","Application Data"
"49","0.634679","2620:1ec:21::14","2600:8805:3803:6100:357c:4644:40b6:e846","TLSv1.2","112","Application Data"
"50","0.634722","2600:8805:3803:6100:357c:4644:40b6:e846","2620:1ec:21::14","TCP","74","50885  >  443 [ACK] Seq=15616 Ack=3924 Win=4091 Len=0"
"51","0.645676","2620:1ec:21::14","2600:8805:3803:6100:357c:4644:40b6:e846","TLSv1.2","657","Application Data"
"52","0.645676","2620:1ec:21::14","2600:8805:3803:6100:357c:4644:40b6:e846","TLSv1.2","112","Application Data"
"53","0.645740","2600:8805:3803:6100:357c:4644:40b6:e846","2620:1ec:21::14","TCP","74","50885  >  443 [ACK] Seq=15616 Ack=4545 Win=4086 Len=0"
"54","0.906118","2600:8805:3803:6100:357c:4644:40b6:e846","2620:1ec:21::14","TCP","1474","50885  >  443 [ACK] Seq=15616 Ack=4545 Win=4096 Len=1400 [TCP segment of a reassembled PDU]"
"55","0.906153","2600:8805:3803:6100:357c:4644:40b6:e846","2620:1ec:21::14","TLSv1.2","755","Application Data"
"56","0.928561","2620:1ec:21::14","2600:8805:3803:6100:357c:4644:40b6:e846","TCP","74","443  >  50885 [ACK] Seq=4545 Ack=17016 Win=16380 Len=0"
"57","0.928561","2620:1ec:21::14","2600:8805:3803:6100:357c:4644:40b6:e846","TCP","74","443  >  50885 [ACK] Seq=4545 Ack=17697 Win=16385 Len=0"
"58","1.059748","2600:8805:3803:6100:357c:4644:40b6:e846","2620:1ec:21::14","TCP","1474","50885  >  443 [ACK] Seq=17697 Ack=4545 Win=4096 Len=1400 [TCP segment of a reassembled PDU]"
"59","1.059802","2600:8805:3803:6100:357c:4644:40b6:e846","2620:1ec:21::14","TLSv1.2","1078","Application Data"
"60","1.059889","2600:8805:3803:6100:357c:4644:40b6:e846","2620:1ec:21::14","TCP","1474","50885  >  443 [ACK] Seq=20101 Ack=4545 Win=4096 Len=1400 [TCP segment of a reassembled PDU]"
"61","1.059892","2600:8805:3803:6100:357c:4644:40b6:e846","2620:1ec:21::14","TCP","1474","50885  >  443 [ACK] Seq=21501 Ack=4545 Win=4096 Len=1400 [TCP segment of a reassembled PDU]"
"62","1.059894","2600:8805:3803:6100:357c:4644:40b6:e846","2620:1ec:21::14","TCP","1474","50885  >  443 [ACK] Seq=22901 Ack=4545 Win=4096 Len=1400 [TCP segment of a reassembled PDU]"
"63","1.059910","2600:8805:3803:6100:357c:4644:40b6:e846","2620:1ec:21::14","TLSv1.2","389","Application Data"
"64","1.075436","2620:1ec:21::14","2600:8805:3803:6100:357c:4644:40b6:e846","TCP","74","443  >  50885 [ACK] Seq=4545 Ack=19097 Win=16380 Len=0"
"65","1.075842","2620:1ec:21::14","2600:8805:3803:6100:357c:4644:40b6:e846","TCP","74","443  >  50885 [ACK] Seq=4545 Ack=20101 Win=16385 Len=0"
"66","1.076230","2620:1ec:21::14","2600:8805:3803:6100:357c:4644:40b6:e846","TCP","74","443  >  50885 [ACK] Seq=4545 Ack=22901 Win=16385 Len=0"
"67","1.076817","2620:1ec:21::14","2600:8805:3803:6100:357c:4644:40b6:e846","TCP","74","443  >  50885 [ACK] Seq=4545 Ack=24616 Win=16385 Len=0"
"68","1.083311","2600:8805:3803:6100:357c:4644:40b6:e846","2620:1ec:21::14","TCP","1474","50885  >  443 [ACK] Seq=24616 Ack=4545 Win=4096 Len=1400 [TCP segment of a reassembled PDU]"
"69","1.083376","2600:8805:3803:6100:357c:4644:40b6:e846","2620:1ec:21::14","TLSv1.2","1301","Application Data"
"70","1.083434","2600:8805:3803:6100:357c:4644:40b6:e846","2620:1ec:21::14","TCP","1474","50885  >  443 [ACK] Seq=27243 Ack=4545 Win=4096 Len=1400 [TCP segment of a reassembled PDU]"
"71","1.083437","2600:8805:3803:6100:357c:4644:40b6:e846","2620:1ec:21::14","TCP","1474","50885  >  443 [ACK] Seq=28643 Ack=4545 Win=4096 Len=1400 [TCP segment of a reassembled PDU]"
"72","1.083447","2600:8805:3803:6100:357c:4644:40b6:e846","2620:1ec:21::14","TLSv1.2","82","Application Data"
"73","1.089259","2600:8805:3803:6100:357c:4644:40b6:e846","2620:1ec:21::14","TCP","1474","50885  >  443 [ACK] Seq=30051 Ack=4545 Win=4096 Len=1400 [TCP segment of a reassembled PDU]"
"74","1.089316","2600:8805:3803:6100:357c:4644:40b6:e846","2620:1ec:21::14","TLSv1.2","1301","Application Data"
"75","1.089358","2600:8805:3803:6100:357c:4644:40b6:e846","2620:1ec:21::14","TCP","1474","50885  >  443 [ACK] Seq=32678 Ack=4545 Win=4096 Len=1400 [TCP segment of a reassembled PDU]"
"76","1.089360","2600:8805:3803:6100:357c:4644:40b6:e846","2620:1ec:21::14","TCP","1474","50885  >  443 [ACK] Seq=34078 Ack=4545 Win=4096 Len=1400 [TCP segment of a reassembled PDU]"
"77","1.089370","2600:8805:3803:6100:357c:4644:40b6:e846","2620:1ec:21::14","TLSv1.2","671","Application Data"
"78","1.093628","2600:8805:3803:6100:357c:4644:40b6:e846","2620:1ec:21::14","TCP","1474","50885  >  443 [ACK] Seq=36075 Ack=4545 Win=4096 Len=1400 [TCP segment of a reassembled PDU]"
"79","1.093687","2600:8805:3803:6100:357c:4644:40b6:e846","2620:1ec:21::14","TLSv1.2","1301","Application Data"
"80","1.093750","2600:8805:3803:6100:357c:4644:40b6:e846","2620:1ec:21::14","TCP","1474","50885  >  443 [ACK] Seq=38702 Ack=4545 Win=4096 Len=1400 [TCP segment of a reassembled PDU]"
"81","1.093761","2600:8805:3803:6100:357c:4644:40b6:e846","2620:1ec:21::14","TLSv1.2","1454","Application Data"
"82","1.102486","2620:1ec:21::14","2600:8805:3803:6100:357c:4644:40b6:e846","TCP","74","443  >  50885 [ACK] Seq=4545 Ack=26016 Win=16380 Len=0"
"83","1.103461","2620:1ec:21::14","2600:8805:3803:6100:357c:4644:40b6:e846","TCP","74","443  >  50885 [ACK] Seq=4545 Ack=27243 Win=16385 Len=0"
"84","1.103531","2600:8805:3803:6100:357c:4644:40b6:e846","2620:1ec:21::14","TCP","1474","50885  >  443 [ACK] Seq=41482 Ack=4545 Win=4096 Len=1400 [TCP segment of a reassembled PDU]"
"85","1.103535","2600:8805:3803:6100:357c:4644:40b6:e846","2620:1ec:21::14","TCP","1474","50885  >  443 [ACK] Seq=42882 Ack=4545 Win=4096 Len=1400 [TCP segment of a reassembled PDU]"
"86","1.103560","2600:8805:3803:6100:357c:4644:40b6:e846","2620:1ec:21::14","TLSv1.2","284","Application Data"
"87","1.103596","2600:8805:3803:6100:357c:4644:40b6:e846","2620:1ec:21::14","TLSv1.2","703","Application Data"
"88","1.103820","2620:1ec:21::14","2600:8805:3803:6100:357c:4644:40b6:e846","TCP","74","443  >  50885 [ACK] Seq=4545 Ack=28643 Win=16380 Len=0"
"89","1.104288","2620:1ec:21::14","2600:8805:3803:6100:357c:4644:40b6:e846","TCP","74","443  >  50885 [ACK] Seq=4545 Ack=30043 Win=16385 Len=0"
"90","1.104288","2620:1ec:21::14","2600:8805:3803:6100:357c:4644:40b6:e846","TCP","74","443  >  50885 [ACK] Seq=4545 Ack=30051 Win=16385 Len=0"
"91","1.104834","2620:1ec:21::14","2600:8805:3803:6100:357c:4644:40b6:e846","TCP","1514","443  >  50885 [ACK] Seq=4545 Ack=30051 Win=16385 Len=1440 [TCP segment of a reassembled PDU]"
"92","1.104893","2600:8805:3803:6100:357c:4644:40b6:e846","2620:1ec:21::14","TCP","74","50885  >  443 [ACK] Seq=45121 Ack=5985 Win=4073 Len=0"
"93","1.106126","2620:1ec:21::14","2600:8805:3803:6100:357c:4644:40b6:e846","TCP","1514","443  >  50885 [ACK] Seq=5985 Ack=30051 Win=16385 Len=1440 [TCP segment of a reassembled PDU]"
"94","1.106126","2620:1ec:21::14","2600:8805:3803:6100:357c:4644:40b6:e846","TCP","1514","443  >  50885 [ACK] Seq=7425 Ack=30051 Win=16385 Len=1440 [TCP segment of a reassembled PDU]"
"95","1.106127","2620:1ec:21::14","2600:8805:3803:6100:357c:4644:40b6:e846","TLSv1.2","749","Application Data"
"96","1.106127","2620:1ec:21::14","2600:8805:3803:6100:357c:4644:40b6:e846","TLSv1.2","918","Application Data"
"97","1.106127","2620:1ec:21::14","2600:8805:3803:6100:357c:4644:40b6:e846","TLSv1.2","112","Application Data"
"98","1.106174","2600:8805:3803:6100:357c:4644:40b6:e846","2620:1ec:21::14","TCP","74","50885  >  443 [ACK] Seq=45121 Ack=10422 Win=4026 Len=0"
"99","1.106233","2600:8805:3803:6100:357c:4644:40b6:e846","2620:1ec:21::14","TCP","74","[TCP Window Update] 50885  >  443 [ACK] Seq=45121 Ack=10422 Win=4096 Len=0"
"100","1.107416","2620:1ec:21::14","2600:8805:3803:6100:357c:4644:40b6:e846","TCP","74","443  >  50885 [ACK] Seq=10422 Ack=31451 Win=16380 Len=0"
"101","1.108208","2620:1ec:21::14","2600:8805:3803:6100:357c:4644:40b6:e846","TCP","74","443  >  50885 [ACK] Seq=10422 Ack=32678 Win=16385 Len=0"
"102","1.108549","2620:1ec:21::14","2600:8805:3803:6100:357c:4644:40b6:e846","TCP","74","443  >  50885 [ACK] Seq=10422 Ack=34078 Win=16380 Len=0"
"103","1.108927","2620:1ec:21::14","2600:8805:3803:6100:357c:4644:40b6:e846","TCP","74","443  >  50885 [ACK] Seq=10422 Ack=35478 Win=16385 Len=0"
"104","1.108927","2620:1ec:21::14","2600:8805:3803:6100:357c:4644:40b6:e846","TCP","74","443  >  50885 [ACK] Seq=10422 Ack=36075 Win=16383 Len=0"
"105","1.108927","2620:1ec:21::14","2600:8805:3803:6100:357c:4644:40b6:e846","TLSv1.2","116","Application Data"
"106","1.108987","2600:8805:3803:6100:357c:4644:40b6:e846","2620:1ec:21::14","TCP","74","50885  >  443 [ACK] Seq=45121 Ack=10464 Win=4095 Len=0"
"107","1.113517","2620:1ec:21::14","2600:8805:3803:6100:357c:4644:40b6:e846","TCP","74","443  >  50885 [ACK] Seq=10464 Ack=37475 Win=16385 Len=0"
"108","1.114106","2620:1ec:21::14","2600:8805:3803:6100:357c:4644:40b6:e846","TCP","74","443  >  50885 [ACK] Seq=10464 Ack=38702 Win=16380 Len=0"
"109","1.114903","2620:1ec:21::14","2600:8805:3803:6100:357c:4644:40b6:e846","TCP","74","443  >  50885 [ACK] Seq=10464 Ack=40102 Win=16385 Len=0"
"110","1.114904","2620:1ec:21::14","2600:8805:3803:6100:357c:4644:40b6:e846","TCP","74","443  >  50885 [ACK] Seq=10464 Ack=41482 Win=16380 Len=0"
"111","1.120737","2620:1ec:21::14","2600:8805:3803:6100:357c:4644:40b6:e846","TCP","74","443  >  50885 [ACK] Seq=10464 Ack=42882 Win=16385 Len=0"
"112","1.121019","2620:1ec:21::14","2600:8805:3803:6100:357c:4644:40b6:e846","TCP","74","443  >  50885 [ACK] Seq=10464 Ack=44282 Win=16380 Len=0"
"113","1.121020","2620:1ec:21::14","2600:8805:3803:6100:357c:4644:40b6:e846","TCP","74","443  >  50885 [ACK] Seq=10464 Ack=44492 Win=16385 Len=0"
"114","1.125531","2620:1ec:21::14","2600:8805:3803:6100:357c:4644:40b6:e846","TCP","74","443  >  50885 [ACK] Seq=10464 Ack=45121 Win=16383 Len=0"
"115","1.150380","2620:1ec:21::14","2600:8805:3803:6100:357c:4644:40b6:e846","TLSv1.2","429","Application Data"
"116","1.150484","2600:8805:3803:6100:357c:4644:40b6:e846","2620:1ec:21::14","TCP","74","50885  >  443 [ACK] Seq=45121 Ack=10819 Win=4090 Len=0"
"117","1.170813","2620:1ec:21::14","2600:8805:3803:6100:357c:4644:40b6:e846","TLSv1.2","256","Application Data"
"118","1.170878","2600:8805:3803:6100:357c:4644:40b6:e846","2620:1ec:21::14","TCP","74","50885  >  443 [ACK] Seq=45121 Ack=11001 Win=4093 Len=0"
"119","1.186451","2620:1ec:21::14","2600:8805:3803:6100:357c:4644:40b6:e846","TLSv1.2","437","Application Data, Application Data"
"120","1.186535","2600:8805:3803:6100:357c:4644:40b6:e846","2620:1ec:21::14","TCP","74","50885  >  443 [ACK] Seq=45121 Ack=11364 Win=4090 Len=0"
"121","1.216852","2620:1ec:21::14","2600:8805:3803:6100:357c:4644:40b6:e846","TLSv1.2","319","Application Data"
"122","1.216940","2600:8805:3803:6100:357c:4644:40b6:e846","2620:1ec:21::14","TCP","74","50885  >  443 [ACK] Seq=45121 Ack=11609 Win=4092 Len=0"
"123","1.304564","2600:8805:3803:6100:357c:4644:40b6:e846","2620:1ec:21::14","TCP","1474","50885  >  443 [ACK] Seq=45121 Ack=11609 Win=4096 Len=1400 [TCP segment of a reassembled PDU]"
"124","1.304625","2600:8805:3803:6100:357c:4644:40b6:e846","2620:1ec:21::14","TLSv1.2","1348","Application Data"
"125","1.304694","2600:8805:3803:6100:357c:4644:40b6:e846","2620:1ec:21::14","TCP","1474","50885  >  443 [ACK] Seq=47795 Ack=11609 Win=4096 Len=1400 [TCP segment of a reassembled PDU]"
"126","1.304709","2600:8805:3803:6100:357c:4644:40b6:e846","2620:1ec:21::14","TLSv1.2","908","Application Data"
"127","1.319585","2620:1ec:21::14","2600:8805:3803:6100:357c:4644:40b6:e846","TCP","74","443  >  50885 [ACK] Seq=11609 Ack=46521 Win=16385 Len=0"
"128","1.320148","2620:1ec:21::14","2600:8805:3803:6100:357c:4644:40b6:e846","TCP","74","443  >  50885 [ACK] Seq=11609 Ack=47795 Win=16380 Len=0"
"129","1.320782","2620:1ec:21::14","2600:8805:3803:6100:357c:4644:40b6:e846","TCP","74","443  >  50885 [ACK] Seq=11609 Ack=50029 Win=16385 Len=0"
"130","1.376882","2620:1ec:21::14","2600:8805:3803:6100:357c:4644:40b6:e846","TLSv1.2","255","Application Data"
"131","1.376958","2600:8805:3803:6100:357c:4644:40b6:e846","2620:1ec:21::14","TCP","74","50885  >  443 [ACK] Seq=50029 Ack=11790 Win=4093 Len=0"
"132","1.395645","2600:8805:3803:6100:357c:4644:40b6:e846","2620:1ec:21::14","TCP","1474","50885  >  443 [ACK] Seq=50029 Ack=11790 Win=4096 Len=1400 [TCP segment of a reassembled PDU]"
"133","1.395651","2600:8805:3803:6100:357c:4644:40b6:e846","2620:1ec:21::14","TCP","1474","50885  >  443 [ACK] Seq=51429 Ack=11790 Win=4096 Len=1400 [TCP segment of a reassembled PDU]"
"134","1.395696","2600:8805:3803:6100:357c:4644:40b6:e846","2620:1ec:21::14","TLSv1.2","284","Application Data"
"135","1.395746","2600:8805:3803:6100:357c:4644:40b6:e846","2620:1ec:21::14","TLSv1.2","746","Application Data"
"136","1.411993","2620:1ec:21::14","2600:8805:3803:6100:357c:4644:40b6:e846","TCP","74","443  >  50885 [ACK] Seq=11790 Ack=51429 Win=16380 Len=0"
"137","1.412531","2620:1ec:21::14","2600:8805:3803:6100:357c:4644:40b6:e846","TCP","74","443  >  50885 [ACK] Seq=11790 Ack=52829 Win=16385 Len=0"
"138","1.412532","2620:1ec:21::14","2600:8805:3803:6100:357c:4644:40b6:e846","TCP","74","443  >  50885 [ACK] Seq=11790 Ack=53039 Win=16384 Len=0"
"139","1.412532","2620:1ec:21::14","2600:8805:3803:6100:357c:4644:40b6:e846","TCP","74","443  >  50885 [ACK] Seq=11790 Ack=53711 Win=16382 Len=0"
"140","1.502308","2620:1ec:21::14","2600:8805:3803:6100:357c:4644:40b6:e846","TLSv1.2","330","Application Data"
"141","1.502399","2600:8805:3803:6100:357c:4644:40b6:e846","2620:1ec:21::14","TCP","74","50885  >  443 [ACK] Seq=53711 Ack=12046 Win=4092 Len=0"
"142","2.243431","2600:8805:3803:6100:357c:4644:40b6:e846","2620:1ec:21::14","TCP","1474","50885  >  443 [ACK] Seq=53711 Ack=12046 Win=4096 Len=1400 [TCP segment of a reassembled PDU]"
"143","2.243473","2600:8805:3803:6100:357c:4644:40b6:e846","2620:1ec:21::14","TLSv1.2","1301","Application Data"
"144","2.243620","2600:8805:3803:6100:357c:4644:40b6:e846","2620:1ec:21::14","TCP","1474","50885  >  443 [ACK] Seq=56338 Ack=12046 Win=4096 Len=1400 [TCP segment of a reassembled PDU]"
"145","2.243637","2600:8805:3803:6100:357c:4644:40b6:e846","2620:1ec:21::14","TLSv1.2","1439","Application Data"
"146","2.243661","2600:8805:3803:6100:357c:4644:40b6:e846","2620:1ec:21::14","TLSv1.2","1090","Application Data"
"147","2.243683","2600:8805:3803:6100:357c:4644:40b6:e846","2620:1ec:21::14","TLSv1.2","1270","Application Data"
"148","2.267765","2620:1ec:21::14","2600:8805:3803:6100:357c:4644:40b6:e846","TCP","74","443  >  50885 [ACK] Seq=12046 Ack=55111 Win=16385 Len=0"
"149","2.268032","2620:1ec:21::14","2600:8805:3803:6100:357c:4644:40b6:e846","TCP","74","443  >  50885 [ACK] Seq=12046 Ack=56338 Win=16380 Len=0"
"150","2.268537","2620:1ec:21::14","2600:8805:3803:6100:357c:4644:40b6:e846","TCP","74","443  >  50885 [ACK] Seq=12046 Ack=57738 Win=16385 Len=0"
"151","2.269034","2620:1ec:21::14","2600:8805:3803:6100:357c:4644:40b6:e846","TCP","74","443  >  50885 [ACK] Seq=12046 Ack=60119 Win=16385 Len=0"
"152","2.269369","2620:1ec:21::14","2600:8805:3803:6100:357c:4644:40b6:e846","TCP","74","443  >  50885 [ACK] Seq=12046 Ack=61315 Win=16380 Len=0"
"153","2.333269","2620:1ec:21::14","2600:8805:3803:6100:357c:4644:40b6:e846","TLSv1.2","306","Application Data"
"154","2.333341","2600:8805:3803:6100:357c:4644:40b6:e846","2620:1ec:21::14","TCP","74","50885  >  443 [ACK] Seq=61315 Ack=12278 Win=4092 Len=0"
"155","2.353635","2620:1ec:21::14","2600:8805:3803:6100:357c:4644:40b6:e846","TLSv1.2","255","Application Data"
"156","2.353692","2600:8805:3803:6100:357c:4644:40b6:e846","2620:1ec:21::14","TCP","74","50885  >  443 [ACK] Seq=61315 Ack=12459 Win=4093 Len=0"
"157","4.649481","2600:8805:3803:6100:357c:4644:40b6:e846","2620:1ec:21::14","TLSv1.2","953","Application Data"
"158","4.649682","2600:8805:3803:6100:357c:4644:40b6:e846","2620:1ec:21::14","TCP","1474","50885  >  443 [ACK] Seq=62194 Ack=12459 Win=4096 Len=1400 [TCP segment of a reassembled PDU]"
"159","4.649725","2600:8805:3803:6100:357c:4644:40b6:e846","2620:1ec:21::14","TLSv1.2","409","Application Data"
"160","4.660514","2600:8805:3803:6100:357c:4644:40b6:e846","2620:1ec:21::14","TCP","1474","50885  >  443 [ACK] Seq=63929 Ack=12459 Win=4096 Len=1400 [TCP segment of a reassembled PDU]"
"161","4.660595","2600:8805:3803:6100:357c:4644:40b6:e846","2620:1ec:21::14","TLSv1.2","1112","Application Data"
"162","4.661039","2600:8805:3803:6100:357c:4644:40b6:e846","2620:1ec:21::14","TLSv1.2","994","Application Data"
"163","4.667367","2600:8805:3803:6100:357c:4644:40b6:e846","2620:1ec:21::14","TLSv1.2","266","Application Data"
"164","4.667475","2600:8805:3803:6100:357c:4644:40b6:e846","2620:1ec:21::14","TCP","1474","50885  >  443 [ACK] Seq=67479 Ack=12459 Win=4096 Len=1400 [TCP segment of a reassembled PDU]"
"165","4.667498","2600:8805:3803:6100:357c:4644:40b6:e846","2620:1ec:21::14","TLSv1.2","442","Application Data"
"166","4.668572","2620:1ec:21::14","2600:8805:3803:6100:357c:4644:40b6:e846","TCP","74","443  >  50885 [ACK] Seq=12459 Ack=62194 Win=16385 Len=0"
"167","4.671189","2620:1ec:21::14","2600:8805:3803:6100:357c:4644:40b6:e846","TCP","74","443  >  50885 [ACK] Seq=12459 Ack=63929 Win=16385 Len=0"
"168","4.677609","2620:1ec:21::14","2600:8805:3803:6100:357c:4644:40b6:e846","TCP","74","443  >  50885 [ACK] Seq=12459 Ack=65329 Win=16380 Len=0"
"169","4.678570","2620:1ec:21::14","2600:8805:3803:6100:357c:4644:40b6:e846","TCP","74","443  >  50885 [ACK] Seq=12459 Ack=66367 Win=16385 Len=0"
"170","4.678570","2620:1ec:21::14","2600:8805:3803:6100:357c:4644:40b6:e846","TCP","74","443  >  50885 [ACK] Seq=12459 Ack=67287 Win=16382 Len=0"
"171","4.684915","2620:1ec:21::14","2600:8805:3803:6100:357c:4644:40b6:e846","TCP","74","443  >  50885 [ACK] Seq=12459 Ack=67479 Win=16381 Len=0"
"172","4.684916","2620:1ec:21::14","2600:8805:3803:6100:357c:4644:40b6:e846","TCP","74","443  >  50885 [ACK] Seq=12459 Ack=68879 Win=16385 Len=0"
"173","4.684916","2620:1ec:21::14","2600:8805:3803:6100:357c:4644:40b6:e846","TCP","74","443  >  50885 [ACK] Seq=12459 Ack=69247 Win=16384 Len=0"
"174","4.742059","2620:1ec:21::14","2600:8805:3803:6100:357c:4644:40b6:e846","TLSv1.2","428","Application Data"
"175","4.742147","2600:8805:3803:6100:357c:4644:40b6:e846","2620:1ec:21::14","TCP","74","50885  >  443 [ACK] Seq=69247 Ack=12813 Win=4090 Len=0"
"176","4.756519","2600:8805:3803:6100:357c:4644:40b6:e846","2620:1ec:21::14","TCP","1474","50885  >  443 [ACK] Seq=69247 Ack=12813 Win=4096 Len=1400 [TCP segment of a reassembled PDU]"
"177","4.756566","2600:8805:3803:6100:357c:4644:40b6:e846","2620:1ec:21::14","TLSv1.2","560","Application Data"
"178","4.756622","2600:8805:3803:6100:357c:4644:40b6:e846","2620:1ec:21::14","TCP","1474","50885  >  443 [ACK] Seq=71133 Ack=12813 Win=4096 Len=1400 [TCP segment of a reassembled PDU]"
"179","4.756625","2600:8805:3803:6100:357c:4644:40b6:e846","2620:1ec:21::14","TCP","1474","50885  >  443 [ACK] Seq=72533 Ack=12813 Win=4096 Len=1400 [TCP segment of a reassembled PDU]"
"180","4.756627","2600:8805:3803:6100:357c:4644:40b6:e846","2620:1ec:21::14","TCP","1474","50885  >  443 [ACK] Seq=73933 Ack=12813 Win=4096 Len=1400 [TCP segment of a reassembled PDU]"
"181","4.756628","2600:8805:3803:6100:357c:4644:40b6:e846","2620:1ec:21::14","TCP","1474","50885  >  443 [ACK] Seq=75333 Ack=12813 Win=4096 Len=1400 [TCP segment of a reassembled PDU]"
"182","4.756644","2600:8805:3803:6100:357c:4644:40b6:e846","2620:1ec:21::14","TLSv1.2","1173","Application Data"
"183","4.757179","2620:1ec:21::14","2600:8805:3803:6100:357c:4644:40b6:e846","TLSv1.2","250","Application Data"
"184","4.757220","2600:8805:3803:6100:357c:4644:40b6:e846","2620:1ec:21::14","TCP","74","50885  >  443 [ACK] Seq=77832 Ack=12989 Win=4093 Len=0"
"185","4.760226","2600:8805:3803:6100:357c:4644:40b6:e846","2620:1ec:21::14","TLSv1.2","868","Application Data"
"186","4.760381","2600:8805:3803:6100:357c:4644:40b6:e846","2620:1ec:21::14","TLSv1.2","1051","Application Data"
"187","4.774048","2620:1ec:21::14","2600:8805:3803:6100:357c:4644:40b6:e846","TCP","74","443  >  50885 [ACK] Seq=12989 Ack=70647 Win=16385 Len=0"
"188","4.774049","2620:1ec:21::14","2600:8805:3803:6100:357c:4644:40b6:e846","TCP","74","443  >  50885 [ACK] Seq=12989 Ack=71133 Win=16383 Len=0"
"189","4.774050","2620:1ec:21::14","2600:8805:3803:6100:357c:4644:40b6:e846","TCP","74","443  >  50885 [ACK] Seq=12989 Ack=72533 Win=16385 Len=0"
"190","4.774413","2620:1ec:21::14","2600:8805:3803:6100:357c:4644:40b6:e846","TCP","74","443  >  50885 [ACK] Seq=12989 Ack=73933 Win=16380 Len=0"
"191","4.777262","2620:1ec:21::14","2600:8805:3803:6100:357c:4644:40b6:e846","TCP","74","443  >  50885 [ACK] Seq=12989 Ack=75333 Win=16385 Len=0"
"192","4.777264","2620:1ec:21::14","2600:8805:3803:6100:357c:4644:40b6:e846","TCP","74","443  >  50885 [ACK] Seq=12989 Ack=76733 Win=16380 Len=0"
"193","4.780915","2620:1ec:21::14","2600:8805:3803:6100:357c:4644:40b6:e846","TCP","74","443  >  50885 [ACK] Seq=12989 Ack=78626 Win=16385 Len=0"
"194","4.780917","2620:1ec:21::14","2600:8805:3803:6100:357c:4644:40b6:e846","TCP","74","443  >  50885 [ACK] Seq=12989 Ack=79603 Win=16381 Len=0"
"195","4.793575","2620:1ec:21::14","2600:8805:3803:6100:357c:4644:40b6:e846","TLSv1.2","605","Application Data"
"196","4.793729","2600:8805:3803:6100:357c:4644:40b6:e846","2620:1ec:21::14","TCP","74","50885  >  443 [ACK] Seq=79603 Ack=13520 Win=4087 Len=0"
"197","4.793878","2620:1ec:21::14","2600:8805:3803:6100:357c:4644:40b6:e846","TLSv1.2","112","Application Data"
"198","4.794021","2600:8805:3803:6100:357c:4644:40b6:e846","2620:1ec:21::14","TCP","74","50885  >  443 [ACK] Seq=79603 Ack=13558 Win=4087 Len=0"
"199","4.795830","2600:8805:3803:6100:357c:4644:40b6:e846","2620:1ec:21::14","TLSv1.2","116","Application Data"
"200","4.814574","2620:1ec:21::14","2600:8805:3803:6100:357c:4644:40b6:e846","TCP","74","443  >  50885 [ACK] Seq=13558 Ack=79645 Win=16381 Len=0"
"201","4.910564","2620:1ec:21::14","2600:8805:3803:6100:357c:4644:40b6:e846","TLSv1.2","604","Application Data"
"202","4.910697","2600:8805:3803:6100:357c:4644:40b6:e846","2620:1ec:21::14","TCP","74","50885  >  443 [ACK] Seq=79645 Ack=14088 Win=4087 Len=0"
"203","4.917102","2620:1ec:21::14","2600:8805:3803:6100:357c:4644:40b6:e846","TCP","1514","443  >  50885 [ACK] Seq=14088 Ack=79645 Win=16381 Len=1440 [TCP segment of a reassembled PDU]"
"204","4.917177","2600:8805:3803:6100:357c:4644:40b6:e846","2620:1ec:21::14","TCP","74","50885  >  443 [ACK] Seq=79645 Ack=15528 Win=4073 Len=0"
"205","4.917420","2620:1ec:21::14","2600:8805:3803:6100:357c:4644:40b6:e846","TCP","1514","443  >  50885 [ACK] Seq=15528 Ack=79645 Win=16381 Len=1440 [TCP segment of a reassembled PDU]"
"206","4.917420","2620:1ec:21::14","2600:8805:3803:6100:357c:4644:40b6:e846","TLSv1.2","150","Application Data"
"207","4.917421","2620:1ec:21::14","2600:8805:3803:6100:357c:4644:40b6:e846","TLSv1.2","112","Application Data"
"208","4.917458","2600:8805:3803:6100:357c:4644:40b6:e846","2620:1ec:21::14","TCP","74","50885  >  443 [ACK] Seq=79645 Ack=17082 Win=4071 Len=0"
"209","4.941020","2600:8805:3803:6100:357c:4644:40b6:e846","2620:1ec:21::14","TCP","1474","50885  >  443 [ACK] Seq=79645 Ack=17082 Win=4096 Len=1400 [TCP segment of a reassembled PDU]"
"210","4.941082","2600:8805:3803:6100:357c:4644:40b6:e846","2620:1ec:21::14","TLSv1.2","1004","Application Data"
"211","4.941110","2600:8805:3803:6100:357c:4644:40b6:e846","2620:1ec:21::14","TLSv1.2","135","Application Data"
"212","4.958608","2600:8805:3803:6100:357c:4644:40b6:e846","2620:1ec:21::14","TLSv1.2","918","Application Data"
"213","4.958656","2620:1ec:21::14","2600:8805:3803:6100:357c:4644:40b6:e846","TCP","74","443  >  50885 [ACK] Seq=17082 Ack=81045 Win=16385 Len=0"
"214","4.958792","2600:8805:3803:6100:357c:4644:40b6:e846","2620:1ec:21::14","TLSv1.2","457","Application Data"
"215","4.959150","2620:1ec:21::14","2600:8805:3803:6100:357c:4644:40b6:e846","TCP","74","443  >  50885 [ACK] Seq=17082 Ack=81975 Win=16381 Len=0"
"216","4.959151","2620:1ec:21::14","2600:8805:3803:6100:357c:4644:40b6:e846","TCP","74","443  >  50885 [ACK] Seq=17082 Ack=82036 Win=16381 Len=0"
"217","4.973215","2600:8805:3803:6100:357c:4644:40b6:e846","2620:1ec:21::14","TCP","1474","50885  >  443 [ACK] Seq=83263 Ack=17082 Win=4096 Len=1400 [TCP segment of a reassembled PDU]"
"218","4.973720","2600:8805:3803:6100:357c:4644:40b6:e846","2620:1ec:21::14","TLSv1.2","1025","Application Data"
"219","4.975100","2620:1ec:21::14","2600:8805:3803:6100:357c:4644:40b6:e846","TCP","74","443  >  50885 [ACK] Seq=17082 Ack=83263 Win=16385 Len=0"
"220","4.990053","2620:1ec:21::14","2600:8805:3803:6100:357c:4644:40b6:e846","TCP","74","443  >  50885 [ACK] Seq=17082 Ack=84663 Win=16380 Len=0"
"221","4.990054","2620:1ec:21::14","2600:8805:3803:6100:357c:4644:40b6:e846","TCP","74","443  >  50885 [ACK] Seq=17082 Ack=85614 Win=16385 Len=0"
"222","5.004191","2600:8805:3803:6100:357c:4644:40b6:e846","2620:1ec:21::14","TLSv1.2","953","Application Data"
"223","5.004307","2600:8805:3803:6100:357c:4644:40b6:e846","2620:1ec:21::14","TLSv1.2","135","Application Data"
"224","5.020259","2620:1ec:21::14","2600:8805:3803:6100:357c:4644:40b6:e846","TCP","74","443  >  50885 [ACK] Seq=17082 Ack=86554 Win=16381 Len=0"
"225","5.022975","2620:1ec:21::14","2600:8805:3803:6100:357c:4644:40b6:e846","TLSv1.2","315","Application Data"
"226","5.023033","2600:8805:3803:6100:357c:4644:40b6:e846","2620:1ec:21::14","TCP","74","50885  >  443 [ACK] Seq=86554 Ack=17323 Win=4092 Len=0"
"227","5.044841","2620:1ec:21::14","2600:8805:3803:6100:357c:4644:40b6:e846","TLSv1.2","478","Application Data"
"228","5.044896","2600:8805:3803:6100:357c:4644:40b6:e846","2620:1ec:21::14","TCP","74","50885  >  443 [ACK] Seq=86554 Ack=17727 Win=4089 Len=0"
"229","5.066436","2600:8805:3803:6100:357c:4644:40b6:e846","2620:1ec:21::14","TCP","1474","50885  >  443 [ACK] Seq=86554 Ack=17727 Win=4096 Len=1400 [TCP segment of a reassembled PDU]"
"230","5.066506","2600:8805:3803:6100:357c:4644:40b6:e846","2620:1ec:21::14","TLSv1.2","1046","Application Data"
"231","5.066549","2620:1ec:21::14","2600:8805:3803:6100:357c:4644:40b6:e846","TLSv1.2","665","Application Data"
"232","5.066549","2620:1ec:21::14","2600:8805:3803:6100:357c:4644:40b6:e846","TLSv1.2","112","Application Data"
"233","5.066578","2600:8805:3803:6100:357c:4644:40b6:e846","2620:1ec:21::14","TLSv1.2","1084","Application Data"
"234","5.066591","2600:8805:3803:6100:357c:4644:40b6:e846","2620:1ec:21::14","TCP","74","50885  >  443 [ACK] Seq=89936 Ack=18356 Win=4086 Len=0"
"235","5.066700","2600:8805:3803:6100:357c:4644:40b6:e846","2620:1ec:21::14","TCP","1474","50885  >  443 [ACK] Seq=89936 Ack=18356 Win=4086 Len=1400 [TCP segment of a reassembled PDU]"
"236","5.066711","2600:8805:3803:6100:357c:4644:40b6:e846","2620:1ec:21::14","TLSv1.2","1026","Application Data"
"237","5.068856","2600:8805:3803:6100:357c:4644:40b6:e846","2620:1ec:21::14","TLSv1.2","980","Application Data"
"238","5.093515","2620:1ec:21::14","2600:8805:3803:6100:357c:4644:40b6:e846","TLSv1.2","257","Application Data"
"239","5.093575","2600:8805:3803:6100:357c:4644:40b6:e846","2620:1ec:21::14","TCP","74","50885  >  443 [ACK] Seq=93194 Ack=18539 Win=4093 Len=0"
"240","5.094662","2620:1ec:21::14","2600:8805:3803:6100:357c:4644:40b6:e846","TCP","74","443  >  50885 [ACK] Seq=18539 Ack=88926 Win=16381 Len=0"
"241","5.095459","2620:1ec:21::14","2600:8805:3803:6100:357c:4644:40b6:e846","TCP","74","443  >  50885 [ACK] Seq=18539 Ack=89936 Win=16385 Len=0"
"242","5.095460","2620:1ec:21::14","2600:8805:3803:6100:357c:4644:40b6:e846","TCP","74","443  >  50885 [ACK] Seq=18539 Ack=91336 Win=16380 Len=0"
"243","5.095460","2620:1ec:21::14","2600:8805:3803:6100:357c:4644:40b6:e846","TCP","74","443  >  50885 [ACK] Seq=18539 Ack=92288 Win=16385 Len=0"
"244","5.095461","2620:1ec:21::14","2600:8805:3803:6100:357c:4644:40b6:e846","TCP","74","443  >  50885 [ACK] Seq=18539 Ack=93194 Win=16382 Len=0"
"245","5.175375","2620:1ec:21::14","2600:8805:3803:6100:357c:4644:40b6:e846","TLSv1.2","605","Application Data"
"246","5.175376","2620:1ec:21::14","2600:8805:3803:6100:357c:4644:40b6:e846","TLSv1.2","112","Application Data"
"247","5.175435","2600:8805:3803:6100:357c:4644:40b6:e846","2620:1ec:21::14","TCP","74","50885  >  443 [ACK] Seq=93194 Ack=19108 Win=4087 Len=0"
"248","5.200938","2620:1ec:21::14","2600:8805:3803:6100:357c:4644:40b6:e846","TLSv1.2","538","Application Data"
"249","5.200938","2620:1ec:21::14","2600:8805:3803:6100:357c:4644:40b6:e846","TLSv1.2","112","Application Data"
"250","5.201005","2600:8805:3803:6100:357c:4644:40b6:e846","2620:1ec:21::14","TCP","74","50885  >  443 [ACK] Seq=93194 Ack=19610 Win=4088 Len=0"
"251","5.216222","2600:8805:3803:6100:357c:4644:40b6:e846","2620:1ec:21::14","TCP","1474","50885  >  443 [ACK] Seq=93194 Ack=19610 Win=4096 Len=1400 [TCP segment of a reassembled PDU]"
"252","5.216290","2600:8805:3803:6100:357c:4644:40b6:e846","2620:1ec:21::14","TLSv1.2","764","Application Data"
"253","5.222555","2620:1ec:21::14","2600:8805:3803:6100:357c:4644:40b6:e846","TLSv1.2","414","Application Data"
"254","5.222614","2600:8805:3803:6100:357c:4644:40b6:e846","2620:1ec:21::14","TCP","74","50885  >  443 [ACK] Seq=95284 Ack=19950 Win=4090 Len=0"
"255","5.232848","2620:1ec:21::14","2600:8805:3803:6100:357c:4644:40b6:e846","TCP","74","443  >  50885 [ACK] Seq=19950 Ack=95284 Win=16385 Len=0"
"256","5.259034","2620:1ec:21::14","2600:8805:3803:6100:357c:4644:40b6:e846","TLSv1.2","1436","Application Data"
"257","5.259035","2620:1ec:21::14","2600:8805:3803:6100:357c:4644:40b6:e846","TLSv1.2","112","Application Data"
"258","5.259098","2600:8805:3803:6100:357c:4644:40b6:e846","2620:1ec:21::14","TCP","74","50885  >  443 [ACK] Seq=95284 Ack=21350 Win=4074 Len=0"
"259","5.338736","2620:1ec:21::14","2600:8805:3803:6100:357c:4644:40b6:e846","TLSv1.2","121","Application Data"
"260","5.338794","2600:8805:3803:6100:357c:4644:40b6:e846","2620:1ec:21::14","TCP","74","50885  >  443 [ACK] Seq=95284 Ack=21397 Win=4095 Len=0"
"261","5.340397","2600:8805:3803:6100:357c:4644:40b6:e846","2620:1ec:21::14","TLSv1.2","116","Application Data"
"262","5.360332","2620:1ec:21::14","2600:8805:3803:6100:357c:4644:40b6:e846","TCP","74","443  >  50885 [ACK] Seq=21397 Ack=95326 Win=16385 Len=0"
"263","5.500745","2620:1ec:21::14","2600:8805:3803:6100:357c:4644:40b6:e846","TCP","1514","443  >  50885 [ACK] Seq=21397 Ack=95326 Win=16385 Len=1440 [TCP segment of a reassembled PDU]"
"264","5.502900","2620:1ec:21::14","2600:8805:3803:6100:357c:4644:40b6:e846","TCP","1514","443  >  50885 [ACK] Seq=22837 Ack=95326 Win=16385 Len=1440 [TCP segment of a reassembled PDU]"
"265","5.502900","2620:1ec:21::14","2600:8805:3803:6100:357c:4644:40b6:e846","TCP","1514","443  >  50885 [ACK] Seq=24277 Ack=95326 Win=16385 Len=1440 [TCP segment of a reassembled PDU]"
"266","5.502901","2620:1ec:21::14","2600:8805:3803:6100:357c:4644:40b6:e846","TLSv1.2","819","Application Data"
"267","5.502901","2620:1ec:21::14","2600:8805:3803:6100:357c:4644:40b6:e846","TLSv1.2","715","Application Data"
"268","5.502901","2620:1ec:21::14","2600:8805:3803:6100:357c:4644:40b6:e846","TLSv1.2","112","Application Data"
"269","5.503062","2600:8805:3803:6100:357c:4644:40b6:e846","2620:1ec:21::14","TCP","74","50885  >  443 [ACK] Seq=95326 Ack=27141 Win=4096 Len=0"
"270","5.757788","2620:1ec:21::14","2600:8805:3803:6100:357c:4644:40b6:e846","TCP","1514","443  >  50885 [ACK] Seq=27141 Ack=95326 Win=16385 Len=1440 [TCP segment of a reassembled PDU]"
"271","5.759608","2620:1ec:21::14","2600:8805:3803:6100:357c:4644:40b6:e846","TCP","1514","443  >  50885 [ACK] Seq=28581 Ack=95326 Win=16385 Len=1440 [TCP segment of a reassembled PDU]"
"272","5.759609","2620:1ec:21::14","2600:8805:3803:6100:357c:4644:40b6:e846","TCP","1514","443  >  50885 [ACK] Seq=30021 Ack=95326 Win=16385 Len=1440 [TCP segment of a reassembled PDU]"
"273","5.759609","2620:1ec:21::14","2600:8805:3803:6100:357c:4644:40b6:e846","TLSv1.2","223","Application Data"
"274","5.759609","2620:1ec:21::14","2600:8805:3803:6100:357c:4644:40b6:e846","TCP","1514","443  >  50885 [ACK] Seq=31610 Ack=95326 Win=16385 Len=1440 [TCP segment of a reassembled PDU]"
"275","5.759610","2620:1ec:21::14","2600:8805:3803:6100:357c:4644:40b6:e846","TCP","1514","443  >  50885 [ACK] Seq=33050 Ack=95326 Win=16385 Len=1440 [TCP segment of a reassembled PDU]"
"276","5.759610","2620:1ec:21::14","2600:8805:3803:6100:357c:4644:40b6:e846","TLSv1.2","676","Application Data"
"277","5.759610","2620:1ec:21::14","2600:8805:3803:6100:357c:4644:40b6:e846","TCP","1514","443  >  50885 [ACK] Seq=35092 Ack=95326 Win=16385 Len=1440 [TCP segment of a reassembled PDU]"
"278","5.759611","2620:1ec:21::14","2600:8805:3803:6100:357c:4644:40b6:e846","TCP","1514","443  >  50885 [ACK] Seq=36532 Ack=95326 Win=16385 Len=1440 [TCP segment of a reassembled PDU]"
"279","5.759612","2620:1ec:21::14","2600:8805:3803:6100:357c:4644:40b6:e846","TLSv1.2","559","Application Data"
"280","5.759612","2620:1ec:21::14","2600:8805:3803:6100:357c:4644:40b6:e846","TLSv1.2","112","Application Data"
"281","5.759718","2600:8805:3803:6100:357c:4644:40b6:e846","2620:1ec:21::14","TCP","74","50885  >  443 [ACK] Seq=95326 Ack=38495 Win=4096 Len=0"
"282","6.078634","2600:8805:3803:6100:357c:4644:40b6:e846","2620:1ec:21::14","TCP","1474","50885  >  443 [ACK] Seq=95326 Ack=38495 Win=4096 Len=1400 [TCP segment of a reassembled PDU]"
"283","6.078723","2600:8805:3803:6100:357c:4644:40b6:e846","2620:1ec:21::14","TLSv1.2","1172","Application Data"
