"No.","Time","Source","Destination","Protocol","Length","Info"
"1","0.000000","2600:1408:ec00:1286::2e03","2600:8805:3803:6100:c100:e220:6ae:755","TLSv1.2","110","Application Data"
"2","0.000002","2600:1408:ec00:1286::2e03","2600:8805:3803:6100:c100:e220:6ae:755","TCP","86","443  >  55118 [FIN, ACK] Seq=25 Ack=1 Win=501 Len=0 TSval=63945806 TSecr=4156690462"
"3","0.000003","2600:1408:ec00:1286::2e03","2600:8805:3803:6100:c100:e220:6ae:755","TCP","86","[TCP Retransmission] 443  >  55118 [FIN, ACK] Seq=25 Ack=1 Win=501 Len=0 TSval=63945853 TSecr=4156690462"
"4","0.000198","2600:8805:3803:6100:c100:e220:6ae:755","2600:1408:ec00:1286::2e03","TCP","86","55118  >  443 [ACK] Seq=1 Ack=25 Win=2047 Len=0 TSval=4156810615 TSecr=63945806"
"5","0.000412","2600:8805:3803:6100:c100:e220:6ae:755","2600:1408:ec00:1286::2e03","TCP","86","55118  >  443 [ACK] Seq=1 Ack=26 Win=2047 Len=0 TSval=4156810615 TSecr=63945806"
"6","0.000606","2600:8805:3803:6100:c100:e220:6ae:755","2600:1408:ec00:1286::2e03","TCP","86","[TCP Dup ACK 5#1] 55118  >  443 [ACK] Seq=1 Ack=26 Win=2047 Len=0 TSval=4156810615 TSecr=63945806"
"7","0.000992","2600:8805:3803:6100:c100:e220:6ae:755","2600:1408:ec00:1286::2e03","TCP","86","55118  >  443 [FIN, ACK] Seq=1 Ack=26 Win=2048 Len=0 TSval=4156810615 TSecr=63945806"
"8","0.019848","2600:1408:ec00:1286::2e03","2600:8805:3803:6100:c100:e220:6ae:755","TCP","86","443  >  55118 [ACK] Seq=26 Ack=2 Win=501 Len=0 TSval=63945932 TSecr=4156810615"
"9","1.677056","2600:8805:3803:6100:c100:e220:6ae:755","2600:1408:ec00:1286::2e03","TLSv1.2","810","Application Data"
"10","1.695522","2600:1408:ec00:1286::2e03","2600:8805:3803:6100:c100:e220:6ae:755","TCP","86","443  >  55088 [ACK] Seq=1 Ack=725 Win=8397 Len=0 TSval=63947608 TSecr=2278768838"
"11","1.715076","2600:1408:ec00:1286::2e03","2600:8805:3803:6100:c100:e220:6ae:755","TLSv1.2","1328","Application Data"
"12","1.715142","2600:8805:3803:6100:c100:e220:6ae:755","2600:1408:ec00:1286::2e03","TCP","86","55088  >  443 [ACK] Seq=725 Ack=1243 Win=16130 Len=0 TSval=2278768876 TSecr=63947627"
"13","1.716519","2600:1408:ec00:1286::2e03","2600:8805:3803:6100:c100:e220:6ae:755","TCP","1514","443  >  55088 [ACK] Seq=1243 Ack=725 Win=8397 Len=1428 TSval=63947627 TSecr=2278768838 [TCP segment of a reassembled PDU]"
"14","1.716519","2600:1408:ec00:1286::2e03","2600:8805:3803:6100:c100:e220:6ae:755","TCP","1514","443  >  55088 [ACK] Seq=2671 Ack=725 Win=8397 Len=1428 TSval=63947627 TSecr=2278768838 [TCP segment of a reassembled PDU]"
"15","1.716520","2600:1408:ec00:1286::2e03","2600:8805:3803:6100:c100:e220:6ae:755","TCP","1514","443  >  55088 [ACK] Seq=4099 Ack=725 Win=8397 Len=1428 TSval=63947627 TSecr=2278768838 [TCP segment of a reassembled PDU]"
"16","1.716521","2600:1408:ec00:1286::2e03","2600:8805:3803:6100:c100:e220:6ae:755","TCP","1514","443  >  55088 [ACK] Seq=5527 Ack=725 Win=8397 Len=1428 TSval=63947627 TSecr=2278768838 [TCP segment of a reassembled PDU]"
"17","1.716522","2600:1408:ec00:1286::2e03","2600:8805:3803:6100:c100:e220:6ae:755","TCP","1514","443  >  55088 [ACK] Seq=6955 Ack=725 Win=8397 Len=1428 TSval=63947627 TSecr=2278768838 [TCP segment of a reassembled PDU]"
"18","1.716522","2600:1408:ec00:1286::2e03","2600:8805:3803:6100:c100:e220:6ae:755","TCP","1514","443  >  55088 [ACK] Seq=8383 Ack=725 Win=8397 Len=1428 TSval=63947627 TSecr=2278768838 [TCP segment of a reassembled PDU]"
"19","1.716523","2600:1408:ec00:1286::2e03","2600:8805:3803:6100:c100:e220:6ae:755","TCP","1514","443  >  55088 [ACK] Seq=9811 Ack=725 Win=8397 Len=1428 TSval=63947627 TSecr=2278768838 [TCP segment of a reassembled PDU]"
"20","1.716524","2600:1408:ec00:1286::2e03","2600:8805:3803:6100:c100:e220:6ae:755","TCP","1514","443  >  55088 [ACK] Seq=11239 Ack=725 Win=8397 Len=1428 TSval=63947627 TSecr=2278768838 [TCP segment of a reassembled PDU]"
"21","1.716524","2600:1408:ec00:1286::2e03","2600:8805:3803:6100:c100:e220:6ae:755","TCP","1514","443  >  55088 [ACK] Seq=12667 Ack=725 Win=8397 Len=1428 TSval=63947627 TSecr=2278768838 [TCP segment of a reassembled PDU]"
"22","1.716525","2600:1408:ec00:1286::2e03","2600:8805:3803:6100:c100:e220:6ae:755","TCP","1514","443  >  55088 [ACK] Seq=14095 Ack=725 Win=8397 Len=1428 TSval=63947627 TSecr=2278768838 [TCP segment of a reassembled PDU]"
"23","1.716525","2600:1408:ec00:1286::2e03","2600:8805:3803:6100:c100:e220:6ae:755","TCP","1514","443  >  55088 [ACK] Seq=15523 Ack=725 Win=8397 Len=1428 TSval=63947627 TSecr=2278768838 [TCP segment of a reassembled PDU]"
"24","1.716526","2600:1408:ec00:1286::2e03","2600:8805:3803:6100:c100:e220:6ae:755","TLSv1.2","784","Application Data"
"25","1.716526","2600:1408:ec00:1286::2e03","2600:8805:3803:6100:c100:e220:6ae:755","TLSv1.2","1514","Application Data"
"26","1.716527","2600:1408:ec00:1286::2e03","2600:8805:3803:6100:c100:e220:6ae:755","TCP","1514","443  >  55088 [ACK] Seq=19077 Ack=725 Win=8397 Len=1428 TSval=63947627 TSecr=2278768838 [TCP segment of a reassembled PDU]"
"27","1.716527","2600:1408:ec00:1286::2e03","2600:8805:3803:6100:c100:e220:6ae:755","TCP","1514","443  >  55088 [ACK] Seq=20505 Ack=725 Win=8397 Len=1428 TSval=63947627 TSecr=2278768838 [TCP segment of a reassembled PDU]"
"28","1.716528","2600:1408:ec00:1286::2e03","2600:8805:3803:6100:c100:e220:6ae:755","TCP","1514","443  >  55088 [ACK] Seq=21933 Ack=725 Win=8397 Len=1428 TSval=63947627 TSecr=2278768838 [TCP segment of a reassembled PDU]"
"29","1.716609","2600:8805:3803:6100:c100:e220:6ae:755","2600:1408:ec00:1286::2e03","TCP","86","55088  >  443 [ACK] Seq=725 Ack=16951 Win=15904 Len=0 TSval=2278768878 TSecr=63947627"
"30","1.716656","2600:8805:3803:6100:c100:e220:6ae:755","2600:1408:ec00:1286::2e03","TCP","86","55088  >  443 [ACK] Seq=725 Ack=23361 Win=15803 Len=0 TSval=2278768878 TSecr=63947627"
"31","1.716773","2600:8805:3803:6100:c100:e220:6ae:755","2600:1408:ec00:1286::2e03","TCP","86","[TCP Window Update] 55088  >  443 [ACK] Seq=725 Ack=23361 Win=16149 Len=0 TSval=2278768878 TSecr=63947627"
"32","1.717470","2600:1408:ec00:1286::2e03","2600:8805:3803:6100:c100:e220:6ae:755","TCP","1514","443  >  55088 [ACK] Seq=23361 Ack=725 Win=8397 Len=1428 TSval=63947627 TSecr=2278768838 [TCP segment of a reassembled PDU]"
"33","1.717471","2600:1408:ec00:1286::2e03","2600:8805:3803:6100:c100:e220:6ae:755","TCP","1514","443  >  55088 [ACK] Seq=24789 Ack=725 Win=8397 Len=1428 TSval=63947627 TSecr=2278768838 [TCP segment of a reassembled PDU]"
"34","1.717472","2600:1408:ec00:1286::2e03","2600:8805:3803:6100:c100:e220:6ae:755","TCP","1514","443  >  55088 [ACK] Seq=26217 Ack=725 Win=8397 Len=1428 TSval=63947627 TSecr=2278768838 [TCP segment of a reassembled PDU]"
"35","1.717472","2600:1408:ec00:1286::2e03","2600:8805:3803:6100:c100:e220:6ae:755","TCP","1514","443  >  55088 [ACK] Seq=27645 Ack=725 Win=8397 Len=1428 TSval=63947627 TSecr=2278768838 [TCP segment of a reassembled PDU]"
"36","1.717473","2600:1408:ec00:1286::2e03","2600:8805:3803:6100:c100:e220:6ae:755","TCP","1514","443  >  55088 [ACK] Seq=29073 Ack=725 Win=8397 Len=1428 TSval=63947627 TSecr=2278768838 [TCP segment of a reassembled PDU]"
"37","1.717473","2600:1408:ec00:1286::2e03","2600:8805:3803:6100:c100:e220:6ae:755","TCP","1514","443  >  55088 [ACK] Seq=30501 Ack=725 Win=8397 Len=1428 TSval=63947627 TSecr=2278768838 [TCP segment of a reassembled PDU]"
"38","1.717474","2600:1408:ec00:1286::2e03","2600:8805:3803:6100:c100:e220:6ae:755","TCP","1514","443  >  55088 [ACK] Seq=31929 Ack=725 Win=8397 Len=1428 TSval=63947627 TSecr=2278768838 [TCP segment of a reassembled PDU]"
"39","1.717475","2600:1408:ec00:1286::2e03","2600:8805:3803:6100:c100:e220:6ae:755","TLSv1.2","815","Application Data"
"40","1.717475","2600:1408:ec00:1286::2e03","2600:8805:3803:6100:c100:e220:6ae:755","TLSv1.2","1514","Application Data"
"41","1.717476","2600:1408:ec00:1286::2e03","2600:8805:3803:6100:c100:e220:6ae:755","TCP","1514","443  >  55088 [ACK] Seq=35514 Ack=725 Win=8397 Len=1428 TSval=63947628 TSecr=2278768838 [TCP segment of a reassembled PDU]"
"42","1.717477","2600:1408:ec00:1286::2e03","2600:8805:3803:6100:c100:e220:6ae:755","TCP","1514","443  >  55088 [ACK] Seq=36942 Ack=725 Win=8397 Len=1428 TSval=63947628 TSecr=2278768838 [TCP segment of a reassembled PDU]"
"43","1.717477","2600:1408:ec00:1286::2e03","2600:8805:3803:6100:c100:e220:6ae:755","TCP","1514","443  >  55088 [ACK] Seq=38370 Ack=725 Win=8397 Len=1428 TSval=63947628 TSecr=2278768838 [TCP segment of a reassembled PDU]"
"44","1.717478","2600:1408:ec00:1286::2e03","2600:8805:3803:6100:c100:e220:6ae:755","TCP","1514","443  >  55088 [ACK] Seq=39798 Ack=725 Win=8397 Len=1428 TSval=63947628 TSecr=2278768838 [TCP segment of a reassembled PDU]"
"45","1.717478","2600:1408:ec00:1286::2e03","2600:8805:3803:6100:c100:e220:6ae:755","TCP","1514","443  >  55088 [ACK] Seq=41226 Ack=725 Win=8397 Len=1428 TSval=63947628 TSecr=2278768838 [TCP segment of a reassembled PDU]"
"46","1.717479","2600:1408:ec00:1286::2e03","2600:8805:3803:6100:c100:e220:6ae:755","TCP","1514","443  >  55088 [ACK] Seq=42654 Ack=725 Win=8397 Len=1428 TSval=63947628 TSecr=2278768838 [TCP segment of a reassembled PDU]"
"47","1.717479","2600:1408:ec00:1286::2e03","2600:8805:3803:6100:c100:e220:6ae:755","TCP","1514","443  >  55088 [ACK] Seq=44082 Ack=725 Win=8397 Len=1428 TSval=63947628 TSecr=2278768838 [TCP segment of a reassembled PDU]"
"48","1.717480","2600:1408:ec00:1286::2e03","2600:8805:3803:6100:c100:e220:6ae:755","TLSv1.2","556","Application Data"
"49","1.717480","2600:1408:ec00:1286::2e03","2600:8805:3803:6100:c100:e220:6ae:755","TCP","1514","443  >  55088 [ACK] Seq=45980 Ack=725 Win=8397 Len=1428 TSval=63947628 TSecr=2278768838 [TCP segment of a reassembled PDU]"
"50","1.717481","2600:1408:ec00:1286::2e03","2600:8805:3803:6100:c100:e220:6ae:755","TCP","1514","443  >  55088 [ACK] Seq=47408 Ack=725 Win=8397 Len=1428 TSval=63947628 TSecr=2278768838 [TCP segment of a reassembled PDU]"
"51","1.717482","2600:1408:ec00:1286::2e03","2600:8805:3803:6100:c100:e220:6ae:755","TCP","1514","443  >  55088 [ACK] Seq=48836 Ack=725 Win=8397 Len=1428 TSval=63947628 TSecr=2278768838 [TCP segment of a reassembled PDU]"
"52","1.717482","2600:1408:ec00:1286::2e03","2600:8805:3803:6100:c100:e220:6ae:755","TCP","1514","443  >  55088 [ACK] Seq=50264 Ack=725 Win=8397 Len=1428 TSval=63947628 TSecr=2278768838 [TCP segment of a reassembled PDU]"
"53","1.717483","2600:1408:ec00:1286::2e03","2600:8805:3803:6100:c100:e220:6ae:755","TCP","1514","443  >  55088 [ACK] Seq=51692 Ack=725 Win=8397 Len=1428 TSval=63947628 TSecr=2278768838 [TCP segment of a reassembled PDU]"
"54","1.717483","2600:1408:ec00:1286::2e03","2600:8805:3803:6100:c100:e220:6ae:755","TCP","1514","443  >  55088 [ACK] Seq=53120 Ack=725 Win=8397 Len=1428 TSval=63947628 TSecr=2278768838 [TCP segment of a reassembled PDU]"
"55","1.717484","2600:1408:ec00:1286::2e03","2600:8805:3803:6100:c100:e220:6ae:755","TCP","1514","443  >  55088 [ACK] Seq=54548 Ack=725 Win=8397 Len=1428 TSval=63947628 TSecr=2278768838 [TCP segment of a reassembled PDU]"
"56","1.717484","2600:1408:ec00:1286::2e03","2600:8805:3803:6100:c100:e220:6ae:755","TCP","1514","443  >  55088 [ACK] Seq=55976 Ack=725 Win=8397 Len=1428 TSval=63947628 TSecr=2278768838 [TCP segment of a reassembled PDU]"
"57","1.717485","2600:1408:ec00:1286::2e03","2600:8805:3803:6100:c100:e220:6ae:755","TLSv1.2","215","Application Data"
"58","1.717559","2600:8805:3803:6100:c100:e220:6ae:755","2600:1408:ec00:1286::2e03","TCP","86","55088  >  443 [ACK] Seq=725 Ack=38370 Win=15914 Len=0 TSval=2278768878 TSecr=63947628"
"59","1.717590","2600:8805:3803:6100:c100:e220:6ae:755","2600:1408:ec00:1286::2e03","TCP","86","55088  >  443 [ACK] Seq=725 Ack=54548 Win=15662 Len=0 TSval=2278768879 TSecr=63947628"
"60","1.717604","2600:8805:3803:6100:c100:e220:6ae:755","2600:1408:ec00:1286::2e03","TCP","86","55088  >  443 [ACK] Seq=725 Ack=57533 Win=15615 Len=0 TSval=2278768879 TSecr=63947628"
"61","1.717897","2600:8805:3803:6100:c100:e220:6ae:755","2600:1408:ec00:1286::2e03","TCP","86","[TCP Window Update] 55088  >  443 [ACK] Seq=725 Ack=57533 Win=16149 Len=0 TSval=2278768879 TSecr=63947628"
"62","1.718508","2600:8805:3803:6100:c100:e220:6ae:755","2600:1408:ec00:1286::2e03","TLSv1.2","121","Application Data"
"63","1.719208","2600:1408:ec00:1286::2e03","2600:8805:3803:6100:c100:e220:6ae:755","TCP","1514","443  >  55088 [ACK] Seq=57533 Ack=725 Win=8397 Len=1428 TSval=63947631 TSecr=2278768838 [TCP segment of a reassembled PDU]"
"64","1.719266","2600:8805:3803:6100:c100:e220:6ae:755","2600:1408:ec00:1286::2e03","TCP","86","55088  >  443 [ACK] Seq=760 Ack=58961 Win=16127 Len=0 TSval=2278768880 TSecr=63947631"
"65","1.720636","2600:1408:ec00:1286::2e03","2600:8805:3803:6100:c100:e220:6ae:755","TCP","1514","443  >  55088 [ACK] Seq=58961 Ack=725 Win=8397 Len=1428 TSval=63947631 TSecr=2278768838 [TCP segment of a reassembled PDU]"
"66","1.720637","2600:1408:ec00:1286::2e03","2600:8805:3803:6100:c100:e220:6ae:755","TCP","1514","443  >  55088 [ACK] Seq=60389 Ack=725 Win=8397 Len=1428 TSval=63947631 TSecr=2278768838 [TCP segment of a reassembled PDU]"
"67","1.720637","2600:1408:ec00:1286::2e03","2600:8805:3803:6100:c100:e220:6ae:755","TCP","1514","443  >  55088 [ACK] Seq=61817 Ack=725 Win=8397 Len=1428 TSval=63947631 TSecr=2278768838 [TCP segment of a reassembled PDU]"
"68","1.720638","2600:1408:ec00:1286::2e03","2600:8805:3803:6100:c100:e220:6ae:755","TCP","1514","443  >  55088 [ACK] Seq=63245 Ack=725 Win=8397 Len=1428 TSval=63947631 TSecr=2278768838 [TCP segment of a reassembled PDU]"
"69","1.720638","2600:1408:ec00:1286::2e03","2600:8805:3803:6100:c100:e220:6ae:755","TCP","1514","443  >  55088 [ACK] Seq=64673 Ack=725 Win=8397 Len=1428 TSval=63947631 TSecr=2278768838 [TCP segment of a reassembled PDU]"
"70","1.720638","2600:1408:ec00:1286::2e03","2600:8805:3803:6100:c100:e220:6ae:755","TCP","1514","443  >  55088 [ACK] Seq=66101 Ack=725 Win=8397 Len=1428 TSval=63947631 TSecr=2278768838 [TCP segment of a reassembled PDU]"
"71","1.720639","2600:1408:ec00:1286::2e03","2600:8805:3803:6100:c100:e220:6ae:755","TCP","1514","443  >  55088 [ACK] Seq=67529 Ack=725 Win=8397 Len=1428 TSval=63947631 TSecr=2278768838 [TCP segment of a reassembled PDU]"
"72","1.720639","2600:1408:ec00:1286::2e03","2600:8805:3803:6100:c100:e220:6ae:755","TCP","1514","443  >  55088 [ACK] Seq=68957 Ack=725 Win=8397 Len=1428 TSval=63947631 TSecr=2278768838 [TCP segment of a reassembled PDU]"
"73","1.720640","2600:1408:ec00:1286::2e03","2600:8805:3803:6100:c100:e220:6ae:755","TCP","1514","443  >  55088 [ACK] Seq=70385 Ack=725 Win=8397 Len=1428 TSval=63947631 TSecr=2278768838 [TCP segment of a reassembled PDU]"
"74","1.720640","2600:1408:ec00:1286::2e03","2600:8805:3803:6100:c100:e220:6ae:755","TCP","1514","443  >  55088 [ACK] Seq=71813 Ack=725 Win=8397 Len=1428 TSval=63947631 TSecr=2278768838 [TCP segment of a reassembled PDU]"
"75","1.720641","2600:1408:ec00:1286::2e03","2600:8805:3803:6100:c100:e220:6ae:755","TLSv1.2","784","Application Data"
"76","1.720641","2600:1408:ec00:1286::2e03","2600:8805:3803:6100:c100:e220:6ae:755","TLSv1.2","117","Application Data"
"77","1.720641","2600:1408:ec00:1286::2e03","2600:8805:3803:6100:c100:e220:6ae:755","TCP","1514","443  >  55088 [ACK] Seq=73970 Ack=725 Win=8397 Len=1428 TSval=63947631 TSecr=2278768838 [TCP segment of a reassembled PDU]"
"78","1.720642","2600:1408:ec00:1286::2e03","2600:8805:3803:6100:c100:e220:6ae:755","TCP","1514","443  >  55088 [ACK] Seq=75398 Ack=725 Win=8397 Len=1428 TSval=63947631 TSecr=2278768838 [TCP segment of a reassembled PDU]"
"79","1.720642","2600:1408:ec00:1286::2e03","2600:8805:3803:6100:c100:e220:6ae:755","TCP","1514","443  >  55088 [ACK] Seq=76826 Ack=725 Win=8397 Len=1428 TSval=63947631 TSecr=2278768838 [TCP segment of a reassembled PDU]"
"80","1.720643","2600:1408:ec00:1286::2e03","2600:8805:3803:6100:c100:e220:6ae:755","TCP","1514","443  >  55088 [ACK] Seq=78254 Ack=725 Win=8397 Len=1428 TSval=63947631 TSecr=2278768838 [TCP segment of a reassembled PDU]"
"81","1.720643","2600:1408:ec00:1286::2e03","2600:8805:3803:6100:c100:e220:6ae:755","TCP","1514","443  >  55088 [ACK] Seq=79682 Ack=725 Win=8397 Len=1428 TSval=63947631 TSecr=2278768838 [TCP segment of a reassembled PDU]"
"82","1.720643","2600:1408:ec00:1286::2e03","2600:8805:3803:6100:c100:e220:6ae:755","TCP","1514","443  >  55088 [ACK] Seq=81110 Ack=725 Win=8397 Len=1428 TSval=63947631 TSecr=2278768838 [TCP segment of a reassembled PDU]"
"83","1.720644","2600:1408:ec00:1286::2e03","2600:8805:3803:6100:c100:e220:6ae:755","TLSv1.2","787","Application Data"
"84","1.720706","2600:8805:3803:6100:c100:e220:6ae:755","2600:1408:ec00:1286::2e03","TCP","86","55088  >  443 [ACK] Seq=760 Ack=73970 Win=15914 Len=0 TSval=2278768882 TSecr=63947631"
"85","1.720730","2600:8805:3803:6100:c100:e220:6ae:755","2600:1408:ec00:1286::2e03","TCP","86","55088  >  443 [ACK] Seq=760 Ack=83239 Win=15770 Len=0 TSval=2278768882 TSecr=63947631"
"86","1.720814","2600:8805:3803:6100:c100:e220:6ae:755","2600:1408:ec00:1286::2e03","TCP","86","[TCP Window Update] 55088  >  443 [ACK] Seq=760 Ack=83239 Win=16149 Len=0 TSval=2278768882 TSecr=63947631"
"87","1.725915","2600:1408:ec00:1286::2e03","2600:8805:3803:6100:c100:e220:6ae:755","TCP","1514","443  >  55088 [ACK] Seq=83239 Ack=725 Win=8397 Len=1428 TSval=63947638 TSecr=2278768838 [TCP segment of a reassembled PDU]"
"88","1.725994","2600:8805:3803:6100:c100:e220:6ae:755","2600:1408:ec00:1286::2e03","TCP","86","55088  >  443 [ACK] Seq=760 Ack=84667 Win=16127 Len=0 TSval=2278768887 TSecr=63947638"
"89","1.726283","2600:1408:ec00:1286::2e03","2600:8805:3803:6100:c100:e220:6ae:755","TCP","1514","443  >  55088 [ACK] Seq=84667 Ack=725 Win=8397 Len=1428 TSval=63947638 TSecr=2278768838 [TCP segment of a reassembled PDU]"
"90","1.726344","2600:8805:3803:6100:c100:e220:6ae:755","2600:1408:ec00:1286::2e03","TCP","86","55088  >  443 [ACK] Seq=760 Ack=86095 Win=16104 Len=0 TSval=2278768887 TSecr=63947638"
"91","1.726374","2600:8805:3803:6100:c100:e220:6ae:755","2600:1408:ec00:1286::2e03","TCP","86","[TCP Window Update] 55088  >  443 [ACK] Seq=760 Ack=86095 Win=16149 Len=0 TSval=2278768887 TSecr=63947638"
"92","1.727597","2600:1408:ec00:1286::2e03","2600:8805:3803:6100:c100:e220:6ae:755","TCP","1514","443  >  55088 [ACK] Seq=86095 Ack=725 Win=8397 Len=1428 TSval=63947638 TSecr=2278768838 [TCP segment of a reassembled PDU]"
"93","1.727598","2600:1408:ec00:1286::2e03","2600:8805:3803:6100:c100:e220:6ae:755","TCP","1514","443  >  55088 [ACK] Seq=87523 Ack=725 Win=8397 Len=1428 TSval=63947638 TSecr=2278768838 [TCP segment of a reassembled PDU]"
"94","1.727599","2600:1408:ec00:1286::2e03","2600:8805:3803:6100:c100:e220:6ae:755","TCP","1514","443  >  55088 [ACK] Seq=88951 Ack=725 Win=8397 Len=1428 TSval=63947638 TSecr=2278768838 [TCP segment of a reassembled PDU]"
"95","1.727599","2600:1408:ec00:1286::2e03","2600:8805:3803:6100:c100:e220:6ae:755","TCP","1514","443  >  55088 [ACK] Seq=90379 Ack=725 Win=8397 Len=1428 TSval=63947638 TSecr=2278768838 [TCP segment of a reassembled PDU]"
"96","1.727599","2600:1408:ec00:1286::2e03","2600:8805:3803:6100:c100:e220:6ae:755","TCP","1514","443  >  55088 [ACK] Seq=91807 Ack=725 Win=8397 Len=1428 TSval=63947638 TSecr=2278768838 [TCP segment of a reassembled PDU]"
"97","1.727600","2600:1408:ec00:1286::2e03","2600:8805:3803:6100:c100:e220:6ae:755","TCP","1514","443  >  55088 [ACK] Seq=93235 Ack=725 Win=8397 Len=1428 TSval=63947638 TSecr=2278768838 [TCP segment of a reassembled PDU]"
"98","1.727600","2600:1408:ec00:1286::2e03","2600:8805:3803:6100:c100:e220:6ae:755","TCP","1514","443  >  55088 [ACK] Seq=94663 Ack=725 Win=8397 Len=1428 TSval=63947638 TSecr=2278768838 [TCP segment of a reassembled PDU]"
"99","1.727601","2600:1408:ec00:1286::2e03","2600:8805:3803:6100:c100:e220:6ae:755","TCP","1514","443  >  55088 [ACK] Seq=96091 Ack=725 Win=8397 Len=1428 TSval=63947638 TSecr=2278768838 [TCP segment of a reassembled PDU]"
"100","1.727601","2600:1408:ec00:1286::2e03","2600:8805:3803:6100:c100:e220:6ae:755","TCP","1514","443  >  55088 [ACK] Seq=97519 Ack=725 Win=8397 Len=1428 TSval=63947638 TSecr=2278768838 [TCP segment of a reassembled PDU]"
"101","1.727602","2600:1408:ec00:1286::2e03","2600:8805:3803:6100:c100:e220:6ae:755","TLSv1.2","784","Application Data"
"102","1.727602","2600:1408:ec00:1286::2e03","2600:8805:3803:6100:c100:e220:6ae:755","TLSv1.2","117","Application Data"
"103","1.727665","2600:8805:3803:6100:c100:e220:6ae:755","2600:1408:ec00:1286::2e03","TCP","86","55088  >  443 [ACK] Seq=760 Ack=99676 Win=15937 Len=0 TSval=2278768889 TSecr=63947638"
"104","1.727926","2600:8805:3803:6100:c100:e220:6ae:755","2600:1408:ec00:1286::2e03","TCP","86","[TCP Window Update] 55088  >  443 [ACK] Seq=760 Ack=99676 Win=16149 Len=0 TSval=2278768889 TSecr=63947638"
"105","1.728545","2600:1408:ec00:1286::2e03","2600:8805:3803:6100:c100:e220:6ae:755","TCP","1514","443  >  55088 [ACK] Seq=99676 Ack=725 Win=8397 Len=1428 TSval=63947639 TSecr=2278768838 [TCP segment of a reassembled PDU]"
"106","1.728546","2600:1408:ec00:1286::2e03","2600:8805:3803:6100:c100:e220:6ae:755","TCP","1514","443  >  55088 [ACK] Seq=101104 Ack=725 Win=8397 Len=1428 TSval=63947639 TSecr=2278768838 [TCP segment of a reassembled PDU]"
"107","1.728546","2600:1408:ec00:1286::2e03","2600:8805:3803:6100:c100:e220:6ae:755","TCP","1514","443  >  55088 [ACK] Seq=102532 Ack=725 Win=8397 Len=1428 TSval=63947639 TSecr=2278768838 [TCP segment of a reassembled PDU]"
"108","1.728546","2600:1408:ec00:1286::2e03","2600:8805:3803:6100:c100:e220:6ae:755","TCP","1514","443  >  55088 [ACK] Seq=103960 Ack=725 Win=8397 Len=1428 TSval=63947639 TSecr=2278768838 [TCP segment of a reassembled PDU]"
"109","1.728547","2600:1408:ec00:1286::2e03","2600:8805:3803:6100:c100:e220:6ae:755","TCP","1514","443  >  55088 [ACK] Seq=105388 Ack=725 Win=8397 Len=1428 TSval=63947639 TSecr=2278768838 [TCP segment of a reassembled PDU]"
"110","1.728547","2600:1408:ec00:1286::2e03","2600:8805:3803:6100:c100:e220:6ae:755","TCP","1514","443  >  55088 [ACK] Seq=106816 Ack=725 Win=8397 Len=1428 TSval=63947639 TSecr=2278768838 [TCP segment of a reassembled PDU]"
"111","1.728548","2600:1408:ec00:1286::2e03","2600:8805:3803:6100:c100:e220:6ae:755","TLSv1.2","1242","Application Data"
"112","1.728650","2600:8805:3803:6100:c100:e220:6ae:755","2600:1408:ec00:1286::2e03","TCP","86","55088  >  443 [ACK] Seq=760 Ack=109400 Win=15997 Len=0 TSval=2278768890 TSecr=63947639"
"113","1.729254","2600:8805:3803:6100:c100:e220:6ae:755","2600:1408:ec00:1286::2e03","TCP","86","[TCP Window Update] 55088  >  443 [ACK] Seq=760 Ack=109400 Win=16149 Len=0 TSval=2278768890 TSecr=63947639"
"114","1.730389","2600:1408:ec00:1286::2e03","2600:8805:3803:6100:c100:e220:6ae:755","TCP","1514","443  >  55088 [ACK] Seq=109400 Ack=725 Win=8397 Len=1428 TSval=63947642 TSecr=2278768838 [TCP segment of a reassembled PDU]"
"115","1.730444","2600:8805:3803:6100:c100:e220:6ae:755","2600:1408:ec00:1286::2e03","TCP","86","55088  >  443 [ACK] Seq=760 Ack=110828 Win=16127 Len=0 TSval=2278768892 TSecr=63947642"
"116","1.731395","2600:1408:ec00:1286::2e03","2600:8805:3803:6100:c100:e220:6ae:755","TCP","1514","443  >  55088 [ACK] Seq=110828 Ack=725 Win=8397 Len=1428 TSval=63947642 TSecr=2278768838 [TCP segment of a reassembled PDU]"
"117","1.731396","2600:1408:ec00:1286::2e03","2600:8805:3803:6100:c100:e220:6ae:755","TCP","1514","443  >  55088 [ACK] Seq=112256 Ack=725 Win=8397 Len=1428 TSval=63947642 TSecr=2278768838 [TCP segment of a reassembled PDU]"
"118","1.731397","2600:1408:ec00:1286::2e03","2600:8805:3803:6100:c100:e220:6ae:755","TCP","1514","443  >  55088 [ACK] Seq=113684 Ack=725 Win=8397 Len=1428 TSval=63947642 TSecr=2278768838 [TCP segment of a reassembled PDU]"
"119","1.731397","2600:1408:ec00:1286::2e03","2600:8805:3803:6100:c100:e220:6ae:755","TCP","1514","443  >  55088 [ACK] Seq=115112 Ack=725 Win=8397 Len=1428 TSval=63947642 TSecr=2278768838 [TCP segment of a reassembled PDU]"
"120","1.731398","2600:1408:ec00:1286::2e03","2600:8805:3803:6100:c100:e220:6ae:755","TCP","1514","443  >  55088 [ACK] Seq=116540 Ack=725 Win=8397 Len=1428 TSval=63947642 TSecr=2278768838 [TCP segment of a reassembled PDU]"
"121","1.731398","2600:1408:ec00:1286::2e03","2600:8805:3803:6100:c100:e220:6ae:755","TCP","1514","443  >  55088 [ACK] Seq=117968 Ack=725 Win=8397 Len=1428 TSval=63947642 TSecr=2278768838 [TCP segment of a reassembled PDU]"
"122","1.731399","2600:1408:ec00:1286::2e03","2600:8805:3803:6100:c100:e220:6ae:755","TCP","1514","443  >  55088 [ACK] Seq=119396 Ack=725 Win=8397 Len=1428 TSval=63947642 TSecr=2278768838 [TCP segment of a reassembled PDU]"
"123","1.731399","2600:1408:ec00:1286::2e03","2600:8805:3803:6100:c100:e220:6ae:755","TCP","1514","443  >  55088 [ACK] Seq=120824 Ack=725 Win=8397 Len=1428 TSval=63947642 TSecr=2278768838 [TCP segment of a reassembled PDU]"
"124","1.731400","2600:1408:ec00:1286::2e03","2600:8805:3803:6100:c100:e220:6ae:755","TCP","1514","443  >  55088 [ACK] Seq=122252 Ack=725 Win=8397 Len=1428 TSval=63947642 TSecr=2278768838 [TCP segment of a reassembled PDU]"
"125","1.731401","2600:1408:ec00:1286::2e03","2600:8805:3803:6100:c100:e220:6ae:755","TCP","1514","443  >  55088 [ACK] Seq=123680 Ack=725 Win=8397 Len=1428 TSval=63947642 TSecr=2278768838 [TCP segment of a reassembled PDU]"
"126","1.731401","2600:1408:ec00:1286::2e03","2600:8805:3803:6100:c100:e220:6ae:755","TLSv1.2","784","Application Data"
"127","1.731402","2600:1408:ec00:1286::2e03","2600:8805:3803:6100:c100:e220:6ae:755","TLSv1.2","117","Application Data"
"128","1.731478","2600:8805:3803:6100:c100:e220:6ae:755","2600:1408:ec00:1286::2e03","TCP","86","55088  >  443 [ACK] Seq=760 Ack=125837 Win=15914 Len=0 TSval=2278768893 TSecr=63947642"
"129","1.731562","2600:8805:3803:6100:c100:e220:6ae:755","2600:1408:ec00:1286::2e03","TCP","86","[TCP Window Update] 55088  >  443 [ACK] Seq=760 Ack=125837 Win=16149 Len=0 TSval=2278768893 TSecr=63947642"
"130","1.732378","2600:1408:ec00:1286::2e03","2600:8805:3803:6100:c100:e220:6ae:755","TCP","1514","443  >  55088 [ACK] Seq=125837 Ack=725 Win=8397 Len=1428 TSval=63947643 TSecr=2278768838 [TCP segment of a reassembled PDU]"
"131","1.732379","2600:1408:ec00:1286::2e03","2600:8805:3803:6100:c100:e220:6ae:755","TCP","1514","443  >  55088 [ACK] Seq=127265 Ack=725 Win=8397 Len=1428 TSval=63947643 TSecr=2278768838 [TCP segment of a reassembled PDU]"
"132","1.732380","2600:1408:ec00:1286::2e03","2600:8805:3803:6100:c100:e220:6ae:755","TCP","1514","443  >  55088 [ACK] Seq=128693 Ack=725 Win=8397 Len=1428 TSval=63947643 TSecr=2278768838 [TCP segment of a reassembled PDU]"
"133","1.732380","2600:1408:ec00:1286::2e03","2600:8805:3803:6100:c100:e220:6ae:755","TCP","1514","443  >  55088 [ACK] Seq=130121 Ack=725 Win=8397 Len=1428 TSval=63947643 TSecr=2278768838 [TCP segment of a reassembled PDU]"
"134","1.732381","2600:1408:ec00:1286::2e03","2600:8805:3803:6100:c100:e220:6ae:755","TCP","1514","443  >  55088 [ACK] Seq=131549 Ack=725 Win=8397 Len=1428 TSval=63947643 TSecr=2278768838 [TCP segment of a reassembled PDU]"
"135","1.732381","2600:1408:ec00:1286::2e03","2600:8805:3803:6100:c100:e220:6ae:755","TLSv1.2","1321","Application Data"
"136","1.732455","2600:8805:3803:6100:c100:e220:6ae:755","2600:1408:ec00:1286::2e03","TCP","86","55088  >  443 [ACK] Seq=760 Ack=134212 Win=16018 Len=0 TSval=2278768893 TSecr=63947643"
"137","1.732576","2600:8805:3803:6100:c100:e220:6ae:755","2600:1408:ec00:1286::2e03","TCP","86","[TCP Window Update] 55088  >  443 [ACK] Seq=760 Ack=134212 Win=16149 Len=0 TSval=2278768894 TSecr=63947643"
"138","1.734708","2600:1408:ec00:1286::2e03","2600:8805:3803:6100:c100:e220:6ae:755","TCP","1514","443  >  55088 [ACK] Seq=134212 Ack=725 Win=8397 Len=1428 TSval=63947647 TSecr=2278768838 [TCP segment of a reassembled PDU]"
"139","1.735401","2600:1408:ec00:1286::2e03","2600:8805:3803:6100:c100:e220:6ae:755","TCP","1514","443  >  55088 [ACK] Seq=135640 Ack=725 Win=8397 Len=1428 TSval=63947647 TSecr=2278768838 [TCP segment of a reassembled PDU]"
"140","1.735402","2600:1408:ec00:1286::2e03","2600:8805:3803:6100:c100:e220:6ae:755","TCP","1514","443  >  55088 [ACK] Seq=137068 Ack=725 Win=8397 Len=1428 TSval=63947647 TSecr=2278768838 [TCP segment of a reassembled PDU]"
"141","1.735403","2600:1408:ec00:1286::2e03","2600:8805:3803:6100:c100:e220:6ae:755","TCP","1514","443  >  55088 [ACK] Seq=138496 Ack=725 Win=8397 Len=1428 TSval=63947647 TSecr=2278768838 [TCP segment of a reassembled PDU]"
"142","1.735403","2600:1408:ec00:1286::2e03","2600:8805:3803:6100:c100:e220:6ae:755","TCP","1514","443  >  55088 [ACK] Seq=139924 Ack=725 Win=8397 Len=1428 TSval=63947647 TSecr=2278768838 [TCP segment of a reassembled PDU]"
"143","1.735404","2600:1408:ec00:1286::2e03","2600:8805:3803:6100:c100:e220:6ae:755","TCP","1514","443  >  55088 [ACK] Seq=141352 Ack=725 Win=8397 Len=1428 TSval=63947647 TSecr=2278768838 [TCP segment of a reassembled PDU]"
"144","1.735405","2600:1408:ec00:1286::2e03","2600:8805:3803:6100:c100:e220:6ae:755","TCP","1514","443  >  55088 [ACK] Seq=142780 Ack=725 Win=8397 Len=1428 TSval=63947647 TSecr=2278768838 [TCP segment of a reassembled PDU]"
"145","1.735405","2600:1408:ec00:1286::2e03","2600:8805:3803:6100:c100:e220:6ae:755","TCP","1514","443  >  55088 [ACK] Seq=144208 Ack=725 Win=8397 Len=1428 TSval=63947647 TSecr=2278768838 [TCP segment of a reassembled PDU]"
"146","1.735406","2600:1408:ec00:1286::2e03","2600:8805:3803:6100:c100:e220:6ae:755","TCP","1514","443  >  55088 [ACK] Seq=145636 Ack=725 Win=8397 Len=1428 TSval=63947647 TSecr=2278768838 [TCP segment of a reassembled PDU]"
"147","1.735406","2600:1408:ec00:1286::2e03","2600:8805:3803:6100:c100:e220:6ae:755","TCP","1514","443  >  55088 [ACK] Seq=147064 Ack=725 Win=8397 Len=1428 TSval=63947647 TSecr=2278768838 [TCP segment of a reassembled PDU]"
"148","1.735407","2600:1408:ec00:1286::2e03","2600:8805:3803:6100:c100:e220:6ae:755","TCP","1514","443  >  55088 [ACK] Seq=148492 Ack=725 Win=8397 Len=1428 TSval=63947647 TSecr=2278768838 [TCP segment of a reassembled PDU]"
"149","1.735407","2600:1408:ec00:1286::2e03","2600:8805:3803:6100:c100:e220:6ae:755","TLSv1.2","784","Application Data"
"150","1.735408","2600:1408:ec00:1286::2e03","2600:8805:3803:6100:c100:e220:6ae:755","TLSv1.2","117","Application Data"
"151","1.735725","2600:1408:ec00:1286::2e03","2600:8805:3803:6100:c100:e220:6ae:755","TCP","1514","443  >  55088 [ACK] Seq=150649 Ack=725 Win=8397 Len=1428 TSval=63947647 TSecr=2278768838 [TCP segment of a reassembled PDU]"
"152","1.735726","2600:1408:ec00:1286::2e03","2600:8805:3803:6100:c100:e220:6ae:755","TCP","1514","443  >  55088 [ACK] Seq=152077 Ack=725 Win=8397 Len=1428 TSval=63947647 TSecr=2278768838 [TCP segment of a reassembled PDU]"
"153","1.735883","2600:8805:3803:6100:c100:e220:6ae:755","2600:1408:ec00:1286::2e03","TCP","86","55088  >  443 [ACK] Seq=760 Ack=153505 Win=16149 Len=0 TSval=2278768897 TSecr=63947647"
"154","1.736501","2600:1408:ec00:1286::2e03","2600:8805:3803:6100:c100:e220:6ae:755","TCP","1514","443  >  55088 [ACK] Seq=153505 Ack=725 Win=8397 Len=1428 TSval=63947647 TSecr=2278768838 [TCP segment of a reassembled PDU]"
"155","1.736502","2600:1408:ec00:1286::2e03","2600:8805:3803:6100:c100:e220:6ae:755","TCP","1514","443  >  55088 [ACK] Seq=154933 Ack=725 Win=8397 Len=1428 TSval=63947647 TSecr=2278768838 [TCP segment of a reassembled PDU]"
"156","1.736502","2600:1408:ec00:1286::2e03","2600:8805:3803:6100:c100:e220:6ae:755","TCP","1514","443  >  55088 [ACK] Seq=156361 Ack=725 Win=8397 Len=1428 TSval=63947647 TSecr=2278768838 [TCP segment of a reassembled PDU]"
"157","1.736503","2600:1408:ec00:1286::2e03","2600:8805:3803:6100:c100:e220:6ae:755","TCP","1514","443  >  55088 [ACK] Seq=157789 Ack=725 Win=8397 Len=1428 TSval=63947647 TSecr=2278768838 [TCP segment of a reassembled PDU]"
"158","1.736503","2600:1408:ec00:1286::2e03","2600:8805:3803:6100:c100:e220:6ae:755","TLSv1.2","897","Application Data"
"159","1.736968","2600:8805:3803:6100:c100:e220:6ae:755","2600:1408:ec00:1286::2e03","TCP","86","55088  >  443 [ACK] Seq=760 Ack=160028 Win=16149 Len=0 TSval=2278768898 TSecr=63947647"
"160","1.755465","2600:1408:ec00:1286::2e03","2600:8805:3803:6100:c100:e220:6ae:755","TCP","1514","443  >  55088 [ACK] Seq=160028 Ack=760 Win=8397 Len=1428 TSval=63947666 TSecr=2278768879 [TCP segment of a reassembled PDU]"
"161","1.755466","2600:1408:ec00:1286::2e03","2600:8805:3803:6100:c100:e220:6ae:755","TCP","1514","443  >  55088 [PSH, ACK] Seq=161456 Ack=760 Win=8397 Len=1428 TSval=63947666 TSecr=2278768879 [TCP segment of a reassembled PDU]"
"162","1.755466","2600:1408:ec00:1286::2e03","2600:8805:3803:6100:c100:e220:6ae:755","TCP","1514","443  >  55088 [ACK] Seq=162884 Ack=760 Win=8397 Len=1428 TSval=63947666 TSecr=2278768879 [TCP segment of a reassembled PDU]"
"163","1.755467","2600:1408:ec00:1286::2e03","2600:8805:3803:6100:c100:e220:6ae:755","TCP","1514","443  >  55088 [PSH, ACK] Seq=164312 Ack=760 Win=8397 Len=1428 TSval=63947666 TSecr=2278768879 [TCP segment of a reassembled PDU]"
"164","1.755540","2600:8805:3803:6100:c100:e220:6ae:755","2600:1408:ec00:1286::2e03","TCP","86","55088  >  443 [ACK] Seq=760 Ack=165740 Win=16060 Len=0 TSval=2278768917 TSecr=63947666"
"165","1.755626","2600:8805:3803:6100:c100:e220:6ae:755","2600:1408:ec00:1286::2e03","TCP","86","[TCP Window Update] 55088  >  443 [ACK] Seq=760 Ack=165740 Win=16149 Len=0 TSval=2278768917 TSecr=63947666"
"166","1.771036","2600:1408:ec00:1286::2e03","2600:8805:3803:6100:c100:e220:6ae:755","TCP","1514","443  >  55088 [ACK] Seq=165740 Ack=760 Win=8397 Len=1428 TSval=63947683 TSecr=2278768917 [TCP segment of a reassembled PDU]"
"167","1.771392","2600:1408:ec00:1286::2e03","2600:8805:3803:6100:c100:e220:6ae:755","TCP","1514","443  >  55088 [PSH, ACK] Seq=167168 Ack=760 Win=8397 Len=1428 TSval=63947683 TSecr=2278768917 [TCP segment of a reassembled PDU]"
"168","1.771392","2600:1408:ec00:1286::2e03","2600:8805:3803:6100:c100:e220:6ae:755","TCP","1514","443  >  55088 [ACK] Seq=168596 Ack=760 Win=8397 Len=1428 TSval=63947683 TSecr=2278768917 [TCP segment of a reassembled PDU]"
"169","1.771393","2600:1408:ec00:1286::2e03","2600:8805:3803:6100:c100:e220:6ae:755","TCP","1514","443  >  55088 [PSH, ACK] Seq=170024 Ack=760 Win=8397 Len=1428 TSval=63947683 TSecr=2278768917 [TCP segment of a reassembled PDU]"
"170","1.772578","2600:8805:3803:6100:c100:e220:6ae:755","2600:1408:ec00:1286::2e03","TCP","86","55088  >  443 [ACK] Seq=760 Ack=171452 Win=16149 Len=0 TSval=2278768933 TSecr=63947683"
"171","1.791752","2600:1408:ec00:1286::2e03","2600:8805:3803:6100:c100:e220:6ae:755","TCP","1514","443  >  55088 [ACK] Seq=171452 Ack=760 Win=8397 Len=1428 TSval=63947704 TSecr=2278768933 [TCP segment of a reassembled PDU]"
"172","1.794827","2600:1408:ec00:1286::2e03","2600:8805:3803:6100:c100:e220:6ae:755","TCP","1514","443  >  55088 [PSH, ACK] Seq=172880 Ack=760 Win=8397 Len=1428 TSval=63947704 TSecr=2278768933 [TCP segment of a reassembled PDU]"
"173","1.794828","2600:1408:ec00:1286::2e03","2600:8805:3803:6100:c100:e220:6ae:755","TCP","1514","443  >  55088 [ACK] Seq=174308 Ack=760 Win=8397 Len=1428 TSval=63947704 TSecr=2278768933 [TCP segment of a reassembled PDU]"
"174","1.794829","2600:1408:ec00:1286::2e03","2600:8805:3803:6100:c100:e220:6ae:755","TLSv1.2","1514","Application Data, Application Data"
"175","1.794940","2600:8805:3803:6100:c100:e220:6ae:755","2600:1408:ec00:1286::2e03","TCP","86","55088  >  443 [ACK] Seq=760 Ack=177164 Win=16149 Len=0 TSval=2278768956 TSecr=63947704"
"176","1.809737","2600:1408:ec00:1286::2e03","2600:8805:3803:6100:c100:e220:6ae:755","TCP","1514","443  >  55088 [ACK] Seq=177164 Ack=760 Win=8397 Len=1428 TSval=63947722 TSecr=2278768956 [TCP segment of a reassembled PDU]"
"177","1.810311","2600:1408:ec00:1286::2e03","2600:8805:3803:6100:c100:e220:6ae:755","TCP","1514","443  >  55088 [PSH, ACK] Seq=178592 Ack=760 Win=8397 Len=1428 TSval=63947722 TSecr=2278768956 [TCP segment of a reassembled PDU]"
"178","1.810311","2600:1408:ec00:1286::2e03","2600:8805:3803:6100:c100:e220:6ae:755","TCP","1514","443  >  55088 [ACK] Seq=180020 Ack=760 Win=8397 Len=1428 TSval=63947722 TSecr=2278768956 [TCP segment of a reassembled PDU]"
"179","1.810312","2600:1408:ec00:1286::2e03","2600:8805:3803:6100:c100:e220:6ae:755","TCP","1514","443  >  55088 [PSH, ACK] Seq=181448 Ack=760 Win=8397 Len=1428 TSval=63947722 TSecr=2278768956 [TCP segment of a reassembled PDU]"
"180","1.810385","2600:8805:3803:6100:c100:e220:6ae:755","2600:1408:ec00:1286::2e03","TCP","86","55088  >  443 [ACK] Seq=760 Ack=182876 Win=16149 Len=0 TSval=2278768971 TSecr=63947722"
"181","1.825302","2600:1408:ec00:1286::2e03","2600:8805:3803:6100:c100:e220:6ae:755","TLSv1.2","1514","Application Data"
"182","1.826251","2600:1408:ec00:1286::2e03","2600:8805:3803:6100:c100:e220:6ae:755","TCP","1514","443  >  55088 [PSH, ACK] Seq=184304 Ack=760 Win=8397 Len=1428 TSval=63947738 TSecr=2278768971 [TCP segment of a reassembled PDU]"
"183","1.826252","2600:1408:ec00:1286::2e03","2600:8805:3803:6100:c100:e220:6ae:755","TCP","1514","443  >  55088 [ACK] Seq=185732 Ack=760 Win=8397 Len=1428 TSval=63947738 TSecr=2278768971 [TCP segment of a reassembled PDU]"
"184","1.826253","2600:1408:ec00:1286::2e03","2600:8805:3803:6100:c100:e220:6ae:755","TCP","1514","443  >  55088 [PSH, ACK] Seq=187160 Ack=760 Win=8397 Len=1428 TSval=63947738 TSecr=2278768971 [TCP segment of a reassembled PDU]"
"185","1.826365","2600:8805:3803:6100:c100:e220:6ae:755","2600:1408:ec00:1286::2e03","TCP","86","55088  >  443 [ACK] Seq=760 Ack=188588 Win=16149 Len=0 TSval=2278768987 TSecr=63947738"
"186","1.842667","2600:1408:ec00:1286::2e03","2600:8805:3803:6100:c100:e220:6ae:755","TCP","1514","443  >  55088 [ACK] Seq=188588 Ack=760 Win=8397 Len=1428 TSval=63947754 TSecr=2278768987 [TCP segment of a reassembled PDU]"
"187","1.843082","2600:1408:ec00:1286::2e03","2600:8805:3803:6100:c100:e220:6ae:755","TCP","1514","443  >  55088 [PSH, ACK] Seq=190016 Ack=760 Win=8397 Len=1428 TSval=63947754 TSecr=2278768987 [TCP segment of a reassembled PDU]"
"188","1.843082","2600:1408:ec00:1286::2e03","2600:8805:3803:6100:c100:e220:6ae:755","TCP","1514","443  >  55088 [ACK] Seq=191444 Ack=760 Win=8397 Len=1428 TSval=63947754 TSecr=2278768987 [TCP segment of a reassembled PDU]"
"189","1.843083","2600:1408:ec00:1286::2e03","2600:8805:3803:6100:c100:e220:6ae:755","TCP","1514","443  >  55088 [PSH, ACK] Seq=192872 Ack=760 Win=8397 Len=1428 TSval=63947754 TSecr=2278768987 [TCP segment of a reassembled PDU]"
"190","1.844703","2600:8805:3803:6100:c100:e220:6ae:755","2600:1408:ec00:1286::2e03","TCP","86","55088  >  443 [ACK] Seq=760 Ack=194300 Win=16149 Len=0 TSval=2278769006 TSecr=63947754"
"191","1.861001","2600:1408:ec00:1286::2e03","2600:8805:3803:6100:c100:e220:6ae:755","TCP","1514","443  >  55088 [ACK] Seq=194300 Ack=760 Win=8397 Len=1428 TSval=63947773 TSecr=2278769006 [TCP segment of a reassembled PDU]"
"192","1.861459","2600:1408:ec00:1286::2e03","2600:8805:3803:6100:c100:e220:6ae:755","TCP","1514","443  >  55088 [PSH, ACK] Seq=195728 Ack=760 Win=8397 Len=1428 TSval=63947773 TSecr=2278769006 [TCP segment of a reassembled PDU]"
"193","1.861459","2600:1408:ec00:1286::2e03","2600:8805:3803:6100:c100:e220:6ae:755","TCP","1514","443  >  55088 [ACK] Seq=197156 Ack=760 Win=8397 Len=1428 TSval=63947773 TSecr=2278769006 [TCP segment of a reassembled PDU]"
"194","1.861460","2600:1408:ec00:1286::2e03","2600:8805:3803:6100:c100:e220:6ae:755","TLSv1.2","1514","Application Data, Application Data"
"195","1.861555","2600:8805:3803:6100:c100:e220:6ae:755","2600:1408:ec00:1286::2e03","TCP","86","55088  >  443 [ACK] Seq=760 Ack=200012 Win=16149 Len=0 TSval=2278769022 TSecr=63947773"
"196","1.876267","2600:1408:ec00:1286::2e03","2600:8805:3803:6100:c100:e220:6ae:755","TCP","1514","443  >  55088 [ACK] Seq=200012 Ack=760 Win=8397 Len=1428 TSval=63947788 TSecr=2278769022 [TCP segment of a reassembled PDU]"
