"No.","Time","Source","Destination","Protocol","Length","Info"
"1","0.000000","2600:8805:3803:6100:c100:e220:6ae:755","2600:1408:ec00:1286::2e03","TLSv1.2","1033","Application Data"
"2","0.000038","2600:8805:3803:6100:c100:e220:6ae:755","2600:1408:ec00:1286::2e03","TLSv1.2","125","Application Data"
"3","0.041287","2600:1408:ec00:1286::2e03","2600:8805:3803:6100:c100:e220:6ae:755","TCP","86","443  >  55088 [ACK] Seq=1 Ack=948 Win=1086 Len=0 TSval=63856026 TSecr=2278677235"
"4","0.041288","2600:1408:ec00:1286::2e03","2600:8805:3803:6100:c100:e220:6ae:755","TCP","86","443  >  55088 [ACK] Seq=1 Ack=987 Win=1086 Len=0 TSval=63856026 TSecr=2278677235"
"5","0.043681","2600:1408:ec00:1286::2e03","2600:8805:3803:6100:c100:e220:6ae:755","TLSv1.2","125","Application Data"
"6","0.043744","2600:8805:3803:6100:c100:e220:6ae:755","2600:1408:ec00:1286::2e03","TCP","86","55088  >  443 [ACK] Seq=987 Ack=40 Win=16148 Len=0 TSval=2278677279 TSecr=63856031"
"7","1.348068","2600:1408:ec00:1286::2e03","2600:8805:3803:6100:c100:e220:6ae:755","TLSv1.2","1344","Application Data"
"8","1.348070","2600:1408:ec00:1286::2e03","2600:8805:3803:6100:c100:e220:6ae:755","TCP","1514","443  >  55088 [ACK] Seq=1298 Ack=987 Win=1086 Len=1428 TSval=63857283 TSecr=2278677279 [TCP segment of a reassembled PDU]"
"9","1.348070","2600:1408:ec00:1286::2e03","2600:8805:3803:6100:c100:e220:6ae:755","TCP","1514","443  >  55088 [ACK] Seq=2726 Ack=987 Win=1086 Len=1428 TSval=63857283 TSecr=2278677279 [TCP segment of a reassembled PDU]"
"10","1.348071","2600:1408:ec00:1286::2e03","2600:8805:3803:6100:c100:e220:6ae:755","TCP","1514","443  >  55088 [ACK] Seq=4154 Ack=987 Win=1086 Len=1428 TSval=63857283 TSecr=2278677279 [TCP segment of a reassembled PDU]"
"11","1.348072","2600:1408:ec00:1286::2e03","2600:8805:3803:6100:c100:e220:6ae:755","TCP","1514","443  >  55088 [ACK] Seq=5582 Ack=987 Win=1086 Len=1428 TSval=63857283 TSecr=2278677279 [TCP segment of a reassembled PDU]"
"12","1.348073","2600:1408:ec00:1286::2e03","2600:8805:3803:6100:c100:e220:6ae:755","TCP","1514","443  >  55088 [ACK] Seq=7010 Ack=987 Win=1086 Len=1428 TSval=63857283 TSecr=2278677279 [TCP segment of a reassembled PDU]"
"13","1.348074","2600:1408:ec00:1286::2e03","2600:8805:3803:6100:c100:e220:6ae:755","TCP","1514","443  >  55088 [ACK] Seq=8438 Ack=987 Win=1086 Len=1428 TSval=63857283 TSecr=2278677279 [TCP segment of a reassembled PDU]"
"14","1.348074","2600:1408:ec00:1286::2e03","2600:8805:3803:6100:c100:e220:6ae:755","TCP","1514","443  >  55088 [ACK] Seq=9866 Ack=987 Win=1086 Len=1428 TSval=63857283 TSecr=2278677279 [TCP segment of a reassembled PDU]"
"15","1.348075","2600:1408:ec00:1286::2e03","2600:8805:3803:6100:c100:e220:6ae:755","TCP","1514","443  >  55088 [ACK] Seq=11294 Ack=987 Win=1086 Len=1428 TSval=63857283 TSecr=2278677279 [TCP segment of a reassembled PDU]"
"16","1.348076","2600:1408:ec00:1286::2e03","2600:8805:3803:6100:c100:e220:6ae:755","TCP","1514","443  >  55088 [ACK] Seq=12722 Ack=987 Win=1086 Len=1428 TSval=63857283 TSecr=2278677279 [TCP segment of a reassembled PDU]"
"17","1.348077","2600:1408:ec00:1286::2e03","2600:8805:3803:6100:c100:e220:6ae:755","TCP","1514","443  >  55088 [ACK] Seq=14150 Ack=987 Win=1086 Len=1428 TSval=63857283 TSecr=2278677279 [TCP segment of a reassembled PDU]"
"18","1.348078","2600:1408:ec00:1286::2e03","2600:8805:3803:6100:c100:e220:6ae:755","TCP","1514","443  >  55088 [ACK] Seq=15578 Ack=987 Win=1086 Len=1428 TSval=63857283 TSecr=2278677279 [TCP segment of a reassembled PDU]"
"19","1.348078","2600:1408:ec00:1286::2e03","2600:8805:3803:6100:c100:e220:6ae:755","TLSv1.2","784","Application Data"
"20","1.348079","2600:1408:ec00:1286::2e03","2600:8805:3803:6100:c100:e220:6ae:755","TLSv1.2","1514","Application Data"
"21","1.348080","2600:1408:ec00:1286::2e03","2600:8805:3803:6100:c100:e220:6ae:755","TCP","1514","443  >  55088 [ACK] Seq=19132 Ack=987 Win=1086 Len=1428 TSval=63857284 TSecr=2278677279 [TCP segment of a reassembled PDU]"
"22","1.348081","2600:1408:ec00:1286::2e03","2600:8805:3803:6100:c100:e220:6ae:755","TCP","1514","443  >  55088 [ACK] Seq=20560 Ack=987 Win=1086 Len=1428 TSval=63857284 TSecr=2278677279 [TCP segment of a reassembled PDU]"
"23","1.348195","2600:8805:3803:6100:c100:e220:6ae:755","2600:1408:ec00:1286::2e03","TCP","86","55088  >  443 [ACK] Seq=987 Ack=15578 Win=15906 Len=0 TSval=2278678583 TSecr=63857283"
"24","1.348426","2600:1408:ec00:1286::2e03","2600:8805:3803:6100:c100:e220:6ae:755","TCP","1514","443  >  55088 [ACK] Seq=21988 Ack=987 Win=1086 Len=1428 TSval=63857284 TSecr=2278677279 [TCP segment of a reassembled PDU]"
"25","1.348428","2600:1408:ec00:1286::2e03","2600:8805:3803:6100:c100:e220:6ae:755","TCP","1514","443  >  55088 [ACK] Seq=23416 Ack=987 Win=1086 Len=1428 TSval=63857284 TSecr=2278677279 [TCP segment of a reassembled PDU]"
"26","1.348429","2600:1408:ec00:1286::2e03","2600:8805:3803:6100:c100:e220:6ae:755","TCP","1514","443  >  55088 [ACK] Seq=24844 Ack=987 Win=1086 Len=1428 TSval=63857284 TSecr=2278677279 [TCP segment of a reassembled PDU]"
"27","1.348430","2600:1408:ec00:1286::2e03","2600:8805:3803:6100:c100:e220:6ae:755","TCP","1514","443  >  55088 [ACK] Seq=26272 Ack=987 Win=1086 Len=1428 TSval=63857284 TSecr=2278677279 [TCP segment of a reassembled PDU]"
"28","1.348431","2600:1408:ec00:1286::2e03","2600:8805:3803:6100:c100:e220:6ae:755","TCP","1514","443  >  55088 [ACK] Seq=27700 Ack=987 Win=1086 Len=1428 TSval=63857284 TSecr=2278677279 [TCP segment of a reassembled PDU]"
"29","1.348432","2600:1408:ec00:1286::2e03","2600:8805:3803:6100:c100:e220:6ae:755","TCP","1514","443  >  55088 [ACK] Seq=29128 Ack=987 Win=1086 Len=1428 TSval=63857284 TSecr=2278677279 [TCP segment of a reassembled PDU]"
"30","1.348434","2600:1408:ec00:1286::2e03","2600:8805:3803:6100:c100:e220:6ae:755","TCP","1514","443  >  55088 [ACK] Seq=30556 Ack=987 Win=1086 Len=1428 TSval=63857284 TSecr=2278677279 [TCP segment of a reassembled PDU]"
"31","1.348435","2600:1408:ec00:1286::2e03","2600:8805:3803:6100:c100:e220:6ae:755","TCP","1514","443  >  55088 [ACK] Seq=31984 Ack=987 Win=1086 Len=1428 TSval=63857284 TSecr=2278677279 [TCP segment of a reassembled PDU]"
"32","1.348436","2600:1408:ec00:1286::2e03","2600:8805:3803:6100:c100:e220:6ae:755","TLSv1.2","815","Application Data"
"33","1.348437","2600:1408:ec00:1286::2e03","2600:8805:3803:6100:c100:e220:6ae:755","TLSv1.2","1514","Application Data"
"34","1.348438","2600:1408:ec00:1286::2e03","2600:8805:3803:6100:c100:e220:6ae:755","TCP","1514","443  >  55088 [ACK] Seq=35569 Ack=987 Win=1086 Len=1428 TSval=63857284 TSecr=2278677279 [TCP segment of a reassembled PDU]"
"35","1.348439","2600:1408:ec00:1286::2e03","2600:8805:3803:6100:c100:e220:6ae:755","TCP","1514","443  >  55088 [ACK] Seq=36997 Ack=987 Win=1086 Len=1428 TSval=63857284 TSecr=2278677279 [TCP segment of a reassembled PDU]"
"36","1.348440","2600:1408:ec00:1286::2e03","2600:8805:3803:6100:c100:e220:6ae:755","TCP","1514","443  >  55088 [ACK] Seq=38425 Ack=987 Win=1086 Len=1428 TSval=63857284 TSecr=2278677279 [TCP segment of a reassembled PDU]"
"37","1.348441","2600:1408:ec00:1286::2e03","2600:8805:3803:6100:c100:e220:6ae:755","TCP","1514","443  >  55088 [ACK] Seq=39853 Ack=987 Win=1086 Len=1428 TSval=63857284 TSecr=2278677279 [TCP segment of a reassembled PDU]"
"38","1.348442","2600:1408:ec00:1286::2e03","2600:8805:3803:6100:c100:e220:6ae:755","TCP","1514","443  >  55088 [ACK] Seq=41281 Ack=987 Win=1086 Len=1428 TSval=63857284 TSecr=2278677279 [TCP segment of a reassembled PDU]"
"39","1.348443","2600:1408:ec00:1286::2e03","2600:8805:3803:6100:c100:e220:6ae:755","TCP","1514","443  >  55088 [ACK] Seq=42709 Ack=987 Win=1086 Len=1428 TSval=63857284 TSecr=2278677279 [TCP segment of a reassembled PDU]"
"40","1.348444","2600:1408:ec00:1286::2e03","2600:8805:3803:6100:c100:e220:6ae:755","TCP","1514","443  >  55088 [ACK] Seq=44137 Ack=987 Win=1086 Len=1428 TSval=63857284 TSecr=2278677279 [TCP segment of a reassembled PDU]"
"41","1.348444","2600:1408:ec00:1286::2e03","2600:8805:3803:6100:c100:e220:6ae:755","TLSv1.2","696","Application Data"
"42","1.348446","2600:1408:ec00:1286::2e03","2600:8805:3803:6100:c100:e220:6ae:755","TCP","1514","443  >  55088 [ACK] Seq=46175 Ack=987 Win=1086 Len=1428 TSval=63857284 TSecr=2278677279 [TCP segment of a reassembled PDU]"
"43","1.348447","2600:1408:ec00:1286::2e03","2600:8805:3803:6100:c100:e220:6ae:755","TCP","1514","443  >  55088 [ACK] Seq=47603 Ack=987 Win=1086 Len=1428 TSval=63857284 TSecr=2278677279 [TCP segment of a reassembled PDU]"
"44","1.348447","2600:1408:ec00:1286::2e03","2600:8805:3803:6100:c100:e220:6ae:755","TCP","1514","443  >  55088 [ACK] Seq=49031 Ack=987 Win=1086 Len=1428 TSval=63857284 TSecr=2278677279 [TCP segment of a reassembled PDU]"
"45","1.348449","2600:1408:ec00:1286::2e03","2600:8805:3803:6100:c100:e220:6ae:755","TCP","1514","443  >  55088 [ACK] Seq=50459 Ack=987 Win=1086 Len=1428 TSval=63857284 TSecr=2278677279 [TCP segment of a reassembled PDU]"
"46","1.348449","2600:1408:ec00:1286::2e03","2600:8805:3803:6100:c100:e220:6ae:755","TCP","1514","443  >  55088 [ACK] Seq=51887 Ack=987 Win=1086 Len=1428 TSval=63857284 TSecr=2278677279 [TCP segment of a reassembled PDU]"
"47","1.348451","2600:1408:ec00:1286::2e03","2600:8805:3803:6100:c100:e220:6ae:755","TCP","1514","443  >  55088 [ACK] Seq=53315 Ack=987 Win=1086 Len=1428 TSval=63857284 TSecr=2278677279 [TCP segment of a reassembled PDU]"
"48","1.348452","2600:1408:ec00:1286::2e03","2600:8805:3803:6100:c100:e220:6ae:755","TCP","1514","443  >  55088 [ACK] Seq=54743 Ack=987 Win=1086 Len=1428 TSval=63857284 TSecr=2278677279 [TCP segment of a reassembled PDU]"
"49","1.348452","2600:1408:ec00:1286::2e03","2600:8805:3803:6100:c100:e220:6ae:755","TLSv1.2","963","Application Data"
"50","1.348454","2600:1408:ec00:1286::2e03","2600:8805:3803:6100:c100:e220:6ae:755","TCP","1514","443  >  55088 [ACK] Seq=57048 Ack=987 Win=1086 Len=1428 TSval=63857287 TSecr=2278677279 [TCP segment of a reassembled PDU]"
"51","1.348454","2600:1408:ec00:1286::2e03","2600:8805:3803:6100:c100:e220:6ae:755","TCP","1514","443  >  55088 [ACK] Seq=58476 Ack=987 Win=1086 Len=1428 TSval=63857287 TSecr=2278677279 [TCP segment of a reassembled PDU]"
"52","1.348455","2600:1408:ec00:1286::2e03","2600:8805:3803:6100:c100:e220:6ae:755","TCP","1514","443  >  55088 [ACK] Seq=59904 Ack=987 Win=1086 Len=1428 TSval=63857287 TSecr=2278677279 [TCP segment of a reassembled PDU]"
"53","1.348456","2600:1408:ec00:1286::2e03","2600:8805:3803:6100:c100:e220:6ae:755","TCP","1514","443  >  55088 [ACK] Seq=61332 Ack=987 Win=1086 Len=1428 TSval=63857287 TSecr=2278677279 [TCP segment of a reassembled PDU]"
"54","1.348457","2600:1408:ec00:1286::2e03","2600:8805:3803:6100:c100:e220:6ae:755","TCP","1514","443  >  55088 [ACK] Seq=62760 Ack=987 Win=1086 Len=1428 TSval=63857287 TSecr=2278677279 [TCP segment of a reassembled PDU]"
"55","1.348458","2600:1408:ec00:1286::2e03","2600:8805:3803:6100:c100:e220:6ae:755","TCP","1514","443  >  55088 [ACK] Seq=64188 Ack=987 Win=1086 Len=1428 TSval=63857287 TSecr=2278677279 [TCP segment of a reassembled PDU]"
"56","1.348459","2600:1408:ec00:1286::2e03","2600:8805:3803:6100:c100:e220:6ae:755","TCP","1514","443  >  55088 [ACK] Seq=65616 Ack=987 Win=1086 Len=1428 TSval=63857287 TSecr=2278677279 [TCP segment of a reassembled PDU]"
"57","1.348460","2600:1408:ec00:1286::2e03","2600:8805:3803:6100:c100:e220:6ae:755","TCP","1514","443  >  55088 [ACK] Seq=67044 Ack=987 Win=1086 Len=1428 TSval=63857287 TSecr=2278677279 [TCP segment of a reassembled PDU]"
"58","1.348462","2600:1408:ec00:1286::2e03","2600:8805:3803:6100:c100:e220:6ae:755","TCP","1514","443  >  55088 [ACK] Seq=68472 Ack=987 Win=1086 Len=1428 TSval=63857287 TSecr=2278677279 [TCP segment of a reassembled PDU]"
"59","1.348462","2600:1408:ec00:1286::2e03","2600:8805:3803:6100:c100:e220:6ae:755","TCP","1514","443  >  55088 [ACK] Seq=69900 Ack=987 Win=1086 Len=1428 TSval=63857287 TSecr=2278677279 [TCP segment of a reassembled PDU]"
"60","1.348493","2600:8805:3803:6100:c100:e220:6ae:755","2600:1408:ec00:1286::2e03","TCP","86","55088  >  443 [ACK] Seq=987 Ack=21988 Win=15806 Len=0 TSval=2278678583 TSecr=63857284"
"61","1.348542","2600:8805:3803:6100:c100:e220:6ae:755","2600:1408:ec00:1286::2e03","TCP","86","55088  >  443 [ACK] Seq=987 Ack=36997 Win=15572 Len=0 TSval=2278678583 TSecr=63857284"
"62","1.348561","2600:8805:3803:6100:c100:e220:6ae:755","2600:1408:ec00:1286::2e03","TCP","86","55088  >  443 [ACK] Seq=987 Ack=51887 Win=15582 Len=0 TSval=2278678583 TSecr=63857284"
"63","1.348578","2600:8805:3803:6100:c100:e220:6ae:755","2600:1408:ec00:1286::2e03","TCP","86","55088  >  443 [ACK] Seq=987 Ack=65616 Win=15396 Len=0 TSval=2278678583 TSecr=63857287"
"64","1.348597","2600:8805:3803:6100:c100:e220:6ae:755","2600:1408:ec00:1286::2e03","TCP","86","55088  >  443 [ACK] Seq=987 Ack=71328 Win=15378 Len=0 TSval=2278678583 TSecr=63857287"
"65","1.349184","2600:8805:3803:6100:c100:e220:6ae:755","2600:1408:ec00:1286::2e03","TCP","86","[TCP Window Update] 55088  >  443 [ACK] Seq=987 Ack=71328 Win=16149 Len=0 TSval=2278678584 TSecr=63857287"
"66","1.349930","2600:1408:ec00:1286::2e03","2600:8805:3803:6100:c100:e220:6ae:755","TCP","1514","443  >  55088 [ACK] Seq=71328 Ack=987 Win=1086 Len=1428 TSval=63857287 TSecr=2278677279 [TCP segment of a reassembled PDU]"
"67","1.349932","2600:1408:ec00:1286::2e03","2600:8805:3803:6100:c100:e220:6ae:755","TLSv1.2","784","Application Data"
"68","1.349933","2600:1408:ec00:1286::2e03","2600:8805:3803:6100:c100:e220:6ae:755","TLSv1.2","117","Application Data"
"69","1.349934","2600:1408:ec00:1286::2e03","2600:8805:3803:6100:c100:e220:6ae:755","TCP","1514","443  >  55088 [ACK] Seq=73485 Ack=987 Win=1086 Len=1428 TSval=63857288 TSecr=2278677279 [TCP segment of a reassembled PDU]"
"70","1.349934","2600:1408:ec00:1286::2e03","2600:8805:3803:6100:c100:e220:6ae:755","TCP","1514","443  >  55088 [ACK] Seq=74913 Ack=987 Win=1086 Len=1428 TSval=63857288 TSecr=2278677279 [TCP segment of a reassembled PDU]"
"71","1.349936","2600:1408:ec00:1286::2e03","2600:8805:3803:6100:c100:e220:6ae:755","TCP","1514","443  >  55088 [ACK] Seq=76341 Ack=987 Win=1086 Len=1428 TSval=63857288 TSecr=2278677279 [TCP segment of a reassembled PDU]"
"72","1.349937","2600:1408:ec00:1286::2e03","2600:8805:3803:6100:c100:e220:6ae:755","TCP","1514","443  >  55088 [ACK] Seq=77769 Ack=987 Win=1086 Len=1428 TSval=63857288 TSecr=2278677279 [TCP segment of a reassembled PDU]"
"73","1.349938","2600:1408:ec00:1286::2e03","2600:8805:3803:6100:c100:e220:6ae:755","TCP","1514","443  >  55088 [ACK] Seq=79197 Ack=987 Win=1086 Len=1428 TSval=63857288 TSecr=2278677279 [TCP segment of a reassembled PDU]"
"74","1.349939","2600:1408:ec00:1286::2e03","2600:8805:3803:6100:c100:e220:6ae:755","TCP","1514","443  >  55088 [ACK] Seq=80625 Ack=987 Win=1086 Len=1428 TSval=63857288 TSecr=2278677279 [TCP segment of a reassembled PDU]"
"75","1.349940","2600:1408:ec00:1286::2e03","2600:8805:3803:6100:c100:e220:6ae:755","TLSv1.2","260","Application Data"
"76","1.349940","2600:1408:ec00:1286::2e03","2600:8805:3803:6100:c100:e220:6ae:755","TCP","1514","443  >  55088 [ACK] Seq=82227 Ack=987 Win=1086 Len=1428 TSval=63857291 TSecr=2278677279 [TCP segment of a reassembled PDU]"
"77","1.349942","2600:1408:ec00:1286::2e03","2600:8805:3803:6100:c100:e220:6ae:755","TCP","1514","443  >  55088 [ACK] Seq=83655 Ack=987 Win=1086 Len=1428 TSval=63857291 TSecr=2278677279 [TCP segment of a reassembled PDU]"
"78","1.349943","2600:1408:ec00:1286::2e03","2600:8805:3803:6100:c100:e220:6ae:755","TCP","1514","443  >  55088 [ACK] Seq=85083 Ack=987 Win=1086 Len=1428 TSval=63857291 TSecr=2278677279 [TCP segment of a reassembled PDU]"
"79","1.349943","2600:1408:ec00:1286::2e03","2600:8805:3803:6100:c100:e220:6ae:755","TCP","1514","443  >  55088 [ACK] Seq=86511 Ack=987 Win=1086 Len=1428 TSval=63857291 TSecr=2278677279 [TCP segment of a reassembled PDU]"
"80","1.349945","2600:1408:ec00:1286::2e03","2600:8805:3803:6100:c100:e220:6ae:755","TCP","1514","443  >  55088 [ACK] Seq=87939 Ack=987 Win=1086 Len=1428 TSval=63857291 TSecr=2278677279 [TCP segment of a reassembled PDU]"
"81","1.349946","2600:1408:ec00:1286::2e03","2600:8805:3803:6100:c100:e220:6ae:755","TCP","1514","443  >  55088 [ACK] Seq=89367 Ack=987 Win=1086 Len=1428 TSval=63857291 TSecr=2278677279 [TCP segment of a reassembled PDU]"
"82","1.349947","2600:1408:ec00:1286::2e03","2600:8805:3803:6100:c100:e220:6ae:755","TCP","1514","443  >  55088 [ACK] Seq=90795 Ack=987 Win=1086 Len=1428 TSval=63857291 TSecr=2278677279 [TCP segment of a reassembled PDU]"
"83","1.349948","2600:1408:ec00:1286::2e03","2600:8805:3803:6100:c100:e220:6ae:755","TCP","1514","443  >  55088 [ACK] Seq=92223 Ack=987 Win=1086 Len=1428 TSval=63857291 TSecr=2278677279 [TCP segment of a reassembled PDU]"
"84","1.349949","2600:1408:ec00:1286::2e03","2600:8805:3803:6100:c100:e220:6ae:755","TCP","1514","443  >  55088 [ACK] Seq=93651 Ack=987 Win=1086 Len=1428 TSval=63857291 TSecr=2278677279 [TCP segment of a reassembled PDU]"
"85","1.349950","2600:1408:ec00:1286::2e03","2600:8805:3803:6100:c100:e220:6ae:755","TCP","1514","443  >  55088 [ACK] Seq=95079 Ack=987 Win=1086 Len=1428 TSval=63857291 TSecr=2278677279 [TCP segment of a reassembled PDU]"
"86","1.349951","2600:1408:ec00:1286::2e03","2600:8805:3803:6100:c100:e220:6ae:755","TCP","1514","443  >  55088 [ACK] Seq=96507 Ack=987 Win=1086 Len=1428 TSval=63857291 TSecr=2278677279 [TCP segment of a reassembled PDU]"
"87","1.349951","2600:1408:ec00:1286::2e03","2600:8805:3803:6100:c100:e220:6ae:755","TLSv1.2","784","Application Data"
"88","1.349953","2600:1408:ec00:1286::2e03","2600:8805:3803:6100:c100:e220:6ae:755","TLSv1.2","117","Application Data"
"89","1.349953","2600:1408:ec00:1286::2e03","2600:8805:3803:6100:c100:e220:6ae:755","TCP","1514","443  >  55088 [ACK] Seq=98664 Ack=987 Win=1086 Len=1428 TSval=63857291 TSecr=2278677279 [TCP segment of a reassembled PDU]"
"90","1.349954","2600:1408:ec00:1286::2e03","2600:8805:3803:6100:c100:e220:6ae:755","TCP","1514","443  >  55088 [ACK] Seq=100092 Ack=987 Win=1086 Len=1428 TSval=63857291 TSecr=2278677279 [TCP segment of a reassembled PDU]"
"91","1.349955","2600:1408:ec00:1286::2e03","2600:8805:3803:6100:c100:e220:6ae:755","TCP","1514","443  >  55088 [ACK] Seq=101520 Ack=987 Win=1086 Len=1428 TSval=63857291 TSecr=2278677279 [TCP segment of a reassembled PDU]"
"92","1.349956","2600:1408:ec00:1286::2e03","2600:8805:3803:6100:c100:e220:6ae:755","TCP","1514","443  >  55088 [ACK] Seq=102948 Ack=987 Win=1086 Len=1428 TSval=63857291 TSecr=2278677279 [TCP segment of a reassembled PDU]"
"93","1.349957","2600:1408:ec00:1286::2e03","2600:8805:3803:6100:c100:e220:6ae:755","TCP","1514","443  >  55088 [ACK] Seq=104376 Ack=987 Win=1086 Len=1428 TSval=63857291 TSecr=2278677279 [TCP segment of a reassembled PDU]"
"94","1.349958","2600:1408:ec00:1286::2e03","2600:8805:3803:6100:c100:e220:6ae:755","TLSv1.2","1068","Application Data"
"95","1.349959","2600:1408:ec00:1286::2e03","2600:8805:3803:6100:c100:e220:6ae:755","TCP","1514","443  >  55088 [ACK] Seq=106786 Ack=987 Win=1086 Len=1428 TSval=63857298 TSecr=2278677279 [TCP segment of a reassembled PDU]"
"96","1.349960","2600:1408:ec00:1286::2e03","2600:8805:3803:6100:c100:e220:6ae:755","TCP","1514","443  >  55088 [ACK] Seq=108214 Ack=987 Win=1086 Len=1428 TSval=63857298 TSecr=2278677279 [TCP segment of a reassembled PDU]"
"97","1.349962","2600:1408:ec00:1286::2e03","2600:8805:3803:6100:c100:e220:6ae:755","TCP","1514","443  >  55088 [ACK] Seq=109642 Ack=987 Win=1086 Len=1428 TSval=63857298 TSecr=2278677279 [TCP segment of a reassembled PDU]"
"98","1.349962","2600:1408:ec00:1286::2e03","2600:8805:3803:6100:c100:e220:6ae:755","TCP","1514","443  >  55088 [ACK] Seq=111070 Ack=987 Win=1086 Len=1428 TSval=63857298 TSecr=2278677279 [TCP segment of a reassembled PDU]"
"99","1.349963","2600:1408:ec00:1286::2e03","2600:8805:3803:6100:c100:e220:6ae:755","TCP","1514","443  >  55088 [ACK] Seq=112498 Ack=987 Win=1086 Len=1428 TSval=63857298 TSecr=2278677279 [TCP segment of a reassembled PDU]"
"100","1.349964","2600:1408:ec00:1286::2e03","2600:8805:3803:6100:c100:e220:6ae:755","TCP","1514","443  >  55088 [ACK] Seq=113926 Ack=987 Win=1086 Len=1428 TSval=63857298 TSecr=2278677279 [TCP segment of a reassembled PDU]"
"101","1.349965","2600:1408:ec00:1286::2e03","2600:8805:3803:6100:c100:e220:6ae:755","TCP","1514","443  >  55088 [ACK] Seq=115354 Ack=987 Win=1086 Len=1428 TSval=63857298 TSecr=2278677279 [TCP segment of a reassembled PDU]"
"102","1.349966","2600:1408:ec00:1286::2e03","2600:8805:3803:6100:c100:e220:6ae:755","TCP","1514","443  >  55088 [ACK] Seq=116782 Ack=987 Win=1086 Len=1428 TSval=63857298 TSecr=2278677279 [TCP segment of a reassembled PDU]"
"103","1.349967","2600:1408:ec00:1286::2e03","2600:8805:3803:6100:c100:e220:6ae:755","TCP","1514","443  >  55088 [ACK] Seq=118210 Ack=987 Win=1086 Len=1428 TSval=63857298 TSecr=2278677279 [TCP segment of a reassembled PDU]"
"104","1.349968","2600:1408:ec00:1286::2e03","2600:8805:3803:6100:c100:e220:6ae:755","TCP","1514","443  >  55088 [ACK] Seq=119638 Ack=987 Win=1086 Len=1428 TSval=63857298 TSecr=2278677279 [TCP segment of a reassembled PDU]"
"105","1.349969","2600:1408:ec00:1286::2e03","2600:8805:3803:6100:c100:e220:6ae:755","TCP","1514","443  >  55088 [ACK] Seq=121066 Ack=987 Win=1086 Len=1428 TSval=63857298 TSecr=2278677279 [TCP segment of a reassembled PDU]"
"106","1.349970","2600:1408:ec00:1286::2e03","2600:8805:3803:6100:c100:e220:6ae:755","TLSv1.2","784","Application Data"
"107","1.349971","2600:1408:ec00:1286::2e03","2600:8805:3803:6100:c100:e220:6ae:755","TLSv1.2","117","Application Data"
"108","1.349971","2600:1408:ec00:1286::2e03","2600:8805:3803:6100:c100:e220:6ae:755","TCP","1514","443  >  55088 [ACK] Seq=123223 Ack=987 Win=1086 Len=1428 TSval=63857298 TSecr=2278677279 [TCP segment of a reassembled PDU]"
"109","1.349973","2600:1408:ec00:1286::2e03","2600:8805:3803:6100:c100:e220:6ae:755","TCP","1514","443  >  55088 [ACK] Seq=124651 Ack=987 Win=1086 Len=1428 TSval=63857298 TSecr=2278677279 [TCP segment of a reassembled PDU]"
"110","1.349973","2600:1408:ec00:1286::2e03","2600:8805:3803:6100:c100:e220:6ae:755","TCP","1514","443  >  55088 [ACK] Seq=126079 Ack=987 Win=1086 Len=1428 TSval=63857298 TSecr=2278677279 [TCP segment of a reassembled PDU]"
"111","1.349974","2600:1408:ec00:1286::2e03","2600:8805:3803:6100:c100:e220:6ae:755","TCP","1514","443  >  55088 [ACK] Seq=127507 Ack=987 Win=1086 Len=1428 TSval=63857298 TSecr=2278677279 [TCP segment of a reassembled PDU]"
"112","1.349976","2600:1408:ec00:1286::2e03","2600:8805:3803:6100:c100:e220:6ae:755","TCP","1514","443  >  55088 [ACK] Seq=128935 Ack=987 Win=1086 Len=1428 TSval=63857298 TSecr=2278677279 [TCP segment of a reassembled PDU]"
"113","1.349977","2600:1408:ec00:1286::2e03","2600:8805:3803:6100:c100:e220:6ae:755","TCP","1514","443  >  55088 [ACK] Seq=130363 Ack=987 Win=1086 Len=1428 TSval=63857298 TSecr=2278677279 [TCP segment of a reassembled PDU]"
"114","1.349977","2600:1408:ec00:1286::2e03","2600:8805:3803:6100:c100:e220:6ae:755","TLSv1.2","769","Application Data"
"115","1.349979","2600:1408:ec00:1286::2e03","2600:8805:3803:6100:c100:e220:6ae:755","TCP","1514","443  >  55088 [ACK] Seq=132474 Ack=987 Win=1086 Len=1428 TSval=63857308 TSecr=2278677279 [TCP segment of a reassembled PDU]"
"116","1.349979","2600:1408:ec00:1286::2e03","2600:8805:3803:6100:c100:e220:6ae:755","TCP","1514","443  >  55088 [ACK] Seq=133902 Ack=987 Win=1086 Len=1428 TSval=63857308 TSecr=2278677279 [TCP segment of a reassembled PDU]"
"117","1.349980","2600:1408:ec00:1286::2e03","2600:8805:3803:6100:c100:e220:6ae:755","TCP","1514","443  >  55088 [ACK] Seq=135330 Ack=987 Win=1086 Len=1428 TSval=63857308 TSecr=2278677279 [TCP segment of a reassembled PDU]"
"118","1.349982","2600:1408:ec00:1286::2e03","2600:8805:3803:6100:c100:e220:6ae:755","TCP","1514","443  >  55088 [ACK] Seq=136758 Ack=987 Win=1086 Len=1428 TSval=63857308 TSecr=2278677279 [TCP segment of a reassembled PDU]"
"119","1.349982","2600:1408:ec00:1286::2e03","2600:8805:3803:6100:c100:e220:6ae:755","TCP","1514","443  >  55088 [ACK] Seq=138186 Ack=987 Win=1086 Len=1428 TSval=63857308 TSecr=2278677279 [TCP segment of a reassembled PDU]"
"120","1.349983","2600:1408:ec00:1286::2e03","2600:8805:3803:6100:c100:e220:6ae:755","TCP","1514","443  >  55088 [ACK] Seq=139614 Ack=987 Win=1086 Len=1428 TSval=63857308 TSecr=2278677279 [TCP segment of a reassembled PDU]"
"121","1.349985","2600:1408:ec00:1286::2e03","2600:8805:3803:6100:c100:e220:6ae:755","TCP","1514","443  >  55088 [ACK] Seq=141042 Ack=987 Win=1086 Len=1428 TSval=63857308 TSecr=2278677279 [TCP segment of a reassembled PDU]"
"122","1.349986","2600:1408:ec00:1286::2e03","2600:8805:3803:6100:c100:e220:6ae:755","TCP","1514","443  >  55088 [ACK] Seq=142470 Ack=987 Win=1086 Len=1428 TSval=63857308 TSecr=2278677279 [TCP segment of a reassembled PDU]"
"123","1.349987","2600:1408:ec00:1286::2e03","2600:8805:3803:6100:c100:e220:6ae:755","TCP","1514","443  >  55088 [ACK] Seq=143898 Ack=987 Win=1086 Len=1428 TSval=63857308 TSecr=2278677279 [TCP segment of a reassembled PDU]"
"124","1.349987","2600:1408:ec00:1286::2e03","2600:8805:3803:6100:c100:e220:6ae:755","TCP","1514","443  >  55088 [ACK] Seq=145326 Ack=987 Win=1086 Len=1428 TSval=63857308 TSecr=2278677279 [TCP segment of a reassembled PDU]"
"125","1.349988","2600:1408:ec00:1286::2e03","2600:8805:3803:6100:c100:e220:6ae:755","TCP","1514","443  >  55088 [ACK] Seq=146754 Ack=987 Win=1086 Len=1428 TSval=63857308 TSecr=2278677279 [TCP segment of a reassembled PDU]"
"126","1.349990","2600:1408:ec00:1286::2e03","2600:8805:3803:6100:c100:e220:6ae:755","TLSv1.2","784","Application Data"
"127","1.349990","2600:1408:ec00:1286::2e03","2600:8805:3803:6100:c100:e220:6ae:755","TLSv1.2","117","Application Data"
"128","1.349991","2600:1408:ec00:1286::2e03","2600:8805:3803:6100:c100:e220:6ae:755","TCP","1514","443  >  55088 [ACK] Seq=148911 Ack=987 Win=1086 Len=1428 TSval=63857308 TSecr=2278677279 [TCP segment of a reassembled PDU]"
"129","1.349992","2600:1408:ec00:1286::2e03","2600:8805:3803:6100:c100:e220:6ae:755","TCP","1514","443  >  55088 [ACK] Seq=150339 Ack=987 Win=1086 Len=1428 TSval=63857308 TSecr=2278677279 [TCP segment of a reassembled PDU]"
"130","1.349993","2600:1408:ec00:1286::2e03","2600:8805:3803:6100:c100:e220:6ae:755","TCP","1514","443  >  55088 [ACK] Seq=151767 Ack=987 Win=1086 Len=1428 TSval=63857308 TSecr=2278677279 [TCP segment of a reassembled PDU]"
"131","1.349994","2600:1408:ec00:1286::2e03","2600:8805:3803:6100:c100:e220:6ae:755","TCP","1514","443  >  55088 [ACK] Seq=153195 Ack=987 Win=1086 Len=1428 TSval=63857308 TSecr=2278677279 [TCP segment of a reassembled PDU]"
"132","1.349994","2600:1408:ec00:1286::2e03","2600:8805:3803:6100:c100:e220:6ae:755","TCP","1514","443  >  55088 [ACK] Seq=154623 Ack=987 Win=1086 Len=1428 TSval=63857308 TSecr=2278677279 [TCP segment of a reassembled PDU]"
"133","1.349996","2600:1408:ec00:1286::2e03","2600:8805:3803:6100:c100:e220:6ae:755","TCP","1514","443  >  55088 [ACK] Seq=156051 Ack=987 Win=1086 Len=1428 TSval=63857308 TSecr=2278677279 [TCP segment of a reassembled PDU]"
"134","1.350077","2600:1408:ec00:1286::2e03","2600:8805:3803:6100:c100:e220:6ae:755","TLSv1.2","459","Application Data"
"135","1.350078","2600:1408:ec00:1286::2e03","2600:8805:3803:6100:c100:e220:6ae:755","TCP","1514","443  >  55088 [ACK] Seq=157852 Ack=987 Win=1086 Len=1428 TSval=63857315 TSecr=2278677279 [TCP segment of a reassembled PDU]"
"136","1.350080","2600:1408:ec00:1286::2e03","2600:8805:3803:6100:c100:e220:6ae:755","TLSv1.2","346","Application Data"
"137","1.350080","2600:1408:ec00:1286::2e03","2600:8805:3803:6100:c100:e220:6ae:755","TLSv1.2","117","Application Data"
"138","1.350131","2600:8805:3803:6100:c100:e220:6ae:755","2600:1408:ec00:1286::2e03","TCP","86","55088  >  443 [ACK] Seq=987 Ack=86511 Win=15912 Len=0 TSval=2278678584 TSecr=63857291"
"139","1.350257","2600:8805:3803:6100:c100:e220:6ae:755","2600:1408:ec00:1286::2e03","TCP","86","55088  >  443 [ACK] Seq=987 Ack=101520 Win=15677 Len=0 TSval=2278678586 TSecr=63857291"
"140","1.350325","2600:8805:3803:6100:c100:e220:6ae:755","2600:1408:ec00:1286::2e03","TCP","86","55088  >  443 [ACK] Seq=987 Ack=111070 Win=15528 Len=0 TSval=2278678586 TSecr=63857298"
"141","1.350344","2600:8805:3803:6100:c100:e220:6ae:755","2600:1408:ec00:1286::2e03","TCP","86","55088  >  443 [ACK] Seq=987 Ack=126079 Win=15294 Len=0 TSval=2278678586 TSecr=63857298"
"142","1.350360","2600:8805:3803:6100:c100:e220:6ae:755","2600:1408:ec00:1286::2e03","TCP","86","55088  >  443 [ACK] Seq=987 Ack=141042 Win=15060 Len=0 TSval=2278678586 TSecr=63857308"
"143","1.350391","2600:8805:3803:6100:c100:e220:6ae:755","2600:1408:ec00:1286::2e03","TCP","86","55088  >  443 [ACK] Seq=987 Ack=151767 Win=14892 Len=0 TSval=2278678586 TSecr=63857308"
"144","1.350395","2600:8805:3803:6100:c100:e220:6ae:755","2600:1408:ec00:1286::2e03","TCP","86","55088  >  443 [ACK] Seq=987 Ack=157479 Win=14803 Len=0 TSval=2278678586 TSecr=63857308"
"145","1.350416","2600:8805:3803:6100:c100:e220:6ae:755","2600:1408:ec00:1286::2e03","TCP","86","55088  >  443 [ACK] Seq=987 Ack=159571 Win=14770 Len=0 TSval=2278678586 TSecr=63857315"
"146","1.351648","2600:8805:3803:6100:c100:e220:6ae:755","2600:1408:ec00:1286::2e03","TLSv1.2","121","Application Data"
"147","1.352657","2600:8805:3803:6100:c100:e220:6ae:755","2600:1408:ec00:1286::2e03","TCP","86","[TCP Window Update] 55088  >  443 [ACK] Seq=1022 Ack=159571 Win=16149 Len=0 TSval=2278678588 TSecr=63857315"
"148","1.410891","2600:1408:ec00:1286::2e03","2600:8805:3803:6100:c100:e220:6ae:755","TCP","86","443  >  55088 [ACK] Seq=159571 Ack=1022 Win=1086 Len=0 TSval=63857398 TSecr=2278678587"
"149","1.423254","2600:8805:3803:6100:c100:e220:6ae:755","2600:1408:ec00:1286::2e03","TCP","1514","55088  >  443 [ACK] Seq=1022 Ack=159571 Win=16149 Len=1428 TSval=2278678659 TSecr=63857398 [TCP segment of a reassembled PDU]"
"150","1.424050","2600:8805:3803:6100:c100:e220:6ae:755","2600:1408:ec00:1286::2e03","TLSv1.2","233","Application Data"
"151","1.424194","2600:8805:3803:6100:c100:e220:6ae:755","2600:1408:ec00:1286::2e03","TLSv1.2","571","Application Data"
"152","1.442803","2600:1408:ec00:1286::2e03","2600:8805:3803:6100:c100:e220:6ae:755","TCP","86","443  >  55088 [ACK] Seq=159571 Ack=2450 Win=1108 Len=0 TSval=63857430 TSecr=2278678659"
"153","1.443065","2600:1408:ec00:1286::2e03","2600:8805:3803:6100:c100:e220:6ae:755","TCP","86","443  >  55088 [ACK] Seq=159571 Ack=2597 Win=1130 Len=0 TSval=63857430 TSecr=2278678659"
"154","1.447016","2600:1408:ec00:1286::2e03","2600:8805:3803:6100:c100:e220:6ae:755","TCP","86","443  >  55088 [ACK] Seq=159571 Ack=3082 Win=1153 Len=0 TSval=63857434 TSecr=2278678659"
"155","1.453075","2600:1408:ec00:1286::2e03","2600:8805:3803:6100:c100:e220:6ae:755","TLSv1.2","1282","Application Data"
"156","1.453076","2600:1408:ec00:1286::2e03","2600:8805:3803:6100:c100:e220:6ae:755","TCP","1514","443  >  55088 [ACK] Seq=160767 Ack=3082 Win=1153 Len=1428 TSval=63857438 TSecr=2278678659 [TCP segment of a reassembled PDU]"
"157","1.453076","2600:1408:ec00:1286::2e03","2600:8805:3803:6100:c100:e220:6ae:755","TCP","1514","443  >  55088 [ACK] Seq=162195 Ack=3082 Win=1153 Len=1428 TSval=63857438 TSecr=2278678659 [TCP segment of a reassembled PDU]"
"158","1.453077","2600:1408:ec00:1286::2e03","2600:8805:3803:6100:c100:e220:6ae:755","TCP","1514","443  >  55088 [ACK] Seq=163623 Ack=3082 Win=1153 Len=1428 TSval=63857438 TSecr=2278678659 [TCP segment of a reassembled PDU]"
"159","1.453078","2600:1408:ec00:1286::2e03","2600:8805:3803:6100:c100:e220:6ae:755","TCP","1514","443  >  55088 [ACK] Seq=165051 Ack=3082 Win=1153 Len=1428 TSval=63857438 TSecr=2278678659 [TCP segment of a reassembled PDU]"
"160","1.453078","2600:1408:ec00:1286::2e03","2600:8805:3803:6100:c100:e220:6ae:755","TCP","1514","443  >  55088 [ACK] Seq=166479 Ack=3082 Win=1153 Len=1428 TSval=63857438 TSecr=2278678659 [TCP segment of a reassembled PDU]"
"161","1.453078","2600:1408:ec00:1286::2e03","2600:8805:3803:6100:c100:e220:6ae:755","TCP","1514","443  >  55088 [ACK] Seq=167907 Ack=3082 Win=1153 Len=1428 TSval=63857438 TSecr=2278678659 [TCP segment of a reassembled PDU]"
"162","1.453079","2600:1408:ec00:1286::2e03","2600:8805:3803:6100:c100:e220:6ae:755","TCP","1514","443  >  55088 [ACK] Seq=169335 Ack=3082 Win=1153 Len=1428 TSval=63857438 TSecr=2278678659 [TCP segment of a reassembled PDU]"
"163","1.453079","2600:1408:ec00:1286::2e03","2600:8805:3803:6100:c100:e220:6ae:755","TCP","1514","443  >  55088 [ACK] Seq=170763 Ack=3082 Win=1153 Len=1428 TSval=63857438 TSecr=2278678659 [TCP segment of a reassembled PDU]"
"164","1.453080","2600:1408:ec00:1286::2e03","2600:8805:3803:6100:c100:e220:6ae:755","TCP","1514","443  >  55088 [ACK] Seq=172191 Ack=3082 Win=1153 Len=1428 TSval=63857438 TSecr=2278678659 [TCP segment of a reassembled PDU]"
"165","1.453080","2600:1408:ec00:1286::2e03","2600:8805:3803:6100:c100:e220:6ae:755","TCP","1514","443  >  55088 [ACK] Seq=173619 Ack=3082 Win=1153 Len=1428 TSval=63857438 TSecr=2278678659 [TCP segment of a reassembled PDU]"
"166","1.453081","2600:1408:ec00:1286::2e03","2600:8805:3803:6100:c100:e220:6ae:755","TCP","1514","443  >  55088 [ACK] Seq=175047 Ack=3082 Win=1153 Len=1428 TSval=63857438 TSecr=2278678659 [TCP segment of a reassembled PDU]"
"167","1.453081","2600:1408:ec00:1286::2e03","2600:8805:3803:6100:c100:e220:6ae:755","TLSv1.2","784","Application Data"
"168","1.453081","2600:1408:ec00:1286::2e03","2600:8805:3803:6100:c100:e220:6ae:755","TLSv1.2","1514","Application Data"
"169","1.453082","2600:1408:ec00:1286::2e03","2600:8805:3803:6100:c100:e220:6ae:755","TCP","1514","443  >  55088 [ACK] Seq=178601 Ack=3082 Win=1153 Len=1428 TSval=63857438 TSecr=2278678659 [TCP segment of a reassembled PDU]"
"170","1.453082","2600:1408:ec00:1286::2e03","2600:8805:3803:6100:c100:e220:6ae:755","TCP","1514","443  >  55088 [ACK] Seq=180029 Ack=3082 Win=1153 Len=1428 TSval=63857438 TSecr=2278678659 [TCP segment of a reassembled PDU]"
"171","1.453083","2600:1408:ec00:1286::2e03","2600:8805:3803:6100:c100:e220:6ae:755","TCP","1514","443  >  55088 [ACK] Seq=181457 Ack=3082 Win=1153 Len=1428 TSval=63857438 TSecr=2278678659 [TCP segment of a reassembled PDU]"
"172","1.453083","2600:1408:ec00:1286::2e03","2600:8805:3803:6100:c100:e220:6ae:755","TCP","1514","443  >  55088 [ACK] Seq=182885 Ack=3082 Win=1153 Len=1428 TSval=63857438 TSecr=2278678659 [TCP segment of a reassembled PDU]"
"173","1.453084","2600:1408:ec00:1286::2e03","2600:8805:3803:6100:c100:e220:6ae:755","TCP","1514","443  >  55088 [ACK] Seq=184313 Ack=3082 Win=1153 Len=1428 TSval=63857438 TSecr=2278678659 [TCP segment of a reassembled PDU]"
"174","1.453085","2600:1408:ec00:1286::2e03","2600:8805:3803:6100:c100:e220:6ae:755","TCP","1514","443  >  55088 [ACK] Seq=185741 Ack=3082 Win=1153 Len=1428 TSval=63857438 TSecr=2278678659 [TCP segment of a reassembled PDU]"
"175","1.453085","2600:1408:ec00:1286::2e03","2600:8805:3803:6100:c100:e220:6ae:755","TCP","1514","443  >  55088 [ACK] Seq=187169 Ack=3082 Win=1153 Len=1428 TSval=63857438 TSecr=2278678659 [TCP segment of a reassembled PDU]"
"176","1.453214","2600:8805:3803:6100:c100:e220:6ae:755","2600:1408:ec00:1286::2e03","TCP","86","55088  >  443 [ACK] Seq=3082 Ack=175047 Win=15907 Len=0 TSval=2278678688 TSecr=63857438"
"177","1.453650","2600:1408:ec00:1286::2e03","2600:8805:3803:6100:c100:e220:6ae:755","TCP","1514","443  >  55088 [ACK] Seq=188597 Ack=3082 Win=1153 Len=1428 TSval=63857438 TSecr=2278678659 [TCP segment of a reassembled PDU]"
"178","1.453651","2600:1408:ec00:1286::2e03","2600:8805:3803:6100:c100:e220:6ae:755","TCP","1514","443  >  55088 [ACK] Seq=190025 Ack=3082 Win=1153 Len=1428 TSval=63857438 TSecr=2278678659 [TCP segment of a reassembled PDU]"
"179","1.453651","2600:1408:ec00:1286::2e03","2600:8805:3803:6100:c100:e220:6ae:755","TCP","1514","443  >  55088 [ACK] Seq=191453 Ack=3082 Win=1153 Len=1428 TSval=63857438 TSecr=2278678659 [TCP segment of a reassembled PDU]"
"180","1.453651","2600:1408:ec00:1286::2e03","2600:8805:3803:6100:c100:e220:6ae:755","TLSv1.2","815","Application Data"
"181","1.453652","2600:1408:ec00:1286::2e03","2600:8805:3803:6100:c100:e220:6ae:755","TLSv1.2","1514","Application Data"
"182","1.453653","2600:1408:ec00:1286::2e03","2600:8805:3803:6100:c100:e220:6ae:755","TCP","1514","443  >  55088 [ACK] Seq=195038 Ack=3082 Win=1153 Len=1428 TSval=63857439 TSecr=2278678659 [TCP segment of a reassembled PDU]"
"183","1.453653","2600:1408:ec00:1286::2e03","2600:8805:3803:6100:c100:e220:6ae:755","TCP","1514","443  >  55088 [ACK] Seq=196466 Ack=3082 Win=1153 Len=1428 TSval=63857439 TSecr=2278678659 [TCP segment of a reassembled PDU]"
"184","1.453654","2600:1408:ec00:1286::2e03","2600:8805:3803:6100:c100:e220:6ae:755","TCP","1514","443  >  55088 [ACK] Seq=197894 Ack=3082 Win=1153 Len=1428 TSval=63857439 TSecr=2278678659 [TCP segment of a reassembled PDU]"
"185","1.453654","2600:1408:ec00:1286::2e03","2600:8805:3803:6100:c100:e220:6ae:755","TCP","1514","443  >  55088 [ACK] Seq=199322 Ack=3082 Win=1153 Len=1428 TSval=63857439 TSecr=2278678659 [TCP segment of a reassembled PDU]"
"186","1.453655","2600:1408:ec00:1286::2e03","2600:8805:3803:6100:c100:e220:6ae:755","TCP","1514","443  >  55088 [ACK] Seq=200750 Ack=3082 Win=1153 Len=1428 TSval=63857439 TSecr=2278678659 [TCP segment of a reassembled PDU]"
"187","1.453655","2600:1408:ec00:1286::2e03","2600:8805:3803:6100:c100:e220:6ae:755","TCP","1514","443  >  55088 [ACK] Seq=202178 Ack=3082 Win=1153 Len=1428 TSval=63857439 TSecr=2278678659 [TCP segment of a reassembled PDU]"
"188","1.453656","2600:1408:ec00:1286::2e03","2600:8805:3803:6100:c100:e220:6ae:755","TCP","1514","443  >  55088 [ACK] Seq=203606 Ack=3082 Win=1153 Len=1428 TSval=63857439 TSecr=2278678659 [TCP segment of a reassembled PDU]"
"189","1.453656","2600:1408:ec00:1286::2e03","2600:8805:3803:6100:c100:e220:6ae:755","TCP","1514","443  >  55088 [ACK] Seq=205034 Ack=3082 Win=1153 Len=1428 TSval=63857439 TSecr=2278678659 [TCP segment of a reassembled PDU]"
"190","1.453657","2600:1408:ec00:1286::2e03","2600:8805:3803:6100:c100:e220:6ae:755","TCP","1514","443  >  55088 [ACK] Seq=206462 Ack=3082 Win=1153 Len=1428 TSval=63857439 TSecr=2278678659 [TCP segment of a reassembled PDU]"
"191","1.453657","2600:1408:ec00:1286::2e03","2600:8805:3803:6100:c100:e220:6ae:755","TCP","1514","443  >  55088 [ACK] Seq=207890 Ack=3082 Win=1153 Len=1428 TSval=63857439 TSecr=2278678659 [TCP segment of a reassembled PDU]"
"192","1.453658","2600:1408:ec00:1286::2e03","2600:8805:3803:6100:c100:e220:6ae:755","TLSv1.2","846","Application Data, Application Data"
"193","1.453658","2600:1408:ec00:1286::2e03","2600:8805:3803:6100:c100:e220:6ae:755","TCP","1514","443  >  55088 [ACK] Seq=210078 Ack=3082 Win=1153 Len=1428 TSval=63857439 TSecr=2278678659 [TCP segment of a reassembled PDU]"
"194","1.453659","2600:1408:ec00:1286::2e03","2600:8805:3803:6100:c100:e220:6ae:755","TCP","1514","443  >  55088 [ACK] Seq=211506 Ack=3082 Win=1153 Len=1428 TSval=63857439 TSecr=2278678659 [TCP segment of a reassembled PDU]"
"195","1.453659","2600:1408:ec00:1286::2e03","2600:8805:3803:6100:c100:e220:6ae:755","TCP","1514","443  >  55088 [ACK] Seq=212934 Ack=3082 Win=1153 Len=1428 TSval=63857439 TSecr=2278678659 [TCP segment of a reassembled PDU]"
"196","1.453660","2600:1408:ec00:1286::2e03","2600:8805:3803:6100:c100:e220:6ae:755","TCP","1514","443  >  55088 [ACK] Seq=214362 Ack=3082 Win=1153 Len=1428 TSval=63857439 TSecr=2278678659 [TCP segment of a reassembled PDU]"
"197","1.453660","2600:1408:ec00:1286::2e03","2600:8805:3803:6100:c100:e220:6ae:755","TCP","1514","443  >  55088 [ACK] Seq=215790 Ack=3082 Win=1153 Len=1428 TSval=63857439 TSecr=2278678659 [TCP segment of a reassembled PDU]"
"198","1.453661","2600:1408:ec00:1286::2e03","2600:8805:3803:6100:c100:e220:6ae:755","TCP","1514","443  >  55088 [ACK] Seq=217218 Ack=3082 Win=1153 Len=1428 TSval=63857439 TSecr=2278678659 [TCP segment of a reassembled PDU]"
