"No.","Time","Source","Destination","Protocol","Length","Info"
"1","0.000000","2600:8805:3803:6100:357c:4644:40b6:e846","2600:1408:ec00:128b::2e03","TCP","98","51538  >  443 [SYN, ECE, CWR] Seq=0 Win=65535 Len=0 MSS=1440 WS=64 TSval=2728006687 TSecr=0 SACK_PERM"
"2","0.020491","2600:1408:ec00:128b::2e03","2600:8805:3803:6100:357c:4644:40b6:e846","TCP","94","443  >  51538 [SYN, ACK, ECE] Seq=0 Ack=1 Win=64260 Len=0 MSS=1440 SACK_PERM TSval=3590199868 TSecr=2728006687 WS=128"
"3","0.020621","2600:8805:3803:6100:357c:4644:40b6:e846","2600:1408:ec00:128b::2e03","TCP","86","51538  >  443 [ACK] Seq=1 Ack=1 Win=131328 Len=0 TSval=2728006708 TSecr=3590199868"
"4","0.021777","2600:8805:3803:6100:357c:4644:40b6:e846","2600:1408:ec00:128b::2e03","TCP","1514","51538  >  443 [ACK] Seq=1 Ack=1 Win=131328 Len=1428 TSval=2728006709 TSecr=3590199868 [TCP segment of a reassembled PDU]"
"5","0.021824","2600:8805:3803:6100:357c:4644:40b6:e846","2600:1408:ec00:128b::2e03","TLSv1.3","698","Client Hello (SNI=weather.com)"
"6","0.043246","2600:1408:ec00:128b::2e03","2600:8805:3803:6100:357c:4644:40b6:e846","TCP","86","443  >  51538 [ACK] Seq=1 Ack=1429 Win=64128 Len=0 TSval=3590199891 TSecr=2728006709"
"7","0.043727","2600:1408:ec00:128b::2e03","2600:8805:3803:6100:357c:4644:40b6:e846","TCP","86","443  >  51538 [ACK] Seq=1 Ack=2041 Win=64000 Len=0 TSval=3590199891 TSecr=2728006709"
"8","0.044070","2600:1408:ec00:128b::2e03","2600:8805:3803:6100:357c:4644:40b6:e846","TLSv1.3","350","Server Hello, Change Cipher Spec, Application Data, Application Data"
"9","0.044122","2600:8805:3803:6100:357c:4644:40b6:e846","2600:1408:ec00:128b::2e03","TCP","86","51538  >  443 [ACK] Seq=2041 Ack=265 Win=131072 Len=0 TSval=2728006731 TSecr=3590199892"
"10","0.045863","2600:8805:3803:6100:357c:4644:40b6:e846","2600:1408:ec00:128b::2e03","TLSv1.3","166","Change Cipher Spec, Application Data"
"11","0.069367","2600:1408:ec00:128b::2e03","2600:8805:3803:6100:357c:4644:40b6:e846","TCP","86","443  >  51538 [ACK] Seq=265 Ack=2121 Win=64128 Len=0 TSval=3590199917 TSecr=2728006733"
"12","0.069700","2600:1408:ec00:128b::2e03","2600:8805:3803:6100:357c:4644:40b6:e846","TLSv1.3","357","Application Data"
"13","0.069770","2600:8805:3803:6100:357c:4644:40b6:e846","2600:1408:ec00:128b::2e03","TCP","86","51538  >  443 [ACK] Seq=2121 Ack=536 Win=130816 Len=0 TSval=2728006757 TSecr=3590199917"
"14","0.109905","2600:8805:3803:6100:357c:4644:40b6:e846","2600:1408:ec00:128b::2e03","TLSv1.3","178","Application Data"
"15","0.110152","2600:8805:3803:6100:357c:4644:40b6:e846","2600:1408:ec00:128b::2e03","TCP","1514","51538  >  443 [ACK] Seq=2213 Ack=536 Win=131072 Len=1428 TSval=2728006797 TSecr=3590199917 [TCP segment of a reassembled PDU]"
"16","0.110172","2600:8805:3803:6100:357c:4644:40b6:e846","2600:1408:ec00:128b::2e03","TLSv1.3","451","Application Data"
"17","0.132703","2600:1408:ec00:128b::2e03","2600:8805:3803:6100:357c:4644:40b6:e846","TLSv1.3","147","Application Data"
"18","0.132787","2600:8805:3803:6100:357c:4644:40b6:e846","2600:1408:ec00:128b::2e03","TCP","86","51538  >  443 [ACK] Seq=4006 Ack=597 Win=131008 Len=0 TSval=2728006820 TSecr=3590199981"
"19","0.133097","2600:1408:ec00:128b::2e03","2600:8805:3803:6100:357c:4644:40b6:e846","TLSv1.3","117","Application Data"
"20","0.133097","2600:1408:ec00:128b::2e03","2600:8805:3803:6100:357c:4644:40b6:e846","TCP","86","443  >  51538 [ACK] Seq=628 Ack=4006 Win=64128 Len=0 TSval=3590199981 TSecr=2728006797"
"21","0.133136","2600:8805:3803:6100:357c:4644:40b6:e846","2600:1408:ec00:128b::2e03","TCP","86","51538  >  443 [ACK] Seq=4006 Ack=628 Win=131008 Len=0 TSval=2728006820 TSecr=3590199981"
"22","0.133318","2600:8805:3803:6100:357c:4644:40b6:e846","2600:1408:ec00:128b::2e03","TLSv1.3","117","Application Data"
"23","0.196862","2600:1408:ec00:128b::2e03","2600:8805:3803:6100:357c:4644:40b6:e846","TCP","86","443  >  51538 [ACK] Seq=628 Ack=4037 Win=64128 Len=0 TSval=3590200044 TSecr=2728006820"
"24","1.070538","2600:1408:ec00:128b::2e03","2600:8805:3803:6100:357c:4644:40b6:e846","TLSv1.3","1464","Application Data"
"25","1.070540","2600:1408:ec00:128b::2e03","2600:8805:3803:6100:357c:4644:40b6:e846","TCP","1514","443  >  51538 [ACK] Seq=2006 Ack=4037 Win=64128 Len=1428 TSval=3590200843 TSecr=2728006820 [TCP segment of a reassembled PDU]"
"26","1.070541","2600:1408:ec00:128b::2e03","2600:8805:3803:6100:357c:4644:40b6:e846","TCP","1514","443  >  51538 [PSH, ACK] Seq=3434 Ack=4037 Win=64128 Len=1428 TSval=3590200843 TSecr=2728006820 [TCP segment of a reassembled PDU]"
"27","1.070542","2600:1408:ec00:128b::2e03","2600:8805:3803:6100:357c:4644:40b6:e846","TCP","1514","443  >  51538 [ACK] Seq=4862 Ack=4037 Win=64128 Len=1428 TSval=3590200843 TSecr=2728006820 [TCP segment of a reassembled PDU]"
"28","1.070544","2600:1408:ec00:128b::2e03","2600:8805:3803:6100:357c:4644:40b6:e846","TCP","1514","443  >  51538 [PSH, ACK] Seq=6290 Ack=4037 Win=64128 Len=1428 TSval=3590200843 TSecr=2728006820 [TCP segment of a reassembled PDU]"
"29","1.070545","2600:1408:ec00:128b::2e03","2600:8805:3803:6100:357c:4644:40b6:e846","TCP","1514","443  >  51538 [ACK] Seq=7718 Ack=4037 Win=64128 Len=1428 TSval=3590200843 TSecr=2728006820 [TCP segment of a reassembled PDU]"
"30","1.070548","2600:1408:ec00:128b::2e03","2600:8805:3803:6100:357c:4644:40b6:e846","TCP","1514","443  >  51538 [PSH, ACK] Seq=9146 Ack=4037 Win=64128 Len=1428 TSval=3590200843 TSecr=2728006820 [TCP segment of a reassembled PDU]"
"31","1.070549","2600:1408:ec00:128b::2e03","2600:8805:3803:6100:357c:4644:40b6:e846","TCP","1514","443  >  51538 [ACK] Seq=10574 Ack=4037 Win=64128 Len=1428 TSval=3590200843 TSecr=2728006820 [TCP segment of a reassembled PDU]"
"32","1.070550","2600:1408:ec00:128b::2e03","2600:8805:3803:6100:357c:4644:40b6:e846","TCP","1514","443  >  51538 [PSH, ACK] Seq=12002 Ack=4037 Win=64128 Len=1428 TSval=3590200843 TSecr=2728006820 [TCP segment of a reassembled PDU]"
"33","1.070553","2600:1408:ec00:128b::2e03","2600:8805:3803:6100:357c:4644:40b6:e846","TCP","1514","443  >  51538 [ACK] Seq=13430 Ack=4037 Win=64128 Len=1428 TSval=3590200843 TSecr=2728006820 [TCP segment of a reassembled PDU]"
"34","1.070554","2600:1408:ec00:128b::2e03","2600:8805:3803:6100:357c:4644:40b6:e846","TCP","1514","443  >  51538 [PSH, ACK] Seq=14858 Ack=4037 Win=64128 Len=1428 TSval=3590200843 TSecr=2728006820 [TCP segment of a reassembled PDU]"
"35","1.070557","2600:1408:ec00:128b::2e03","2600:8805:3803:6100:357c:4644:40b6:e846","TCP","1514","443  >  51538 [ACK] Seq=16286 Ack=4037 Win=64128 Len=1428 TSval=3590200843 TSecr=2728006820 [TCP segment of a reassembled PDU]"
"36","1.070558","2600:1408:ec00:128b::2e03","2600:8805:3803:6100:357c:4644:40b6:e846","TLSv1.3","815","Application Data, Application Data"
"37","1.070559","2600:1408:ec00:128b::2e03","2600:8805:3803:6100:357c:4644:40b6:e846","TCP","1514","443  >  51538 [ACK] Seq=18443 Ack=4037 Win=64128 Len=1428 TSval=3590200844 TSecr=2728006820 [TCP segment of a reassembled PDU]"
"38","1.070561","2600:1408:ec00:128b::2e03","2600:8805:3803:6100:357c:4644:40b6:e846","TCP","1514","443  >  51538 [PSH, ACK] Seq=19871 Ack=4037 Win=64128 Len=1428 TSval=3590200844 TSecr=2728006820 [TCP segment of a reassembled PDU]"
"39","1.070562","2600:1408:ec00:128b::2e03","2600:8805:3803:6100:357c:4644:40b6:e846","TCP","1514","443  >  51538 [ACK] Seq=21299 Ack=4037 Win=64128 Len=1428 TSval=3590200845 TSecr=2728006820 [TCP segment of a reassembled PDU]"
"40","1.070563","2600:1408:ec00:128b::2e03","2600:8805:3803:6100:357c:4644:40b6:e846","TCP","1514","443  >  51538 [PSH, ACK] Seq=22727 Ack=4037 Win=64128 Len=1428 TSval=3590200845 TSecr=2728006820 [TCP segment of a reassembled PDU]"
"41","1.070566","2600:1408:ec00:128b::2e03","2600:8805:3803:6100:357c:4644:40b6:e846","TCP","1514","443  >  51538 [ACK] Seq=24155 Ack=4037 Win=64128 Len=1428 TSval=3590200846 TSecr=2728006820 [TCP segment of a reassembled PDU]"
"42","1.070567","2600:1408:ec00:128b::2e03","2600:8805:3803:6100:357c:4644:40b6:e846","TCP","1514","443  >  51538 [ACK] Seq=25583 Ack=4037 Win=64128 Len=1428 TSval=3590200894 TSecr=2728006820 [TCP segment of a reassembled PDU]"
"43","1.070798","2600:8805:3803:6100:357c:4644:40b6:e846","2600:1408:ec00:128b::2e03","TCP","86","51538  >  443 [ACK] Seq=4037 Ack=16286 Win=115392 Len=0 TSval=2728007758 TSecr=3590200843"
"44","1.070924","2600:8805:3803:6100:357c:4644:40b6:e846","2600:1408:ec00:128b::2e03","TCP","86","51538  >  443 [ACK] Seq=4037 Ack=27011 Win=104640 Len=0 TSval=2728007758 TSecr=3590200894"
"45","1.071186","2600:8805:3803:6100:357c:4644:40b6:e846","2600:1408:ec00:128b::2e03","TCP","86","[TCP Window Update] 51538  >  443 [ACK] Seq=4037 Ack=27011 Win=131072 Len=0 TSval=2728007758 TSecr=3590200894"
"46","1.088055","2600:1408:ec00:128b::2e03","2600:8805:3803:6100:357c:4644:40b6:e846","TCP","1514","443  >  51538 [ACK] Seq=27011 Ack=4037 Win=64128 Len=1428 TSval=3590200937 TSecr=2728007758 [TCP segment of a reassembled PDU]"
"47","1.088131","2600:8805:3803:6100:357c:4644:40b6:e846","2600:1408:ec00:128b::2e03","TCP","86","51538  >  443 [ACK] Seq=4037 Ack=28439 Win=129600 Len=0 TSval=2728007775 TSecr=3590200937"
"48","1.088379","2600:1408:ec00:128b::2e03","2600:8805:3803:6100:357c:4644:40b6:e846","TCP","1514","443  >  51538 [PSH, ACK] Seq=28439 Ack=4037 Win=64128 Len=1428 TSval=3590200937 TSecr=2728007758 [TCP segment of a reassembled PDU]"
"49","1.088381","2600:1408:ec00:128b::2e03","2600:8805:3803:6100:357c:4644:40b6:e846","TCP","1514","443  >  51538 [ACK] Seq=29867 Ack=4037 Win=64128 Len=1428 TSval=3590200937 TSecr=2728007758 [TCP segment of a reassembled PDU]"
"50","1.088383","2600:1408:ec00:128b::2e03","2600:8805:3803:6100:357c:4644:40b6:e846","TCP","1514","443  >  51538 [PSH, ACK] Seq=31295 Ack=4037 Win=64128 Len=1428 TSval=3590200937 TSecr=2728007758 [TCP segment of a reassembled PDU]"
"51","1.088449","2600:8805:3803:6100:357c:4644:40b6:e846","2600:1408:ec00:128b::2e03","TCP","86","51538  >  443 [ACK] Seq=4037 Ack=32723 Win=125312 Len=0 TSval=2728007775 TSecr=3590200937"
"52","1.089069","2600:8805:3803:6100:357c:4644:40b6:e846","2600:1408:ec00:128b::2e03","TCP","86","[TCP Window Update] 51538  >  443 [ACK] Seq=4037 Ack=32723 Win=131072 Len=0 TSval=2728007775 TSecr=3590200937"
"53","1.089469","2600:1408:ec00:128b::2e03","2600:8805:3803:6100:357c:4644:40b6:e846","TCP","1514","443  >  51538 [ACK] Seq=32723 Ack=4037 Win=64128 Len=1428 TSval=3590200939 TSecr=2728007758 [TCP segment of a reassembled PDU]"
"54","1.089542","2600:8805:3803:6100:357c:4644:40b6:e846","2600:1408:ec00:128b::2e03","TCP","86","51538  >  443 [ACK] Seq=4037 Ack=34151 Win=129600 Len=0 TSval=2728007777 TSecr=3590200939"
"55","1.090108","2600:1408:ec00:128b::2e03","2600:8805:3803:6100:357c:4644:40b6:e846","TLSv1.3","1514","Application Data, Application Data"
"56","1.090159","2600:8805:3803:6100:357c:4644:40b6:e846","2600:1408:ec00:128b::2e03","TCP","86","51538  >  443 [ACK] Seq=4037 Ack=35579 Win=129600 Len=0 TSval=2728007777 TSecr=3590200939"
"57","1.091898","2600:1408:ec00:128b::2e03","2600:8805:3803:6100:357c:4644:40b6:e846","TCP","1514","443  >  51538 [ACK] Seq=35579 Ack=4037 Win=64128 Len=1428 TSval=3590200940 TSecr=2728007758 [TCP segment of a reassembled PDU]"
"58","1.091899","2600:1408:ec00:128b::2e03","2600:8805:3803:6100:357c:4644:40b6:e846","TCP","1514","443  >  51538 [PSH, ACK] Seq=37007 Ack=4037 Win=64128 Len=1428 TSval=3590200940 TSecr=2728007758 [TCP segment of a reassembled PDU]"
"59","1.091970","2600:8805:3803:6100:357c:4644:40b6:e846","2600:1408:ec00:128b::2e03","TCP","86","51538  >  443 [ACK] Seq=4037 Ack=38435 Win=128192 Len=0 TSval=2728007779 TSecr=3590200940"
"60","1.092184","2600:8805:3803:6100:357c:4644:40b6:e846","2600:1408:ec00:128b::2e03","TCP","86","[TCP Window Update] 51538  >  443 [ACK] Seq=4037 Ack=38435 Win=131072 Len=0 TSval=2728007779 TSecr=3590200940"
"61","1.092509","2600:1408:ec00:128b::2e03","2600:8805:3803:6100:357c:4644:40b6:e846","TCP","1514","443  >  51538 [ACK] Seq=38435 Ack=4037 Win=64128 Len=1428 TSval=3590200941 TSecr=2728007758 [TCP segment of a reassembled PDU]"
"62","1.092510","2600:1408:ec00:128b::2e03","2600:8805:3803:6100:357c:4644:40b6:e846","TCP","1514","443  >  51538 [PSH, ACK] Seq=39863 Ack=4037 Win=64128 Len=1428 TSval=3590200941 TSecr=2728007758 [TCP segment of a reassembled PDU]"
"63","1.092564","2600:8805:3803:6100:357c:4644:40b6:e846","2600:1408:ec00:128b::2e03","TCP","86","51538  >  443 [ACK] Seq=4037 Ack=41291 Win=128192 Len=0 TSval=2728007779 TSecr=3590200941"
"64","1.092751","2600:1408:ec00:128b::2e03","2600:8805:3803:6100:357c:4644:40b6:e846","TCP","1514","443  >  51538 [ACK] Seq=41291 Ack=4037 Win=64128 Len=1428 TSval=3590200942 TSecr=2728007758 [TCP segment of a reassembled PDU]"
"65","1.092753","2600:1408:ec00:128b::2e03","2600:8805:3803:6100:357c:4644:40b6:e846","TCP","1514","443  >  51538 [PSH, ACK] Seq=42719 Ack=4037 Win=64128 Len=1428 TSval=3590200942 TSecr=2728007758 [TCP segment of a reassembled PDU]"
"66","1.092755","2600:8805:3803:6100:357c:4644:40b6:e846","2600:1408:ec00:128b::2e03","TCP","86","[TCP Window Update] 51538  >  443 [ACK] Seq=4037 Ack=41291 Win=131072 Len=0 TSval=2728007779 TSecr=3590200941"
"67","1.092793","2600:8805:3803:6100:357c:4644:40b6:e846","2600:1408:ec00:128b::2e03","TCP","86","51538  >  443 [ACK] Seq=4037 Ack=44147 Win=128192 Len=0 TSval=2728007779 TSecr=3590200942"
"68","1.092897","2600:8805:3803:6100:357c:4644:40b6:e846","2600:1408:ec00:128b::2e03","TCP","86","[TCP Window Update] 51538  >  443 [ACK] Seq=4037 Ack=44147 Win=131072 Len=0 TSval=2728007779 TSecr=3590200942"
"69","1.093597","2600:1408:ec00:128b::2e03","2600:8805:3803:6100:357c:4644:40b6:e846","TCP","1514","443  >  51538 [ACK] Seq=44147 Ack=4037 Win=64128 Len=1428 TSval=3590200943 TSecr=2728007758 [TCP segment of a reassembled PDU]"
"70","1.093682","2600:8805:3803:6100:357c:4644:40b6:e846","2600:1408:ec00:128b::2e03","TCP","86","51538  >  443 [ACK] Seq=4037 Ack=45575 Win=129600 Len=0 TSval=2728007781 TSecr=3590200943"
"71","1.093796","2600:1408:ec00:128b::2e03","2600:8805:3803:6100:357c:4644:40b6:e846","TCP","1514","443  >  51538 [PSH, ACK] Seq=45575 Ack=4037 Win=64128 Len=1428 TSval=3590200943 TSecr=2728007758 [TCP segment of a reassembled PDU]"
"72","1.093842","2600:8805:3803:6100:357c:4644:40b6:e846","2600:1408:ec00:128b::2e03","TCP","86","51538  >  443 [ACK] Seq=4037 Ack=47003 Win=129600 Len=0 TSval=2728007781 TSecr=3590200943"
"73","1.094497","2600:1408:ec00:128b::2e03","2600:8805:3803:6100:357c:4644:40b6:e846","TLSv1.3","1514","Application Data"
"74","1.094611","2600:8805:3803:6100:357c:4644:40b6:e846","2600:1408:ec00:128b::2e03","TCP","86","51538  >  443 [ACK] Seq=4037 Ack=48431 Win=131072 Len=0 TSval=2728007781 TSecr=3590200944"
"75","1.094750","2600:1408:ec00:128b::2e03","2600:8805:3803:6100:357c:4644:40b6:e846","TCP","1514","443  >  51538 [PSH, ACK] Seq=48431 Ack=4037 Win=64128 Len=1428 TSval=3590200944 TSecr=2728007758 [TCP segment of a reassembled PDU]"
"76","1.094941","2600:8805:3803:6100:357c:4644:40b6:e846","2600:1408:ec00:128b::2e03","TCP","86","51538  >  443 [ACK] Seq=4037 Ack=49859 Win=131072 Len=0 TSval=2728007782 TSecr=3590200944"
"77","1.095475","2600:1408:ec00:128b::2e03","2600:8805:3803:6100:357c:4644:40b6:e846","TCP","1514","443  >  51538 [ACK] Seq=49859 Ack=4037 Win=64128 Len=1428 TSval=3590200945 TSecr=2728007758 [TCP segment of a reassembled PDU]"
"78","1.096169","2600:1408:ec00:128b::2e03","2600:8805:3803:6100:357c:4644:40b6:e846","TCP","1514","443  >  51538 [PSH, ACK] Seq=51287 Ack=4037 Win=64128 Len=1428 TSval=3590200945 TSecr=2728007758 [TCP segment of a reassembled PDU]"
"79","1.096252","2600:8805:3803:6100:357c:4644:40b6:e846","2600:1408:ec00:128b::2e03","TCP","86","51538  >  443 [ACK] Seq=4037 Ack=52715 Win=129600 Len=0 TSval=2728007784 TSecr=3590200945"
"80","1.096637","2600:1408:ec00:128b::2e03","2600:8805:3803:6100:357c:4644:40b6:e846","TCP","1514","443  >  51538 [ACK] Seq=52715 Ack=4037 Win=64128 Len=1428 TSval=3590200946 TSecr=2728007758 [TCP segment of a reassembled PDU]"
"81","1.096927","2600:1408:ec00:128b::2e03","2600:8805:3803:6100:357c:4644:40b6:e846","TCP","1514","443  >  51538 [PSH, ACK] Seq=54143 Ack=4037 Win=64128 Len=1428 TSval=3590200946 TSecr=2728007758 [TCP segment of a reassembled PDU]"
"82","1.096994","2600:8805:3803:6100:357c:4644:40b6:e846","2600:1408:ec00:128b::2e03","TCP","86","51538  >  443 [ACK] Seq=4037 Ack=55571 Win=128192 Len=0 TSval=2728007784 TSecr=3590200946"
"83","1.097120","2600:8805:3803:6100:357c:4644:40b6:e846","2600:1408:ec00:128b::2e03","TCP","86","[TCP Window Update] 51538  >  443 [ACK] Seq=4037 Ack=55571 Win=131072 Len=0 TSval=2728007784 TSecr=3590200946"
"84","1.097287","2600:1408:ec00:128b::2e03","2600:8805:3803:6100:357c:4644:40b6:e846","TLSv1.3","1514","Application Data"
"85","1.098879","2600:1408:ec00:128b::2e03","2600:8805:3803:6100:357c:4644:40b6:e846","TCP","1514","443  >  51538 [PSH, ACK] Seq=56999 Ack=4037 Win=64128 Len=1428 TSval=3590200947 TSecr=2728007758 [TCP segment of a reassembled PDU]"
"86","1.098949","2600:8805:3803:6100:357c:4644:40b6:e846","2600:1408:ec00:128b::2e03","TCP","86","51538  >  443 [ACK] Seq=4037 Ack=58427 Win=129600 Len=0 TSval=2728007786 TSecr=3590200947"
"87","1.099304","2600:1408:ec00:128b::2e03","2600:8805:3803:6100:357c:4644:40b6:e846","TCP","1514","443  >  51538 [ACK] Seq=58427 Ack=4037 Win=64128 Len=1428 TSval=3590200948 TSecr=2728007758 [TCP segment of a reassembled PDU]"
"88","1.099305","2600:1408:ec00:128b::2e03","2600:8805:3803:6100:357c:4644:40b6:e846","TCP","1514","443  >  51538 [PSH, ACK] Seq=59855 Ack=4037 Win=64128 Len=1428 TSval=3590200948 TSecr=2728007758 [TCP segment of a reassembled PDU]"
"89","1.099372","2600:8805:3803:6100:357c:4644:40b6:e846","2600:1408:ec00:128b::2e03","TCP","86","51538  >  443 [ACK] Seq=4037 Ack=61283 Win=128192 Len=0 TSval=2728007786 TSecr=3590200948"
"90","1.099608","2600:1408:ec00:128b::2e03","2600:8805:3803:6100:357c:4644:40b6:e846","TCP","1514","443  >  51538 [ACK] Seq=61283 Ack=4037 Win=64128 Len=1428 TSval=3590200949 TSecr=2728007758 [TCP segment of a reassembled PDU]"
"91","1.099622","2600:8805:3803:6100:357c:4644:40b6:e846","2600:1408:ec00:128b::2e03","TCP","86","[TCP Window Update] 51538  >  443 [ACK] Seq=4037 Ack=61283 Win=131072 Len=0 TSval=2728007786 TSecr=3590200948"
"92","1.100099","2600:1408:ec00:128b::2e03","2600:8805:3803:6100:357c:4644:40b6:e846","TCP","1514","443  >  51538 [PSH, ACK] Seq=62711 Ack=4037 Win=64128 Len=1428 TSval=3590200949 TSecr=2728007758 [TCP segment of a reassembled PDU]"
"93","1.100166","2600:8805:3803:6100:357c:4644:40b6:e846","2600:1408:ec00:128b::2e03","TCP","86","51538  >  443 [ACK] Seq=4037 Ack=64139 Win=129600 Len=0 TSval=2728007787 TSecr=3590200949"
"94","1.100430","2600:1408:ec00:128b::2e03","2600:8805:3803:6100:357c:4644:40b6:e846","TCP","1514","443  >  51538 [ACK] Seq=64139 Ack=4037 Win=64128 Len=1428 TSval=3590200950 TSecr=2728007758 [TCP segment of a reassembled PDU]"
"95","1.100432","2600:1408:ec00:128b::2e03","2600:8805:3803:6100:357c:4644:40b6:e846","TCP","1514","443  >  51538 [PSH, ACK] Seq=65567 Ack=4037 Win=64128 Len=1428 TSval=3590200950 TSecr=2728007758 [TCP segment of a reassembled PDU]"
"96","1.100490","2600:8805:3803:6100:357c:4644:40b6:e846","2600:1408:ec00:128b::2e03","TCP","86","51538  >  443 [ACK] Seq=4037 Ack=66995 Win=128192 Len=0 TSval=2728007787 TSecr=3590200950"
"97","1.100554","2600:8805:3803:6100:357c:4644:40b6:e846","2600:1408:ec00:128b::2e03","TCP","86","[TCP Window Update] 51538  >  443 [ACK] Seq=4037 Ack=66995 Win=131072 Len=0 TSval=2728007787 TSecr=3590200950"
"98","1.101896","2600:1408:ec00:128b::2e03","2600:8805:3803:6100:357c:4644:40b6:e846","TCP","1514","443  >  51538 [ACK] Seq=66995 Ack=4037 Win=64128 Len=1428 TSval=3590200951 TSecr=2728007758 [TCP segment of a reassembled PDU]"
"99","1.102175","2600:1408:ec00:128b::2e03","2600:8805:3803:6100:357c:4644:40b6:e846","TCP","1514","443  >  51538 [PSH, ACK] Seq=68423 Ack=4037 Win=64128 Len=1428 TSval=3590200951 TSecr=2728007758 [TCP segment of a reassembled PDU]"
"100","1.102227","2600:8805:3803:6100:357c:4644:40b6:e846","2600:1408:ec00:128b::2e03","TCP","86","51538  >  443 [ACK] Seq=4037 Ack=69851 Win=129600 Len=0 TSval=2728007789 TSecr=3590200951"
"101","1.102653","2600:1408:ec00:128b::2e03","2600:8805:3803:6100:357c:4644:40b6:e846","TCP","1514","443  >  51538 [ACK] Seq=69851 Ack=4037 Win=64128 Len=1428 TSval=3590200952 TSecr=2728007758 [TCP segment of a reassembled PDU]"
"102","1.102655","2600:1408:ec00:128b::2e03","2600:8805:3803:6100:357c:4644:40b6:e846","TCP","1514","443  >  51538 [PSH, ACK] Seq=71279 Ack=4037 Win=64128 Len=1428 TSval=3590200952 TSecr=2728007758 [TCP segment of a reassembled PDU]"
"103","1.102713","2600:8805:3803:6100:357c:4644:40b6:e846","2600:1408:ec00:128b::2e03","TCP","86","51538  >  443 [ACK] Seq=4037 Ack=72707 Win=128192 Len=0 TSval=2728007789 TSecr=3590200952"
"104","1.102794","2600:8805:3803:6100:357c:4644:40b6:e846","2600:1408:ec00:128b::2e03","TCP","86","[TCP Window Update] 51538  >  443 [ACK] Seq=4037 Ack=72707 Win=131072 Len=0 TSval=2728007789 TSecr=3590200952"
"105","1.103472","2600:1408:ec00:128b::2e03","2600:8805:3803:6100:357c:4644:40b6:e846","TLSv1.3","1514","Application Data, Application Data"
"106","1.103531","2600:8805:3803:6100:357c:4644:40b6:e846","2600:1408:ec00:128b::2e03","TCP","86","51538  >  443 [ACK] Seq=4037 Ack=74135 Win=180992 Len=0 TSval=2728007791 TSecr=3590200953"
"107","1.104046","2600:1408:ec00:128b::2e03","2600:8805:3803:6100:357c:4644:40b6:e846","TCP","1514","443  >  51538 [PSH, ACK] Seq=74135 Ack=4037 Win=64128 Len=1428 TSval=3590200953 TSecr=2728007775 [TCP segment of a reassembled PDU]"
"108","1.104354","2600:8805:3803:6100:357c:4644:40b6:e846","2600:1408:ec00:128b::2e03","TCP","86","51538  >  443 [ACK] Seq=4037 Ack=75563 Win=182464 Len=0 TSval=2728007791 TSecr=3590200953"
"109","1.104446","2600:1408:ec00:128b::2e03","2600:8805:3803:6100:357c:4644:40b6:e846","TCP","1514","443  >  51538 [ACK] Seq=75563 Ack=4037 Win=64128 Len=1428 TSval=3590200954 TSecr=2728007775 [TCP segment of a reassembled PDU]"
"110","1.104742","2600:1408:ec00:128b::2e03","2600:8805:3803:6100:357c:4644:40b6:e846","TCP","1514","443  >  51538 [PSH, ACK] Seq=76991 Ack=4037 Win=64128 Len=1428 TSval=3590200954 TSecr=2728007775 [TCP segment of a reassembled PDU]"
"111","1.104796","2600:8805:3803:6100:357c:4644:40b6:e846","2600:1408:ec00:128b::2e03","TCP","86","51538  >  443 [ACK] Seq=4037 Ack=78419 Win=180992 Len=0 TSval=2728007792 TSecr=3590200954"
"112","1.105470","2600:1408:ec00:128b::2e03","2600:8805:3803:6100:357c:4644:40b6:e846","TCP","1514","443  >  51538 [ACK] Seq=78419 Ack=4037 Win=64128 Len=1428 TSval=3590200955 TSecr=2728007775 [TCP segment of a reassembled PDU]"
"113","1.105585","2600:8805:3803:6100:357c:4644:40b6:e846","2600:1408:ec00:128b::2e03","TCP","86","51538  >  443 [ACK] Seq=4037 Ack=79847 Win=182464 Len=0 TSval=2728007792 TSecr=3590200955"
"114","1.106048","2600:1408:ec00:128b::2e03","2600:8805:3803:6100:357c:4644:40b6:e846","TCP","1514","443  >  51538 [PSH, ACK] Seq=79847 Ack=4037 Win=64128 Len=1428 TSval=3590200955 TSecr=2728007775 [TCP segment of a reassembled PDU]"
"115","1.106350","2600:1408:ec00:128b::2e03","2600:8805:3803:6100:357c:4644:40b6:e846","TCP","1514","443  >  51538 [ACK] Seq=81275 Ack=4037 Win=64128 Len=1428 TSval=3590200956 TSecr=2728007775 [TCP segment of a reassembled PDU]"
"116","1.106352","2600:8805:3803:6100:357c:4644:40b6:e846","2600:1408:ec00:128b::2e03","TCP","86","51538  >  443 [ACK] Seq=4037 Ack=81275 Win=182464 Len=0 TSval=2728007793 TSecr=3590200955"
"117","1.107431","2600:1408:ec00:128b::2e03","2600:8805:3803:6100:357c:4644:40b6:e846","TCP","1514","443  >  51538 [PSH, ACK] Seq=82703 Ack=4037 Win=64128 Len=1428 TSval=3590200956 TSecr=2728007775 [TCP segment of a reassembled PDU]"
"118","1.107483","2600:8805:3803:6100:357c:4644:40b6:e846","2600:1408:ec00:128b::2e03","TCP","86","51538  >  443 [ACK] Seq=4037 Ack=84131 Win=180992 Len=0 TSval=2728007795 TSecr=3590200956"
"119","1.108112","2600:1408:ec00:128b::2e03","2600:8805:3803:6100:357c:4644:40b6:e846","TLSv1.3","1514","Application Data"
"120","1.108113","2600:1408:ec00:128b::2e03","2600:8805:3803:6100:357c:4644:40b6:e846","TCP","1514","443  >  51538 [PSH, ACK] Seq=85559 Ack=4037 Win=64128 Len=1428 TSval=3590200957 TSecr=2728007779 [TCP segment of a reassembled PDU]"
"121","1.108163","2600:8805:3803:6100:357c:4644:40b6:e846","2600:1408:ec00:128b::2e03","TCP","86","51538  >  443 [ACK] Seq=4037 Ack=86987 Win=179584 Len=0 TSval=2728007795 TSecr=3590200957"
"122","1.108237","2600:8805:3803:6100:357c:4644:40b6:e846","2600:1408:ec00:128b::2e03","TCP","86","[TCP Window Update] 51538  >  443 [ACK] Seq=4037 Ack=86987 Win=182464 Len=0 TSval=2728007795 TSecr=3590200957"
"123","1.108358","2600:1408:ec00:128b::2e03","2600:8805:3803:6100:357c:4644:40b6:e846","TCP","1514","443  >  51538 [ACK] Seq=86987 Ack=4037 Win=64128 Len=1428 TSval=3590200958 TSecr=2728007779 [TCP segment of a reassembled PDU]"
"124","1.108664","2600:1408:ec00:128b::2e03","2600:8805:3803:6100:357c:4644:40b6:e846","TCP","1514","443  >  51538 [PSH, ACK] Seq=88415 Ack=4037 Win=64128 Len=1428 TSval=3590200958 TSecr=2728007779 [TCP segment of a reassembled PDU]"
"125","1.108699","2600:8805:3803:6100:357c:4644:40b6:e846","2600:1408:ec00:128b::2e03","TCP","86","51538  >  443 [ACK] Seq=4037 Ack=89843 Win=180992 Len=0 TSval=2728007796 TSecr=3590200958"
"126","1.109429","2600:1408:ec00:128b::2e03","2600:8805:3803:6100:357c:4644:40b6:e846","TCP","1514","443  >  51538 [ACK] Seq=89843 Ack=4037 Win=64128 Len=1428 TSval=3590200959 TSecr=2728007782 [TCP segment of a reassembled PDU]"
"127","1.109697","2600:1408:ec00:128b::2e03","2600:8805:3803:6100:357c:4644:40b6:e846","TCP","1514","443  >  51538 [PSH, ACK] Seq=91271 Ack=4037 Win=64128 Len=1428 TSval=3590200959 TSecr=2728007782 [TCP segment of a reassembled PDU]"
"128","1.109746","2600:8805:3803:6100:357c:4644:40b6:e846","2600:1408:ec00:128b::2e03","TCP","86","51538  >  443 [ACK] Seq=4037 Ack=92699 Win=179584 Len=0 TSval=2728007797 TSecr=3590200959"
"129","1.110547","2600:1408:ec00:128b::2e03","2600:8805:3803:6100:357c:4644:40b6:e846","TCP","1514","443  >  51538 [ACK] Seq=92699 Ack=4037 Win=64128 Len=1428 TSval=3590200959 TSecr=2728007782 [TCP segment of a reassembled PDU]"
"130","1.110952","2600:1408:ec00:128b::2e03","2600:8805:3803:6100:357c:4644:40b6:e846","TCP","1514","443  >  51538 [PSH, ACK] Seq=94127 Ack=4037 Win=64128 Len=1428 TSval=3590200959 TSecr=2728007782 [TCP segment of a reassembled PDU]"
"131","1.111001","2600:8805:3803:6100:357c:4644:40b6:e846","2600:1408:ec00:128b::2e03","TCP","86","51538  >  443 [ACK] Seq=4037 Ack=95555 Win=176768 Len=0 TSval=2728007798 TSecr=3590200959"
"132","1.111404","2600:1408:ec00:128b::2e03","2600:8805:3803:6100:357c:4644:40b6:e846","TCP","1514","443  >  51538 [ACK] Seq=95555 Ack=4037 Win=64128 Len=1428 TSval=3590200960 TSecr=2728007782 [TCP segment of a reassembled PDU]"
"133","1.111405","2600:1408:ec00:128b::2e03","2600:8805:3803:6100:357c:4644:40b6:e846","TCP","1514","443  >  51538 [PSH, ACK] Seq=96983 Ack=4037 Win=64128 Len=1428 TSval=3590200960 TSecr=2728007782 [TCP segment of a reassembled PDU]"
"134","1.111444","2600:8805:3803:6100:357c:4644:40b6:e846","2600:1408:ec00:128b::2e03","TCP","86","51538  >  443 [ACK] Seq=4037 Ack=98411 Win=173888 Len=0 TSval=2728007798 TSecr=3590200960"
"135","1.112113","2600:1408:ec00:128b::2e03","2600:8805:3803:6100:357c:4644:40b6:e846","TCP","1514","443  >  51538 [ACK] Seq=98411 Ack=4037 Win=64128 Len=1428 TSval=3590200961 TSecr=2728007782 [TCP segment of a reassembled PDU]"
"136","1.112298","2600:1408:ec00:128b::2e03","2600:8805:3803:6100:357c:4644:40b6:e846","TLSv1.3","1514","Application Data, Application Data"
"137","1.112338","2600:8805:3803:6100:357c:4644:40b6:e846","2600:1408:ec00:128b::2e03","TCP","86","51538  >  443 [ACK] Seq=4037 Ack=101267 Win=171008 Len=0 TSval=2728007799 TSecr=3590200961"
"138","1.112706","2600:1408:ec00:128b::2e03","2600:8805:3803:6100:357c:4644:40b6:e846","TCP","1514","443  >  51538 [ACK] Seq=101267 Ack=4037 Win=64128 Len=1428 TSval=3590200962 TSecr=2728007782 [TCP segment of a reassembled PDU]"
"139","1.113420","2600:1408:ec00:128b::2e03","2600:8805:3803:6100:357c:4644:40b6:e846","TCP","1514","443  >  51538 [PSH, ACK] Seq=102695 Ack=4037 Win=64128 Len=1428 TSval=3590200962 TSecr=2728007782 [TCP segment of a reassembled PDU]"
"140","1.113452","2600:8805:3803:6100:357c:4644:40b6:e846","2600:1408:ec00:128b::2e03","TCP","86","51538  >  443 [ACK] Seq=4037 Ack=102695 Win=182464 Len=0 TSval=2728007801 TSecr=3590200962"
"141","1.113641","2600:8805:3803:6100:357c:4644:40b6:e846","2600:1408:ec00:128b::2e03","TCP","86","51538  >  443 [ACK] Seq=4037 Ack=104123 Win=182464 Len=0 TSval=2728007801 TSecr=3590200962"
"142","1.113871","2600:1408:ec00:128b::2e03","2600:8805:3803:6100:357c:4644:40b6:e846","TCP","1514","443  >  51538 [ACK] Seq=104123 Ack=4037 Win=64128 Len=1428 TSval=3590200963 TSecr=2728007782 [TCP segment of a reassembled PDU]"
"143","1.113872","2600:1408:ec00:128b::2e03","2600:8805:3803:6100:357c:4644:40b6:e846","TCP","1514","443  >  51538 [PSH, ACK] Seq=105551 Ack=4037 Win=64128 Len=1428 TSval=3590200963 TSecr=2728007782 [TCP segment of a reassembled PDU]"
"144","1.113912","2600:8805:3803:6100:357c:4644:40b6:e846","2600:1408:ec00:128b::2e03","TCP","86","51538  >  443 [ACK] Seq=4037 Ack=106979 Win=179584 Len=0 TSval=2728007801 TSecr=3590200963"
"145","1.114971","2600:8805:3803:6100:357c:4644:40b6:e846","2600:1408:ec00:128b::2e03","TCP","86","[TCP Window Update] 51538  >  443 [ACK] Seq=4037 Ack=106979 Win=182464 Len=0 TSval=2728007802 TSecr=3590200963"
"146","1.116721","2600:1408:ec00:128b::2e03","2600:8805:3803:6100:357c:4644:40b6:e846","TCP","1514","443  >  51538 [ACK] Seq=106979 Ack=4037 Win=64128 Len=1428 TSval=3590200966 TSecr=2728007786 [TCP segment of a reassembled PDU]"
"147","1.117106","2600:1408:ec00:128b::2e03","2600:8805:3803:6100:357c:4644:40b6:e846","TCP","1514","443  >  51538 [PSH, ACK] Seq=108407 Ack=4037 Win=64128 Len=1428 TSval=3590200966 TSecr=2728007786 [TCP segment of a reassembled PDU]"
"148","1.117148","2600:8805:3803:6100:357c:4644:40b6:e846","2600:1408:ec00:128b::2e03","TCP","86","51538  >  443 [ACK] Seq=4037 Ack=109835 Win=179584 Len=0 TSval=2728007804 TSecr=3590200966"
"149","1.117497","2600:1408:ec00:128b::2e03","2600:8805:3803:6100:357c:4644:40b6:e846","TCP","1514","443  >  51538 [ACK] Seq=109835 Ack=4037 Win=64128 Len=1428 TSval=3590200966 TSecr=2728007786 [TCP segment of a reassembled PDU]"
"150","1.117498","2600:1408:ec00:128b::2e03","2600:8805:3803:6100:357c:4644:40b6:e846","TCP","1514","443  >  51538 [PSH, ACK] Seq=111263 Ack=4037 Win=64128 Len=1428 TSval=3590200966 TSecr=2728007786 [TCP segment of a reassembled PDU]"
"151","1.117534","2600:8805:3803:6100:357c:4644:40b6:e846","2600:1408:ec00:128b::2e03","TCP","86","51538  >  443 [ACK] Seq=4037 Ack=112691 Win=176768 Len=0 TSval=2728007804 TSecr=3590200966"
"152","1.117843","2600:1408:ec00:128b::2e03","2600:8805:3803:6100:357c:4644:40b6:e846","TCP","1514","443  >  51538 [ACK] Seq=112691 Ack=4037 Win=64128 Len=1428 TSval=3590200967 TSecr=2728007786 [TCP segment of a reassembled PDU]"
"153","1.118147","2600:1408:ec00:128b::2e03","2600:8805:3803:6100:357c:4644:40b6:e846","TCP","1514","443  >  51538 [PSH, ACK] Seq=114119 Ack=4037 Win=64128 Len=1428 TSval=3590200967 TSecr=2728007786 [TCP segment of a reassembled PDU]"
"154","1.118177","2600:8805:3803:6100:357c:4644:40b6:e846","2600:1408:ec00:128b::2e03","TCP","86","51538  >  443 [ACK] Seq=4037 Ack=115547 Win=173888 Len=0 TSval=2728007805 TSecr=3590200967"
"155","1.118915","2600:1408:ec00:128b::2e03","2600:8805:3803:6100:357c:4644:40b6:e846","TCP","1514","443  >  51538 [ACK] Seq=115547 Ack=4037 Win=64128 Len=1428 TSval=3590200968 TSecr=2728007786 [TCP segment of a reassembled PDU]"
"156","1.119516","2600:1408:ec00:128b::2e03","2600:8805:3803:6100:357c:4644:40b6:e846","TLSv1.3","1514","Application Data, Application Data"
"157","1.119557","2600:8805:3803:6100:357c:4644:40b6:e846","2600:1408:ec00:128b::2e03","TCP","86","51538  >  443 [ACK] Seq=4037 Ack=118403 Win=171008 Len=0 TSval=2728007806 TSecr=3590200968"
"158","1.122780","2600:1408:ec00:128b::2e03","2600:8805:3803:6100:357c:4644:40b6:e846","TCP","1514","443  >  51538 [ACK] Seq=118403 Ack=4037 Win=64128 Len=1428 TSval=3590200972 TSecr=2728007789 [TCP segment of a reassembled PDU]"
"159","1.123185","2600:1408:ec00:128b::2e03","2600:8805:3803:6100:357c:4644:40b6:e846","TCP","1514","443  >  51538 [PSH, ACK] Seq=119831 Ack=4037 Win=64128 Len=1428 TSval=3590200972 TSecr=2728007789 [TCP segment of a reassembled PDU]"
"160","1.123247","2600:8805:3803:6100:357c:4644:40b6:e846","2600:1408:ec00:128b::2e03","TCP","86","51538  >  443 [ACK] Seq=4037 Ack=119831 Win=182464 Len=0 TSval=2728007810 TSecr=3590200972"
"161","1.123505","2600:8805:3803:6100:357c:4644:40b6:e846","2600:1408:ec00:128b::2e03","TCP","86","51538  >  443 [ACK] Seq=4037 Ack=121259 Win=182464 Len=0 TSval=2728007810 TSecr=3590200972"
"162","1.124702","2600:1408:ec00:128b::2e03","2600:8805:3803:6100:357c:4644:40b6:e846","TCP","1514","443  >  51538 [ACK] Seq=121259 Ack=4037 Win=64128 Len=1428 TSval=3590200972 TSecr=2728007789 [TCP segment of a reassembled PDU]"
"163","1.124703","2600:1408:ec00:128b::2e03","2600:8805:3803:6100:357c:4644:40b6:e846","TCP","1514","443  >  51538 [PSH, ACK] Seq=122687 Ack=4037 Win=64128 Len=1428 TSval=3590200972 TSecr=2728007789 [TCP segment of a reassembled PDU]"
"164","1.124755","2600:8805:3803:6100:357c:4644:40b6:e846","2600:1408:ec00:128b::2e03","TCP","86","51538  >  443 [ACK] Seq=4037 Ack=124115 Win=179584 Len=0 TSval=2728007812 TSecr=3590200972"
"165","1.125689","2600:1408:ec00:128b::2e03","2600:8805:3803:6100:357c:4644:40b6:e846","TCP","1514","443  >  51538 [ACK] Seq=124115 Ack=4037 Win=64128 Len=1428 TSval=3590200973 TSecr=2728007792 [TCP segment of a reassembled PDU]"
"166","1.125690","2600:1408:ec00:128b::2e03","2600:8805:3803:6100:357c:4644:40b6:e846","TCP","1514","443  >  51538 [PSH, ACK] Seq=125543 Ack=4037 Win=64128 Len=1428 TSval=3590200973 TSecr=2728007792 [TCP segment of a reassembled PDU]"
"167","1.125690","2600:1408:ec00:128b::2e03","2600:8805:3803:6100:357c:4644:40b6:e846","TCP","1514","443  >  51538 [ACK] Seq=126971 Ack=4037 Win=64128 Len=1428 TSval=3590200973 TSecr=2728007792 [TCP segment of a reassembled PDU]"
"168","1.125691","2600:1408:ec00:128b::2e03","2600:8805:3803:6100:357c:4644:40b6:e846","TCP","1514","443  >  51538 [ACK] Seq=128399 Ack=4037 Win=64128 Len=1428 TSval=3590200973 TSecr=2728007792 [TCP segment of a reassembled PDU]"
"169","1.125691","2600:1408:ec00:128b::2e03","2600:8805:3803:6100:357c:4644:40b6:e846","TCP","1514","443  >  51538 [ACK] Seq=129827 Ack=4037 Win=64128 Len=1428 TSval=3590200973 TSecr=2728007792 [TCP segment of a reassembled PDU]"
"170","1.125692","2600:1408:ec00:128b::2e03","2600:8805:3803:6100:357c:4644:40b6:e846","TCP","1514","443  >  51538 [PSH, ACK] Seq=131255 Ack=4037 Win=64128 Len=1428 TSval=3590200973 TSecr=2728007792 [TCP segment of a reassembled PDU]"
"171","1.125749","2600:8805:3803:6100:357c:4644:40b6:e846","2600:1408:ec00:128b::2e03","TCP","86","51538  >  443 [ACK] Seq=4037 Ack=132683 Win=171008 Len=0 TSval=2728007812 TSecr=3590200973"
"172","1.128941","2600:1408:ec00:128b::2e03","2600:8805:3803:6100:357c:4644:40b6:e846","TLSv1.3","1514","Application Data, Application Data"
"173","1.128942","2600:1408:ec00:128b::2e03","2600:8805:3803:6100:357c:4644:40b6:e846","TCP","1514","443  >  51538 [ACK] Seq=134111 Ack=4037 Win=64128 Len=1428 TSval=3590200974 TSecr=2728007792 [TCP segment of a reassembled PDU]"
"174","1.128943","2600:1408:ec00:128b::2e03","2600:8805:3803:6100:357c:4644:40b6:e846","TCP","1514","443  >  51538 [ACK] Seq=135539 Ack=4037 Win=64128 Len=1428 TSval=3590200974 TSecr=2728007792 [TCP segment of a reassembled PDU]"
"175","1.128943","2600:1408:ec00:128b::2e03","2600:8805:3803:6100:357c:4644:40b6:e846","TCP","1514","443  >  51538 [PSH, ACK] Seq=136967 Ack=4037 Win=64128 Len=1428 TSval=3590200974 TSecr=2728007792 [TCP segment of a reassembled PDU]"
"176","1.128944","2600:1408:ec00:128b::2e03","2600:8805:3803:6100:357c:4644:40b6:e846","TCP","1514","443  >  51538 [ACK] Seq=138395 Ack=4037 Win=64128 Len=1428 TSval=3590200975 TSecr=2728007792 [TCP segment of a reassembled PDU]"
"177","1.128944","2600:1408:ec00:128b::2e03","2600:8805:3803:6100:357c:4644:40b6:e846","TCP","1514","443  >  51538 [ACK] Seq=139823 Ack=4037 Win=64128 Len=1428 TSval=3590200975 TSecr=2728007792 [TCP segment of a reassembled PDU]"
"178","1.128945","2600:1408:ec00:128b::2e03","2600:8805:3803:6100:357c:4644:40b6:e846","TCP","1514","443  >  51538 [ACK] Seq=141251 Ack=4037 Win=64128 Len=1428 TSval=3590200975 TSecr=2728007792 [TCP segment of a reassembled PDU]"
"179","1.128946","2600:1408:ec00:128b::2e03","2600:8805:3803:6100:357c:4644:40b6:e846","TCP","1269","443  >  51538 [PSH, ACK] Seq=142679 Ack=4037 Win=64128 Len=1183 TSval=3590200975 TSecr=2728007792 [TCP segment of a reassembled PDU]"
"180","1.129026","2600:8805:3803:6100:357c:4644:40b6:e846","2600:1408:ec00:128b::2e03","TCP","86","51538  >  443 [ACK] Seq=4037 Ack=143862 Win=159872 Len=0 TSval=2728007816 TSecr=3590200975"
"181","1.129281","2600:8805:3803:6100:357c:4644:40b6:e846","2600:1408:ec00:128b::2e03","TCP","86","[TCP Window Update] 51538  >  443 [ACK] Seq=4037 Ack=143862 Win=182464 Len=0 TSval=2728007816 TSecr=3590200975"
"182","1.129358","2600:1408:ec00:128b::2e03","2600:8805:3803:6100:357c:4644:40b6:e846","TCP","1514","443  >  51538 [ACK] Seq=143862 Ack=4037 Win=64128 Len=1428 TSval=3590200978 TSecr=2728007798 [TCP segment of a reassembled PDU]"
"183","1.129359","2600:1408:ec00:128b::2e03","2600:8805:3803:6100:357c:4644:40b6:e846","TCP","1514","443  >  51538 [ACK] Seq=145290 Ack=4037 Win=64128 Len=1428 TSval=3590200978 TSecr=2728007798 [TCP segment of a reassembled PDU]"
"184","1.129360","2600:1408:ec00:128b::2e03","2600:8805:3803:6100:357c:4644:40b6:e846","TCP","1514","443  >  51538 [ACK] Seq=146718 Ack=4037 Win=64128 Len=1428 TSval=3590200978 TSecr=2728007798 [TCP segment of a reassembled PDU]"
"185","1.129714","2600:1408:ec00:128b::2e03","2600:8805:3803:6100:357c:4644:40b6:e846","TCP","1514","443  >  51538 [PSH, ACK] Seq=148146 Ack=4037 Win=64128 Len=1428 TSval=3590200978 TSecr=2728007798 [TCP segment of a reassembled PDU]"
"186","1.129715","2600:1408:ec00:128b::2e03","2600:8805:3803:6100:357c:4644:40b6:e846","TLSv1.3","1514","Application Data, Application Data"
"187","1.129715","2600:1408:ec00:128b::2e03","2600:8805:3803:6100:357c:4644:40b6:e846","TCP","1514","443  >  51538 [ACK] Seq=151002 Ack=4037 Win=64128 Len=1428 TSval=3590200978 TSecr=2728007798 [TCP segment of a reassembled PDU]"
"188","1.129716","2600:1408:ec00:128b::2e03","2600:8805:3803:6100:357c:4644:40b6:e846","TCP","1514","443  >  51538 [ACK] Seq=152430 Ack=4037 Win=64128 Len=1428 TSval=3590200978 TSecr=2728007798 [TCP segment of a reassembled PDU]"
"189","1.129790","2600:8805:3803:6100:357c:4644:40b6:e846","2600:1408:ec00:128b::2e03","TCP","86","51538  >  443 [ACK] Seq=4037 Ack=148146 Win=178176 Len=0 TSval=2728007816 TSecr=3590200978"
"190","1.129813","2600:8805:3803:6100:357c:4644:40b6:e846","2600:1408:ec00:128b::2e03","TCP","86","51538  >  443 [ACK] Seq=4037 Ack=153858 Win=172480 Len=0 TSval=2728007816 TSecr=3590200978"
"191","1.130073","2600:1408:ec00:128b::2e03","2600:8805:3803:6100:357c:4644:40b6:e846","TCP","1514","443  >  51538 [PSH, ACK] Seq=153858 Ack=4037 Win=64128 Len=1428 TSval=3590200978 TSecr=2728007798 [TCP segment of a reassembled PDU]"
"192","1.130625","2600:8805:3803:6100:357c:4644:40b6:e846","2600:1408:ec00:128b::2e03","TCP","86","51538  >  443 [ACK] Seq=4037 Ack=155286 Win=182464 Len=0 TSval=2728007817 TSecr=3590200978"
"193","1.131764","2600:1408:ec00:128b::2e03","2600:8805:3803:6100:357c:4644:40b6:e846","TCP","1514","443  >  51538 [ACK] Seq=155286 Ack=4037 Win=64128 Len=1428 TSval=3590200979 TSecr=2728007798 [TCP segment of a reassembled PDU]"
