"No.","Time","Source","Destination","Protocol","Length","Info"
"1","0.000000","2600:8805:3803:6100:c100:e220:6ae:755","2600:1408:ec00:1286::2e03","TLSv1.2","884","Application Data"
"2","0.000131","2600:8805:3803:6100:c100:e220:6ae:755","2600:1408:ec00:1286::2e03","TLSv1.2","125","Application Data"
"3","0.018700","2600:1408:ec00:1286::2e03","2600:8805:3803:6100:c100:e220:6ae:755","TCP","86","443  >  55088 [ACK] Seq=1 Ack=799 Win=3810 Len=0 TSval=63882466 TSecr=2278703695"
"4","0.019027","2600:1408:ec00:1286::2e03","2600:8805:3803:6100:c100:e220:6ae:755","TCP","86","443  >  55088 [ACK] Seq=1 Ack=838 Win=3810 Len=0 TSval=63882466 TSecr=2278703695"
"5","0.019028","2600:1408:ec00:1286::2e03","2600:8805:3803:6100:c100:e220:6ae:755","TLSv1.2","125","Application Data"
"6","0.019099","2600:8805:3803:6100:c100:e220:6ae:755","2600:1408:ec00:1286::2e03","TCP","86","55088  >  443 [ACK] Seq=838 Ack=40 Win=16148 Len=0 TSval=2278703714 TSecr=63882466"
"7","0.041035","2600:1408:ec00:1286::2e03","2600:8805:3803:6100:c100:e220:6ae:755","TLSv1.2","1328","Application Data"
"8","0.041192","2600:8805:3803:6100:c100:e220:6ae:755","2600:1408:ec00:1286::2e03","TCP","86","55088  >  443 [ACK] Seq=838 Ack=1282 Win=16130 Len=0 TSval=2278703737 TSecr=63882488"
"9","0.041775","2600:1408:ec00:1286::2e03","2600:8805:3803:6100:c100:e220:6ae:755","TCP","1514","443  >  55088 [ACK] Seq=1282 Ack=838 Win=3810 Len=1428 TSval=63882488 TSecr=2278703714 [TCP segment of a reassembled PDU]"
"10","0.041777","2600:1408:ec00:1286::2e03","2600:8805:3803:6100:c100:e220:6ae:755","TCP","1514","443  >  55088 [ACK] Seq=2710 Ack=838 Win=3810 Len=1428 TSval=63882488 TSecr=2278703714 [TCP segment of a reassembled PDU]"
"11","0.041778","2600:1408:ec00:1286::2e03","2600:8805:3803:6100:c100:e220:6ae:755","TCP","1514","443  >  55088 [ACK] Seq=4138 Ack=838 Win=3810 Len=1428 TSval=63882488 TSecr=2278703714 [TCP segment of a reassembled PDU]"
"12","0.041778","2600:1408:ec00:1286::2e03","2600:8805:3803:6100:c100:e220:6ae:755","TCP","1514","443  >  55088 [ACK] Seq=5566 Ack=838 Win=3810 Len=1428 TSval=63882488 TSecr=2278703714 [TCP segment of a reassembled PDU]"
"13","0.041779","2600:1408:ec00:1286::2e03","2600:8805:3803:6100:c100:e220:6ae:755","TCP","1514","443  >  55088 [ACK] Seq=6994 Ack=838 Win=3810 Len=1428 TSval=63882488 TSecr=2278703714 [TCP segment of a reassembled PDU]"
"14","0.041784","2600:1408:ec00:1286::2e03","2600:8805:3803:6100:c100:e220:6ae:755","TCP","1514","443  >  55088 [ACK] Seq=8422 Ack=838 Win=3810 Len=1428 TSval=63882488 TSecr=2278703714 [TCP segment of a reassembled PDU]"
"15","0.041785","2600:1408:ec00:1286::2e03","2600:8805:3803:6100:c100:e220:6ae:755","TCP","1514","443  >  55088 [ACK] Seq=9850 Ack=838 Win=3810 Len=1428 TSval=63882488 TSecr=2278703714 [TCP segment of a reassembled PDU]"
"16","0.041786","2600:1408:ec00:1286::2e03","2600:8805:3803:6100:c100:e220:6ae:755","TCP","1514","443  >  55088 [ACK] Seq=11278 Ack=838 Win=3810 Len=1428 TSval=63882488 TSecr=2278703714 [TCP segment of a reassembled PDU]"
"17","0.041786","2600:1408:ec00:1286::2e03","2600:8805:3803:6100:c100:e220:6ae:755","TCP","1514","443  >  55088 [ACK] Seq=12706 Ack=838 Win=3810 Len=1428 TSval=63882488 TSecr=2278703714 [TCP segment of a reassembled PDU]"
"18","0.041787","2600:1408:ec00:1286::2e03","2600:8805:3803:6100:c100:e220:6ae:755","TCP","1514","443  >  55088 [ACK] Seq=14134 Ack=838 Win=3810 Len=1428 TSval=63882488 TSecr=2278703714 [TCP segment of a reassembled PDU]"
"19","0.041788","2600:1408:ec00:1286::2e03","2600:8805:3803:6100:c100:e220:6ae:755","TCP","1514","443  >  55088 [ACK] Seq=15562 Ack=838 Win=3810 Len=1428 TSval=63882488 TSecr=2278703714 [TCP segment of a reassembled PDU]"
"20","0.041789","2600:1408:ec00:1286::2e03","2600:8805:3803:6100:c100:e220:6ae:755","TLSv1.2","784","Application Data"
"21","0.041789","2600:1408:ec00:1286::2e03","2600:8805:3803:6100:c100:e220:6ae:755","TLSv1.2","117","Application Data"
"22","0.041790","2600:1408:ec00:1286::2e03","2600:8805:3803:6100:c100:e220:6ae:755","TCP","1514","443  >  55088 [ACK] Seq=17719 Ack=838 Win=3810 Len=1428 TSval=63882489 TSecr=2278703714 [TCP segment of a reassembled PDU]"
"23","0.041791","2600:1408:ec00:1286::2e03","2600:8805:3803:6100:c100:e220:6ae:755","TCP","1514","443  >  55088 [ACK] Seq=19147 Ack=838 Win=3810 Len=1428 TSval=63882489 TSecr=2278703714 [TCP segment of a reassembled PDU]"
"24","0.041791","2600:1408:ec00:1286::2e03","2600:8805:3803:6100:c100:e220:6ae:755","TCP","1514","443  >  55088 [ACK] Seq=20575 Ack=838 Win=3810 Len=1428 TSval=63882489 TSecr=2278703714 [TCP segment of a reassembled PDU]"
"25","0.041876","2600:8805:3803:6100:c100:e220:6ae:755","2600:1408:ec00:1286::2e03","TCP","86","55088  >  443 [ACK] Seq=838 Ack=16990 Win=15904 Len=0 TSval=2278703737 TSecr=63882488"
"26","0.041925","2600:8805:3803:6100:c100:e220:6ae:755","2600:1408:ec00:1286::2e03","TCP","86","55088  >  443 [ACK] Seq=838 Ack=22003 Win=15825 Len=0 TSval=2278703737 TSecr=63882489"
"27","0.042914","2600:1408:ec00:1286::2e03","2600:8805:3803:6100:c100:e220:6ae:755","TCP","1514","443  >  55088 [ACK] Seq=22003 Ack=838 Win=3810 Len=1428 TSval=63882489 TSecr=2278703714 [TCP segment of a reassembled PDU]"
"28","0.042916","2600:1408:ec00:1286::2e03","2600:8805:3803:6100:c100:e220:6ae:755","TCP","1514","443  >  55088 [ACK] Seq=23431 Ack=838 Win=3810 Len=1428 TSval=63882489 TSecr=2278703714 [TCP segment of a reassembled PDU]"
"29","0.042917","2600:1408:ec00:1286::2e03","2600:8805:3803:6100:c100:e220:6ae:755","TCP","1514","443  >  55088 [ACK] Seq=24859 Ack=838 Win=3810 Len=1428 TSval=63882489 TSecr=2278703714 [TCP segment of a reassembled PDU]"
"30","0.042921","2600:1408:ec00:1286::2e03","2600:8805:3803:6100:c100:e220:6ae:755","TCP","1514","443  >  55088 [ACK] Seq=26287 Ack=838 Win=3810 Len=1428 TSval=63882489 TSecr=2278703714 [TCP segment of a reassembled PDU]"
"31","0.042924","2600:1408:ec00:1286::2e03","2600:8805:3803:6100:c100:e220:6ae:755","TCP","1514","443  >  55088 [ACK] Seq=27715 Ack=838 Win=3810 Len=1428 TSval=63882489 TSecr=2278703714 [TCP segment of a reassembled PDU]"
"32","0.042929","2600:1408:ec00:1286::2e03","2600:8805:3803:6100:c100:e220:6ae:755","TCP","1514","443  >  55088 [ACK] Seq=29143 Ack=838 Win=3810 Len=1428 TSval=63882489 TSecr=2278703714 [TCP segment of a reassembled PDU]"
"33","0.042931","2600:1408:ec00:1286::2e03","2600:8805:3803:6100:c100:e220:6ae:755","TCP","1514","443  >  55088 [ACK] Seq=30571 Ack=838 Win=3810 Len=1428 TSval=63882489 TSecr=2278703714 [TCP segment of a reassembled PDU]"
"34","0.042934","2600:1408:ec00:1286::2e03","2600:8805:3803:6100:c100:e220:6ae:755","TCP","1514","443  >  55088 [ACK] Seq=31999 Ack=838 Win=3810 Len=1428 TSval=63882489 TSecr=2278703714 [TCP segment of a reassembled PDU]"
"35","0.042942","2600:1408:ec00:1286::2e03","2600:8805:3803:6100:c100:e220:6ae:755","TLSv1.2","784","Application Data"
"36","0.042943","2600:1408:ec00:1286::2e03","2600:8805:3803:6100:c100:e220:6ae:755","TLSv1.2","1514","Application Data"
"37","0.042945","2600:1408:ec00:1286::2e03","2600:8805:3803:6100:c100:e220:6ae:755","TCP","1514","443  >  55088 [ACK] Seq=35553 Ack=838 Win=3810 Len=1428 TSval=63882489 TSecr=2278703714 [TCP segment of a reassembled PDU]"
"38","0.042949","2600:1408:ec00:1286::2e03","2600:8805:3803:6100:c100:e220:6ae:755","TCP","1514","443  >  55088 [ACK] Seq=36981 Ack=838 Win=3810 Len=1428 TSval=63882489 TSecr=2278703714 [TCP segment of a reassembled PDU]"
"39","0.042952","2600:1408:ec00:1286::2e03","2600:8805:3803:6100:c100:e220:6ae:755","TCP","1514","443  >  55088 [ACK] Seq=38409 Ack=838 Win=3810 Len=1428 TSval=63882489 TSecr=2278703714 [TCP segment of a reassembled PDU]"
"40","0.042953","2600:1408:ec00:1286::2e03","2600:8805:3803:6100:c100:e220:6ae:755","TCP","1514","443  >  55088 [ACK] Seq=39837 Ack=838 Win=3810 Len=1428 TSval=63882489 TSecr=2278703714 [TCP segment of a reassembled PDU]"
"41","0.042956","2600:1408:ec00:1286::2e03","2600:8805:3803:6100:c100:e220:6ae:755","TCP","1514","443  >  55088 [ACK] Seq=41265 Ack=838 Win=3810 Len=1428 TSval=63882489 TSecr=2278703714 [TCP segment of a reassembled PDU]"
"42","0.042957","2600:1408:ec00:1286::2e03","2600:8805:3803:6100:c100:e220:6ae:755","TCP","1514","443  >  55088 [ACK] Seq=42693 Ack=838 Win=3810 Len=1428 TSval=63882489 TSecr=2278703714 [TCP segment of a reassembled PDU]"
"43","0.042960","2600:1408:ec00:1286::2e03","2600:8805:3803:6100:c100:e220:6ae:755","TCP","1514","443  >  55088 [ACK] Seq=44121 Ack=838 Win=3810 Len=1428 TSval=63882489 TSecr=2278703714 [TCP segment of a reassembled PDU]"
"44","0.042963","2600:1408:ec00:1286::2e03","2600:8805:3803:6100:c100:e220:6ae:755","TLSv1.2","556","Application Data"
"45","0.042963","2600:1408:ec00:1286::2e03","2600:8805:3803:6100:c100:e220:6ae:755","TCP","1514","443  >  55088 [ACK] Seq=46019 Ack=838 Win=3810 Len=1428 TSval=63882489 TSecr=2278703714 [TCP segment of a reassembled PDU]"
"46","0.042964","2600:1408:ec00:1286::2e03","2600:8805:3803:6100:c100:e220:6ae:755","TCP","1514","443  >  55088 [ACK] Seq=47447 Ack=838 Win=3810 Len=1428 TSval=63882489 TSecr=2278703714 [TCP segment of a reassembled PDU]"
"47","0.042965","2600:1408:ec00:1286::2e03","2600:8805:3803:6100:c100:e220:6ae:755","TCP","1514","443  >  55088 [ACK] Seq=48875 Ack=838 Win=3810 Len=1428 TSval=63882489 TSecr=2278703714 [TCP segment of a reassembled PDU]"
"48","0.043055","2600:8805:3803:6100:c100:e220:6ae:755","2600:1408:ec00:1286::2e03","TCP","86","55088  >  443 [ACK] Seq=838 Ack=36981 Win=15591 Len=0 TSval=2278703739 TSecr=63882489"
"49","0.043097","2600:8805:3803:6100:c100:e220:6ae:755","2600:1408:ec00:1286::2e03","TCP","86","55088  >  443 [ACK] Seq=838 Ack=50303 Win=15383 Len=0 TSval=2278703739 TSecr=63882489"
"50","0.043475","2600:8805:3803:6100:c100:e220:6ae:755","2600:1408:ec00:1286::2e03","TCP","86","[TCP Window Update] 55088  >  443 [ACK] Seq=838 Ack=50303 Win=16149 Len=0 TSval=2278703739 TSecr=63882489"
"51","0.043593","2600:1408:ec00:1286::2e03","2600:8805:3803:6100:c100:e220:6ae:755","TCP","1514","443  >  55088 [ACK] Seq=50303 Ack=838 Win=3810 Len=1428 TSval=63882489 TSecr=2278703714 [TCP segment of a reassembled PDU]"
"52","0.043595","2600:1408:ec00:1286::2e03","2600:8805:3803:6100:c100:e220:6ae:755","TCP","1514","443  >  55088 [ACK] Seq=51731 Ack=838 Win=3810 Len=1428 TSval=63882489 TSecr=2278703714 [TCP segment of a reassembled PDU]"
"53","0.043596","2600:1408:ec00:1286::2e03","2600:8805:3803:6100:c100:e220:6ae:755","TCP","1514","443  >  55088 [ACK] Seq=53159 Ack=838 Win=3810 Len=1428 TSval=63882489 TSecr=2278703714 [TCP segment of a reassembled PDU]"
"54","0.043596","2600:1408:ec00:1286::2e03","2600:8805:3803:6100:c100:e220:6ae:755","TCP","1514","443  >  55088 [ACK] Seq=54587 Ack=838 Win=3810 Len=1428 TSval=63882489 TSecr=2278703714 [TCP segment of a reassembled PDU]"
"55","0.043597","2600:1408:ec00:1286::2e03","2600:8805:3803:6100:c100:e220:6ae:755","TCP","1514","443  >  55088 [ACK] Seq=56015 Ack=838 Win=3810 Len=1428 TSval=63882489 TSecr=2278703714 [TCP segment of a reassembled PDU]"
"56","0.043598","2600:1408:ec00:1286::2e03","2600:8805:3803:6100:c100:e220:6ae:755","TCP","1514","443  >  55088 [ACK] Seq=57443 Ack=838 Win=3810 Len=1428 TSval=63882489 TSecr=2278703714 [TCP segment of a reassembled PDU]"
"57","0.043599","2600:1408:ec00:1286::2e03","2600:8805:3803:6100:c100:e220:6ae:755","TCP","1514","443  >  55088 [ACK] Seq=58871 Ack=838 Win=3810 Len=1428 TSval=63882489 TSecr=2278703714 [TCP segment of a reassembled PDU]"
"58","0.043600","2600:1408:ec00:1286::2e03","2600:8805:3803:6100:c100:e220:6ae:755","TCP","1514","443  >  55088 [ACK] Seq=60299 Ack=838 Win=3810 Len=1428 TSval=63882489 TSecr=2278703714 [TCP segment of a reassembled PDU]"
"59","0.043600","2600:1408:ec00:1286::2e03","2600:8805:3803:6100:c100:e220:6ae:755","TLSv1.2","784","Application Data"
"60","0.043601","2600:1408:ec00:1286::2e03","2600:8805:3803:6100:c100:e220:6ae:755","TLSv1.2","1514","Application Data"
"61","0.043602","2600:1408:ec00:1286::2e03","2600:8805:3803:6100:c100:e220:6ae:755","TCP","1514","443  >  55088 [ACK] Seq=63853 Ack=838 Win=3810 Len=1428 TSval=63882489 TSecr=2278703714 [TCP segment of a reassembled PDU]"
"62","0.043603","2600:1408:ec00:1286::2e03","2600:8805:3803:6100:c100:e220:6ae:755","TCP","1514","443  >  55088 [ACK] Seq=65281 Ack=838 Win=3810 Len=1428 TSval=63882489 TSecr=2278703714 [TCP segment of a reassembled PDU]"
"63","0.043604","2600:1408:ec00:1286::2e03","2600:8805:3803:6100:c100:e220:6ae:755","TCP","1514","443  >  55088 [ACK] Seq=66709 Ack=838 Win=3810 Len=1428 TSval=63882489 TSecr=2278703714 [TCP segment of a reassembled PDU]"
"64","0.043604","2600:1408:ec00:1286::2e03","2600:8805:3803:6100:c100:e220:6ae:755","TCP","1514","443  >  55088 [ACK] Seq=68137 Ack=838 Win=3810 Len=1428 TSval=63882489 TSecr=2278703714 [TCP segment of a reassembled PDU]"
"65","0.043605","2600:1408:ec00:1286::2e03","2600:8805:3803:6100:c100:e220:6ae:755","TCP","1514","443  >  55088 [ACK] Seq=69565 Ack=838 Win=3810 Len=1428 TSval=63882489 TSecr=2278703714 [TCP segment of a reassembled PDU]"
"66","0.043606","2600:1408:ec00:1286::2e03","2600:8805:3803:6100:c100:e220:6ae:755","TCP","1514","443  >  55088 [ACK] Seq=70993 Ack=838 Win=3810 Len=1428 TSval=63882489 TSecr=2278703714 [TCP segment of a reassembled PDU]"
"67","0.043607","2600:1408:ec00:1286::2e03","2600:8805:3803:6100:c100:e220:6ae:755","TCP","1514","443  >  55088 [ACK] Seq=72421 Ack=838 Win=3810 Len=1428 TSval=63882489 TSecr=2278703714 [TCP segment of a reassembled PDU]"
"68","0.043607","2600:1408:ec00:1286::2e03","2600:8805:3803:6100:c100:e220:6ae:755","TCP","1514","443  >  55088 [ACK] Seq=73849 Ack=838 Win=3810 Len=1428 TSval=63882489 TSecr=2278703714 [TCP segment of a reassembled PDU]"
"69","0.043608","2600:1408:ec00:1286::2e03","2600:8805:3803:6100:c100:e220:6ae:755","TCP","1514","443  >  55088 [ACK] Seq=75277 Ack=838 Win=3810 Len=1428 TSval=63882489 TSecr=2278703714 [TCP segment of a reassembled PDU]"
"70","0.043609","2600:1408:ec00:1286::2e03","2600:8805:3803:6100:c100:e220:6ae:755","TCP","1514","443  >  55088 [ACK] Seq=76705 Ack=838 Win=3810 Len=1428 TSval=63882489 TSecr=2278703714 [TCP segment of a reassembled PDU]"
"71","0.043610","2600:1408:ec00:1286::2e03","2600:8805:3803:6100:c100:e220:6ae:755","TLSv1.2","1514","Application Data, Application Data"
"72","0.043611","2600:1408:ec00:1286::2e03","2600:8805:3803:6100:c100:e220:6ae:755","TCP","1514","443  >  55088 [ACK] Seq=79561 Ack=838 Win=3810 Len=1428 TSval=63882489 TSecr=2278703714 [TCP segment of a reassembled PDU]"
"73","0.043612","2600:1408:ec00:1286::2e03","2600:8805:3803:6100:c100:e220:6ae:755","TCP","1514","443  >  55088 [ACK] Seq=80989 Ack=838 Win=3810 Len=1428 TSval=63882489 TSecr=2278703714 [TCP segment of a reassembled PDU]"
"74","0.043613","2600:1408:ec00:1286::2e03","2600:8805:3803:6100:c100:e220:6ae:755","TLSv1.2","966","Application Data"
"75","0.043686","2600:8805:3803:6100:c100:e220:6ae:755","2600:1408:ec00:1286::2e03","TCP","86","55088  >  443 [ACK] Seq=838 Ack=65281 Win=15915 Len=0 TSval=2278703739 TSecr=63882489"
"76","0.043724","2600:8805:3803:6100:c100:e220:6ae:755","2600:1408:ec00:1286::2e03","TCP","86","55088  >  443 [ACK] Seq=838 Ack=80989 Win=15670 Len=0 TSval=2278703739 TSecr=63882489"
"77","0.043743","2600:8805:3803:6100:c100:e220:6ae:755","2600:1408:ec00:1286::2e03","TCP","86","55088  >  443 [ACK] Seq=838 Ack=83297 Win=15633 Len=0 TSval=2278703739 TSecr=63882489"
"78","0.045383","2600:8805:3803:6100:c100:e220:6ae:755","2600:1408:ec00:1286::2e03","TCP","86","[TCP Window Update] 55088  >  443 [ACK] Seq=838 Ack=83297 Win=16149 Len=0 TSval=2278703741 TSecr=63882489"
"79","0.046803","2600:8805:3803:6100:c100:e220:6ae:755","2600:1408:ec00:1286::2e03","TLSv1.2","121","Application Data"
"80","0.047338","2600:1408:ec00:1286::2e03","2600:8805:3803:6100:c100:e220:6ae:755","TCP","1514","443  >  55088 [ACK] Seq=83297 Ack=838 Win=3810 Len=1428 TSval=63882495 TSecr=2278703714 [TCP segment of a reassembled PDU]"
"81","0.047395","2600:8805:3803:6100:c100:e220:6ae:755","2600:1408:ec00:1286::2e03","TCP","86","55088  >  443 [ACK] Seq=873 Ack=84725 Win=16127 Len=0 TSval=2278703742 TSecr=63882495"
"82","0.048673","2600:1408:ec00:1286::2e03","2600:8805:3803:6100:c100:e220:6ae:755","TCP","1514","443  >  55088 [ACK] Seq=84725 Ack=838 Win=3810 Len=1428 TSval=63882495 TSecr=2278703714 [TCP segment of a reassembled PDU]"
"83","0.048675","2600:1408:ec00:1286::2e03","2600:8805:3803:6100:c100:e220:6ae:755","TCP","1514","443  >  55088 [ACK] Seq=86153 Ack=838 Win=3810 Len=1428 TSval=63882495 TSecr=2278703714 [TCP segment of a reassembled PDU]"
"84","0.048675","2600:1408:ec00:1286::2e03","2600:8805:3803:6100:c100:e220:6ae:755","TCP","1514","443  >  55088 [ACK] Seq=87581 Ack=838 Win=3810 Len=1428 TSval=63882495 TSecr=2278703714 [TCP segment of a reassembled PDU]"
"85","0.048676","2600:1408:ec00:1286::2e03","2600:8805:3803:6100:c100:e220:6ae:755","TCP","1514","443  >  55088 [ACK] Seq=89009 Ack=838 Win=3810 Len=1428 TSval=63882495 TSecr=2278703714 [TCP segment of a reassembled PDU]"
"86","0.048677","2600:1408:ec00:1286::2e03","2600:8805:3803:6100:c100:e220:6ae:755","TCP","1514","443  >  55088 [ACK] Seq=90437 Ack=838 Win=3810 Len=1428 TSval=63882495 TSecr=2278703714 [TCP segment of a reassembled PDU]"
"87","0.048677","2600:1408:ec00:1286::2e03","2600:8805:3803:6100:c100:e220:6ae:755","TCP","1514","443  >  55088 [ACK] Seq=91865 Ack=838 Win=3810 Len=1428 TSval=63882495 TSecr=2278703714 [TCP segment of a reassembled PDU]"
"88","0.048678","2600:1408:ec00:1286::2e03","2600:8805:3803:6100:c100:e220:6ae:755","TCP","1514","443  >  55088 [ACK] Seq=93293 Ack=838 Win=3810 Len=1428 TSval=63882495 TSecr=2278703714 [TCP segment of a reassembled PDU]"
"89","0.048678","2600:1408:ec00:1286::2e03","2600:8805:3803:6100:c100:e220:6ae:755","TCP","1514","443  >  55088 [ACK] Seq=94721 Ack=838 Win=3810 Len=1428 TSval=63882495 TSecr=2278703714 [TCP segment of a reassembled PDU]"
"90","0.048679","2600:1408:ec00:1286::2e03","2600:8805:3803:6100:c100:e220:6ae:755","TCP","1514","443  >  55088 [ACK] Seq=96149 Ack=838 Win=3810 Len=1428 TSval=63882495 TSecr=2278703714 [TCP segment of a reassembled PDU]"
"91","0.048680","2600:1408:ec00:1286::2e03","2600:8805:3803:6100:c100:e220:6ae:755","TCP","1514","443  >  55088 [ACK] Seq=97577 Ack=838 Win=3810 Len=1428 TSval=63882495 TSecr=2278703714 [TCP segment of a reassembled PDU]"
"92","0.048680","2600:1408:ec00:1286::2e03","2600:8805:3803:6100:c100:e220:6ae:755","TLSv1.2","784","Application Data"
"93","0.048681","2600:1408:ec00:1286::2e03","2600:8805:3803:6100:c100:e220:6ae:755","TLSv1.2","117","Application Data"
"94","0.048681","2600:1408:ec00:1286::2e03","2600:8805:3803:6100:c100:e220:6ae:755","TCP","1514","443  >  55088 [ACK] Seq=99734 Ack=838 Win=3810 Len=1428 TSval=63882496 TSecr=2278703714 [TCP segment of a reassembled PDU]"
"95","0.048747","2600:8805:3803:6100:c100:e220:6ae:755","2600:1408:ec00:1286::2e03","TCP","86","55088  >  443 [ACK] Seq=873 Ack=99734 Win=15914 Len=0 TSval=2278703744 TSecr=63882495"
"96","0.048791","2600:8805:3803:6100:c100:e220:6ae:755","2600:1408:ec00:1286::2e03","TCP","86","55088  >  443 [ACK] Seq=873 Ack=101162 Win=15892 Len=0 TSval=2278703744 TSecr=63882496"
"97","0.048849","2600:8805:3803:6100:c100:e220:6ae:755","2600:1408:ec00:1286::2e03","TCP","86","[TCP Window Update] 55088  >  443 [ACK] Seq=873 Ack=101162 Win=16149 Len=0 TSval=2278703744 TSecr=63882496"
"98","0.049581","2600:1408:ec00:1286::2e03","2600:8805:3803:6100:c100:e220:6ae:755","TCP","1514","443  >  55088 [ACK] Seq=101162 Ack=838 Win=3810 Len=1428 TSval=63882496 TSecr=2278703714 [TCP segment of a reassembled PDU]"
"99","0.049581","2600:1408:ec00:1286::2e03","2600:8805:3803:6100:c100:e220:6ae:755","TCP","1514","443  >  55088 [ACK] Seq=102590 Ack=838 Win=3810 Len=1428 TSval=63882496 TSecr=2278703714 [TCP segment of a reassembled PDU]"
"100","0.049582","2600:1408:ec00:1286::2e03","2600:8805:3803:6100:c100:e220:6ae:755","TCP","1514","443  >  55088 [ACK] Seq=104018 Ack=838 Win=3810 Len=1428 TSval=63882496 TSecr=2278703714 [TCP segment of a reassembled PDU]"
"101","0.049583","2600:1408:ec00:1286::2e03","2600:8805:3803:6100:c100:e220:6ae:755","TCP","1514","443  >  55088 [ACK] Seq=105446 Ack=838 Win=3810 Len=1428 TSval=63882496 TSecr=2278703714 [TCP segment of a reassembled PDU]"
"102","0.049583","2600:1408:ec00:1286::2e03","2600:8805:3803:6100:c100:e220:6ae:755","TCP","1514","443  >  55088 [ACK] Seq=106874 Ack=838 Win=3810 Len=1428 TSval=63882496 TSecr=2278703714 [TCP segment of a reassembled PDU]"
"103","0.049584","2600:1408:ec00:1286::2e03","2600:8805:3803:6100:c100:e220:6ae:755","TLSv1.2","1243","Application Data"
"104","0.049629","2600:8805:3803:6100:c100:e220:6ae:755","2600:1408:ec00:1286::2e03","TCP","86","55088  >  443 [ACK] Seq=873 Ack=109459 Win=16019 Len=0 TSval=2278703744 TSecr=63882496"
"105","0.049711","2600:8805:3803:6100:c100:e220:6ae:755","2600:1408:ec00:1286::2e03","TCP","86","[TCP Window Update] 55088  >  443 [ACK] Seq=873 Ack=109459 Win=16149 Len=0 TSval=2278703744 TSecr=63882496"
"106","0.051881","2600:1408:ec00:1286::2e03","2600:8805:3803:6100:c100:e220:6ae:755","TCP","1514","443  >  55088 [ACK] Seq=109459 Ack=838 Win=3810 Len=1428 TSval=63882499 TSecr=2278703714 [TCP segment of a reassembled PDU]"
"107","0.051944","2600:8805:3803:6100:c100:e220:6ae:755","2600:1408:ec00:1286::2e03","TCP","86","55088  >  443 [ACK] Seq=873 Ack=110887 Win=16127 Len=0 TSval=2278703747 TSecr=63882499"
"108","0.054465","2600:1408:ec00:1286::2e03","2600:8805:3803:6100:c100:e220:6ae:755","TCP","1514","443  >  55088 [ACK] Seq=110887 Ack=838 Win=3810 Len=1428 TSval=63882499 TSecr=2278703714 [TCP segment of a reassembled PDU]"
"109","0.054466","2600:1408:ec00:1286::2e03","2600:8805:3803:6100:c100:e220:6ae:755","TCP","1514","443  >  55088 [ACK] Seq=112315 Ack=838 Win=3810 Len=1428 TSval=63882499 TSecr=2278703714 [TCP segment of a reassembled PDU]"
"110","0.054466","2600:1408:ec00:1286::2e03","2600:8805:3803:6100:c100:e220:6ae:755","TCP","1514","443  >  55088 [ACK] Seq=113743 Ack=838 Win=3810 Len=1428 TSval=63882499 TSecr=2278703714 [TCP segment of a reassembled PDU]"
"111","0.054467","2600:1408:ec00:1286::2e03","2600:8805:3803:6100:c100:e220:6ae:755","TCP","1514","443  >  55088 [ACK] Seq=115171 Ack=838 Win=3810 Len=1428 TSval=63882499 TSecr=2278703714 [TCP segment of a reassembled PDU]"
"112","0.054467","2600:1408:ec00:1286::2e03","2600:8805:3803:6100:c100:e220:6ae:755","TCP","1514","443  >  55088 [ACK] Seq=116599 Ack=838 Win=3810 Len=1428 TSval=63882499 TSecr=2278703714 [TCP segment of a reassembled PDU]"
"113","0.054468","2600:1408:ec00:1286::2e03","2600:8805:3803:6100:c100:e220:6ae:755","TCP","1514","443  >  55088 [ACK] Seq=118027 Ack=838 Win=3810 Len=1428 TSval=63882499 TSecr=2278703714 [TCP segment of a reassembled PDU]"
"114","0.054469","2600:1408:ec00:1286::2e03","2600:8805:3803:6100:c100:e220:6ae:755","TCP","1514","443  >  55088 [ACK] Seq=119455 Ack=838 Win=3810 Len=1428 TSval=63882499 TSecr=2278703714 [TCP segment of a reassembled PDU]"
"115","0.054469","2600:1408:ec00:1286::2e03","2600:8805:3803:6100:c100:e220:6ae:755","TCP","1514","443  >  55088 [ACK] Seq=120883 Ack=838 Win=3810 Len=1428 TSval=63882499 TSecr=2278703714 [TCP segment of a reassembled PDU]"
"116","0.054470","2600:1408:ec00:1286::2e03","2600:8805:3803:6100:c100:e220:6ae:755","TCP","1514","443  >  55088 [ACK] Seq=122311 Ack=838 Win=3810 Len=1428 TSval=63882499 TSecr=2278703714 [TCP segment of a reassembled PDU]"
"117","0.054471","2600:1408:ec00:1286::2e03","2600:8805:3803:6100:c100:e220:6ae:755","TCP","1514","443  >  55088 [ACK] Seq=123739 Ack=838 Win=3810 Len=1428 TSval=63882499 TSecr=2278703714 [TCP segment of a reassembled PDU]"
"118","0.054471","2600:1408:ec00:1286::2e03","2600:8805:3803:6100:c100:e220:6ae:755","TLSv1.2","784","Application Data"
"119","0.054472","2600:1408:ec00:1286::2e03","2600:8805:3803:6100:c100:e220:6ae:755","TLSv1.2","117","Application Data"
"120","0.054542","2600:8805:3803:6100:c100:e220:6ae:755","2600:1408:ec00:1286::2e03","TCP","86","55088  >  443 [ACK] Seq=873 Ack=125896 Win=15914 Len=0 TSval=2278703750 TSecr=63882499"
"121","0.054641","2600:8805:3803:6100:c100:e220:6ae:755","2600:1408:ec00:1286::2e03","TCP","86","[TCP Window Update] 55088  >  443 [ACK] Seq=873 Ack=125896 Win=16149 Len=0 TSval=2278703750 TSecr=63882499"
"122","0.066171","2600:1408:ec00:1286::2e03","2600:8805:3803:6100:c100:e220:6ae:755","TCP","1514","443  >  55088 [ACK] Seq=125896 Ack=873 Win=3810 Len=1428 TSval=63882514 TSecr=2278703742 [TCP segment of a reassembled PDU]"
"123","0.066244","2600:8805:3803:6100:c100:e220:6ae:755","2600:1408:ec00:1286::2e03","TCP","86","55088  >  443 [ACK] Seq=873 Ack=127324 Win=16127 Len=0 TSval=2278703762 TSecr=63882514"
"124","0.067763","2600:1408:ec00:1286::2e03","2600:8805:3803:6100:c100:e220:6ae:755","TCP","1514","443  >  55088 [PSH, ACK] Seq=127324 Ack=873 Win=3810 Len=1428 TSval=63882514 TSecr=2278703742 [TCP segment of a reassembled PDU]"
"125","0.067763","2600:1408:ec00:1286::2e03","2600:8805:3803:6100:c100:e220:6ae:755","TCP","1514","443  >  55088 [ACK] Seq=128752 Ack=873 Win=3810 Len=1428 TSval=63882514 TSecr=2278703742 [TCP segment of a reassembled PDU]"
"126","0.067764","2600:1408:ec00:1286::2e03","2600:8805:3803:6100:c100:e220:6ae:755","TCP","1514","443  >  55088 [PSH, ACK] Seq=130180 Ack=873 Win=3810 Len=1428 TSval=63882514 TSecr=2278703742 [TCP segment of a reassembled PDU]"
"127","0.067876","2600:8805:3803:6100:c100:e220:6ae:755","2600:1408:ec00:1286::2e03","TCP","86","55088  >  443 [ACK] Seq=873 Ack=131608 Win=16149 Len=0 TSval=2278703763 TSecr=63882514"
"128","0.081985","2600:1408:ec00:1286::2e03","2600:8805:3803:6100:c100:e220:6ae:755","TCP","1514","443  >  55088 [ACK] Seq=131608 Ack=873 Win=3810 Len=1428 TSval=63882529 TSecr=2278703763 [TCP segment of a reassembled PDU]"
"129","0.082441","2600:1408:ec00:1286::2e03","2600:8805:3803:6100:c100:e220:6ae:755","TLSv1.2","1514","Application Data"
"130","0.082442","2600:1408:ec00:1286::2e03","2600:8805:3803:6100:c100:e220:6ae:755","TCP","1514","443  >  55088 [ACK] Seq=134464 Ack=873 Win=3810 Len=1428 TSval=63882529 TSecr=2278703763 [TCP segment of a reassembled PDU]"
"131","0.082443","2600:1408:ec00:1286::2e03","2600:8805:3803:6100:c100:e220:6ae:755","TCP","1514","443  >  55088 [PSH, ACK] Seq=135892 Ack=873 Win=3810 Len=1428 TSval=63882529 TSecr=2278703763 [TCP segment of a reassembled PDU]"
"132","0.082567","2600:8805:3803:6100:c100:e220:6ae:755","2600:1408:ec00:1286::2e03","TCP","86","55088  >  443 [ACK] Seq=873 Ack=137320 Win=16149 Len=0 TSval=2278703778 TSecr=63882529"
"133","0.099664","2600:1408:ec00:1286::2e03","2600:8805:3803:6100:c100:e220:6ae:755","TCP","1514","443  >  55088 [ACK] Seq=137320 Ack=873 Win=3810 Len=1428 TSval=63882545 TSecr=2278703778 [TCP segment of a reassembled PDU]"
"134","0.099664","2600:1408:ec00:1286::2e03","2600:8805:3803:6100:c100:e220:6ae:755","TCP","1514","443  >  55088 [PSH, ACK] Seq=138748 Ack=873 Win=3810 Len=1428 TSval=63882545 TSecr=2278703778 [TCP segment of a reassembled PDU]"
"135","0.099665","2600:1408:ec00:1286::2e03","2600:8805:3803:6100:c100:e220:6ae:755","TCP","1514","443  >  55088 [ACK] Seq=140176 Ack=873 Win=3810 Len=1428 TSval=63882545 TSecr=2278703778 [TCP segment of a reassembled PDU]"
"136","0.099666","2600:1408:ec00:1286::2e03","2600:8805:3803:6100:c100:e220:6ae:755","TCP","1514","443  >  55088 [PSH, ACK] Seq=141604 Ack=873 Win=3810 Len=1428 TSval=63882545 TSecr=2278703778 [TCP segment of a reassembled PDU]"
"137","0.101143","2600:8805:3803:6100:c100:e220:6ae:755","2600:1408:ec00:1286::2e03","TCP","86","55088  >  443 [ACK] Seq=873 Ack=143032 Win=16149 Len=0 TSval=2278703797 TSecr=63882545"
"138","0.117065","2600:1408:ec00:1286::2e03","2600:8805:3803:6100:c100:e220:6ae:755","TCP","1514","443  >  55088 [ACK] Seq=143032 Ack=873 Win=3810 Len=1428 TSval=63882563 TSecr=2278703797 [TCP segment of a reassembled PDU]"
"139","0.117391","2600:1408:ec00:1286::2e03","2600:8805:3803:6100:c100:e220:6ae:755","TCP","1514","443  >  55088 [PSH, ACK] Seq=144460 Ack=873 Win=3810 Len=1428 TSval=63882563 TSecr=2278703797 [TCP segment of a reassembled PDU]"
"140","0.117392","2600:1408:ec00:1286::2e03","2600:8805:3803:6100:c100:e220:6ae:755","TCP","1514","443  >  55088 [ACK] Seq=145888 Ack=873 Win=3810 Len=1428 TSval=63882563 TSecr=2278703797 [TCP segment of a reassembled PDU]"
"141","0.117393","2600:1408:ec00:1286::2e03","2600:8805:3803:6100:c100:e220:6ae:755","TCP","1514","443  >  55088 [PSH, ACK] Seq=147316 Ack=873 Win=3810 Len=1428 TSval=63882563 TSecr=2278703797 [TCP segment of a reassembled PDU]"
"142","0.117482","2600:8805:3803:6100:c100:e220:6ae:755","2600:1408:ec00:1286::2e03","TCP","86","55088  >  443 [ACK] Seq=873 Ack=148744 Win=16149 Len=0 TSval=2278703813 TSecr=63882563"
"143","0.131907","2600:1408:ec00:1286::2e03","2600:8805:3803:6100:c100:e220:6ae:755","TCP","1514","443  >  55088 [ACK] Seq=148744 Ack=873 Win=3810 Len=1428 TSval=63882579 TSecr=2278703813 [TCP segment of a reassembled PDU]"
"144","0.132888","2600:1408:ec00:1286::2e03","2600:8805:3803:6100:c100:e220:6ae:755","TLSv1.2","1514","Application Data, Application Data"
"145","0.132889","2600:1408:ec00:1286::2e03","2600:8805:3803:6100:c100:e220:6ae:755","TCP","1514","443  >  55088 [ACK] Seq=151600 Ack=873 Win=3810 Len=1428 TSval=63882579 TSecr=2278703813 [TCP segment of a reassembled PDU]"
"146","0.132890","2600:1408:ec00:1286::2e03","2600:8805:3803:6100:c100:e220:6ae:755","TCP","1514","443  >  55088 [PSH, ACK] Seq=153028 Ack=873 Win=3810 Len=1428 TSval=63882579 TSecr=2278703813 [TCP segment of a reassembled PDU]"
"147","0.133719","2600:8805:3803:6100:c100:e220:6ae:755","2600:1408:ec00:1286::2e03","TCP","86","55088  >  443 [ACK] Seq=873 Ack=154456 Win=16149 Len=0 TSval=2278703829 TSecr=63882579"
"148","0.150541","2600:1408:ec00:1286::2e03","2600:8805:3803:6100:c100:e220:6ae:755","TCP","1514","443  >  55088 [ACK] Seq=154456 Ack=873 Win=3810 Len=1428 TSval=63882596 TSecr=2278703829 [TCP segment of a reassembled PDU]"
"149","0.150542","2600:1408:ec00:1286::2e03","2600:8805:3803:6100:c100:e220:6ae:755","TCP","1514","443  >  55088 [PSH, ACK] Seq=155884 Ack=873 Win=3810 Len=1428 TSval=63882596 TSecr=2278703829 [TCP segment of a reassembled PDU]"
"150","0.150542","2600:1408:ec00:1286::2e03","2600:8805:3803:6100:c100:e220:6ae:755","TCP","1514","443  >  55088 [ACK] Seq=157312 Ack=873 Win=3810 Len=1428 TSval=63882596 TSecr=2278703829 [TCP segment of a reassembled PDU]"
"151","0.150543","2600:1408:ec00:1286::2e03","2600:8805:3803:6100:c100:e220:6ae:755","TLSv1.2","1514","Application Data"
"152","0.151115","2600:8805:3803:6100:c100:e220:6ae:755","2600:1408:ec00:1286::2e03","TCP","86","55088  >  443 [ACK] Seq=873 Ack=160168 Win=16149 Len=0 TSval=2278703846 TSecr=63882596"
"153","0.162379","2600:1408:ec00:1286::2e03","2600:8805:3803:6100:c100:e220:6ae:755","TCP","1514","443  >  55088 [ACK] Seq=160168 Ack=873 Win=3810 Len=1428 TSval=63882610 TSecr=2278703846 [TCP segment of a reassembled PDU]"
"154","0.162831","2600:1408:ec00:1286::2e03","2600:8805:3803:6100:c100:e220:6ae:755","TCP","1514","443  >  55088 [PSH, ACK] Seq=161596 Ack=873 Win=3810 Len=1428 TSval=63882610 TSecr=2278703846 [TCP segment of a reassembled PDU]"
"155","0.162832","2600:1408:ec00:1286::2e03","2600:8805:3803:6100:c100:e220:6ae:755","TCP","1514","443  >  55088 [ACK] Seq=163024 Ack=873 Win=3810 Len=1428 TSval=63882610 TSecr=2278703846 [TCP segment of a reassembled PDU]"
"156","0.162833","2600:1408:ec00:1286::2e03","2600:8805:3803:6100:c100:e220:6ae:755","TCP","1514","443  >  55088 [PSH, ACK] Seq=164452 Ack=873 Win=3810 Len=1428 TSval=63882610 TSecr=2278703846 [TCP segment of a reassembled PDU]"
"157","0.162967","2600:8805:3803:6100:c100:e220:6ae:755","2600:1408:ec00:1286::2e03","TCP","86","55088  >  443 [ACK] Seq=873 Ack=165880 Win=16149 Len=0 TSval=2278703858 TSecr=63882610"
"158","0.182656","2600:1408:ec00:1286::2e03","2600:8805:3803:6100:c100:e220:6ae:755","TCP","1514","443  >  55088 [ACK] Seq=165880 Ack=873 Win=3810 Len=1428 TSval=63882629 TSecr=2278703858 [TCP segment of a reassembled PDU]"
"159","0.182984","2600:1408:ec00:1286::2e03","2600:8805:3803:6100:c100:e220:6ae:755","TCP","1514","443  >  55088 [PSH, ACK] Seq=167308 Ack=873 Win=3810 Len=1428 TSval=63882629 TSecr=2278703858 [TCP segment of a reassembled PDU]"
"160","0.182985","2600:1408:ec00:1286::2e03","2600:8805:3803:6100:c100:e220:6ae:755","TCP","1514","443  >  55088 [ACK] Seq=168736 Ack=873 Win=3810 Len=1428 TSval=63882629 TSecr=2278703858 [TCP segment of a reassembled PDU]"
"161","0.182985","2600:1408:ec00:1286::2e03","2600:8805:3803:6100:c100:e220:6ae:755","TCP","1514","443  >  55088 [PSH, ACK] Seq=170164 Ack=873 Win=3810 Len=1428 TSval=63882629 TSecr=2278703858 [TCP segment of a reassembled PDU]"
"162","0.183080","2600:8805:3803:6100:c100:e220:6ae:755","2600:1408:ec00:1286::2e03","TCP","86","55088  >  443 [ACK] Seq=873 Ack=171592 Win=16149 Len=0 TSval=2278703878 TSecr=63882629"
"163","0.198740","2600:1408:ec00:1286::2e03","2600:8805:3803:6100:c100:e220:6ae:755","TCP","1514","443  >  55088 [ACK] Seq=171592 Ack=873 Win=3810 Len=1428 TSval=63882646 TSecr=2278703878 [TCP segment of a reassembled PDU]"
"164","0.199082","2600:1408:ec00:1286::2e03","2600:8805:3803:6100:c100:e220:6ae:755","TCP","1514","443  >  55088 [PSH, ACK] Seq=173020 Ack=873 Win=3810 Len=1428 TSval=63882646 TSecr=2278703878 [TCP segment of a reassembled PDU]"
"165","0.199083","2600:1408:ec00:1286::2e03","2600:8805:3803:6100:c100:e220:6ae:755","TCP","1514","443  >  55088 [ACK] Seq=174448 Ack=873 Win=3810 Len=1428 TSval=63882646 TSecr=2278703878 [TCP segment of a reassembled PDU]"
"166","0.199083","2600:1408:ec00:1286::2e03","2600:8805:3803:6100:c100:e220:6ae:755","TLSv1.2","1514","Application Data, Application Data"
"167","0.199194","2600:8805:3803:6100:c100:e220:6ae:755","2600:1408:ec00:1286::2e03","TCP","86","55088  >  443 [ACK] Seq=873 Ack=177304 Win=16149 Len=0 TSval=2278703894 TSecr=63882646"
"168","0.214317","2600:1408:ec00:1286::2e03","2600:8805:3803:6100:c100:e220:6ae:755","TCP","1514","443  >  55088 [ACK] Seq=177304 Ack=873 Win=3810 Len=1428 TSval=63882661 TSecr=2278703894 [TCP segment of a reassembled PDU]"
"169","0.214764","2600:1408:ec00:1286::2e03","2600:8805:3803:6100:c100:e220:6ae:755","TCP","1514","443  >  55088 [PSH, ACK] Seq=178732 Ack=873 Win=3810 Len=1428 TSval=63882661 TSecr=2278703894 [TCP segment of a reassembled PDU]"
"170","0.214765","2600:1408:ec00:1286::2e03","2600:8805:3803:6100:c100:e220:6ae:755","TCP","1514","443  >  55088 [ACK] Seq=180160 Ack=873 Win=3810 Len=1428 TSval=63882662 TSecr=2278703894 [TCP segment of a reassembled PDU]"
"171","0.214766","2600:1408:ec00:1286::2e03","2600:8805:3803:6100:c100:e220:6ae:755","TCP","1514","443  >  55088 [PSH, ACK] Seq=181588 Ack=873 Win=3810 Len=1428 TSval=63882662 TSecr=2278703894 [TCP segment of a reassembled PDU]"
"172","0.218305","2600:8805:3803:6100:c100:e220:6ae:755","2600:1408:ec00:1286::2e03","TCP","86","55088  >  443 [ACK] Seq=873 Ack=183016 Win=16149 Len=0 TSval=2278703914 TSecr=63882661"
"173","0.233917","2600:1408:ec00:1286::2e03","2600:8805:3803:6100:c100:e220:6ae:755","TLSv1.2","1514","Application Data"
"174","0.233918","2600:1408:ec00:1286::2e03","2600:8805:3803:6100:c100:e220:6ae:755","TCP","1514","443  >  55088 [PSH, ACK] Seq=184444 Ack=873 Win=3810 Len=1428 TSval=63882680 TSecr=2278703914 [TCP segment of a reassembled PDU]"
"175","0.234037","2600:8805:3803:6100:c100:e220:6ae:755","2600:1408:ec00:1286::2e03","TCP","86","55088  >  443 [ACK] Seq=873 Ack=185872 Win=16149 Len=0 TSval=2278703930 TSecr=63882680"
"176","0.234737","2600:1408:ec00:1286::2e03","2600:8805:3803:6100:c100:e220:6ae:755","TCP","1514","443  >  55088 [ACK] Seq=185872 Ack=873 Win=3810 Len=1428 TSval=63882680 TSecr=2278703914 [TCP segment of a reassembled PDU]"
"177","0.234737","2600:1408:ec00:1286::2e03","2600:8805:3803:6100:c100:e220:6ae:755","TCP","1514","443  >  55088 [PSH, ACK] Seq=187300 Ack=873 Win=3810 Len=1428 TSval=63882680 TSecr=2278703914 [TCP segment of a reassembled PDU]"
"178","0.234886","2600:8805:3803:6100:c100:e220:6ae:755","2600:1408:ec00:1286::2e03","TCP","86","55088  >  443 [ACK] Seq=873 Ack=188728 Win=16149 Len=0 TSval=2278703930 TSecr=63882680"
"179","0.248974","2600:1408:ec00:1286::2e03","2600:8805:3803:6100:c100:e220:6ae:755","TCP","1514","443  >  55088 [ACK] Seq=188728 Ack=873 Win=3810 Len=1428 TSval=63882697 TSecr=2278703930 [TCP segment of a reassembled PDU]"
"180","0.249256","2600:1408:ec00:1286::2e03","2600:8805:3803:6100:c100:e220:6ae:755","TCP","1514","443  >  55088 [PSH, ACK] Seq=190156 Ack=873 Win=3810 Len=1428 TSval=63882697 TSecr=2278703930 [TCP segment of a reassembled PDU]"
"181","0.249523","2600:8805:3803:6100:c100:e220:6ae:755","2600:1408:ec00:1286::2e03","TCP","86","55088  >  443 [ACK] Seq=873 Ack=191584 Win=16149 Len=0 TSval=2278703945 TSecr=63882697"
"182","0.253878","2600:1408:ec00:1286::2e03","2600:8805:3803:6100:c100:e220:6ae:755","TCP","752","443  >  55088 [PSH, ACK] Seq=191584 Ack=873 Win=3810 Len=666 TSval=63882702 TSecr=2278703930 [TCP segment of a reassembled PDU]"
"183","0.253985","2600:8805:3803:6100:c100:e220:6ae:755","2600:1408:ec00:1286::2e03","TCP","86","55088  >  443 [ACK] Seq=873 Ack=192250 Win=16149 Len=0 TSval=2278703949 TSecr=63882702"
"184","0.254215","2600:1408:ec00:1286::2e03","2600:8805:3803:6100:c100:e220:6ae:755","TCP","1514","443  >  55088 [ACK] Seq=192250 Ack=873 Win=3810 Len=1428 TSval=63882702 TSecr=2278703930 [TCP segment of a reassembled PDU]"
"185","0.268382","2600:1408:ec00:1286::2e03","2600:8805:3803:6100:c100:e220:6ae:755","TCP","1514","443  >  55088 [ACK] Seq=193678 Ack=873 Win=3810 Len=1428 TSval=63882716 TSecr=2278703945 [TCP segment of a reassembled PDU]"
"186","0.268597","2600:8805:3803:6100:c100:e220:6ae:755","2600:1408:ec00:1286::2e03","TCP","86","55088  >  443 [ACK] Seq=873 Ack=195106 Win=16149 Len=0 TSval=2278703964 TSecr=63882702"
"187","0.269728","2600:1408:ec00:1286::2e03","2600:8805:3803:6100:c100:e220:6ae:755","TCP","1514","443  >  55088 [ACK] Seq=195106 Ack=873 Win=3810 Len=1428 TSval=63882716 TSecr=2278703945 [TCP segment of a reassembled PDU]"
"188","0.269729","2600:1408:ec00:1286::2e03","2600:8805:3803:6100:c100:e220:6ae:755","TCP","1514","443  >  55088 [ACK] Seq=196534 Ack=873 Win=3810 Len=1428 TSval=63882716 TSecr=2278703945 [TCP segment of a reassembled PDU]"
"189","0.269729","2600:1408:ec00:1286::2e03","2600:8805:3803:6100:c100:e220:6ae:755","TCP","1514","443  >  55088 [ACK] Seq=197962 Ack=873 Win=3810 Len=1428 TSval=63882716 TSecr=2278703945 [TCP segment of a reassembled PDU]"
"190","0.269730","2600:1408:ec00:1286::2e03","2600:8805:3803:6100:c100:e220:6ae:755","TLSv1.2","1514","Application Data, Application Data"
"191","0.269730","2600:1408:ec00:1286::2e03","2600:8805:3803:6100:c100:e220:6ae:755","TCP","1514","443  >  55088 [ACK] Seq=200818 Ack=873 Win=3810 Len=1428 TSval=63882716 TSecr=2278703945 [TCP segment of a reassembled PDU]"
"192","0.269731","2600:1408:ec00:1286::2e03","2600:8805:3803:6100:c100:e220:6ae:755","TCP","1514","443  >  55088 [ACK] Seq=202246 Ack=873 Win=3810 Len=1428 TSval=63882716 TSecr=2278703945 [TCP segment of a reassembled PDU]"
"193","0.269731","2600:1408:ec00:1286::2e03","2600:8805:3803:6100:c100:e220:6ae:755","TCP","1514","443  >  55088 [ACK] Seq=203674 Ack=873 Win=3810 Len=1428 TSval=63882716 TSecr=2278703945 [TCP segment of a reassembled PDU]"
"194","0.269732","2600:1408:ec00:1286::2e03","2600:8805:3803:6100:c100:e220:6ae:755","TCP","1514","443  >  55088 [ACK] Seq=205102 Ack=873 Win=3810 Len=1428 TSval=63882716 TSecr=2278703945 [TCP segment of a reassembled PDU]"
"195","0.269732","2600:1408:ec00:1286::2e03","2600:8805:3803:6100:c100:e220:6ae:755","TLSv1.2","1514","Application Data"
"196","0.269733","2600:1408:ec00:1286::2e03","2600:8805:3803:6100:c100:e220:6ae:755","TCP","1514","443  >  55088 [ACK] Seq=207958 Ack=873 Win=3810 Len=1428 TSval=63882716 TSecr=2278703945 [TCP segment of a reassembled PDU]"
