"No.","Time","Source","Destination","Protocol","Length","Info"
"1","0.000000","2600:8805:3803:6100:357c:4644:40b6:e846","2600:1408:ec00:128b::2e03","TLSv1.2","1303","Application Data"
"2","0.020989","2600:1408:ec00:128b::2e03","2600:8805:3803:6100:357c:4644:40b6:e846","TCP","86","443  >  51538 [ACK] Seq=1 Ack=1218 Win=3192 Len=0 TSval=3590246869 TSecr=2728053688"
"3","0.039566","2600:1408:ec00:128b::2e03","2600:8805:3803:6100:357c:4644:40b6:e846","TLSv1.2","1428","Application Data"
"4","0.039691","2600:8805:3803:6100:357c:4644:40b6:e846","2600:1408:ec00:128b::2e03","TCP","86","51538  >  443 [ACK] Seq=1218 Ack=1343 Win=31367 Len=0 TSval=2728053728 TSecr=3590246889"
"5","0.041013","2600:1408:ec00:128b::2e03","2600:8805:3803:6100:357c:4644:40b6:e846","TCP","1514","443  >  51538 [ACK] Seq=1343 Ack=1218 Win=3192 Len=1428 TSval=3590246889 TSecr=2728053688 [TCP segment of a reassembled PDU]"
"6","0.041016","2600:1408:ec00:128b::2e03","2600:8805:3803:6100:357c:4644:40b6:e846","TCP","1514","443  >  51538 [ACK] Seq=2771 Ack=1218 Win=3192 Len=1428 TSval=3590246889 TSecr=2728053688 [TCP segment of a reassembled PDU]"
"7","0.041017","2600:1408:ec00:128b::2e03","2600:8805:3803:6100:357c:4644:40b6:e846","TCP","1514","443  >  51538 [ACK] Seq=4199 Ack=1218 Win=3192 Len=1428 TSval=3590246889 TSecr=2728053688 [TCP segment of a reassembled PDU]"
"8","0.041019","2600:1408:ec00:128b::2e03","2600:8805:3803:6100:357c:4644:40b6:e846","TCP","1514","443  >  51538 [ACK] Seq=5627 Ack=1218 Win=3192 Len=1428 TSval=3590246889 TSecr=2728053688 [TCP segment of a reassembled PDU]"
"9","0.041020","2600:1408:ec00:128b::2e03","2600:8805:3803:6100:357c:4644:40b6:e846","TCP","1514","443  >  51538 [ACK] Seq=7055 Ack=1218 Win=3192 Len=1428 TSval=3590246889 TSecr=2728053688 [TCP segment of a reassembled PDU]"
"10","0.041022","2600:1408:ec00:128b::2e03","2600:8805:3803:6100:357c:4644:40b6:e846","TCP","1514","443  >  51538 [ACK] Seq=8483 Ack=1218 Win=3192 Len=1428 TSval=3590246889 TSecr=2728053688 [TCP segment of a reassembled PDU]"
"11","0.041023","2600:1408:ec00:128b::2e03","2600:8805:3803:6100:357c:4644:40b6:e846","TCP","1514","443  >  51538 [ACK] Seq=9911 Ack=1218 Win=3192 Len=1428 TSval=3590246889 TSecr=2728053688 [TCP segment of a reassembled PDU]"
"12","0.041025","2600:1408:ec00:128b::2e03","2600:8805:3803:6100:357c:4644:40b6:e846","TCP","1514","443  >  51538 [ACK] Seq=11339 Ack=1218 Win=3192 Len=1428 TSval=3590246889 TSecr=2728053688 [TCP segment of a reassembled PDU]"
"13","0.041026","2600:1408:ec00:128b::2e03","2600:8805:3803:6100:357c:4644:40b6:e846","TCP","1514","443  >  51538 [ACK] Seq=12767 Ack=1218 Win=3192 Len=1428 TSval=3590246889 TSecr=2728053688 [TCP segment of a reassembled PDU]"
"14","0.041028","2600:1408:ec00:128b::2e03","2600:8805:3803:6100:357c:4644:40b6:e846","TCP","1514","443  >  51538 [ACK] Seq=14195 Ack=1218 Win=3192 Len=1428 TSval=3590246889 TSecr=2728053688 [TCP segment of a reassembled PDU]"
"15","0.041029","2600:1408:ec00:128b::2e03","2600:8805:3803:6100:357c:4644:40b6:e846","TCP","1514","443  >  51538 [ACK] Seq=15623 Ack=1218 Win=3192 Len=1428 TSval=3590246889 TSecr=2728053688 [TCP segment of a reassembled PDU]"
"16","0.041030","2600:1408:ec00:128b::2e03","2600:8805:3803:6100:357c:4644:40b6:e846","TLSv1.2","784","Application Data"
"17","0.041032","2600:1408:ec00:128b::2e03","2600:8805:3803:6100:357c:4644:40b6:e846","TLSv1.2","117","Application Data"
"18","0.041032","2600:1408:ec00:128b::2e03","2600:8805:3803:6100:357c:4644:40b6:e846","TCP","1514","443  >  51538 [ACK] Seq=17780 Ack=1218 Win=3192 Len=1428 TSval=3590246889 TSecr=2728053688 [TCP segment of a reassembled PDU]"
"19","0.041033","2600:1408:ec00:128b::2e03","2600:8805:3803:6100:357c:4644:40b6:e846","TCP","1514","443  >  51538 [ACK] Seq=19208 Ack=1218 Win=3192 Len=1428 TSval=3590246889 TSecr=2728053688 [TCP segment of a reassembled PDU]"
"20","0.041034","2600:1408:ec00:128b::2e03","2600:8805:3803:6100:357c:4644:40b6:e846","TCP","1514","443  >  51538 [ACK] Seq=20636 Ack=1218 Win=3192 Len=1428 TSval=3590246889 TSecr=2728053688 [TCP segment of a reassembled PDU]"
"21","0.041036","2600:1408:ec00:128b::2e03","2600:8805:3803:6100:357c:4644:40b6:e846","TCP","1514","443  >  51538 [ACK] Seq=22064 Ack=1218 Win=3192 Len=1428 TSval=3590246889 TSecr=2728053688 [TCP segment of a reassembled PDU]"
"22","0.041037","2600:1408:ec00:128b::2e03","2600:8805:3803:6100:357c:4644:40b6:e846","TCP","1514","443  >  51538 [ACK] Seq=23492 Ack=1218 Win=3192 Len=1428 TSval=3590246889 TSecr=2728053688 [TCP segment of a reassembled PDU]"
"23","0.041038","2600:1408:ec00:128b::2e03","2600:8805:3803:6100:357c:4644:40b6:e846","TCP","1514","443  >  51538 [ACK] Seq=24920 Ack=1218 Win=3192 Len=1428 TSval=3590246889 TSecr=2728053688 [TCP segment of a reassembled PDU]"
"24","0.041039","2600:1408:ec00:128b::2e03","2600:8805:3803:6100:357c:4644:40b6:e846","TCP","1514","443  >  51538 [ACK] Seq=26348 Ack=1218 Win=3192 Len=1428 TSval=3590246889 TSecr=2728053688 [TCP segment of a reassembled PDU]"
"25","0.041040","2600:1408:ec00:128b::2e03","2600:8805:3803:6100:357c:4644:40b6:e846","TCP","1514","443  >  51538 [ACK] Seq=27776 Ack=1218 Win=3192 Len=1428 TSval=3590246889 TSecr=2728053688 [TCP segment of a reassembled PDU]"
"26","0.041042","2600:1408:ec00:128b::2e03","2600:8805:3803:6100:357c:4644:40b6:e846","TCP","1514","443  >  51538 [ACK] Seq=29204 Ack=1218 Win=3192 Len=1428 TSval=3590246889 TSecr=2728053688 [TCP segment of a reassembled PDU]"
"27","0.041043","2600:1408:ec00:128b::2e03","2600:8805:3803:6100:357c:4644:40b6:e846","TCP","1514","443  >  51538 [ACK] Seq=30632 Ack=1218 Win=3192 Len=1428 TSval=3590246889 TSecr=2728053688 [TCP segment of a reassembled PDU]"
"28","0.041044","2600:1408:ec00:128b::2e03","2600:8805:3803:6100:357c:4644:40b6:e846","TCP","1514","443  >  51538 [ACK] Seq=32060 Ack=1218 Win=3192 Len=1428 TSval=3590246889 TSecr=2728053688 [TCP segment of a reassembled PDU]"
"29","0.041045","2600:1408:ec00:128b::2e03","2600:8805:3803:6100:357c:4644:40b6:e846","TLSv1.2","784","Application Data"
"30","0.041046","2600:1408:ec00:128b::2e03","2600:8805:3803:6100:357c:4644:40b6:e846","TLSv1.2","1514","Application Data"
"31","0.041047","2600:1408:ec00:128b::2e03","2600:8805:3803:6100:357c:4644:40b6:e846","TCP","1514","443  >  51538 [ACK] Seq=35614 Ack=1218 Win=3192 Len=1428 TSval=3590246889 TSecr=2728053688 [TCP segment of a reassembled PDU]"
"32","0.041048","2600:1408:ec00:128b::2e03","2600:8805:3803:6100:357c:4644:40b6:e846","TCP","1514","443  >  51538 [ACK] Seq=37042 Ack=1218 Win=3192 Len=1428 TSval=3590246889 TSecr=2728053688 [TCP segment of a reassembled PDU]"
"33","0.041049","2600:1408:ec00:128b::2e03","2600:8805:3803:6100:357c:4644:40b6:e846","TCP","1514","443  >  51538 [ACK] Seq=38470 Ack=1218 Win=3192 Len=1428 TSval=3590246889 TSecr=2728053688 [TCP segment of a reassembled PDU]"
"34","0.041050","2600:1408:ec00:128b::2e03","2600:8805:3803:6100:357c:4644:40b6:e846","TCP","1514","443  >  51538 [ACK] Seq=39898 Ack=1218 Win=3192 Len=1428 TSval=3590246889 TSecr=2728053688 [TCP segment of a reassembled PDU]"
"35","0.041052","2600:1408:ec00:128b::2e03","2600:8805:3803:6100:357c:4644:40b6:e846","TCP","1514","443  >  51538 [ACK] Seq=41326 Ack=1218 Win=3192 Len=1428 TSval=3590246889 TSecr=2728053688 [TCP segment of a reassembled PDU]"
"36","0.041053","2600:1408:ec00:128b::2e03","2600:8805:3803:6100:357c:4644:40b6:e846","TCP","1514","443  >  51538 [ACK] Seq=42754 Ack=1218 Win=3192 Len=1428 TSval=3590246889 TSecr=2728053688 [TCP segment of a reassembled PDU]"
"37","0.041053","2600:1408:ec00:128b::2e03","2600:8805:3803:6100:357c:4644:40b6:e846","TCP","1514","443  >  51538 [ACK] Seq=44182 Ack=1218 Win=3192 Len=1428 TSval=3590246889 TSecr=2728053688 [TCP segment of a reassembled PDU]"
"38","0.041228","2600:8805:3803:6100:357c:4644:40b6:e846","2600:1408:ec00:128b::2e03","TCP","86","51538  >  443 [ACK] Seq=1218 Ack=17051 Win=31143 Len=0 TSval=2728053729 TSecr=3590246889"
"39","0.041302","2600:8805:3803:6100:357c:4644:40b6:e846","2600:1408:ec00:128b::2e03","TCP","86","51538  >  443 [ACK] Seq=1218 Ack=32060 Win=30908 Len=0 TSval=2728053729 TSecr=3590246889"
"40","0.041330","2600:8805:3803:6100:357c:4644:40b6:e846","2600:1408:ec00:128b::2e03","TCP","86","51538  >  443 [ACK] Seq=1218 Ack=44182 Win=30719 Len=0 TSval=2728053729 TSecr=3590246889"
"41","0.041366","2600:8805:3803:6100:357c:4644:40b6:e846","2600:1408:ec00:128b::2e03","TCP","86","51538  >  443 [ACK] Seq=1218 Ack=45610 Win=30697 Len=0 TSval=2728053729 TSecr=3590246889"
"42","0.041823","2600:8805:3803:6100:357c:4644:40b6:e846","2600:1408:ec00:128b::2e03","TCP","86","[TCP Window Update] 51538  >  443 [ACK] Seq=1218 Ack=45610 Win=31388 Len=0 TSval=2728053729 TSecr=3590246889"
"43","0.041978","2600:1408:ec00:128b::2e03","2600:8805:3803:6100:357c:4644:40b6:e846","TLSv1.2","1298","Application Data"
"44","0.041979","2600:1408:ec00:128b::2e03","2600:8805:3803:6100:357c:4644:40b6:e846","TCP","1514","443  >  51538 [ACK] Seq=46822 Ack=1218 Win=3192 Len=1428 TSval=3590246889 TSecr=2728053688 [TCP segment of a reassembled PDU]"
"45","0.041981","2600:1408:ec00:128b::2e03","2600:8805:3803:6100:357c:4644:40b6:e846","TCP","1514","443  >  51538 [ACK] Seq=48250 Ack=1218 Win=3192 Len=1428 TSval=3590246889 TSecr=2728053688 [TCP segment of a reassembled PDU]"
"46","0.041982","2600:1408:ec00:128b::2e03","2600:8805:3803:6100:357c:4644:40b6:e846","TCP","1514","443  >  51538 [ACK] Seq=49678 Ack=1218 Win=3192 Len=1428 TSval=3590246889 TSecr=2728053688 [TCP segment of a reassembled PDU]"
"47","0.041983","2600:1408:ec00:128b::2e03","2600:8805:3803:6100:357c:4644:40b6:e846","TCP","1514","443  >  51538 [ACK] Seq=51106 Ack=1218 Win=3192 Len=1428 TSval=3590246889 TSecr=2728053688 [TCP segment of a reassembled PDU]"
"48","0.041985","2600:1408:ec00:128b::2e03","2600:8805:3803:6100:357c:4644:40b6:e846","TCP","1514","443  >  51538 [ACK] Seq=52534 Ack=1218 Win=3192 Len=1428 TSval=3590246889 TSecr=2728053688 [TCP segment of a reassembled PDU]"
"49","0.041986","2600:1408:ec00:128b::2e03","2600:8805:3803:6100:357c:4644:40b6:e846","TCP","1514","443  >  51538 [ACK] Seq=53962 Ack=1218 Win=3192 Len=1428 TSval=3590246889 TSecr=2728053688 [TCP segment of a reassembled PDU]"
"50","0.041987","2600:1408:ec00:128b::2e03","2600:8805:3803:6100:357c:4644:40b6:e846","TLSv1.2","1026","Application Data"
"51","0.042049","2600:8805:3803:6100:357c:4644:40b6:e846","2600:1408:ec00:128b::2e03","TCP","86","51538  >  443 [ACK] Seq=1218 Ack=56330 Win=31221 Len=0 TSval=2728053729 TSecr=3590246889"
"52","0.043125","2600:8805:3803:6100:357c:4644:40b6:e846","2600:1408:ec00:128b::2e03","TCP","86","[TCP Window Update] 51538  >  443 [ACK] Seq=1218 Ack=56330 Win=31388 Len=0 TSval=2728053731 TSecr=3590246889"
"53","0.043715","2600:8805:3803:6100:357c:4644:40b6:e846","2600:1408:ec00:128b::2e03","TLSv1.2","121","Application Data"
"54","0.044813","2600:1408:ec00:128b::2e03","2600:8805:3803:6100:357c:4644:40b6:e846","TCP","1514","443  >  51538 [ACK] Seq=56330 Ack=1218 Win=3192 Len=1428 TSval=3590246892 TSecr=2728053688 [TCP segment of a reassembled PDU]"
"55","0.044920","2600:8805:3803:6100:357c:4644:40b6:e846","2600:1408:ec00:128b::2e03","TCP","86","51538  >  443 [ACK] Seq=1253 Ack=57758 Win=31366 Len=0 TSval=2728053733 TSecr=3590246892"
"56","0.046120","2600:1408:ec00:128b::2e03","2600:8805:3803:6100:357c:4644:40b6:e846","TCP","1514","443  >  51538 [ACK] Seq=57758 Ack=1218 Win=3192 Len=1428 TSval=3590246892 TSecr=2728053688 [TCP segment of a reassembled PDU]"
"57","0.046122","2600:1408:ec00:128b::2e03","2600:8805:3803:6100:357c:4644:40b6:e846","TCP","1514","443  >  51538 [ACK] Seq=59186 Ack=1218 Win=3192 Len=1428 TSval=3590246892 TSecr=2728053688 [TCP segment of a reassembled PDU]"
"58","0.046123","2600:1408:ec00:128b::2e03","2600:8805:3803:6100:357c:4644:40b6:e846","TCP","1514","443  >  51538 [ACK] Seq=60614 Ack=1218 Win=3192 Len=1428 TSval=3590246892 TSecr=2728053688 [TCP segment of a reassembled PDU]"
"59","0.046124","2600:1408:ec00:128b::2e03","2600:8805:3803:6100:357c:4644:40b6:e846","TCP","1514","443  >  51538 [ACK] Seq=62042 Ack=1218 Win=3192 Len=1428 TSval=3590246892 TSecr=2728053688 [TCP segment of a reassembled PDU]"
"60","0.046126","2600:1408:ec00:128b::2e03","2600:8805:3803:6100:357c:4644:40b6:e846","TCP","1514","443  >  51538 [ACK] Seq=63470 Ack=1218 Win=3192 Len=1428 TSval=3590246892 TSecr=2728053688 [TCP segment of a reassembled PDU]"
"61","0.046127","2600:1408:ec00:128b::2e03","2600:8805:3803:6100:357c:4644:40b6:e846","TCP","1514","443  >  51538 [ACK] Seq=64898 Ack=1218 Win=3192 Len=1428 TSval=3590246892 TSecr=2728053688 [TCP segment of a reassembled PDU]"
"62","0.046129","2600:1408:ec00:128b::2e03","2600:8805:3803:6100:357c:4644:40b6:e846","TCP","1514","443  >  51538 [ACK] Seq=66326 Ack=1218 Win=3192 Len=1428 TSval=3590246892 TSecr=2728053688 [TCP segment of a reassembled PDU]"
"63","0.046130","2600:1408:ec00:128b::2e03","2600:8805:3803:6100:357c:4644:40b6:e846","TCP","1514","443  >  51538 [ACK] Seq=67754 Ack=1218 Win=3192 Len=1428 TSval=3590246892 TSecr=2728053688 [TCP segment of a reassembled PDU]"
"64","0.046130","2600:1408:ec00:128b::2e03","2600:8805:3803:6100:357c:4644:40b6:e846","TCP","1514","443  >  51538 [ACK] Seq=69182 Ack=1218 Win=3192 Len=1428 TSval=3590246892 TSecr=2728053688 [TCP segment of a reassembled PDU]"
"65","0.046132","2600:1408:ec00:128b::2e03","2600:8805:3803:6100:357c:4644:40b6:e846","TCP","1514","443  >  51538 [ACK] Seq=70610 Ack=1218 Win=3192 Len=1428 TSval=3590246892 TSecr=2728053688 [TCP segment of a reassembled PDU]"
"66","0.046133","2600:1408:ec00:128b::2e03","2600:8805:3803:6100:357c:4644:40b6:e846","TLSv1.2","784","Application Data"
"67","0.046133","2600:1408:ec00:128b::2e03","2600:8805:3803:6100:357c:4644:40b6:e846","TLSv1.2","117","Application Data"
"68","0.046134","2600:1408:ec00:128b::2e03","2600:8805:3803:6100:357c:4644:40b6:e846","TCP","1514","443  >  51538 [ACK] Seq=72767 Ack=1218 Win=3192 Len=1428 TSval=3590246893 TSecr=2728053688 [TCP segment of a reassembled PDU]"
"69","0.046136","2600:1408:ec00:128b::2e03","2600:8805:3803:6100:357c:4644:40b6:e846","TCP","1514","443  >  51538 [ACK] Seq=74195 Ack=1218 Win=3192 Len=1428 TSval=3590246893 TSecr=2728053688 [TCP segment of a reassembled PDU]"
"70","0.046136","2600:1408:ec00:128b::2e03","2600:8805:3803:6100:357c:4644:40b6:e846","TCP","1514","443  >  51538 [ACK] Seq=75623 Ack=1218 Win=3192 Len=1428 TSval=3590246893 TSecr=2728053688 [TCP segment of a reassembled PDU]"
"71","0.046137","2600:1408:ec00:128b::2e03","2600:8805:3803:6100:357c:4644:40b6:e846","TCP","1514","443  >  51538 [ACK] Seq=77051 Ack=1218 Win=3192 Len=1428 TSval=3590246893 TSecr=2728053688 [TCP segment of a reassembled PDU]"
"72","0.046139","2600:1408:ec00:128b::2e03","2600:8805:3803:6100:357c:4644:40b6:e846","TCP","1514","443  >  51538 [ACK] Seq=78479 Ack=1218 Win=3192 Len=1428 TSval=3590246893 TSecr=2728053688 [TCP segment of a reassembled PDU]"
"73","0.046139","2600:1408:ec00:128b::2e03","2600:8805:3803:6100:357c:4644:40b6:e846","TCP","1514","443  >  51538 [ACK] Seq=79907 Ack=1218 Win=3192 Len=1428 TSval=3590246893 TSecr=2728053688 [TCP segment of a reassembled PDU]"
"74","0.046141","2600:1408:ec00:128b::2e03","2600:8805:3803:6100:357c:4644:40b6:e846","TCP","1514","443  >  51538 [ACK] Seq=81335 Ack=1218 Win=3192 Len=1428 TSval=3590246893 TSecr=2728053688 [TCP segment of a reassembled PDU]"
"75","0.046142","2600:1408:ec00:128b::2e03","2600:8805:3803:6100:357c:4644:40b6:e846","TLSv1.2","931","Application Data"
"76","0.046241","2600:8805:3803:6100:357c:4644:40b6:e846","2600:1408:ec00:128b::2e03","TCP","86","51538  >  443 [ACK] Seq=1253 Ack=72767 Win=31154 Len=0 TSval=2728053734 TSecr=3590246893"
"77","0.046295","2600:8805:3803:6100:357c:4644:40b6:e846","2600:1408:ec00:128b::2e03","TCP","86","51538  >  443 [ACK] Seq=1253 Ack=83608 Win=30985 Len=0 TSval=2728053734 TSecr=3590246893"
"78","0.046535","2600:8805:3803:6100:357c:4644:40b6:e846","2600:1408:ec00:128b::2e03","TCP","86","[TCP Window Update] 51538  >  443 [ACK] Seq=1253 Ack=83608 Win=31388 Len=0 TSval=2728053734 TSecr=3590246893"
"79","0.047322","2600:1408:ec00:128b::2e03","2600:8805:3803:6100:357c:4644:40b6:e846","TCP","1514","443  >  51538 [ACK] Seq=83608 Ack=1218 Win=3192 Len=1428 TSval=3590246897 TSecr=2728053688 [TCP segment of a reassembled PDU]"
"80","0.047377","2600:8805:3803:6100:357c:4644:40b6:e846","2600:1408:ec00:128b::2e03","TCP","86","51538  >  443 [ACK] Seq=1253 Ack=85036 Win=31366 Len=0 TSval=2728053736 TSecr=3590246897"
"81","0.048874","2600:1408:ec00:128b::2e03","2600:8805:3803:6100:357c:4644:40b6:e846","TCP","1514","443  >  51538 [ACK] Seq=85036 Ack=1218 Win=3192 Len=1428 TSval=3590246897 TSecr=2728053688 [TCP segment of a reassembled PDU]"
"82","0.048876","2600:1408:ec00:128b::2e03","2600:8805:3803:6100:357c:4644:40b6:e846","TCP","1514","443  >  51538 [ACK] Seq=86464 Ack=1218 Win=3192 Len=1428 TSval=3590246897 TSecr=2728053688 [TCP segment of a reassembled PDU]"
"83","0.048877","2600:1408:ec00:128b::2e03","2600:8805:3803:6100:357c:4644:40b6:e846","TCP","1514","443  >  51538 [ACK] Seq=87892 Ack=1218 Win=3192 Len=1428 TSval=3590246897 TSecr=2728053688 [TCP segment of a reassembled PDU]"
"84","0.048878","2600:1408:ec00:128b::2e03","2600:8805:3803:6100:357c:4644:40b6:e846","TCP","1514","443  >  51538 [ACK] Seq=89320 Ack=1218 Win=3192 Len=1428 TSval=3590246897 TSecr=2728053688 [TCP segment of a reassembled PDU]"
"85","0.048879","2600:1408:ec00:128b::2e03","2600:8805:3803:6100:357c:4644:40b6:e846","TCP","1514","443  >  51538 [ACK] Seq=90748 Ack=1218 Win=3192 Len=1428 TSval=3590246897 TSecr=2728053688 [TCP segment of a reassembled PDU]"
"86","0.048880","2600:1408:ec00:128b::2e03","2600:8805:3803:6100:357c:4644:40b6:e846","TCP","1514","443  >  51538 [ACK] Seq=92176 Ack=1218 Win=3192 Len=1428 TSval=3590246897 TSecr=2728053688 [TCP segment of a reassembled PDU]"
"87","0.048960","2600:8805:3803:6100:357c:4644:40b6:e846","2600:1408:ec00:128b::2e03","TCP","86","51538  >  443 [ACK] Seq=1253 Ack=93604 Win=31255 Len=0 TSval=2728053737 TSecr=3590246897"
"88","0.049077","2600:8805:3803:6100:357c:4644:40b6:e846","2600:1408:ec00:128b::2e03","TCP","86","[TCP Window Update] 51538  >  443 [ACK] Seq=1253 Ack=93604 Win=31388 Len=0 TSval=2728053737 TSecr=3590246897"
"89","0.049508","2600:1408:ec00:128b::2e03","2600:8805:3803:6100:357c:4644:40b6:e846","TCP","1514","443  >  51538 [ACK] Seq=93604 Ack=1218 Win=3192 Len=1428 TSval=3590246897 TSecr=2728053688 [TCP segment of a reassembled PDU]"
"90","0.049509","2600:1408:ec00:128b::2e03","2600:8805:3803:6100:357c:4644:40b6:e846","TCP","1514","443  >  51538 [ACK] Seq=95032 Ack=1218 Win=3192 Len=1428 TSval=3590246897 TSecr=2728053688 [TCP segment of a reassembled PDU]"
"91","0.049510","2600:1408:ec00:128b::2e03","2600:8805:3803:6100:357c:4644:40b6:e846","TCP","1514","443  >  51538 [ACK] Seq=96460 Ack=1218 Win=3192 Len=1428 TSval=3590246897 TSecr=2728053688 [TCP segment of a reassembled PDU]"
"92","0.049511","2600:1408:ec00:128b::2e03","2600:8805:3803:6100:357c:4644:40b6:e846","TCP","1514","443  >  51538 [ACK] Seq=97888 Ack=1218 Win=3192 Len=1428 TSval=3590246897 TSecr=2728053688 [TCP segment of a reassembled PDU]"
"93","0.049511","2600:1408:ec00:128b::2e03","2600:8805:3803:6100:357c:4644:40b6:e846","TLSv1.2","784","Application Data"
"94","0.049513","2600:1408:ec00:128b::2e03","2600:8805:3803:6100:357c:4644:40b6:e846","TLSv1.2","117","Application Data"
"95","0.049572","2600:8805:3803:6100:357c:4644:40b6:e846","2600:1408:ec00:128b::2e03","TCP","86","51538  >  443 [ACK] Seq=1253 Ack=100045 Win=31288 Len=0 TSval=2728053737 TSecr=3590246897"
"96","0.049666","2600:8805:3803:6100:357c:4644:40b6:e846","2600:1408:ec00:128b::2e03","TCP","86","[TCP Window Update] 51538  >  443 [ACK] Seq=1253 Ack=100045 Win=31388 Len=0 TSval=2728053737 TSecr=3590246897"
"97","0.050742","2600:1408:ec00:128b::2e03","2600:8805:3803:6100:357c:4644:40b6:e846","TCP","1514","443  >  51538 [ACK] Seq=100045 Ack=1218 Win=3192 Len=1428 TSval=3590246898 TSecr=2728053688 [TCP segment of a reassembled PDU]"
"98","0.050744","2600:1408:ec00:128b::2e03","2600:8805:3803:6100:357c:4644:40b6:e846","TCP","1514","443  >  51538 [ACK] Seq=101473 Ack=1218 Win=3192 Len=1428 TSval=3590246898 TSecr=2728053688 [TCP segment of a reassembled PDU]"
"99","0.050744","2600:1408:ec00:128b::2e03","2600:8805:3803:6100:357c:4644:40b6:e846","TCP","1514","443  >  51538 [ACK] Seq=102901 Ack=1218 Win=3192 Len=1428 TSval=3590246898 TSecr=2728053688 [TCP segment of a reassembled PDU]"
"100","0.050746","2600:1408:ec00:128b::2e03","2600:8805:3803:6100:357c:4644:40b6:e846","TCP","1514","443  >  51538 [ACK] Seq=104329 Ack=1218 Win=3192 Len=1428 TSval=3590246898 TSecr=2728053688 [TCP segment of a reassembled PDU]"
"101","0.050747","2600:1408:ec00:128b::2e03","2600:8805:3803:6100:357c:4644:40b6:e846","TCP","1514","443  >  51538 [ACK] Seq=105757 Ack=1218 Win=3192 Len=1428 TSval=3590246898 TSecr=2728053688 [TCP segment of a reassembled PDU]"
"102","0.050748","2600:1408:ec00:128b::2e03","2600:8805:3803:6100:357c:4644:40b6:e846","TLSv1.2","1007","Application Data"
"103","0.050749","2600:1408:ec00:128b::2e03","2600:8805:3803:6100:357c:4644:40b6:e846","TCP","1514","443  >  51538 [ACK] Seq=108106 Ack=1218 Win=3192 Len=1428 TSval=3590246899 TSecr=2728053688 [TCP segment of a reassembled PDU]"
"104","0.050750","2600:1408:ec00:128b::2e03","2600:8805:3803:6100:357c:4644:40b6:e846","TCP","1514","443  >  51538 [ACK] Seq=109534 Ack=1218 Win=3192 Len=1428 TSval=3590246899 TSecr=2728053688 [TCP segment of a reassembled PDU]"
"105","0.050751","2600:1408:ec00:128b::2e03","2600:8805:3803:6100:357c:4644:40b6:e846","TCP","1514","443  >  51538 [ACK] Seq=110962 Ack=1218 Win=3192 Len=1428 TSval=3590246899 TSecr=2728053688 [TCP segment of a reassembled PDU]"
"106","0.050752","2600:1408:ec00:128b::2e03","2600:8805:3803:6100:357c:4644:40b6:e846","TCP","1514","443  >  51538 [ACK] Seq=112390 Ack=1218 Win=3192 Len=1428 TSval=3590246899 TSecr=2728053688 [TCP segment of a reassembled PDU]"
"107","0.050753","2600:1408:ec00:128b::2e03","2600:8805:3803:6100:357c:4644:40b6:e846","TCP","1514","443  >  51538 [ACK] Seq=113818 Ack=1218 Win=3192 Len=1428 TSval=3590246899 TSecr=2728053688 [TCP segment of a reassembled PDU]"
"108","0.050754","2600:1408:ec00:128b::2e03","2600:8805:3803:6100:357c:4644:40b6:e846","TCP","1514","443  >  51538 [ACK] Seq=115246 Ack=1218 Win=3192 Len=1428 TSval=3590246899 TSecr=2728053688 [TCP segment of a reassembled PDU]"
"109","0.050755","2600:1408:ec00:128b::2e03","2600:8805:3803:6100:357c:4644:40b6:e846","TCP","1514","443  >  51538 [ACK] Seq=116674 Ack=1218 Win=3192 Len=1428 TSval=3590246899 TSecr=2728053688 [TCP segment of a reassembled PDU]"
"110","0.050756","2600:1408:ec00:128b::2e03","2600:8805:3803:6100:357c:4644:40b6:e846","TCP","1514","443  >  51538 [ACK] Seq=118102 Ack=1218 Win=3192 Len=1428 TSval=3590246899 TSecr=2728053688 [TCP segment of a reassembled PDU]"
"111","0.050757","2600:1408:ec00:128b::2e03","2600:8805:3803:6100:357c:4644:40b6:e846","TCP","1514","443  >  51538 [ACK] Seq=119530 Ack=1218 Win=3192 Len=1428 TSval=3590246899 TSecr=2728053688 [TCP segment of a reassembled PDU]"
"112","0.050758","2600:1408:ec00:128b::2e03","2600:8805:3803:6100:357c:4644:40b6:e846","TCP","1514","443  >  51538 [ACK] Seq=120958 Ack=1218 Win=3192 Len=1428 TSval=3590246899 TSecr=2728053688 [TCP segment of a reassembled PDU]"
"113","0.050759","2600:1408:ec00:128b::2e03","2600:8805:3803:6100:357c:4644:40b6:e846","TCP","1514","443  >  51538 [ACK] Seq=122386 Ack=1218 Win=3192 Len=1428 TSval=3590246899 TSecr=2728053688 [TCP segment of a reassembled PDU]"
"114","0.050760","2600:1408:ec00:128b::2e03","2600:8805:3803:6100:357c:4644:40b6:e846","TLSv1.2","784","Application Data"
"115","0.050761","2600:1408:ec00:128b::2e03","2600:8805:3803:6100:357c:4644:40b6:e846","TLSv1.2","117","Application Data"
"116","0.050872","2600:8805:3803:6100:357c:4644:40b6:e846","2600:1408:ec00:128b::2e03","TCP","86","51538  >  443 [ACK] Seq=1253 Ack=115246 Win=31151 Len=0 TSval=2728053738 TSecr=3590246899"
"117","0.050930","2600:8805:3803:6100:357c:4644:40b6:e846","2600:1408:ec00:128b::2e03","TCP","86","51538  >  443 [ACK] Seq=1253 Ack=124543 Win=31006 Len=0 TSval=2728053738 TSecr=3590246899"
"118","0.051361","2600:8805:3803:6100:357c:4644:40b6:e846","2600:1408:ec00:128b::2e03","TCP","86","[TCP Window Update] 51538  >  443 [ACK] Seq=1253 Ack=124543 Win=31388 Len=0 TSval=2728053739 TSecr=3590246899"
"119","0.052346","2600:1408:ec00:128b::2e03","2600:8805:3803:6100:357c:4644:40b6:e846","TCP","1514","443  >  51538 [ACK] Seq=124543 Ack=1218 Win=3192 Len=1428 TSval=3590246901 TSecr=2728053688 [TCP segment of a reassembled PDU]"
"120","0.052431","2600:8805:3803:6100:357c:4644:40b6:e846","2600:1408:ec00:128b::2e03","TCP","86","51538  >  443 [ACK] Seq=1253 Ack=125971 Win=31366 Len=0 TSval=2728053741 TSecr=3590246901"
"121","0.053708","2600:1408:ec00:128b::2e03","2600:8805:3803:6100:357c:4644:40b6:e846","TCP","1514","443  >  51538 [ACK] Seq=125971 Ack=1218 Win=3192 Len=1428 TSval=3590246901 TSecr=2728053688 [TCP segment of a reassembled PDU]"
"122","0.053735","2600:1408:ec00:128b::2e03","2600:8805:3803:6100:357c:4644:40b6:e846","TCP","1514","443  >  51538 [ACK] Seq=127399 Ack=1218 Win=3192 Len=1428 TSval=3590246901 TSecr=2728053688 [TCP segment of a reassembled PDU]"
"123","0.053735","2600:1408:ec00:128b::2e03","2600:8805:3803:6100:357c:4644:40b6:e846","TLSv1.2","1055","Application Data"
"124","0.053736","2600:1408:ec00:128b::2e03","2600:8805:3803:6100:357c:4644:40b6:e846","TCP","1514","443  >  51538 [ACK] Seq=129796 Ack=1218 Win=3192 Len=1428 TSval=3590246902 TSecr=2728053688 [TCP segment of a reassembled PDU]"
"125","0.053737","2600:1408:ec00:128b::2e03","2600:8805:3803:6100:357c:4644:40b6:e846","TCP","1514","443  >  51538 [ACK] Seq=131224 Ack=1218 Win=3192 Len=1428 TSval=3590246902 TSecr=2728053688 [TCP segment of a reassembled PDU]"
"126","0.053738","2600:1408:ec00:128b::2e03","2600:8805:3803:6100:357c:4644:40b6:e846","TCP","1514","443  >  51538 [ACK] Seq=132652 Ack=1218 Win=3192 Len=1428 TSval=3590246902 TSecr=2728053688 [TCP segment of a reassembled PDU]"
"127","0.053739","2600:1408:ec00:128b::2e03","2600:8805:3803:6100:357c:4644:40b6:e846","TCP","1514","443  >  51538 [ACK] Seq=134080 Ack=1218 Win=3192 Len=1428 TSval=3590246902 TSecr=2728053688 [TCP segment of a reassembled PDU]"
"128","0.053739","2600:1408:ec00:128b::2e03","2600:8805:3803:6100:357c:4644:40b6:e846","TCP","1514","443  >  51538 [ACK] Seq=135508 Ack=1218 Win=3192 Len=1428 TSval=3590246902 TSecr=2728053688 [TCP segment of a reassembled PDU]"
"129","0.053740","2600:1408:ec00:128b::2e03","2600:8805:3803:6100:357c:4644:40b6:e846","TCP","1514","443  >  51538 [ACK] Seq=136936 Ack=1218 Win=3192 Len=1428 TSval=3590246902 TSecr=2728053688 [TCP segment of a reassembled PDU]"
"130","0.053741","2600:1408:ec00:128b::2e03","2600:8805:3803:6100:357c:4644:40b6:e846","TCP","1514","443  >  51538 [ACK] Seq=138364 Ack=1218 Win=3192 Len=1428 TSval=3590246902 TSecr=2728053688 [TCP segment of a reassembled PDU]"
"131","0.053742","2600:1408:ec00:128b::2e03","2600:8805:3803:6100:357c:4644:40b6:e846","TCP","1514","443  >  51538 [ACK] Seq=139792 Ack=1218 Win=3192 Len=1428 TSval=3590246902 TSecr=2728053688 [TCP segment of a reassembled PDU]"
"132","0.053743","2600:1408:ec00:128b::2e03","2600:8805:3803:6100:357c:4644:40b6:e846","TCP","1514","443  >  51538 [ACK] Seq=141220 Ack=1218 Win=3192 Len=1428 TSval=3590246902 TSecr=2728053688 [TCP segment of a reassembled PDU]"
"133","0.053743","2600:1408:ec00:128b::2e03","2600:8805:3803:6100:357c:4644:40b6:e846","TCP","1514","443  >  51538 [ACK] Seq=142648 Ack=1218 Win=3192 Len=1428 TSval=3590246902 TSecr=2728053688 [TCP segment of a reassembled PDU]"
"134","0.053744","2600:1408:ec00:128b::2e03","2600:8805:3803:6100:357c:4644:40b6:e846","TCP","1514","443  >  51538 [ACK] Seq=144076 Ack=1218 Win=3192 Len=1428 TSval=3590246902 TSecr=2728053688 [TCP segment of a reassembled PDU]"
"135","0.053745","2600:1408:ec00:128b::2e03","2600:8805:3803:6100:357c:4644:40b6:e846","TLSv1.2","784","Application Data"
"136","0.053746","2600:1408:ec00:128b::2e03","2600:8805:3803:6100:357c:4644:40b6:e846","TLSv1.2","117","Application Data"
"137","0.053855","2600:8805:3803:6100:357c:4644:40b6:e846","2600:1408:ec00:128b::2e03","TCP","86","51538  >  443 [ACK] Seq=1253 Ack=141220 Win=31150 Len=0 TSval=2728053742 TSecr=3590246902"
"138","0.054015","2600:1408:ec00:128b::2e03","2600:8805:3803:6100:357c:4644:40b6:e846","TCP","1514","443  >  51538 [ACK] Seq=146233 Ack=1218 Win=3192 Len=1428 TSval=3590246903 TSecr=2728053688 [TCP segment of a reassembled PDU]"
"139","0.054363","2600:8805:3803:6100:357c:4644:40b6:e846","2600:1408:ec00:128b::2e03","TCP","86","51538  >  443 [ACK] Seq=1253 Ack=147661 Win=31388 Len=0 TSval=2728053742 TSecr=3590246902"
"140","0.054415","2600:1408:ec00:128b::2e03","2600:8805:3803:6100:357c:4644:40b6:e846","TCP","1514","443  >  51538 [ACK] Seq=147661 Ack=1218 Win=3192 Len=1428 TSval=3590246903 TSecr=2728053688 [TCP segment of a reassembled PDU]"
"141","0.054416","2600:1408:ec00:128b::2e03","2600:8805:3803:6100:357c:4644:40b6:e846","TCP","1514","443  >  51538 [ACK] Seq=149089 Ack=1218 Win=3192 Len=1428 TSval=3590246903 TSecr=2728053688 [TCP segment of a reassembled PDU]"
"142","0.054417","2600:1408:ec00:128b::2e03","2600:8805:3803:6100:357c:4644:40b6:e846","TCP","1514","443  >  51538 [ACK] Seq=150517 Ack=1218 Win=3192 Len=1428 TSval=3590246903 TSecr=2728053688 [TCP segment of a reassembled PDU]"
"143","0.054862","2600:8805:3803:6100:357c:4644:40b6:e846","2600:1408:ec00:128b::2e03","TCP","86","51538  >  443 [ACK] Seq=1253 Ack=151945 Win=31388 Len=0 TSval=2728053743 TSecr=3590246903"
"144","0.055008","2600:1408:ec00:128b::2e03","2600:8805:3803:6100:357c:4644:40b6:e846","TLSv1.2","701","Application Data"
"145","0.055864","2600:8805:3803:6100:357c:4644:40b6:e846","2600:1408:ec00:128b::2e03","TCP","86","51538  >  443 [ACK] Seq=1253 Ack=152560 Win=31388 Len=0 TSval=2728053744 TSecr=3590246903"
"146","0.056362","2600:1408:ec00:128b::2e03","2600:8805:3803:6100:357c:4644:40b6:e846","TCP","1514","443  >  51538 [ACK] Seq=152560 Ack=1218 Win=3192 Len=1428 TSval=3590246905 TSecr=2728053688 [TCP segment of a reassembled PDU]"
"147","0.057628","2600:1408:ec00:128b::2e03","2600:8805:3803:6100:357c:4644:40b6:e846","TCP","1514","443  >  51538 [ACK] Seq=153988 Ack=1218 Win=3192 Len=1428 TSval=3590246905 TSecr=2728053688 [TCP segment of a reassembled PDU]"
"148","0.057629","2600:1408:ec00:128b::2e03","2600:8805:3803:6100:357c:4644:40b6:e846","TCP","1514","443  >  51538 [ACK] Seq=155416 Ack=1218 Win=3192 Len=1428 TSval=3590246905 TSecr=2728053688 [TCP segment of a reassembled PDU]"
"149","0.057631","2600:1408:ec00:128b::2e03","2600:8805:3803:6100:357c:4644:40b6:e846","TCP","1514","443  >  51538 [ACK] Seq=156844 Ack=1218 Win=3192 Len=1428 TSval=3590246905 TSecr=2728053688 [TCP segment of a reassembled PDU]"
"150","0.057632","2600:1408:ec00:128b::2e03","2600:8805:3803:6100:357c:4644:40b6:e846","TCP","1514","443  >  51538 [ACK] Seq=158272 Ack=1218 Win=3192 Len=1428 TSval=3590246905 TSecr=2728053688 [TCP segment of a reassembled PDU]"
"151","0.057633","2600:1408:ec00:128b::2e03","2600:8805:3803:6100:357c:4644:40b6:e846","TCP","1514","443  >  51538 [ACK] Seq=159700 Ack=1218 Win=3192 Len=1428 TSval=3590246905 TSecr=2728053688 [TCP segment of a reassembled PDU]"
"152","0.057634","2600:1408:ec00:128b::2e03","2600:8805:3803:6100:357c:4644:40b6:e846","TCP","1514","443  >  51538 [ACK] Seq=161128 Ack=1218 Win=3192 Len=1428 TSval=3590246905 TSecr=2728053688 [TCP segment of a reassembled PDU]"
"153","0.057634","2600:1408:ec00:128b::2e03","2600:8805:3803:6100:357c:4644:40b6:e846","TCP","1514","443  >  51538 [ACK] Seq=162556 Ack=1218 Win=3192 Len=1428 TSval=3590246905 TSecr=2728053688 [TCP segment of a reassembled PDU]"
"154","0.057636","2600:1408:ec00:128b::2e03","2600:8805:3803:6100:357c:4644:40b6:e846","TCP","1514","443  >  51538 [ACK] Seq=163984 Ack=1218 Win=3192 Len=1428 TSval=3590246905 TSecr=2728053688 [TCP segment of a reassembled PDU]"
"155","0.057636","2600:1408:ec00:128b::2e03","2600:8805:3803:6100:357c:4644:40b6:e846","TCP","1514","443  >  51538 [ACK] Seq=165412 Ack=1218 Win=3192 Len=1428 TSval=3590246905 TSecr=2728053688 [TCP segment of a reassembled PDU]"
"156","0.057637","2600:1408:ec00:128b::2e03","2600:8805:3803:6100:357c:4644:40b6:e846","TCP","1514","443  >  51538 [ACK] Seq=166840 Ack=1218 Win=3192 Len=1428 TSval=3590246905 TSecr=2728053688 [TCP segment of a reassembled PDU]"
"157","0.057639","2600:1408:ec00:128b::2e03","2600:8805:3803:6100:357c:4644:40b6:e846","TLSv1.2","784","Application Data"
"158","0.057639","2600:1408:ec00:128b::2e03","2600:8805:3803:6100:357c:4644:40b6:e846","TLSv1.2","117","Application Data"
"159","0.057640","2600:1408:ec00:128b::2e03","2600:8805:3803:6100:357c:4644:40b6:e846","TCP","1514","443  >  51538 [ACK] Seq=168997 Ack=1218 Win=3192 Len=1428 TSval=3590246906 TSecr=2728053688 [TCP segment of a reassembled PDU]"
"160","0.057640","2600:1408:ec00:128b::2e03","2600:8805:3803:6100:357c:4644:40b6:e846","TCP","1514","443  >  51538 [ACK] Seq=170425 Ack=1218 Win=3192 Len=1428 TSval=3590246906 TSecr=2728053688 [TCP segment of a reassembled PDU]"
"161","0.057642","2600:1408:ec00:128b::2e03","2600:8805:3803:6100:357c:4644:40b6:e846","TCP","1514","443  >  51538 [ACK] Seq=171853 Ack=1218 Win=3192 Len=1428 TSval=3590246906 TSecr=2728053688 [TCP segment of a reassembled PDU]"
"162","0.057642","2600:1408:ec00:128b::2e03","2600:8805:3803:6100:357c:4644:40b6:e846","TCP","1514","443  >  51538 [ACK] Seq=173281 Ack=1218 Win=3192 Len=1428 TSval=3590246906 TSecr=2728053688 [TCP segment of a reassembled PDU]"
"163","0.057643","2600:1408:ec00:128b::2e03","2600:8805:3803:6100:357c:4644:40b6:e846","TCP","1514","443  >  51538 [ACK] Seq=174709 Ack=1218 Win=3192 Len=1428 TSval=3590246906 TSecr=2728053688 [TCP segment of a reassembled PDU]"
"164","0.057644","2600:1408:ec00:128b::2e03","2600:8805:3803:6100:357c:4644:40b6:e846","TLSv1.2","1422","Application Data"
"165","0.058121","2600:8805:3803:6100:357c:4644:40b6:e846","2600:1408:ec00:128b::2e03","TCP","86","51538  >  443 [ACK] Seq=1253 Ack=177473 Win=31388 Len=0 TSval=2728053746 TSecr=3590246905"
"166","0.060810","2600:1408:ec00:128b::2e03","2600:8805:3803:6100:357c:4644:40b6:e846","TCP","1514","443  >  51538 [ACK] Seq=177473 Ack=1218 Win=3192 Len=1428 TSval=3590246909 TSecr=2728053729 [TCP segment of a reassembled PDU]"
"167","0.062614","2600:1408:ec00:128b::2e03","2600:8805:3803:6100:357c:4644:40b6:e846","TCP","1514","443  >  51538 [ACK] Seq=178901 Ack=1218 Win=3192 Len=1428 TSval=3590246909 TSecr=2728053729 [TCP segment of a reassembled PDU]"
"168","0.062616","2600:1408:ec00:128b::2e03","2600:8805:3803:6100:357c:4644:40b6:e846","TCP","1514","443  >  51538 [ACK] Seq=180329 Ack=1218 Win=3192 Len=1428 TSval=3590246909 TSecr=2728053729 [TCP segment of a reassembled PDU]"
"169","0.062616","2600:1408:ec00:128b::2e03","2600:8805:3803:6100:357c:4644:40b6:e846","TCP","1514","443  >  51538 [ACK] Seq=181757 Ack=1218 Win=3192 Len=1428 TSval=3590246909 TSecr=2728053729 [TCP segment of a reassembled PDU]"
"170","0.062618","2600:1408:ec00:128b::2e03","2600:8805:3803:6100:357c:4644:40b6:e846","TCP","1514","443  >  51538 [ACK] Seq=183185 Ack=1218 Win=3192 Len=1428 TSval=3590246909 TSecr=2728053729 [TCP segment of a reassembled PDU]"
"171","0.062619","2600:1408:ec00:128b::2e03","2600:8805:3803:6100:357c:4644:40b6:e846","TCP","1514","443  >  51538 [ACK] Seq=184613 Ack=1218 Win=3192 Len=1428 TSval=3590246909 TSecr=2728053729 [TCP segment of a reassembled PDU]"
"172","0.062620","2600:1408:ec00:128b::2e03","2600:8805:3803:6100:357c:4644:40b6:e846","TCP","1514","443  >  51538 [ACK] Seq=186041 Ack=1218 Win=3192 Len=1428 TSval=3590246909 TSecr=2728053729 [TCP segment of a reassembled PDU]"
"173","0.062620","2600:1408:ec00:128b::2e03","2600:8805:3803:6100:357c:4644:40b6:e846","TCP","1514","443  >  51538 [ACK] Seq=187469 Ack=1218 Win=3192 Len=1428 TSval=3590246909 TSecr=2728053729 [TCP segment of a reassembled PDU]"
"174","0.062621","2600:1408:ec00:128b::2e03","2600:8805:3803:6100:357c:4644:40b6:e846","TCP","1514","443  >  51538 [ACK] Seq=188897 Ack=1218 Win=3192 Len=1428 TSval=3590246909 TSecr=2728053729 [TCP segment of a reassembled PDU]"
"175","0.062622","2600:1408:ec00:128b::2e03","2600:8805:3803:6100:357c:4644:40b6:e846","TCP","1514","443  >  51538 [ACK] Seq=190325 Ack=1218 Win=3192 Len=1428 TSval=3590246909 TSecr=2728053729 [TCP segment of a reassembled PDU]"
"176","0.062622","2600:1408:ec00:128b::2e03","2600:8805:3803:6100:357c:4644:40b6:e846","TCP","1514","443  >  51538 [ACK] Seq=191753 Ack=1218 Win=3192 Len=1428 TSval=3590246909 TSecr=2728053729 [TCP segment of a reassembled PDU]"
"177","0.062623","2600:1408:ec00:128b::2e03","2600:8805:3803:6100:357c:4644:40b6:e846","TLSv1.2","784","Application Data"
"178","0.062624","2600:1408:ec00:128b::2e03","2600:8805:3803:6100:357c:4644:40b6:e846","TLSv1.2","117","Application Data"
"179","0.062625","2600:1408:ec00:128b::2e03","2600:8805:3803:6100:357c:4644:40b6:e846","TCP","1514","443  >  51538 [ACK] Seq=193910 Ack=1218 Win=3192 Len=1428 TSval=3590246910 TSecr=2728053729 [TCP segment of a reassembled PDU]"
"180","0.062625","2600:1408:ec00:128b::2e03","2600:8805:3803:6100:357c:4644:40b6:e846","TCP","1514","443  >  51538 [ACK] Seq=195338 Ack=1218 Win=3192 Len=1428 TSval=3590246910 TSecr=2728053729 [TCP segment of a reassembled PDU]"
"181","0.062626","2600:1408:ec00:128b::2e03","2600:8805:3803:6100:357c:4644:40b6:e846","TCP","1514","443  >  51538 [ACK] Seq=196766 Ack=1218 Win=3192 Len=1428 TSval=3590246910 TSecr=2728053729 [TCP segment of a reassembled PDU]"
"182","0.062627","2600:1408:ec00:128b::2e03","2600:8805:3803:6100:357c:4644:40b6:e846","TCP","1514","443  >  51538 [ACK] Seq=198194 Ack=1218 Win=3192 Len=1428 TSval=3590246910 TSecr=2728053729 [TCP segment of a reassembled PDU]"
"183","0.062627","2600:1408:ec00:128b::2e03","2600:8805:3803:6100:357c:4644:40b6:e846","TCP","1514","443  >  51538 [ACK] Seq=199622 Ack=1218 Win=3192 Len=1428 TSval=3590246910 TSecr=2728053729 [TCP segment of a reassembled PDU]"
"184","0.062628","2600:1408:ec00:128b::2e03","2600:8805:3803:6100:357c:4644:40b6:e846","TLSv1.2","787","Application Data"
"185","0.062796","2600:8805:3803:6100:357c:4644:40b6:e846","2600:1408:ec00:128b::2e03","TCP","86","51538  >  443 [ACK] Seq=1253 Ack=201751 Win=31388 Len=0 TSval=2728053751 TSecr=3590246909"
"186","0.063245","2600:1408:ec00:128b::2e03","2600:8805:3803:6100:357c:4644:40b6:e846","TCP","1514","443  >  51538 [ACK] Seq=201751 Ack=1218 Win=3192 Len=1428 TSval=3590246913 TSecr=2728053729 [TCP segment of a reassembled PDU]"
"187","0.064679","2600:1408:ec00:128b::2e03","2600:8805:3803:6100:357c:4644:40b6:e846","TCP","1514","443  >  51538 [ACK] Seq=203179 Ack=1218 Win=3192 Len=1428 TSval=3590246913 TSecr=2728053729 [TCP segment of a reassembled PDU]"
"188","0.064681","2600:1408:ec00:128b::2e03","2600:8805:3803:6100:357c:4644:40b6:e846","TCP","1514","443  >  51538 [ACK] Seq=204607 Ack=1218 Win=3192 Len=1428 TSval=3590246913 TSecr=2728053729 [TCP segment of a reassembled PDU]"
"189","0.064682","2600:1408:ec00:128b::2e03","2600:8805:3803:6100:357c:4644:40b6:e846","TCP","1514","443  >  51538 [ACK] Seq=206035 Ack=1218 Win=3192 Len=1428 TSval=3590246913 TSecr=2728053729 [TCP segment of a reassembled PDU]"
"190","0.064682","2600:1408:ec00:128b::2e03","2600:8805:3803:6100:357c:4644:40b6:e846","TCP","1514","443  >  51538 [ACK] Seq=207463 Ack=1218 Win=3192 Len=1428 TSval=3590246913 TSecr=2728053729 [TCP segment of a reassembled PDU]"
"191","0.064683","2600:1408:ec00:128b::2e03","2600:8805:3803:6100:357c:4644:40b6:e846","TCP","1514","443  >  51538 [ACK] Seq=208891 Ack=1218 Win=3192 Len=1428 TSval=3590246913 TSecr=2728053729 [TCP segment of a reassembled PDU]"
"192","0.064683","2600:1408:ec00:128b::2e03","2600:8805:3803:6100:357c:4644:40b6:e846","TCP","1514","443  >  51538 [ACK] Seq=210319 Ack=1218 Win=3192 Len=1428 TSval=3590246913 TSecr=2728053729 [TCP segment of a reassembled PDU]"
