"No.","Time","Source","Destination","Protocol","Length","Info"
"1","0.000000","2600:8805:3803:6100:c100:e220:6ae:755","2620:0:861:ed1a::1","TLSv1.2","159","Application Data"
"2","0.000121","2600:8805:3803:6100:c100:e220:6ae:755","2620:0:861:ed1a::1","TLSv1.2","125","Application Data"
"3","0.015754","2620:0:861:ed1a::1","2600:8805:3803:6100:c100:e220:6ae:755","TCP","1514","443  >  54978 [ACK] Seq=1 Ack=74 Win=83 Len=1428 TSval=705213431 TSecr=2149405071 [TCP segment of a reassembled PDU]"
"4","0.015836","2600:8805:3803:6100:c100:e220:6ae:755","2620:0:861:ed1a::1","TCP","86","54978  >  443 [ACK] Seq=113 Ack=1429 Win=2561 Len=0 TSval=2149405087 TSecr=705213431"
"5","0.016051","2620:0:861:ed1a::1","2600:8805:3803:6100:c100:e220:6ae:755","TCP","1514","443  >  54978 [ACK] Seq=1429 Ack=74 Win=83 Len=1428 TSval=705213431 TSecr=2149405071 [TCP segment of a reassembled PDU]"
"6","0.016052","2620:0:861:ed1a::1","2600:8805:3803:6100:c100:e220:6ae:755","TCP","1514","443  >  54978 [ACK] Seq=2857 Ack=74 Win=83 Len=1428 TSval=705213431 TSecr=2149405071 [TCP segment of a reassembled PDU]"
"7","0.016053","2620:0:861:ed1a::1","2600:8805:3803:6100:c100:e220:6ae:755","TCP","1514","443  >  54978 [PSH, ACK] Seq=4285 Ack=74 Win=83 Len=1428 TSval=705213431 TSecr=2149405071 [TCP segment of a reassembled PDU]"
"8","0.016098","2600:8805:3803:6100:c100:e220:6ae:755","2620:0:861:ed1a::1","TCP","86","54978  >  443 [ACK] Seq=113 Ack=5713 Win=2516 Len=0 TSval=2149405087 TSecr=705213431"
"9","0.016186","2600:8805:3803:6100:c100:e220:6ae:755","2620:0:861:ed1a::1","TCP","86","[TCP Window Update] 54978  >  443 [ACK] Seq=113 Ack=5713 Win=2583 Len=0 TSval=2149405087 TSecr=705213431"
"10","0.017497","2620:0:861:ed1a::1","2600:8805:3803:6100:c100:e220:6ae:755","TCP","1514","443  >  54978 [ACK] Seq=5713 Ack=74 Win=83 Len=1428 TSval=705213431 TSecr=2149405071 [TCP segment of a reassembled PDU]"
"11","0.017498","2620:0:861:ed1a::1","2600:8805:3803:6100:c100:e220:6ae:755","TCP","1514","443  >  54978 [ACK] Seq=7141 Ack=74 Win=83 Len=1428 TSval=705213431 TSecr=2149405071 [TCP segment of a reassembled PDU]"
"12","0.017498","2620:0:861:ed1a::1","2600:8805:3803:6100:c100:e220:6ae:755","TCP","1514","443  >  54978 [ACK] Seq=8569 Ack=74 Win=83 Len=1428 TSval=705213431 TSecr=2149405071 [TCP segment of a reassembled PDU]"
"13","0.017499","2620:0:861:ed1a::1","2600:8805:3803:6100:c100:e220:6ae:755","TCP","1514","443  >  54978 [PSH, ACK] Seq=9997 Ack=74 Win=83 Len=1428 TSval=705213431 TSecr=2149405071 [TCP segment of a reassembled PDU]"
"14","0.017500","2620:0:861:ed1a::1","2600:8805:3803:6100:c100:e220:6ae:755","TCP","1514","443  >  54978 [ACK] Seq=11425 Ack=74 Win=83 Len=1428 TSval=705213432 TSecr=2149405071 [TCP segment of a reassembled PDU]"
"15","0.017571","2600:8805:3803:6100:c100:e220:6ae:755","2620:0:861:ed1a::1","TCP","86","54978  >  443 [ACK] Seq=113 Ack=12853 Win=2471 Len=0 TSval=2149405088 TSecr=705213432"
"16","0.017672","2600:8805:3803:6100:c100:e220:6ae:755","2620:0:861:ed1a::1","TCP","86","[TCP Window Update] 54978  >  443 [ACK] Seq=113 Ack=12853 Win=2583 Len=0 TSval=2149405088 TSecr=705213432"
"17","0.018517","2620:0:861:ed1a::1","2600:8805:3803:6100:c100:e220:6ae:755","TCP","1514","443  >  54978 [ACK] Seq=12853 Ack=74 Win=83 Len=1428 TSval=705213432 TSecr=2149405071 [TCP segment of a reassembled PDU]"
"18","0.018519","2620:0:861:ed1a::1","2600:8805:3803:6100:c100:e220:6ae:755","TLSv1.2","427","Application Data"
"19","0.018520","2620:0:861:ed1a::1","2600:8805:3803:6100:c100:e220:6ae:755","TCP","1514","443  >  54978 [ACK] Seq=14622 Ack=74 Win=83 Len=1428 TSval=705213433 TSecr=2149405071 [TCP segment of a reassembled PDU]"
"20","0.018520","2620:0:861:ed1a::1","2600:8805:3803:6100:c100:e220:6ae:755","TCP","1514","443  >  54978 [ACK] Seq=16050 Ack=74 Win=83 Len=1428 TSval=705213433 TSecr=2149405071 [TCP segment of a reassembled PDU]"
"21","0.018521","2620:0:861:ed1a::1","2600:8805:3803:6100:c100:e220:6ae:755","TCP","1514","443  >  54978 [ACK] Seq=17478 Ack=74 Win=83 Len=1428 TSval=705213433 TSecr=2149405071 [TCP segment of a reassembled PDU]"
"22","0.018522","2620:0:861:ed1a::1","2600:8805:3803:6100:c100:e220:6ae:755","TCP","1514","443  >  54978 [PSH, ACK] Seq=18906 Ack=74 Win=83 Len=1428 TSval=705213433 TSecr=2149405071 [TCP segment of a reassembled PDU]"
"23","0.018568","2600:8805:3803:6100:c100:e220:6ae:755","2620:0:861:ed1a::1","TCP","86","54978  >  443 [ACK] Seq=113 Ack=20334 Win=2466 Len=0 TSval=2149405089 TSecr=705213433"
"24","0.018691","2600:8805:3803:6100:c100:e220:6ae:755","2620:0:861:ed1a::1","TCP","86","[TCP Window Update] 54978  >  443 [ACK] Seq=113 Ack=20334 Win=2583 Len=0 TSval=2149405089 TSecr=705213433"
"25","0.019451","2620:0:861:ed1a::1","2600:8805:3803:6100:c100:e220:6ae:755","TCP","1514","443  >  54978 [ACK] Seq=20334 Ack=74 Win=83 Len=1428 TSval=705213433 TSecr=2149405071 [TCP segment of a reassembled PDU]"
"26","0.019451","2620:0:861:ed1a::1","2600:8805:3803:6100:c100:e220:6ae:755","TCP","1514","443  >  54978 [ACK] Seq=21762 Ack=74 Win=83 Len=1428 TSval=705213433 TSecr=2149405071 [TCP segment of a reassembled PDU]"
"27","0.019453","2620:0:861:ed1a::1","2600:8805:3803:6100:c100:e220:6ae:755","TCP","1514","443  >  54978 [ACK] Seq=23190 Ack=74 Win=83 Len=1428 TSval=705213433 TSecr=2149405071 [TCP segment of a reassembled PDU]"
"28","0.019453","2620:0:861:ed1a::1","2600:8805:3803:6100:c100:e220:6ae:755","TLSv1.2","438","Application Data"
"29","0.019454","2620:0:861:ed1a::1","2600:8805:3803:6100:c100:e220:6ae:755","TLSv1.2","125","Application Data"
"30","0.019530","2600:8805:3803:6100:c100:e220:6ae:755","2620:0:861:ed1a::1","TCP","86","54978  >  443 [ACK] Seq=113 Ack=24970 Win=2511 Len=0 TSval=2149405089 TSecr=705213433"
"31","0.019586","2600:8805:3803:6100:c100:e220:6ae:755","2620:0:861:ed1a::1","TCP","86","54978  >  443 [ACK] Seq=113 Ack=25009 Win=2510 Len=0 TSval=2149405091 TSecr=705213434"
"32","0.019996","2600:8805:3803:6100:c100:e220:6ae:755","2620:0:861:ed1a::1","TCP","86","[TCP Window Update] 54978  >  443 [ACK] Seq=113 Ack=25009 Win=2583 Len=0 TSval=2149405091 TSecr=705213434"
"33","0.020127","2600:8805:3803:6100:c100:e220:6ae:755","2620:0:861:ed1a::1","TLSv1.2","121","Application Data"
"34","0.035804","2620:0:861:ed1a::1","2600:8805:3803:6100:c100:e220:6ae:755","TCP","86","443  >  54978 [ACK] Seq=25009 Ack=148 Win=83 Len=0 TSval=705213451 TSecr=2149405091"
"35","1.582691","2600:8805:3803:6100:c100:e220:6ae:755","2620:0:861:ed1a::1","TLSv1.2","163","Application Data"
"36","1.641647","2620:0:861:ed1a::1","2600:8805:3803:6100:c100:e220:6ae:755","TCP","86","443  >  54978 [ACK] Seq=25009 Ack=225 Win=83 Len=0 TSval=705215057 TSecr=2149406654"
"37","1.755361","2620:0:861:ed1a::1","2600:8805:3803:6100:c100:e220:6ae:755","TLSv1.2","1230","Application Data"
"38","1.755458","2600:8805:3803:6100:c100:e220:6ae:755","2620:0:861:ed1a::1","TCP","86","54978  >  443 [ACK] Seq=225 Ack=26153 Win=2565 Len=0 TSval=2149406826 TSecr=705215170"
"39","1.760930","2620:0:861:ed1a::1","2600:8805:3803:6100:c100:e220:6ae:755","TCP","1514","443  >  54978 [ACK] Seq=26153 Ack=225 Win=83 Len=1428 TSval=705215176 TSecr=2149406654 [TCP segment of a reassembled PDU]"
"40","1.761044","2600:8805:3803:6100:c100:e220:6ae:755","2620:0:861:ed1a::1","TCP","86","54978  >  443 [ACK] Seq=225 Ack=27581 Win=2561 Len=0 TSval=2149406832 TSecr=705215176"
"41","1.761244","2620:0:861:ed1a::1","2600:8805:3803:6100:c100:e220:6ae:755","TCP","1514","443  >  54978 [ACK] Seq=27581 Ack=225 Win=83 Len=1428 TSval=705215176 TSecr=2149406654 [TCP segment of a reassembled PDU]"
"42","1.761245","2620:0:861:ed1a::1","2600:8805:3803:6100:c100:e220:6ae:755","TCP","1514","443  >  54978 [ACK] Seq=29009 Ack=225 Win=83 Len=1428 TSval=705215176 TSecr=2149406654 [TCP segment of a reassembled PDU]"
"43","1.761246","2620:0:861:ed1a::1","2600:8805:3803:6100:c100:e220:6ae:755","TCP","1514","443  >  54978 [PSH, ACK] Seq=30437 Ack=225 Win=83 Len=1428 TSval=705215176 TSecr=2149406654 [TCP segment of a reassembled PDU]"
"44","1.761333","2600:8805:3803:6100:c100:e220:6ae:755","2620:0:861:ed1a::1","TCP","86","54978  >  443 [ACK] Seq=225 Ack=31865 Win=2494 Len=0 TSval=2149406832 TSecr=705215176"
"45","1.761507","2620:0:861:ed1a::1","2600:8805:3803:6100:c100:e220:6ae:755","TCP","1514","443  >  54978 [ACK] Seq=31865 Ack=225 Win=83 Len=1428 TSval=705215176 TSecr=2149406654 [TCP segment of a reassembled PDU]"
"46","1.761565","2600:8805:3803:6100:c100:e220:6ae:755","2620:0:861:ed1a::1","TCP","86","54978  >  443 [ACK] Seq=225 Ack=33293 Win=2471 Len=0 TSval=2149406832 TSecr=705215176"
"47","1.762053","2600:8805:3803:6100:c100:e220:6ae:755","2620:0:861:ed1a::1","TCP","86","[TCP Window Update] 54978  >  443 [ACK] Seq=225 Ack=33293 Win=2583 Len=0 TSval=2149406833 TSecr=705215176"
"48","1.762310","2620:0:861:ed1a::1","2600:8805:3803:6100:c100:e220:6ae:755","TCP","1514","443  >  54978 [ACK] Seq=33293 Ack=225 Win=83 Len=1428 TSval=705215176 TSecr=2149406654 [TCP segment of a reassembled PDU]"
"49","1.762311","2620:0:861:ed1a::1","2600:8805:3803:6100:c100:e220:6ae:755","TCP","1514","443  >  54978 [ACK] Seq=34721 Ack=225 Win=83 Len=1428 TSval=705215176 TSecr=2149406654 [TCP segment of a reassembled PDU]"
"50","1.762311","2620:0:861:ed1a::1","2600:8805:3803:6100:c100:e220:6ae:755","TCP","1514","443  >  54978 [PSH, ACK] Seq=36149 Ack=225 Win=83 Len=1428 TSval=705215176 TSecr=2149406654 [TCP segment of a reassembled PDU]"
"51","1.762386","2600:8805:3803:6100:c100:e220:6ae:755","2620:0:861:ed1a::1","TCP","86","54978  >  443 [ACK] Seq=225 Ack=37577 Win=2516 Len=0 TSval=2149406833 TSecr=705215176"
"52","1.762501","2600:8805:3803:6100:c100:e220:6ae:755","2620:0:861:ed1a::1","TCP","86","[TCP Window Update] 54978  >  443 [ACK] Seq=225 Ack=37577 Win=2583 Len=0 TSval=2149406833 TSecr=705215176"
"53","1.763501","2620:0:861:ed1a::1","2600:8805:3803:6100:c100:e220:6ae:755","TCP","1514","443  >  54978 [ACK] Seq=37577 Ack=225 Win=83 Len=1428 TSval=705215177 TSecr=2149406654 [TCP segment of a reassembled PDU]"
"54","1.763502","2620:0:861:ed1a::1","2600:8805:3803:6100:c100:e220:6ae:755","TCP","1514","443  >  54978 [ACK] Seq=39005 Ack=225 Win=83 Len=1428 TSval=705215177 TSecr=2149406654 [TCP segment of a reassembled PDU]"
"55","1.763503","2620:0:861:ed1a::1","2600:8805:3803:6100:c100:e220:6ae:755","TCP","1514","443  >  54978 [ACK] Seq=40433 Ack=225 Win=83 Len=1428 TSval=705215177 TSecr=2149406654 [TCP segment of a reassembled PDU]"
"56","1.763565","2600:8805:3803:6100:c100:e220:6ae:755","2620:0:861:ed1a::1","TCP","86","54978  >  443 [ACK] Seq=225 Ack=41861 Win=2516 Len=0 TSval=2149406834 TSecr=705215177"
"57","1.763650","2600:8805:3803:6100:c100:e220:6ae:755","2620:0:861:ed1a::1","TCP","86","[TCP Window Update] 54978  >  443 [ACK] Seq=225 Ack=41861 Win=2583 Len=0 TSval=2149406834 TSecr=705215177"
"58","1.765376","2620:0:861:ed1a::1","2600:8805:3803:6100:c100:e220:6ae:755","TLSv1.2","721","Application Data"
"59","1.765377","2620:0:861:ed1a::1","2600:8805:3803:6100:c100:e220:6ae:755","TCP","1514","443  >  54978 [ACK] Seq=42496 Ack=225 Win=83 Len=1428 TSval=705215178 TSecr=2149406654 [TCP segment of a reassembled PDU]"
"60","1.765378","2620:0:861:ed1a::1","2600:8805:3803:6100:c100:e220:6ae:755","TCP","1514","443  >  54978 [ACK] Seq=43924 Ack=225 Win=83 Len=1428 TSval=705215178 TSecr=2149406654 [TCP segment of a reassembled PDU]"
"61","1.765379","2620:0:861:ed1a::1","2600:8805:3803:6100:c100:e220:6ae:755","TCP","1514","443  >  54978 [ACK] Seq=45352 Ack=225 Win=83 Len=1428 TSval=705215178 TSecr=2149406654 [TCP segment of a reassembled PDU]"
"62","1.765380","2620:0:861:ed1a::1","2600:8805:3803:6100:c100:e220:6ae:755","TCP","1514","443  >  54978 [PSH, ACK] Seq=46780 Ack=225 Win=83 Len=1428 TSval=705215178 TSecr=2149406654 [TCP segment of a reassembled PDU]"
"63","1.765488","2600:8805:3803:6100:c100:e220:6ae:755","2620:0:861:ed1a::1","TCP","86","54978  >  443 [ACK] Seq=225 Ack=48208 Win=2484 Len=0 TSval=2149406836 TSecr=705215178"
"64","1.765684","2600:8805:3803:6100:c100:e220:6ae:755","2620:0:861:ed1a::1","TCP","86","[TCP Window Update] 54978  >  443 [ACK] Seq=225 Ack=48208 Win=2583 Len=0 TSval=2149406836 TSecr=705215178"
"65","1.766378","2620:0:861:ed1a::1","2600:8805:3803:6100:c100:e220:6ae:755","TCP","1514","443  >  54978 [ACK] Seq=48208 Ack=225 Win=83 Len=1428 TSval=705215179 TSecr=2149406654 [TCP segment of a reassembled PDU]"
"66","1.766379","2620:0:861:ed1a::1","2600:8805:3803:6100:c100:e220:6ae:755","TCP","1514","443  >  54978 [ACK] Seq=49636 Ack=225 Win=83 Len=1428 TSval=705215179 TSecr=2149406654 [TCP segment of a reassembled PDU]"
"67","1.766379","2620:0:861:ed1a::1","2600:8805:3803:6100:c100:e220:6ae:755","TCP","1514","443  >  54978 [ACK] Seq=51064 Ack=225 Win=83 Len=1428 TSval=705215179 TSecr=2149406654 [TCP segment of a reassembled PDU]"
"68","1.766380","2620:0:861:ed1a::1","2600:8805:3803:6100:c100:e220:6ae:755","TCP","1514","443  >  54978 [PSH, ACK] Seq=52492 Ack=225 Win=83 Len=1428 TSval=705215179 TSecr=2149406654 [TCP segment of a reassembled PDU]"
"69","1.766380","2620:0:861:ed1a::1","2600:8805:3803:6100:c100:e220:6ae:755","TCP","1514","443  >  54978 [ACK] Seq=53920 Ack=225 Win=83 Len=1428 TSval=705215180 TSecr=2149406654 [TCP segment of a reassembled PDU]"
"70","1.766382","2620:0:861:ed1a::1","2600:8805:3803:6100:c100:e220:6ae:755","TLSv1.2","1220","Application Data"
"71","1.766467","2600:8805:3803:6100:c100:e220:6ae:755","2620:0:861:ed1a::1","TCP","86","54978  >  443 [ACK] Seq=225 Ack=56482 Win=2454 Len=0 TSval=2149406837 TSecr=705215180"
"72","1.766568","2600:8805:3803:6100:c100:e220:6ae:755","2620:0:861:ed1a::1","TCP","86","[TCP Window Update] 54978  >  443 [ACK] Seq=225 Ack=56482 Win=2583 Len=0 TSval=2149406837 TSecr=705215180"
"73","1.837663","2600:8805:3803:6100:c100:e220:6ae:755","2620:0:861:ed1a::1","TLSv1.2","509","Application Data"
"74","1.853260","2620:0:861:ed1a::1","2600:8805:3803:6100:c100:e220:6ae:755","TCP","86","443  >  54978 [ACK] Seq=56482 Ack=648 Win=83 Len=0 TSval=705215268 TSecr=2149406909"
"75","1.853742","2620:0:861:ed1a::1","2600:8805:3803:6100:c100:e220:6ae:755","TCP","1514","443  >  54978 [ACK] Seq=56482 Ack=648 Win=83 Len=1428 TSval=705215269 TSecr=2149406909 [TCP segment of a reassembled PDU]"
"76","1.853792","2600:8805:3803:6100:c100:e220:6ae:755","2620:0:861:ed1a::1","TCP","86","54978  >  443 [ACK] Seq=648 Ack=57910 Win=2561 Len=0 TSval=2149406924 TSecr=705215269"
"77","1.854141","2620:0:861:ed1a::1","2600:8805:3803:6100:c100:e220:6ae:755","TCP","1514","443  >  54978 [ACK] Seq=57910 Ack=648 Win=83 Len=1428 TSval=705215269 TSecr=2149406909 [TCP segment of a reassembled PDU]"
"78","1.854142","2620:0:861:ed1a::1","2600:8805:3803:6100:c100:e220:6ae:755","TCP","1514","443  >  54978 [ACK] Seq=59338 Ack=648 Win=83 Len=1428 TSval=705215269 TSecr=2149406909 [TCP segment of a reassembled PDU]"
"79","1.854184","2600:8805:3803:6100:c100:e220:6ae:755","2620:0:861:ed1a::1","TCP","86","54978  >  443 [ACK] Seq=648 Ack=60766 Win=2516 Len=0 TSval=2149406924 TSecr=705215269"
"80","1.854572","2600:8805:3803:6100:c100:e220:6ae:755","2620:0:861:ed1a::1","TCP","86","[TCP Window Update] 54978  >  443 [ACK] Seq=648 Ack=60766 Win=2583 Len=0 TSval=2149406926 TSecr=705215269"
"81","1.855093","2620:0:861:ed1a::1","2600:8805:3803:6100:c100:e220:6ae:755","TCP","1514","443  >  54978 [PSH, ACK] Seq=60766 Ack=648 Win=83 Len=1428 TSval=705215269 TSecr=2149406909 [TCP segment of a reassembled PDU]"
"82","1.855094","2620:0:861:ed1a::1","2600:8805:3803:6100:c100:e220:6ae:755","TCP","1514","443  >  54978 [ACK] Seq=62194 Ack=648 Win=83 Len=1428 TSval=705215269 TSecr=2149406909 [TCP segment of a reassembled PDU]"
"83","1.855095","2620:0:861:ed1a::1","2600:8805:3803:6100:c100:e220:6ae:755","TCP","1514","443  >  54978 [ACK] Seq=63622 Ack=648 Win=83 Len=1428 TSval=705215269 TSecr=2149406909 [TCP segment of a reassembled PDU]"
"84","1.855095","2620:0:861:ed1a::1","2600:8805:3803:6100:c100:e220:6ae:755","TCP","1514","443  >  54978 [ACK] Seq=65050 Ack=648 Win=83 Len=1428 TSval=705215269 TSecr=2149406909 [TCP segment of a reassembled PDU]"
"85","1.855143","2600:8805:3803:6100:c100:e220:6ae:755","2620:0:861:ed1a::1","TCP","86","54978  >  443 [ACK] Seq=648 Ack=66478 Win=2494 Len=0 TSval=2149406926 TSecr=705215269"
"86","1.855538","2620:0:861:ed1a::1","2600:8805:3803:6100:c100:e220:6ae:755","TCP","1514","443  >  54978 [PSH, ACK] Seq=66478 Ack=648 Win=83 Len=1428 TSval=705215269 TSecr=2149406909 [TCP segment of a reassembled PDU]"
"87","1.855543","2600:8805:3803:6100:c100:e220:6ae:755","2620:0:861:ed1a::1","TCP","86","[TCP Window Update] 54978  >  443 [ACK] Seq=648 Ack=66478 Win=2583 Len=0 TSval=2149406926 TSecr=705215269"
"88","1.855569","2600:8805:3803:6100:c100:e220:6ae:755","2620:0:861:ed1a::1","TCP","86","54978  >  443 [ACK] Seq=648 Ack=67906 Win=2561 Len=0 TSval=2149406927 TSecr=705215269"
"89","1.857319","2620:0:861:ed1a::1","2600:8805:3803:6100:c100:e220:6ae:755","TCP","1514","443  >  54978 [ACK] Seq=67906 Ack=648 Win=83 Len=1428 TSval=705215270 TSecr=2149406909 [TCP segment of a reassembled PDU]"
"90","1.857320","2620:0:861:ed1a::1","2600:8805:3803:6100:c100:e220:6ae:755","TCP","1514","443  >  54978 [ACK] Seq=69334 Ack=648 Win=83 Len=1428 TSval=705215270 TSecr=2149406909 [TCP segment of a reassembled PDU]"
"91","1.857320","2620:0:861:ed1a::1","2600:8805:3803:6100:c100:e220:6ae:755","TLSv1.2","474","Application Data"
"92","1.857321","2620:0:861:ed1a::1","2600:8805:3803:6100:c100:e220:6ae:755","TCP","1514","443  >  54978 [ACK] Seq=71150 Ack=648 Win=83 Len=1428 TSval=705215271 TSecr=2149406909 [TCP segment of a reassembled PDU]"
"93","1.857321","2620:0:861:ed1a::1","2600:8805:3803:6100:c100:e220:6ae:755","TCP","1514","443  >  54978 [ACK] Seq=72578 Ack=648 Win=83 Len=1428 TSval=705215271 TSecr=2149406909 [TCP segment of a reassembled PDU]"
"94","1.857322","2620:0:861:ed1a::1","2600:8805:3803:6100:c100:e220:6ae:755","TCP","1514","443  >  54978 [ACK] Seq=74006 Ack=648 Win=83 Len=1428 TSval=705215271 TSecr=2149406909 [TCP segment of a reassembled PDU]"
"95","1.857322","2620:0:861:ed1a::1","2600:8805:3803:6100:c100:e220:6ae:755","TCP","1514","443  >  54978 [PSH, ACK] Seq=75434 Ack=648 Win=83 Len=1428 TSval=705215271 TSecr=2149406909 [TCP segment of a reassembled PDU]"
"96","1.857405","2600:8805:3803:6100:c100:e220:6ae:755","2620:0:861:ed1a::1","TCP","86","54978  >  443 [ACK] Seq=648 Ack=76862 Win=2443 Len=0 TSval=2149406928 TSecr=705215271"
"97","1.857504","2600:8805:3803:6100:c100:e220:6ae:755","2620:0:861:ed1a::1","TCP","86","[TCP Window Update] 54978  >  443 [ACK] Seq=648 Ack=76862 Win=2583 Len=0 TSval=2149406928 TSecr=705215271"
"98","1.858133","2620:0:861:ed1a::1","2600:8805:3803:6100:c100:e220:6ae:755","TCP","1514","443  >  54978 [ACK] Seq=76862 Ack=648 Win=83 Len=1428 TSval=705215272 TSecr=2149406909 [TCP segment of a reassembled PDU]"
"99","1.858133","2620:0:861:ed1a::1","2600:8805:3803:6100:c100:e220:6ae:755","TCP","1514","443  >  54978 [ACK] Seq=78290 Ack=648 Win=83 Len=1428 TSval=705215272 TSecr=2149406909 [TCP segment of a reassembled PDU]"
"100","1.858134","2620:0:861:ed1a::1","2600:8805:3803:6100:c100:e220:6ae:755","TCP","1514","443  >  54978 [ACK] Seq=79718 Ack=648 Win=83 Len=1428 TSval=705215272 TSecr=2149406909 [TCP segment of a reassembled PDU]"
"101","1.858135","2620:0:861:ed1a::1","2600:8805:3803:6100:c100:e220:6ae:755","TCP","1514","443  >  54978 [PSH, ACK] Seq=81146 Ack=648 Win=83 Len=1428 TSval=705215272 TSecr=2149406909 [TCP segment of a reassembled PDU]"
"102","1.858135","2620:0:861:ed1a::1","2600:8805:3803:6100:c100:e220:6ae:755","TCP","1514","443  >  54978 [ACK] Seq=82574 Ack=648 Win=83 Len=1428 TSval=705215272 TSecr=2149406909 [TCP segment of a reassembled PDU]"
"103","1.858136","2620:0:861:ed1a::1","2600:8805:3803:6100:c100:e220:6ae:755","TCP","1514","443  >  54978 [ACK] Seq=84002 Ack=648 Win=83 Len=1428 TSval=705215272 TSecr=2149406909 [TCP segment of a reassembled PDU]"
"104","1.858136","2620:0:861:ed1a::1","2600:8805:3803:6100:c100:e220:6ae:755","TCP","1514","443  >  54978 [ACK] Seq=85430 Ack=648 Win=83 Len=1428 TSval=705215272 TSecr=2149406909 [TCP segment of a reassembled PDU]"
"105","1.858137","2620:0:861:ed1a::1","2600:8805:3803:6100:c100:e220:6ae:755","TLSv1.2","1514","Application Data"
"106","1.858222","2600:8805:3803:6100:c100:e220:6ae:755","2620:0:861:ed1a::1","TCP","86","54978  >  443 [ACK] Seq=648 Ack=88286 Win=2405 Len=0 TSval=2149406928 TSecr=705215272"
"107","1.858315","2600:8805:3803:6100:c100:e220:6ae:755","2620:0:861:ed1a::1","TCP","86","[TCP Window Update] 54978  >  443 [ACK] Seq=648 Ack=88286 Win=2583 Len=0 TSval=2149406928 TSecr=705215272"
"108","1.858755","2620:0:861:ed1a::1","2600:8805:3803:6100:c100:e220:6ae:755","TCP","1514","443  >  54978 [ACK] Seq=88286 Ack=648 Win=83 Len=1428 TSval=705215273 TSecr=2149406909 [TCP segment of a reassembled PDU]"
"109","1.858756","2620:0:861:ed1a::1","2600:8805:3803:6100:c100:e220:6ae:755","TLSv1.2","502","Application Data"
"110","1.858818","2600:8805:3803:6100:c100:e220:6ae:755","2620:0:861:ed1a::1","TCP","86","54978  >  443 [ACK] Seq=648 Ack=90130 Win=2554 Len=0 TSval=2149406930 TSecr=705215273"
"111","2.068828","2600:8805:3803:6100:c100:e220:6ae:755","2620:0:861:ed1a::1","TLSv1.2","570","Application Data"
"112","2.070126","2600:8805:3803:6100:c100:e220:6ae:755","2620:0:861:ed1a::1","TLSv1.2","224","Application Data"
"113","2.084012","2620:0:861:ed1a::1","2600:8805:3803:6100:c100:e220:6ae:755","TLSv1.2","1189","Application Data"
"114","2.084080","2600:8805:3803:6100:c100:e220:6ae:755","2620:0:861:ed1a::1","TCP","86","54978  >  443 [ACK] Seq=1270 Ack=91233 Win=2566 Len=0 TSval=2149407155 TSecr=705215499"
"115","2.088318","2620:0:861:ed1a::1","2600:8805:3803:6100:c100:e220:6ae:755","TLSv1.2","1435","Application Data"
"116","2.088381","2600:8805:3803:6100:c100:e220:6ae:755","2620:0:861:ed1a::1","TCP","86","54978  >  443 [ACK] Seq=1270 Ack=92582 Win=2562 Len=0 TSval=2149407159 TSecr=705215503"
"117","2.171352","2600:8805:3803:6100:c100:e220:6ae:755","2620:0:861:ed1a::1","TLSv1.2","269","Application Data"
"118","2.192016","2620:0:861:ed1a::1","2600:8805:3803:6100:c100:e220:6ae:755","TCP","1514","443  >  54978 [ACK] Seq=92582 Ack=1453 Win=83 Len=1428 TSval=705215607 TSecr=2149407242 [TCP segment of a reassembled PDU]"
"119","2.192176","2600:8805:3803:6100:c100:e220:6ae:755","2620:0:861:ed1a::1","TCP","86","54978  >  443 [ACK] Seq=1453 Ack=94010 Win=2561 Len=0 TSval=2149407263 TSecr=705215607"
"120","2.192338","2620:0:861:ed1a::1","2600:8805:3803:6100:c100:e220:6ae:755","TCP","1514","443  >  54978 [ACK] Seq=94010 Ack=1453 Win=83 Len=1428 TSval=705215607 TSecr=2149407242 [TCP segment of a reassembled PDU]"
"121","2.192339","2620:0:861:ed1a::1","2600:8805:3803:6100:c100:e220:6ae:755","TCP","1514","443  >  54978 [ACK] Seq=95438 Ack=1453 Win=83 Len=1428 TSval=705215607 TSecr=2149407242 [TCP segment of a reassembled PDU]"
"122","2.192340","2620:0:861:ed1a::1","2600:8805:3803:6100:c100:e220:6ae:755","TCP","1514","443  >  54978 [PSH, ACK] Seq=96866 Ack=1453 Win=83 Len=1428 TSval=705215607 TSecr=2149407242 [TCP segment of a reassembled PDU]"
"123","2.192445","2600:8805:3803:6100:c100:e220:6ae:755","2620:0:861:ed1a::1","TCP","86","54978  >  443 [ACK] Seq=1453 Ack=98294 Win=2494 Len=0 TSval=2149407263 TSecr=705215607"
"124","2.192500","2600:8805:3803:6100:c100:e220:6ae:755","2620:0:861:ed1a::1","TCP","86","[TCP Window Update] 54978  >  443 [ACK] Seq=1453 Ack=98294 Win=2583 Len=0 TSval=2149407263 TSecr=705215607"
"125","2.193105","2620:0:861:ed1a::1","2600:8805:3803:6100:c100:e220:6ae:755","TCP","1514","443  >  54978 [ACK] Seq=98294 Ack=1453 Win=83 Len=1428 TSval=705215607 TSecr=2149407242 [TCP segment of a reassembled PDU]"
"126","2.193106","2620:0:861:ed1a::1","2600:8805:3803:6100:c100:e220:6ae:755","TCP","1514","443  >  54978 [ACK] Seq=99722 Ack=1453 Win=83 Len=1428 TSval=705215607 TSecr=2149407242 [TCP segment of a reassembled PDU]"
"127","2.193107","2620:0:861:ed1a::1","2600:8805:3803:6100:c100:e220:6ae:755","TCP","1514","443  >  54978 [ACK] Seq=101150 Ack=1453 Win=83 Len=1428 TSval=705215607 TSecr=2149407242 [TCP segment of a reassembled PDU]"
"128","2.193108","2620:0:861:ed1a::1","2600:8805:3803:6100:c100:e220:6ae:755","TLSv1.2","619","Application Data"
"129","2.193109","2620:0:861:ed1a::1","2600:8805:3803:6100:c100:e220:6ae:755","TCP","1514","443  >  54978 [ACK] Seq=103111 Ack=1453 Win=83 Len=1428 TSval=705215608 TSecr=2149407242 [TCP segment of a reassembled PDU]"
"130","2.193291","2600:8805:3803:6100:c100:e220:6ae:755","2620:0:861:ed1a::1","TCP","86","54978  >  443 [ACK] Seq=1453 Ack=104539 Win=2485 Len=0 TSval=2149407264 TSecr=705215608"
"131","2.193497","2600:8805:3803:6100:c100:e220:6ae:755","2620:0:861:ed1a::1","TCP","86","[TCP Window Update] 54978  >  443 [ACK] Seq=1453 Ack=104539 Win=2583 Len=0 TSval=2149407264 TSecr=705215608"
"132","2.195847","2620:0:861:ed1a::1","2600:8805:3803:6100:c100:e220:6ae:755","TCP","1514","443  >  54978 [ACK] Seq=104539 Ack=1453 Win=83 Len=1428 TSval=705215608 TSecr=2149407242 [TCP segment of a reassembled PDU]"
"133","2.195847","2620:0:861:ed1a::1","2600:8805:3803:6100:c100:e220:6ae:755","TCP","1514","443  >  54978 [ACK] Seq=105967 Ack=1453 Win=83 Len=1428 TSval=705215608 TSecr=2149407242 [TCP segment of a reassembled PDU]"
"134","2.195912","2600:8805:3803:6100:c100:e220:6ae:755","2620:0:861:ed1a::1","TCP","86","54978  >  443 [ACK] Seq=1453 Ack=107395 Win=2538 Len=0 TSval=2149407267 TSecr=705215608"
"135","2.195977","2600:8805:3803:6100:c100:e220:6ae:755","2620:0:861:ed1a::1","TCP","86","[TCP Window Update] 54978  >  443 [ACK] Seq=1453 Ack=107395 Win=2583 Len=0 TSval=2149407267 TSecr=705215608"
"136","2.197338","2620:0:861:ed1a::1","2600:8805:3803:6100:c100:e220:6ae:755","TCP","1514","443  >  54978 [PSH, ACK] Seq=107395 Ack=1453 Win=83 Len=1428 TSval=705215608 TSecr=2149407242 [TCP segment of a reassembled PDU]"
"137","2.197339","2620:0:861:ed1a::1","2600:8805:3803:6100:c100:e220:6ae:755","TCP","1514","443  >  54978 [ACK] Seq=108823 Ack=1453 Win=83 Len=1428 TSval=705215609 TSecr=2149407242 [TCP segment of a reassembled PDU]"
"138","2.197339","2620:0:861:ed1a::1","2600:8805:3803:6100:c100:e220:6ae:755","TCP","1514","443  >  54978 [ACK] Seq=110251 Ack=1453 Win=83 Len=1428 TSval=705215609 TSecr=2149407242 [TCP segment of a reassembled PDU]"
"139","2.197340","2620:0:861:ed1a::1","2600:8805:3803:6100:c100:e220:6ae:755","TCP","1514","443  >  54978 [ACK] Seq=111679 Ack=1453 Win=83 Len=1428 TSval=705215609 TSecr=2149407242 [TCP segment of a reassembled PDU]"
"140","2.197340","2620:0:861:ed1a::1","2600:8805:3803:6100:c100:e220:6ae:755","TCP","1514","443  >  54978 [PSH, ACK] Seq=113107 Ack=1453 Win=83 Len=1428 TSval=705215609 TSecr=2149407242 [TCP segment of a reassembled PDU]"
"141","2.197341","2620:0:861:ed1a::1","2600:8805:3803:6100:c100:e220:6ae:755","TCP","1514","443  >  54978 [ACK] Seq=114535 Ack=1453 Win=83 Len=1428 TSval=705215610 TSecr=2149407242 [TCP segment of a reassembled PDU]"
"142","2.197341","2620:0:861:ed1a::1","2600:8805:3803:6100:c100:e220:6ae:755","TCP","1514","443  >  54978 [ACK] Seq=115963 Ack=1453 Win=83 Len=1428 TSval=705215610 TSecr=2149407242 [TCP segment of a reassembled PDU]"
"143","2.197342","2620:0:861:ed1a::1","2600:8805:3803:6100:c100:e220:6ae:755","TCP","1514","443  >  54978 [ACK] Seq=117391 Ack=1453 Win=83 Len=1428 TSval=705215610 TSecr=2149407242 [TCP segment of a reassembled PDU]"
"144","2.197342","2620:0:861:ed1a::1","2600:8805:3803:6100:c100:e220:6ae:755","TLSv1.2","1514","Application Data"
"145","2.197342","2620:0:861:ed1a::1","2600:8805:3803:6100:c100:e220:6ae:755","TCP","1514","443  >  54978 [ACK] Seq=120247 Ack=1453 Win=83 Len=1428 TSval=705215611 TSecr=2149407242 [TCP segment of a reassembled PDU]"
"146","2.197343","2620:0:861:ed1a::1","2600:8805:3803:6100:c100:e220:6ae:755","TCP","1514","443  >  54978 [ACK] Seq=121675 Ack=1453 Win=83 Len=1428 TSval=705215611 TSecr=2149407242 [TCP segment of a reassembled PDU]"
"147","2.197343","2620:0:861:ed1a::1","2600:8805:3803:6100:c100:e220:6ae:755","TCP","1514","443  >  54978 [ACK] Seq=123103 Ack=1453 Win=83 Len=1428 TSval=705215611 TSecr=2149407242 [TCP segment of a reassembled PDU]"
"148","2.197344","2620:0:861:ed1a::1","2600:8805:3803:6100:c100:e220:6ae:755","TCP","1514","443  >  54978 [PSH, ACK] Seq=124531 Ack=1453 Win=83 Len=1428 TSval=705215611 TSecr=2149407242 [TCP segment of a reassembled PDU]"
"149","2.197344","2620:0:861:ed1a::1","2600:8805:3803:6100:c100:e220:6ae:755","TCP","1514","443  >  54978 [ACK] Seq=125959 Ack=1453 Win=83 Len=1428 TSval=705215612 TSecr=2149407242 [TCP segment of a reassembled PDU]"
"150","2.197344","2620:0:861:ed1a::1","2600:8805:3803:6100:c100:e220:6ae:755","TCP","1514","443  >  54978 [ACK] Seq=127387 Ack=1453 Win=83 Len=1428 TSval=705215612 TSecr=2149407242 [TCP segment of a reassembled PDU]"
"151","2.197345","2620:0:861:ed1a::1","2600:8805:3803:6100:c100:e220:6ae:755","TCP","1514","443  >  54978 [ACK] Seq=128815 Ack=1453 Win=83 Len=1428 TSval=705215612 TSecr=2149407242 [TCP segment of a reassembled PDU]"
"152","2.197345","2620:0:861:ed1a::1","2600:8805:3803:6100:c100:e220:6ae:755","TCP","1514","443  >  54978 [PSH, ACK] Seq=130243 Ack=1453 Win=83 Len=1428 TSval=705215612 TSecr=2149407242 [TCP segment of a reassembled PDU]"
"153","2.197412","2600:8805:3803:6100:c100:e220:6ae:755","2620:0:861:ed1a::1","TCP","86","54978  >  443 [ACK] Seq=1453 Ack=123103 Win=2338 Len=0 TSval=2149407268 TSecr=705215611"
"154","2.197459","2620:0:861:ed1a::1","2600:8805:3803:6100:c100:e220:6ae:755","TCP","1514","443  >  54978 [ACK] Seq=131671 Ack=1453 Win=83 Len=1428 TSval=705215612 TSecr=2149407242 [TCP segment of a reassembled PDU]"
"155","2.197499","2600:8805:3803:6100:c100:e220:6ae:755","2620:0:861:ed1a::1","TCP","86","54978  >  443 [ACK] Seq=1453 Ack=131671 Win=2204 Len=0 TSval=2149407268 TSecr=705215612"
"156","2.197831","2600:8805:3803:6100:c100:e220:6ae:755","2620:0:861:ed1a::1","TCP","86","54978  >  443 [ACK] Seq=1453 Ack=133099 Win=2583 Len=0 TSval=2149407268 TSecr=705215612"
"157","2.197891","2620:0:861:ed1a::1","2600:8805:3803:6100:c100:e220:6ae:755","TCP","1514","443  >  54978 [ACK] Seq=133099 Ack=1453 Win=83 Len=1428 TSval=705215612 TSecr=2149407242 [TCP segment of a reassembled PDU]"
"158","2.197892","2620:0:861:ed1a::1","2600:8805:3803:6100:c100:e220:6ae:755","TLSv1.2","1514","Application Data"
"159","2.197892","2620:0:861:ed1a::1","2600:8805:3803:6100:c100:e220:6ae:755","TCP","1514","443  >  54978 [PSH, ACK] Seq=135955 Ack=1453 Win=83 Len=1428 TSval=705215612 TSecr=2149407242 [TCP segment of a reassembled PDU]"
"160","2.197930","2600:8805:3803:6100:c100:e220:6ae:755","2620:0:861:ed1a::1","TCP","86","54978  >  443 [ACK] Seq=1453 Ack=137383 Win=2516 Len=0 TSval=2149407268 TSecr=705215612"
"161","2.198105","2600:8805:3803:6100:c100:e220:6ae:755","2620:0:861:ed1a::1","TCP","86","[TCP Window Update] 54978  >  443 [ACK] Seq=1453 Ack=137383 Win=2583 Len=0 TSval=2149407268 TSecr=705215612"
"162","2.198469","2620:0:861:ed1a::1","2600:8805:3803:6100:c100:e220:6ae:755","TCP","1514","443  >  54978 [ACK] Seq=137383 Ack=1453 Win=83 Len=1428 TSval=705215613 TSecr=2149407242 [TCP segment of a reassembled PDU]"
"163","2.198696","2620:0:861:ed1a::1","2600:8805:3803:6100:c100:e220:6ae:755","TCP","1514","443  >  54978 [ACK] Seq=138811 Ack=1453 Win=83 Len=1428 TSval=705215613 TSecr=2149407242 [TCP segment of a reassembled PDU]"
"164","2.198743","2600:8805:3803:6100:c100:e220:6ae:755","2620:0:861:ed1a::1","TCP","86","54978  >  443 [ACK] Seq=1453 Ack=140239 Win=2561 Len=0 TSval=2149407269 TSecr=705215613"
"165","2.199156","2620:0:861:ed1a::1","2600:8805:3803:6100:c100:e220:6ae:755","TCP","1514","443  >  54978 [ACK] Seq=140239 Ack=1453 Win=83 Len=1428 TSval=705215613 TSecr=2149407242 [TCP segment of a reassembled PDU]"
"166","2.199157","2620:0:861:ed1a::1","2600:8805:3803:6100:c100:e220:6ae:755","TCP","1514","443  >  54978 [PSH, ACK] Seq=141667 Ack=1453 Win=83 Len=1428 TSval=705215613 TSecr=2149407242 [TCP segment of a reassembled PDU]"
"167","2.199225","2600:8805:3803:6100:c100:e220:6ae:755","2620:0:861:ed1a::1","TCP","86","54978  >  443 [ACK] Seq=1453 Ack=143095 Win=2538 Len=0 TSval=2149407269 TSecr=705215613"
"168","2.199325","2600:8805:3803:6100:c100:e220:6ae:755","2620:0:861:ed1a::1","TCP","86","[TCP Window Update] 54978  >  443 [ACK] Seq=1453 Ack=143095 Win=2583 Len=0 TSval=2149407269 TSecr=705215613"
"169","2.200025","2620:0:861:ed1a::1","2600:8805:3803:6100:c100:e220:6ae:755","TCP","1514","443  >  54978 [ACK] Seq=143095 Ack=1453 Win=83 Len=1428 TSval=705215614 TSecr=2149407242 [TCP segment of a reassembled PDU]"
"170","2.200026","2620:0:861:ed1a::1","2600:8805:3803:6100:c100:e220:6ae:755","TCP","1514","443  >  54978 [ACK] Seq=144523 Ack=1453 Win=83 Len=1428 TSval=705215614 TSecr=2149407242 [TCP segment of a reassembled PDU]"
"171","2.200026","2620:0:861:ed1a::1","2600:8805:3803:6100:c100:e220:6ae:755","TCP","1514","443  >  54978 [ACK] Seq=145951 Ack=1453 Win=83 Len=1428 TSval=705215614 TSecr=2149407242 [TCP segment of a reassembled PDU]"
"172","2.200027","2620:0:861:ed1a::1","2600:8805:3803:6100:c100:e220:6ae:755","TCP","1514","443  >  54978 [PSH, ACK] Seq=147379 Ack=1453 Win=83 Len=1428 TSval=705215614 TSecr=2149407242 [TCP segment of a reassembled PDU]"
"173","2.200089","2600:8805:3803:6100:c100:e220:6ae:755","2620:0:861:ed1a::1","TCP","86","54978  >  443 [ACK] Seq=1453 Ack=148807 Win=2494 Len=0 TSval=2149407271 TSecr=705215614"
"174","2.200158","2600:8805:3803:6100:c100:e220:6ae:755","2620:0:861:ed1a::1","TCP","86","[TCP Window Update] 54978  >  443 [ACK] Seq=1453 Ack=148807 Win=2583 Len=0 TSval=2149407271 TSecr=705215614"
"175","2.200237","2620:0:861:ed1a::1","2600:8805:3803:6100:c100:e220:6ae:755","TCP","1514","443  >  54978 [ACK] Seq=148807 Ack=1453 Win=83 Len=1428 TSval=705215615 TSecr=2149407242 [TCP segment of a reassembled PDU]"
"176","2.200767","2620:0:861:ed1a::1","2600:8805:3803:6100:c100:e220:6ae:755","TCP","1514","443  >  54978 [ACK] Seq=150235 Ack=1453 Win=83 Len=1428 TSval=705215615 TSecr=2149407242 [TCP segment of a reassembled PDU]"
"177","2.200768","2620:0:861:ed1a::1","2600:8805:3803:6100:c100:e220:6ae:755","TLSv1.2","1514","Application Data"
"178","2.200768","2620:0:861:ed1a::1","2600:8805:3803:6100:c100:e220:6ae:755","TCP","1514","443  >  54978 [PSH, ACK] Seq=153091 Ack=1453 Win=83 Len=1428 TSval=705215615 TSecr=2149407242 [TCP segment of a reassembled PDU]"
"179","2.200804","2600:8805:3803:6100:c100:e220:6ae:755","2620:0:861:ed1a::1","TCP","86","54978  >  443 [ACK] Seq=1453 Ack=154519 Win=2516 Len=0 TSval=2149407271 TSecr=705215615"
"180","2.200847","2600:8805:3803:6100:c100:e220:6ae:755","2620:0:861:ed1a::1","TCP","86","[TCP Window Update] 54978  >  443 [ACK] Seq=1453 Ack=154519 Win=2583 Len=0 TSval=2149407271 TSecr=705215615"
"181","2.202263","2620:0:861:ed1a::1","2600:8805:3803:6100:c100:e220:6ae:755","TCP","1514","443  >  54978 [ACK] Seq=154519 Ack=1453 Win=83 Len=1428 TSval=705215616 TSecr=2149407242 [TCP segment of a reassembled PDU]"
"182","2.202263","2620:0:861:ed1a::1","2600:8805:3803:6100:c100:e220:6ae:755","TCP","1514","443  >  54978 [ACK] Seq=155947 Ack=1453 Win=83 Len=1428 TSval=705215616 TSecr=2149407242 [TCP segment of a reassembled PDU]"
"183","2.202264","2620:0:861:ed1a::1","2600:8805:3803:6100:c100:e220:6ae:755","TCP","1514","443  >  54978 [ACK] Seq=157375 Ack=1453 Win=83 Len=1428 TSval=705215616 TSecr=2149407242 [TCP segment of a reassembled PDU]"
"184","2.202264","2620:0:861:ed1a::1","2600:8805:3803:6100:c100:e220:6ae:755","TCP","1514","443  >  54978 [PSH, ACK] Seq=158803 Ack=1453 Win=83 Len=1428 TSval=705215616 TSecr=2149407242 [TCP segment of a reassembled PDU]"
"185","2.202265","2620:0:861:ed1a::1","2600:8805:3803:6100:c100:e220:6ae:755","TCP","1514","443  >  54978 [ACK] Seq=160231 Ack=1453 Win=83 Len=1428 TSval=705215617 TSecr=2149407242 [TCP segment of a reassembled PDU]"
"186","2.202322","2600:8805:3803:6100:c100:e220:6ae:755","2620:0:861:ed1a::1","TCP","86","54978  >  443 [ACK] Seq=1453 Ack=161659 Win=2471 Len=0 TSval=2149407273 TSecr=705215617"
"187","2.202412","2600:8805:3803:6100:c100:e220:6ae:755","2620:0:861:ed1a::1","TCP","86","[TCP Window Update] 54978  >  443 [ACK] Seq=1453 Ack=161659 Win=2583 Len=0 TSval=2149407273 TSecr=705215617"
"188","2.203223","2620:0:861:ed1a::1","2600:8805:3803:6100:c100:e220:6ae:755","TCP","1514","443  >  54978 [ACK] Seq=161659 Ack=1453 Win=83 Len=1428 TSval=705215617 TSecr=2149407242 [TCP segment of a reassembled PDU]"
"189","2.203224","2620:0:861:ed1a::1","2600:8805:3803:6100:c100:e220:6ae:755","TCP","1514","443  >  54978 [ACK] Seq=163087 Ack=1453 Win=83 Len=1428 TSval=705215617 TSecr=2149407242 [TCP segment of a reassembled PDU]"
"190","2.203224","2620:0:861:ed1a::1","2600:8805:3803:6100:c100:e220:6ae:755","TCP","1514","443  >  54978 [PSH, ACK] Seq=164515 Ack=1453 Win=83 Len=1428 TSval=705215617 TSecr=2149407242 [TCP segment of a reassembled PDU]"
"191","2.203327","2600:8805:3803:6100:c100:e220:6ae:755","2620:0:861:ed1a::1","TCP","86","54978  >  443 [ACK] Seq=1453 Ack=165943 Win=2516 Len=0 TSval=2149407273 TSecr=705215617"
"192","2.203425","2600:8805:3803:6100:c100:e220:6ae:755","2620:0:861:ed1a::1","TCP","86","[TCP Window Update] 54978  >  443 [ACK] Seq=1453 Ack=165943 Win=2583 Len=0 TSval=2149407274 TSecr=705215617"
"193","2.204146","2620:0:861:ed1a::1","2600:8805:3803:6100:c100:e220:6ae:755","TCP","1514","443  >  54978 [ACK] Seq=165943 Ack=1453 Win=83 Len=1428 TSval=705215618 TSecr=2149407242 [TCP segment of a reassembled PDU]"
"194","2.204146","2620:0:861:ed1a::1","2600:8805:3803:6100:c100:e220:6ae:755","TLSv1.2","1514","Application Data"
"195","2.204147","2620:0:861:ed1a::1","2600:8805:3803:6100:c100:e220:6ae:755","TCP","1514","443  >  54978 [ACK] Seq=168799 Ack=1453 Win=83 Len=1428 TSval=705215618 TSecr=2149407242 [TCP segment of a reassembled PDU]"
"196","2.204147","2620:0:861:ed1a::1","2600:8805:3803:6100:c100:e220:6ae:755","TCP","1514","443  >  54978 [PSH, ACK] Seq=170227 Ack=1453 Win=83 Len=1428 TSval=705215618 TSecr=2149407242 [TCP segment of a reassembled PDU]"
"197","2.204148","2620:0:861:ed1a::1","2600:8805:3803:6100:c100:e220:6ae:755","TCP","1514","443  >  54978 [ACK] Seq=171655 Ack=1453 Win=83 Len=1428 TSval=705215619 TSecr=2149407242 [TCP segment of a reassembled PDU]"
"198","2.204211","2600:8805:3803:6100:c100:e220:6ae:755","2620:0:861:ed1a::1","TCP","86","54978  >  443 [ACK] Seq=1453 Ack=173083 Win=2471 Len=0 TSval=2149407274 TSecr=705215619"
"199","2.204486","2600:8805:3803:6100:c100:e220:6ae:755","2620:0:861:ed1a::1","TCP","86","[TCP Window Update] 54978  >  443 [ACK] Seq=1453 Ack=173083 Win=2583 Len=0 TSval=2149407275 TSecr=705215619"
"200","2.204577","2620:0:861:ed1a::1","2600:8805:3803:6100:c100:e220:6ae:755","TCP","1514","443  >  54978 [ACK] Seq=173083 Ack=1453 Win=83 Len=1428 TSval=705215619 TSecr=2149407242 [TCP segment of a reassembled PDU]"
"201","2.204578","2620:0:861:ed1a::1","2600:8805:3803:6100:c100:e220:6ae:755","TCP","1514","443  >  54978 [ACK] Seq=174511 Ack=1453 Win=83 Len=1428 TSval=705215619 TSecr=2149407242 [TCP segment of a reassembled PDU]"
"202","2.204578","2620:0:861:ed1a::1","2600:8805:3803:6100:c100:e220:6ae:755","TCP","1514","443  >  54978 [PSH, ACK] Seq=175939 Ack=1453 Win=83 Len=1428 TSval=705215619 TSecr=2149407242 [TCP segment of a reassembled PDU]"
"203","2.204605","2600:8805:3803:6100:c100:e220:6ae:755","2620:0:861:ed1a::1","TCP","86","54978  >  443 [ACK] Seq=1453 Ack=177367 Win=2516 Len=0 TSval=2149407275 TSecr=705215619"
"204","2.204888","2600:8805:3803:6100:c100:e220:6ae:755","2620:0:861:ed1a::1","TCP","86","[TCP Window Update] 54978  >  443 [ACK] Seq=1453 Ack=177367 Win=2583 Len=0 TSval=2149407275 TSecr=705215619"
"205","2.204958","2620:0:861:ed1a::1","2600:8805:3803:6100:c100:e220:6ae:755","TCP","1514","443  >  54978 [ACK] Seq=177367 Ack=1453 Win=83 Len=1428 TSval=705215619 TSecr=2149407242 [TCP segment of a reassembled PDU]"
