"No.","Time","Source","Destination","Protocol","Length","Info"
"1","0.000000","2600:8805:3803:6100:357c:4644:40b6:e846","2620:0:861:ed1a::1","TLSv1.2","213","Application Data"
"2","0.000082","2600:8805:3803:6100:357c:4644:40b6:e846","2620:0:861:ed1a::1","TLSv1.2","125","Application Data"
"3","0.021209","2620:0:861:ed1a::1","2600:8805:3803:6100:357c:4644:40b6:e846","TCP","86","443  >  51704 [ACK] Seq=1 Ack=167 Win=122 Len=0 TSval=2878032731 TSecr=3262635046"
"4","0.021210","2620:0:861:ed1a::1","2600:8805:3803:6100:357c:4644:40b6:e846","TLSv1.2","125","Application Data"
"5","0.021357","2600:8805:3803:6100:357c:4644:40b6:e846","2620:0:861:ed1a::1","TCP","86","51704  >  443 [ACK] Seq=167 Ack=40 Win=7960 Len=0 TSval=3262635067 TSecr=2878032731"
"6","0.077700","2600:8805:3803:6100:357c:4644:40b6:e846","2620:0:861:ed1a::1","TLSv1.2","165","Application Data"
"7","0.101056","2620:0:861:ed1a::1","2600:8805:3803:6100:357c:4644:40b6:e846","TLSv1.2","1229","Application Data"
"8","0.101155","2600:8805:3803:6100:357c:4644:40b6:e846","2620:0:861:ed1a::1","TCP","86","51704  >  443 [ACK] Seq=246 Ack=1183 Win=7942 Len=0 TSval=3262635147 TSecr=2878032805"
"9","0.102524","2600:8805:3803:6100:357c:4644:40b6:e846","2620:0:861:ed1a::1","TLSv1.2","121","Application Data"
"10","0.103070","2620:0:861:ed1a::1","2600:8805:3803:6100:357c:4644:40b6:e846","TCP","1514","443  >  51704 [ACK] Seq=1183 Ack=246 Win=122 Len=1428 TSval=2878032813 TSecr=3262635124 [TCP segment of a reassembled PDU]"
"11","0.103133","2600:8805:3803:6100:357c:4644:40b6:e846","2620:0:861:ed1a::1","TCP","86","51704  >  443 [ACK] Seq=281 Ack=2611 Win=7938 Len=0 TSval=3262635148 TSecr=2878032813"
"12","0.104644","2620:0:861:ed1a::1","2600:8805:3803:6100:357c:4644:40b6:e846","TCP","1514","443  >  51704 [ACK] Seq=2611 Ack=246 Win=122 Len=1428 TSval=2878032813 TSecr=3262635124 [TCP segment of a reassembled PDU]"
"13","0.104646","2620:0:861:ed1a::1","2600:8805:3803:6100:357c:4644:40b6:e846","TCP","1514","443  >  51704 [ACK] Seq=4039 Ack=246 Win=122 Len=1428 TSval=2878032813 TSecr=3262635124 [TCP segment of a reassembled PDU]"
"14","0.104646","2620:0:861:ed1a::1","2600:8805:3803:6100:357c:4644:40b6:e846","TCP","1514","443  >  51704 [ACK] Seq=5467 Ack=246 Win=122 Len=1428 TSval=2878032813 TSecr=3262635124 [TCP segment of a reassembled PDU]"
"15","0.104647","2620:0:861:ed1a::1","2600:8805:3803:6100:357c:4644:40b6:e846","TCP","1514","443  >  51704 [ACK] Seq=6895 Ack=246 Win=122 Len=1428 TSval=2878032813 TSecr=3262635124 [TCP segment of a reassembled PDU]"
"16","0.104648","2620:0:861:ed1a::1","2600:8805:3803:6100:357c:4644:40b6:e846","TCP","1514","443  >  51704 [ACK] Seq=8323 Ack=246 Win=122 Len=1428 TSval=2878032813 TSecr=3262635124 [TCP segment of a reassembled PDU]"
"17","0.104648","2620:0:861:ed1a::1","2600:8805:3803:6100:357c:4644:40b6:e846","TCP","1514","443  >  51704 [ACK] Seq=9751 Ack=246 Win=122 Len=1428 TSval=2878032813 TSecr=3262635124 [TCP segment of a reassembled PDU]"
"18","0.104649","2620:0:861:ed1a::1","2600:8805:3803:6100:357c:4644:40b6:e846","TCP","1514","443  >  51704 [ACK] Seq=11179 Ack=246 Win=122 Len=1428 TSval=2878032813 TSecr=3262635124 [TCP segment of a reassembled PDU]"
"19","0.104650","2620:0:861:ed1a::1","2600:8805:3803:6100:357c:4644:40b6:e846","TCP","1514","443  >  51704 [ACK] Seq=12607 Ack=246 Win=122 Len=1428 TSval=2878032813 TSecr=3262635124 [TCP segment of a reassembled PDU]"
"20","0.104650","2620:0:861:ed1a::1","2600:8805:3803:6100:357c:4644:40b6:e846","TCP","1514","443  >  51704 [ACK] Seq=14035 Ack=246 Win=122 Len=1428 TSval=2878032813 TSecr=3262635124 [TCP segment of a reassembled PDU]"
"21","0.104651","2620:0:861:ed1a::1","2600:8805:3803:6100:357c:4644:40b6:e846","TCP","1514","443  >  51704 [ACK] Seq=15463 Ack=246 Win=122 Len=1428 TSval=2878032813 TSecr=3262635124 [TCP segment of a reassembled PDU]"
"22","0.104651","2620:0:861:ed1a::1","2600:8805:3803:6100:357c:4644:40b6:e846","TLSv1.2","711","Application Data"
"23","0.104733","2600:8805:3803:6100:357c:4644:40b6:e846","2620:0:861:ed1a::1","TCP","86","51704  >  443 [ACK] Seq=281 Ack=17516 Win=7727 Len=0 TSval=3262635151 TSecr=2878032813"
"24","0.104858","2600:8805:3803:6100:357c:4644:40b6:e846","2620:0:861:ed1a::1","TCP","86","[TCP Window Update] 51704  >  443 [ACK] Seq=281 Ack=17516 Win=7960 Len=0 TSval=3262635151 TSecr=2878032813"
"25","0.105824","2620:0:861:ed1a::1","2600:8805:3803:6100:357c:4644:40b6:e846","TCP","1514","443  >  51704 [ACK] Seq=17516 Ack=246 Win=122 Len=1428 TSval=2878032813 TSecr=3262635124 [TCP segment of a reassembled PDU]"
"26","0.105825","2620:0:861:ed1a::1","2600:8805:3803:6100:357c:4644:40b6:e846","TCP","1514","443  >  51704 [ACK] Seq=18944 Ack=246 Win=122 Len=1428 TSval=2878032813 TSecr=3262635124 [TCP segment of a reassembled PDU]"
"27","0.105825","2620:0:861:ed1a::1","2600:8805:3803:6100:357c:4644:40b6:e846","TCP","1514","443  >  51704 [ACK] Seq=20372 Ack=246 Win=122 Len=1428 TSval=2878032813 TSecr=3262635124 [TCP segment of a reassembled PDU]"
"28","0.105826","2620:0:861:ed1a::1","2600:8805:3803:6100:357c:4644:40b6:e846","TCP","1514","443  >  51704 [ACK] Seq=21800 Ack=246 Win=122 Len=1428 TSval=2878032813 TSecr=3262635124 [TCP segment of a reassembled PDU]"
"29","0.105827","2620:0:861:ed1a::1","2600:8805:3803:6100:357c:4644:40b6:e846","TCP","1514","443  >  51704 [ACK] Seq=23228 Ack=246 Win=122 Len=1428 TSval=2878032813 TSecr=3262635124 [TCP segment of a reassembled PDU]"
"30","0.105827","2620:0:861:ed1a::1","2600:8805:3803:6100:357c:4644:40b6:e846","TCP","1514","443  >  51704 [ACK] Seq=24656 Ack=246 Win=122 Len=1428 TSval=2878032813 TSecr=3262635124 [TCP segment of a reassembled PDU]"
"31","0.105827","2620:0:861:ed1a::1","2600:8805:3803:6100:357c:4644:40b6:e846","TCP","1514","443  >  51704 [ACK] Seq=26084 Ack=246 Win=122 Len=1428 TSval=2878032813 TSecr=3262635124 [TCP segment of a reassembled PDU]"
"32","0.105828","2620:0:861:ed1a::1","2600:8805:3803:6100:357c:4644:40b6:e846","TCP","1514","443  >  51704 [ACK] Seq=27512 Ack=246 Win=122 Len=1428 TSval=2878032813 TSecr=3262635124 [TCP segment of a reassembled PDU]"
"33","0.105829","2620:0:861:ed1a::1","2600:8805:3803:6100:357c:4644:40b6:e846","TCP","1514","443  >  51704 [ACK] Seq=28940 Ack=246 Win=122 Len=1428 TSval=2878032813 TSecr=3262635124 [TCP segment of a reassembled PDU]"
"34","0.105830","2620:0:861:ed1a::1","2600:8805:3803:6100:357c:4644:40b6:e846","TCP","1514","443  >  51704 [ACK] Seq=30368 Ack=246 Win=122 Len=1428 TSval=2878032813 TSecr=3262635124 [TCP segment of a reassembled PDU]"
"35","0.105830","2620:0:861:ed1a::1","2600:8805:3803:6100:357c:4644:40b6:e846","TCP","1514","443  >  51704 [ACK] Seq=31796 Ack=246 Win=122 Len=1428 TSval=2878032813 TSecr=3262635124 [TCP segment of a reassembled PDU]"
"36","0.105830","2620:0:861:ed1a::1","2600:8805:3803:6100:357c:4644:40b6:e846","TLSv1.2","729","Application Data"
"37","0.105831","2620:0:861:ed1a::1","2600:8805:3803:6100:357c:4644:40b6:e846","TCP","1514","443  >  51704 [ACK] Seq=33867 Ack=246 Win=122 Len=1428 TSval=2878032814 TSecr=3262635124 [TCP segment of a reassembled PDU]"
"38","0.105832","2620:0:861:ed1a::1","2600:8805:3803:6100:357c:4644:40b6:e846","TCP","1514","443  >  51704 [ACK] Seq=35295 Ack=246 Win=122 Len=1428 TSval=2878032814 TSecr=3262635124 [TCP segment of a reassembled PDU]"
"39","0.105832","2620:0:861:ed1a::1","2600:8805:3803:6100:357c:4644:40b6:e846","TCP","1514","443  >  51704 [ACK] Seq=36723 Ack=246 Win=122 Len=1428 TSval=2878032814 TSecr=3262635124 [TCP segment of a reassembled PDU]"
"40","0.105833","2620:0:861:ed1a::1","2600:8805:3803:6100:357c:4644:40b6:e846","TCP","1514","443  >  51704 [ACK] Seq=38151 Ack=246 Win=122 Len=1428 TSval=2878032814 TSecr=3262635124 [TCP segment of a reassembled PDU]"
"41","0.105833","2620:0:861:ed1a::1","2600:8805:3803:6100:357c:4644:40b6:e846","TCP","1514","443  >  51704 [ACK] Seq=39579 Ack=246 Win=122 Len=1428 TSval=2878032814 TSecr=3262635124 [TCP segment of a reassembled PDU]"
"42","0.105833","2620:0:861:ed1a::1","2600:8805:3803:6100:357c:4644:40b6:e846","TLSv1.2","237","Application Data"
"43","0.105928","2600:8805:3803:6100:357c:4644:40b6:e846","2620:0:861:ed1a::1","TCP","86","51704  >  443 [ACK] Seq=281 Ack=33224 Win=7715 Len=0 TSval=3262635152 TSecr=2878032813"
"44","0.105961","2600:8805:3803:6100:357c:4644:40b6:e846","2620:0:861:ed1a::1","TCP","86","51704  >  443 [ACK] Seq=281 Ack=41158 Win=7591 Len=0 TSval=3262635152 TSecr=2878032814"
"45","0.106051","2600:8805:3803:6100:357c:4644:40b6:e846","2620:0:861:ed1a::1","TCP","86","[TCP Window Update] 51704  >  443 [ACK] Seq=281 Ack=41158 Win=7960 Len=0 TSval=3262635152 TSecr=2878032814"
"46","0.170115","2620:0:861:ed1a::1","2600:8805:3803:6100:357c:4644:40b6:e846","TCP","86","443  >  51704 [ACK] Seq=41158 Ack=281 Win=122 Len=0 TSval=2878032880 TSecr=3262635148"
"47","0.183055","2620:0:861:ed1a::1","2600:8805:3803:6100:357c:4644:40b6:e846","TLSv1.2","1460","Application Data"
"48","0.183129","2600:8805:3803:6100:357c:4644:40b6:e846","2620:0:861:ed1a::1","TCP","86","51704  >  443 [ACK] Seq=281 Ack=42532 Win=7939 Len=0 TSval=3262635228 TSecr=2878032893"
"49","0.750636","2600:8805:3803:6100:357c:4644:40b6:e846","2620:0:861:ed1a::1","TLSv1.2","410","Application Data"
"50","0.755722","2600:8805:3803:6100:357c:4644:40b6:e846","2620:0:861:ed1a::1","TLSv1.2","215","Application Data"
"51","0.766346","2620:0:861:ed1a::1","2600:8805:3803:6100:357c:4644:40b6:e846","TCP","86","443  >  51704 [ACK] Seq=42532 Ack=605 Win=128 Len=0 TSval=2878033476 TSecr=3262635797"
"52","0.767108","2620:0:861:ed1a::1","2600:8805:3803:6100:357c:4644:40b6:e846","TLSv1.2","937","Application Data"
"53","0.767154","2600:8805:3803:6100:357c:4644:40b6:e846","2620:0:861:ed1a::1","TCP","86","51704  >  443 [ACK] Seq=734 Ack=43383 Win=7947 Len=0 TSval=3262635812 TSecr=2878033477"
"54","0.767541","2600:8805:3803:6100:357c:4644:40b6:e846","2620:0:861:ed1a::1","TLSv1.2","121","Application Data"
"55","0.771914","2620:0:861:ed1a::1","2600:8805:3803:6100:357c:4644:40b6:e846","TCP","1514","443  >  51704 [ACK] Seq=43383 Ack=734 Win=133 Len=1428 TSval=2878033482 TSecr=3262635802 [TCP segment of a reassembled PDU]"
"56","0.771979","2600:8805:3803:6100:357c:4644:40b6:e846","2620:0:861:ed1a::1","TCP","86","51704  >  443 [ACK] Seq=769 Ack=44811 Win=7938 Len=0 TSval=3262635818 TSecr=2878033482"
"57","0.773935","2620:0:861:ed1a::1","2600:8805:3803:6100:357c:4644:40b6:e846","TCP","1514","443  >  51704 [ACK] Seq=44811 Ack=734 Win=133 Len=1428 TSval=2878033482 TSecr=3262635802 [TCP segment of a reassembled PDU]"
"58","0.773936","2620:0:861:ed1a::1","2600:8805:3803:6100:357c:4644:40b6:e846","TCP","1514","443  >  51704 [ACK] Seq=46239 Ack=734 Win=133 Len=1428 TSval=2878033482 TSecr=3262635802 [TCP segment of a reassembled PDU]"
"59","0.773937","2620:0:861:ed1a::1","2600:8805:3803:6100:357c:4644:40b6:e846","TCP","1514","443  >  51704 [ACK] Seq=47667 Ack=734 Win=133 Len=1428 TSval=2878033482 TSecr=3262635802 [TCP segment of a reassembled PDU]"
"60","0.773937","2620:0:861:ed1a::1","2600:8805:3803:6100:357c:4644:40b6:e846","TCP","1514","443  >  51704 [ACK] Seq=49095 Ack=734 Win=133 Len=1428 TSval=2878033482 TSecr=3262635802 [TCP segment of a reassembled PDU]"
"61","0.773938","2620:0:861:ed1a::1","2600:8805:3803:6100:357c:4644:40b6:e846","TCP","1514","443  >  51704 [ACK] Seq=50523 Ack=734 Win=133 Len=1428 TSval=2878033482 TSecr=3262635802 [TCP segment of a reassembled PDU]"
"62","0.773938","2620:0:861:ed1a::1","2600:8805:3803:6100:357c:4644:40b6:e846","TCP","1514","443  >  51704 [ACK] Seq=51951 Ack=734 Win=133 Len=1428 TSval=2878033482 TSecr=3262635802 [TCP segment of a reassembled PDU]"
"63","0.773939","2620:0:861:ed1a::1","2600:8805:3803:6100:357c:4644:40b6:e846","TCP","1514","443  >  51704 [ACK] Seq=53379 Ack=734 Win=133 Len=1428 TSval=2878033482 TSecr=3262635802 [TCP segment of a reassembled PDU]"
"64","0.773939","2620:0:861:ed1a::1","2600:8805:3803:6100:357c:4644:40b6:e846","TCP","1514","443  >  51704 [ACK] Seq=54807 Ack=734 Win=133 Len=1428 TSval=2878033482 TSecr=3262635802 [TCP segment of a reassembled PDU]"
"65","0.773940","2620:0:861:ed1a::1","2600:8805:3803:6100:357c:4644:40b6:e846","TCP","1514","443  >  51704 [ACK] Seq=56235 Ack=734 Win=133 Len=1428 TSval=2878033482 TSecr=3262635802 [TCP segment of a reassembled PDU]"
"66","0.773941","2620:0:861:ed1a::1","2600:8805:3803:6100:357c:4644:40b6:e846","TLSv1.2","489","Application Data"
"67","0.773941","2620:0:861:ed1a::1","2600:8805:3803:6100:357c:4644:40b6:e846","TCP","1514","443  >  51704 [ACK] Seq=58066 Ack=734 Win=133 Len=1428 TSval=2878033482 TSecr=3262635802 [TCP segment of a reassembled PDU]"
"68","0.773941","2620:0:861:ed1a::1","2600:8805:3803:6100:357c:4644:40b6:e846","TCP","1514","443  >  51704 [ACK] Seq=59494 Ack=734 Win=133 Len=1428 TSval=2878033482 TSecr=3262635802 [TCP segment of a reassembled PDU]"
"69","0.773942","2620:0:861:ed1a::1","2600:8805:3803:6100:357c:4644:40b6:e846","TCP","1514","443  >  51704 [ACK] Seq=60922 Ack=734 Win=133 Len=1428 TSval=2878033482 TSecr=3262635802 [TCP segment of a reassembled PDU]"
"70","0.773942","2620:0:861:ed1a::1","2600:8805:3803:6100:357c:4644:40b6:e846","TCP","1514","443  >  51704 [ACK] Seq=62350 Ack=734 Win=133 Len=1428 TSval=2878033482 TSecr=3262635802 [TCP segment of a reassembled PDU]"
"71","0.773943","2620:0:861:ed1a::1","2600:8805:3803:6100:357c:4644:40b6:e846","TLSv1.2","604","Application Data"
"72","0.774058","2600:8805:3803:6100:357c:4644:40b6:e846","2620:0:861:ed1a::1","TCP","86","51704  >  443 [ACK] Seq=769 Ack=60922 Win=7709 Len=0 TSval=3262635820 TSecr=2878033482"
"73","0.774113","2600:8805:3803:6100:357c:4644:40b6:e846","2620:0:861:ed1a::1","TCP","86","51704  >  443 [ACK] Seq=769 Ack=64296 Win=7656 Len=0 TSval=3262635820 TSecr=2878033482"
"74","0.774651","2600:8805:3803:6100:357c:4644:40b6:e846","2620:0:861:ed1a::1","TCP","86","[TCP Window Update] 51704  >  443 [ACK] Seq=769 Ack=64296 Win=7960 Len=0 TSval=3262635820 TSecr=2878033482"
"75","0.833773","2620:0:861:ed1a::1","2600:8805:3803:6100:357c:4644:40b6:e846","TCP","86","443  >  51704 [ACK] Seq=64296 Ack=769 Win=133 Len=0 TSval=2878033544 TSecr=3262635802"
"76","1.385009","2600:8805:3803:6100:357c:4644:40b6:e846","2620:0:861:ed1a::1","TLSv1.2","210","Application Data"
"77","1.402778","2620:0:861:ed1a::1","2600:8805:3803:6100:357c:4644:40b6:e846","TCP","86","443  >  51704 [ACK] Seq=64296 Ack=893 Win=133 Len=0 TSval=2878034111 TSecr=3262636431"
"78","1.404210","2620:0:861:ed1a::1","2600:8805:3803:6100:357c:4644:40b6:e846","TCP","1514","443  >  51704 [ACK] Seq=64296 Ack=893 Win=133 Len=1428 TSval=2878034111 TSecr=3262636431 [TCP segment of a reassembled PDU]"
"79","1.404211","2620:0:861:ed1a::1","2600:8805:3803:6100:357c:4644:40b6:e846","TCP","1514","443  >  51704 [ACK] Seq=65724 Ack=893 Win=133 Len=1428 TSval=2878034111 TSecr=3262636431 [TCP segment of a reassembled PDU]"
"80","1.404213","2620:0:861:ed1a::1","2600:8805:3803:6100:357c:4644:40b6:e846","TCP","1514","443  >  51704 [ACK] Seq=67152 Ack=893 Win=133 Len=1428 TSval=2878034111 TSecr=3262636431 [TCP segment of a reassembled PDU]"
"81","1.404213","2620:0:861:ed1a::1","2600:8805:3803:6100:357c:4644:40b6:e846","TCP","1514","443  >  51704 [ACK] Seq=68580 Ack=893 Win=133 Len=1428 TSval=2878034111 TSecr=3262636431 [TCP segment of a reassembled PDU]"
"82","1.404214","2620:0:861:ed1a::1","2600:8805:3803:6100:357c:4644:40b6:e846","TCP","1514","443  >  51704 [ACK] Seq=70008 Ack=893 Win=133 Len=1428 TSval=2878034111 TSecr=3262636431 [TCP segment of a reassembled PDU]"
"83","1.404214","2620:0:861:ed1a::1","2600:8805:3803:6100:357c:4644:40b6:e846","TCP","1514","443  >  51704 [ACK] Seq=71436 Ack=893 Win=133 Len=1428 TSval=2878034111 TSecr=3262636431 [TCP segment of a reassembled PDU]"
"84","1.404215","2620:0:861:ed1a::1","2600:8805:3803:6100:357c:4644:40b6:e846","TCP","1514","443  >  51704 [ACK] Seq=72864 Ack=893 Win=133 Len=1428 TSval=2878034111 TSecr=3262636431 [TCP segment of a reassembled PDU]"
"85","1.404215","2620:0:861:ed1a::1","2600:8805:3803:6100:357c:4644:40b6:e846","TCP","1514","443  >  51704 [ACK] Seq=74292 Ack=893 Win=133 Len=1428 TSval=2878034111 TSecr=3262636431 [TCP segment of a reassembled PDU]"
"86","1.404215","2620:0:861:ed1a::1","2600:8805:3803:6100:357c:4644:40b6:e846","TCP","1514","443  >  51704 [ACK] Seq=75720 Ack=893 Win=133 Len=1428 TSval=2878034111 TSecr=3262636431 [TCP segment of a reassembled PDU]"
"87","1.404216","2620:0:861:ed1a::1","2600:8805:3803:6100:357c:4644:40b6:e846","TCP","1514","443  >  51704 [ACK] Seq=77148 Ack=893 Win=133 Len=1428 TSval=2878034111 TSecr=3262636431 [TCP segment of a reassembled PDU]"
"88","1.404216","2620:0:861:ed1a::1","2600:8805:3803:6100:357c:4644:40b6:e846","TLSv1.2","429","Application Data"
"89","1.404216","2620:0:861:ed1a::1","2600:8805:3803:6100:357c:4644:40b6:e846","TCP","1514","443  >  51704 [ACK] Seq=78919 Ack=893 Win=133 Len=1428 TSval=2878034112 TSecr=3262636431 [TCP segment of a reassembled PDU]"
"90","1.404217","2620:0:861:ed1a::1","2600:8805:3803:6100:357c:4644:40b6:e846","TCP","1514","443  >  51704 [ACK] Seq=80347 Ack=893 Win=133 Len=1428 TSval=2878034112 TSecr=3262636431 [TCP segment of a reassembled PDU]"
"91","1.404217","2620:0:861:ed1a::1","2600:8805:3803:6100:357c:4644:40b6:e846","TCP","1514","443  >  51704 [ACK] Seq=81775 Ack=893 Win=133 Len=1428 TSval=2878034112 TSecr=3262636431 [TCP segment of a reassembled PDU]"
"92","1.404218","2620:0:861:ed1a::1","2600:8805:3803:6100:357c:4644:40b6:e846","TCP","1514","443  >  51704 [ACK] Seq=83203 Ack=893 Win=133 Len=1428 TSval=2878034112 TSecr=3262636431 [TCP segment of a reassembled PDU]"
"93","1.404218","2620:0:861:ed1a::1","2600:8805:3803:6100:357c:4644:40b6:e846","TCP","1514","443  >  51704 [ACK] Seq=84631 Ack=893 Win=133 Len=1428 TSval=2878034112 TSecr=3262636431 [TCP segment of a reassembled PDU]"
"94","1.404219","2620:0:861:ed1a::1","2600:8805:3803:6100:357c:4644:40b6:e846","TCP","1514","443  >  51704 [ACK] Seq=86059 Ack=893 Win=133 Len=1428 TSval=2878034112 TSecr=3262636431 [TCP segment of a reassembled PDU]"
"95","1.404219","2620:0:861:ed1a::1","2600:8805:3803:6100:357c:4644:40b6:e846","TCP","1514","443  >  51704 [ACK] Seq=87487 Ack=893 Win=133 Len=1428 TSval=2878034112 TSecr=3262636431 [TCP segment of a reassembled PDU]"
"96","1.404219","2620:0:861:ed1a::1","2600:8805:3803:6100:357c:4644:40b6:e846","TCP","1514","443  >  51704 [ACK] Seq=88915 Ack=893 Win=133 Len=1428 TSval=2878034112 TSecr=3262636431 [TCP segment of a reassembled PDU]"
"97","1.404220","2620:0:861:ed1a::1","2600:8805:3803:6100:357c:4644:40b6:e846","TCP","1514","443  >  51704 [ACK] Seq=90343 Ack=893 Win=133 Len=1428 TSval=2878034112 TSecr=3262636431 [TCP segment of a reassembled PDU]"
"98","1.404220","2620:0:861:ed1a::1","2600:8805:3803:6100:357c:4644:40b6:e846","TCP","1514","443  >  51704 [ACK] Seq=91771 Ack=893 Win=133 Len=1428 TSval=2878034112 TSecr=3262636431 [TCP segment of a reassembled PDU]"
"99","1.404220","2620:0:861:ed1a::1","2600:8805:3803:6100:357c:4644:40b6:e846","TCP","1514","443  >  51704 [ACK] Seq=93199 Ack=893 Win=133 Len=1428 TSval=2878034112 TSecr=3262636431 [TCP segment of a reassembled PDU]"
"100","1.404221","2620:0:861:ed1a::1","2600:8805:3803:6100:357c:4644:40b6:e846","TLSv1.2","729","Application Data"
"101","1.404221","2620:0:861:ed1a::1","2600:8805:3803:6100:357c:4644:40b6:e846","TCP","1514","443  >  51704 [ACK] Seq=95270 Ack=893 Win=133 Len=1428 TSval=2878034112 TSecr=3262636431 [TCP segment of a reassembled PDU]"
"102","1.404221","2620:0:861:ed1a::1","2600:8805:3803:6100:357c:4644:40b6:e846","TCP","1514","443  >  51704 [ACK] Seq=96698 Ack=893 Win=133 Len=1428 TSval=2878034112 TSecr=3262636431 [TCP segment of a reassembled PDU]"
"103","1.404222","2620:0:861:ed1a::1","2600:8805:3803:6100:357c:4644:40b6:e846","TCP","1514","443  >  51704 [ACK] Seq=98126 Ack=893 Win=133 Len=1428 TSval=2878034112 TSecr=3262636431 [TCP segment of a reassembled PDU]"
"104","1.404222","2620:0:861:ed1a::1","2600:8805:3803:6100:357c:4644:40b6:e846","TCP","1514","443  >  51704 [ACK] Seq=99554 Ack=893 Win=133 Len=1428 TSval=2878034112 TSecr=3262636431 [TCP segment of a reassembled PDU]"
"105","1.404223","2620:0:861:ed1a::1","2600:8805:3803:6100:357c:4644:40b6:e846","TCP","1514","443  >  51704 [ACK] Seq=100982 Ack=893 Win=133 Len=1428 TSval=2878034112 TSecr=3262636431 [TCP segment of a reassembled PDU]"
"106","1.404223","2620:0:861:ed1a::1","2600:8805:3803:6100:357c:4644:40b6:e846","TCP","1514","443  >  51704 [ACK] Seq=102410 Ack=893 Win=133 Len=1428 TSval=2878034112 TSecr=3262636431 [TCP segment of a reassembled PDU]"
"107","1.404223","2620:0:861:ed1a::1","2600:8805:3803:6100:357c:4644:40b6:e846","TCP","1514","443  >  51704 [ACK] Seq=103838 Ack=893 Win=133 Len=1428 TSval=2878034112 TSecr=3262636431 [TCP segment of a reassembled PDU]"
"108","1.404224","2620:0:861:ed1a::1","2600:8805:3803:6100:357c:4644:40b6:e846","TCP","1514","443  >  51704 [ACK] Seq=105266 Ack=893 Win=133 Len=1428 TSval=2878034112 TSecr=3262636431 [TCP segment of a reassembled PDU]"
"109","1.404224","2620:0:861:ed1a::1","2600:8805:3803:6100:357c:4644:40b6:e846","TCP","1514","443  >  51704 [ACK] Seq=106694 Ack=893 Win=133 Len=1428 TSval=2878034112 TSecr=3262636431 [TCP segment of a reassembled PDU]"
"110","1.404224","2620:0:861:ed1a::1","2600:8805:3803:6100:357c:4644:40b6:e846","TCP","1514","443  >  51704 [ACK] Seq=108122 Ack=893 Win=133 Len=1428 TSval=2878034112 TSecr=3262636431 [TCP segment of a reassembled PDU]"
"111","1.404225","2620:0:861:ed1a::1","2600:8805:3803:6100:357c:4644:40b6:e846","TCP","1514","443  >  51704 [ACK] Seq=109550 Ack=893 Win=133 Len=1428 TSval=2878034112 TSecr=3262636431 [TCP segment of a reassembled PDU]"
"112","1.404226","2620:0:861:ed1a::1","2600:8805:3803:6100:357c:4644:40b6:e846","TLSv1.2","729","Application Data"
"113","1.404226","2620:0:861:ed1a::1","2600:8805:3803:6100:357c:4644:40b6:e846","TCP","1514","443  >  51704 [ACK] Seq=111621 Ack=893 Win=133 Len=1428 TSval=2878034113 TSecr=3262636431 [TCP segment of a reassembled PDU]"
"114","1.404227","2620:0:861:ed1a::1","2600:8805:3803:6100:357c:4644:40b6:e846","TCP","1514","443  >  51704 [ACK] Seq=113049 Ack=893 Win=133 Len=1428 TSval=2878034113 TSecr=3262636431 [TCP segment of a reassembled PDU]"
"115","1.404227","2620:0:861:ed1a::1","2600:8805:3803:6100:357c:4644:40b6:e846","TCP","1514","443  >  51704 [ACK] Seq=114477 Ack=893 Win=133 Len=1428 TSval=2878034113 TSecr=3262636431 [TCP segment of a reassembled PDU]"
"116","1.404227","2620:0:861:ed1a::1","2600:8805:3803:6100:357c:4644:40b6:e846","TLSv1.2","662","Application Data"
"117","1.404314","2600:8805:3803:6100:357c:4644:40b6:e846","2620:0:861:ed1a::1","TCP","86","51704  >  443 [ACK] Seq=893 Ack=80347 Win=7710 Len=0 TSval=3262636450 TSecr=2878034112"
"118","1.404353","2600:8805:3803:6100:357c:4644:40b6:e846","2620:0:861:ed1a::1","TCP","86","51704  >  443 [ACK] Seq=893 Ack=95270 Win=7476 Len=0 TSval=3262636450 TSecr=2878034112"
"119","1.404364","2600:8805:3803:6100:357c:4644:40b6:e846","2620:0:861:ed1a::1","TCP","86","51704  >  443 [ACK] Seq=893 Ack=108122 Win=7276 Len=0 TSval=3262636450 TSecr=2878034112"
"120","1.404385","2600:8805:3803:6100:357c:4644:40b6:e846","2620:0:861:ed1a::1","TCP","86","51704  >  443 [ACK] Seq=893 Ack=116481 Win=7145 Len=0 TSval=3262636450 TSecr=2878034113"
"121","1.404807","2600:8805:3803:6100:357c:4644:40b6:e846","2620:0:861:ed1a::1","TCP","86","[TCP Window Update] 51704  >  443 [ACK] Seq=893 Ack=116481 Win=7960 Len=0 TSval=3262636450 TSecr=2878034113"
"122","2.166735","2600:8805:3803:6100:357c:4644:40b6:e846","2620:0:861:ed1a::1","TLSv1.2","264","Application Data"
"123","2.183375","2620:0:861:ed1a::1","2600:8805:3803:6100:357c:4644:40b6:e846","TCP","1514","443  >  51704 [ACK] Seq=116481 Ack=1071 Win=139 Len=1428 TSval=2878034893 TSecr=3262637213 [TCP segment of a reassembled PDU]"
"124","2.183475","2600:8805:3803:6100:357c:4644:40b6:e846","2620:0:861:ed1a::1","TCP","86","51704  >  443 [ACK] Seq=1071 Ack=117909 Win=7938 Len=0 TSval=3262637230 TSecr=2878034893"
"125","2.185001","2620:0:861:ed1a::1","2600:8805:3803:6100:357c:4644:40b6:e846","TCP","1514","443  >  51704 [ACK] Seq=117909 Ack=1071 Win=139 Len=1428 TSval=2878034893 TSecr=3262637213 [TCP segment of a reassembled PDU]"
"126","2.185002","2620:0:861:ed1a::1","2600:8805:3803:6100:357c:4644:40b6:e846","TCP","1514","443  >  51704 [ACK] Seq=119337 Ack=1071 Win=139 Len=1428 TSval=2878034893 TSecr=3262637213 [TCP segment of a reassembled PDU]"
"127","2.185002","2620:0:861:ed1a::1","2600:8805:3803:6100:357c:4644:40b6:e846","TCP","1514","443  >  51704 [ACK] Seq=120765 Ack=1071 Win=139 Len=1428 TSval=2878034893 TSecr=3262637213 [TCP segment of a reassembled PDU]"
"128","2.185002","2620:0:861:ed1a::1","2600:8805:3803:6100:357c:4644:40b6:e846","TCP","1514","443  >  51704 [ACK] Seq=122193 Ack=1071 Win=139 Len=1428 TSval=2878034893 TSecr=3262637213 [TCP segment of a reassembled PDU]"
"129","2.185003","2620:0:861:ed1a::1","2600:8805:3803:6100:357c:4644:40b6:e846","TCP","1514","443  >  51704 [ACK] Seq=123621 Ack=1071 Win=139 Len=1428 TSval=2878034893 TSecr=3262637213 [TCP segment of a reassembled PDU]"
"130","2.185008","2620:0:861:ed1a::1","2600:8805:3803:6100:357c:4644:40b6:e846","TCP","1514","443  >  51704 [ACK] Seq=125049 Ack=1071 Win=139 Len=1428 TSval=2878034893 TSecr=3262637213 [TCP segment of a reassembled PDU]"
"131","2.185008","2620:0:861:ed1a::1","2600:8805:3803:6100:357c:4644:40b6:e846","TCP","1514","443  >  51704 [ACK] Seq=126477 Ack=1071 Win=139 Len=1428 TSval=2878034893 TSecr=3262637213 [TCP segment of a reassembled PDU]"
"132","2.185009","2620:0:861:ed1a::1","2600:8805:3803:6100:357c:4644:40b6:e846","TCP","1514","443  >  51704 [ACK] Seq=127905 Ack=1071 Win=139 Len=1428 TSval=2878034893 TSecr=3262637213 [TCP segment of a reassembled PDU]"
"133","2.185009","2620:0:861:ed1a::1","2600:8805:3803:6100:357c:4644:40b6:e846","TCP","1514","443  >  51704 [ACK] Seq=129333 Ack=1071 Win=139 Len=1428 TSval=2878034893 TSecr=3262637213 [TCP segment of a reassembled PDU]"
"134","2.185010","2620:0:861:ed1a::1","2600:8805:3803:6100:357c:4644:40b6:e846","TLSv1.2","491","Application Data"
"135","2.185010","2620:0:861:ed1a::1","2600:8805:3803:6100:357c:4644:40b6:e846","TCP","1514","443  >  51704 [ACK] Seq=131166 Ack=1071 Win=139 Len=1428 TSval=2878034893 TSecr=3262637213 [TCP segment of a reassembled PDU]"
"136","2.185010","2620:0:861:ed1a::1","2600:8805:3803:6100:357c:4644:40b6:e846","TCP","1514","443  >  51704 [ACK] Seq=132594 Ack=1071 Win=139 Len=1428 TSval=2878034893 TSecr=3262637213 [TCP segment of a reassembled PDU]"
"137","2.185011","2620:0:861:ed1a::1","2600:8805:3803:6100:357c:4644:40b6:e846","TCP","1514","443  >  51704 [ACK] Seq=134022 Ack=1071 Win=139 Len=1428 TSval=2878034893 TSecr=3262637213 [TCP segment of a reassembled PDU]"
"138","2.185011","2620:0:861:ed1a::1","2600:8805:3803:6100:357c:4644:40b6:e846","TCP","1514","443  >  51704 [ACK] Seq=135450 Ack=1071 Win=139 Len=1428 TSval=2878034893 TSecr=3262637213 [TCP segment of a reassembled PDU]"
"139","2.185012","2620:0:861:ed1a::1","2600:8805:3803:6100:357c:4644:40b6:e846","TCP","1514","443  >  51704 [ACK] Seq=136878 Ack=1071 Win=139 Len=1428 TSval=2878034893 TSecr=3262637213 [TCP segment of a reassembled PDU]"
"140","2.185012","2620:0:861:ed1a::1","2600:8805:3803:6100:357c:4644:40b6:e846","TCP","1514","443  >  51704 [ACK] Seq=138306 Ack=1071 Win=139 Len=1428 TSval=2878034893 TSecr=3262637213 [TCP segment of a reassembled PDU]"
"141","2.185013","2620:0:861:ed1a::1","2600:8805:3803:6100:357c:4644:40b6:e846","TCP","1514","443  >  51704 [ACK] Seq=139734 Ack=1071 Win=139 Len=1428 TSval=2878034893 TSecr=3262637213 [TCP segment of a reassembled PDU]"
"142","2.185013","2620:0:861:ed1a::1","2600:8805:3803:6100:357c:4644:40b6:e846","TCP","1514","443  >  51704 [ACK] Seq=141162 Ack=1071 Win=139 Len=1428 TSval=2878034893 TSecr=3262637213 [TCP segment of a reassembled PDU]"
"143","2.185014","2620:0:861:ed1a::1","2600:8805:3803:6100:357c:4644:40b6:e846","TCP","1514","443  >  51704 [ACK] Seq=142590 Ack=1071 Win=139 Len=1428 TSval=2878034893 TSecr=3262637213 [TCP segment of a reassembled PDU]"
"144","2.185015","2620:0:861:ed1a::1","2600:8805:3803:6100:357c:4644:40b6:e846","TCP","1514","443  >  51704 [ACK] Seq=144018 Ack=1071 Win=139 Len=1428 TSval=2878034893 TSecr=3262637213 [TCP segment of a reassembled PDU]"
"145","2.185015","2620:0:861:ed1a::1","2600:8805:3803:6100:357c:4644:40b6:e846","TCP","1514","443  >  51704 [ACK] Seq=145446 Ack=1071 Win=139 Len=1428 TSval=2878034893 TSecr=3262637213 [TCP segment of a reassembled PDU]"
"146","2.185016","2620:0:861:ed1a::1","2600:8805:3803:6100:357c:4644:40b6:e846","TLSv1.2","729","Application Data"
"147","2.185092","2600:8805:3803:6100:357c:4644:40b6:e846","2620:0:861:ed1a::1","TCP","86","51704  >  443 [ACK] Seq=1071 Ack=134022 Win=7709 Len=0 TSval=3262637231 TSecr=2878034893"
"148","2.185141","2600:8805:3803:6100:357c:4644:40b6:e846","2620:0:861:ed1a::1","TCP","86","51704  >  443 [ACK] Seq=1071 Ack=147517 Win=7498 Len=0 TSval=3262637231 TSecr=2878034893"
"149","2.186022","2600:8805:3803:6100:357c:4644:40b6:e846","2620:0:861:ed1a::1","TCP","86","[TCP Window Update] 51704  >  443 [ACK] Seq=1071 Ack=147517 Win=7960 Len=0 TSval=3262637231 TSecr=2878034893"
"150","2.186876","2620:0:861:ed1a::1","2600:8805:3803:6100:357c:4644:40b6:e846","TCP","1514","443  >  51704 [ACK] Seq=147517 Ack=1071 Win=139 Len=1428 TSval=2878034894 TSecr=3262637213 [TCP segment of a reassembled PDU]"
"151","2.186877","2620:0:861:ed1a::1","2600:8805:3803:6100:357c:4644:40b6:e846","TCP","1514","443  >  51704 [ACK] Seq=148945 Ack=1071 Win=139 Len=1428 TSval=2878034894 TSecr=3262637213 [TCP segment of a reassembled PDU]"
"152","2.186878","2620:0:861:ed1a::1","2600:8805:3803:6100:357c:4644:40b6:e846","TCP","1514","443  >  51704 [ACK] Seq=150373 Ack=1071 Win=139 Len=1428 TSval=2878034894 TSecr=3262637213 [TCP segment of a reassembled PDU]"
"153","2.186878","2620:0:861:ed1a::1","2600:8805:3803:6100:357c:4644:40b6:e846","TCP","1514","443  >  51704 [ACK] Seq=151801 Ack=1071 Win=139 Len=1428 TSval=2878034894 TSecr=3262637213 [TCP segment of a reassembled PDU]"
"154","2.186879","2620:0:861:ed1a::1","2600:8805:3803:6100:357c:4644:40b6:e846","TCP","1514","443  >  51704 [ACK] Seq=153229 Ack=1071 Win=139 Len=1428 TSval=2878034894 TSecr=3262637213 [TCP segment of a reassembled PDU]"
"155","2.186879","2620:0:861:ed1a::1","2600:8805:3803:6100:357c:4644:40b6:e846","TCP","1514","443  >  51704 [ACK] Seq=154657 Ack=1071 Win=139 Len=1428 TSval=2878034894 TSecr=3262637213 [TCP segment of a reassembled PDU]"
"156","2.186880","2620:0:861:ed1a::1","2600:8805:3803:6100:357c:4644:40b6:e846","TCP","1514","443  >  51704 [ACK] Seq=156085 Ack=1071 Win=139 Len=1428 TSval=2878034894 TSecr=3262637213 [TCP segment of a reassembled PDU]"
"157","2.186880","2620:0:861:ed1a::1","2600:8805:3803:6100:357c:4644:40b6:e846","TLSv1.2","1481","Application Data"
"158","2.186937","2600:8805:3803:6100:357c:4644:40b6:e846","2620:0:861:ed1a::1","TCP","86","51704  >  443 [ACK] Seq=1071 Ack=158908 Win=7782 Len=0 TSval=3262637233 TSecr=2878034894"
"159","2.187647","2600:8805:3803:6100:357c:4644:40b6:e846","2620:0:861:ed1a::1","TCP","86","[TCP Window Update] 51704  >  443 [ACK] Seq=1071 Ack=158908 Win=7960 Len=0 TSval=3262637233 TSecr=2878034894"
"160","3.041411","2600:8805:3803:6100:357c:4644:40b6:e846","2620:0:861:ed1a::1","TLSv1.2","174","Application Data"
"161","3.062292","2620:0:861:ed1a::1","2600:8805:3803:6100:357c:4644:40b6:e846","TCP","1514","443  >  51704 [ACK] Seq=158908 Ack=1159 Win=139 Len=1428 TSval=2878035772 TSecr=3262638088 [TCP segment of a reassembled PDU]"
"162","3.062458","2600:8805:3803:6100:357c:4644:40b6:e846","2620:0:861:ed1a::1","TCP","86","51704  >  443 [ACK] Seq=1159 Ack=160336 Win=7938 Len=0 TSval=3262638109 TSecr=2878035772"
"163","3.063144","2620:0:861:ed1a::1","2600:8805:3803:6100:357c:4644:40b6:e846","TLSv1.2","758","Application Data"
"164","3.063215","2600:8805:3803:6100:357c:4644:40b6:e846","2620:0:861:ed1a::1","TCP","86","51704  >  443 [ACK] Seq=1159 Ack=161008 Win=7950 Len=0 TSval=3262638109 TSecr=2878035772"
"165","3.503566","2600:8805:3803:6100:357c:4644:40b6:e846","2620:0:861:ed1a::1","TLSv1.2","214","Application Data"
"166","3.518951","2620:0:861:ed1a::1","2600:8805:3803:6100:357c:4644:40b6:e846","TCP","1514","443  >  51704 [ACK] Seq=161008 Ack=1287 Win=144 Len=1428 TSval=2878036229 TSecr=3262638550 [TCP segment of a reassembled PDU]"
"167","3.518952","2620:0:861:ed1a::1","2600:8805:3803:6100:357c:4644:40b6:e846","TLSv1.2","183","Application Data"
"168","3.519073","2600:8805:3803:6100:357c:4644:40b6:e846","2620:0:861:ed1a::1","TCP","86","51704  >  443 [ACK] Seq=1287 Ack=162533 Win=7936 Len=0 TSval=3262638565 TSecr=2878036229"
"169","3.520042","2600:8805:3803:6100:357c:4644:40b6:e846","2620:0:861:ed1a::1","TLSv1.2","121","Application Data"
"170","3.581677","2620:0:861:ed1a::1","2600:8805:3803:6100:357c:4644:40b6:e846","TCP","86","443  >  51704 [ACK] Seq=162533 Ack=1322 Win=144 Len=0 TSval=2878036292 TSecr=3262638565"
"171","3.639199","2600:8805:3803:6100:357c:4644:40b6:e846","2620:0:861:ed1a::1","TLSv1.2","162","Application Data"
"172","3.655257","2620:0:861:ed1a::1","2600:8805:3803:6100:357c:4644:40b6:e846","TCP","86","443  >  51704 [ACK] Seq=162533 Ack=1398 Win=144 Len=0 TSval=2878036365 TSecr=3262638686"
"173","3.699068","2620:0:861:ed1a::1","2600:8805:3803:6100:357c:4644:40b6:e846","TCP","1514","443  >  51704 [ACK] Seq=162533 Ack=1398 Win=144 Len=1428 TSval=2878036410 TSecr=3262638686 [TCP segment of a reassembled PDU]"
"174","3.699177","2600:8805:3803:6100:357c:4644:40b6:e846","2620:0:861:ed1a::1","TCP","86","51704  >  443 [ACK] Seq=1398 Ack=163961 Win=7938 Len=0 TSval=3262638746 TSecr=2878036410"
"175","3.700449","2620:0:861:ed1a::1","2600:8805:3803:6100:357c:4644:40b6:e846","TCP","1514","443  >  51704 [ACK] Seq=163961 Ack=1398 Win=144 Len=1428 TSval=2878036410 TSecr=3262638686 [TCP segment of a reassembled PDU]"
"176","3.700451","2620:0:861:ed1a::1","2600:8805:3803:6100:357c:4644:40b6:e846","TCP","1514","443  >  51704 [ACK] Seq=165389 Ack=1398 Win=144 Len=1428 TSval=2878036410 TSecr=3262638686 [TCP segment of a reassembled PDU]"
"177","3.700452","2620:0:861:ed1a::1","2600:8805:3803:6100:357c:4644:40b6:e846","TCP","1514","443  >  51704 [ACK] Seq=166817 Ack=1398 Win=144 Len=1428 TSval=2878036410 TSecr=3262638686 [TCP segment of a reassembled PDU]"
"178","3.700453","2620:0:861:ed1a::1","2600:8805:3803:6100:357c:4644:40b6:e846","TCP","1514","443  >  51704 [ACK] Seq=168245 Ack=1398 Win=144 Len=1428 TSval=2878036410 TSecr=3262638686 [TCP segment of a reassembled PDU]"
"179","3.700454","2620:0:861:ed1a::1","2600:8805:3803:6100:357c:4644:40b6:e846","TCP","1514","443  >  51704 [ACK] Seq=169673 Ack=1398 Win=144 Len=1428 TSval=2878036410 TSecr=3262638686 [TCP segment of a reassembled PDU]"
"180","3.700455","2620:0:861:ed1a::1","2600:8805:3803:6100:357c:4644:40b6:e846","TCP","1514","443  >  51704 [ACK] Seq=171101 Ack=1398 Win=144 Len=1428 TSval=2878036410 TSecr=3262638686 [TCP segment of a reassembled PDU]"
"181","3.700456","2620:0:861:ed1a::1","2600:8805:3803:6100:357c:4644:40b6:e846","TCP","1514","443  >  51704 [ACK] Seq=172529 Ack=1398 Win=144 Len=1428 TSval=2878036410 TSecr=3262638686 [TCP segment of a reassembled PDU]"
"182","3.700456","2620:0:861:ed1a::1","2600:8805:3803:6100:357c:4644:40b6:e846","TCP","1514","443  >  51704 [ACK] Seq=173957 Ack=1398 Win=144 Len=1428 TSval=2878036410 TSecr=3262638686 [TCP segment of a reassembled PDU]"
"183","3.700458","2620:0:861:ed1a::1","2600:8805:3803:6100:357c:4644:40b6:e846","TCP","1514","443  >  51704 [ACK] Seq=175385 Ack=1398 Win=144 Len=1428 TSval=2878036410 TSecr=3262638686 [TCP segment of a reassembled PDU]"
"184","3.700458","2620:0:861:ed1a::1","2600:8805:3803:6100:357c:4644:40b6:e846","TLSv1.2","441","Application Data"
"185","3.700459","2620:0:861:ed1a::1","2600:8805:3803:6100:357c:4644:40b6:e846","TCP","1514","443  >  51704 [ACK] Seq=177168 Ack=1398 Win=144 Len=1428 TSval=2878036410 TSecr=3262638686 [TCP segment of a reassembled PDU]"
"186","3.700460","2620:0:861:ed1a::1","2600:8805:3803:6100:357c:4644:40b6:e846","TCP","1514","443  >  51704 [ACK] Seq=178596 Ack=1398 Win=144 Len=1428 TSval=2878036410 TSecr=3262638686 [TCP segment of a reassembled PDU]"
"187","3.700461","2620:0:861:ed1a::1","2600:8805:3803:6100:357c:4644:40b6:e846","TCP","1514","443  >  51704 [ACK] Seq=180024 Ack=1398 Win=144 Len=1428 TSval=2878036410 TSecr=3262638686 [TCP segment of a reassembled PDU]"
"188","3.700462","2620:0:861:ed1a::1","2600:8805:3803:6100:357c:4644:40b6:e846","TCP","1514","443  >  51704 [ACK] Seq=181452 Ack=1398 Win=144 Len=1428 TSval=2878036410 TSecr=3262638686 [TCP segment of a reassembled PDU]"
"189","3.700463","2620:0:861:ed1a::1","2600:8805:3803:6100:357c:4644:40b6:e846","TCP","1514","443  >  51704 [ACK] Seq=182880 Ack=1398 Win=144 Len=1428 TSval=2878036410 TSecr=3262638686 [TCP segment of a reassembled PDU]"
"190","3.700463","2620:0:861:ed1a::1","2600:8805:3803:6100:357c:4644:40b6:e846","TLSv1.2","434","Application Data"
"191","3.700586","2600:8805:3803:6100:357c:4644:40b6:e846","2620:0:861:ed1a::1","TCP","86","51704  >  443 [ACK] Seq=1398 Ack=180024 Win=7709 Len=0 TSval=3262638747 TSecr=2878036410"
"192","3.700660","2600:8805:3803:6100:357c:4644:40b6:e846","2620:0:861:ed1a::1","TCP","86","51704  >  443 [ACK] Seq=1398 Ack=184656 Win=7637 Len=0 TSval=3262638747 TSecr=2878036410"
"193","3.701726","2600:8805:3803:6100:357c:4644:40b6:e846","2620:0:861:ed1a::1","TCP","86","[TCP Window Update] 51704  >  443 [ACK] Seq=1398 Ack=184656 Win=7960 Len=0 TSval=3262638748 TSecr=2878036410"
"194","3.795628","2600:8805:3803:6100:357c:4644:40b6:e846","2620:0:861:ed1a::1","TLSv1.2","266","Application Data"
"195","3.795747","2600:8805:3803:6100:357c:4644:40b6:e846","2620:0:861:ed1a::1","TLSv1.2","192","Application Data"
"196","3.795809","2600:8805:3803:6100:357c:4644:40b6:e846","2620:0:861:ed1a::1","TLSv1.2","193","Application Data"
"197","3.796051","2600:8805:3803:6100:357c:4644:40b6:e846","2620:0:861:ed1a::1","TLSv1.2","192","Application Data"
"198","3.796122","2600:8805:3803:6100:357c:4644:40b6:e846","2620:0:861:ed1a::1","TLSv1.2","194","Application Data"
"199","3.799160","2600:8805:3803:6100:357c:4644:40b6:e846","2620:0:861:ed1a::1","TLSv1.2","192","Application Data"
"200","3.813109","2620:0:861:ed1a::1","2600:8805:3803:6100:357c:4644:40b6:e846","TCP","86","443  >  51704 [ACK] Seq=184656 Ack=1578 Win=150 Len=0 TSval=2878036523 TSecr=3262638842"
"201","3.813109","2620:0:861:ed1a::1","2600:8805:3803:6100:357c:4644:40b6:e846","TCP","86","443  >  51704 [ACK] Seq=184656 Ack=2005 Win=150 Len=0 TSval=2878036524 TSecr=3262638842"
"202","3.813334","2620:0:861:ed1a::1","2600:8805:3803:6100:357c:4644:40b6:e846","TCP","1514","443  >  51704 [ACK] Seq=184656 Ack=2005 Win=150 Len=1428 TSval=2878036524 TSecr=3262638842 [TCP segment of a reassembled PDU]"
"203","3.813335","2620:0:861:ed1a::1","2600:8805:3803:6100:357c:4644:40b6:e846","TCP","1514","443  >  51704 [ACK] Seq=186084 Ack=2005 Win=150 Len=1428 TSval=2878036524 TSecr=3262638842 [TCP segment of a reassembled PDU]"
"204","3.813378","2600:8805:3803:6100:357c:4644:40b6:e846","2620:0:861:ed1a::1","TCP","86","51704  >  443 [ACK] Seq=2111 Ack=187512 Win=7916 Len=0 TSval=3262638860 TSecr=2878036524"
"205","3.813469","2600:8805:3803:6100:357c:4644:40b6:e846","2620:0:861:ed1a::1","TCP","86","[TCP Window Update] 51704  >  443 [ACK] Seq=2111 Ack=187512 Win=7960 Len=0 TSval=3262638860 TSecr=2878036524"
"206","3.816377","2620:0:861:ed1a::1","2600:8805:3803:6100:357c:4644:40b6:e846","TLSv1.2","156","Application Data"
"207","3.816377","2620:0:861:ed1a::1","2600:8805:3803:6100:357c:4644:40b6:e846","TCP","1514","443  >  51704 [ACK] Seq=187582 Ack=2005 Win=150 Len=1428 TSval=2878036524 TSecr=3262638842 [TCP segment of a reassembled PDU]"
"208","3.816378","2620:0:861:ed1a::1","2600:8805:3803:6100:357c:4644:40b6:e846","TCP","1514","443  >  51704 [ACK] Seq=189010 Ack=2005 Win=150 Len=1428 TSval=2878036524 TSecr=3262638842 [TCP segment of a reassembled PDU]"
