"No.","Time","Source","Destination","Protocol","Length","Info"
"1","0.000000","2600:8805:3803:6100:357c:4644:40b6:e846","2620:0:861:ed1a::1","TLSv1.2","183","Application Data"
"2","0.000169","2600:8805:3803:6100:357c:4644:40b6:e846","2620:0:861:ed1a::1","TLSv1.2","125","Application Data"
"3","0.015286","2620:0:861:ed1a::1","2600:8805:3803:6100:357c:4644:40b6:e846","TCP","86","443  >  51704 [ACK] Seq=1 Ack=98 Win=83 Len=0 TSval=2877993145 TSecr=3262595465"
"4","0.024226","2620:0:861:ed1a::1","2600:8805:3803:6100:357c:4644:40b6:e846","TCP","86","443  >  51704 [ACK] Seq=1 Ack=137 Win=83 Len=0 TSval=2877993149 TSecr=3262595465"
"5","0.024227","2620:0:861:ed1a::1","2600:8805:3803:6100:357c:4644:40b6:e846","TLSv1.2","125","Application Data"
"6","0.024430","2600:8805:3803:6100:357c:4644:40b6:e846","2620:0:861:ed1a::1","TCP","86","51704  >  443 [ACK] Seq=137 Ack=40 Win=7960 Len=0 TSval=3262595490 TSecr=2877993149"
"7","0.082269","2600:8805:3803:6100:357c:4644:40b6:e846","2620:0:861:ed1a::1","TLSv1.2","171","Application Data"
"8","0.141486","2620:0:861:ed1a::1","2600:8805:3803:6100:357c:4644:40b6:e846","TCP","86","443  >  51704 [ACK] Seq=40 Ack=222 Win=83 Len=0 TSval=2877993272 TSecr=3262595547"
"9","0.257700","2620:0:861:ed1a::1","2600:8805:3803:6100:357c:4644:40b6:e846","TLSv1.2","1216","Application Data"
"10","0.257781","2600:8805:3803:6100:357c:4644:40b6:e846","2620:0:861:ed1a::1","TCP","86","51704  >  443 [ACK] Seq=222 Ack=1170 Win=7943 Len=0 TSval=3262595723 TSecr=2877993387"
"11","0.258917","2620:0:861:ed1a::1","2600:8805:3803:6100:357c:4644:40b6:e846","TCP","1514","443  >  51704 [ACK] Seq=1170 Ack=222 Win=83 Len=1428 TSval=2877993389 TSecr=3262595547 [TCP segment of a reassembled PDU]"
"12","0.259004","2600:8805:3803:6100:357c:4644:40b6:e846","2620:0:861:ed1a::1","TCP","86","51704  >  443 [ACK] Seq=222 Ack=2598 Win=7938 Len=0 TSval=3262595724 TSecr=2877993389"
"13","0.259282","2600:8805:3803:6100:357c:4644:40b6:e846","2620:0:861:ed1a::1","TLSv1.2","121","Application Data"
"14","0.260530","2620:0:861:ed1a::1","2600:8805:3803:6100:357c:4644:40b6:e846","TCP","1514","443  >  51704 [ACK] Seq=2598 Ack=222 Win=83 Len=1428 TSval=2877993389 TSecr=3262595547 [TCP segment of a reassembled PDU]"
"15","0.260532","2620:0:861:ed1a::1","2600:8805:3803:6100:357c:4644:40b6:e846","TCP","1514","443  >  51704 [ACK] Seq=4026 Ack=222 Win=83 Len=1428 TSval=2877993389 TSecr=3262595547 [TCP segment of a reassembled PDU]"
"16","0.260532","2620:0:861:ed1a::1","2600:8805:3803:6100:357c:4644:40b6:e846","TCP","1514","443  >  51704 [ACK] Seq=5454 Ack=222 Win=83 Len=1428 TSval=2877993389 TSecr=3262595547 [TCP segment of a reassembled PDU]"
"17","0.260533","2620:0:861:ed1a::1","2600:8805:3803:6100:357c:4644:40b6:e846","TCP","1514","443  >  51704 [ACK] Seq=6882 Ack=222 Win=83 Len=1428 TSval=2877993389 TSecr=3262595547 [TCP segment of a reassembled PDU]"
"18","0.260534","2620:0:861:ed1a::1","2600:8805:3803:6100:357c:4644:40b6:e846","TCP","1514","443  >  51704 [ACK] Seq=8310 Ack=222 Win=83 Len=1428 TSval=2877993389 TSecr=3262595547 [TCP segment of a reassembled PDU]"
"19","0.260534","2620:0:861:ed1a::1","2600:8805:3803:6100:357c:4644:40b6:e846","TCP","1514","443  >  51704 [ACK] Seq=9738 Ack=222 Win=83 Len=1428 TSval=2877993389 TSecr=3262595547 [TCP segment of a reassembled PDU]"
"20","0.260535","2620:0:861:ed1a::1","2600:8805:3803:6100:357c:4644:40b6:e846","TCP","1514","443  >  51704 [ACK] Seq=11166 Ack=222 Win=83 Len=1428 TSval=2877993389 TSecr=3262595547 [TCP segment of a reassembled PDU]"
"21","0.260536","2620:0:861:ed1a::1","2600:8805:3803:6100:357c:4644:40b6:e846","TCP","1514","443  >  51704 [ACK] Seq=12594 Ack=222 Win=83 Len=1428 TSval=2877993389 TSecr=3262595547 [TCP segment of a reassembled PDU]"
"22","0.260536","2620:0:861:ed1a::1","2600:8805:3803:6100:357c:4644:40b6:e846","TLSv1.2","1435","Application Data"
"23","0.260537","2620:0:861:ed1a::1","2600:8805:3803:6100:357c:4644:40b6:e846","TLSv1.2","117","Application Data"
"24","0.260647","2600:8805:3803:6100:357c:4644:40b6:e846","2620:0:861:ed1a::1","TCP","86","51704  >  443 [ACK] Seq=257 Ack=15402 Win=7760 Len=0 TSval=3262595726 TSecr=2877993389"
"25","0.260945","2600:8805:3803:6100:357c:4644:40b6:e846","2620:0:861:ed1a::1","TCP","86","[TCP Window Update] 51704  >  443 [ACK] Seq=257 Ack=15402 Win=7960 Len=0 TSval=3262595726 TSecr=2877993389"
"26","0.266958","2620:0:861:ed1a::1","2600:8805:3803:6100:357c:4644:40b6:e846","TLSv1.2","1454","Application Data"
"27","0.267017","2600:8805:3803:6100:357c:4644:40b6:e846","2620:0:861:ed1a::1","TCP","86","51704  >  443 [ACK] Seq=257 Ack=16770 Win=7939 Len=0 TSval=3262595732 TSecr=2877993397"
"28","0.279546","2620:0:861:ed1a::1","2600:8805:3803:6100:357c:4644:40b6:e846","TCP","86","443  >  51704 [ACK] Seq=16770 Ack=257 Win=83 Len=0 TSval=2877993409 TSecr=3262595724"
"29","0.828946","2600:8805:3803:6100:357c:4644:40b6:e846","2620:0:861:ed1a::1","TLSv1.2","404","Application Data"
"30","0.850444","2620:0:861:ed1a::1","2600:8805:3803:6100:357c:4644:40b6:e846","TCP","86","443  >  51704 [ACK] Seq=16770 Ack=575 Win=83 Len=0 TSval=2877993980 TSecr=3262596294"
"31","0.851103","2620:0:861:ed1a::1","2600:8805:3803:6100:357c:4644:40b6:e846","TLSv1.2","936","Application Data"
"32","0.851142","2600:8805:3803:6100:357c:4644:40b6:e846","2620:0:861:ed1a::1","TCP","86","51704  >  443 [ACK] Seq=575 Ack=17620 Win=7947 Len=0 TSval=3262596316 TSecr=2877993980"
"33","0.851561","2600:8805:3803:6100:357c:4644:40b6:e846","2620:0:861:ed1a::1","TLSv1.2","121","Application Data"
"34","0.913541","2620:0:861:ed1a::1","2600:8805:3803:6100:357c:4644:40b6:e846","TCP","86","443  >  51704 [ACK] Seq=17620 Ack=610 Win=83 Len=0 TSval=2877994044 TSecr=3262596317"
"35","1.438663","2600:8805:3803:6100:357c:4644:40b6:e846","2620:0:861:ed1a::1","TLSv1.2","214","Application Data"
"36","1.460760","2620:0:861:ed1a::1","2600:8805:3803:6100:357c:4644:40b6:e846","TCP","86","443  >  51704 [ACK] Seq=17620 Ack=738 Win=83 Len=0 TSval=2877994591 TSecr=3262596904"
"37","1.461295","2620:0:861:ed1a::1","2600:8805:3803:6100:357c:4644:40b6:e846","TLSv1.2","1503","Application Data"
"38","1.461361","2600:8805:3803:6100:357c:4644:40b6:e846","2620:0:861:ed1a::1","TCP","86","51704  >  443 [ACK] Seq=738 Ack=19037 Win=7938 Len=0 TSval=3262596926 TSecr=2877994591"
"39","1.510594","2600:8805:3803:6100:357c:4644:40b6:e846","2620:0:861:ed1a::1","TLSv1.2","185","Application Data"
"40","1.528793","2620:0:861:ed1a::1","2600:8805:3803:6100:357c:4644:40b6:e846","TCP","1514","443  >  51704 [ACK] Seq=19037 Ack=837 Win=83 Len=1428 TSval=2877994659 TSecr=3262596976 [TCP segment of a reassembled PDU]"
"41","1.528872","2600:8805:3803:6100:357c:4644:40b6:e846","2620:0:861:ed1a::1","TCP","86","51704  >  443 [ACK] Seq=837 Ack=20465 Win=7938 Len=0 TSval=3262596994 TSecr=2877994659"
"42","1.529141","2620:0:861:ed1a::1","2600:8805:3803:6100:357c:4644:40b6:e846","TCP","1514","443  >  51704 [ACK] Seq=20465 Ack=837 Win=83 Len=1428 TSval=2877994659 TSecr=3262596976 [TCP segment of a reassembled PDU]"
"43","1.529142","2620:0:861:ed1a::1","2600:8805:3803:6100:357c:4644:40b6:e846","TLSv1.2","145","Application Data"
"44","1.529182","2600:8805:3803:6100:357c:4644:40b6:e846","2620:0:861:ed1a::1","TCP","86","51704  >  443 [ACK] Seq=837 Ack=21952 Win=7937 Len=0 TSval=3262596994 TSecr=2877994659"
"45","1.637947","2600:8805:3803:6100:357c:4644:40b6:e846","2620:0:861:ed1a::1","TLSv1.2","175","Application Data"
"46","1.653761","2620:0:861:ed1a::1","2600:8805:3803:6100:357c:4644:40b6:e846","TCP","1514","443  >  51704 [ACK] Seq=21952 Ack=926 Win=83 Len=1428 TSval=2877994783 TSecr=3262597103 [TCP segment of a reassembled PDU]"
"47","1.653950","2600:8805:3803:6100:357c:4644:40b6:e846","2620:0:861:ed1a::1","TCP","86","51704  >  443 [ACK] Seq=926 Ack=23380 Win=7938 Len=0 TSval=3262597119 TSecr=2877994783"
"48","1.654476","2620:0:861:ed1a::1","2600:8805:3803:6100:357c:4644:40b6:e846","TLSv1.2","971","Application Data"
"49","1.654603","2600:8805:3803:6100:357c:4644:40b6:e846","2620:0:861:ed1a::1","TCP","86","51704  >  443 [ACK] Seq=926 Ack=24265 Win=7946 Len=0 TSval=3262597119 TSecr=2877994783"
"50","1.844752","2600:8805:3803:6100:357c:4644:40b6:e846","2620:0:861:ed1a::1","TLSv1.2","163","Application Data"
"51","1.861717","2620:0:861:ed1a::1","2600:8805:3803:6100:357c:4644:40b6:e846","TCP","1514","443  >  51704 [ACK] Seq=24265 Ack=1003 Win=83 Len=1428 TSval=2877994991 TSecr=3262597310 [TCP segment of a reassembled PDU]"
"52","1.861807","2600:8805:3803:6100:357c:4644:40b6:e846","2620:0:861:ed1a::1","TCP","86","51704  >  443 [ACK] Seq=1003 Ack=25693 Win=7938 Len=0 TSval=3262597327 TSecr=2877994991"
"53","1.866579","2620:0:861:ed1a::1","2600:8805:3803:6100:357c:4644:40b6:e846","TCP","1514","443  >  51704 [ACK] Seq=25693 Ack=1003 Win=83 Len=1428 TSval=2877994991 TSecr=3262597310 [TCP segment of a reassembled PDU]"
"54","1.866580","2620:0:861:ed1a::1","2600:8805:3803:6100:357c:4644:40b6:e846","TCP","1514","443  >  51704 [ACK] Seq=27121 Ack=1003 Win=83 Len=1428 TSval=2877994991 TSecr=3262597310 [TCP segment of a reassembled PDU]"
"55","1.866581","2620:0:861:ed1a::1","2600:8805:3803:6100:357c:4644:40b6:e846","TCP","1514","443  >  51704 [ACK] Seq=28549 Ack=1003 Win=83 Len=1428 TSval=2877994991 TSecr=3262597310 [TCP segment of a reassembled PDU]"
"56","1.866581","2620:0:861:ed1a::1","2600:8805:3803:6100:357c:4644:40b6:e846","TCP","1514","443  >  51704 [ACK] Seq=29977 Ack=1003 Win=83 Len=1428 TSval=2877994991 TSecr=3262597310 [TCP segment of a reassembled PDU]"
"57","1.866582","2620:0:861:ed1a::1","2600:8805:3803:6100:357c:4644:40b6:e846","TCP","1514","443  >  51704 [ACK] Seq=31405 Ack=1003 Win=83 Len=1428 TSval=2877994991 TSecr=3262597310 [TCP segment of a reassembled PDU]"
"58","1.866582","2620:0:861:ed1a::1","2600:8805:3803:6100:357c:4644:40b6:e846","TCP","1514","443  >  51704 [ACK] Seq=32833 Ack=1003 Win=83 Len=1428 TSval=2877994991 TSecr=3262597310 [TCP segment of a reassembled PDU]"
"59","1.866583","2620:0:861:ed1a::1","2600:8805:3803:6100:357c:4644:40b6:e846","TCP","1514","443  >  51704 [ACK] Seq=34261 Ack=1003 Win=83 Len=1428 TSval=2877994991 TSecr=3262597310 [TCP segment of a reassembled PDU]"
"60","1.866583","2620:0:861:ed1a::1","2600:8805:3803:6100:357c:4644:40b6:e846","TCP","1514","443  >  51704 [ACK] Seq=35689 Ack=1003 Win=83 Len=1428 TSval=2877994991 TSecr=3262597310 [TCP segment of a reassembled PDU]"
"61","1.866583","2620:0:861:ed1a::1","2600:8805:3803:6100:357c:4644:40b6:e846","TCP","1514","443  >  51704 [ACK] Seq=37117 Ack=1003 Win=83 Len=1428 TSval=2877994991 TSecr=3262597310 [TCP segment of a reassembled PDU]"
"62","1.866584","2620:0:861:ed1a::1","2600:8805:3803:6100:357c:4644:40b6:e846","TLSv1.2","429","Application Data"
"63","1.866584","2620:0:861:ed1a::1","2600:8805:3803:6100:357c:4644:40b6:e846","TCP","1514","443  >  51704 [ACK] Seq=38888 Ack=1003 Win=83 Len=1428 TSval=2877994991 TSecr=3262597310 [TCP segment of a reassembled PDU]"
"64","1.866585","2620:0:861:ed1a::1","2600:8805:3803:6100:357c:4644:40b6:e846","TCP","1514","443  >  51704 [ACK] Seq=40316 Ack=1003 Win=83 Len=1428 TSval=2877994991 TSecr=3262597310 [TCP segment of a reassembled PDU]"
"65","1.866585","2620:0:861:ed1a::1","2600:8805:3803:6100:357c:4644:40b6:e846","TCP","1514","443  >  51704 [ACK] Seq=41744 Ack=1003 Win=83 Len=1428 TSval=2877994991 TSecr=3262597310 [TCP segment of a reassembled PDU]"
"66","1.866586","2620:0:861:ed1a::1","2600:8805:3803:6100:357c:4644:40b6:e846","TCP","1514","443  >  51704 [ACK] Seq=43172 Ack=1003 Win=83 Len=1428 TSval=2877994991 TSecr=3262597310 [TCP segment of a reassembled PDU]"
"67","1.866586","2620:0:861:ed1a::1","2600:8805:3803:6100:357c:4644:40b6:e846","TCP","1514","443  >  51704 [ACK] Seq=44600 Ack=1003 Win=83 Len=1428 TSval=2877994991 TSecr=3262597310 [TCP segment of a reassembled PDU]"
"68","1.866587","2620:0:861:ed1a::1","2600:8805:3803:6100:357c:4644:40b6:e846","TCP","1514","443  >  51704 [ACK] Seq=46028 Ack=1003 Win=83 Len=1428 TSval=2877994991 TSecr=3262597310 [TCP segment of a reassembled PDU]"
"69","1.866588","2620:0:861:ed1a::1","2600:8805:3803:6100:357c:4644:40b6:e846","TCP","1514","443  >  51704 [ACK] Seq=47456 Ack=1003 Win=83 Len=1428 TSval=2877994991 TSecr=3262597310 [TCP segment of a reassembled PDU]"
"70","1.866588","2620:0:861:ed1a::1","2600:8805:3803:6100:357c:4644:40b6:e846","TCP","1514","443  >  51704 [ACK] Seq=48884 Ack=1003 Win=83 Len=1428 TSval=2877994991 TSecr=3262597310 [TCP segment of a reassembled PDU]"
"71","1.866588","2620:0:861:ed1a::1","2600:8805:3803:6100:357c:4644:40b6:e846","TCP","1514","443  >  51704 [ACK] Seq=50312 Ack=1003 Win=83 Len=1428 TSval=2877994991 TSecr=3262597310 [TCP segment of a reassembled PDU]"
"72","1.866589","2620:0:861:ed1a::1","2600:8805:3803:6100:357c:4644:40b6:e846","TCP","1514","443  >  51704 [ACK] Seq=51740 Ack=1003 Win=83 Len=1428 TSval=2877994991 TSecr=3262597310 [TCP segment of a reassembled PDU]"
"73","1.866590","2620:0:861:ed1a::1","2600:8805:3803:6100:357c:4644:40b6:e846","TCP","1514","443  >  51704 [ACK] Seq=53168 Ack=1003 Win=83 Len=1428 TSval=2877994991 TSecr=3262597310 [TCP segment of a reassembled PDU]"
"74","1.866590","2620:0:861:ed1a::1","2600:8805:3803:6100:357c:4644:40b6:e846","TLSv1.2","729","Application Data"
"75","1.866695","2600:8805:3803:6100:357c:4644:40b6:e846","2620:0:861:ed1a::1","TCP","86","51704  >  443 [ACK] Seq=1003 Ack=41744 Win=7710 Len=0 TSval=3262597332 TSecr=2877994991"
"76","1.866818","2600:8805:3803:6100:357c:4644:40b6:e846","2620:0:861:ed1a::1","TCP","86","51704  >  443 [ACK] Seq=1003 Ack=55239 Win=7499 Len=0 TSval=3262597332 TSecr=2877994991"
"77","1.867241","2600:8805:3803:6100:357c:4644:40b6:e846","2620:0:861:ed1a::1","TCP","86","[TCP Window Update] 51704  >  443 [ACK] Seq=1003 Ack=55239 Win=7960 Len=0 TSval=3262597332 TSecr=2877994991"
"78","1.868093","2620:0:861:ed1a::1","2600:8805:3803:6100:357c:4644:40b6:e846","TCP","1514","443  >  51704 [ACK] Seq=55239 Ack=1003 Win=83 Len=1428 TSval=2877994992 TSecr=3262597310 [TCP segment of a reassembled PDU]"
"79","1.868094","2620:0:861:ed1a::1","2600:8805:3803:6100:357c:4644:40b6:e846","TCP","1514","443  >  51704 [ACK] Seq=56667 Ack=1003 Win=83 Len=1428 TSval=2877994992 TSecr=3262597310 [TCP segment of a reassembled PDU]"
"80","1.868095","2620:0:861:ed1a::1","2600:8805:3803:6100:357c:4644:40b6:e846","TCP","1514","443  >  51704 [ACK] Seq=58095 Ack=1003 Win=83 Len=1428 TSval=2877994992 TSecr=3262597310 [TCP segment of a reassembled PDU]"
"81","1.868095","2620:0:861:ed1a::1","2600:8805:3803:6100:357c:4644:40b6:e846","TCP","1514","443  >  51704 [ACK] Seq=59523 Ack=1003 Win=83 Len=1428 TSval=2877994992 TSecr=3262597310 [TCP segment of a reassembled PDU]"
"82","1.868096","2620:0:861:ed1a::1","2600:8805:3803:6100:357c:4644:40b6:e846","TCP","1514","443  >  51704 [ACK] Seq=60951 Ack=1003 Win=83 Len=1428 TSval=2877994992 TSecr=3262597310 [TCP segment of a reassembled PDU]"
"83","1.868096","2620:0:861:ed1a::1","2600:8805:3803:6100:357c:4644:40b6:e846","TCP","1514","443  >  51704 [ACK] Seq=62379 Ack=1003 Win=83 Len=1428 TSval=2877994992 TSecr=3262597310 [TCP segment of a reassembled PDU]"
"84","1.868097","2620:0:861:ed1a::1","2600:8805:3803:6100:357c:4644:40b6:e846","TCP","1514","443  >  51704 [ACK] Seq=63807 Ack=1003 Win=83 Len=1428 TSval=2877994992 TSecr=3262597310 [TCP segment of a reassembled PDU]"
"85","1.868097","2620:0:861:ed1a::1","2600:8805:3803:6100:357c:4644:40b6:e846","TCP","1514","443  >  51704 [ACK] Seq=65235 Ack=1003 Win=83 Len=1428 TSval=2877994992 TSecr=3262597310 [TCP segment of a reassembled PDU]"
"86","1.868098","2620:0:861:ed1a::1","2600:8805:3803:6100:357c:4644:40b6:e846","TLSv1.2","781","Application Data"
"87","1.868163","2600:8805:3803:6100:357c:4644:40b6:e846","2620:0:861:ed1a::1","TCP","86","51704  >  443 [ACK] Seq=1003 Ack=67358 Win=7771 Len=0 TSval=3262597333 TSecr=2877994992"
"88","1.868572","2600:8805:3803:6100:357c:4644:40b6:e846","2620:0:861:ed1a::1","TCP","86","[TCP Window Update] 51704  >  443 [ACK] Seq=1003 Ack=67358 Win=7960 Len=0 TSval=3262597333 TSecr=2877994992"
"89","3.162008","2600:8805:3803:6100:357c:4644:40b6:e846","2620:0:861:ed1a::1","TLSv1.2","212","Application Data"
"90","3.187447","2620:0:861:ed1a::1","2600:8805:3803:6100:357c:4644:40b6:e846","TCP","1514","443  >  51704 [ACK] Seq=67358 Ack=1129 Win=83 Len=1428 TSval=2877996317 TSecr=3262598627 [TCP segment of a reassembled PDU]"
"91","3.187450","2620:0:861:ed1a::1","2600:8805:3803:6100:357c:4644:40b6:e846","TLSv1.2","1052","Application Data"
"92","3.187641","2600:8805:3803:6100:357c:4644:40b6:e846","2620:0:861:ed1a::1","TCP","86","51704  >  443 [ACK] Seq=1129 Ack=68786 Win=7938 Len=0 TSval=3262598653 TSecr=2877996317"
"93","3.187885","2600:8805:3803:6100:357c:4644:40b6:e846","2620:0:861:ed1a::1","TCP","86","51704  >  443 [ACK] Seq=1129 Ack=69752 Win=7923 Len=0 TSval=3262598653 TSecr=2877996317"
"94","3.347773","2600:8805:3803:6100:357c:4644:40b6:e846","2620:0:861:ed1a::1","TLSv1.2","168","Application Data"
"95","3.409789","2620:0:861:ed1a::1","2600:8805:3803:6100:357c:4644:40b6:e846","TCP","86","443  >  51704 [ACK] Seq=69752 Ack=1211 Win=83 Len=0 TSval=2877996540 TSecr=3262598813"
"96","3.562995","2620:0:861:ed1a::1","2600:8805:3803:6100:357c:4644:40b6:e846","TLSv1.2","1232","Application Data"
"97","3.563144","2600:8805:3803:6100:357c:4644:40b6:e846","2620:0:861:ed1a::1","TCP","86","51704  >  443 [ACK] Seq=1211 Ack=70898 Win=7942 Len=0 TSval=3262599028 TSecr=2877996692"
"98","3.566983","2620:0:861:ed1a::1","2600:8805:3803:6100:357c:4644:40b6:e846","TCP","1514","443  >  51704 [ACK] Seq=70898 Ack=1211 Win=83 Len=1428 TSval=2877996696 TSecr=3262598813 [TCP segment of a reassembled PDU]"
"99","3.567148","2600:8805:3803:6100:357c:4644:40b6:e846","2620:0:861:ed1a::1","TCP","86","51704  >  443 [ACK] Seq=1211 Ack=72326 Win=7938 Len=0 TSval=3262599032 TSecr=2877996696"
"100","3.568377","2620:0:861:ed1a::1","2600:8805:3803:6100:357c:4644:40b6:e846","TCP","1514","443  >  51704 [ACK] Seq=72326 Ack=1211 Win=83 Len=1428 TSval=2877996696 TSecr=3262598813 [TCP segment of a reassembled PDU]"
"101","3.568380","2620:0:861:ed1a::1","2600:8805:3803:6100:357c:4644:40b6:e846","TCP","1514","443  >  51704 [ACK] Seq=73754 Ack=1211 Win=83 Len=1428 TSval=2877996696 TSecr=3262598813 [TCP segment of a reassembled PDU]"
"102","3.568381","2620:0:861:ed1a::1","2600:8805:3803:6100:357c:4644:40b6:e846","TCP","1514","443  >  51704 [ACK] Seq=75182 Ack=1211 Win=83 Len=1428 TSval=2877996696 TSecr=3262598813 [TCP segment of a reassembled PDU]"
"103","3.568383","2620:0:861:ed1a::1","2600:8805:3803:6100:357c:4644:40b6:e846","TCP","1514","443  >  51704 [ACK] Seq=76610 Ack=1211 Win=83 Len=1428 TSval=2877996696 TSecr=3262598813 [TCP segment of a reassembled PDU]"
"104","3.568384","2620:0:861:ed1a::1","2600:8805:3803:6100:357c:4644:40b6:e846","TCP","1514","443  >  51704 [ACK] Seq=78038 Ack=1211 Win=83 Len=1428 TSval=2877996696 TSecr=3262598813 [TCP segment of a reassembled PDU]"
"105","3.568386","2620:0:861:ed1a::1","2600:8805:3803:6100:357c:4644:40b6:e846","TCP","1514","443  >  51704 [ACK] Seq=79466 Ack=1211 Win=83 Len=1428 TSval=2877996696 TSecr=3262598813 [TCP segment of a reassembled PDU]"
"106","3.568387","2620:0:861:ed1a::1","2600:8805:3803:6100:357c:4644:40b6:e846","TCP","1514","443  >  51704 [ACK] Seq=80894 Ack=1211 Win=83 Len=1428 TSval=2877996696 TSecr=3262598813 [TCP segment of a reassembled PDU]"
"107","3.568390","2620:0:861:ed1a::1","2600:8805:3803:6100:357c:4644:40b6:e846","TCP","1514","443  >  51704 [ACK] Seq=82322 Ack=1211 Win=83 Len=1428 TSval=2877996696 TSecr=3262598813 [TCP segment of a reassembled PDU]"
"108","3.568392","2620:0:861:ed1a::1","2600:8805:3803:6100:357c:4644:40b6:e846","TCP","1514","443  >  51704 [ACK] Seq=83750 Ack=1211 Win=83 Len=1428 TSval=2877996696 TSecr=3262598813 [TCP segment of a reassembled PDU]"
"109","3.568395","2620:0:861:ed1a::1","2600:8805:3803:6100:357c:4644:40b6:e846","TCP","1514","443  >  51704 [ACK] Seq=85178 Ack=1211 Win=83 Len=1428 TSval=2877996696 TSecr=3262598813 [TCP segment of a reassembled PDU]"
"110","3.568397","2620:0:861:ed1a::1","2600:8805:3803:6100:357c:4644:40b6:e846","TLSv1.2","721","Application Data"
"111","3.568398","2620:0:861:ed1a::1","2600:8805:3803:6100:357c:4644:40b6:e846","TCP","1514","443  >  51704 [ACK] Seq=87241 Ack=1211 Win=83 Len=1428 TSval=2877996697 TSecr=3262598813 [TCP segment of a reassembled PDU]"
"112","3.568400","2620:0:861:ed1a::1","2600:8805:3803:6100:357c:4644:40b6:e846","TCP","1514","443  >  51704 [ACK] Seq=88669 Ack=1211 Win=83 Len=1428 TSval=2877996697 TSecr=3262598813 [TCP segment of a reassembled PDU]"
"113","3.568401","2620:0:861:ed1a::1","2600:8805:3803:6100:357c:4644:40b6:e846","TCP","1514","443  >  51704 [ACK] Seq=90097 Ack=1211 Win=83 Len=1428 TSval=2877996697 TSecr=3262598813 [TCP segment of a reassembled PDU]"
"114","3.568402","2620:0:861:ed1a::1","2600:8805:3803:6100:357c:4644:40b6:e846","TCP","1514","443  >  51704 [ACK] Seq=91525 Ack=1211 Win=83 Len=1428 TSval=2877996697 TSecr=3262598813 [TCP segment of a reassembled PDU]"
"115","3.568404","2620:0:861:ed1a::1","2600:8805:3803:6100:357c:4644:40b6:e846","TCP","1514","443  >  51704 [ACK] Seq=92953 Ack=1211 Win=83 Len=1428 TSval=2877996697 TSecr=3262598813 [TCP segment of a reassembled PDU]"
"116","3.568404","2620:0:861:ed1a::1","2600:8805:3803:6100:357c:4644:40b6:e846","TCP","1514","443  >  51704 [ACK] Seq=94381 Ack=1211 Win=83 Len=1428 TSval=2877996697 TSecr=3262598813 [TCP segment of a reassembled PDU]"
"117","3.568405","2620:0:861:ed1a::1","2600:8805:3803:6100:357c:4644:40b6:e846","TCP","1514","443  >  51704 [ACK] Seq=95809 Ack=1211 Win=83 Len=1428 TSval=2877996697 TSecr=3262598813 [TCP segment of a reassembled PDU]"
"118","3.568407","2620:0:861:ed1a::1","2600:8805:3803:6100:357c:4644:40b6:e846","TLSv1.2","118","Application Data"
"119","3.568407","2620:0:861:ed1a::1","2600:8805:3803:6100:357c:4644:40b6:e846","TLSv1.2","117","Application Data"
"120","3.568572","2600:8805:3803:6100:357c:4644:40b6:e846","2620:0:861:ed1a::1","TCP","86","51704  >  443 [ACK] Seq=1211 Ack=87241 Win=7727 Len=0 TSval=3262599034 TSecr=2877996696"
"121","3.568715","2600:8805:3803:6100:357c:4644:40b6:e846","2620:0:861:ed1a::1","TCP","86","51704  >  443 [ACK] Seq=1211 Ack=97300 Win=7570 Len=0 TSval=3262599034 TSecr=2877996697"
"122","3.569025","2600:8805:3803:6100:357c:4644:40b6:e846","2620:0:861:ed1a::1","TCP","86","[TCP Window Update] 51704  >  443 [ACK] Seq=1211 Ack=97300 Win=7960 Len=0 TSval=3262599034 TSecr=2877996697"
"123","3.634187","2600:8805:3803:6100:357c:4644:40b6:e846","2620:0:861:ed1a::1","TLSv1.2","412","Application Data"
"124","3.649976","2620:0:861:ed1a::1","2600:8805:3803:6100:357c:4644:40b6:e846","TCP","86","443  >  51704 [ACK] Seq=97300 Ack=1537 Win=83 Len=0 TSval=2877996780 TSecr=3262599099"
"125","3.650223","2620:0:861:ed1a::1","2600:8805:3803:6100:357c:4644:40b6:e846","TLSv1.2","936","Application Data"
"126","3.650264","2600:8805:3803:6100:357c:4644:40b6:e846","2620:0:861:ed1a::1","TCP","86","51704  >  443 [ACK] Seq=1537 Ack=98150 Win=7947 Len=0 TSval=3262599115 TSecr=2877996780"
"127","3.651724","2600:8805:3803:6100:357c:4644:40b6:e846","2620:0:861:ed1a::1","TLSv1.2","121","Application Data"
"128","3.652011","2600:8805:3803:6100:357c:4644:40b6:e846","2620:0:861:ed1a::1","TLSv1.2","266","Application Data"
"129","3.652187","2600:8805:3803:6100:357c:4644:40b6:e846","2620:0:861:ed1a::1","TLSv1.2","192","Application Data"
"130","3.652317","2600:8805:3803:6100:357c:4644:40b6:e846","2620:0:861:ed1a::1","TLSv1.2","192","Application Data"
"131","3.653419","2600:8805:3803:6100:357c:4644:40b6:e846","2620:0:861:ed1a::1","TLSv1.2","194","Application Data"
"132","3.653464","2600:8805:3803:6100:357c:4644:40b6:e846","2620:0:861:ed1a::1","TLSv1.2","193","Application Data"
"133","3.653502","2600:8805:3803:6100:357c:4644:40b6:e846","2620:0:861:ed1a::1","TLSv1.2","193","Application Data"
"134","3.671949","2620:0:861:ed1a::1","2600:8805:3803:6100:357c:4644:40b6:e846","TCP","86","443  >  51704 [ACK] Seq=98150 Ack=1964 Win=83 Len=0 TSval=2877996801 TSecr=3262599117"
"135","3.674079","2620:0:861:ed1a::1","2600:8805:3803:6100:357c:4644:40b6:e846","TCP","86","443  >  51704 [ACK] Seq=98150 Ack=2286 Win=83 Len=0 TSval=2877996803 TSecr=3262599118"
"136","3.681164","2620:0:861:ed1a::1","2600:8805:3803:6100:357c:4644:40b6:e846","TCP","1514","443  >  51704 [ACK] Seq=98150 Ack=2286 Win=83 Len=1428 TSval=2877996809 TSecr=3262599118 [TCP segment of a reassembled PDU]"
"137","3.681164","2620:0:861:ed1a::1","2600:8805:3803:6100:357c:4644:40b6:e846","TCP","1514","443  >  51704 [ACK] Seq=99578 Ack=2286 Win=83 Len=1428 TSval=2877996809 TSecr=3262599118 [TCP segment of a reassembled PDU]"
"138","3.681165","2620:0:861:ed1a::1","2600:8805:3803:6100:357c:4644:40b6:e846","TCP","1514","443  >  51704 [ACK] Seq=101006 Ack=2286 Win=83 Len=1428 TSval=2877996809 TSecr=3262599118 [TCP segment of a reassembled PDU]"
"139","3.681166","2620:0:861:ed1a::1","2600:8805:3803:6100:357c:4644:40b6:e846","TLSv1.2","297","Application Data"
"140","3.681261","2600:8805:3803:6100:357c:4644:40b6:e846","2620:0:861:ed1a::1","TCP","86","51704  >  443 [ACK] Seq=2286 Ack=102434 Win=7893 Len=0 TSval=3262599146 TSecr=2877996809"
"141","3.681300","2600:8805:3803:6100:357c:4644:40b6:e846","2620:0:861:ed1a::1","TCP","86","51704  >  443 [ACK] Seq=2286 Ack=102645 Win=7890 Len=0 TSval=3262599146 TSecr=2877996809"
"142","3.681496","2600:8805:3803:6100:357c:4644:40b6:e846","2620:0:861:ed1a::1","TCP","86","[TCP Window Update] 51704  >  443 [ACK] Seq=2286 Ack=102645 Win=7960 Len=0 TSval=3262599147 TSecr=2877996809"
"143","3.683250","2620:0:861:ed1a::1","2600:8805:3803:6100:357c:4644:40b6:e846","TCP","1514","443  >  51704 [ACK] Seq=102645 Ack=2286 Win=83 Len=1428 TSval=2877996811 TSecr=3262599118 [TCP segment of a reassembled PDU]"
"144","3.683251","2620:0:861:ed1a::1","2600:8805:3803:6100:357c:4644:40b6:e846","TCP","1514","443  >  51704 [ACK] Seq=104073 Ack=2286 Win=83 Len=1428 TSval=2877996811 TSecr=3262599118 [TCP segment of a reassembled PDU]"
"145","3.683252","2620:0:861:ed1a::1","2600:8805:3803:6100:357c:4644:40b6:e846","TLSv1.2","1467","Application Data"
"146","3.683327","2600:8805:3803:6100:357c:4644:40b6:e846","2620:0:861:ed1a::1","TCP","86","51704  >  443 [ACK] Seq=2286 Ack=106882 Win=7894 Len=0 TSval=3262599148 TSecr=2877996811"
"147","3.683889","2600:8805:3803:6100:357c:4644:40b6:e846","2620:0:861:ed1a::1","TCP","86","[TCP Window Update] 51704  >  443 [ACK] Seq=2286 Ack=106882 Win=7960 Len=0 TSval=3262599148 TSecr=2877996811"
"148","3.685170","2620:0:861:ed1a::1","2600:8805:3803:6100:357c:4644:40b6:e846","TCP","1514","443  >  51704 [ACK] Seq=106882 Ack=2286 Win=83 Len=1428 TSval=2877996813 TSecr=3262599118 [TCP segment of a reassembled PDU]"
"149","3.685171","2620:0:861:ed1a::1","2600:8805:3803:6100:357c:4644:40b6:e846","TCP","1514","443  >  51704 [ACK] Seq=108310 Ack=2286 Win=83 Len=1428 TSval=2877996813 TSecr=3262599118 [TCP segment of a reassembled PDU]"
"150","3.685252","2600:8805:3803:6100:357c:4644:40b6:e846","2620:0:861:ed1a::1","TCP","86","51704  >  443 [ACK] Seq=2286 Ack=109738 Win=7916 Len=0 TSval=3262599150 TSecr=2877996813"
"151","3.686040","2620:0:861:ed1a::1","2600:8805:3803:6100:357c:4644:40b6:e846","TLSv1.2","1351","Application Data"
"152","3.686041","2620:0:861:ed1a::1","2600:8805:3803:6100:357c:4644:40b6:e846","TCP","1514","443  >  51704 [ACK] Seq=111003 Ack=2286 Win=83 Len=1428 TSval=2877996813 TSecr=3262599118 [TCP segment of a reassembled PDU]"
"153","3.686042","2620:0:861:ed1a::1","2600:8805:3803:6100:357c:4644:40b6:e846","TCP","1514","443  >  51704 [ACK] Seq=112431 Ack=2286 Win=83 Len=1428 TSval=2877996813 TSecr=3262599118 [TCP segment of a reassembled PDU]"
"154","3.686042","2620:0:861:ed1a::1","2600:8805:3803:6100:357c:4644:40b6:e846","TLSv1.2","1288","Application Data"
"155","3.686043","2620:0:861:ed1a::1","2600:8805:3803:6100:357c:4644:40b6:e846","TCP","1514","443  >  51704 [ACK] Seq=115061 Ack=2286 Win=83 Len=1428 TSval=2877996814 TSecr=3262599118 [TCP segment of a reassembled PDU]"
"156","3.686043","2620:0:861:ed1a::1","2600:8805:3803:6100:357c:4644:40b6:e846","TCP","1514","443  >  51704 [ACK] Seq=116489 Ack=2286 Win=83 Len=1428 TSval=2877996814 TSecr=3262599118 [TCP segment of a reassembled PDU]"
"157","3.686044","2620:0:861:ed1a::1","2600:8805:3803:6100:357c:4644:40b6:e846","TLSv1.2","1205","Application Data"
"158","3.686096","2600:8805:3803:6100:357c:4644:40b6:e846","2620:0:861:ed1a::1","TCP","86","51704  >  443 [ACK] Seq=2286 Ack=119036 Win=7770 Len=0 TSval=3262599150 TSecr=2877996814"
"159","3.686701","2600:8805:3803:6100:357c:4644:40b6:e846","2620:0:861:ed1a::1","TCP","86","[TCP Window Update] 51704  >  443 [ACK] Seq=2286 Ack=119036 Win=7960 Len=0 TSval=3262599152 TSecr=2877996814"
"160","3.686937","2620:0:861:ed1a::1","2600:8805:3803:6100:357c:4644:40b6:e846","TCP","1514","443  >  51704 [ACK] Seq=119036 Ack=2286 Win=83 Len=1428 TSval=2877996816 TSecr=3262599118 [TCP segment of a reassembled PDU]"
"161","3.687021","2600:8805:3803:6100:357c:4644:40b6:e846","2620:0:861:ed1a::1","TCP","86","51704  >  443 [ACK] Seq=2286 Ack=120464 Win=7938 Len=0 TSval=3262599152 TSecr=2877996816"
"162","3.687417","2620:0:861:ed1a::1","2600:8805:3803:6100:357c:4644:40b6:e846","TCP","1514","443  >  51704 [ACK] Seq=120464 Ack=2286 Win=83 Len=1428 TSval=2877996816 TSecr=3262599118 [TCP segment of a reassembled PDU]"
"163","3.687418","2620:0:861:ed1a::1","2600:8805:3803:6100:357c:4644:40b6:e846","TCP","1514","443  >  51704 [ACK] Seq=121892 Ack=2286 Win=83 Len=1428 TSval=2877996816 TSecr=3262599118 [TCP segment of a reassembled PDU]"
"164","3.687419","2620:0:861:ed1a::1","2600:8805:3803:6100:357c:4644:40b6:e846","TLSv1.2","273","Application Data"
"165","3.687487","2600:8805:3803:6100:357c:4644:40b6:e846","2620:0:861:ed1a::1","TCP","86","51704  >  443 [ACK] Seq=2286 Ack=123507 Win=7890 Len=0 TSval=3262599152 TSecr=2877996816"
"166","3.688189","2600:8805:3803:6100:357c:4644:40b6:e846","2620:0:861:ed1a::1","TCP","86","[TCP Window Update] 51704  >  443 [ACK] Seq=2286 Ack=123507 Win=7960 Len=0 TSval=3262599153 TSecr=2877996816"
"167","3.694154","2600:8805:3803:6100:357c:4644:40b6:e846","2620:0:861:ed1a::1","TLSv1.2","192","Application Data"
"168","3.696686","2600:8805:3803:6100:357c:4644:40b6:e846","2620:0:861:ed1a::1","TLSv1.2","192","Application Data"
"169","3.696771","2600:8805:3803:6100:357c:4644:40b6:e846","2620:0:861:ed1a::1","TLSv1.2","192","Application Data"
"170","3.696842","2600:8805:3803:6100:357c:4644:40b6:e846","2620:0:861:ed1a::1","TLSv1.2","193","Application Data"
"171","3.696914","2600:8805:3803:6100:357c:4644:40b6:e846","2620:0:861:ed1a::1","TLSv1.2","192","Application Data"
"172","3.696969","2600:8805:3803:6100:357c:4644:40b6:e846","2620:0:861:ed1a::1","TLSv1.2","192","Application Data"
"173","3.716517","2620:0:861:ed1a::1","2600:8805:3803:6100:357c:4644:40b6:e846","TCP","86","443  >  51704 [ACK] Seq=123507 Ack=2923 Win=83 Len=0 TSval=2877996846 TSecr=3262599159"
"174","3.726441","2620:0:861:ed1a::1","2600:8805:3803:6100:357c:4644:40b6:e846","TCP","1514","443  >  51704 [ACK] Seq=123507 Ack=2923 Win=83 Len=1428 TSval=2877996854 TSecr=3262599159 [TCP segment of a reassembled PDU]"
"175","3.726442","2620:0:861:ed1a::1","2600:8805:3803:6100:357c:4644:40b6:e846","TCP","1514","443  >  51704 [ACK] Seq=124935 Ack=2923 Win=83 Len=1428 TSval=2877996854 TSecr=3262599159 [TCP segment of a reassembled PDU]"
"176","3.726442","2620:0:861:ed1a::1","2600:8805:3803:6100:357c:4644:40b6:e846","TCP","1514","443  >  51704 [ACK] Seq=126363 Ack=2923 Win=83 Len=1428 TSval=2877996854 TSecr=3262599159 [TCP segment of a reassembled PDU]"
"177","3.726443","2620:0:861:ed1a::1","2600:8805:3803:6100:357c:4644:40b6:e846","TLSv1.2","274","Application Data"
"178","3.726503","2600:8805:3803:6100:357c:4644:40b6:e846","2620:0:861:ed1a::1","TCP","86","51704  >  443 [ACK] Seq=2923 Ack=127979 Win=7890 Len=0 TSval=3262599192 TSecr=2877996854"
"179","3.726679","2600:8805:3803:6100:357c:4644:40b6:e846","2620:0:861:ed1a::1","TCP","86","[TCP Window Update] 51704  >  443 [ACK] Seq=2923 Ack=127979 Win=7960 Len=0 TSval=3262599192 TSecr=2877996854"
"180","3.728473","2600:8805:3803:6100:357c:4644:40b6:e846","2620:0:861:ed1a::1","TLSv1.2","192","Application Data"
"181","3.730863","2620:0:861:ed1a::1","2600:8805:3803:6100:357c:4644:40b6:e846","TCP","1514","443  >  51704 [ACK] Seq=127979 Ack=2923 Win=83 Len=1428 TSval=2877996856 TSecr=3262599159 [TCP segment of a reassembled PDU]"
"182","3.730863","2620:0:861:ed1a::1","2600:8805:3803:6100:357c:4644:40b6:e846","TCP","1514","443  >  51704 [ACK] Seq=129407 Ack=2923 Win=83 Len=1428 TSval=2877996856 TSecr=3262599159 [TCP segment of a reassembled PDU]"
"183","3.730864","2620:0:861:ed1a::1","2600:8805:3803:6100:357c:4644:40b6:e846","TLSv1.2","1492","Application Data"
"184","3.730864","2620:0:861:ed1a::1","2600:8805:3803:6100:357c:4644:40b6:e846","TCP","1514","443  >  51704 [ACK] Seq=132241 Ack=2923 Win=83 Len=1428 TSval=2877996857 TSecr=3262599159 [TCP segment of a reassembled PDU]"
"185","3.730864","2620:0:861:ed1a::1","2600:8805:3803:6100:357c:4644:40b6:e846","TCP","1514","443  >  51704 [ACK] Seq=133669 Ack=2923 Win=83 Len=1428 TSval=2877996857 TSecr=3262599159 [TCP segment of a reassembled PDU]"
"186","3.730865","2620:0:861:ed1a::1","2600:8805:3803:6100:357c:4644:40b6:e846","TLSv1.2","893","Application Data"
"187","3.730865","2620:0:861:ed1a::1","2600:8805:3803:6100:357c:4644:40b6:e846","TCP","1514","443  >  51704 [ACK] Seq=135904 Ack=2923 Win=83 Len=1428 TSval=2877996857 TSecr=3262599159 [TCP segment of a reassembled PDU]"
"188","3.730866","2620:0:861:ed1a::1","2600:8805:3803:6100:357c:4644:40b6:e846","TCP","1514","443  >  51704 [ACK] Seq=137332 Ack=2923 Win=83 Len=1428 TSval=2877996857 TSecr=3262599159 [TCP segment of a reassembled PDU]"
"189","3.730866","2620:0:861:ed1a::1","2600:8805:3803:6100:357c:4644:40b6:e846","TCP","1514","443  >  51704 [ACK] Seq=138760 Ack=2923 Win=83 Len=1428 TSval=2877996857 TSecr=3262599159 [TCP segment of a reassembled PDU]"
"190","3.730866","2620:0:861:ed1a::1","2600:8805:3803:6100:357c:4644:40b6:e846","TLSv1.2","1372","Application Data"
"191","3.730866","2620:0:861:ed1a::1","2600:8805:3803:6100:357c:4644:40b6:e846","TCP","1514","443  >  51704 [ACK] Seq=141474 Ack=2923 Win=83 Len=1428 TSval=2877996857 TSecr=3262599159 [TCP segment of a reassembled PDU]"
"192","3.730867","2620:0:861:ed1a::1","2600:8805:3803:6100:357c:4644:40b6:e846","TCP","1514","443  >  51704 [ACK] Seq=142902 Ack=2923 Win=83 Len=1428 TSval=2877996857 TSecr=3262599159 [TCP segment of a reassembled PDU]"
"193","3.730867","2620:0:861:ed1a::1","2600:8805:3803:6100:357c:4644:40b6:e846","TCP","1514","443  >  51704 [ACK] Seq=144330 Ack=2923 Win=83 Len=1428 TSval=2877996857 TSecr=3262599159 [TCP segment of a reassembled PDU]"
"194","3.730868","2620:0:861:ed1a::1","2600:8805:3803:6100:357c:4644:40b6:e846","TLSv1.2","269","Application Data"
"195","3.730868","2620:0:861:ed1a::1","2600:8805:3803:6100:357c:4644:40b6:e846","TCP","1514","443  >  51704 [ACK] Seq=145941 Ack=2923 Win=83 Len=1428 TSval=2877996858 TSecr=3262599159 [TCP segment of a reassembled PDU]"
"196","3.730868","2620:0:861:ed1a::1","2600:8805:3803:6100:357c:4644:40b6:e846","TCP","1514","443  >  51704 [ACK] Seq=147369 Ack=2923 Win=83 Len=1428 TSval=2877996858 TSecr=3262599159 [TCP segment of a reassembled PDU]"
"197","3.730869","2620:0:861:ed1a::1","2600:8805:3803:6100:357c:4644:40b6:e846","TCP","1514","443  >  51704 [ACK] Seq=148797 Ack=2923 Win=83 Len=1428 TSval=2877996858 TSecr=3262599159 [TCP segment of a reassembled PDU]"
"198","3.730869","2620:0:861:ed1a::1","2600:8805:3803:6100:357c:4644:40b6:e846","TLSv1.2","327","Application Data"
"199","3.730963","2600:8805:3803:6100:357c:4644:40b6:e846","2620:0:861:ed1a::1","TCP","86","51704  >  443 [ACK] Seq=3029 Ack=142902 Win=7727 Len=0 TSval=3262599196 TSecr=2877996857"
"200","3.731615","2600:8805:3803:6100:357c:4644:40b6:e846","2620:0:861:ed1a::1","TCP","86","51704  >  443 [ACK] Seq=3029 Ack=150466 Win=7960 Len=0 TSval=3262599196 TSecr=2877996858"
"201","3.737864","2600:8805:3803:6100:357c:4644:40b6:e846","2620:0:861:ed1a::1","TLSv1.2","192","Application Data"
"202","3.738018","2600:8805:3803:6100:357c:4644:40b6:e846","2620:0:861:ed1a::1","TLSv1.2","192","Application Data"
"203","3.738071","2600:8805:3803:6100:357c:4644:40b6:e846","2620:0:861:ed1a::1","TLSv1.2","192","Application Data"
"204","3.738110","2600:8805:3803:6100:357c:4644:40b6:e846","2620:0:861:ed1a::1","TLSv1.2","192","Application Data"
"205","3.738143","2600:8805:3803:6100:357c:4644:40b6:e846","2620:0:861:ed1a::1","TLSv1.2","193","Application Data"
"206","3.763169","2620:0:861:ed1a::1","2600:8805:3803:6100:357c:4644:40b6:e846","TCP","86","443  >  51704 [ACK] Seq=150466 Ack=3135 Win=83 Len=0 TSval=2877996890 TSecr=3262599194"
"207","3.763170","2620:0:861:ed1a::1","2600:8805:3803:6100:357c:4644:40b6:e846","TCP","86","[TCP Dup ACK 206#1] 443  >  51704 [ACK] Seq=150466 Ack=3135 Win=83 Len=0 TSval=2877996890 TSecr=3262599194"
"208","3.763170","2620:0:861:ed1a::1","2600:8805:3803:6100:357c:4644:40b6:e846","TCP","86","443  >  51704 [ACK] Seq=150466 Ack=3560 Win=83 Len=0 TSval=2877996890 TSecr=3262599203"
"209","3.772040","2620:0:861:ed1a::1","2600:8805:3803:6100:357c:4644:40b6:e846","TCP","1514","443  >  51704 [ACK] Seq=150466 Ack=3560 Win=83 Len=1428 TSval=2877996899 TSecr=3262599203 [TCP segment of a reassembled PDU]"
"210","3.772040","2620:0:861:ed1a::1","2600:8805:3803:6100:357c:4644:40b6:e846","TCP","1514","443  >  51704 [ACK] Seq=151894 Ack=3560 Win=83 Len=1428 TSval=2877996899 TSecr=3262599203 [TCP segment of a reassembled PDU]"
"211","3.772041","2620:0:861:ed1a::1","2600:8805:3803:6100:357c:4644:40b6:e846","TCP","1514","443  >  51704 [ACK] Seq=153322 Ack=3560 Win=83 Len=1428 TSval=2877996899 TSecr=3262599203 [TCP segment of a reassembled PDU]"
"212","3.772041","2620:0:861:ed1a::1","2600:8805:3803:6100:357c:4644:40b6:e846","TLSv1.2","700","Application Data"
"213","3.772230","2600:8805:3803:6100:357c:4644:40b6:e846","2620:0:861:ed1a::1","TCP","86","51704  >  443 [ACK] Seq=3560 Ack=155364 Win=7960 Len=0 TSval=3262599237 TSecr=2877996899"
"214","3.773065","2620:0:861:ed1a::1","2600:8805:3803:6100:357c:4644:40b6:e846","TCP","1514","443  >  51704 [ACK] Seq=155364 Ack=3560 Win=83 Len=1428 TSval=2877996900 TSecr=3262599203 [TCP segment of a reassembled PDU]"
"215","3.773065","2620:0:861:ed1a::1","2600:8805:3803:6100:357c:4644:40b6:e846","TCP","1514","443  >  51704 [ACK] Seq=156792 Ack=3560 Win=83 Len=1428 TSval=2877996900 TSecr=3262599203 [TCP segment of a reassembled PDU]"
"216","3.773065","2620:0:861:ed1a::1","2600:8805:3803:6100:357c:4644:40b6:e846","TCP","1514","443  >  51704 [ACK] Seq=158220 Ack=3560 Win=83 Len=1428 TSval=2877996900 TSecr=3262599203 [TCP segment of a reassembled PDU]"
"217","3.773066","2620:0:861:ed1a::1","2600:8805:3803:6100:357c:4644:40b6:e846","TLSv1.2","300","Application Data"
"218","3.773066","2620:0:861:ed1a::1","2600:8805:3803:6100:357c:4644:40b6:e846","TCP","1514","443  >  51704 [ACK] Seq=159862 Ack=3560 Win=83 Len=1428 TSval=2877996901 TSecr=3262599203 [TCP segment of a reassembled PDU]"
"219","3.773067","2620:0:861:ed1a::1","2600:8805:3803:6100:357c:4644:40b6:e846","TCP","1514","443  >  51704 [ACK] Seq=161290 Ack=3560 Win=83 Len=1428 TSval=2877996901 TSecr=3262599203 [TCP segment of a reassembled PDU]"
"220","3.773067","2620:0:861:ed1a::1","2600:8805:3803:6100:357c:4644:40b6:e846","TCP","1514","443  >  51704 [ACK] Seq=162718 Ack=3560 Win=83 Len=1428 TSval=2877996901 TSecr=3262599203 [TCP segment of a reassembled PDU]"
"221","3.773067","2620:0:861:ed1a::1","2600:8805:3803:6100:357c:4644:40b6:e846","TLSv1.2","719","Application Data"
"222","3.773068","2620:0:861:ed1a::1","2600:8805:3803:6100:357c:4644:40b6:e846","TCP","1514","443  >  51704 [ACK] Seq=164779 Ack=3560 Win=83 Len=1428 TSval=2877996901 TSecr=3262599203 [TCP segment of a reassembled PDU]"
