"No.","Time","Source","Destination","Protocol","Length","Info"
"1","0.000000","2600:8805:3803:6100:c100:e220:6ae:755","2620:0:861:ed1a::1","TCP","98","55038  >  443 [SYN, ECE, CWR] Seq=0 Win=65535 Len=0 MSS=1440 WS=64 TSval=1238034009 TSecr=0 SACK_PERM"
"2","0.021828","2620:0:861:ed1a::1","2600:8805:3803:6100:c100:e220:6ae:755","TCP","94","443  >  55038 [SYN, ACK, ECE] Seq=0 Ack=1 Win=42840 Len=0 MSS=1440 SACK_PERM TSval=705603342 TSecr=1238034009 WS=512"
"3","0.021928","2600:8805:3803:6100:c100:e220:6ae:755","2620:0:861:ed1a::1","TCP","86","55038  >  443 [ACK] Seq=1 Ack=1 Win=131328 Len=0 TSval=1238034031 TSecr=705603342"
"4","0.022607","2600:8805:3803:6100:c100:e220:6ae:755","2620:0:861:ed1a::1","TCP","1514","55038  >  443 [ACK] Seq=1 Ack=1 Win=131328 Len=1428 TSval=1238034031 TSecr=705603342 [TCP segment of a reassembled PDU]"
"5","0.022641","2600:8805:3803:6100:c100:e220:6ae:755","2620:0:861:ed1a::1","TLSv1.3","721","Client Hello (SNI=meta.wikimedia.org)"
"6","0.047315","2620:0:861:ed1a::1","2600:8805:3803:6100:c100:e220:6ae:755","TCP","86","443  >  55038 [ACK] Seq=1 Ack=2064 Win=40960 Len=0 TSval=705603371 TSecr=1238034031"
"7","0.047689","2620:0:861:ed1a::1","2600:8805:3803:6100:c100:e220:6ae:755","TLSv1.3","340","Server Hello, Change Cipher Spec, Application Data, Application Data"
"8","0.047748","2600:8805:3803:6100:c100:e220:6ae:755","2620:0:861:ed1a::1","TCP","86","55038  >  443 [ACK] Seq=2064 Ack=255 Win=131072 Len=0 TSval=1238034057 TSecr=705603371"
"9","0.048294","2600:8805:3803:6100:c100:e220:6ae:755","2620:0:861:ed1a::1","TLSv1.3","166","Change Cipher Spec, Application Data"
"10","0.048633","2600:8805:3803:6100:c100:e220:6ae:755","2620:0:861:ed1a::1","TLSv1.3","178","Application Data"
"11","0.049009","2600:8805:3803:6100:c100:e220:6ae:755","2620:0:861:ed1a::1","TLSv1.3","776","Application Data"
"12","0.074072","2620:0:861:ed1a::1","2600:8805:3803:6100:c100:e220:6ae:755","TCP","86","443  >  55038 [ACK] Seq=255 Ack=2926 Win=42496 Len=0 TSval=705603398 TSecr=1238034057"
"13","0.074073","2620:0:861:ed1a::1","2600:8805:3803:6100:c100:e220:6ae:755","TLSv1.3","138","Application Data"
"14","0.074233","2600:8805:3803:6100:c100:e220:6ae:755","2620:0:861:ed1a::1","TCP","86","55038  >  443 [ACK] Seq=2926 Ack=307 Win=131008 Len=0 TSval=1238034084 TSecr=705603398"
"15","0.074488","2600:8805:3803:6100:c100:e220:6ae:755","2620:0:861:ed1a::1","TLSv1.3","117","Application Data"
"16","0.124529","2620:0:861:ed1a::1","2600:8805:3803:6100:c100:e220:6ae:755","TLSv1.3","1228","Application Data"
"17","0.124688","2600:8805:3803:6100:c100:e220:6ae:755","2620:0:861:ed1a::1","TCP","86","55038  >  443 [ACK] Seq=2957 Ack=1449 Win=129920 Len=0 TSval=1238034134 TSecr=705603446"
"18","0.130562","2620:0:861:ed1a::1","2600:8805:3803:6100:c100:e220:6ae:755","TCP","1514","443  >  55038 [ACK] Seq=1449 Ack=2957 Win=42496 Len=1428 TSval=705603455 TSecr=1238034084 [TCP segment of a reassembled PDU]"
"19","0.130769","2600:8805:3803:6100:c100:e220:6ae:755","2620:0:861:ed1a::1","TCP","86","55038  >  443 [ACK] Seq=2957 Ack=2877 Win=129600 Len=0 TSval=1238034140 TSecr=705603455"
"20","0.130885","2620:0:861:ed1a::1","2600:8805:3803:6100:c100:e220:6ae:755","TCP","1514","443  >  55038 [PSH, ACK] Seq=2877 Ack=2957 Win=42496 Len=1428 TSval=705603455 TSecr=1238034084 [TCP segment of a reassembled PDU]"
"21","0.130980","2600:8805:3803:6100:c100:e220:6ae:755","2620:0:861:ed1a::1","TCP","86","55038  >  443 [ACK] Seq=2957 Ack=4305 Win=128192 Len=0 TSval=1238034140 TSecr=705603455"
"22","0.131096","2600:8805:3803:6100:c100:e220:6ae:755","2620:0:861:ed1a::1","TCP","86","[TCP Window Update] 55038  >  443 [ACK] Seq=2957 Ack=4305 Win=131072 Len=0 TSval=1238034140 TSecr=705603455"
"23","0.131820","2620:0:861:ed1a::1","2600:8805:3803:6100:c100:e220:6ae:755","TCP","1514","443  >  55038 [ACK] Seq=4305 Ack=2957 Win=42496 Len=1428 TSval=705603455 TSecr=1238034084 [TCP segment of a reassembled PDU]"
"24","0.131908","2600:8805:3803:6100:c100:e220:6ae:755","2620:0:861:ed1a::1","TCP","86","55038  >  443 [ACK] Seq=2957 Ack=5733 Win=129600 Len=0 TSval=1238034141 TSecr=705603455"
"25","0.132191","2620:0:861:ed1a::1","2600:8805:3803:6100:c100:e220:6ae:755","TCP","1514","443  >  55038 [PSH, ACK] Seq=5733 Ack=2957 Win=42496 Len=1428 TSval=705603455 TSecr=1238034084 [TCP segment of a reassembled PDU]"
"26","0.132286","2600:8805:3803:6100:c100:e220:6ae:755","2620:0:861:ed1a::1","TCP","86","55038  >  443 [ACK] Seq=2957 Ack=7161 Win=129600 Len=0 TSval=1238034141 TSecr=705603455"
"27","0.132492","2620:0:861:ed1a::1","2600:8805:3803:6100:c100:e220:6ae:755","TCP","1514","443  >  55038 [ACK] Seq=7161 Ack=2957 Win=42496 Len=1428 TSval=705603455 TSecr=1238034084 [TCP segment of a reassembled PDU]"
"28","0.132494","2620:0:861:ed1a::1","2600:8805:3803:6100:c100:e220:6ae:755","TCP","1514","443  >  55038 [PSH, ACK] Seq=8589 Ack=2957 Win=42496 Len=1428 TSval=705603455 TSecr=1238034084 [TCP segment of a reassembled PDU]"
"29","0.132587","2600:8805:3803:6100:c100:e220:6ae:755","2620:0:861:ed1a::1","TCP","86","55038  >  443 [ACK] Seq=2957 Ack=10017 Win=128192 Len=0 TSval=1238034141 TSecr=705603455"
"30","0.132828","2600:8805:3803:6100:c100:e220:6ae:755","2620:0:861:ed1a::1","TCP","86","[TCP Window Update] 55038  >  443 [ACK] Seq=2957 Ack=10017 Win=131072 Len=0 TSval=1238034141 TSecr=705603455"
"31","0.133893","2620:0:861:ed1a::1","2600:8805:3803:6100:c100:e220:6ae:755","TCP","1514","443  >  55038 [ACK] Seq=10017 Ack=2957 Win=42496 Len=1428 TSval=705603455 TSecr=1238034084 [TCP segment of a reassembled PDU]"
"32","0.133975","2600:8805:3803:6100:c100:e220:6ae:755","2620:0:861:ed1a::1","TCP","86","55038  >  443 [ACK] Seq=2957 Ack=11445 Win=129600 Len=0 TSval=1238034143 TSecr=705603455"
"33","0.136767","2620:0:861:ed1a::1","2600:8805:3803:6100:c100:e220:6ae:755","TCP","1514","443  >  55038 [PSH, ACK] Seq=11445 Ack=2957 Win=42496 Len=1428 TSval=705603455 TSecr=1238034084 [TCP segment of a reassembled PDU]"
"34","0.136768","2620:0:861:ed1a::1","2600:8805:3803:6100:c100:e220:6ae:755","TCP","1514","443  >  55038 [ACK] Seq=12873 Ack=2957 Win=42496 Len=1428 TSval=705603457 TSecr=1238034084 [TCP segment of a reassembled PDU]"
"35","0.136770","2620:0:861:ed1a::1","2600:8805:3803:6100:c100:e220:6ae:755","TCP","1514","443  >  55038 [PSH, ACK] Seq=14301 Ack=2957 Win=42496 Len=1428 TSval=705603457 TSecr=1238034084 [TCP segment of a reassembled PDU]"
"36","0.136770","2620:0:861:ed1a::1","2600:8805:3803:6100:c100:e220:6ae:755","TCP","1514","443  >  55038 [ACK] Seq=15729 Ack=2957 Win=42496 Len=1428 TSval=705603459 TSecr=1238034084 [TCP segment of a reassembled PDU]"
"37","0.136883","2600:8805:3803:6100:c100:e220:6ae:755","2620:0:861:ed1a::1","TCP","86","55038  >  443 [ACK] Seq=2957 Ack=17157 Win=125312 Len=0 TSval=1238034146 TSecr=705603459"
"38","0.137125","2600:8805:3803:6100:c100:e220:6ae:755","2620:0:861:ed1a::1","TCP","86","[TCP Window Update] 55038  >  443 [ACK] Seq=2957 Ack=17157 Win=131072 Len=0 TSval=1238034146 TSecr=705603459"
"39","0.142291","2620:0:861:ed1a::1","2600:8805:3803:6100:c100:e220:6ae:755","TLSv1.3","1514","Application Data"
"40","0.142362","2600:8805:3803:6100:c100:e220:6ae:755","2620:0:861:ed1a::1","TCP","86","55038  >  443 [ACK] Seq=2957 Ack=18585 Win=129600 Len=0 TSval=1238034152 TSecr=705603468"
"41","0.142858","2620:0:861:ed1a::1","2600:8805:3803:6100:c100:e220:6ae:755","TCP","1514","443  >  55038 [PSH, ACK] Seq=18585 Ack=2957 Win=42496 Len=1428 TSval=705603468 TSecr=1238034134 [TCP segment of a reassembled PDU]"
"42","0.142935","2600:8805:3803:6100:c100:e220:6ae:755","2620:0:861:ed1a::1","TCP","86","55038  >  443 [ACK] Seq=2957 Ack=20013 Win=129600 Len=0 TSval=1238034152 TSecr=705603468"
"43","0.147874","2620:0:861:ed1a::1","2600:8805:3803:6100:c100:e220:6ae:755","TCP","1514","443  >  55038 [ACK] Seq=20013 Ack=2957 Win=42496 Len=1428 TSval=705603473 TSecr=1238034140 [TCP segment of a reassembled PDU]"
"44","0.147876","2620:0:861:ed1a::1","2600:8805:3803:6100:c100:e220:6ae:755","TCP","1514","443  >  55038 [PSH, ACK] Seq=21441 Ack=2957 Win=42496 Len=1428 TSval=705603473 TSecr=1238034140 [TCP segment of a reassembled PDU]"
"45","0.147961","2600:8805:3803:6100:c100:e220:6ae:755","2620:0:861:ed1a::1","TCP","86","55038  >  443 [ACK] Seq=2957 Ack=21441 Win=129600 Len=0 TSval=1238034157 TSecr=705603473"
"46","0.148021","2600:8805:3803:6100:c100:e220:6ae:755","2620:0:861:ed1a::1","TCP","86","55038  >  443 [ACK] Seq=2957 Ack=22869 Win=128192 Len=0 TSval=1238034157 TSecr=705603473"
"47","0.148162","2600:8805:3803:6100:c100:e220:6ae:755","2620:0:861:ed1a::1","TCP","86","[TCP Window Update] 55038  >  443 [ACK] Seq=2957 Ack=22869 Win=131072 Len=0 TSval=1238034157 TSecr=705603473"
"48","0.149218","2620:0:861:ed1a::1","2600:8805:3803:6100:c100:e220:6ae:755","TCP","1514","443  >  55038 [ACK] Seq=22869 Ack=2957 Win=42496 Len=1428 TSval=705603474 TSecr=1238034140 [TCP segment of a reassembled PDU]"
"49","0.149310","2600:8805:3803:6100:c100:e220:6ae:755","2620:0:861:ed1a::1","TCP","86","55038  >  443 [ACK] Seq=2957 Ack=24297 Win=129600 Len=0 TSval=1238034159 TSecr=705603474"
"50","0.149555","2620:0:861:ed1a::1","2600:8805:3803:6100:c100:e220:6ae:755","TCP","1514","443  >  55038 [PSH, ACK] Seq=24297 Ack=2957 Win=42496 Len=1428 TSval=705603474 TSecr=1238034140 [TCP segment of a reassembled PDU]"
"51","0.149695","2600:8805:3803:6100:c100:e220:6ae:755","2620:0:861:ed1a::1","TCP","86","55038  >  443 [ACK] Seq=2957 Ack=25725 Win=131072 Len=0 TSval=1238034159 TSecr=705603474"
"52","0.152557","2620:0:861:ed1a::1","2600:8805:3803:6100:c100:e220:6ae:755","TCP","1514","443  >  55038 [ACK] Seq=25725 Ack=2957 Win=42496 Len=1428 TSval=705603477 TSecr=1238034141 [TCP segment of a reassembled PDU]"
"53","0.153137","2620:0:861:ed1a::1","2600:8805:3803:6100:c100:e220:6ae:755","TCP","1514","443  >  55038 [PSH, ACK] Seq=27153 Ack=2957 Win=42496 Len=1428 TSval=705603477 TSecr=1238034141 [TCP segment of a reassembled PDU]"
"54","0.153254","2600:8805:3803:6100:c100:e220:6ae:755","2620:0:861:ed1a::1","TCP","86","55038  >  443 [ACK] Seq=2957 Ack=28581 Win=129600 Len=0 TSval=1238034162 TSecr=705603477"
"55","0.153593","2620:0:861:ed1a::1","2600:8805:3803:6100:c100:e220:6ae:755","TCP","1514","443  >  55038 [ACK] Seq=28581 Ack=2957 Win=42496 Len=1428 TSval=705603478 TSecr=1238034141 [TCP segment of a reassembled PDU]"
"56","0.153595","2620:0:861:ed1a::1","2600:8805:3803:6100:c100:e220:6ae:755","TCP","1514","443  >  55038 [PSH, ACK] Seq=30009 Ack=2957 Win=42496 Len=1428 TSval=705603478 TSecr=1238034141 [TCP segment of a reassembled PDU]"
"57","0.153676","2600:8805:3803:6100:c100:e220:6ae:755","2620:0:861:ed1a::1","TCP","86","55038  >  443 [ACK] Seq=2957 Ack=31437 Win=128192 Len=0 TSval=1238034163 TSecr=705603478"
"58","0.153791","2600:8805:3803:6100:c100:e220:6ae:755","2620:0:861:ed1a::1","TCP","86","[TCP Window Update] 55038  >  443 [ACK] Seq=2957 Ack=31437 Win=131072 Len=0 TSval=1238034163 TSecr=705603478"
"59","0.155068","2620:0:861:ed1a::1","2600:8805:3803:6100:c100:e220:6ae:755","TCP","1514","443  >  55038 [ACK] Seq=31437 Ack=2957 Win=42496 Len=1428 TSval=705603480 TSecr=1238034146 [TCP segment of a reassembled PDU]"
"60","0.155390","2620:0:861:ed1a::1","2600:8805:3803:6100:c100:e220:6ae:755","TLSv1.3","1514","Application Data"
"61","0.155451","2600:8805:3803:6100:c100:e220:6ae:755","2620:0:861:ed1a::1","TCP","86","55038  >  443 [ACK] Seq=2957 Ack=34293 Win=129600 Len=0 TSval=1238034165 TSecr=705603480"
"62","0.156842","2620:0:861:ed1a::1","2600:8805:3803:6100:c100:e220:6ae:755","TCP","1514","443  >  55038 [ACK] Seq=34293 Ack=2957 Win=42496 Len=1428 TSval=705603482 TSecr=1238034146 [TCP segment of a reassembled PDU]"
"63","0.157147","2620:0:861:ed1a::1","2600:8805:3803:6100:c100:e220:6ae:755","TCP","1514","443  >  55038 [PSH, ACK] Seq=35721 Ack=2957 Win=42496 Len=1428 TSval=705603482 TSecr=1238034146 [TCP segment of a reassembled PDU]"
"64","0.157227","2600:8805:3803:6100:c100:e220:6ae:755","2620:0:861:ed1a::1","TCP","86","55038  >  443 [ACK] Seq=2957 Ack=37149 Win=128192 Len=0 TSval=1238034166 TSecr=705603482"
"65","0.157460","2600:8805:3803:6100:c100:e220:6ae:755","2620:0:861:ed1a::1","TCP","86","[TCP Window Update] 55038  >  443 [ACK] Seq=2957 Ack=37149 Win=131072 Len=0 TSval=1238034166 TSecr=705603482"
"66","0.158912","2620:0:861:ed1a::1","2600:8805:3803:6100:c100:e220:6ae:755","TCP","1514","443  >  55038 [ACK] Seq=37149 Ack=2957 Win=42496 Len=1428 TSval=705603484 TSecr=1238034146 [TCP segment of a reassembled PDU]"
"67","0.159982","2620:0:861:ed1a::1","2600:8805:3803:6100:c100:e220:6ae:755","TCP","1514","443  >  55038 [PSH, ACK] Seq=38577 Ack=2957 Win=42496 Len=1428 TSval=705603484 TSecr=1238034146 [TCP segment of a reassembled PDU]"
"68","0.160046","2600:8805:3803:6100:c100:e220:6ae:755","2620:0:861:ed1a::1","TCP","86","55038  >  443 [ACK] Seq=2957 Ack=40005 Win=129600 Len=0 TSval=1238034169 TSecr=705603484"
"69","0.160647","2620:0:861:ed1a::1","2600:8805:3803:6100:c100:e220:6ae:755","TCP","1514","443  >  55038 [ACK] Seq=40005 Ack=2957 Win=42496 Len=1428 TSval=705603486 TSecr=1238034146 [TCP segment of a reassembled PDU]"
"70","0.160707","2600:8805:3803:6100:c100:e220:6ae:755","2620:0:861:ed1a::1","TCP","86","55038  >  443 [ACK] Seq=2957 Ack=41433 Win=131072 Len=0 TSval=1238034169 TSecr=705603486"
"71","0.161265","2620:0:861:ed1a::1","2600:8805:3803:6100:c100:e220:6ae:755","TCP","1514","443  >  55038 [PSH, ACK] Seq=41433 Ack=2957 Win=42496 Len=1428 TSval=705603486 TSecr=1238034146 [TCP segment of a reassembled PDU]"
"72","0.161345","2600:8805:3803:6100:c100:e220:6ae:755","2620:0:861:ed1a::1","TCP","86","55038  >  443 [ACK] Seq=2957 Ack=42861 Win=131072 Len=0 TSval=1238034171 TSecr=705603486"
"73","0.162345","2620:0:861:ed1a::1","2600:8805:3803:6100:c100:e220:6ae:755","TCP","1514","443  >  55038 [ACK] Seq=42861 Ack=2957 Win=42496 Len=1428 TSval=705603488 TSecr=1238034152 [TCP segment of a reassembled PDU]"
"74","0.162798","2620:0:861:ed1a::1","2600:8805:3803:6100:c100:e220:6ae:755","TCP","1514","443  >  55038 [PSH, ACK] Seq=44289 Ack=2957 Win=42496 Len=1428 TSval=705603488 TSecr=1238034152 [TCP segment of a reassembled PDU]"
"75","0.162847","2600:8805:3803:6100:c100:e220:6ae:755","2620:0:861:ed1a::1","TCP","86","55038  >  443 [ACK] Seq=2957 Ack=45717 Win=129600 Len=0 TSval=1238034172 TSecr=705603488"
"76","0.163762","2620:0:861:ed1a::1","2600:8805:3803:6100:c100:e220:6ae:755","TCP","1514","443  >  55038 [ACK] Seq=45717 Ack=2957 Win=42496 Len=1428 TSval=705603489 TSecr=1238034152 [TCP segment of a reassembled PDU]"
"77","0.163803","2600:8805:3803:6100:c100:e220:6ae:755","2620:0:861:ed1a::1","TCP","86","55038  >  443 [ACK] Seq=2957 Ack=47145 Win=131072 Len=0 TSval=1238034173 TSecr=705603489"
"78","0.163925","2620:0:861:ed1a::1","2600:8805:3803:6100:c100:e220:6ae:755","TCP","1514","443  >  55038 [PSH, ACK] Seq=47145 Ack=2957 Win=42496 Len=1428 TSval=705603489 TSecr=1238034152 [TCP segment of a reassembled PDU]"
"79","0.163956","2600:8805:3803:6100:c100:e220:6ae:755","2620:0:861:ed1a::1","TCP","86","55038  >  443 [ACK] Seq=2957 Ack=48573 Win=131072 Len=0 TSval=1238034173 TSecr=705603489"
"80","0.164661","2620:0:861:ed1a::1","2600:8805:3803:6100:c100:e220:6ae:755","TCP","1514","443  >  55038 [ACK] Seq=48573 Ack=2957 Win=42496 Len=1428 TSval=705603490 TSecr=1238034152 [TCP segment of a reassembled PDU]"
"81","0.165111","2620:0:861:ed1a::1","2600:8805:3803:6100:c100:e220:6ae:755","TLSv1.3","1514","Application Data"
"82","0.165142","2600:8805:3803:6100:c100:e220:6ae:755","2620:0:861:ed1a::1","TCP","86","55038  >  443 [ACK] Seq=2957 Ack=51429 Win=129600 Len=0 TSval=1238034175 TSecr=705603490"
"83","0.166357","2620:0:861:ed1a::1","2600:8805:3803:6100:c100:e220:6ae:755","TLSv1.3","1475","Application Data"
"84","0.166390","2600:8805:3803:6100:c100:e220:6ae:755","2620:0:861:ed1a::1","TCP","86","55038  >  443 [ACK] Seq=2957 Ack=52818 Win=129664 Len=0 TSval=1238034176 TSecr=705603491"
"85","1.743802","2600:8805:3803:6100:c100:e220:6ae:755","2620:0:861:ed1a::1","TLSv1.3","216","Application Data"
"86","1.750990","2600:8805:3803:6100:c100:e220:6ae:755","2620:0:861:ed1a::1","TLSv1.3","266","Application Data"
"87","1.751060","2600:8805:3803:6100:c100:e220:6ae:755","2620:0:861:ed1a::1","TLSv1.3","194","Application Data"
"88","1.753811","2600:8805:3803:6100:c100:e220:6ae:755","2620:0:861:ed1a::1","TLSv1.3","122","Application Data"
"89","1.760886","2600:8805:3803:6100:c100:e220:6ae:755","2620:0:861:ed1a::1","TLSv1.3","225","Application Data"
"90","1.772959","2620:0:861:ed1a::1","2600:8805:3803:6100:c100:e220:6ae:755","TCP","86","443  >  55038 [ACK] Seq=52818 Ack=3375 Win=42496 Len=0 TSval=705605098 TSecr=1238035753"
"91","1.773348","2620:0:861:ed1a::1","2600:8805:3803:6100:c100:e220:6ae:755","TCP","1514","443  >  55038 [ACK] Seq=52818 Ack=3411 Win=42496 Len=1428 TSval=705605099 TSecr=1238035763 [TCP segment of a reassembled PDU]"
"92","1.773394","2600:8805:3803:6100:c100:e220:6ae:755","2620:0:861:ed1a::1","TCP","86","55038  >  443 [ACK] Seq=3550 Ack=54246 Win=129600 Len=0 TSval=1238035782 TSecr=705605099"
"93","1.773807","2620:0:861:ed1a::1","2600:8805:3803:6100:c100:e220:6ae:755","TLSv1.3","270","Application Data"
"94","1.773807","2620:0:861:ed1a::1","2600:8805:3803:6100:c100:e220:6ae:755","TLSv1.3","1493","Application Data"
"95","1.773834","2600:8805:3803:6100:c100:e220:6ae:755","2620:0:861:ed1a::1","TCP","86","55038  >  443 [ACK] Seq=3550 Ack=55837 Win=129472 Len=0 TSval=1238035782 TSecr=705605099"
"96","1.777758","2620:0:861:ed1a::1","2600:8805:3803:6100:c100:e220:6ae:755","TCP","1514","443  >  55038 [ACK] Seq=55837 Ack=3550 Win=42496 Len=1428 TSval=705605103 TSecr=1238035770 [TCP segment of a reassembled PDU]"
"97","1.777871","2600:8805:3803:6100:c100:e220:6ae:755","2620:0:861:ed1a::1","TCP","86","55038  >  443 [ACK] Seq=3550 Ack=57265 Win=129600 Len=0 TSval=1238035787 TSecr=705605103"
"98","1.778118","2620:0:861:ed1a::1","2600:8805:3803:6100:c100:e220:6ae:755","TCP","1514","443  >  55038 [PSH, ACK] Seq=57265 Ack=3550 Win=42496 Len=1428 TSval=705605103 TSecr=1238035770 [TCP segment of a reassembled PDU]"
"99","1.778175","2600:8805:3803:6100:c100:e220:6ae:755","2620:0:861:ed1a::1","TCP","86","55038  >  443 [ACK] Seq=3550 Ack=58693 Win=129600 Len=0 TSval=1238035787 TSecr=705605103"
"100","1.778665","2620:0:861:ed1a::1","2600:8805:3803:6100:c100:e220:6ae:755","TCP","1514","443  >  55038 [ACK] Seq=58693 Ack=3550 Win=42496 Len=1428 TSval=705605103 TSecr=1238035770 [TCP segment of a reassembled PDU]"
"101","1.778720","2600:8805:3803:6100:c100:e220:6ae:755","2620:0:861:ed1a::1","TCP","86","55038  >  443 [ACK] Seq=3550 Ack=60121 Win=129600 Len=0 TSval=1238035787 TSecr=705605103"
"102","1.778989","2620:0:861:ed1a::1","2600:8805:3803:6100:c100:e220:6ae:755","TCP","1514","443  >  55038 [PSH, ACK] Seq=60121 Ack=3550 Win=42496 Len=1428 TSval=705605103 TSecr=1238035770 [TCP segment of a reassembled PDU]"
"103","1.779046","2600:8805:3803:6100:c100:e220:6ae:755","2620:0:861:ed1a::1","TCP","86","55038  >  443 [ACK] Seq=3550 Ack=61549 Win=129600 Len=0 TSval=1238035788 TSecr=705605103"
"104","1.779644","2620:0:861:ed1a::1","2600:8805:3803:6100:c100:e220:6ae:755","TCP","1514","443  >  55038 [ACK] Seq=61549 Ack=3550 Win=42496 Len=1428 TSval=705605104 TSecr=1238035770 [TCP segment of a reassembled PDU]"
"105","1.779645","2620:0:861:ed1a::1","2600:8805:3803:6100:c100:e220:6ae:755","TCP","1514","443  >  55038 [PSH, ACK] Seq=62977 Ack=3550 Win=42496 Len=1428 TSval=705605104 TSecr=1238035770 [TCP segment of a reassembled PDU]"
"106","1.779665","2600:8805:3803:6100:c100:e220:6ae:755","2620:0:861:ed1a::1","TCP","86","55038  >  443 [ACK] Seq=3550 Ack=64405 Win=128192 Len=0 TSval=1238035788 TSecr=705605104"
"107","1.779696","2600:8805:3803:6100:c100:e220:6ae:755","2620:0:861:ed1a::1","TCP","86","[TCP Window Update] 55038  >  443 [ACK] Seq=3550 Ack=64405 Win=131072 Len=0 TSval=1238035788 TSecr=705605104"
"108","1.780057","2620:0:861:ed1a::1","2600:8805:3803:6100:c100:e220:6ae:755","TCP","1514","443  >  55038 [ACK] Seq=64405 Ack=3550 Win=42496 Len=1428 TSval=705605105 TSecr=1238035770 [TCP segment of a reassembled PDU]"
"109","1.780057","2620:0:861:ed1a::1","2600:8805:3803:6100:c100:e220:6ae:755","TCP","1514","443  >  55038 [PSH, ACK] Seq=65833 Ack=3550 Win=42496 Len=1428 TSval=705605105 TSecr=1238035770 [TCP segment of a reassembled PDU]"
"110","1.780085","2600:8805:3803:6100:c100:e220:6ae:755","2620:0:861:ed1a::1","TCP","86","55038  >  443 [ACK] Seq=3550 Ack=67261 Win=128192 Len=0 TSval=1238035789 TSecr=705605105"
"111","1.780114","2600:8805:3803:6100:c100:e220:6ae:755","2620:0:861:ed1a::1","TCP","86","[TCP Window Update] 55038  >  443 [ACK] Seq=3550 Ack=67261 Win=131072 Len=0 TSval=1238035789 TSecr=705605105"
"112","1.781793","2620:0:861:ed1a::1","2600:8805:3803:6100:c100:e220:6ae:755","TCP","1514","443  >  55038 [ACK] Seq=67261 Ack=3550 Win=42496 Len=1428 TSval=705605105 TSecr=1238035770 [TCP segment of a reassembled PDU]"
"113","1.781794","2620:0:861:ed1a::1","2600:8805:3803:6100:c100:e220:6ae:755","TCP","1514","443  >  55038 [PSH, ACK] Seq=68689 Ack=3550 Win=42496 Len=1428 TSval=705605105 TSecr=1238035770 [TCP segment of a reassembled PDU]"
"114","1.781836","2600:8805:3803:6100:c100:e220:6ae:755","2620:0:861:ed1a::1","TCP","86","55038  >  443 [ACK] Seq=3550 Ack=70117 Win=128192 Len=0 TSval=1238035791 TSecr=705605105"
"115","1.781894","2600:8805:3803:6100:c100:e220:6ae:755","2620:0:861:ed1a::1","TCP","86","[TCP Window Update] 55038  >  443 [ACK] Seq=3550 Ack=70117 Win=131072 Len=0 TSval=1238035791 TSecr=705605105"
"116","1.782354","2620:0:861:ed1a::1","2600:8805:3803:6100:c100:e220:6ae:755","TLSv1.3","1514","Application Data"
"117","1.782354","2620:0:861:ed1a::1","2600:8805:3803:6100:c100:e220:6ae:755","TCP","1514","443  >  55038 [PSH, ACK] Seq=71545 Ack=3550 Win=42496 Len=1428 TSval=705605106 TSecr=1238035770 [TCP segment of a reassembled PDU]"
"118","1.782355","2620:0:861:ed1a::1","2600:8805:3803:6100:c100:e220:6ae:755","TLSv1.3","1138","Application Data"
"119","1.782369","2600:8805:3803:6100:c100:e220:6ae:755","2620:0:861:ed1a::1","TCP","86","55038  >  443 [ACK] Seq=3550 Ack=74025 Win=127104 Len=0 TSval=1238035791 TSecr=705605107"
"120","1.782391","2600:8805:3803:6100:c100:e220:6ae:755","2620:0:861:ed1a::1","TCP","86","[TCP Window Update] 55038  >  443 [ACK] Seq=3550 Ack=74025 Win=131072 Len=0 TSval=1238035791 TSecr=705605107"
"121","1.794824","2620:0:861:ed1a::1","2600:8805:3803:6100:c100:e220:6ae:755","TCP","1514","443  >  55038 [ACK] Seq=74025 Ack=3550 Win=42496 Len=1428 TSval=705605120 TSecr=1238035787 [TCP segment of a reassembled PDU]"
"122","1.794887","2600:8805:3803:6100:c100:e220:6ae:755","2620:0:861:ed1a::1","TCP","86","55038  >  443 [ACK] Seq=3550 Ack=75453 Win=129600 Len=0 TSval=1238035804 TSecr=705605120"
"123","1.795041","2620:0:861:ed1a::1","2600:8805:3803:6100:c100:e220:6ae:755","TCP","1514","443  >  55038 [PSH, ACK] Seq=75453 Ack=3550 Win=42496 Len=1428 TSval=705605120 TSecr=1238035787 [TCP segment of a reassembled PDU]"
"124","1.795098","2600:8805:3803:6100:c100:e220:6ae:755","2620:0:861:ed1a::1","TCP","86","55038  >  443 [ACK] Seq=3550 Ack=76881 Win=129600 Len=0 TSval=1238035804 TSecr=705605120"
"125","1.795438","2620:0:861:ed1a::1","2600:8805:3803:6100:c100:e220:6ae:755","TCP","1514","443  >  55038 [ACK] Seq=76881 Ack=3550 Win=42496 Len=1428 TSval=705605121 TSecr=1238035787 [TCP segment of a reassembled PDU]"
"126","1.795439","2620:0:861:ed1a::1","2600:8805:3803:6100:c100:e220:6ae:755","TCP","1514","443  >  55038 [PSH, ACK] Seq=78309 Ack=3550 Win=42496 Len=1428 TSval=705605121 TSecr=1238035787 [TCP segment of a reassembled PDU]"
"127","1.795492","2600:8805:3803:6100:c100:e220:6ae:755","2620:0:861:ed1a::1","TCP","86","55038  >  443 [ACK] Seq=3550 Ack=79737 Win=128192 Len=0 TSval=1238035804 TSecr=705605121"
"128","1.795525","2600:8805:3803:6100:c100:e220:6ae:755","2620:0:861:ed1a::1","TCP","86","[TCP Window Update] 55038  >  443 [ACK] Seq=3550 Ack=79737 Win=131072 Len=0 TSval=1238035804 TSecr=705605121"
"129","1.795777","2620:0:861:ed1a::1","2600:8805:3803:6100:c100:e220:6ae:755","TCP","1514","443  >  55038 [ACK] Seq=79737 Ack=3550 Win=42496 Len=1428 TSval=705605121 TSecr=1238035787 [TCP segment of a reassembled PDU]"
"130","1.795808","2600:8805:3803:6100:c100:e220:6ae:755","2620:0:861:ed1a::1","TCP","86","55038  >  443 [ACK] Seq=3550 Ack=81165 Win=129600 Len=0 TSval=1238035804 TSecr=705605121"
"131","1.796143","2620:0:861:ed1a::1","2600:8805:3803:6100:c100:e220:6ae:755","TCP","1514","443  >  55038 [PSH, ACK] Seq=81165 Ack=3550 Win=42496 Len=1428 TSval=705605121 TSecr=1238035787 [TCP segment of a reassembled PDU]"
"132","1.796178","2600:8805:3803:6100:c100:e220:6ae:755","2620:0:861:ed1a::1","TCP","86","55038  >  443 [ACK] Seq=3550 Ack=82593 Win=129600 Len=0 TSval=1238035805 TSecr=705605121"
"133","1.796779","2620:0:861:ed1a::1","2600:8805:3803:6100:c100:e220:6ae:755","TCP","1514","443  >  55038 [ACK] Seq=82593 Ack=3550 Win=42496 Len=1428 TSval=705605122 TSecr=1238035788 [TCP segment of a reassembled PDU]"
"134","1.796828","2600:8805:3803:6100:c100:e220:6ae:755","2620:0:861:ed1a::1","TCP","86","55038  >  443 [ACK] Seq=3550 Ack=84021 Win=129600 Len=0 TSval=1238035805 TSecr=705605122"
"135","1.797044","2620:0:861:ed1a::1","2600:8805:3803:6100:c100:e220:6ae:755","TCP","1514","443  >  55038 [PSH, ACK] Seq=84021 Ack=3550 Win=42496 Len=1428 TSval=705605122 TSecr=1238035788 [TCP segment of a reassembled PDU]"
"136","1.797111","2600:8805:3803:6100:c100:e220:6ae:755","2620:0:861:ed1a::1","TCP","86","55038  >  443 [ACK] Seq=3550 Ack=85449 Win=131072 Len=0 TSval=1238035806 TSecr=705605122"
"137","1.797455","2620:0:861:ed1a::1","2600:8805:3803:6100:c100:e220:6ae:755","TCP","1514","443  >  55038 [ACK] Seq=85449 Ack=3550 Win=42496 Len=1428 TSval=705605123 TSecr=1238035788 [TCP segment of a reassembled PDU]"
"138","1.797456","2620:0:861:ed1a::1","2600:8805:3803:6100:c100:e220:6ae:755","TCP","1514","443  >  55038 [PSH, ACK] Seq=86877 Ack=3550 Win=42496 Len=1428 TSval=705605123 TSecr=1238035788 [TCP segment of a reassembled PDU]"
"139","1.797498","2600:8805:3803:6100:c100:e220:6ae:755","2620:0:861:ed1a::1","TCP","86","55038  >  443 [ACK] Seq=3550 Ack=88305 Win=128192 Len=0 TSval=1238035806 TSecr=705605123"
"140","1.797561","2600:8805:3803:6100:c100:e220:6ae:755","2620:0:861:ed1a::1","TCP","86","[TCP Window Update] 55038  >  443 [ACK] Seq=3550 Ack=88305 Win=131072 Len=0 TSval=1238035806 TSecr=705605123"
"141","1.798524","2620:0:861:ed1a::1","2600:8805:3803:6100:c100:e220:6ae:755","TLSv1.3","1514","Application Data"
"142","1.799239","2620:0:861:ed1a::1","2600:8805:3803:6100:c100:e220:6ae:755","TCP","1514","443  >  55038 [PSH, ACK] Seq=89733 Ack=3550 Win=42496 Len=1428 TSval=705605123 TSecr=1238035788 [TCP segment of a reassembled PDU]"
"143","1.799240","2620:0:861:ed1a::1","2600:8805:3803:6100:c100:e220:6ae:755","TCP","1514","443  >  55038 [ACK] Seq=91161 Ack=3550 Win=42496 Len=1428 TSval=705605124 TSecr=1238035788 [TCP segment of a reassembled PDU]"
"144","1.799241","2620:0:861:ed1a::1","2600:8805:3803:6100:c100:e220:6ae:755","TCP","1514","443  >  55038 [PSH, ACK] Seq=92589 Ack=3550 Win=42496 Len=1428 TSval=705605124 TSecr=1238035788 [TCP segment of a reassembled PDU]"
"145","1.799320","2600:8805:3803:6100:c100:e220:6ae:755","2620:0:861:ed1a::1","TCP","86","55038  >  443 [ACK] Seq=3550 Ack=94017 Win=126784 Len=0 TSval=1238035808 TSecr=705605123"
"146","1.799450","2600:8805:3803:6100:c100:e220:6ae:755","2620:0:861:ed1a::1","TCP","86","[TCP Window Update] 55038  >  443 [ACK] Seq=3550 Ack=94017 Win=131072 Len=0 TSval=1238035808 TSecr=705605123"
"147","1.799817","2620:0:861:ed1a::1","2600:8805:3803:6100:c100:e220:6ae:755","TCP","1514","443  >  55038 [ACK] Seq=94017 Ack=3550 Win=42496 Len=1428 TSval=705605125 TSecr=1238035788 [TCP segment of a reassembled PDU]"
"148","1.800086","2620:0:861:ed1a::1","2600:8805:3803:6100:c100:e220:6ae:755","TCP","1514","443  >  55038 [PSH, ACK] Seq=95445 Ack=3550 Win=42496 Len=1428 TSval=705605125 TSecr=1238035788 [TCP segment of a reassembled PDU]"
"149","1.800124","2600:8805:3803:6100:c100:e220:6ae:755","2620:0:861:ed1a::1","TCP","86","55038  >  443 [ACK] Seq=3550 Ack=96873 Win=129600 Len=0 TSval=1238035809 TSecr=705605125"
"150","1.800843","2620:0:861:ed1a::1","2600:8805:3803:6100:c100:e220:6ae:755","TCP","1514","443  >  55038 [ACK] Seq=96873 Ack=3550 Win=42496 Len=1428 TSval=705605126 TSecr=1238035788 [TCP segment of a reassembled PDU]"
"151","1.800844","2620:0:861:ed1a::1","2600:8805:3803:6100:c100:e220:6ae:755","TCP","1514","443  >  55038 [PSH, ACK] Seq=98301 Ack=3550 Win=42496 Len=1428 TSval=705605126 TSecr=1238035788 [TCP segment of a reassembled PDU]"
"152","1.800900","2600:8805:3803:6100:c100:e220:6ae:755","2620:0:861:ed1a::1","TCP","86","55038  >  443 [ACK] Seq=3550 Ack=99729 Win=128192 Len=0 TSval=1238035810 TSecr=705605126"
"153","1.800988","2600:8805:3803:6100:c100:e220:6ae:755","2620:0:861:ed1a::1","TCP","86","[TCP Window Update] 55038  >  443 [ACK] Seq=3550 Ack=99729 Win=131072 Len=0 TSval=1238035810 TSecr=705605126"
"154","1.801384","2620:0:861:ed1a::1","2600:8805:3803:6100:c100:e220:6ae:755","TCP","1514","443  >  55038 [ACK] Seq=99729 Ack=3550 Win=42496 Len=1428 TSval=705605126 TSecr=1238035788 [TCP segment of a reassembled PDU]"
"155","1.802071","2620:0:861:ed1a::1","2600:8805:3803:6100:c100:e220:6ae:755","TCP","1514","443  >  55038 [PSH, ACK] Seq=101157 Ack=3550 Win=42496 Len=1428 TSval=705605126 TSecr=1238035788 [TCP segment of a reassembled PDU]"
"156","1.802072","2620:0:861:ed1a::1","2600:8805:3803:6100:c100:e220:6ae:755","TCP","1514","443  >  55038 [ACK] Seq=102585 Ack=3550 Win=42496 Len=1428 TSval=705605127 TSecr=1238035791 [TCP segment of a reassembled PDU]"
"157","1.802142","2600:8805:3803:6100:c100:e220:6ae:755","2620:0:861:ed1a::1","TCP","86","55038  >  443 [ACK] Seq=3550 Ack=104013 Win=128192 Len=0 TSval=1238035812 TSecr=705605126"
"158","1.802325","2600:8805:3803:6100:c100:e220:6ae:755","2620:0:861:ed1a::1","TCP","86","[TCP Window Update] 55038  >  443 [ACK] Seq=3550 Ack=104013 Win=131072 Len=0 TSval=1238035812 TSecr=705605126"
"159","1.802405","2620:0:861:ed1a::1","2600:8805:3803:6100:c100:e220:6ae:755","TLSv1.3","1514","Application Data"
"160","1.802405","2620:0:861:ed1a::1","2600:8805:3803:6100:c100:e220:6ae:755","TCP","1514","443  >  55038 [ACK] Seq=105441 Ack=3550 Win=42496 Len=1428 TSval=705605128 TSecr=1238035791 [TCP segment of a reassembled PDU]"
"161","1.802406","2620:0:861:ed1a::1","2600:8805:3803:6100:c100:e220:6ae:755","TCP","1514","443  >  55038 [PSH, ACK] Seq=106869 Ack=3550 Win=42496 Len=1428 TSval=705605128 TSecr=1238035791 [TCP segment of a reassembled PDU]"
"162","1.802447","2600:8805:3803:6100:c100:e220:6ae:755","2620:0:861:ed1a::1","TCP","86","55038  >  443 [ACK] Seq=3550 Ack=108297 Win=126784 Len=0 TSval=1238035812 TSecr=705605128"
"163","1.802485","2600:8805:3803:6100:c100:e220:6ae:755","2620:0:861:ed1a::1","TCP","86","[TCP Window Update] 55038  >  443 [ACK] Seq=3550 Ack=108297 Win=131072 Len=0 TSval=1238035812 TSecr=705605128"
"164","1.803040","2620:0:861:ed1a::1","2600:8805:3803:6100:c100:e220:6ae:755","TCP","1514","443  >  55038 [ACK] Seq=108297 Ack=3550 Win=42496 Len=1428 TSval=705605128 TSecr=1238035791 [TCP segment of a reassembled PDU]"
"165","1.803342","2620:0:861:ed1a::1","2600:8805:3803:6100:c100:e220:6ae:755","TCP","1514","443  >  55038 [PSH, ACK] Seq=109725 Ack=3550 Win=42496 Len=1428 TSval=705605128 TSecr=1238035791 [TCP segment of a reassembled PDU]"
"166","1.803408","2600:8805:3803:6100:c100:e220:6ae:755","2620:0:861:ed1a::1","TCP","86","55038  >  443 [ACK] Seq=3550 Ack=111153 Win=129600 Len=0 TSval=1238035813 TSecr=705605128"
"167","1.803946","2620:0:861:ed1a::1","2600:8805:3803:6100:c100:e220:6ae:755","TCP","1514","443  >  55038 [ACK] Seq=111153 Ack=3550 Win=42496 Len=1428 TSval=705605129 TSecr=1238035791 [TCP segment of a reassembled PDU]"
"168","1.804011","2600:8805:3803:6100:c100:e220:6ae:755","2620:0:861:ed1a::1","TCP","86","55038  >  443 [ACK] Seq=3550 Ack=112581 Win=131072 Len=0 TSval=1238035813 TSecr=705605129"
"169","1.806102","2620:0:861:ed1a::1","2600:8805:3803:6100:c100:e220:6ae:755","TCP","1514","443  >  55038 [PSH, ACK] Seq=112581 Ack=3550 Win=42496 Len=1428 TSval=705605129 TSecr=1238035791 [TCP segment of a reassembled PDU]"
"170","1.806181","2600:8805:3803:6100:c100:e220:6ae:755","2620:0:861:ed1a::1","TCP","86","55038  >  443 [ACK] Seq=3550 Ack=114009 Win=131072 Len=0 TSval=1238035816 TSecr=705605129"
"171","1.807836","2620:0:861:ed1a::1","2600:8805:3803:6100:c100:e220:6ae:755","TCP","1514","443  >  55038 [ACK] Seq=114009 Ack=3550 Win=42496 Len=1428 TSval=705605130 TSecr=1238035791 [TCP segment of a reassembled PDU]"
"172","1.807837","2620:0:861:ed1a::1","2600:8805:3803:6100:c100:e220:6ae:755","TCP","1514","443  >  55038 [PSH, ACK] Seq=115437 Ack=3550 Win=42496 Len=1428 TSval=705605130 TSecr=1238035791 [TCP segment of a reassembled PDU]"
"173","1.807837","2620:0:861:ed1a::1","2600:8805:3803:6100:c100:e220:6ae:755","TCP","1514","443  >  55038 [ACK] Seq=116865 Ack=3550 Win=42496 Len=1428 TSval=705605131 TSecr=1238035791 [TCP segment of a reassembled PDU]"
"174","1.807838","2620:0:861:ed1a::1","2600:8805:3803:6100:c100:e220:6ae:755","TCP","1514","443  >  55038 [PSH, ACK] Seq=118293 Ack=3550 Win=42496 Len=1428 TSval=705605131 TSecr=1238035791 [TCP segment of a reassembled PDU]"
"175","1.807838","2620:0:861:ed1a::1","2600:8805:3803:6100:c100:e220:6ae:755","TCP","1514","443  >  55038 [ACK] Seq=119721 Ack=3550 Win=42496 Len=1428 TSval=705605131 TSecr=1238035791 [TCP segment of a reassembled PDU]"
"176","1.807839","2620:0:861:ed1a::1","2600:8805:3803:6100:c100:e220:6ae:755","TLSv1.3","1514","Application Data"
"177","1.807839","2620:0:861:ed1a::1","2600:8805:3803:6100:c100:e220:6ae:755","TCP","1514","443  >  55038 [ACK] Seq=122577 Ack=3550 Win=42496 Len=1428 TSval=705605132 TSecr=1238035791 [TCP segment of a reassembled PDU]"
"178","1.807839","2620:0:861:ed1a::1","2600:8805:3803:6100:c100:e220:6ae:755","TCP","1514","443  >  55038 [PSH, ACK] Seq=124005 Ack=3550 Win=42496 Len=1428 TSval=705605132 TSecr=1238035791 [TCP segment of a reassembled PDU]"
"179","1.807840","2620:0:861:ed1a::1","2600:8805:3803:6100:c100:e220:6ae:755","TCP","1514","443  >  55038 [ACK] Seq=125433 Ack=3550 Win=42496 Len=1428 TSval=705605133 TSecr=1238035791 [TCP segment of a reassembled PDU]"
"180","1.807841","2620:0:861:ed1a::1","2600:8805:3803:6100:c100:e220:6ae:755","TCP","1514","443  >  55038 [PSH, ACK] Seq=126861 Ack=3550 Win=42496 Len=1428 TSval=705605133 TSecr=1238035791 [TCP segment of a reassembled PDU]"
"181","1.807899","2600:8805:3803:6100:c100:e220:6ae:755","2620:0:861:ed1a::1","TCP","86","55038  >  443 [ACK] Seq=3550 Ack=128289 Win=116736 Len=0 TSval=1238035817 TSecr=705605133"
"182","1.808035","2600:8805:3803:6100:c100:e220:6ae:755","2620:0:861:ed1a::1","TCP","86","[TCP Window Update] 55038  >  443 [ACK] Seq=3550 Ack=128289 Win=131072 Len=0 TSval=1238035817 TSecr=705605133"
"183","1.808736","2620:0:861:ed1a::1","2600:8805:3803:6100:c100:e220:6ae:755","TCP","1514","443  >  55038 [ACK] Seq=128289 Ack=3550 Win=42496 Len=1428 TSval=705605133 TSecr=1238035791 [TCP segment of a reassembled PDU]"
"184","1.808737","2620:0:861:ed1a::1","2600:8805:3803:6100:c100:e220:6ae:755","TCP","1514","443  >  55038 [PSH, ACK] Seq=129717 Ack=3550 Win=42496 Len=1428 TSval=705605133 TSecr=1238035791 [TCP segment of a reassembled PDU]"
"185","1.808791","2600:8805:3803:6100:c100:e220:6ae:755","2620:0:861:ed1a::1","TCP","86","55038  >  443 [ACK] Seq=3550 Ack=131145 Win=128192 Len=0 TSval=1238035817 TSecr=705605133"
"186","1.808862","2600:8805:3803:6100:c100:e220:6ae:755","2620:0:861:ed1a::1","TCP","86","[TCP Window Update] 55038  >  443 [ACK] Seq=3550 Ack=131145 Win=131072 Len=0 TSval=1238035817 TSecr=705605133"
"187","1.809044","2620:0:861:ed1a::1","2600:8805:3803:6100:c100:e220:6ae:755","TCP","1514","443  >  55038 [ACK] Seq=131145 Ack=3550 Win=42496 Len=1428 TSval=705605134 TSecr=1238035791 [TCP segment of a reassembled PDU]"
"188","1.809045","2620:0:861:ed1a::1","2600:8805:3803:6100:c100:e220:6ae:755","TCP","1514","443  >  55038 [PSH, ACK] Seq=132573 Ack=3550 Win=42496 Len=1428 TSval=705605134 TSecr=1238035791 [TCP segment of a reassembled PDU]"
"189","1.809073","2600:8805:3803:6100:c100:e220:6ae:755","2620:0:861:ed1a::1","TCP","86","55038  >  443 [ACK] Seq=3550 Ack=134001 Win=128192 Len=0 TSval=1238035818 TSecr=705605134"
"190","1.809108","2600:8805:3803:6100:c100:e220:6ae:755","2620:0:861:ed1a::1","TCP","86","[TCP Window Update] 55038  >  443 [ACK] Seq=3550 Ack=134001 Win=131072 Len=0 TSval=1238035818 TSecr=705605134"
"191","1.810154","2620:0:861:ed1a::1","2600:8805:3803:6100:c100:e220:6ae:755","TCP","1514","443  >  55038 [ACK] Seq=134001 Ack=3550 Win=42496 Len=1428 TSval=705605135 TSecr=1238035791 [TCP segment of a reassembled PDU]"
"192","1.810742","2620:0:861:ed1a::1","2600:8805:3803:6100:c100:e220:6ae:755","TCP","1514","443  >  55038 [PSH, ACK] Seq=135429 Ack=3550 Win=42496 Len=1428 TSval=705605135 TSecr=1238035791 [TCP segment of a reassembled PDU]"
"193","1.810742","2620:0:861:ed1a::1","2600:8805:3803:6100:c100:e220:6ae:755","TLSv1.3","1514","Application Data"
"194","1.810743","2620:0:861:ed1a::1","2600:8805:3803:6100:c100:e220:6ae:755","TCP","1514","443  >  55038 [PSH, ACK] Seq=138285 Ack=3550 Win=42496 Len=1428 TSval=705605136 TSecr=1238035791 [TCP segment of a reassembled PDU]"
"195","1.810819","2600:8805:3803:6100:c100:e220:6ae:755","2620:0:861:ed1a::1","TCP","86","55038  >  443 [ACK] Seq=3550 Ack=139713 Win=126784 Len=0 TSval=1238035820 TSecr=705605135"
"196","1.810875","2600:8805:3803:6100:c100:e220:6ae:755","2620:0:861:ed1a::1","TCP","86","[TCP Window Update] 55038  >  443 [ACK] Seq=3550 Ack=139713 Win=131072 Len=0 TSval=1238035820 TSecr=705605135"
"197","1.811073","2620:0:861:ed1a::1","2600:8805:3803:6100:c100:e220:6ae:755","TCP","1514","443  >  55038 [ACK] Seq=139713 Ack=3550 Win=42496 Len=1428 TSval=705605136 TSecr=1238035791 [TCP segment of a reassembled PDU]"
"198","1.811073","2620:0:861:ed1a::1","2600:8805:3803:6100:c100:e220:6ae:755","TCP","1514","443  >  55038 [PSH, ACK] Seq=141141 Ack=3550 Win=42496 Len=1428 TSval=705605136 TSecr=1238035791 [TCP segment of a reassembled PDU]"
"199","1.811101","2600:8805:3803:6100:c100:e220:6ae:755","2620:0:861:ed1a::1","TCP","86","55038  >  443 [ACK] Seq=3550 Ack=142569 Win=128192 Len=0 TSval=1238035820 TSecr=705605136"
"200","1.811153","2600:8805:3803:6100:c100:e220:6ae:755","2620:0:861:ed1a::1","TCP","86","[TCP Window Update] 55038  >  443 [ACK] Seq=3550 Ack=142569 Win=131072 Len=0 TSval=1238035820 TSecr=705605136"
"201","1.812882","2620:0:861:ed1a::1","2600:8805:3803:6100:c100:e220:6ae:755","TCP","1514","443  >  55038 [ACK] Seq=142569 Ack=3550 Win=42496 Len=1428 TSval=705605138 TSecr=1238035805 [TCP segment of a reassembled PDU]"
"202","1.812927","2600:8805:3803:6100:c100:e220:6ae:755","2620:0:861:ed1a::1","TCP","86","55038  >  443 [ACK] Seq=3550 Ack=143997 Win=272384 Len=0 TSval=1238035822 TSecr=705605138"
"203","1.813216","2620:0:861:ed1a::1","2600:8805:3803:6100:c100:e220:6ae:755","TCP","1514","443  >  55038 [PSH, ACK] Seq=143997 Ack=3550 Win=42496 Len=1428 TSval=705605138 TSecr=1238035805 [TCP segment of a reassembled PDU]"
"204","1.813257","2600:8805:3803:6100:c100:e220:6ae:755","2620:0:861:ed1a::1","TCP","86","55038  >  443 [ACK] Seq=3550 Ack=145425 Win=273856 Len=0 TSval=1238035822 TSecr=705605138"
"205","1.814442","2620:0:861:ed1a::1","2600:8805:3803:6100:c100:e220:6ae:755","TCP","1514","443  >  55038 [ACK] Seq=145425 Ack=3550 Win=42496 Len=1428 TSval=705605139 TSecr=1238035805 [TCP segment of a reassembled PDU]"
"206","1.814443","2620:0:861:ed1a::1","2600:8805:3803:6100:c100:e220:6ae:755","TCP","1514","443  >  55038 [PSH, ACK] Seq=146853 Ack=3550 Win=42496 Len=1428 TSval=705605139 TSecr=1238035805 [TCP segment of a reassembled PDU]"
"207","1.814720","2600:8805:3803:6100:c100:e220:6ae:755","2620:0:861:ed1a::1","TCP","86","55038  >  443 [ACK] Seq=3550 Ack=148281 Win=273856 Len=0 TSval=1238035824 TSecr=705605139"
