"No.","Time","Source","Destination","Protocol","Length","Info"
"1","0.000000","2600:8805:3803:6100:c100:e220:6ae:755","2620:0:861:ed1a::1","TLSv1.2","231","Application Data"
"2","0.000093","2600:8805:3803:6100:c100:e220:6ae:755","2620:0:861:ed1a::1","TLSv1.2","125","Application Data"
"3","0.015007","2620:0:861:ed1a::1","2600:8805:3803:6100:c100:e220:6ae:755","TCP","86","443  >  55034 [ACK] Seq=1 Ack=146 Win=83 Len=0 TSval=705697736 TSecr=2193185418"
"4","0.015128","2620:0:861:ed1a::1","2600:8805:3803:6100:c100:e220:6ae:755","TCP","86","443  >  55034 [ACK] Seq=1 Ack=185 Win=83 Len=0 TSval=705697736 TSecr=2193185418"
"5","0.015129","2620:0:861:ed1a::1","2600:8805:3803:6100:c100:e220:6ae:755","TLSv1.2","125","Application Data"
"6","0.015228","2600:8805:3803:6100:c100:e220:6ae:755","2620:0:861:ed1a::1","TCP","86","55034  >  443 [ACK] Seq=185 Ack=40 Win=4903 Len=0 TSval=2193185433 TSecr=705697736"
"7","0.035569","2620:0:861:ed1a::1","2600:8805:3803:6100:c100:e220:6ae:755","TCP","1514","443  >  55034 [ACK] Seq=40 Ack=185 Win=83 Len=1428 TSval=705697757 TSecr=2193185433 [TCP segment of a reassembled PDU]"
"8","0.035733","2600:8805:3803:6100:c100:e220:6ae:755","2620:0:861:ed1a::1","TCP","86","55034  >  443 [ACK] Seq=185 Ack=1468 Win=4881 Len=0 TSval=2193185454 TSecr=705697757"
"9","0.035940","2620:0:861:ed1a::1","2600:8805:3803:6100:c100:e220:6ae:755","TLSv1.2","696","Application Data"
"10","0.036078","2600:8805:3803:6100:c100:e220:6ae:755","2620:0:861:ed1a::1","TCP","86","55034  >  443 [ACK] Seq=185 Ack=2078 Win=4894 Len=0 TSval=2193185454 TSecr=705697757"
"11","0.038876","2600:8805:3803:6100:c100:e220:6ae:755","2620:0:861:ed1a::1","TLSv1.2","121","Application Data"
"12","0.106726","2620:0:861:ed1a::1","2600:8805:3803:6100:c100:e220:6ae:755","TCP","86","443  >  55034 [ACK] Seq=2078 Ack=220 Win=83 Len=0 TSval=705697829 TSecr=2193185457"
"13","0.256622","2600:8805:3803:6100:c100:e220:6ae:755","2620:0:861:ed1a::1","TCP","74","55038  >  443 [ACK] Seq=1 Ack=1 Win=4279 Len=0"
"14","0.273522","2620:0:861:ed1a::1","2600:8805:3803:6100:c100:e220:6ae:755","TCP","86","[TCP ACKed unseen segment] 443  >  55038 [ACK] Seq=1 Ack=2 Win=83 Len=0 TSval=705697993 TSecr=1238038539"
"15","1.140363","2600:8805:3803:6100:c100:e220:6ae:755","2620:0:861:ed1a::1","TLSv1.2","198","Application Data"
"16","1.161140","2620:0:861:ed1a::1","2600:8805:3803:6100:c100:e220:6ae:755","TCP","86","443  >  55034 [ACK] Seq=2078 Ack=332 Win=83 Len=0 TSval=705698883 TSecr=2193186558"
"17","1.683643","2620:0:861:ed1a::1","2600:8805:3803:6100:c100:e220:6ae:755","TLSv1.2","1252","Application Data"
"18","1.683645","2620:0:861:ed1a::1","2600:8805:3803:6100:c100:e220:6ae:755","TCP","1514","443  >  55034 [ACK] Seq=3244 Ack=332 Win=83 Len=1428 TSval=705699336 TSecr=2193186558 [TCP segment of a reassembled PDU]"
"19","1.683647","2620:0:861:ed1a::1","2600:8805:3803:6100:c100:e220:6ae:755","TCP","1514","443  >  55034 [ACK] Seq=4672 Ack=332 Win=83 Len=1428 TSval=705699336 TSecr=2193186558 [TCP segment of a reassembled PDU]"
"20","1.683650","2620:0:861:ed1a::1","2600:8805:3803:6100:c100:e220:6ae:755","TCP","1514","443  >  55034 [ACK] Seq=6100 Ack=332 Win=83 Len=1428 TSval=705699336 TSecr=2193186558 [TCP segment of a reassembled PDU]"
"21","1.683652","2620:0:861:ed1a::1","2600:8805:3803:6100:c100:e220:6ae:755","TCP","1514","443  >  55034 [ACK] Seq=7528 Ack=332 Win=83 Len=1428 TSval=705699336 TSecr=2193186558 [TCP segment of a reassembled PDU]"
"22","1.683653","2620:0:861:ed1a::1","2600:8805:3803:6100:c100:e220:6ae:755","TCP","1514","443  >  55034 [ACK] Seq=8956 Ack=332 Win=83 Len=1428 TSval=705699336 TSecr=2193186558 [TCP segment of a reassembled PDU]"
"23","1.683656","2620:0:861:ed1a::1","2600:8805:3803:6100:c100:e220:6ae:755","TCP","1514","443  >  55034 [PSH, ACK] Seq=10384 Ack=332 Win=83 Len=1428 TSval=705699336 TSecr=2193186558 [TCP segment of a reassembled PDU]"
"24","1.683657","2620:0:861:ed1a::1","2600:8805:3803:6100:c100:e220:6ae:755","TCP","1514","443  >  55034 [ACK] Seq=11812 Ack=332 Win=83 Len=1428 TSval=705699337 TSecr=2193186558 [TCP segment of a reassembled PDU]"
"25","1.683659","2620:0:861:ed1a::1","2600:8805:3803:6100:c100:e220:6ae:755","TCP","1514","443  >  55034 [ACK] Seq=13240 Ack=332 Win=83 Len=1428 TSval=705699337 TSecr=2193186558 [TCP segment of a reassembled PDU]"
"26","1.683661","2620:0:861:ed1a::1","2600:8805:3803:6100:c100:e220:6ae:755","TCP","1514","443  >  55034 [ACK] Seq=14668 Ack=332 Win=83 Len=1428 TSval=705699337 TSecr=2193186558 [TCP segment of a reassembled PDU]"
"27","1.683663","2620:0:861:ed1a::1","2600:8805:3803:6100:c100:e220:6ae:755","TCP","1514","443  >  55034 [ACK] Seq=16096 Ack=332 Win=83 Len=1428 TSval=705699337 TSecr=2193186558 [TCP segment of a reassembled PDU]"
"28","1.683665","2620:0:861:ed1a::1","2600:8805:3803:6100:c100:e220:6ae:755","TCP","1514","443  >  55034 [ACK] Seq=17524 Ack=332 Win=83 Len=1428 TSval=705699337 TSecr=2193186558 [TCP segment of a reassembled PDU]"
"29","1.683667","2620:0:861:ed1a::1","2600:8805:3803:6100:c100:e220:6ae:755","TLSv1.2","721","Application Data"
"30","1.683668","2620:0:861:ed1a::1","2600:8805:3803:6100:c100:e220:6ae:755","TCP","1514","443  >  55034 [ACK] Seq=19587 Ack=332 Win=83 Len=1428 TSval=705699338 TSecr=2193186558 [TCP segment of a reassembled PDU]"
"31","1.683669","2620:0:861:ed1a::1","2600:8805:3803:6100:c100:e220:6ae:755","TLSv1.2","412","Application Data"
"32","1.683672","2620:0:861:ed1a::1","2600:8805:3803:6100:c100:e220:6ae:755","TCP","412","[TCP Retransmission] 443  >  55034 [PSH, ACK] Seq=21015 Ack=332 Win=83 Len=326 TSval=705699385 TSecr=2193186558 [TCP segment of a reassembled PDU]"
"33","1.683862","2600:8805:3803:6100:c100:e220:6ae:755","2620:0:861:ed1a::1","TCP","86","55034  >  443 [ACK] Seq=332 Ack=17524 Win=4662 Len=0 TSval=2193187102 TSecr=705699337"
"34","1.684018","2600:8805:3803:6100:c100:e220:6ae:755","2620:0:861:ed1a::1","TCP","86","55034  >  443 [ACK] Seq=332 Ack=21341 Win=4603 Len=0 TSval=2193187102 TSecr=705699338"
"35","1.684028","2600:8805:3803:6100:c100:e220:6ae:755","2620:0:861:ed1a::1","TCP","98","[TCP Dup ACK 34#1] 55034  >  443 [ACK] Seq=332 Ack=21341 Win=4603 Len=0 TSval=2193187102 TSecr=705699385 SLE=21015 SRE=21341"
"36","1.684243","2600:8805:3803:6100:c100:e220:6ae:755","2620:0:861:ed1a::1","TCP","86","[TCP Window Update] 55034  >  443 [ACK] Seq=332 Ack=21341 Win=4904 Len=0 TSval=2193187102 TSecr=705699385"
"37","1.757652","2600:8805:3803:6100:c100:e220:6ae:755","2620:0:861:ed1a::1","TLSv1.2","535","Application Data"
"38","1.774763","2620:0:861:ed1a::1","2600:8805:3803:6100:c100:e220:6ae:755","TCP","86","443  >  55034 [ACK] Seq=21341 Ack=781 Win=83 Len=0 TSval=705699497 TSecr=2193187176"
"39","1.776164","2620:0:861:ed1a::1","2600:8805:3803:6100:c100:e220:6ae:755","TCP","1514","443  >  55034 [ACK] Seq=21341 Ack=781 Win=83 Len=1428 TSval=705699497 TSecr=2193187176 [TCP segment of a reassembled PDU]"
"40","1.776164","2620:0:861:ed1a::1","2600:8805:3803:6100:c100:e220:6ae:755","TCP","1514","443  >  55034 [ACK] Seq=22769 Ack=781 Win=83 Len=1428 TSval=705699497 TSecr=2193187176 [TCP segment of a reassembled PDU]"
"41","1.776165","2620:0:861:ed1a::1","2600:8805:3803:6100:c100:e220:6ae:755","TCP","1514","443  >  55034 [ACK] Seq=24197 Ack=781 Win=83 Len=1428 TSval=705699497 TSecr=2193187176 [TCP segment of a reassembled PDU]"
"42","1.776165","2620:0:861:ed1a::1","2600:8805:3803:6100:c100:e220:6ae:755","TCP","1514","443  >  55034 [ACK] Seq=25625 Ack=781 Win=83 Len=1428 TSval=705699497 TSecr=2193187176 [TCP segment of a reassembled PDU]"
"43","1.776166","2620:0:861:ed1a::1","2600:8805:3803:6100:c100:e220:6ae:755","TCP","1514","443  >  55034 [ACK] Seq=27053 Ack=781 Win=83 Len=1428 TSval=705699497 TSecr=2193187176 [TCP segment of a reassembled PDU]"
"44","1.776166","2620:0:861:ed1a::1","2600:8805:3803:6100:c100:e220:6ae:755","TCP","1514","443  >  55034 [PSH, ACK] Seq=28481 Ack=781 Win=83 Len=1428 TSval=705699497 TSecr=2193187176 [TCP segment of a reassembled PDU]"
"45","1.776167","2620:0:861:ed1a::1","2600:8805:3803:6100:c100:e220:6ae:755","TCP","1514","443  >  55034 [ACK] Seq=29909 Ack=781 Win=83 Len=1428 TSval=705699497 TSecr=2193187176 [TCP segment of a reassembled PDU]"
"46","1.776167","2620:0:861:ed1a::1","2600:8805:3803:6100:c100:e220:6ae:755","TCP","1514","443  >  55034 [ACK] Seq=31337 Ack=781 Win=83 Len=1428 TSval=705699497 TSecr=2193187176 [TCP segment of a reassembled PDU]"
"47","1.776168","2620:0:861:ed1a::1","2600:8805:3803:6100:c100:e220:6ae:755","TCP","1514","443  >  55034 [ACK] Seq=32765 Ack=781 Win=83 Len=1428 TSval=705699497 TSecr=2193187176 [TCP segment of a reassembled PDU]"
"48","1.776168","2620:0:861:ed1a::1","2600:8805:3803:6100:c100:e220:6ae:755","TCP","1514","443  >  55034 [ACK] Seq=34193 Ack=781 Win=83 Len=1428 TSval=705699497 TSecr=2193187176 [TCP segment of a reassembled PDU]"
"49","1.776169","2620:0:861:ed1a::1","2600:8805:3803:6100:c100:e220:6ae:755","TLSv1.2","463","Application Data"
"50","1.776247","2600:8805:3803:6100:c100:e220:6ae:755","2620:0:861:ed1a::1","TCP","86","55034  >  443 [ACK] Seq=781 Ack=35998 Win=4674 Len=0 TSval=2193187194 TSecr=705699497"
"51","1.776460","2600:8805:3803:6100:c100:e220:6ae:755","2620:0:861:ed1a::1","TCP","86","[TCP Window Update] 55034  >  443 [ACK] Seq=781 Ack=35998 Win=4904 Len=0 TSval=2193187194 TSecr=705699497"
"52","1.777334","2620:0:861:ed1a::1","2600:8805:3803:6100:c100:e220:6ae:755","TCP","1514","443  >  55034 [ACK] Seq=35998 Ack=781 Win=83 Len=1428 TSval=705699498 TSecr=2193187176 [TCP segment of a reassembled PDU]"
"53","1.777335","2620:0:861:ed1a::1","2600:8805:3803:6100:c100:e220:6ae:755","TCP","1514","443  >  55034 [ACK] Seq=37426 Ack=781 Win=83 Len=1428 TSval=705699498 TSecr=2193187176 [TCP segment of a reassembled PDU]"
"54","1.777335","2620:0:861:ed1a::1","2600:8805:3803:6100:c100:e220:6ae:755","TCP","1514","443  >  55034 [ACK] Seq=38854 Ack=781 Win=83 Len=1428 TSval=705699498 TSecr=2193187176 [TCP segment of a reassembled PDU]"
"55","1.777336","2620:0:861:ed1a::1","2600:8805:3803:6100:c100:e220:6ae:755","TCP","1514","443  >  55034 [ACK] Seq=40282 Ack=781 Win=83 Len=1428 TSval=705699498 TSecr=2193187176 [TCP segment of a reassembled PDU]"
"56","1.777336","2620:0:861:ed1a::1","2600:8805:3803:6100:c100:e220:6ae:755","TCP","1514","443  >  55034 [ACK] Seq=41710 Ack=781 Win=83 Len=1428 TSval=705699498 TSecr=2193187176 [TCP segment of a reassembled PDU]"
"57","1.777337","2620:0:861:ed1a::1","2600:8805:3803:6100:c100:e220:6ae:755","TCP","1514","443  >  55034 [PSH, ACK] Seq=43138 Ack=781 Win=83 Len=1428 TSval=705699498 TSecr=2193187176 [TCP segment of a reassembled PDU]"
"58","1.777394","2600:8805:3803:6100:c100:e220:6ae:755","2620:0:861:ed1a::1","TCP","86","55034  >  443 [ACK] Seq=781 Ack=44566 Win=4770 Len=0 TSval=2193187195 TSecr=705699498"
"59","1.777474","2600:8805:3803:6100:c100:e220:6ae:755","2620:0:861:ed1a::1","TCP","86","[TCP Window Update] 55034  >  443 [ACK] Seq=781 Ack=44566 Win=4904 Len=0 TSval=2193187195 TSecr=705699498"
"60","1.778663","2620:0:861:ed1a::1","2600:8805:3803:6100:c100:e220:6ae:755","TCP","1514","443  >  55034 [ACK] Seq=44566 Ack=781 Win=83 Len=1428 TSval=705699499 TSecr=2193187176 [TCP segment of a reassembled PDU]"
"61","1.778663","2620:0:861:ed1a::1","2600:8805:3803:6100:c100:e220:6ae:755","TCP","1514","443  >  55034 [ACK] Seq=45994 Ack=781 Win=83 Len=1428 TSval=705699499 TSecr=2193187176 [TCP segment of a reassembled PDU]"
"62","1.778664","2620:0:861:ed1a::1","2600:8805:3803:6100:c100:e220:6ae:755","TCP","1514","443  >  55034 [ACK] Seq=47422 Ack=781 Win=83 Len=1428 TSval=705699499 TSecr=2193187176 [TCP segment of a reassembled PDU]"
"63","1.778665","2620:0:861:ed1a::1","2600:8805:3803:6100:c100:e220:6ae:755","TCP","1514","443  >  55034 [ACK] Seq=48850 Ack=781 Win=83 Len=1428 TSval=705699499 TSecr=2193187176 [TCP segment of a reassembled PDU]"
"64","1.778665","2620:0:861:ed1a::1","2600:8805:3803:6100:c100:e220:6ae:755","TLSv1.2","89","Application Data"
"65","1.778723","2600:8805:3803:6100:c100:e220:6ae:755","2620:0:861:ed1a::1","TCP","86","55034  >  443 [ACK] Seq=781 Ack=50281 Win=4814 Len=0 TSval=2193187197 TSecr=705699499"
"66","1.778793","2600:8805:3803:6100:c100:e220:6ae:755","2620:0:861:ed1a::1","TCP","86","[TCP Window Update] 55034  >  443 [ACK] Seq=781 Ack=50281 Win=4904 Len=0 TSval=2193187197 TSecr=705699499"
"67","1.780601","2600:8805:3803:6100:c100:e220:6ae:755","2620:0:861:ed1a::1","TLSv1.2","203","Application Data"
"68","1.805044","2620:0:861:ed1a::1","2600:8805:3803:6100:c100:e220:6ae:755","TLSv1.2","1248","Application Data"
"69","1.805110","2600:8805:3803:6100:c100:e220:6ae:755","2620:0:861:ed1a::1","TCP","86","55034  >  443 [ACK] Seq=898 Ack=51443 Win=4885 Len=0 TSval=2193187223 TSecr=705699527"
"70","2.483760","2600:8805:3803:6100:c100:e220:6ae:755","2620:0:861:ed1a::1","TLSv1.2","200","Application Data"
"71","2.543326","2620:0:861:ed1a::1","2600:8805:3803:6100:c100:e220:6ae:755","TCP","86","443  >  55034 [ACK] Seq=51443 Ack=1012 Win=83 Len=0 TSval=705700265 TSecr=2193187902"
"72","2.647830","2600:8805:3803:6100:c100:e220:6ae:755","2620:0:861:ed1a::1","TLSv1.2","199","Application Data"
"73","2.658657","2600:8805:3803:6100:c100:e220:6ae:755","2620:0:861:ed1a::1","TLSv1.2","480","Application Data"
"74","2.663276","2620:0:861:ed1a::1","2600:8805:3803:6100:c100:e220:6ae:755","TCP","86","443  >  55034 [ACK] Seq=51443 Ack=1125 Win=83 Len=0 TSval=705700385 TSecr=2193188066"
"75","2.663799","2620:0:861:ed1a::1","2600:8805:3803:6100:c100:e220:6ae:755","TCP","1514","443  >  55034 [ACK] Seq=51443 Ack=1125 Win=83 Len=1428 TSval=705700385 TSecr=2193188066 [TCP segment of a reassembled PDU]"
"76","2.663853","2600:8805:3803:6100:c100:e220:6ae:755","2620:0:861:ed1a::1","TCP","86","55034  >  443 [ACK] Seq=1519 Ack=52871 Win=4881 Len=0 TSval=2193188081 TSecr=705700385"
"77","2.664328","2620:0:861:ed1a::1","2600:8805:3803:6100:c100:e220:6ae:755","TCP","1514","443  >  55034 [ACK] Seq=52871 Ack=1125 Win=83 Len=1428 TSval=705700385 TSecr=2193188066 [TCP segment of a reassembled PDU]"
"78","2.664328","2620:0:861:ed1a::1","2600:8805:3803:6100:c100:e220:6ae:755","TCP","1514","443  >  55034 [ACK] Seq=54299 Ack=1125 Win=83 Len=1428 TSval=705700385 TSecr=2193188066 [TCP segment of a reassembled PDU]"
"79","2.664394","2600:8805:3803:6100:c100:e220:6ae:755","2620:0:861:ed1a::1","TCP","86","55034  >  443 [ACK] Seq=1519 Ack=55727 Win=4837 Len=0 TSval=2193188082 TSecr=705700385"
"80","2.664921","2600:8805:3803:6100:c100:e220:6ae:755","2620:0:861:ed1a::1","TCP","86","[TCP Window Update] 55034  >  443 [ACK] Seq=1519 Ack=55727 Win=4904 Len=0 TSval=2193188082 TSecr=705700385"
"81","2.665026","2620:0:861:ed1a::1","2600:8805:3803:6100:c100:e220:6ae:755","TCP","1514","443  >  55034 [ACK] Seq=55727 Ack=1125 Win=83 Len=1428 TSval=705700385 TSecr=2193188066 [TCP segment of a reassembled PDU]"
"82","2.665026","2620:0:861:ed1a::1","2600:8805:3803:6100:c100:e220:6ae:755","TCP","1514","443  >  55034 [ACK] Seq=57155 Ack=1125 Win=83 Len=1428 TSval=705700385 TSecr=2193188066 [TCP segment of a reassembled PDU]"
"83","2.665027","2620:0:861:ed1a::1","2600:8805:3803:6100:c100:e220:6ae:755","TCP","1514","443  >  55034 [PSH, ACK] Seq=58583 Ack=1125 Win=83 Len=1428 TSval=705700385 TSecr=2193188066 [TCP segment of a reassembled PDU]"
"84","2.665027","2620:0:861:ed1a::1","2600:8805:3803:6100:c100:e220:6ae:755","TCP","1514","443  >  55034 [ACK] Seq=60011 Ack=1125 Win=83 Len=1428 TSval=705700386 TSecr=2193188066 [TCP segment of a reassembled PDU]"
"85","2.665027","2620:0:861:ed1a::1","2600:8805:3803:6100:c100:e220:6ae:755","TCP","1514","443  >  55034 [ACK] Seq=61439 Ack=1125 Win=83 Len=1428 TSval=705700386 TSecr=2193188066 [TCP segment of a reassembled PDU]"
"86","2.665028","2620:0:861:ed1a::1","2600:8805:3803:6100:c100:e220:6ae:755","TCP","1514","443  >  55034 [ACK] Seq=62867 Ack=1125 Win=83 Len=1428 TSval=705700386 TSecr=2193188066 [TCP segment of a reassembled PDU]"
"87","2.665028","2620:0:861:ed1a::1","2600:8805:3803:6100:c100:e220:6ae:755","TCP","1514","443  >  55034 [ACK] Seq=64295 Ack=1125 Win=83 Len=1428 TSval=705700386 TSecr=2193188066 [TCP segment of a reassembled PDU]"
"88","2.665029","2620:0:861:ed1a::1","2600:8805:3803:6100:c100:e220:6ae:755","TLSv1.2","491","Application Data"
"89","2.665068","2600:8805:3803:6100:c100:e220:6ae:755","2620:0:861:ed1a::1","TCP","86","55034  >  443 [ACK] Seq=1519 Ack=66128 Win=4741 Len=0 TSval=2193188082 TSecr=705700386"
"90","2.665088","2600:8805:3803:6100:c100:e220:6ae:755","2620:0:861:ed1a::1","TCP","86","[TCP Window Update] 55034  >  443 [ACK] Seq=1519 Ack=66128 Win=4904 Len=0 TSval=2193188082 TSecr=705700386"
"91","2.667047","2620:0:861:ed1a::1","2600:8805:3803:6100:c100:e220:6ae:755","TCP","1514","443  >  55034 [ACK] Seq=66128 Ack=1125 Win=83 Len=1428 TSval=705700386 TSecr=2193188066 [TCP segment of a reassembled PDU]"
"92","2.667048","2620:0:861:ed1a::1","2600:8805:3803:6100:c100:e220:6ae:755","TCP","1514","443  >  55034 [ACK] Seq=67556 Ack=1125 Win=83 Len=1428 TSval=705700386 TSecr=2193188066 [TCP segment of a reassembled PDU]"
"93","2.667048","2620:0:861:ed1a::1","2600:8805:3803:6100:c100:e220:6ae:755","TCP","1514","443  >  55034 [ACK] Seq=68984 Ack=1125 Win=83 Len=1428 TSval=705700386 TSecr=2193188066 [TCP segment of a reassembled PDU]"
"94","2.667049","2620:0:861:ed1a::1","2600:8805:3803:6100:c100:e220:6ae:755","TCP","1514","443  >  55034 [ACK] Seq=70412 Ack=1125 Win=83 Len=1428 TSval=705700386 TSecr=2193188066 [TCP segment of a reassembled PDU]"
"95","2.667049","2620:0:861:ed1a::1","2600:8805:3803:6100:c100:e220:6ae:755","TCP","1514","443  >  55034 [ACK] Seq=71840 Ack=1125 Win=83 Len=1428 TSval=705700386 TSecr=2193188066 [TCP segment of a reassembled PDU]"
"96","2.667050","2620:0:861:ed1a::1","2600:8805:3803:6100:c100:e220:6ae:755","TCP","1514","443  >  55034 [PSH, ACK] Seq=73268 Ack=1125 Win=83 Len=1428 TSval=705700386 TSecr=2193188066 [TCP segment of a reassembled PDU]"
"97","2.667050","2620:0:861:ed1a::1","2600:8805:3803:6100:c100:e220:6ae:755","TLSv1.2","268","Application Data"
"98","2.667118","2600:8805:3803:6100:c100:e220:6ae:755","2620:0:861:ed1a::1","TCP","86","55034  >  443 [ACK] Seq=1519 Ack=74878 Win=4767 Len=0 TSval=2193188085 TSecr=705700387"
"99","2.669161","2600:8805:3803:6100:c100:e220:6ae:755","2620:0:861:ed1a::1","TCP","86","[TCP Window Update] 55034  >  443 [ACK] Seq=1519 Ack=74878 Win=4904 Len=0 TSval=2193188087 TSecr=705700387"
"100","2.718782","2620:0:861:ed1a::1","2600:8805:3803:6100:c100:e220:6ae:755","TCP","86","443  >  55034 [ACK] Seq=74878 Ack=1519 Win=83 Len=0 TSval=705700441 TSecr=2193188077"
"101","2.724775","2620:0:861:ed1a::1","2600:8805:3803:6100:c100:e220:6ae:755","TLSv1.2","1477","Application Data"
"102","2.724843","2600:8805:3803:6100:c100:e220:6ae:755","2620:0:861:ed1a::1","TCP","86","55034  >  443 [ACK] Seq=1519 Ack=76269 Win=4882 Len=0 TSval=2193188143 TSecr=705700446"
"103","2.737956","2620:0:861:ed1a::1","2600:8805:3803:6100:c100:e220:6ae:755","TCP","1514","443  >  55034 [ACK] Seq=76269 Ack=1519 Win=83 Len=1428 TSval=705700458 TSecr=2193188077 [TCP segment of a reassembled PDU]"
"104","2.738029","2600:8805:3803:6100:c100:e220:6ae:755","2620:0:861:ed1a::1","TCP","86","55034  >  443 [ACK] Seq=1519 Ack=77697 Win=4881 Len=0 TSval=2193188156 TSecr=705700458"
"105","2.739010","2620:0:861:ed1a::1","2600:8805:3803:6100:c100:e220:6ae:755","TCP","1514","443  >  55034 [ACK] Seq=77697 Ack=1519 Win=83 Len=1428 TSval=705700458 TSecr=2193188077 [TCP segment of a reassembled PDU]"
"106","2.739010","2620:0:861:ed1a::1","2600:8805:3803:6100:c100:e220:6ae:755","TCP","1514","443  >  55034 [ACK] Seq=79125 Ack=1519 Win=83 Len=1428 TSval=705700458 TSecr=2193188077 [TCP segment of a reassembled PDU]"
"107","2.739010","2620:0:861:ed1a::1","2600:8805:3803:6100:c100:e220:6ae:755","TCP","1514","443  >  55034 [ACK] Seq=80553 Ack=1519 Win=83 Len=1428 TSval=705700458 TSecr=2193188077 [TCP segment of a reassembled PDU]"
"108","2.739011","2620:0:861:ed1a::1","2600:8805:3803:6100:c100:e220:6ae:755","TCP","1514","443  >  55034 [ACK] Seq=81981 Ack=1519 Win=83 Len=1428 TSval=705700458 TSecr=2193188077 [TCP segment of a reassembled PDU]"
"109","2.739011","2620:0:861:ed1a::1","2600:8805:3803:6100:c100:e220:6ae:755","TCP","1514","443  >  55034 [PSH, ACK] Seq=83409 Ack=1519 Win=83 Len=1428 TSval=705700458 TSecr=2193188077 [TCP segment of a reassembled PDU]"
"110","2.739012","2620:0:861:ed1a::1","2600:8805:3803:6100:c100:e220:6ae:755","TCP","1514","443  >  55034 [ACK] Seq=84837 Ack=1519 Win=83 Len=1428 TSval=705700459 TSecr=2193188077 [TCP segment of a reassembled PDU]"
"111","2.739012","2620:0:861:ed1a::1","2600:8805:3803:6100:c100:e220:6ae:755","TCP","1514","443  >  55034 [ACK] Seq=86265 Ack=1519 Win=83 Len=1428 TSval=705700459 TSecr=2193188077 [TCP segment of a reassembled PDU]"
"112","2.739012","2620:0:861:ed1a::1","2600:8805:3803:6100:c100:e220:6ae:755","TCP","1514","443  >  55034 [ACK] Seq=87693 Ack=1519 Win=83 Len=1428 TSval=705700459 TSecr=2193188077 [TCP segment of a reassembled PDU]"
"113","2.739013","2620:0:861:ed1a::1","2600:8805:3803:6100:c100:e220:6ae:755","TCP","1514","443  >  55034 [ACK] Seq=89121 Ack=1519 Win=83 Len=1428 TSval=705700459 TSecr=2193188077 [TCP segment of a reassembled PDU]"
"114","2.739013","2620:0:861:ed1a::1","2600:8805:3803:6100:c100:e220:6ae:755","TCP","1514","443  >  55034 [ACK] Seq=90549 Ack=1519 Win=83 Len=1428 TSval=705700459 TSecr=2193188077 [TCP segment of a reassembled PDU]"
"115","2.739013","2620:0:861:ed1a::1","2600:8805:3803:6100:c100:e220:6ae:755","TLSv1.2","721","Application Data"
"116","2.739014","2620:0:861:ed1a::1","2600:8805:3803:6100:c100:e220:6ae:755","TCP","1514","443  >  55034 [ACK] Seq=92612 Ack=1519 Win=83 Len=1428 TSval=705700460 TSecr=2193188077 [TCP segment of a reassembled PDU]"
"117","2.739014","2620:0:861:ed1a::1","2600:8805:3803:6100:c100:e220:6ae:755","TCP","1514","443  >  55034 [ACK] Seq=94040 Ack=1519 Win=83 Len=1428 TSval=705700460 TSecr=2193188077 [TCP segment of a reassembled PDU]"
"118","2.739014","2620:0:861:ed1a::1","2600:8805:3803:6100:c100:e220:6ae:755","TCP","1514","443  >  55034 [ACK] Seq=95468 Ack=1519 Win=83 Len=1428 TSval=705700460 TSecr=2193188077 [TCP segment of a reassembled PDU]"
"119","2.739014","2620:0:861:ed1a::1","2600:8805:3803:6100:c100:e220:6ae:755","TCP","1514","443  >  55034 [ACK] Seq=96896 Ack=1519 Win=83 Len=1428 TSval=705700460 TSecr=2193188077 [TCP segment of a reassembled PDU]"
"120","2.739015","2620:0:861:ed1a::1","2600:8805:3803:6100:c100:e220:6ae:755","TCP","1514","443  >  55034 [ACK] Seq=98324 Ack=1519 Win=83 Len=1428 TSval=705700460 TSecr=2193188077 [TCP segment of a reassembled PDU]"
"121","2.739015","2620:0:861:ed1a::1","2600:8805:3803:6100:c100:e220:6ae:755","TCP","1514","443  >  55034 [PSH, ACK] Seq=99752 Ack=1519 Win=83 Len=1428 TSval=705700460 TSecr=2193188077 [TCP segment of a reassembled PDU]"
"122","2.739097","2600:8805:3803:6100:c100:e220:6ae:755","2620:0:861:ed1a::1","TCP","86","55034  >  443 [ACK] Seq=1519 Ack=92612 Win=4670 Len=0 TSval=2193188157 TSecr=705700459"
"123","2.739190","2600:8805:3803:6100:c100:e220:6ae:755","2620:0:861:ed1a::1","TCP","86","55034  >  443 [ACK] Seq=1519 Ack=101180 Win=4537 Len=0 TSval=2193188157 TSecr=705700460"
"124","2.740027","2620:0:861:ed1a::1","2600:8805:3803:6100:c100:e220:6ae:755","TCP","1514","443  >  55034 [ACK] Seq=101180 Ack=1519 Win=83 Len=1428 TSval=705700460 TSecr=2193188077 [TCP segment of a reassembled PDU]"
"125","2.740027","2620:0:861:ed1a::1","2600:8805:3803:6100:c100:e220:6ae:755","TCP","1514","443  >  55034 [ACK] Seq=102608 Ack=1519 Win=83 Len=1428 TSval=705700460 TSecr=2193188077 [TCP segment of a reassembled PDU]"
"126","2.740028","2620:0:861:ed1a::1","2600:8805:3803:6100:c100:e220:6ae:755","TCP","1514","443  >  55034 [ACK] Seq=104036 Ack=1519 Win=83 Len=1428 TSval=705700460 TSecr=2193188077 [TCP segment of a reassembled PDU]"
"127","2.740028","2620:0:861:ed1a::1","2600:8805:3803:6100:c100:e220:6ae:755","TCP","1514","443  >  55034 [ACK] Seq=105464 Ack=1519 Win=83 Len=1428 TSval=705700460 TSecr=2193188077 [TCP segment of a reassembled PDU]"
"128","2.740029","2620:0:861:ed1a::1","2600:8805:3803:6100:c100:e220:6ae:755","TCP","1514","443  >  55034 [ACK] Seq=106892 Ack=1519 Win=83 Len=1428 TSval=705700460 TSecr=2193188077 [TCP segment of a reassembled PDU]"
"129","2.740029","2620:0:861:ed1a::1","2600:8805:3803:6100:c100:e220:6ae:755","TLSv1.2","1514","Application Data"
"130","2.740029","2620:0:861:ed1a::1","2600:8805:3803:6100:c100:e220:6ae:755","TCP","1514","443  >  55034 [ACK] Seq=109748 Ack=1519 Win=83 Len=1428 TSval=705700461 TSecr=2193188077 [TCP segment of a reassembled PDU]"
"131","2.740030","2620:0:861:ed1a::1","2600:8805:3803:6100:c100:e220:6ae:755","TCP","1514","443  >  55034 [ACK] Seq=111176 Ack=1519 Win=83 Len=1428 TSval=705700461 TSecr=2193188077 [TCP segment of a reassembled PDU]"
"132","2.740031","2620:0:861:ed1a::1","2600:8805:3803:6100:c100:e220:6ae:755","TCP","1514","443  >  55034 [ACK] Seq=112604 Ack=1519 Win=83 Len=1428 TSval=705700461 TSecr=2193188077 [TCP segment of a reassembled PDU]"
"133","2.740031","2620:0:861:ed1a::1","2600:8805:3803:6100:c100:e220:6ae:755","TCP","1514","443  >  55034 [ACK] Seq=114032 Ack=1519 Win=83 Len=1428 TSval=705700461 TSecr=2193188077 [TCP segment of a reassembled PDU]"
"134","2.740031","2620:0:861:ed1a::1","2600:8805:3803:6100:c100:e220:6ae:755","TCP","1514","443  >  55034 [ACK] Seq=115460 Ack=1519 Win=83 Len=1428 TSval=705700461 TSecr=2193188077 [TCP segment of a reassembled PDU]"
"135","2.740032","2620:0:861:ed1a::1","2600:8805:3803:6100:c100:e220:6ae:755","TCP","1514","443  >  55034 [PSH, ACK] Seq=116888 Ack=1519 Win=83 Len=1428 TSval=705700461 TSecr=2193188077 [TCP segment of a reassembled PDU]"
"136","2.740129","2600:8805:3803:6100:c100:e220:6ae:755","2620:0:861:ed1a::1","TCP","86","55034  >  443 [ACK] Seq=1519 Ack=116888 Win=4291 Len=0 TSval=2193188158 TSecr=705700461"
"137","2.740203","2600:8805:3803:6100:c100:e220:6ae:755","2620:0:861:ed1a::1","TCP","86","55034  >  443 [ACK] Seq=1519 Ack=118316 Win=4269 Len=0 TSval=2193188158 TSecr=705700461"
"138","2.740528","2620:0:861:ed1a::1","2600:8805:3803:6100:c100:e220:6ae:755","TCP","1514","443  >  55034 [ACK] Seq=118316 Ack=1519 Win=83 Len=1428 TSval=705700462 TSecr=2193188077 [TCP segment of a reassembled PDU]"
"139","2.740573","2600:8805:3803:6100:c100:e220:6ae:755","2620:0:861:ed1a::1","TCP","86","55034  >  443 [ACK] Seq=1519 Ack=119744 Win=4247 Len=0 TSval=2193188158 TSecr=705700462"
"140","2.740729","2600:8805:3803:6100:c100:e220:6ae:755","2620:0:861:ed1a::1","TCP","86","[TCP Window Update] 55034  >  443 [ACK] Seq=1519 Ack=119744 Win=4904 Len=0 TSval=2193188158 TSecr=705700462"
"141","2.742010","2620:0:861:ed1a::1","2600:8805:3803:6100:c100:e220:6ae:755","TCP","1514","443  >  55034 [ACK] Seq=119744 Ack=1519 Win=83 Len=1428 TSval=705700462 TSecr=2193188077 [TCP segment of a reassembled PDU]"
"142","2.742011","2620:0:861:ed1a::1","2600:8805:3803:6100:c100:e220:6ae:755","TCP","1514","443  >  55034 [ACK] Seq=121172 Ack=1519 Win=83 Len=1428 TSval=705700462 TSecr=2193188077 [TCP segment of a reassembled PDU]"
"143","2.742011","2620:0:861:ed1a::1","2600:8805:3803:6100:c100:e220:6ae:755","TCP","1514","443  >  55034 [ACK] Seq=122600 Ack=1519 Win=83 Len=1428 TSval=705700462 TSecr=2193188077 [TCP segment of a reassembled PDU]"
"144","2.742012","2620:0:861:ed1a::1","2600:8805:3803:6100:c100:e220:6ae:755","TLSv1.2","1514","Application Data"
"145","2.742013","2620:0:861:ed1a::1","2600:8805:3803:6100:c100:e220:6ae:755","TLSv1.2","380","Application Data"
"146","2.742087","2600:8805:3803:6100:c100:e220:6ae:755","2620:0:861:ed1a::1","TCP","86","55034  >  443 [ACK] Seq=1519 Ack=125750 Win=4810 Len=0 TSval=2193188160 TSecr=705700462"
"147","2.743458","2620:0:861:ed1a::1","2600:8805:3803:6100:c100:e220:6ae:755","TCP","1514","443  >  55034 [ACK] Seq=125750 Ack=1519 Win=83 Len=1428 TSval=705700463 TSecr=2193188143 [TCP segment of a reassembled PDU]"
"148","2.743459","2620:0:861:ed1a::1","2600:8805:3803:6100:c100:e220:6ae:755","TCP","1514","443  >  55034 [ACK] Seq=127178 Ack=1519 Win=83 Len=1428 TSval=705700463 TSecr=2193188143 [TCP segment of a reassembled PDU]"
"149","2.743460","2620:0:861:ed1a::1","2600:8805:3803:6100:c100:e220:6ae:755","TCP","1514","443  >  55034 [ACK] Seq=128606 Ack=1519 Win=83 Len=1428 TSval=705700463 TSecr=2193188143 [TCP segment of a reassembled PDU]"
"150","2.743460","2620:0:861:ed1a::1","2600:8805:3803:6100:c100:e220:6ae:755","TCP","1514","443  >  55034 [ACK] Seq=130034 Ack=1519 Win=83 Len=1428 TSval=705700463 TSecr=2193188143 [TCP segment of a reassembled PDU]"
"151","2.743461","2620:0:861:ed1a::1","2600:8805:3803:6100:c100:e220:6ae:755","TLSv1.2","866","Application Data"
"152","2.743542","2600:8805:3803:6100:c100:e220:6ae:755","2620:0:861:ed1a::1","TCP","86","55034  >  443 [ACK] Seq=1519 Ack=132242 Win=4708 Len=0 TSval=2193188161 TSecr=705700463"
"153","2.743836","2600:8805:3803:6100:c100:e220:6ae:755","2620:0:861:ed1a::1","TCP","86","[TCP Window Update] 55034  >  443 [ACK] Seq=1519 Ack=132242 Win=4904 Len=0 TSval=2193188161 TSecr=705700463"
"154","2.757110","2620:0:861:ed1a::1","2600:8805:3803:6100:c100:e220:6ae:755","TCP","1514","443  >  55034 [ACK] Seq=132242 Ack=1519 Win=83 Len=1428 TSval=705700479 TSecr=2193188156 [TCP segment of a reassembled PDU]"
"155","2.757169","2600:8805:3803:6100:c100:e220:6ae:755","2620:0:861:ed1a::1","TCP","86","55034  >  443 [ACK] Seq=1519 Ack=133670 Win=4881 Len=0 TSval=2193188175 TSecr=705700479"
"156","2.758167","2620:0:861:ed1a::1","2600:8805:3803:6100:c100:e220:6ae:755","TCP","1514","443  >  55034 [ACK] Seq=133670 Ack=1519 Win=83 Len=1428 TSval=705700479 TSecr=2193188156 [TCP segment of a reassembled PDU]"
"157","2.758168","2620:0:861:ed1a::1","2600:8805:3803:6100:c100:e220:6ae:755","TCP","1514","443  >  55034 [ACK] Seq=135098 Ack=1519 Win=83 Len=1428 TSval=705700479 TSecr=2193188156 [TCP segment of a reassembled PDU]"
"158","2.758169","2620:0:861:ed1a::1","2600:8805:3803:6100:c100:e220:6ae:755","TCP","1514","443  >  55034 [ACK] Seq=136526 Ack=1519 Win=83 Len=1428 TSval=705700479 TSecr=2193188156 [TCP segment of a reassembled PDU]"
"159","2.758170","2620:0:861:ed1a::1","2600:8805:3803:6100:c100:e220:6ae:755","TCP","1514","443  >  55034 [ACK] Seq=137954 Ack=1519 Win=83 Len=1428 TSval=705700479 TSecr=2193188156 [TCP segment of a reassembled PDU]"
"160","2.758170","2620:0:861:ed1a::1","2600:8805:3803:6100:c100:e220:6ae:755","TCP","1514","443  >  55034 [PSH, ACK] Seq=139382 Ack=1519 Win=83 Len=1428 TSval=705700479 TSecr=2193188156 [TCP segment of a reassembled PDU]"
"161","2.758225","2600:8805:3803:6100:c100:e220:6ae:755","2620:0:861:ed1a::1","TCP","86","55034  >  443 [ACK] Seq=1519 Ack=140810 Win=4792 Len=0 TSval=2193188176 TSecr=705700479"
"162","2.758318","2600:8805:3803:6100:c100:e220:6ae:755","2620:0:861:ed1a::1","TCP","86","[TCP Window Update] 55034  >  443 [ACK] Seq=1519 Ack=140810 Win=4904 Len=0 TSval=2193188176 TSecr=705700479"
"163","2.759308","2620:0:861:ed1a::1","2600:8805:3803:6100:c100:e220:6ae:755","TCP","1514","443  >  55034 [ACK] Seq=140810 Ack=1519 Win=83 Len=1428 TSval=705700479 TSecr=2193188156 [TCP segment of a reassembled PDU]"
"164","2.759309","2620:0:861:ed1a::1","2600:8805:3803:6100:c100:e220:6ae:755","TCP","1514","443  >  55034 [ACK] Seq=142238 Ack=1519 Win=83 Len=1428 TSval=705700479 TSecr=2193188156 [TCP segment of a reassembled PDU]"
"165","2.759310","2620:0:861:ed1a::1","2600:8805:3803:6100:c100:e220:6ae:755","TCP","1514","443  >  55034 [ACK] Seq=143666 Ack=1519 Win=83 Len=1428 TSval=705700479 TSecr=2193188156 [TCP segment of a reassembled PDU]"
"166","2.759310","2620:0:861:ed1a::1","2600:8805:3803:6100:c100:e220:6ae:755","TCP","1514","443  >  55034 [ACK] Seq=145094 Ack=1519 Win=83 Len=1428 TSval=705700479 TSecr=2193188156 [TCP segment of a reassembled PDU]"
"167","2.759311","2620:0:861:ed1a::1","2600:8805:3803:6100:c100:e220:6ae:755","TCP","1514","443  >  55034 [ACK] Seq=146522 Ack=1519 Win=83 Len=1428 TSval=705700479 TSecr=2193188156 [TCP segment of a reassembled PDU]"
"168","2.759311","2620:0:861:ed1a::1","2600:8805:3803:6100:c100:e220:6ae:755","TLSv1.2","721","Application Data"
"169","2.759312","2620:0:861:ed1a::1","2600:8805:3803:6100:c100:e220:6ae:755","TCP","1514","443  >  55034 [ACK] Seq=148585 Ack=1519 Win=83 Len=1428 TSval=705700480 TSecr=2193188156 [TCP segment of a reassembled PDU]"
"170","2.759312","2620:0:861:ed1a::1","2600:8805:3803:6100:c100:e220:6ae:755","TCP","1514","443  >  55034 [ACK] Seq=150013 Ack=1519 Win=83 Len=1428 TSval=705700480 TSecr=2193188156 [TCP segment of a reassembled PDU]"
"171","2.759313","2620:0:861:ed1a::1","2600:8805:3803:6100:c100:e220:6ae:755","TCP","1514","443  >  55034 [ACK] Seq=151441 Ack=1519 Win=83 Len=1428 TSval=705700480 TSecr=2193188156 [TCP segment of a reassembled PDU]"
"172","2.759313","2620:0:861:ed1a::1","2600:8805:3803:6100:c100:e220:6ae:755","TCP","1514","443  >  55034 [ACK] Seq=152869 Ack=1519 Win=83 Len=1428 TSval=705700480 TSecr=2193188156 [TCP segment of a reassembled PDU]"
"173","2.759314","2620:0:861:ed1a::1","2600:8805:3803:6100:c100:e220:6ae:755","TCP","1514","443  >  55034 [ACK] Seq=154297 Ack=1519 Win=83 Len=1428 TSval=705700480 TSecr=2193188156 [TCP segment of a reassembled PDU]"
"174","2.759314","2620:0:861:ed1a::1","2600:8805:3803:6100:c100:e220:6ae:755","TCP","1514","443  >  55034 [PSH, ACK] Seq=155725 Ack=1519 Win=83 Len=1428 TSval=705700480 TSecr=2193188156 [TCP segment of a reassembled PDU]"
"175","2.759371","2600:8805:3803:6100:c100:e220:6ae:755","2620:0:861:ed1a::1","TCP","86","55034  >  443 [ACK] Seq=1519 Ack=155725 Win=4670 Len=0 TSval=2193188177 TSecr=705700480"
"176","2.759542","2600:8805:3803:6100:c100:e220:6ae:755","2620:0:861:ed1a::1","TCP","86","55034  >  443 [ACK] Seq=1519 Ack=157153 Win=4904 Len=0 TSval=2193188177 TSecr=705700480"
"177","2.760745","2620:0:861:ed1a::1","2600:8805:3803:6100:c100:e220:6ae:755","TCP","1514","443  >  55034 [ACK] Seq=157153 Ack=1519 Win=83 Len=1428 TSval=705700481 TSecr=2193188156 [TCP segment of a reassembled PDU]"
"178","2.760745","2620:0:861:ed1a::1","2600:8805:3803:6100:c100:e220:6ae:755","TCP","1514","443  >  55034 [ACK] Seq=158581 Ack=1519 Win=83 Len=1428 TSval=705700481 TSecr=2193188156 [TCP segment of a reassembled PDU]"
"179","2.760745","2620:0:861:ed1a::1","2600:8805:3803:6100:c100:e220:6ae:755","TCP","1514","443  >  55034 [ACK] Seq=160009 Ack=1519 Win=83 Len=1428 TSval=705700481 TSecr=2193188156 [TCP segment of a reassembled PDU]"
"180","2.760746","2620:0:861:ed1a::1","2600:8805:3803:6100:c100:e220:6ae:755","TCP","1514","443  >  55034 [ACK] Seq=161437 Ack=1519 Win=83 Len=1428 TSval=705700481 TSecr=2193188156 [TCP segment of a reassembled PDU]"
"181","2.760747","2620:0:861:ed1a::1","2600:8805:3803:6100:c100:e220:6ae:755","TCP","1514","443  >  55034 [ACK] Seq=162865 Ack=1519 Win=83 Len=1428 TSval=705700481 TSecr=2193188156 [TCP segment of a reassembled PDU]"
"182","2.760747","2620:0:861:ed1a::1","2600:8805:3803:6100:c100:e220:6ae:755","TLSv1.2","1514","Application Data"
"183","2.760806","2600:8805:3803:6100:c100:e220:6ae:755","2620:0:861:ed1a::1","TCP","86","55034  >  443 [ACK] Seq=1519 Ack=165721 Win=4904 Len=0 TSval=2193188179 TSecr=705700481"
"184","2.761801","2620:0:861:ed1a::1","2600:8805:3803:6100:c100:e220:6ae:755","TCP","1514","443  >  55034 [ACK] Seq=165721 Ack=1519 Win=83 Len=1428 TSval=705700482 TSecr=2193188161 [TCP segment of a reassembled PDU]"
"185","2.763058","2620:0:861:ed1a::1","2600:8805:3803:6100:c100:e220:6ae:755","TCP","1514","443  >  55034 [ACK] Seq=167149 Ack=1519 Win=83 Len=1428 TSval=705700482 TSecr=2193188161 [TCP segment of a reassembled PDU]"
"186","2.763058","2620:0:861:ed1a::1","2600:8805:3803:6100:c100:e220:6ae:755","TCP","1514","443  >  55034 [ACK] Seq=168577 Ack=1519 Win=83 Len=1428 TSval=705700482 TSecr=2193188161 [TCP segment of a reassembled PDU]"
"187","2.763059","2620:0:861:ed1a::1","2600:8805:3803:6100:c100:e220:6ae:755","TCP","1514","443  >  55034 [ACK] Seq=170005 Ack=1519 Win=83 Len=1428 TSval=705700482 TSecr=2193188161 [TCP segment of a reassembled PDU]"
"188","2.763059","2620:0:861:ed1a::1","2600:8805:3803:6100:c100:e220:6ae:755","TLSv1.2","1048","Application Data"
"189","2.763060","2620:0:861:ed1a::1","2600:8805:3803:6100:c100:e220:6ae:755","TCP","1514","443  >  55034 [ACK] Seq=172395 Ack=1519 Win=83 Len=1428 TSval=705700482 TSecr=2193188161 [TCP segment of a reassembled PDU]"
"190","2.763061","2620:0:861:ed1a::1","2600:8805:3803:6100:c100:e220:6ae:755","TCP","1514","443  >  55034 [ACK] Seq=173823 Ack=1519 Win=83 Len=1428 TSval=705700482 TSecr=2193188161 [TCP segment of a reassembled PDU]"
"191","2.763061","2620:0:861:ed1a::1","2600:8805:3803:6100:c100:e220:6ae:755","TCP","1514","443  >  55034 [ACK] Seq=175251 Ack=1519 Win=83 Len=1428 TSval=705700482 TSecr=2193188161 [TCP segment of a reassembled PDU]"
"192","2.763062","2620:0:861:ed1a::1","2600:8805:3803:6100:c100:e220:6ae:755","TCP","1514","443  >  55034 [ACK] Seq=176679 Ack=1519 Win=83 Len=1428 TSval=705700482 TSecr=2193188161 [TCP segment of a reassembled PDU]"
"193","2.763062","2620:0:861:ed1a::1","2600:8805:3803:6100:c100:e220:6ae:755","TCP","1514","443  >  55034 [ACK] Seq=178107 Ack=1519 Win=83 Len=1428 TSval=705700482 TSecr=2193188161 [TCP segment of a reassembled PDU]"
"194","2.763063","2620:0:861:ed1a::1","2600:8805:3803:6100:c100:e220:6ae:755","TCP","1514","443  >  55034 [PSH, ACK] Seq=179535 Ack=1519 Win=83 Len=1428 TSval=705700482 TSecr=2193188161 [TCP segment of a reassembled PDU]"
"195","2.763063","2620:0:861:ed1a::1","2600:8805:3803:6100:c100:e220:6ae:755","TCP","1514","443  >  55034 [ACK] Seq=180963 Ack=1519 Win=83 Len=1428 TSval=705700483 TSecr=2193188161 [TCP segment of a reassembled PDU]"
"196","2.763063","2620:0:861:ed1a::1","2600:8805:3803:6100:c100:e220:6ae:755","TCP","1514","443  >  55034 [ACK] Seq=182391 Ack=1519 Win=83 Len=1428 TSval=705700483 TSecr=2193188161 [TCP segment of a reassembled PDU]"
"197","2.763064","2620:0:861:ed1a::1","2600:8805:3803:6100:c100:e220:6ae:755","TCP","1514","443  >  55034 [ACK] Seq=183819 Ack=1519 Win=83 Len=1428 TSval=705700483 TSecr=2193188161 [TCP segment of a reassembled PDU]"
"198","2.763064","2620:0:861:ed1a::1","2600:8805:3803:6100:c100:e220:6ae:755","TCP","1514","443  >  55034 [ACK] Seq=185247 Ack=1519 Win=83 Len=1428 TSval=705700483 TSecr=2193188161 [TCP segment of a reassembled PDU]"
"199","2.763065","2620:0:861:ed1a::1","2600:8805:3803:6100:c100:e220:6ae:755","TCP","1514","443  >  55034 [ACK] Seq=186675 Ack=1519 Win=83 Len=1428 TSval=705700483 TSecr=2193188161 [TCP segment of a reassembled PDU]"
"200","2.763066","2620:0:861:ed1a::1","2600:8805:3803:6100:c100:e220:6ae:755","TLSv1.2","721","Application Data"
"201","2.763066","2620:0:861:ed1a::1","2600:8805:3803:6100:c100:e220:6ae:755","TCP","1514","443  >  55034 [ACK] Seq=188738 Ack=1519 Win=83 Len=1428 TSval=705700484 TSecr=2193188161 [TCP segment of a reassembled PDU]"
"202","2.763066","2620:0:861:ed1a::1","2600:8805:3803:6100:c100:e220:6ae:755","TCP","1514","443  >  55034 [ACK] Seq=190166 Ack=1519 Win=83 Len=1428 TSval=705700484 TSecr=2193188161 [TCP segment of a reassembled PDU]"
"203","2.763067","2620:0:861:ed1a::1","2600:8805:3803:6100:c100:e220:6ae:755","TLSv1.2","369","Application Data"
"204","2.763186","2600:8805:3803:6100:c100:e220:6ae:755","2620:0:861:ed1a::1","TCP","86","55034  >  443 [ACK] Seq=1519 Ack=191877 Win=4904 Len=0 TSval=2193188181 TSecr=705700482"
"205","2.772082","2620:0:861:ed1a::1","2600:8805:3803:6100:c100:e220:6ae:755","TCP","1514","443  >  55034 [ACK] Seq=191877 Ack=1519 Win=83 Len=1428 TSval=705700494 TSecr=2193188161 [TCP segment of a reassembled PDU]"
"206","2.773353","2620:0:861:ed1a::1","2600:8805:3803:6100:c100:e220:6ae:755","TLSv1.2","1445","Application Data"
"207","2.773354","2620:0:861:ed1a::1","2600:8805:3803:6100:c100:e220:6ae:755","TCP","1514","443  >  55034 [ACK] Seq=194664 Ack=1519 Win=83 Len=1428 TSval=705700494 TSecr=2193188161 [TCP segment of a reassembled PDU]"
