"No.","Time","Source","Destination","Protocol","Length","Info"
"1","0.000000","2600:8805:3803:6100:c100:e220:6ae:755","2620:0:861:ed1a::1","TLSv1.2","207","Application Data"
"2","0.000124","2600:8805:3803:6100:c100:e220:6ae:755","2620:0:861:ed1a::1","TLSv1.2","125","Application Data"
"3","0.021412","2620:0:861:ed1a::1","2600:8805:3803:6100:c100:e220:6ae:755","TCP","86","443  >  55034 [ACK] Seq=1 Ack=161 Win=83 Len=0 TSval=705930184 TSecr=2193417863"
"4","0.021950","2620:0:861:ed1a::1","2600:8805:3803:6100:c100:e220:6ae:755","TLSv1.2","125","Application Data"
"5","0.022032","2600:8805:3803:6100:c100:e220:6ae:755","2620:0:861:ed1a::1","TCP","86","55034  >  443 [ACK] Seq=161 Ack=40 Win=18045 Len=0 TSval=2193417884 TSecr=705930184"
"6","0.022389","2620:0:861:ed1a::1","2600:8805:3803:6100:c100:e220:6ae:755","TLSv1.2","1477","Application Data"
"7","0.022447","2600:8805:3803:6100:c100:e220:6ae:755","2620:0:861:ed1a::1","TCP","86","55034  >  443 [ACK] Seq=161 Ack=1431 Win=18024 Len=0 TSval=2193417884 TSecr=705930185"
"8","0.041087","2600:8805:3803:6100:c100:e220:6ae:755","2620:0:861:ed1a::1","TLSv1.2","179","Application Data"
"9","0.041796","2600:8805:3803:6100:c100:e220:6ae:755","2620:0:861:ed1a::1","TLSv1.2","121","Application Data"
"10","0.057002","2620:0:861:ed1a::1","2600:8805:3803:6100:c100:e220:6ae:755","TCP","1514","443  >  55034 [ACK] Seq=1431 Ack=254 Win=83 Len=1428 TSval=705930220 TSecr=2193417904 [TCP segment of a reassembled PDU]"
"11","0.057082","2600:8805:3803:6100:c100:e220:6ae:755","2620:0:861:ed1a::1","TCP","86","55034  >  443 [ACK] Seq=289 Ack=2859 Win=18023 Len=0 TSval=2193417920 TSecr=705930220"
"12","0.057477","2620:0:861:ed1a::1","2600:8805:3803:6100:c100:e220:6ae:755","TLSv1.2","732","Application Data"
"13","0.057528","2600:8805:3803:6100:c100:e220:6ae:755","2620:0:861:ed1a::1","TCP","86","55034  >  443 [ACK] Seq=289 Ack=3505 Win=18035 Len=0 TSval=2193417920 TSecr=705930220"
"14","0.057744","2600:8805:3803:6100:c100:e220:6ae:755","2620:0:861:ed1a::1","TLSv1.2","121","Application Data"
"15","0.075511","2620:0:861:ed1a::1","2600:8805:3803:6100:c100:e220:6ae:755","TCP","86","443  >  55034 [ACK] Seq=3505 Ack=324 Win=83 Len=0 TSval=705930238 TSecr=2193417904"
"16","0.397091","2600:8805:3803:6100:c100:e220:6ae:755","2620:0:861:ed1a::1","TLSv1.2","182","Application Data"
"17","0.419817","2620:0:861:ed1a::1","2600:8805:3803:6100:c100:e220:6ae:755","TLSv1.2","1477","Application Data"
"18","0.420012","2600:8805:3803:6100:c100:e220:6ae:755","2620:0:861:ed1a::1","TCP","86","55034  >  443 [ACK] Seq=420 Ack=4896 Win=18024 Len=0 TSval=2193418283 TSecr=705930582"
"19","0.424100","2600:8805:3803:6100:c100:e220:6ae:755","2620:0:861:ed1a::1","TLSv1.2","175","Application Data"
"20","0.441691","2620:0:861:ed1a::1","2600:8805:3803:6100:c100:e220:6ae:755","TCP","86","443  >  55034 [ACK] Seq=4896 Ack=509 Win=83 Len=0 TSval=705930604 TSecr=2193418287"
"21","0.442113","2620:0:861:ed1a::1","2600:8805:3803:6100:c100:e220:6ae:755","TCP","1514","443  >  55034 [ACK] Seq=4896 Ack=509 Win=83 Len=1428 TSval=705930604 TSecr=2193418287 [TCP segment of a reassembled PDU]"
"22","0.442115","2620:0:861:ed1a::1","2600:8805:3803:6100:c100:e220:6ae:755","TLSv1.2","959","Application Data"
"23","0.442220","2600:8805:3803:6100:c100:e220:6ae:755","2620:0:861:ed1a::1","TCP","86","55034  >  443 [ACK] Seq=509 Ack=7197 Win=18010 Len=0 TSval=2193418305 TSecr=705930604"
"24","0.703499","2600:8805:3803:6100:c100:e220:6ae:755","2620:0:861:ed1a::1","TLSv1.2","170","Application Data"
"25","0.721861","2620:0:861:ed1a::1","2600:8805:3803:6100:c100:e220:6ae:755","TCP","1514","443  >  55034 [ACK] Seq=7197 Ack=593 Win=83 Len=1428 TSval=705930885 TSecr=2193418566 [TCP segment of a reassembled PDU]"
"26","0.721997","2600:8805:3803:6100:c100:e220:6ae:755","2620:0:861:ed1a::1","TCP","86","55034  >  443 [ACK] Seq=593 Ack=8625 Win=18023 Len=0 TSval=2193418585 TSecr=705930885"
"27","0.726211","2620:0:861:ed1a::1","2600:8805:3803:6100:c100:e220:6ae:755","TCP","1514","443  >  55034 [ACK] Seq=8625 Ack=593 Win=83 Len=1428 TSval=705930885 TSecr=2193418566 [TCP segment of a reassembled PDU]"
"28","0.726212","2620:0:861:ed1a::1","2600:8805:3803:6100:c100:e220:6ae:755","TCP","1514","443  >  55034 [ACK] Seq=10053 Ack=593 Win=83 Len=1428 TSval=705930885 TSecr=2193418566 [TCP segment of a reassembled PDU]"
"29","0.726212","2620:0:861:ed1a::1","2600:8805:3803:6100:c100:e220:6ae:755","TCP","1514","443  >  55034 [ACK] Seq=11481 Ack=593 Win=83 Len=1428 TSval=705930885 TSecr=2193418566 [TCP segment of a reassembled PDU]"
"30","0.726213","2620:0:861:ed1a::1","2600:8805:3803:6100:c100:e220:6ae:755","TCP","1514","443  >  55034 [ACK] Seq=12909 Ack=593 Win=83 Len=1428 TSval=705930885 TSecr=2193418566 [TCP segment of a reassembled PDU]"
"31","0.726213","2620:0:861:ed1a::1","2600:8805:3803:6100:c100:e220:6ae:755","TCP","1514","443  >  55034 [ACK] Seq=14337 Ack=593 Win=83 Len=1428 TSval=705930885 TSecr=2193418566 [TCP segment of a reassembled PDU]"
"32","0.726215","2620:0:861:ed1a::1","2600:8805:3803:6100:c100:e220:6ae:755","TCP","1514","443  >  55034 [ACK] Seq=15765 Ack=593 Win=83 Len=1428 TSval=705930885 TSecr=2193418566 [TCP segment of a reassembled PDU]"
"33","0.726215","2620:0:861:ed1a::1","2600:8805:3803:6100:c100:e220:6ae:755","TCP","1514","443  >  55034 [ACK] Seq=17193 Ack=593 Win=83 Len=1428 TSval=705930885 TSecr=2193418566 [TCP segment of a reassembled PDU]"
"34","0.726216","2620:0:861:ed1a::1","2600:8805:3803:6100:c100:e220:6ae:755","TCP","1514","443  >  55034 [ACK] Seq=18621 Ack=593 Win=83 Len=1428 TSval=705930885 TSecr=2193418566 [TCP segment of a reassembled PDU]"
"35","0.726216","2620:0:861:ed1a::1","2600:8805:3803:6100:c100:e220:6ae:755","TCP","1514","443  >  55034 [ACK] Seq=20049 Ack=593 Win=83 Len=1428 TSval=705930885 TSecr=2193418566 [TCP segment of a reassembled PDU]"
"36","0.726217","2620:0:861:ed1a::1","2600:8805:3803:6100:c100:e220:6ae:755","TLSv1.2","429","Application Data"
"37","0.726217","2620:0:861:ed1a::1","2600:8805:3803:6100:c100:e220:6ae:755","TCP","1514","443  >  55034 [ACK] Seq=21820 Ack=593 Win=83 Len=1428 TSval=705930885 TSecr=2193418566 [TCP segment of a reassembled PDU]"
"38","0.726218","2620:0:861:ed1a::1","2600:8805:3803:6100:c100:e220:6ae:755","TCP","1514","443  >  55034 [ACK] Seq=23248 Ack=593 Win=83 Len=1428 TSval=705930885 TSecr=2193418566 [TCP segment of a reassembled PDU]"
"39","0.726218","2620:0:861:ed1a::1","2600:8805:3803:6100:c100:e220:6ae:755","TLSv1.2","1161","Application Data"
"40","0.726218","2620:0:861:ed1a::1","2600:8805:3803:6100:c100:e220:6ae:755","TCP","1514","443  >  55034 [ACK] Seq=25751 Ack=593 Win=83 Len=1428 TSval=705930885 TSecr=2193418566 [TCP segment of a reassembled PDU]"
"41","0.726219","2620:0:861:ed1a::1","2600:8805:3803:6100:c100:e220:6ae:755","TCP","1514","443  >  55034 [ACK] Seq=27179 Ack=593 Win=83 Len=1428 TSval=705930885 TSecr=2193418566 [TCP segment of a reassembled PDU]"
"42","0.726219","2620:0:861:ed1a::1","2600:8805:3803:6100:c100:e220:6ae:755","TCP","1514","443  >  55034 [ACK] Seq=28607 Ack=593 Win=83 Len=1428 TSval=705930885 TSecr=2193418566 [TCP segment of a reassembled PDU]"
"43","0.726220","2620:0:861:ed1a::1","2600:8805:3803:6100:c100:e220:6ae:755","TCP","1514","443  >  55034 [ACK] Seq=30035 Ack=593 Win=83 Len=1428 TSval=705930885 TSecr=2193418566 [TCP segment of a reassembled PDU]"
"44","0.726221","2620:0:861:ed1a::1","2600:8805:3803:6100:c100:e220:6ae:755","TCP","1514","443  >  55034 [ACK] Seq=31463 Ack=593 Win=83 Len=1428 TSval=705930885 TSecr=2193418566 [TCP segment of a reassembled PDU]"
"45","0.726221","2620:0:861:ed1a::1","2600:8805:3803:6100:c100:e220:6ae:755","TCP","1514","443  >  55034 [ACK] Seq=32891 Ack=593 Win=83 Len=1428 TSval=705930885 TSecr=2193418566 [TCP segment of a reassembled PDU]"
"46","0.726223","2620:0:861:ed1a::1","2600:8805:3803:6100:c100:e220:6ae:755","TCP","1514","443  >  55034 [ACK] Seq=34319 Ack=593 Win=83 Len=1428 TSval=705930885 TSecr=2193418566 [TCP segment of a reassembled PDU]"
"47","0.726224","2620:0:861:ed1a::1","2600:8805:3803:6100:c100:e220:6ae:755","TCP","1514","443  >  55034 [ACK] Seq=35747 Ack=593 Win=83 Len=1428 TSval=705930885 TSecr=2193418566 [TCP segment of a reassembled PDU]"
"48","0.726224","2620:0:861:ed1a::1","2600:8805:3803:6100:c100:e220:6ae:755","TCP","1514","443  >  55034 [ACK] Seq=37175 Ack=593 Win=83 Len=1428 TSval=705930885 TSecr=2193418566 [TCP segment of a reassembled PDU]"
"49","0.726225","2620:0:861:ed1a::1","2600:8805:3803:6100:c100:e220:6ae:755","TCP","1514","443  >  55034 [ACK] Seq=38603 Ack=593 Win=83 Len=1428 TSval=705930885 TSecr=2193418566 [TCP segment of a reassembled PDU]"
"50","0.726225","2620:0:861:ed1a::1","2600:8805:3803:6100:c100:e220:6ae:755","TCP","1514","443  >  55034 [ACK] Seq=40031 Ack=593 Win=83 Len=1428 TSval=705930885 TSecr=2193418566 [TCP segment of a reassembled PDU]"
"51","0.726226","2620:0:861:ed1a::1","2600:8805:3803:6100:c100:e220:6ae:755","TLSv1.2","729","Application Data"
"52","0.726226","2620:0:861:ed1a::1","2600:8805:3803:6100:c100:e220:6ae:755","TCP","1514","443  >  55034 [ACK] Seq=42102 Ack=593 Win=83 Len=1428 TSval=705930886 TSecr=2193418566 [TCP segment of a reassembled PDU]"
"53","0.726227","2620:0:861:ed1a::1","2600:8805:3803:6100:c100:e220:6ae:755","TCP","1514","443  >  55034 [ACK] Seq=43530 Ack=593 Win=83 Len=1428 TSval=705930886 TSecr=2193418566 [TCP segment of a reassembled PDU]"
"54","0.726227","2620:0:861:ed1a::1","2600:8805:3803:6100:c100:e220:6ae:755","TCP","1514","443  >  55034 [ACK] Seq=44958 Ack=593 Win=83 Len=1428 TSval=705930886 TSecr=2193418566 [TCP segment of a reassembled PDU]"
"55","0.726228","2620:0:861:ed1a::1","2600:8805:3803:6100:c100:e220:6ae:755","TCP","1514","443  >  55034 [ACK] Seq=46386 Ack=593 Win=83 Len=1428 TSval=705930886 TSecr=2193418566 [TCP segment of a reassembled PDU]"
"56","0.726228","2620:0:861:ed1a::1","2600:8805:3803:6100:c100:e220:6ae:755","TCP","1514","443  >  55034 [ACK] Seq=47814 Ack=593 Win=83 Len=1428 TSval=705930886 TSecr=2193418566 [TCP segment of a reassembled PDU]"
"57","0.726229","2620:0:861:ed1a::1","2600:8805:3803:6100:c100:e220:6ae:755","TCP","1514","443  >  55034 [ACK] Seq=49242 Ack=593 Win=83 Len=1428 TSval=705930886 TSecr=2193418566 [TCP segment of a reassembled PDU]"
"58","0.726229","2620:0:861:ed1a::1","2600:8805:3803:6100:c100:e220:6ae:755","TCP","1514","443  >  55034 [ACK] Seq=50670 Ack=593 Win=83 Len=1428 TSval=705930886 TSecr=2193418566 [TCP segment of a reassembled PDU]"
"59","0.726230","2620:0:861:ed1a::1","2600:8805:3803:6100:c100:e220:6ae:755","TCP","1514","443  >  55034 [ACK] Seq=52098 Ack=593 Win=83 Len=1428 TSval=705930886 TSecr=2193418566 [TCP segment of a reassembled PDU]"
"60","0.726231","2620:0:861:ed1a::1","2600:8805:3803:6100:c100:e220:6ae:755","TCP","1514","443  >  55034 [ACK] Seq=53526 Ack=593 Win=83 Len=1428 TSval=705930886 TSecr=2193418566 [TCP segment of a reassembled PDU]"
"61","0.726232","2620:0:861:ed1a::1","2600:8805:3803:6100:c100:e220:6ae:755","TCP","1514","443  >  55034 [ACK] Seq=54954 Ack=593 Win=83 Len=1428 TSval=705930886 TSecr=2193418566 [TCP segment of a reassembled PDU]"
"62","0.726268","2620:0:861:ed1a::1","2600:8805:3803:6100:c100:e220:6ae:755","TCP","1514","443  >  55034 [ACK] Seq=56382 Ack=593 Win=83 Len=1428 TSval=705930886 TSecr=2193418566 [TCP segment of a reassembled PDU]"
"63","0.726269","2620:0:861:ed1a::1","2600:8805:3803:6100:c100:e220:6ae:755","TLSv1.2","729","Application Data"
"64","0.726269","2620:0:861:ed1a::1","2600:8805:3803:6100:c100:e220:6ae:755","TCP","1514","443  >  55034 [ACK] Seq=58453 Ack=593 Win=83 Len=1428 TSval=705930886 TSecr=2193418566 [TCP segment of a reassembled PDU]"
"65","0.726269","2620:0:861:ed1a::1","2600:8805:3803:6100:c100:e220:6ae:755","TCP","1514","443  >  55034 [ACK] Seq=59881 Ack=593 Win=83 Len=1428 TSval=705930886 TSecr=2193418566 [TCP segment of a reassembled PDU]"
"66","0.726270","2620:0:861:ed1a::1","2600:8805:3803:6100:c100:e220:6ae:755","TCP","1514","443  >  55034 [ACK] Seq=61309 Ack=593 Win=83 Len=1428 TSval=705930886 TSecr=2193418566 [TCP segment of a reassembled PDU]"
"67","0.726271","2620:0:861:ed1a::1","2600:8805:3803:6100:c100:e220:6ae:755","TCP","1514","443  >  55034 [ACK] Seq=62737 Ack=593 Win=83 Len=1428 TSval=705930886 TSecr=2193418566 [TCP segment of a reassembled PDU]"
"68","0.726271","2620:0:861:ed1a::1","2600:8805:3803:6100:c100:e220:6ae:755","TCP","1514","443  >  55034 [ACK] Seq=64165 Ack=593 Win=83 Len=1428 TSval=705930886 TSecr=2193418566 [TCP segment of a reassembled PDU]"
"69","0.726272","2620:0:861:ed1a::1","2600:8805:3803:6100:c100:e220:6ae:755","TCP","1514","443  >  55034 [ACK] Seq=65593 Ack=593 Win=83 Len=1428 TSval=705930886 TSecr=2193418566 [TCP segment of a reassembled PDU]"
"70","0.726272","2620:0:861:ed1a::1","2600:8805:3803:6100:c100:e220:6ae:755","TCP","1514","443  >  55034 [ACK] Seq=67021 Ack=593 Win=83 Len=1428 TSval=705930886 TSecr=2193418566 [TCP segment of a reassembled PDU]"
"71","0.726273","2620:0:861:ed1a::1","2600:8805:3803:6100:c100:e220:6ae:755","TCP","1514","443  >  55034 [ACK] Seq=68449 Ack=593 Win=83 Len=1428 TSval=705930886 TSecr=2193418566 [TCP segment of a reassembled PDU]"
"72","0.726273","2620:0:861:ed1a::1","2600:8805:3803:6100:c100:e220:6ae:755","TCP","1514","443  >  55034 [ACK] Seq=69877 Ack=593 Win=83 Len=1428 TSval=705930886 TSecr=2193418566 [TCP segment of a reassembled PDU]"
"73","0.726274","2620:0:861:ed1a::1","2600:8805:3803:6100:c100:e220:6ae:755","TCP","1514","443  >  55034 [ACK] Seq=71305 Ack=593 Win=83 Len=1428 TSval=705930886 TSecr=2193418566 [TCP segment of a reassembled PDU]"
"74","0.726275","2620:0:861:ed1a::1","2600:8805:3803:6100:c100:e220:6ae:755","TCP","1514","443  >  55034 [ACK] Seq=72733 Ack=593 Win=83 Len=1428 TSval=705930886 TSecr=2193418566 [TCP segment of a reassembled PDU]"
"75","0.726275","2620:0:861:ed1a::1","2600:8805:3803:6100:c100:e220:6ae:755","TLSv1.2","1514","Application Data"
"76","0.726276","2620:0:861:ed1a::1","2600:8805:3803:6100:c100:e220:6ae:755","TCP","1514","443  >  55034 [ACK] Seq=75589 Ack=593 Win=83 Len=1428 TSval=705930886 TSecr=2193418566 [TCP segment of a reassembled PDU]"
"77","0.726277","2620:0:861:ed1a::1","2600:8805:3803:6100:c100:e220:6ae:755","TLSv1.2","1124","Application Data"
"78","0.726318","2600:8805:3803:6100:c100:e220:6ae:755","2620:0:861:ed1a::1","TCP","86","55034  >  443 [ACK] Seq=593 Ack=24676 Win=17795 Len=0 TSval=2193418589 TSecr=705930885"
"79","0.726346","2600:8805:3803:6100:c100:e220:6ae:755","2620:0:861:ed1a::1","TCP","86","55034  >  443 [ACK] Seq=593 Ack=40031 Win=17555 Len=0 TSval=2193418589 TSecr=705930885"
"80","0.726355","2600:8805:3803:6100:c100:e220:6ae:755","2620:0:861:ed1a::1","TCP","86","55034  >  443 [ACK] Seq=593 Ack=52098 Win=17366 Len=0 TSval=2193418589 TSecr=705930886"
"81","0.726364","2600:8805:3803:6100:c100:e220:6ae:755","2620:0:861:ed1a::1","TCP","86","55034  >  443 [ACK] Seq=593 Ack=56382 Win=17299 Len=0 TSval=2193418589 TSecr=705930886"
"82","0.726381","2600:8805:3803:6100:c100:e220:6ae:755","2620:0:861:ed1a::1","TCP","86","55034  >  443 [ACK] Seq=593 Ack=71305 Win=17066 Len=0 TSval=2193418589 TSecr=705930886"
"83","0.726390","2600:8805:3803:6100:c100:e220:6ae:755","2620:0:861:ed1a::1","TCP","86","55034  >  443 [ACK] Seq=593 Ack=78055 Win=16961 Len=0 TSval=2193418589 TSecr=705930886"
"84","0.728324","2600:8805:3803:6100:c100:e220:6ae:755","2620:0:861:ed1a::1","TCP","86","[TCP Window Update] 55034  >  443 [ACK] Seq=593 Ack=78055 Win=18046 Len=0 TSval=2193418591 TSecr=705930886"
"85","2.254451","2600:8805:3803:6100:c100:e220:6ae:755","2620:0:861:ed1a::1","TLSv1.2","202","Application Data"
"86","2.269645","2620:0:861:ed1a::1","2600:8805:3803:6100:c100:e220:6ae:755","TCP","1514","443  >  55034 [ACK] Seq=78055 Ack=709 Win=83 Len=1428 TSval=705932433 TSecr=2193420117 [TCP segment of a reassembled PDU]"
"87","2.269738","2600:8805:3803:6100:c100:e220:6ae:755","2620:0:861:ed1a::1","TCP","86","55034  >  443 [ACK] Seq=709 Ack=79483 Win=18023 Len=0 TSval=2193420132 TSecr=705932433"
"88","2.271198","2620:0:861:ed1a::1","2600:8805:3803:6100:c100:e220:6ae:755","TCP","1514","443  >  55034 [ACK] Seq=79483 Ack=709 Win=83 Len=1428 TSval=705932433 TSecr=2193420117 [TCP segment of a reassembled PDU]"
"89","2.271199","2620:0:861:ed1a::1","2600:8805:3803:6100:c100:e220:6ae:755","TCP","1514","443  >  55034 [ACK] Seq=80911 Ack=709 Win=83 Len=1428 TSval=705932433 TSecr=2193420117 [TCP segment of a reassembled PDU]"
"90","2.271199","2620:0:861:ed1a::1","2600:8805:3803:6100:c100:e220:6ae:755","TCP","1514","443  >  55034 [ACK] Seq=82339 Ack=709 Win=83 Len=1428 TSval=705932433 TSecr=2193420117 [TCP segment of a reassembled PDU]"
"91","2.271200","2620:0:861:ed1a::1","2600:8805:3803:6100:c100:e220:6ae:755","TCP","1514","443  >  55034 [ACK] Seq=83767 Ack=709 Win=83 Len=1428 TSval=705932433 TSecr=2193420117 [TCP segment of a reassembled PDU]"
"92","2.271200","2620:0:861:ed1a::1","2600:8805:3803:6100:c100:e220:6ae:755","TCP","1514","443  >  55034 [ACK] Seq=85195 Ack=709 Win=83 Len=1428 TSval=705932433 TSecr=2193420117 [TCP segment of a reassembled PDU]"
"93","2.271201","2620:0:861:ed1a::1","2600:8805:3803:6100:c100:e220:6ae:755","TCP","1514","443  >  55034 [ACK] Seq=86623 Ack=709 Win=83 Len=1428 TSval=705932433 TSecr=2193420117 [TCP segment of a reassembled PDU]"
"94","2.271201","2620:0:861:ed1a::1","2600:8805:3803:6100:c100:e220:6ae:755","TCP","1514","443  >  55034 [ACK] Seq=88051 Ack=709 Win=83 Len=1428 TSval=705932433 TSecr=2193420117 [TCP segment of a reassembled PDU]"
"95","2.271202","2620:0:861:ed1a::1","2600:8805:3803:6100:c100:e220:6ae:755","TCP","1514","443  >  55034 [ACK] Seq=89479 Ack=709 Win=83 Len=1428 TSval=705932433 TSecr=2193420117 [TCP segment of a reassembled PDU]"
"96","2.271202","2620:0:861:ed1a::1","2600:8805:3803:6100:c100:e220:6ae:755","TCP","1514","443  >  55034 [ACK] Seq=90907 Ack=709 Win=83 Len=1428 TSval=705932433 TSecr=2193420117 [TCP segment of a reassembled PDU]"
"97","2.271203","2620:0:861:ed1a::1","2600:8805:3803:6100:c100:e220:6ae:755","TLSv1.2","430","Application Data"
"98","2.271203","2620:0:861:ed1a::1","2600:8805:3803:6100:c100:e220:6ae:755","TCP","1514","443  >  55034 [ACK] Seq=92679 Ack=709 Win=83 Len=1428 TSval=705932433 TSecr=2193420117 [TCP segment of a reassembled PDU]"
"99","2.271203","2620:0:861:ed1a::1","2600:8805:3803:6100:c100:e220:6ae:755","TLSv1.2","501","Application Data"
"100","2.271274","2600:8805:3803:6100:c100:e220:6ae:755","2620:0:861:ed1a::1","TCP","86","55034  >  443 [ACK] Seq=709 Ack=94522 Win=17811 Len=0 TSval=2193420134 TSecr=705932433"
"101","2.271358","2600:8805:3803:6100:c100:e220:6ae:755","2620:0:861:ed1a::1","TCP","86","[TCP Window Update] 55034  >  443 [ACK] Seq=709 Ack=94522 Win=18046 Len=0 TSval=2193420134 TSecr=705932433"
"102","2.897838","2600:8805:3803:6100:c100:e220:6ae:755","2620:0:861:ed1a::1","TLSv1.2","404","Application Data"
"103","2.920192","2620:0:861:ed1a::1","2600:8805:3803:6100:c100:e220:6ae:755","TLSv1.2","934","Application Data"
"104","2.920273","2600:8805:3803:6100:c100:e220:6ae:755","2620:0:861:ed1a::1","TCP","86","55034  >  443 [ACK] Seq=1027 Ack=95370 Win=18032 Len=0 TSval=2193420783 TSecr=705933083"
"105","2.920727","2600:8805:3803:6100:c100:e220:6ae:755","2620:0:861:ed1a::1","TLSv1.2","121","Application Data"
"106","2.981549","2620:0:861:ed1a::1","2600:8805:3803:6100:c100:e220:6ae:755","TCP","86","443  >  55034 [ACK] Seq=95370 Ack=1062 Win=83 Len=0 TSval=705933145 TSecr=2193420783"
"107","3.642366","2600:8805:3803:6100:c100:e220:6ae:755","2620:0:861:ed1a::1","TLSv1.2","263","Application Data"
"108","3.657479","2620:0:861:ed1a::1","2600:8805:3803:6100:c100:e220:6ae:755","TCP","86","443  >  55034 [ACK] Seq=95370 Ack=1239 Win=83 Len=0 TSval=705933820 TSecr=2193421505"
"109","3.658797","2620:0:861:ed1a::1","2600:8805:3803:6100:c100:e220:6ae:755","TCP","1514","443  >  55034 [ACK] Seq=95370 Ack=1239 Win=83 Len=1428 TSval=705933821 TSecr=2193421505 [TCP segment of a reassembled PDU]"
"110","3.658797","2620:0:861:ed1a::1","2600:8805:3803:6100:c100:e220:6ae:755","TCP","1514","443  >  55034 [ACK] Seq=96798 Ack=1239 Win=83 Len=1428 TSval=705933821 TSecr=2193421505 [TCP segment of a reassembled PDU]"
"111","3.658798","2620:0:861:ed1a::1","2600:8805:3803:6100:c100:e220:6ae:755","TCP","1514","443  >  55034 [ACK] Seq=98226 Ack=1239 Win=83 Len=1428 TSval=705933821 TSecr=2193421505 [TCP segment of a reassembled PDU]"
"112","3.658798","2620:0:861:ed1a::1","2600:8805:3803:6100:c100:e220:6ae:755","TCP","1514","443  >  55034 [ACK] Seq=99654 Ack=1239 Win=83 Len=1428 TSval=705933821 TSecr=2193421505 [TCP segment of a reassembled PDU]"
"113","3.658799","2620:0:861:ed1a::1","2600:8805:3803:6100:c100:e220:6ae:755","TCP","1514","443  >  55034 [ACK] Seq=101082 Ack=1239 Win=83 Len=1428 TSval=705933821 TSecr=2193421505 [TCP segment of a reassembled PDU]"
"114","3.658799","2620:0:861:ed1a::1","2600:8805:3803:6100:c100:e220:6ae:755","TCP","1514","443  >  55034 [ACK] Seq=102510 Ack=1239 Win=83 Len=1428 TSval=705933821 TSecr=2193421505 [TCP segment of a reassembled PDU]"
"115","3.658810","2620:0:861:ed1a::1","2600:8805:3803:6100:c100:e220:6ae:755","TCP","1514","443  >  55034 [ACK] Seq=103938 Ack=1239 Win=83 Len=1428 TSval=705933821 TSecr=2193421505 [TCP segment of a reassembled PDU]"
"116","3.658811","2620:0:861:ed1a::1","2600:8805:3803:6100:c100:e220:6ae:755","TCP","1514","443  >  55034 [ACK] Seq=105366 Ack=1239 Win=83 Len=1428 TSval=705933821 TSecr=2193421505 [TCP segment of a reassembled PDU]"
"117","3.658812","2620:0:861:ed1a::1","2600:8805:3803:6100:c100:e220:6ae:755","TCP","1514","443  >  55034 [ACK] Seq=106794 Ack=1239 Win=83 Len=1428 TSval=705933821 TSecr=2193421505 [TCP segment of a reassembled PDU]"
"118","3.658812","2620:0:861:ed1a::1","2600:8805:3803:6100:c100:e220:6ae:755","TCP","1514","443  >  55034 [ACK] Seq=108222 Ack=1239 Win=83 Len=1428 TSval=705933821 TSecr=2193421505 [TCP segment of a reassembled PDU]"
"119","3.658812","2620:0:861:ed1a::1","2600:8805:3803:6100:c100:e220:6ae:755","TLSv1.2","430","Application Data"
"120","3.658813","2620:0:861:ed1a::1","2600:8805:3803:6100:c100:e220:6ae:755","TCP","1514","443  >  55034 [ACK] Seq=109994 Ack=1239 Win=83 Len=1428 TSval=705933821 TSecr=2193421505 [TCP segment of a reassembled PDU]"
"121","3.658813","2620:0:861:ed1a::1","2600:8805:3803:6100:c100:e220:6ae:755","TCP","1514","443  >  55034 [ACK] Seq=111422 Ack=1239 Win=83 Len=1428 TSval=705933821 TSecr=2193421505 [TCP segment of a reassembled PDU]"
"122","3.658814","2620:0:861:ed1a::1","2600:8805:3803:6100:c100:e220:6ae:755","TCP","1514","443  >  55034 [ACK] Seq=112850 Ack=1239 Win=83 Len=1428 TSval=705933821 TSecr=2193421505 [TCP segment of a reassembled PDU]"
"123","3.658814","2620:0:861:ed1a::1","2600:8805:3803:6100:c100:e220:6ae:755","TCP","1514","443  >  55034 [ACK] Seq=114278 Ack=1239 Win=83 Len=1428 TSval=705933821 TSecr=2193421505 [TCP segment of a reassembled PDU]"
"124","3.658815","2620:0:861:ed1a::1","2600:8805:3803:6100:c100:e220:6ae:755","TCP","1514","443  >  55034 [ACK] Seq=115706 Ack=1239 Win=83 Len=1428 TSval=705933821 TSecr=2193421505 [TCP segment of a reassembled PDU]"
"125","3.658815","2620:0:861:ed1a::1","2600:8805:3803:6100:c100:e220:6ae:755","TCP","1514","443  >  55034 [ACK] Seq=117134 Ack=1239 Win=83 Len=1428 TSval=705933821 TSecr=2193421505 [TCP segment of a reassembled PDU]"
"126","3.658816","2620:0:861:ed1a::1","2600:8805:3803:6100:c100:e220:6ae:755","TCP","1514","443  >  55034 [ACK] Seq=118562 Ack=1239 Win=83 Len=1428 TSval=705933821 TSecr=2193421505 [TCP segment of a reassembled PDU]"
"127","3.658816","2620:0:861:ed1a::1","2600:8805:3803:6100:c100:e220:6ae:755","TCP","1514","443  >  55034 [ACK] Seq=119990 Ack=1239 Win=83 Len=1428 TSval=705933821 TSecr=2193421505 [TCP segment of a reassembled PDU]"
"128","3.658816","2620:0:861:ed1a::1","2600:8805:3803:6100:c100:e220:6ae:755","TCP","1514","443  >  55034 [ACK] Seq=121418 Ack=1239 Win=83 Len=1428 TSval=705933821 TSecr=2193421505 [TCP segment of a reassembled PDU]"
"129","3.658817","2620:0:861:ed1a::1","2600:8805:3803:6100:c100:e220:6ae:755","TCP","1514","443  >  55034 [ACK] Seq=122846 Ack=1239 Win=83 Len=1428 TSval=705933821 TSecr=2193421505 [TCP segment of a reassembled PDU]"
"130","3.658817","2620:0:861:ed1a::1","2600:8805:3803:6100:c100:e220:6ae:755","TCP","1514","443  >  55034 [ACK] Seq=124274 Ack=1239 Win=83 Len=1428 TSval=705933821 TSecr=2193421505 [TCP segment of a reassembled PDU]"
"131","3.658818","2620:0:861:ed1a::1","2600:8805:3803:6100:c100:e220:6ae:755","TLSv1.2","729","Application Data"
"132","3.658894","2600:8805:3803:6100:c100:e220:6ae:755","2620:0:861:ed1a::1","TCP","86","55034  >  443 [ACK] Seq=1239 Ack=111422 Win=17795 Len=0 TSval=2193421522 TSecr=705933821"
"133","3.658931","2600:8805:3803:6100:c100:e220:6ae:755","2620:0:861:ed1a::1","TCP","86","55034  >  443 [ACK] Seq=1239 Ack=126345 Win=17562 Len=0 TSval=2193421522 TSecr=705933821"
"134","3.659404","2600:8805:3803:6100:c100:e220:6ae:755","2620:0:861:ed1a::1","TCP","86","[TCP Window Update] 55034  >  443 [ACK] Seq=1239 Ack=126345 Win=18046 Len=0 TSval=2193421522 TSecr=705933821"
"135","3.659758","2620:0:861:ed1a::1","2600:8805:3803:6100:c100:e220:6ae:755","TCP","1514","443  >  55034 [ACK] Seq=126345 Ack=1239 Win=83 Len=1428 TSval=705933821 TSecr=2193421505 [TCP segment of a reassembled PDU]"
"136","3.659759","2620:0:861:ed1a::1","2600:8805:3803:6100:c100:e220:6ae:755","TCP","1514","443  >  55034 [ACK] Seq=127773 Ack=1239 Win=83 Len=1428 TSval=705933821 TSecr=2193421505 [TCP segment of a reassembled PDU]"
"137","3.659759","2620:0:861:ed1a::1","2600:8805:3803:6100:c100:e220:6ae:755","TCP","1514","443  >  55034 [ACK] Seq=129201 Ack=1239 Win=83 Len=1428 TSval=705933821 TSecr=2193421505 [TCP segment of a reassembled PDU]"
"138","3.659760","2620:0:861:ed1a::1","2600:8805:3803:6100:c100:e220:6ae:755","TCP","1514","443  >  55034 [ACK] Seq=130629 Ack=1239 Win=83 Len=1428 TSval=705933821 TSecr=2193421505 [TCP segment of a reassembled PDU]"
"139","3.659760","2620:0:861:ed1a::1","2600:8805:3803:6100:c100:e220:6ae:755","TCP","1514","443  >  55034 [ACK] Seq=132057 Ack=1239 Win=83 Len=1428 TSval=705933821 TSecr=2193421505 [TCP segment of a reassembled PDU]"
"140","3.659760","2620:0:861:ed1a::1","2600:8805:3803:6100:c100:e220:6ae:755","TCP","1514","443  >  55034 [ACK] Seq=133485 Ack=1239 Win=83 Len=1428 TSval=705933821 TSecr=2193421505 [TCP segment of a reassembled PDU]"
"141","3.659761","2620:0:861:ed1a::1","2600:8805:3803:6100:c100:e220:6ae:755","TCP","1514","443  >  55034 [ACK] Seq=134913 Ack=1239 Win=83 Len=1428 TSval=705933821 TSecr=2193421505 [TCP segment of a reassembled PDU]"
"142","3.659761","2620:0:861:ed1a::1","2600:8805:3803:6100:c100:e220:6ae:755","TCP","1514","443  >  55034 [ACK] Seq=136341 Ack=1239 Win=83 Len=1428 TSval=705933821 TSecr=2193421505 [TCP segment of a reassembled PDU]"
"143","3.659762","2620:0:861:ed1a::1","2600:8805:3803:6100:c100:e220:6ae:755","TCP","1514","443  >  55034 [ACK] Seq=137769 Ack=1239 Win=83 Len=1428 TSval=705933821 TSecr=2193421505 [TCP segment of a reassembled PDU]"
"144","3.659762","2620:0:861:ed1a::1","2600:8805:3803:6100:c100:e220:6ae:755","TCP","1514","443  >  55034 [ACK] Seq=139197 Ack=1239 Win=83 Len=1428 TSval=705933821 TSecr=2193421505 [TCP segment of a reassembled PDU]"
"145","3.659762","2620:0:861:ed1a::1","2600:8805:3803:6100:c100:e220:6ae:755","TCP","1514","443  >  55034 [ACK] Seq=140625 Ack=1239 Win=83 Len=1428 TSval=705933821 TSecr=2193421505 [TCP segment of a reassembled PDU]"
"146","3.659763","2620:0:861:ed1a::1","2600:8805:3803:6100:c100:e220:6ae:755","TLSv1.2","729","Application Data"
"147","3.659763","2620:0:861:ed1a::1","2600:8805:3803:6100:c100:e220:6ae:755","TCP","1514","443  >  55034 [ACK] Seq=142696 Ack=1239 Win=83 Len=1428 TSval=705933822 TSecr=2193421505 [TCP segment of a reassembled PDU]"
"148","3.659819","2600:8805:3803:6100:c100:e220:6ae:755","2620:0:861:ed1a::1","TCP","86","55034  >  443 [ACK] Seq=1239 Ack=142053 Win=17800 Len=0 TSval=2193421522 TSecr=705933821"
"149","3.659853","2600:8805:3803:6100:c100:e220:6ae:755","2620:0:861:ed1a::1","TCP","86","55034  >  443 [ACK] Seq=1239 Ack=144124 Win=17768 Len=0 TSval=2193421522 TSecr=705933822"
"150","3.659915","2600:8805:3803:6100:c100:e220:6ae:755","2620:0:861:ed1a::1","TCP","86","[TCP Window Update] 55034  >  443 [ACK] Seq=1239 Ack=144124 Win=18046 Len=0 TSval=2193421523 TSecr=705933822"
"151","3.660811","2620:0:861:ed1a::1","2600:8805:3803:6100:c100:e220:6ae:755","TCP","1514","443  >  55034 [ACK] Seq=144124 Ack=1239 Win=83 Len=1428 TSval=705933822 TSecr=2193421505 [TCP segment of a reassembled PDU]"
"152","3.660812","2620:0:861:ed1a::1","2600:8805:3803:6100:c100:e220:6ae:755","TCP","1514","443  >  55034 [ACK] Seq=145552 Ack=1239 Win=83 Len=1428 TSval=705933822 TSecr=2193421505 [TCP segment of a reassembled PDU]"
"153","3.660812","2620:0:861:ed1a::1","2600:8805:3803:6100:c100:e220:6ae:755","TCP","1514","443  >  55034 [ACK] Seq=146980 Ack=1239 Win=83 Len=1428 TSval=705933822 TSecr=2193421505 [TCP segment of a reassembled PDU]"
"154","3.660813","2620:0:861:ed1a::1","2600:8805:3803:6100:c100:e220:6ae:755","TCP","1514","443  >  55034 [ACK] Seq=148408 Ack=1239 Win=83 Len=1428 TSval=705933822 TSecr=2193421505 [TCP segment of a reassembled PDU]"
"155","3.660814","2620:0:861:ed1a::1","2600:8805:3803:6100:c100:e220:6ae:755","TCP","1514","443  >  55034 [ACK] Seq=149836 Ack=1239 Win=83 Len=1428 TSval=705933822 TSecr=2193421505 [TCP segment of a reassembled PDU]"
"156","3.660814","2620:0:861:ed1a::1","2600:8805:3803:6100:c100:e220:6ae:755","TCP","1514","443  >  55034 [ACK] Seq=151264 Ack=1239 Win=83 Len=1428 TSval=705933822 TSecr=2193421505 [TCP segment of a reassembled PDU]"
"157","3.660815","2620:0:861:ed1a::1","2600:8805:3803:6100:c100:e220:6ae:755","TCP","1514","443  >  55034 [ACK] Seq=152692 Ack=1239 Win=83 Len=1428 TSval=705933822 TSecr=2193421505 [TCP segment of a reassembled PDU]"
"158","3.660815","2620:0:861:ed1a::1","2600:8805:3803:6100:c100:e220:6ae:755","TCP","1514","443  >  55034 [ACK] Seq=154120 Ack=1239 Win=83 Len=1428 TSval=705933822 TSecr=2193421505 [TCP segment of a reassembled PDU]"
"159","3.660815","2620:0:861:ed1a::1","2600:8805:3803:6100:c100:e220:6ae:755","TCP","1514","443  >  55034 [ACK] Seq=155548 Ack=1239 Win=83 Len=1428 TSval=705933822 TSecr=2193421505 [TCP segment of a reassembled PDU]"
"160","3.660816","2620:0:861:ed1a::1","2600:8805:3803:6100:c100:e220:6ae:755","TCP","1514","443  >  55034 [ACK] Seq=156976 Ack=1239 Win=83 Len=1428 TSval=705933822 TSecr=2193421505 [TCP segment of a reassembled PDU]"
"161","3.660817","2620:0:861:ed1a::1","2600:8805:3803:6100:c100:e220:6ae:755","TLSv1.2","1514","Application Data"
"162","3.660817","2620:0:861:ed1a::1","2600:8805:3803:6100:c100:e220:6ae:755","TCP","1514","443  >  55034 [ACK] Seq=159832 Ack=1239 Win=83 Len=1428 TSval=705933822 TSecr=2193421505 [TCP segment of a reassembled PDU]"
"163","3.660818","2620:0:861:ed1a::1","2600:8805:3803:6100:c100:e220:6ae:755","TCP","1514","443  >  55034 [ACK] Seq=161260 Ack=1239 Win=83 Len=1428 TSval=705933822 TSecr=2193421505 [TCP segment of a reassembled PDU]"
"164","3.660818","2620:0:861:ed1a::1","2600:8805:3803:6100:c100:e220:6ae:755","TCP","1514","443  >  55034 [ACK] Seq=162688 Ack=1239 Win=83 Len=1428 TSval=705933822 TSecr=2193421505 [TCP segment of a reassembled PDU]"
"165","3.660819","2620:0:861:ed1a::1","2600:8805:3803:6100:c100:e220:6ae:755","TCP","1514","443  >  55034 [ACK] Seq=164116 Ack=1239 Win=83 Len=1428 TSval=705933822 TSecr=2193421505 [TCP segment of a reassembled PDU]"
"166","3.660819","2620:0:861:ed1a::1","2600:8805:3803:6100:c100:e220:6ae:755","TCP","1514","443  >  55034 [ACK] Seq=165544 Ack=1239 Win=83 Len=1428 TSval=705933822 TSecr=2193421505 [TCP segment of a reassembled PDU]"
"167","3.660820","2620:0:861:ed1a::1","2600:8805:3803:6100:c100:e220:6ae:755","TCP","1514","443  >  55034 [ACK] Seq=166972 Ack=1239 Win=83 Len=1428 TSval=705933822 TSecr=2193421505 [TCP segment of a reassembled PDU]"
"168","3.660821","2620:0:861:ed1a::1","2600:8805:3803:6100:c100:e220:6ae:755","TCP","1514","443  >  55034 [PSH, ACK] Seq=168400 Ack=1239 Win=83 Len=1428 TSval=705933822 TSecr=2193421505 [TCP segment of a reassembled PDU]"
"169","3.660821","2620:0:861:ed1a::1","2600:8805:3803:6100:c100:e220:6ae:755","TCP","1514","443  >  55034 [ACK] Seq=169828 Ack=1239 Win=83 Len=1428 TSval=705933823 TSecr=2193421505 [TCP segment of a reassembled PDU]"
"170","3.660822","2620:0:861:ed1a::1","2600:8805:3803:6100:c100:e220:6ae:755","TCP","1514","443  >  55034 [ACK] Seq=171256 Ack=1239 Win=83 Len=1428 TSval=705933823 TSecr=2193421505 [TCP segment of a reassembled PDU]"
"171","3.660823","2620:0:861:ed1a::1","2600:8805:3803:6100:c100:e220:6ae:755","TCP","1514","443  >  55034 [ACK] Seq=172684 Ack=1239 Win=83 Len=1428 TSval=705933823 TSecr=2193421505 [TCP segment of a reassembled PDU]"
"172","3.660823","2620:0:861:ed1a::1","2600:8805:3803:6100:c100:e220:6ae:755","TLSv1.2","1514","Application Data"
"173","3.660824","2620:0:861:ed1a::1","2600:8805:3803:6100:c100:e220:6ae:755","TCP","1514","443  >  55034 [ACK] Seq=175540 Ack=1239 Win=83 Len=1428 TSval=705933823 TSecr=2193421505 [TCP segment of a reassembled PDU]"
"174","3.660824","2620:0:861:ed1a::1","2600:8805:3803:6100:c100:e220:6ae:755","TCP","1514","443  >  55034 [ACK] Seq=176968 Ack=1239 Win=83 Len=1428 TSval=705933823 TSecr=2193421505 [TCP segment of a reassembled PDU]"
"175","3.660825","2620:0:861:ed1a::1","2600:8805:3803:6100:c100:e220:6ae:755","TCP","1514","443  >  55034 [ACK] Seq=178396 Ack=1239 Win=83 Len=1428 TSval=705933823 TSecr=2193421505 [TCP segment of a reassembled PDU]"
"176","3.660826","2620:0:861:ed1a::1","2600:8805:3803:6100:c100:e220:6ae:755","TCP","1514","443  >  55034 [ACK] Seq=179824 Ack=1239 Win=83 Len=1428 TSval=705933823 TSecr=2193421505 [TCP segment of a reassembled PDU]"
"177","3.660826","2620:0:861:ed1a::1","2600:8805:3803:6100:c100:e220:6ae:755","TCP","1514","443  >  55034 [ACK] Seq=181252 Ack=1239 Win=83 Len=1428 TSval=705933823 TSecr=2193421505 [TCP segment of a reassembled PDU]"
"178","3.660827","2620:0:861:ed1a::1","2600:8805:3803:6100:c100:e220:6ae:755","TCP","1514","443  >  55034 [ACK] Seq=182680 Ack=1239 Win=83 Len=1428 TSval=705933823 TSecr=2193421505 [TCP segment of a reassembled PDU]"
"179","3.660950","2600:8805:3803:6100:c100:e220:6ae:755","2620:0:861:ed1a::1","TCP","86","55034  >  443 [ACK] Seq=1239 Ack=159832 Win=17800 Len=0 TSval=2193421523 TSecr=705933822"
"180","3.661019","2600:8805:3803:6100:c100:e220:6ae:755","2620:0:861:ed1a::1","TCP","86","55034  >  443 [ACK] Seq=1239 Ack=175540 Win=17555 Len=0 TSval=2193421524 TSecr=705933823"
"181","3.661043","2600:8805:3803:6100:c100:e220:6ae:755","2620:0:861:ed1a::1","TCP","86","55034  >  443 [ACK] Seq=1239 Ack=184108 Win=17421 Len=0 TSval=2193421524 TSecr=705933823"
"182","3.661133","2600:8805:3803:6100:c100:e220:6ae:755","2620:0:861:ed1a::1","TCP","86","[TCP Window Update] 55034  >  443 [ACK] Seq=1239 Ack=184108 Win=18046 Len=0 TSval=2193421524 TSecr=705933823"
"183","3.661951","2620:0:861:ed1a::1","2600:8805:3803:6100:c100:e220:6ae:755","TCP","1514","443  >  55034 [ACK] Seq=184108 Ack=1239 Win=83 Len=1428 TSval=705933823 TSecr=2193421505 [TCP segment of a reassembled PDU]"
"184","3.661952","2620:0:861:ed1a::1","2600:8805:3803:6100:c100:e220:6ae:755","TCP","1514","443  >  55034 [ACK] Seq=185536 Ack=1239 Win=83 Len=1428 TSval=705933823 TSecr=2193421505 [TCP segment of a reassembled PDU]"
"185","3.661953","2620:0:861:ed1a::1","2600:8805:3803:6100:c100:e220:6ae:755","TCP","1514","443  >  55034 [ACK] Seq=186964 Ack=1239 Win=83 Len=1428 TSval=705933823 TSecr=2193421505 [TCP segment of a reassembled PDU]"
"186","3.661953","2620:0:861:ed1a::1","2600:8805:3803:6100:c100:e220:6ae:755","TCP","1514","443  >  55034 [ACK] Seq=188392 Ack=1239 Win=83 Len=1428 TSval=705933823 TSecr=2193421505 [TCP segment of a reassembled PDU]"
"187","3.661954","2620:0:861:ed1a::1","2600:8805:3803:6100:c100:e220:6ae:755","TCP","1514","443  >  55034 [ACK] Seq=189820 Ack=1239 Win=83 Len=1428 TSval=705933823 TSecr=2193421505 [TCP segment of a reassembled PDU]"
"188","3.661954","2620:0:861:ed1a::1","2600:8805:3803:6100:c100:e220:6ae:755","TLSv1.2","1514","Application Data"
"189","3.661955","2620:0:861:ed1a::1","2600:8805:3803:6100:c100:e220:6ae:755","TCP","1514","443  >  55034 [ACK] Seq=192676 Ack=1239 Win=83 Len=1428 TSval=705933823 TSecr=2193421505 [TCP segment of a reassembled PDU]"
"190","3.661955","2620:0:861:ed1a::1","2600:8805:3803:6100:c100:e220:6ae:755","TCP","1514","443  >  55034 [ACK] Seq=194104 Ack=1239 Win=83 Len=1428 TSval=705933823 TSecr=2193421505 [TCP segment of a reassembled PDU]"
"191","3.661956","2620:0:861:ed1a::1","2600:8805:3803:6100:c100:e220:6ae:755","TCP","1514","443  >  55034 [PSH, ACK] Seq=195532 Ack=1239 Win=83 Len=1428 TSval=705933823 TSecr=2193421505 [TCP segment of a reassembled PDU]"
"192","3.662013","2600:8805:3803:6100:c100:e220:6ae:755","2620:0:861:ed1a::1","TCP","86","55034  >  443 [ACK] Seq=1239 Ack=196960 Win=17845 Len=0 TSval=2193421524 TSecr=705933823"
"193","3.662082","2600:8805:3803:6100:c100:e220:6ae:755","2620:0:861:ed1a::1","TCP","86","[TCP Window Update] 55034  >  443 [ACK] Seq=1239 Ack=196960 Win=18046 Len=0 TSval=2193421525 TSecr=705933823"
"194","3.662805","2620:0:861:ed1a::1","2600:8805:3803:6100:c100:e220:6ae:755","TCP","1514","443  >  55034 [ACK] Seq=196960 Ack=1239 Win=83 Len=1428 TSval=705933824 TSecr=2193421505 [TCP segment of a reassembled PDU]"
"195","3.662807","2620:0:861:ed1a::1","2600:8805:3803:6100:c100:e220:6ae:755","TCP","1514","443  >  55034 [ACK] Seq=198388 Ack=1239 Win=83 Len=1428 TSval=705933824 TSecr=2193421505 [TCP segment of a reassembled PDU]"
"196","3.662808","2620:0:861:ed1a::1","2600:8805:3803:6100:c100:e220:6ae:755","TCP","1514","443  >  55034 [ACK] Seq=199816 Ack=1239 Win=83 Len=1428 TSval=705933824 TSecr=2193421505 [TCP segment of a reassembled PDU]"
"197","3.662809","2620:0:861:ed1a::1","2600:8805:3803:6100:c100:e220:6ae:755","TCP","1514","443  >  55034 [ACK] Seq=201244 Ack=1239 Win=83 Len=1428 TSval=705933824 TSecr=2193421505 [TCP segment of a reassembled PDU]"
"198","3.662810","2620:0:861:ed1a::1","2600:8805:3803:6100:c100:e220:6ae:755","TCP","1514","443  >  55034 [ACK] Seq=202672 Ack=1239 Win=83 Len=1428 TSval=705933824 TSecr=2193421505 [TCP segment of a reassembled PDU]"
"199","3.662811","2620:0:861:ed1a::1","2600:8805:3803:6100:c100:e220:6ae:755","TCP","1514","443  >  55034 [ACK] Seq=204100 Ack=1239 Win=83 Len=1428 TSval=705933824 TSecr=2193421505 [TCP segment of a reassembled PDU]"
"200","3.662812","2620:0:861:ed1a::1","2600:8805:3803:6100:c100:e220:6ae:755","TCP","1514","443  >  55034 [ACK] Seq=205528 Ack=1239 Win=83 Len=1428 TSval=705933824 TSecr=2193421505 [TCP segment of a reassembled PDU]"
"201","3.662813","2620:0:861:ed1a::1","2600:8805:3803:6100:c100:e220:6ae:755","TLSv1.2","1514","Application Data"
"202","3.662814","2620:0:861:ed1a::1","2600:8805:3803:6100:c100:e220:6ae:755","TCP","1514","443  >  55034 [ACK] Seq=208384 Ack=1239 Win=83 Len=1428 TSval=705933824 TSecr=2193421505 [TCP segment of a reassembled PDU]"
"203","3.662815","2620:0:861:ed1a::1","2600:8805:3803:6100:c100:e220:6ae:755","TCP","1514","443  >  55034 [ACK] Seq=209812 Ack=1239 Win=83 Len=1428 TSval=705933824 TSecr=2193421505 [TCP segment of a reassembled PDU]"
"204","3.662817","2620:0:861:ed1a::1","2600:8805:3803:6100:c100:e220:6ae:755","TCP","1514","443  >  55034 [ACK] Seq=211240 Ack=1239 Win=83 Len=1428 TSval=705933824 TSecr=2193421505 [TCP segment of a reassembled PDU]"
"205","3.662819","2620:0:861:ed1a::1","2600:8805:3803:6100:c100:e220:6ae:755","TCP","1514","443  >  55034 [ACK] Seq=212668 Ack=1239 Win=83 Len=1428 TSval=705933824 TSecr=2193421505 [TCP segment of a reassembled PDU]"
"206","3.662820","2620:0:861:ed1a::1","2600:8805:3803:6100:c100:e220:6ae:755","TCP","1514","443  >  55034 [ACK] Seq=214096 Ack=1239 Win=83 Len=1428 TSval=705933824 TSecr=2193421505 [TCP segment of a reassembled PDU]"
